date,username,to,replies,retweets,favorites,text,geo,mentions,hashtags,id,permalink
2020-03-04 18:48:44,3ammoonlight_,,7,5,73,"ethnicity: filipino race: asian proud to be: 5sos fan <3 #pocsospic.twitter.com/WME9Hj0MML",,,#pocsospic,1235276004534497280,https://twitter.com/3ammoonlight_/status/1235276004534497280
2020-03-04 18:45:10,shafmusic98,,11,4,77,"lil brown boi from a little island in Malaysia. always proud to be Asian. #POCSOSpic.twitter.com/QC5b6ale1I",,,#POCSOSpic,1235275106701774852,https://twitter.com/shafmusic98/status/1235275106701774852
2020-03-04 18:40:23,AGWilliamTong,,8,13,48,"Tong Tasting #36: Stopped by Shu Restaurant in West Hartford yesterday to encourage residents to support local Asian-American businesses, which have seen a decrease in activity due to unfair and irrational concerns over the coronavirus. Great meeting topped off with great food. pic.twitter.com/HxTh0zn012",,,#36,1235273905234796544,https://twitter.com/AGWilliamTong/status/1235273905234796544
2020-03-04 18:39:06,j4kstarr,,7,6,98,"Two Asian girls just got on the train and some small minded man covered his mouth and nose with his scarf and is giving them dagger eyes. Mate, you could already have the virus from your white work colleague and do not even know it yet. Don’t associate the virus with ethnicity",,,,1235273580398735361,https://twitter.com/j4kstarr/status/1235273580398735361
2020-03-04 18:19:27,m3gin0,,3,21,139,"So far, the district with the highest % of vote for Andrew Yang in CA is Dist 17 in the Bay Area at 2.7%. It is the only majority-Asian American district in the United States outside of Hawaii.",,,,1235268636375273472,https://twitter.com/m3gin0/status/1235268636375273472
2020-03-04 18:18:51,ChurchGirlLin,,8,68,144,"New to nsfw twitter! My Name is Lin and I’m very sweet • 20, in college • Asian • Bi • Sub & Dom • Kinky • Gamer • Always horny Like and RT to be mutuals. I’m very friendly pic.twitter.com/VxhNsng1EZ",,,,1235268486126919680,https://twitter.com/ChurchGirlLin/status/1235268486126919680
2020-03-04 18:10:46,scobesx,,25,55,668,"asian girls be fine as hell then BOOM they take off their fake lashes",,,,1235266448605487107,https://twitter.com/scobesx/status/1235266448605487107
2020-03-04 18:09:26,AkiCarlito,,29,19,224,"I am an a 5 ft 4 asian artist. Please send help. I get cold hands easily when i draw therefore I need a hot guy to warm my hands asap. I can draw tiddies as compensation. Thank you",,,,1235266113266569216,https://twitter.com/AkiCarlito/status/1235266113266569216
2020-03-04 18:05:21,calumglass,,46,38,398,"here’s your asian latina calum stan #pocsospic.twitter.com/vYICzfcQa0",,,#pocsospic,1235265088493441025,https://twitter.com/calumglass/status/1235265088493441025
2020-03-04 18:05:05,alanyang,,29,123,942,"I’m Asian-American. I’ve spent most of my life trying to be as American as possible. But I ended up making a very Asian film. And I felt more whole than I ever have in my life. I hope the film brings you as much meaning and fulfillment as it has for me. (7/7) pic.twitter.com/K8ac2SXPco",,,,1235265019652255751,https://twitter.com/alanyang/status/1235265019652255751
2020-03-04 18:05:04,alanyang,,2,12,144,"In the meantime, I denied my Asian identity, pretended my heritage didn’t exist, and did everything I could to fit into a world mostly populated by people who didn’t look like me. (4/7)",,,,1235265016212918288,https://twitter.com/alanyang/status/1235265016212918288
2020-03-04 18:04:31,fredvanlente,,3,23,38,"It's 1p on the East Coast, so let's continue our look at some of the women & POC we'll be profiling in Comic Book History of Animation with IWAO TAKAMOTO, the greatest Asian-American animator of his generation & the hidden hand behind many of your personal toon faves 1/ pic.twitter.com/AQXc5HNghB",,,,1235264876655890432,https://twitter.com/fredvanlente/status/1235264876655890432
2020-03-04 18:02:35,prfctlrh,,14,25,243,"3/4 chinese, 1/4 indian, proud asian and stan #POCSOS keep streaming old me and no shame xpic.twitter.com/mdMK1xr1y8",,,#POCSOS,1235264391513161728,https://twitter.com/prfctlrh/status/1235264391513161728
2020-03-04 17:58:02,Complex,,35,41,334,"Asian student victim of racist attack in London: ""I don't want your Coronavirus in my country."" http://cmplx.co/yIrMT9y pic.twitter.com/edUoF1tfm5",,,,1235263244589248519,https://twitter.com/Complex/status/1235263244589248519
2020-03-04 17:56:00,Allison2Abner,BernieSanders,1,13,111,"‘Working class’ people ARE in the movement. They are Black and Latinx and Muslim and Asian and Women and middle aged. They have been sacrificing their time and resources to stave off Trump. Why not acknowledge their contribution as a VITAL and FOUNDATIONAL?",,,,1235262732867256320,https://twitter.com/Allison2Abner/status/1235262732867256320
2020-03-04 17:48:15,_EricHu,,7,19,454,"I think a lot of discussions surrounding the ""de-sexualization"" of the Asian male rub me the wrong way because masculinity is such a boring thing to desire and also you either find me attractive or you don't and I don't really need to beg and I'm just over it?",,,,1235260782406971392,https://twitter.com/_EricHu/status/1235260782406971392
2020-03-04 17:43:37,niqueswrld,,2,30,108,"I’m gonna 𝘬𝘪𝘭𝘭 you guys I sWEAR // im in target & I notice this asian woman standing a 𝘤𝘰𝘯𝘴𝘪𝘥𝘦𝘳𝘢𝘣𝘭𝘦 distance away from me in the checkout line so I assumed it was just your stndrd racism so I turned & smiled at her & ...",,,,1235259616625336320,https://twitter.com/niqueswrld/status/1235259616625336320
2020-03-04 17:37:04,PaulBrandITV,,20,34,72,"Kane Blackwell worked for Priti Patel for a year and says in that time he never witnessed any bullying behaviour. He claims some in the establishment are out to get the Home Secretary because she's an asian woman with a right-wing agenda on law and order.",,,,1235257970105225217,https://twitter.com/PaulBrandITV/status/1235257970105225217
2020-03-04 17:36:28,KaiAaron_,StoneyThaGreat,2,11,23,"Is it impossible to understand multiple concepts at once? Anti Blackness is wrong. Anti Asian sentiments are also wrong. Nobody is comparing the two. They’re both wrong and are fueling white supremacy. Y’all have to expand your world views https://twitter.com/StoneyThaGreat/status/1234910777045377025 …",,,,1235257818954989568,https://twitter.com/KaiAaron_/status/1235257818954989568
2020-03-04 17:31:27,angry_asian_mom,Telegraph,10,18,551,"It would be helpful if you would remove the paywall on these articles so people can actually read them",,,,1235256554732924928,https://twitter.com/angry_asian_mom/status/1235256554732924928
2020-03-04 17:25:19,psychdr100,,5,23,33,"Trump silent as coronavirus inspires wave of anti-Asian racism https://americanindependent.com/coronavirus-racism-donald-trump-violence-asian-americans-judy-chu-covid-19/ …",,,,1235255012713844736,https://twitter.com/psychdr100/status/1235255012713844736
2020-03-04 17:16:47,Doaud_,,12,682,3399,"Me walking into the library and seeing all the asian couples there pic.twitter.com/ZeIszfwmm6",,,,1235252864869715969,https://twitter.com/Doaud_/status/1235252864869715969
2020-03-04 17:04:15,starmometer,,7,338,249,"100 Asian Heartthrobs 2020 Battle Round – Ten vs Wen Junhui http://www.starmometer.com/2020/03/04/100-asian-heartthrobs-2020-battle-round-ten-vs-wen-junhui/ …",,,,1235249712652902400,https://twitter.com/starmometer/status/1235249712652902400
2020-03-04 16:59:12,darksecretplace,,9,15,92,"The fact the Dr Ferrer didn't get to the mic until two elected officials denounced decreased traffic at LA's Asian restaurants, tells you everything about LA politics. They did that, now they're haranguing us into trusting them. @KFIAM640",,@KFIAM640,,1235248438507274240,https://twitter.com/darksecretplace/status/1235248438507274240
2020-03-04 16:52:22,chongmandan,,4,44,328,"name one cali asian dude that dont look like this pic.twitter.com/RDeZbFKi9i",,,,1235246720465821696,https://twitter.com/chongmandan/status/1235246720465821696
2020-03-04 16:47:03,babenohaze,damienxpat,8,7,888,"Being an Asian American fan of hers just makes it hurt more :(",,,,1235245383623880704,https://twitter.com/babenohaze/status/1235245383623880704
2020-03-04 16:45:32,sunny_hundal,,65,84,1225,"Tip for white people: If you want to stockpile dry food, head to a ""cash and carry"" in an Asian dominated area. You could buy a year's supply and still not dent their stock",,,,1235244998339293190,https://twitter.com/sunny_hundal/status/1235244998339293190
2020-03-04 16:42:20,RhodesMahogany,,6,12,45,"If Biden really wants to rebuild the Obama coalition, he must get to work on his outreach to Hispanic, Asian, Native, and younger voters. He also needs to choose a VP, that will attract the youth, and a racial coalitions of voters. And someone needs to write his speeches now.",,,,1235244195742396420,https://twitter.com/RhodesMahogany/status/1235244195742396420
2020-03-04 16:30:11,sciam,,0,14,42,"Artificial roosting sites are much-needed resting spots for the tens of thousands of migratory shorebirds that traverse the East Asian-Australasian Flyway. http://ow.ly/NDoI50yCIf6",,,,1235241137104879617,https://twitter.com/sciam/status/1235241137104879617
2020-03-04 16:27:52,Sturgeons_Law,wastefellows,15,19,127,"For all my S. Asian followers, both homeland & diaspora, I have joined India's finest podcast to discuss the history, misconceptions, & gospel of LEMURIA. Where is Lemuria? Can whites be Lemurian? Which Indian reply guys are Lemurian & which aren't? All the answers are here. https://twitter.com/wastefellows/status/1234052144627453952 …",,,,1235240555015294976,https://twitter.com/Sturgeons_Law/status/1235240555015294976
2020-03-04 16:27:10,a_centrism,MikePsJuice,11,6,85,"Allow me the pleasure of presenting my first LOL tweet: LOL. It's not that whites aren't being discriminated against in admission to selective colleges -- they clearly are -- but the amount of it at the most prestigious schools is less than that experienced by Asian-Americans. https://twitter.com/MikePsJuice/status/1235047600979492865 …",,,,1235240376627232768,https://twitter.com/a_centrism/status/1235240376627232768
2020-03-04 16:21:18,KoofiDonJon,,1,19,60,"Just gonna put this warning out there for Ole Miss. If I see ya being racist to an Asian bc of this virus, then I’m boxing. Hope your hands ready.",,,,1235238899951296513,https://twitter.com/KoofiDonJon/status/1235238899951296513
2020-03-04 16:20:29,ShahidForChange,BrandonHarami,4,74,553,"Just sharing some credit where due for last night’s spectacular win for #NotMeUs here in California! Asian-American women are holding it down on the Sanders campaign across the state. We’re grateful both for their dedication and their leadership. https://twitter.com/BrandonHarami/status/1235059135881695232 …",,,#NotMeUs,1235238698373042176,https://twitter.com/ShahidForChange/status/1235238698373042176
2020-03-04 16:20:29,ejacqui,,2,18,14,"“the harassment has been intense for Asian Americans across the country—regardless of ethnicity, location or age.” https://www.npr.org/2020/03/02/811363404/when-xenophobia-spreads-like-a-virus …",,,,1235238696472977410,https://twitter.com/ejacqui/status/1235238696472977410
2020-03-04 16:16:55,sesmith,,0,40,157,"Unless the Asian person in your header photo for your article about COVID-19 is a physician, policy expert, or elected official featured in the article, pick a different picture my dudes.",,,,1235237797671260160,https://twitter.com/sesmith/status/1235237797671260160
2020-03-04 16:15:43,Eternalsnews,,0,18,76,"We have the first gay superhero, the first south Asian superhero, the first deaf superhero, the first Korean superhero, all in this mainstream Hollywood film - Kumail Nanjiani",,,,1235237498781143041,https://twitter.com/Eternalsnews/status/1235237498781143041
2020-03-04 16:15:30,RealNatalieRowe,,6,12,49,"And if YOU @BorisJohnson thinks that surrounding yourself with Asian Ministers to do you Thug Work, works in order to look LESS Racist, it will never work with me, or the rest of the more intelligent folks. #Patel clearly loves being your lackey.",,@BorisJohnson,#Patel,1235237441126223873,https://twitter.com/RealNatalieRowe/status/1235237441126223873
2020-03-04 16:14:59,graceachen,,1,11,47,"when do we get to stop explaining this? when will As/Am political history/context become taken-for-granted; when will we be able to assume readers know it, so “another [Asian] American [researcher] won’t have to write that history?” (Maxine Hong Kingston)? (2/4) pic.twitter.com/QSDGhE1CS2",,,,1235237310683373568,https://twitter.com/graceachen/status/1235237310683373568
2020-03-04 16:14:55,ithayla,,7,107,242,"5 Asian-Themed Board Games made by Asian people that I think you will love: A Thread pic.twitter.com/OPYaSzshDc",,,,1235237296535826432,https://twitter.com/ithayla/status/1235237296535826432
2020-03-04 16:14:26,graceachen,,1,12,37,"reviewing a paper on asian/americans in STEM. as with any paper i’ve ever read on asian/americans, the lit review explains the MMM, the forever foreigner stereotype, the heterogeneity among those identified as asian/american… on the one hand, yes. important context. OTOH, (1/4)",,,,1235237174230110211,https://twitter.com/graceachen/status/1235237174230110211
2020-03-04 16:11:36,urwaifuneptune,,38,41,586,"Two days ago I woke up to a racist comment from someone assuming I have coronavirus because I’m Asian. Today I woke up to someone throwing a tantrum because I do not make the kind of explicit content they want. Please be kind and respectful to content creators/sex workers.",,,,1235236458752905217,https://twitter.com/urwaifuneptune/status/1235236458752905217
2020-03-04 15:51:55,augurmag,,2,19,36,"Voices we would love to hear more from include: Latinx, Black, South Asian, South East Asian, Middle Eastern, and their diasporas. Also, Indigenous and especially 2S creators. We would also love to see more voices at the intersection of BIPOC and disability and transness.",,,,1235231506055999488,https://twitter.com/augurmag/status/1235231506055999488
2020-03-04 15:45:59,azeen,,3,63,88,"After men yelling ""Chinese"" tried to punch Jiye Seong-Yu off her bike, she started a Google survey for East Asian people in Europe who experienced racist attacks they believe were linked to the coronavirus outbreak. She received more than 100 responses: https://www.buzzfeednews.com/article/meghara/coronavirus-racism-europe-covid-19 …",,,,1235230014620274689,https://twitter.com/azeen/status/1235230014620274689
2020-03-04 15:45:30,shadow_twts,,1,272,244,"Austrian Albums #1 MOTS: 7 (debut) Austrian Singles #23 ON Feat. Sia (debut) MOTS: 7 is the first Asian Album to get #1 in Austria! #VoteBTS #KCA @BTS_twt",,@BTS_twt,#1 #23 #1 #VoteBTS #KCA,1235229892561817600,https://twitter.com/shadow_twts/status/1235229892561817600
2020-03-04 15:44:25,amandadonnell14,,5,102,91,"House Of Commons Live Reporting That Coronavirus Originated Form South Asian Butcheries So Why Havent We Banned Halal Slaughter ? Ban Halal Now pic.twitter.com/ZUUI9TFw2P",,,,1235229619248336896,https://twitter.com/amandadonnell14/status/1235229619248336896
2020-03-04 15:42:34,AniMiaOfficial,princessmin_c,15,9,144,"Sorry, but if I happen to exist in public and someone gives me the stink eye because I'm Asian and they think I might have coronavirus because they are racist, I'm gonna have a coughing fit in their direction. I will chase down racists while coughing. https://twitter.com/princessmin_c/status/1234574194928705539 …",,,,1235229155869982720,https://twitter.com/AniMiaOfficial/status/1235229155869982720
2020-03-04 15:39:25,charts_k,,21,1426,2256,"Map of the Soul: 7 has debuted at #1 in Austria! This is @BTS_twt's FIRST ever #1 album in Austria, and also first ever for an Asian act. Map of the Soul: 7 has now charted #1 in 18 countries! pic.twitter.com/MAszrljY6k",,@BTS_twt,#1 #1 #1,1235228362051903489,https://twitter.com/charts_k/status/1235228362051903489
2020-03-04 15:33:19,splendidvorra,,2,45,159,"Hello Asian Interview (9) Staff: Bright, you tweeted that ‘You will take it seriously.’ for the third episode. What does it mean? Bright: I’m gonna flirt with him. #2getherTheSeries #winmetawin #bbrightvc #brightwin #ไบร์ทวิน #คั่นกูpic.twitter.com/Nfm1DqIMeC",,,#2getherTheSeries #winmetawin #bbrightvc #brightwin #ไบร #ค,1235226827355852801,https://twitter.com/splendidvorra/status/1235226827355852801
2020-03-04 15:33:10,taegurl_,,1,25,132,"When Asian's ARMY will go to bed No one : Literally no one : Bighit : pic.twitter.com/vACwLIYa48",,,,1235226789590585344,https://twitter.com/taegurl_/status/1235226789590585344
2020-03-04 15:30:14,Aryl_Ether,clineamb,2,14,29,"Instead of promoting my own work, I'm going to promote the jam I'm hosting with @BabblegumSam & @TheDovetailor. #AsianMartialArtsJam is for Asian analogue game creators making games relating to Asian Martial Arts. It's running from March through to April. https://itch.io/jam/asian-martial-arts-by-asian-creators-game-jam …",,@BabblegumSam @TheDovetailor,#AsianMartialArtsJam,1235226052177408000,https://twitter.com/Aryl_Ether/status/1235226052177408000
2020-03-04 15:29:55,davechensky,,3,46,104,"Anti-Asian racism because of Coronavirus is real and many of us are experiencing it all around the country. This breaks my heart. https://www.npr.org/2020/03/02/811363404/when-xenophobia-spreads-like-a-virus …",,,,1235225972720324609,https://twitter.com/davechensky/status/1235225972720324609
2020-03-04 15:19:44,curlychoppa,,5,57,205,"Racism against Asian people gets so overlooked. Some of y’all straight up be saying “Ching Chong nail lady corona virus ” and then follow up with “I was just being silly!!” No love you were being racist.",,,,1235223410189504512,https://twitter.com/curlychoppa/status/1235223410189504512
2020-03-04 15:16:41,yuhline,,25,154,250,"Anti-Asian violence is breaking out everywhere...media has a responsibility to stop the xenophobia and racism they are perpetuating and we need to speak up too. Every one of us. Or more people will get hurt or worse....please... https://nextshark.com/asians-allegedly-attacked-by-mob-on-philadelphia-subway-in-disturbing-video/ …",,,,1235222640891228162,https://twitter.com/yuhline/status/1235222640891228162
2020-03-04 15:14:42,Vijay_Ramjattan,,3,15,39,"This controversy highlights how raciolinguistic ideologies can be used as a marketing tool that upholds such things as the white male gaze and the sexual availability of Asian women. #raciolxhttps://www.vice.com/en_in/article/5dmkwq/singapore-language-tutorial-centre-racist-ad-chinese-accent …",,,#raciolxhttps,1235222142536626191,https://twitter.com/Vijay_Ramjattan/status/1235222142536626191
2020-03-04 15:12:47,ScissorhandsOKC,,8,8,169,"If you’re Asian, Black, White, Latino, Native or whatever I wish you good health & wealth. I love good ppl & have surrounded myself with them",,,,1235221658945892352,https://twitter.com/ScissorhandsOKC/status/1235221658945892352
2020-03-04 15:11:39,swrongwitme,,7,5,407,"it actually makes me so mad when ppl r rude to my friends and i if we cough in public just bc we’re asian. u do Not have to go up to us and say “u better cover ur damn mouth” and then stare at us maliciously jesus christ",,,,1235221375553544193,https://twitter.com/swrongwitme/status/1235221375553544193
2020-03-04 15:08:05,atlasobscura,,0,11,28,"The cuisine showcased at Cafe At-Your-Mother-in-Law in Brooklyn, New York, combines the kick of Korean cuisine with the heartiness of Uzbek and Central Asian fare. https://trib.al/zFfuqUE",,,,1235220476814864384,https://twitter.com/atlasobscura/status/1235220476814864384
2020-03-04 15:06:58,essenviews,,3,25,18,"Trump silent as coronavirus triggers wave of anti-Asian racism: In LA, man verbally harassed a Thai American woman, saying how ""every disease has ever came from China,"" and claiming falsely, ""Everything comes from China because they're fucking disgusting."" https://americanindependent.com/coronavirus-racism-donald-trump-violence-asian-americans-judy-chu-covid-19/ …",,,,1235220195750187009,https://twitter.com/essenviews/status/1235220195750187009
2020-03-04 15:01:33,sunflwrwiegner,,0,10,45,"it’s 2020 and people are still calling calum white or asian ,,,,, he’s made it clear what he is and he’s proud. y’all need to get some serious help pls.",,,,1235218830286360576,https://twitter.com/sunflwrwiegner/status/1235218830286360576
2020-03-04 14:59:55,MichelinGuideUK,,2,3,67,"A British classic given an Asian spin – sausage roll with duck and plum sauce @EdinburghNotopic.twitter.com/l9A0F3b0F5",,@EdinburghNotopic,,1235218422180589569,https://twitter.com/MichelinGuideUK/status/1235218422180589569
2020-03-04 14:53:31,mattyglesias,,42,105,773,"It seems like several Asian countries have implemented effective internal controls to drastically slow the spread of infection but we’re maybe gonna start testing people soon?",,,,1235216812528279552,https://twitter.com/mattyglesias/status/1235216812528279552
2020-03-04 14:52:23,dumplingmei,,3,15,72,"this corona virus panic is fueled by racism & hysteria not evidence or genuine concern. NOTHING justifies being rude to me because I’m asian. AGAIN good morning, stop harassing me pLEASE",,,,1235216523490451456,https://twitter.com/dumplingmei/status/1235216523490451456
2020-03-04 14:48:17,BrandonStraka,,103,596,1640,"Dear Democrats, we all look to you for our cues on wokeness. So- help us understand. In your presidential race, the black people were eliminated first. Then the Asian people. Then the gay. Then the women. And in the end, it comes down to 2 rich, old, straight white men. pic.twitter.com/3ked1VWlkr",,,,1235215493746896903,https://twitter.com/BrandonStraka/status/1235215493746896903
2020-03-04 14:38:58,cestlavie9090,,1,80,144,"""As I was a minority, @BTS_twt phenomenon is thrilling. Asian grp that doesn't speak perfect English dominating the mainstream music outside Asia. Artists expressed their own way how impactful msgs of BTS."" Kang Yi Yun #BestFanArmy #BTSARMY #iHeartAwardspic.twitter.com/GqYmrctt2e",,@BTS_twt,#BestFanArmy #BTSARMY #iHeartAwardspic,1235213146824093699,https://twitter.com/cestlavie9090/status/1235213146824093699
2020-03-04 14:33:30,_NatalieEscobar,,12,508,784,"Asian & Asian American listeners told us that they've been experiencing xenophobic harassment everywhere, regardless of their age, ethnicity or location. It's been happening on public transit, the street & in schools—and bystanders have been slow to help. https://www.npr.org/2020/03/02/811363404/when-xenophobia-spreads-like-a-virus …",,,,1235211772245798913,https://twitter.com/_NatalieEscobar/status/1235211772245798913
2020-03-04 14:28:30,jamie2181,,21,5,81,"Unpopular opinion but I don't think its racist for people to be cautious around coughing Asian people. I think most people are cautious around anyone coughing today, so not sure all these videos of people covering their faces when a sick Asian is present is really a ""gotcha""",,,,1235210515649089536,https://twitter.com/jamie2181/status/1235210515649089536
2020-03-04 14:28:06,RekomenByAsrul,,1,62,153,"FIRST LOVE (Japan). A boy and girl fall in love in this romantic movie. Fuck, I lied. This is Takashi Miike’s film where blood and gore are norms + beheadings are like side dishes at McDonald’s. Nominated for Best Asian Film at Neuchâtel. Not for everyone #RekomenFilem pic.twitter.com/WfDaXtxsSM",,,#RekomenFilem,1235210413081595904,https://twitter.com/RekomenByAsrul/status/1235210413081595904
2020-03-04 14:26:24,BuzzFeedNews,,6,20,30,"People of East Asian descent in Europe and the United States have reported racist attacks linked to coronavirus fears https://www.buzzfeednews.com/article/meghara/coronavirus-racism-europe-covid-19?bftwnews&utm_term=4ldqpgc#4ldqpgc …",,,#4ldqpgc,1235209985782579200,https://twitter.com/BuzzFeedNews/status/1235209985782579200
2020-03-04 14:24:21,GoddessAsianDo1,,9,43,134,"Here's your Asian Goddess, I'm tired of you lurkers and time wasters; just get off of findom. If I don't want you here, neither do ANY OTHER DOMMES. Real subs cum and $end to me. { find findom finsub asianfindom finslave paypig cashslave humanatm cashcow asiandomme } pic.twitter.com/w03pVdorKs",,,,1235209469425934336,https://twitter.com/GoddessAsianDo1/status/1235209469425934336
2020-03-04 14:24:02,NPR,,41,411,729,"As coronavirus dominates the headlines, Asian Americans across the country have reported being harassed and discriminated against in public. ""It just reminds me that when people look at us, they don't see us as American,"" one man says. https://trib.al/6a4PvFP",,,,1235209391659503617,https://twitter.com/NPR/status/1235209391659503617
2020-03-04 14:21:43,PlanetHrithik,,0,23,85,"@iHrithik talks about Rado, being the Sexiest Asian and handling success, controversies and attention #HrithikRoshan #Rado #Chennai Last Part of the Interview | 7pic.twitter.com/YVtzm0Ivrh",,@iHrithik,#HrithikRoshan #Rado #Chennai,1235208807904509952,https://twitter.com/PlanetHrithik/status/1235208807904509952
2020-03-04 14:21:06,TVSanjeev,TVSanjeev,21,12,305,"Actually my response was ‘Well I’ve been Asian for 34 years. How about you?’ I knew I hadn’t got the part at that point funnily enough. https://twitter.com/TVSanjeev/status/1235207674238771207 …",,,,1235208652472152065,https://twitter.com/TVSanjeev/status/1235208652472152065
2020-03-04 14:12:20,damienxpat,Jamay434,4,10,562,"saying “idgaf if you’re black/white/purple” and recirculating a decade old video that perpetuates negative stigmas against Asian folk is xenophobia, stop acting purposely dense in my mentions you fucking dweeb.",,,,1235206448159825920,https://twitter.com/damienxpat/status/1235206448159825920
