date,username,to,replies,retweets,favorites,text,geo,mentions,hashtags,id,permalink
2020-03-06 22:39:00,dami_lee,,9,68,670,"being an asian woman in public is fun right now bc you never know if sexist racists are about to catcall you or move away from you. i'm sure it's confusing for them too!",,,,1236058729801560064,https://twitter.com/dami_lee/status/1236058729801560064
2020-03-06 22:36:19,JoeWongComedy,KALONSMERALDO,12,28,113,"Can schools tell kids it’s wrong to pick on Asian kids? Please email all the school officials you know NOW! This has to stop!! https://twitter.com/KALONSMERALDO/status/1235429090745896960 …",,,,1236058053520142337,https://twitter.com/JoeWongComedy/status/1236058053520142337
2020-03-06 22:33:31,Popehat,,3,9,534,"/9 In a few words of hard-won English he said they were a gift for her, that children love Asian pears, that they are special. So they are. He shook my hand firmly and said thank you. I thanked him, and tried to convey in a how inexplicably blessed we are by these kids.",,,,1236057350894546944,https://twitter.com/Popehat/status/1236057350894546944
2020-03-06 22:33:31,Popehat,,3,8,471,"/8 They had gone next door to the Korean market and bought two huge, perfect Asian pears, and bought a nice fancy box to put them in. Asian pears are amazing -- ambrosial and beautiful and ludicrously expensive. They're a traditional gift.",,,,1236057350114443264,https://twitter.com/Popehat/status/1236057350114443264
2020-03-06 22:15:50,PatrioticLovers,,26,395,1821,"If you’re eating out this evening- consider supporting your local Asian cuisine. Including, but not limited to: Chinese, Japanese, & Vietnamese. Many restaurants are hearing CRICKETS right now bc of the coronavirus. Don’t let these restaurants suffer due to public misconceptions!",,,,1236052897319841793,https://twitter.com/PatrioticLovers/status/1236052897319841793
2020-03-06 22:14:38,andreagrimes,,5,59,411,"And make it a coronavirus twofer: Make an extra, extra special effort to patronize local businesses owned by Asian folks, because racism and ignorance are real forever, but particularly right now.",,,,1236052596357500929,https://twitter.com/andreagrimes/status/1236052596357500929
2020-03-06 22:10:19,mierihiranishi,,12,355,1399,"When western artists say “Don’t repost my art” they are taken very seriously but when an Asian artist says it, why do people start justifying and brushing it off? Why do western audiences feel ENTITLED to free manga/manhwa? Is it people taking advantage of the language barrier??",,,,1236051508678062086,https://twitter.com/mierihiranishi/status/1236051508678062086
2020-03-06 22:05:59,njaved,,6,16,128,"People need to cool it with their racism. Some lady on the GO train just yelled at an Asian man wearing a mask and stormed off. I couldn’t even catch what she said, but the fact that she even felt like she could do that pisses me off.",,,,1236050418876047360,https://twitter.com/njaved/status/1236050418876047360
2020-03-06 21:55:54,BYUNBABIE1,,3,134,453,"And we let’s talk about how a LOT of ppl act as though it is IMPOSSIBLE for another Asian act to be at the top without cheating your prejudice is showing luv",,,,1236047880986730501,https://twitter.com/BYUNBABIE1/status/1236047880986730501
2020-03-06 21:48:10,Complex,,33,35,201,"NYPD is investigating a #Coronavirus-related subway incident as a hate crime. Video shows the aggressor verbally attacking an Asian commuter and spraying a bottle of Febreze in his direction: http://cmplx.co/uobnaFk pic.twitter.com/up3wcvTEYv",,,#Coronavirus,1236045935911858176,https://twitter.com/Complex/status/1236045935911858176
2020-03-06 21:26:16,ElephantsTN,,4,37,298,"Asian elephant Debbie walks alongside one of the many ponds in Q Habitat. Access to a diverse and expansive habitat space has been shown to have a positive influence on the health, social, and psychological well-being of elephants at The Sanctuary. pic.twitter.com/6uGyLCbAOy",,,,1236040423988215813,https://twitter.com/ElephantsTN/status/1236040423988215813
2020-03-06 21:09:46,_THVTGUy_,MrInappr0pri8,2,15,36,"Everytime a yt person is prejudiced to an Asian person because of the corona virus, show them this video... https://twitter.com/MrInappr0pri8/status/1235992948531056640 …",,,,1236036270746415104,https://twitter.com/_THVTGUy_/status/1236036270746415104
2020-03-06 21:08:50,stichomancery,,3,39,102,"One day people will figure out that ""I knew nothing about rap and found it distasteful and/or vulgar until [East Asian Artist/Group] made it palatable for me"" isn't the compliment they think it is for their faves OR the Black people who created the genre they're working with.",,,,1236036039782871040,https://twitter.com/stichomancery/status/1236036039782871040
2020-03-06 21:05:21,bluelivesmtr,,17,18,38,"VIDEO: Elderly Asian Man Attacked, Robbed As Bystanders Laughed Follow @bluelivesmtr #BlueLivesMatter #BackTheBlue #lawenforcement #law Story https://buff.ly/2PTh4sm pic.twitter.com/NzqkLvuGLn",,@bluelivesmtr,#BlueLivesMatter #BackTheBlue #lawenforcement #law,1236035161575301120,https://twitter.com/bluelivesmtr/status/1236035161575301120
2020-03-06 21:04:31,NJamesWorld,,81,664,580,"Police release image of man after 'coronavirus rage' attack on woman Police hunting a racist thug who knocked a woman unconscious in a ""coronavirus rage"" attack The attacker is described as Asian heritage I wonder which part of Asia he will be from https://www.manchestereveningnews.co.uk/news/uk-news/coronavirus-rage-attack-cctv-image-17874267?utm_source=twitter.com&utm_medium=social&utm_campaign=sharebar …",,,,1236034949452566530,https://twitter.com/NJamesWorld/status/1236034949452566530
2020-03-06 21:02:43,JAMDAcom,,0,17,29,"The Asian Working Group for Sarcopenia ( #awgs) provides the 2019 consensus update on #sarcopenia diagnosis and treatment. Read more: https://www.jamda.com/article/S1525-8610(19)30872-2/fulltext …pic.twitter.com/E5HOPcYtf5",,,#awgs #sarcopenia,1236034500099895296,https://twitter.com/JAMDAcom/status/1236034500099895296
2020-03-06 20:57:53,TaingySauce,,32,12,172,"I feel so sad seeing all the racism that my asian friends and I have to deal with. It’s ridiculous. Dirty looks in public, people avoiding us and covering their faces when we’re near. Even on stream being told I need to be quarantined and the racial slurs are ridiculous now.",,,,1236033282346807297,https://twitter.com/TaingySauce/status/1236033282346807297
2020-03-06 20:48:24,kristy_tea,,2,9,19,"People are unnecessarily avoiding Asian businesses because of COVID-19. In response, my lovely friend @KimFosterNYC is rounding people up to support @ChinatownVegas. You should go! And regardless of where you live, support azn business, now more than everhttp://www.kim-foster.com/chinatown-chowdown/ …",,@KimFosterNYC @ChinatownVegas,,1236030897595412480,https://twitter.com/kristy_tea/status/1236030897595412480
2020-03-06 20:42:26,TrueFactsStated,,4,23,27,"Asian-Americans Terrified of Coronavirus Backlash Stock Up on Guns https://www.thedailybeast.com/asian-americans-terrified-of-coronavirus-backlash-stock-up-on-guns …",,,,1236029392486379521,https://twitter.com/TrueFactsStated/status/1236029392486379521
2020-03-06 20:25:43,supergenericgal,,10,43,144,"""They are us"", unless they're Asian, eh? https://www.nzherald.co.nz/nz/news/article.cfm?c_id=1&objectid=12314709 …",,,,1236025188468133889,https://twitter.com/supergenericgal/status/1236025188468133889
2020-03-06 20:24:51,Alythuh,,250,1647,27437,"love bein a southeast asian gal thrivin in a creative career, letting my filipina self be more known in a western space. delicious",,,,1236024968384667648,https://twitter.com/Alythuh/status/1236024968384667648
2020-03-06 20:24:47,OG_Rorschach,OGTubers,1,6,670,"style: Asian @TheRealRyanHiga",,@TheRealRyanHiga,,1236024953683750912,https://twitter.com/OG_Rorschach/status/1236024953683750912
2020-03-06 20:17:46,hermit_hwarang,,3,37,175,"Reminder that Mexico, the US, and almost all states in the Americas have very similar histories regarding Asian immigration, labor and internment. Mexico in particular has a much longer history due to the Manila trade https://time.com/5743555/wwii-incarceration-japanese-latin-americans/ …https://splinternews.com/the-forgotten-history-of-chinese-immigrants-in-this-mex-1793862816 …",,,,1236023187302944768,https://twitter.com/hermit_hwarang/status/1236023187302944768
2020-03-06 20:10:12,wrkclasshistory,,1,26,41,"#OtD 6 March 1964 Kowsilla, a striking sugarcane worker was killed in Guyana by a scab, and others badly injured. The British Tate sugar company was using African scabs to try to break a national strike of predominantly Asian workers https://libcom.org/tags/guyana pic.twitter.com/cLZe9f53bh",,,#OtD,1236021283013435393,https://twitter.com/wrkclasshistory/status/1236021283013435393
2020-03-06 20:07:27,drphilhammond,,20,82,384,"#COVIDー19 update. My local GP practice, which also dispenses drugs, ran out of paracetamol first and then Viagra. Either the Asian supply chain is drying up or people aren’t self isolating as strictly as they should.",,,#COVIDー19,1236020590408015872,https://twitter.com/drphilhammond/status/1236020590408015872
2020-03-06 20:03:16,TrumpJew,,3,31,72,"The Dem field started off with: 6 women (including a black, a Hindu, and a 1/1,024th Native American) 2 black men 1 Asian man 1 Latino man And 1 gay man Now they’re down to 2 straight white old men Democrats must be racist, sexist, homophobic bigots. Isn’t that how it works?",,,,1236019538103332869,https://twitter.com/TrumpJew/status/1236019538103332869
2020-03-06 19:39:50,STAND_LA,,0,23,81,"""I have to stand up & fight back. Being part of @CBECal for a few years, I see the strength & power we have as community members—black, indigenous, Latinx, Asian—rise as one to combat these injustices."" Jocelyn Moguel, a young leader born and raised in Wilmington #FireDrillFridaypic.twitter.com/FkVLWwrxP2",,@CBECal,#FireDrillFridaypic,1236013639221444608,https://twitter.com/STAND_LA/status/1236013639221444608
2020-03-06 19:33:05,thepack_kluse,MrInappr0pri8,7,188,418,".............and it’s the parents of THESE kinds of kids who are scared of East Asian folk right now? Gotta be shitting me. Lol. https://twitter.com/MrInappr0pri8/status/1235992948531056640 …",,,,1236011941891579905,https://twitter.com/thepack_kluse/status/1236011941891579905
2020-03-06 19:32:52,TIME,,36,179,370,"As coronavirus spreads, so does xenophobia and anti-Asian racism https://ti.me/2PPEuPe",,,,1236011885406965760,https://twitter.com/TIME/status/1236011885406965760
2020-03-06 19:30:44,AikaIntongVA,,2,12,36,"If you going to cover your nose when an Asian person is near you, you're racist. 1. Chances of getting COVID19 may increase when you cover your mouth/nose or just touching your face 2. The virus can come from ANYWHERE 3. Realize that some Asians have never been to China 4. pic.twitter.com/5zIyHxx2kg",,,,1236011349508894721,https://twitter.com/AikaIntongVA/status/1236011349508894721
2020-03-06 19:25:12,my2k,,6,7,117,"thank god for asian ASMR cooking channels where they have thousand dollar cameras that film in 4k 60fps and play nice soft jazz they've been saving my life the past week or two",,,,1236009956681191426,https://twitter.com/my2k/status/1236009956681191426
2020-03-06 19:24:36,BernieSanders,,337,1428,6831,"We are building a multigenerational, multiracial movement — Black, white, Latino, Native American, Asian American — all coming together and demanding an economy that works for all, not just a few. Get involved today: http://berniesanders.com/volunteer",,,,1236009807997538305,https://twitter.com/BernieSanders/status/1236009807997538305
2020-03-06 19:20:05,Mei_Mac,,26,418,2858,"BEING RACIST AND RUDE TO EAST ASIAN PEOPLE WILL NOT STOP YOU GETTING COVID-19. YOU'RE 100% MORE LIKELY TO CATCH IT FROM YOUR MATE WHO WENT TO ITALY LAST MONTH THAN FROM ME. stopthisnonsensepleaseitfeelslikeshit",,,,1236008669558554624,https://twitter.com/Mei_Mac/status/1236008669558554624
2020-03-06 19:19:39,BronFredericks,,1,21,66,"It’s saddening & disappointing seeing the rise in Sinophobia, hostility & broader anti-Asian discrimination in conjunction with the coronavirus. I offer solidarity to Asian & Asian-Australian communities at this time & #solidarity to those affected by #coronavirus.pic.twitter.com/Klm2Hiy3z7",,,#solidarity #coronavirus,1236008558849748992,https://twitter.com/BronFredericks/status/1236008558849748992
2020-03-06 19:19:15,donnabrazile,RevDrBarber,47,14,87,"And the Asian American gone. The youthful candidates gone. There’s an awakening coming. https://twitter.com/RevDrBarber/status/1235987521856770049 …",,,,1236008460204023808,https://twitter.com/donnabrazile/status/1236008460204023808
2020-03-06 19:18:59,mykrokoswos,_illeglrl,3,7,65,"Im not poc so idk if its rly my place to say anything at all but reading this from her- something doesnt sound right when she ties east asian gang violence to an online kpop fandom that rightfully called her out pic.twitter.com/GCL8JfhaxH",,,,1236008394093363200,https://twitter.com/mykrokoswos/status/1236008394093363200
2020-03-06 19:02:04,B0TSHELO,,3,33,88,"Yoh That Asian beat on Gunna’s “Who you foolin”",,,,1236004135687852032,https://twitter.com/B0TSHELO/status/1236004135687852032
2020-03-06 18:56:12,tpzElf,,3,18,95,"Hey media, when discussing the #Coronavius outbreak, please stop showing pictures of Asian-Americans in Flushing with masks on when all the confirmed cases in #NYC are non-Asians in Manhattan.",,,#Coronavius #NYC,1236002659892629509,https://twitter.com/tpzElf/status/1236002659892629509
2020-03-06 18:54:05,EmericanJohnson,,14,341,1512,"Vietnam was the first country to completely contain COVID-19 without any deaths out of 16 cases. It's been completely contained for weeks, now. But a woman just brought it to Hanoi from EUROPE. But please tell me more about how Asian people are the ones who spread the virus",,,,1236002127756947456,https://twitter.com/EmericanJohnson/status/1236002127756947456
2020-03-06 18:38:08,FNATIC_MOTOR,issa,5,2,890,"I am asian u fat fucking arab go play with 1 hand or I take out my folder",,,,1235998110842867712,https://twitter.com/FNATIC_MOTOR/status/1235998110842867712
2020-03-06 18:35:45,gamesblazer06,,2,28,88,"Bear was insolvent March 2008...the market ripped till August 2008. LTCM cratered the market in late 98 w the Asian Crisis...we had a year plus long rally & then the Recession hit in March 2001 way before 9/11... There are #LateCycle lags & Blow Off Tops that can kill careers.",,,#LateCycle,1235997511086530560,https://twitter.com/gamesblazer06/status/1235997511086530560
2020-03-06 18:32:22,EricQuachSpeaks,,297,380,916,"This is damn not okay & we must stop it. This is a video of an Asian kid getting assaulted on a Philadelphia subway train this week. I understand #coronavirus #COVID19 came from China, but that gives people 0 excuse for their racist & zenophobic behavior.pic.twitter.com/d7WUYBjTq5",,,#coronavirus #COVID19,1235996660938891264,https://twitter.com/EricQuachSpeaks/status/1235996660938891264
2020-03-06 18:22:59,Abramjee,,349,428,729,"WATCH- Some students calling an Asian student “Corona”. This discrimination must stop! pic.twitter.com/zDHyB9Tk3j",,,,1235994299529154562,https://twitter.com/Abramjee/status/1235994299529154562
2020-03-06 18:20:57,forevertawl,,5,12,83,"At Bernie's press conference so far theyve asked him two questions about the black vote. Erasing Asian and Latino voices. I fucking hate the media.",,,,1235993786712547334,https://twitter.com/forevertawl/status/1235993786712547334
2020-03-06 18:13:28,s44dcba,,6,6,131,"Some Asian meme page on Insta keeps rejecting my follow request BRO I JUST WANNA SEE WHAT PEOPLE SEND ME WHY DO U HATE ME WHAT HAVE I DONE TO YOU MAN I DONT EVEN KNOW YOU",,,,1235991906712252417,https://twitter.com/s44dcba/status/1235991906712252417
2020-03-06 18:10:08,aaja,,0,26,30,"The spread of COVID-19 ""has been accompanied by a dramatic increase in anti-Asian discrimination across the U.S., and news stories featuring photos of people of Asian descent unrelated to the context of the reporting help to perpetuate this racism."" @mmfa:https://www.mediamatters.org/coronavirus-covid-19/news-outlets-contribute-anti-asian-racism-careless-stock-photos-coronavirus …",,@mmfa,,1235991065192280066,https://twitter.com/aaja/status/1235991065192280066
2020-03-06 18:07:25,symonelyfy,,12,21,90,"I'm about to give my thoughts on some things. FIRST: Everyone needs to stop telling #JoeBiden who to pick for VP. It's his choice and he should pick someone qualified who has his back and that he can trust. A Male Or A Woman black white Asian or Hispanic.",,,#JoeBiden,1235990381210329088,https://twitter.com/symonelyfy/status/1235990381210329088
2020-03-06 17:31:25,PeterKGeoghegan,heraldscotland,27,74,284,"Is there a reason this story is accompanied by a picture of Asian tourists? https://twitter.com/heraldscotland/status/1235980966587289602 …",,,,1235981321794654209,https://twitter.com/PeterKGeoghegan/status/1235981321794654209
2020-03-06 17:29:15,marmitemarmz,,15,110,84,"Asian teens punched, kicked and spat at in three separate racist coronavirus attacks in Exeter in just one day Devon and Cornwall Police is appealing for witnesses following at least six separate incidents involving Asian residents of the city https://www.devonlive.com/news/devon-news/asian-teens-punched-kicked-spat-3922546 …",,,,1235980778242215936,https://twitter.com/marmitemarmz/status/1235980778242215936
2020-03-06 17:21:47,literallysofie,,1,41,573,"my honors english teacher after calling me and my friend ""asian persuasion"" because we partnered for a project pic.twitter.com/hVbDhcyfOD",,,,1235978896694112257,https://twitter.com/literallysofie/status/1235978896694112257
2020-03-06 17:21:30,DHotwheelz,,1,26,125,"Asian Americans and Asian Immigrants should feel safe in this country They shouldnt go outside and worry about all the strange looks, or ppl avoiding them or them getting jumped by some hateful mob Im telling you this hate will lead to someone getting killed End dis, sho Love",,,,1235978829191155719,https://twitter.com/DHotwheelz/status/1235978829191155719
2020-03-06 17:19:31,TRlVlASCENERY,taegiswings,2,6,180,"if someone from an “english-speaking culture” went to an asian culture and adressed an older person by their first name that would be disrespectful, but likewise is it not fair to expect that person to uphold your cultural values in their own culture",,,,1235978327434973184,https://twitter.com/TRlVlASCENERY/status/1235978327434973184
2020-03-06 17:19:24,yumcoconutmilk,,13,107,298,"For @voxdotcom, I wrote about why news outlets need to stop making Asian people the “face of the coronavirus” by using irrelevant and biased photos. MUCH thanks to @kainazamaria, Vox’s visuals editor, for speaking with me about photojournalism ethics!https://www.vox.com/identities/2020/3/6/21166625/coronavirus-photos-racism …",,@voxdotcom @kainazamaria,,1235978297315651586,https://twitter.com/yumcoconutmilk/status/1235978297315651586
2020-03-06 17:18:00,TheBeigeSirKeir,,20,46,222,"Boris Johnson is NOT a racist! And you really should listen to me! If the Prime Minister was racist, would he choose as Home Secretary a woman of Asian origin (whose immigration rules would have deported her own parents)? I don't think so! Checkmate lefties x",,,,1235977947888091136,https://twitter.com/TheBeigeSirKeir/status/1235977947888091136
2020-03-06 17:13:40,DeIicatekth,,11,336,375,"ARMY ALERT VOTE FOR JUNGKOOK as one of the 100 Asian Heartthrobs !! the gap is really small and i would appreciate if we get a bigger one the votes are UNLIMITED !! Just vote AND refresh the page http://www.starmometer.com/2020/03/05/100-asian-heartthrobs-2020-battle-round-jungkook-vs-taeyong/ …",,,,1235976856542818305,https://twitter.com/DeIicatekth/status/1235976856542818305
2020-03-06 17:03:00,nowthisnews,,17,173,434,"‘People treat you differently in public now and that sucks’ — Asian American producer @davechensky shared 4 tips for addressing racism in the wake of the global coronavirus outbreak pic.twitter.com/WmTiQ6q5tI",,@davechensky,,1235974170992939008,https://twitter.com/nowthisnews/status/1235974170992939008
2020-03-06 17:00:40,JesuInToast,,14,27,156,"Again, what's with these Asian American YA writers who write half-white half-Asian protagonists when they themselves are not? pic.twitter.com/rlnNbowmFc",,,,1235973584943747072,https://twitter.com/JesuInToast/status/1235973584943747072
2020-03-06 16:54:22,TVMohandasPai,,4,23,83,"No, Dr. Nye, the future is Asian: Parag Khanna - Nikkei Asian The Future is Asia! ⁦ @PMOIndia⁩ ⁦ @narendramodi⁩ ⁦ @nsitharaman⁩ ⁦ @sanjeevsanyal⁩ ⁦ @SubramanianKri⁩ ⁦ @APanagariya⁩ ⁦ @surjitbhalla⁩ ⁦ @PiyushGoyal⁩https://asia.nikkei.com/Editor-s-Picks/Interview/No-Dr.-Nye-the-future-is-Asian-Parag-Khanna …",,@PMOIndia @narendramodi @nsitharaman @sanjeevsanyal @SubramanianKri @APanagariya @surjitbhalla @PiyushGoyal,,1235971998825627651,https://twitter.com/TVMohandasPai/status/1235971998825627651
2020-03-06 16:52:30,DHotwheelz,,51,149,688,"Praying for my Asian brothers and sisters Who are going through so much hate because of this stupid virus I want to let you guys know that we love you and that even tho we have bad apples in this country they dont represent all of us I love you all so much I am so sorry",,,,1235971529692848128,https://twitter.com/DHotwheelz/status/1235971529692848128
2020-03-06 16:47:37,DeIicatekth,,6,273,297,"ARMYS LISTEN VOTE FOR JIN as one of the 100 Asian Heartthrobs It is UNLIMITED votes ! All you gotta do is vote, complete the captcha, refresh etc... http://www.starmometer.com/2020/03/06/100-asian-heartthrobs-2020-battle-round-xiao-zhan-vs-kim-seokjin/?utm_source=feedburner&utm_medium=twitter&utm_campaign=Feed%3A+starmometer+%28starmometer%29 …",,,,1235970298517872642,https://twitter.com/DeIicatekth/status/1235970298517872642
2020-03-06 16:39:51,Arati4Congress,,2,147,230,"I'm a neuroscientist, mom and the first South Asian elected in Glen Rock. As a scientist, I researched diseases, including addiction. Now, I'm after Josh Gottheimer's seat. We've got a growing grassroots movement. Can you RT and follow to get us to 5k? pic.twitter.com/M6qYYbdICy",,,,1235968345255612416,https://twitter.com/Arati4Congress/status/1235968345255612416
2020-03-06 16:35:45,seungminkim,,12,26,28,"Fearful of a Coronavirus Backlash, Some Asian Americans Are Stocking Up on Guns https://www.thetrace.org/2020/03/coronavirus-gun-sales-washington-california-asian-americans/ …",,,,1235967314966740994,https://twitter.com/seungminkim/status/1235967314966740994
2020-03-06 16:29:29,jinnieslamp,,35,430,495,"[ #VoteJin] Vote for #JIN on the 100 Asian Heartthrobs 2020 Battle Round – Level 3. He is currently in 2nd place! http://www.starmometer.com/2020/03/06/100-asian-heartthrobs-2020-battle-round-xiao-zhan-vs-kim-seokjin/?utm_source=feedburner&utm_medium=twitter&utm_campaign=Feed%3A+starmometer+%28starmometer%29 … #방탄소년단진 #SEOKJIN #진 #김석진 #방탄진 @BTS_twtpic.twitter.com/g5NsebdlpY",,@BTS_twtpic,#VoteJin #JIN #방탄소년단진 #SEOKJIN #진 #김석진 #방탄진,1235965735752495104,https://twitter.com/jinnieslamp/status/1235965735752495104
2020-03-06 16:28:23,herediitarys,,1,44,206,"idk which person needs to hear this but just because the coronavirus exists doesn’t mean you can blatantly be xenophobic and racist towards asian people",,,,1235965458374852608,https://twitter.com/herediitarys/status/1235965458374852608
2020-03-06 16:22:37,teamtrace,,10,25,25,"NEW: Coronavirus outbreaks in Washington and California have motivated first-time gun buyers —many of them Asian Americans worried about racist attacks stemming from fears about the virus, reports @champebarton in a new piece published w/ @TheDailyBeast https://www.thetrace.org/2020/03/coronavirus-gun-sales-washington-california-asian-americans/ …",,@champebarton @TheDailyBeast,,1235964010429849603,https://twitter.com/teamtrace/status/1235964010429849603
2020-03-06 16:16:06,PowellBettyJ,,0,51,24,"Mid Century Premco Kitsch TV Lamp, Green and Gold Asian Gondola Boat Console Light, Cool Vintage Bar Accent Lamp #midcenturymodern #50sKitsch #Asian #BarLamp #TVLamp #Etsy https://etsy.me/2TsCq1I via @Etsy",,@Etsy,#midcenturymodern #50sKitsch #Asian #BarLamp #TVLamp #Etsy,1235962368305307648,https://twitter.com/PowellBettyJ/status/1235962368305307648
2020-03-06 15:59:05,maxwelltani,,5,43,104,"been trying to discover some deeper meaning or truth in the anti-asian coronavirus prejudice, but can't really because it's all very stupid pic.twitter.com/1TiIYcgj2v",,,,1235958086944403464,https://twitter.com/maxwelltani/status/1235958086944403464
2020-03-06 15:43:51,DawsOrion83,,109,38,303,"So the next president will be a old white man Not a woman, not someone who is black or Asian, not someone who is gay Another old white man... So much for being progressive",,,,1235954252993851392,https://twitter.com/DawsOrion83/status/1235954252993851392
2020-03-06 15:33:40,KeenlyAxon,,1,60,170,"𝗪𝗵𝗮𝘁 𝘁𝗵𝗲𝘆 𝘀𝗮𝘆: ""We need to change Asian media since it has problematic themes"" 𝗪𝗵𝗮𝘁 𝘁𝗵𝗲𝘆 𝗺𝗲𝗮𝗻: ""Asian media is different than Western media and I don't like that, I'm racist under a woke cloak""",,,,1235951688621711362,https://twitter.com/KeenlyAxon/status/1235951688621711362
2020-03-06 15:26:39,LokiJulianus,,8,26,171,"Can we at least test the Asian guy first before jumping to conclusions about ""who was in the wrong"" here? pic.twitter.com/iTR6oiv2nm",,,,1235949922836508673,https://twitter.com/LokiJulianus/status/1235949922836508673
