date,username,to,replies,retweets,favorites,text,geo,mentions,hashtags,id,permalink
2020-03-13 10:48:29,flourishedfern,,3,4,59,"I dead ass just witnessed a white lady at Starbucks tell an ASIAN EMPLOYEE TO “KEEP THAT CORONA CRAP AWAY” LIKE???? DO KARENS NOT HAVE BRAINS ANYMORE ???",,,,1238416638661341184,https://twitter.com/flourishedfern/status/1238416638661341184
2020-03-13 10:47:38,gijn,,2,24,13,"GIJN regrets to announce that we are canceling this year's Asian Investigative Journalism Conference #IJAsia20, which was slated for Oct 16-18 in Kuala Lumpur, Malaysia. The move comes after considerable work by GIJN staff & our great co-host @malaysiakini https://buff.ly/2WdV9jt pic.twitter.com/8dlZ6iDuXF",,@malaysiakini,#IJAsia20,1238416421081792517,https://twitter.com/gijn/status/1238416421081792517
2020-03-13 10:43:56,datta_arvind,,38,23,396,"My buys for today in small quantities everything ended up in green, would call myself extremely lucky Axis Bank Asian Paints ITC TCS Britannia Infosys Bandhan Bank",,,,1238415492940836864,https://twitter.com/datta_arvind/status/1238415492940836864
2020-03-13 10:35:07,BeigeShiba,,15,18,163,"Oh great another Asian thot is doing the ""I'm a conservative now please enjoy these pictures with my tits out"" bit. pic.twitter.com/UnMq6E2YuA",,,,1238413272233046016,https://twitter.com/BeigeShiba/status/1238413272233046016
2020-03-13 10:19:50,VanessaIfeoma,,16,260,1930,"Covid-19 was brought to Ireland by young ones on a ski trip to Italy but that won’t stop The Guardian from using an Asian woman as the face of their story pic.twitter.com/VlkAHVJ3na",,,,1238409427990036482,https://twitter.com/VanessaIfeoma/status/1238409427990036482
2020-03-13 10:13:11,JinChartData,,8,80,67,"[ VOTING FOR JIN ] STARMOMETER 100 Asian Heartthrobs 2020 1. - 1,147,207 2. Jin - 1,146,470 GAP from #1 : 737 http://www.starmometer.com/2020/03/06/100-asian-heartthrobs-2020-battle-round-xiao-zhan-vs-kim-seokjin/ … https://poll.fm/10516159/verify/captcha …",,,#1,1238407753032294400,https://twitter.com/JinChartData/status/1238407753032294400
2020-03-13 10:00:15,NBCNews,,30,59,185,"“Right now, we've seen particularly troubling instances of discrimination directed at Asian communities, particularly in Chinese community,” de Blasio said. “This is unacceptable.” https://nbcnews.to/2U5wmv9",,,,1238404497770262531,https://twitter.com/NBCNews/status/1238404497770262531
2020-03-13 09:58:00,JinChartData,,4,73,62,"[ VOTING FOR JIN ] STARMOMETER 100 Asian Heartthrobs 2020 1. Jin - 1,137,825 2. - 1,13,487 GAP: 338 http://www.starmometer.com/2020/03/06/100-asian-heartthrobs-2020-battle-round-xiao-zhan-vs-kim-seokjin/ … https://poll.fm/10516159/verify/captcha …",,,,1238403932419788802,https://twitter.com/JinChartData/status/1238403932419788802
2020-03-13 09:56:32,SouthAsiaTimeUK,,92,223,215,"Handshake and Hug greeting are being replaced by the oldest South Asian greeting #Namaste due to #coronavirus safety. People from both countries India and Nepal are arguing “Namaste” greeting as the copyright of their own country. What do you think?",,,#Namaste #coronavirus,1238403562285281280,https://twitter.com/SouthAsiaTimeUK/status/1238403562285281280
2020-03-13 09:56:22,elerianm,elerianm,21,36,169,"Volatile overnight in #markets gives way to a better tone this morning...at least for now. Several Asian indices turned to close higher; European stocks are bouncing; and US futures indicate a 700'ish point higher open (or up almost 4%). The yield on 10-yr Treasuries is up 10 bps https://twitter.com/elerianm/status/1238295218203455488 …",,,#markets,1238403521965199360,https://twitter.com/elerianm/status/1238403521965199360
2020-03-13 09:54:30,suhasinih,tallstories,265,183,567,"The government has mocked the concept of SAARC so many times, and hyped alternative formations so much, the big question remains whether the PM is serious about reviving the South Asian grouping this time. Would be a shame if false expectations are raised in the neighbourhood. https://twitter.com/tallstories/status/1238400478276452352 …",,,,1238403050781409280,https://twitter.com/suhasinih/status/1238403050781409280
2020-03-13 09:51:30,Jockedupgeek,,10,2,88,"Sorry what? You’re not into Asian, Middle Eastern and Latino men ? That’s a shame for you and more for me nomnomnom",,,,1238402298075889664,https://twitter.com/Jockedupgeek/status/1238402298075889664
2020-03-13 09:44:51,itsasyrf,,4,891,1825,"mostly parents didn’t understand their child, especially asian parents. you say friends is nothing. you don’t know what i been through during my hard time. you just busy with you career and business. who i have at the time? only a few friends a have when i through my hard time.",,,,1238400624619712512,https://twitter.com/itsasyrf/status/1238400624619712512
2020-03-13 09:39:41,kingbyree___,,0,21,16,"It's mad ironic seeing Asian people complain about racism because of coronavirus considering how racist a lot of them are themselves",,,,1238399321617227776,https://twitter.com/kingbyree___/status/1238399321617227776
2020-03-13 09:14:52,Trinhnomics,,10,25,73,"Guys, what a week that felt like a month. Asian close today & markets are looking to next week already: *China data finally on 16 March 2020 - gonna be brutal but at least u were warned *Fed at 2am 19 March & markets off the chart w/ expectations (zero to be hero) *US Fiscal? pic.twitter.com/XAJaf1mPq6",,,,1238393077338791937,https://twitter.com/Trinhnomics/status/1238393077338791937
2020-03-13 08:58:46,upulie,,3,6,48,"Do not be alarmed by East Asian people wearing masks. Chinese people often wear masks as a matter of course, whether in China or elsewhere. They have done so for years - largely to deal with pollution. It's perfectly normal and you should absolutely not panic or worry.",,,,1238389024408010753,https://twitter.com/upulie/status/1238389024408010753
2020-03-13 08:23:06,this_is_zel,,0,24,90,"Dumbasses be racist against asian people while it's rich white europeans on vacation that brought the disease everywhere.",,,,1238380048517922818,https://twitter.com/this_is_zel/status/1238380048517922818
2020-03-13 08:19:24,PJM_DIARY_,PJM_DIARY_,2,49,69,"#JIMIN is nominated in 100 Asian Heartthrobs 2020 poll. The current gap is less than 1k. Mass vote for him because the poll will end tomorrow. The vote is unlimited. If the website crash keep refreshing it. Check the thread for voting method. https://twitter.com/PJM_DIARY_/status/1237332259201400837 …",,,#JIMIN,1238379117688418304,https://twitter.com/PJM_DIARY_/status/1238379117688418304
2020-03-13 08:15:27,SheRa_Marley,,5,23,154,"PSA making glib jokes about Chinese people eating bats and broadcasting them on the internet ultimately leads to Asian people being racially abused and attacked. Don't do it, it's shit",,,,1238378124812967936,https://twitter.com/SheRa_Marley/status/1238378124812967936
2020-03-13 08:12:14,head_bulb,,1,47,68,"Pleased to inform you that @SwordOpen's launched a petition asking @Twitter to forbid likening national symbols to hate symbols I know this likening has been made mainly by S.Koreans, not Asians in other Asian countries. Sign it if you agree with that https://www.change.org/p/twitter-inc-ask-twitter-to-forbid-the-comparison-of-national-symbols-with-hate-symbols …",,@SwordOpen @Twitter,,1238377313646940161,https://twitter.com/head_bulb/status/1238377313646940161
2020-03-13 08:09:47,ithayla,Fahmibinhassan,3,25,82,"southeast asian internet game is ridiculously strong https://twitter.com/Fahmibinhassan/status/1238080010017058816 …",,,,1238376698262867969,https://twitter.com/ithayla/status/1238376698262867969
2020-03-13 08:06:59,FutbolJustin,,2,19,88,"COVIC-14 UPDATE: Western Sydney Wanderers are the only Australian team to win the Asian Champions League. pic.twitter.com/zbSVOH4p5O",,,,1238375994894909441,https://twitter.com/FutbolJustin/status/1238375994894909441
2020-03-13 08:04:53,RILEY_CYRUS,,1,10,94,"i toured in 8 asian countries where the COVID19 actively was. i have nearly 500 hours on site experience of the East vs. West. if any news wants to have a semi-recognizabe rocker school you on how awful the West is handling by comparison, holler @CNN @greggutfeld @MSNBC @BBCWorld",,@CNN @greggutfeld @MSNBC @BBCWorld,,1238375464147787781,https://twitter.com/RILEY_CYRUS/status/1238375464147787781
2020-03-13 08:03:42,JinChartData,,6,101,119,"[ VOTING FOR JIN ] STARMOMETER 100 Asian Heartthrobs 2020 VOTING: unlimited 1. Jin - 1,090,425 2. - 1,087,184 GAP: 3,241 (+2,006) http://www.starmometer.com/2020/03/06/100-asian-heartthrobs-2020-battle-round-xiao-zhan-vs-kim-seokjin/ … https://poll.fm/10516159/verify/captcha …",,,,1238375167341916160,https://twitter.com/JinChartData/status/1238375167341916160
2020-03-13 07:53:42,ANI,ANI,14,124,733,"Prime Minister Narendra Modi: I would like to propose that the leadership of South Asian Association for Regional Cooperation (SAARC) nations chalk out a strong strategy to fight Coronavirus. We could discuss, via video conferencing, ways to keep our citizens healthy. https://twitter.com/ANI/status/1238372257698729984 …",,,,1238372649278910464,https://twitter.com/ANI/status/1238372649278910464
2020-03-13 07:43:01,ExpatBanana,kaitlynjanellee,6,32,374,"A ton of stores still have a lot of vegan food available. Also check out Asian markets! People are avoiding them like crazy for racist reasons, so they are mostly fully stocked still.",,,,1238369962923679744,https://twitter.com/ExpatBanana/status/1238369962923679744
2020-03-13 07:40:48,paulinevetuna,,8,99,509,"Time to stop using random Asian peoples photos to accompany your #covid19australia articles and start using Dutton’s",,,#covid19australia,1238369404829626368,https://twitter.com/paulinevetuna/status/1238369404829626368
2020-03-13 07:39:28,elpueblo1998,,9,22,68,"I'm approached while taking Asian Studies Journal and he asked, ""Do you need to be Asian to learn Asian studies?"" Then I asked him, ""Do you need to be Caucasian to be a racist?""",,,,1238369067276185601,https://twitter.com/elpueblo1998/status/1238369067276185601
2020-03-13 07:26:08,inthecopa,,22,335,353,"FOLLOWING PANDEMICS ALL ORIGINATED FROM CHINA: COVID-19 (2019) SARS (2003) HONG KONG FLU (1968) ASIAN FLU (1957) But Pelosi thinks it xenophobic, racist for us to refer to these pandemics as Asian related",,,,1238365715557539840,https://twitter.com/inthecopa/status/1238365715557539840
2020-03-13 07:09:39,ANI,,3,12,69,"Hisham Al Taher, General Secretary, Asian Chess Federation: As a precautionary measure, all events have been postponed until the end of June. Asian Amateur Chess Championship scheduled for this April in Muscat is postponed until further notice after the end of June. #CoronaViruspic.twitter.com/poDe5uFlf2",,,#CoronaViruspic,1238361567139266560,https://twitter.com/ANI/status/1238361567139266560
2020-03-13 07:07:03,business,,5,39,67,"Asian central banks moved aggressively to soothe virus-rattled markets by injecting funds https://trib.al/l24Zqeh",,,,1238360909678022657,https://twitter.com/business/status/1238360909678022657
2020-03-13 06:55:42,AdosLineage,USATODAY,4,33,77,"Remember when the Asian community came out to support Peter liang when he shot akai Gurley in the hallway in BK? Remember they said it was wrong to convict and scapegoat Asians for killing a black Male when white officers had been getting away with it. #ADOShttps://twitter.com/USATODAY/status/1238247148044587009 …",,,#ADOShttps,1238358054325956608,https://twitter.com/AdosLineage/status/1238358054325956608
2020-03-13 06:39:54,209acesheepdog,,13,119,78,"Sheepdog's, Asians attacked by idiots blaming them 4 Wuhan virus. Asians have been assaulted by ppl for being Asian. Asians R using their 2nd ammendment rights by buying guns.Thank God 4 the 2nd ammendment & how it applys to all Americans! #209acemaga45https://www.theblaze.com/news/asian-americans-guns-racism …",,,#209acemaga45https,1238354076615593984,https://twitter.com/209acesheepdog/status/1238354076615593984
2020-03-13 06:00:36,EW,,3,59,180,"Find out why it was important to showcase ‘hot Asian masculinity' on #NoraFromQueens.https://ew.com/tv/awkwafina-is-nora-from-queens-k-drama-episode-hot-asian-masculinity/?utm_campaign=entertainmentweekly_entertainmentweekly_trueanthem&utm_content=tv&utm_medium=social&utm_source=twitter.com&utm_term=5e6b21840286ed0001efbc98 …",,,#NoraFromQueens,1238344188334391296,https://twitter.com/EW/status/1238344188334391296
2020-03-13 05:59:47,Sanatkhan391,,1,91,29,"Kashmir is the living tragedy not only for the south asian region but for entire world. #222DaysOfIndianBrutalitypic.twitter.com/mXqnXzCF32",,,#222DaysOfIndianBrutalitypic,1238343980842127361,https://twitter.com/Sanatkhan391/status/1238343980842127361
2020-03-13 05:55:04,aninoami,GenuineSrik,1,72,1805,"#iwilleatwithyou is a hashtag-movement that was started by people to get others to support chinese and asian businesses (restaurants)... it’s not something they personally came up with",,,#iwilleatwithyou,1238342795342934016,https://twitter.com/aninoami/status/1238342795342934016
2020-03-13 05:54:36,LynxEvil721,,43,205,412,"In case you are an Asian and you do not want to be misrecognized as a chinese. #WuhanVirus #WuhanCoronavirusOutbreak #武漢肺炎pic.twitter.com/OpbCsVoEAv",,,#WuhanVirus #WuhanCoronavirusOutbreak #武漢肺炎pic,1238342678971990016,https://twitter.com/LynxEvil721/status/1238342678971990016
2020-03-13 05:49:57,harmon_jess,KALONSMERALDO,9,36,216,"Yes this pandemic is frightening but it’s no excuse for the racism that clearly already exists in your heart. Be kind to people, we’re all in this together. Oh and blaming Asian people is just fucking ignorant.. like your ignorant racism. https://twitter.com/KALONSMERALDO/status/1235429090745896960 …",,,,1238341508215930880,https://twitter.com/harmon_jess/status/1238341508215930880
2020-03-13 05:40:01,nytimes,,26,78,189,"Asian stocks continued to get hammered on Friday, following Wall Street’s worst trading day in more than three decades https://nyti.ms/2IHQMFl",,,,1238339009706934272,https://twitter.com/nytimes/status/1238339009706934272
2020-03-13 05:39:33,btsyoutubedata,,42,1747,2384,". @BTS_twt is now the 16th most viewed artist on YouTube They're the only Asian act in top 35 ( #BoyWithLuv #BestMusicVideo #iHeartAwards )pic.twitter.com/gQZYsayB85",,@BTS_twt,#BoyWithLuv #BestMusicVideo #iHeartAwards,1238338890672607232,https://twitter.com/btsyoutubedata/status/1238338890672607232
2020-03-13 05:34:13,JinChartData,,10,116,126,"[ VOTING FOR JIN ] STARMOMETER 100 Asian Heartthrobs 2020 1. Jin - 1,017,917 2. - 1,015,091 GAP: 2,826 http://www.starmometer.com/2020/03/06/100-asian-heartthrobs-2020-battle-round-xiao-zhan-vs-kim-seokjin/ … https://poll.fm/10516159/verify/captcha …",,,,1238337547790508033,https://twitter.com/JinChartData/status/1238337547790508033
2020-03-13 05:30:58,sugarcane_tea,USATODAY,9,24,245,"Someone else is understanding the everyday experiences of being Black in America, especially when we venture into an Asian-owned store. Exhausting, isn’t it. pic.twitter.com/0kTwKU6QAr",,,,1238336731591643137,https://twitter.com/sugarcane_tea/status/1238336731591643137
2020-03-13 05:26:54,jeongyunhonet,,14,34,192,"now that kq has postponed ateez concert in europe,,, what if,,,,, they decided to add new dates,,, and,,,,,, also,, include,,, south east asian,, i am thinking",,,,1238335708558843905,https://twitter.com/jeongyunhonet/status/1238335708558843905
2020-03-13 05:15:47,goldentot,,22,138,951,"Tried to get food and the store is just empty. Except the Asian aisles. Stock up on Ramen, lads, people are fucking stupid.",,,,1238332910232645633,https://twitter.com/goldentot/status/1238332910232645633
2020-03-13 05:10:07,bettingkingz7,,1,27,55,"Recap Thursday VIP VIP Fee R15 Overs goals Frankfurt game Overs goals United game Overs goals Wolfsburg Overs goals Rangers game Rugby League Parra ML Asian handicap 2.0 Many games have been cancelled but lots still on! Big weekend Betway pic.twitter.com/Dua88PGVl3",,,,1238331485519663109,https://twitter.com/bettingkingz7/status/1238331485519663109
2020-03-13 05:07:48,ProfHsieh,,19,23,166,"Friends, check on your Asian American friends. If we’re friends, you can check on me. All the racist incidents in our community right now are taxing. I’m tired. Pretty much all the time for the last 10 days. Making it with a lot of community support but so tired.",,,,1238330901789958144,https://twitter.com/ProfHsieh/status/1238330901789958144
2020-03-13 04:56:36,discoveryduck,,21,67,523,"Everyone else preparing for the pandemic by buying toilet paper and rubbing alcohol. Asian Americans preparing by buying brass knuckles and mace.",,,,1238328080936165376,https://twitter.com/discoveryduck/status/1238328080936165376
2020-03-13 04:45:07,wang_maya,,9,200,521,"We can beat the epidemic while respecting rights. Some Asian countries, esp. Taiwan, are shinning examples in this difficult time which tests our values: https://www.nbcnews.com/health/health-news/what-taiwan-can-teach-world-fighting-coronavirus-n1153826 … Human rights = maximized overall well-being in society. END",,,,1238325193036054528,https://twitter.com/wang_maya/status/1238325193036054528
2020-03-13 04:37:42,AlexandraErin,,2,13,87,"The fact that emphasizing its point of known origin resulted in widespread acts of anti-Asian racism and muddied the waters on actual containment and prevention means we might think about not doing that with future outbreaks, even temporarily.",,,,1238323326365454337,https://twitter.com/AlexandraErin/status/1238323326365454337
2020-03-13 04:08:49,HellBentVixen,,12,59,306,"Hey guys, coronavirus isn’t a race.... So think a little before you discriminate against Asian people will ya? Thanks! -Some Asian Girl",,,,1238316057590292480,https://twitter.com/HellBentVixen/status/1238316057590292480
2020-03-13 03:56:58,GoddessAsianDo1,,17,29,135,"$ubmit to me. Get on your knees and beg. I'm the Asian Goddess of your dreams and I want you to pray to me. $end to me. You can only find pleasure in sending to me . { find findom finsub asianfindom finslave paypig cashslave humanatm cashcow asiandomme }pic.twitter.com/4NKiL4bUim",,,,1238313074198638592,https://twitter.com/GoddessAsianDo1/status/1238313074198638592
2020-03-13 03:54:05,NBCNews,,39,54,145,"“Right now, we've seen particularly troubling instances of discrimination directed at Asian communities, particularly in Chinese community,” New York City Mayor de Blasio said. https://nbcnews.to/3aUBadY - @NBCAsianAmerica",,@NBCAsianAmerica,,1238312349968318465,https://twitter.com/NBCNews/status/1238312349968318465
2020-03-13 03:51:44,johnauthers,,5,36,64,"It's an Asian session where there's so much red on the screen you almost feel you could warm your hands with it. I can easily understand why a lot of NY traders are hoping circuit breakers will intervene and let them go home early for the weekend... pic.twitter.com/MVnA4bswHx",,,,1238311757975826438,https://twitter.com/johnauthers/status/1238311757975826438
2020-03-13 03:48:43,Scholars_Stage,,2,24,221,"USA has a lot of political dysfunction, but having lived in three Asian nations and studied others carefully as part of my career not at all convinced USA bureaucracy is the worst of the bunch. In my experience US bureaucrats often faaaaaar more responsive than Asian ones.",,,,1238310999926755328,https://twitter.com/Scholars_Stage/status/1238310999926755328
2020-03-13 03:45:12,KTH_ASIA,,4,250,552,"Taehyung's 'Sweet Night"" OST for 'Itaewon class' will be out in march 13 @6pm KST! These will be our HASHTAGS: #.SweetNightOutNow #.SweetNightByTaehyung #.SweetNightOST #.우리의_SweetNight_태형 #.태형이의_단밤은_달콤해 Asian armys, we can do this! #SweetNightCountdown @BTS_twtpic.twitter.com/u7S07etayw",,@6pm @BTS_twtpic,# # # # # #SweetNightCountdown,1238310114576064513,https://twitter.com/KTH_ASIA/status/1238310114576064513
2020-03-13 03:44:38,PhilstarNews,,80,786,968,"Among most Southeast Asian countries, the Philippines so far has the highest running mortality rate from COVID-19 at 9.62%. This is more than double the global average of 3.6% and higher than mainland China's 3.91%. Get live updates on #COVID19 here: http://bit.ly/live-covid pic.twitter.com/dRmkUCdQS9",,,#COVID19,1238309970241679361,https://twitter.com/PhilstarNews/status/1238309970241679361
2020-03-13 03:41:38,jodieegrace,elijahdaniel,1,20,474,"even better go to the small family owned grocery stores, especially ones owned by Asian families, they could use the business and have everything in stock!!",,,,1238309214310649857,https://twitter.com/jodieegrace/status/1238309214310649857
2020-03-13 03:34:54,aubs_dancek,,2,23,128,"my favorite moment from impromptu asian nigh. I wish all the seniors got the ending they deserved... pic.twitter.com/1kor0lTfK4",,,,1238307521900789761,https://twitter.com/aubs_dancek/status/1238307521900789761
2020-03-13 03:29:36,GodzillaMendoza,,8,97,520,"Considering people are being such assholes to them lately, let's all come together and support the Asian community wherever you live. Help them keep the lights on and support their businesses because they've been unfairly affected by this.",,,,1238306187696730114,https://twitter.com/GodzillaMendoza/status/1238306187696730114
2020-03-13 03:25:00,Koreaboo,,37,105,623,"Asian Woman Attacked In New York City Amid Spread Of Xenophobia Due To Coronavirus (COVID-19) Pandemic https://www.koreaboo.com/news/asian-woman-attacked-in-new-york-city-amid-spread-xenophobia-in-midst-coronavirus-pandemic/ …",,,,1238305029364174848,https://twitter.com/Koreaboo/status/1238305029364174848
2020-03-13 03:22:27,mkvenu1,,196,489,1899,"Swine Flu 2009, a pandemic, killed half a million worldwide & over 1.2 lakh in US but less than 2600 in India, a minuscule ratio of population. In Asian Flu 1968 1-4 million died worldwide but Indian deaths were about 1500, writes Dr.Shah Alam in IE. Is it Indian immune system?",,,,1238304389816676353,https://twitter.com/mkvenu1/status/1238304389816676353
2020-03-13 03:22:27,rinbadrudin,Jomkitamy,77,36588,32282,"asian mom will use one for all. as long it still sharp https://twitter.com/Jomkitamy/status/1238280005488082944 …",,,,1238304388457697281,https://twitter.com/rinbadrudin/status/1238304388457697281
2020-03-13 03:14:37,paulsperry_,,150,1350,2072,"FOLLOWING PANDEMICS ALL ORIGINATED FROM CHINA: COVID-19 (2019) SARS (2003) HONG KONG FLU (1968) ASIAN FLU (1957)",,,,1238302416308703237,https://twitter.com/paulsperry_/status/1238302416308703237
2020-03-13 03:13:00,azcentral,,56,45,129,"As coronavirus spreads across the U.S., Asian Americans share how racism and microaggressions have, too. pic.twitter.com/zX36EEhhLI",,,,1238302009301905413,https://twitter.com/azcentral/status/1238302009301905413
2020-03-13 03:11:35,mamaa_ari,,3,9,175,"This is our favorite fast chinese food. We decided to stop and take it home after grocery shopping and a place that is usually PACKED was completely empty. This CV is harming so many businesses, especially asian run businesses. Please take the virus seriously, but don’t be racist pic.twitter.com/fGwn7Mve2c",,,,1238301652932792320,https://twitter.com/mamaa_ari/status/1238301652932792320
2020-03-13 02:58:41,loversinfilm,decalkosmos,24,11334,32814,"please go support asian owned restaurants this breaks my heart https://twitter.com/decalkosmos/status/1238276778524885000 …",,,,1238298407762042880,https://twitter.com/loversinfilm/status/1238298407762042880
2020-03-13 02:51:50,AJENews,,6,76,100,"Global wipeout: Asian stocks deepen fall over virus panic https://aje.io/qe78q pic.twitter.com/zSXUUzijo6",,,,1238296684192464897,https://twitter.com/AJENews/status/1238296684192464897
2020-03-13 02:40:30,ConstantinoX,,4,31,79,"Even discounting Pakistanis, China now attracts as many South Asian students as India. Will this affect Indian soft power in the neighbourhood? How can Delhi increase educational connectivity to win hearts and minds? I write with Aakshi Chaba in HT: https://www.hindustantimes.com/analysis/china-is-the-new-hub-for-south-asian-students/story-ab5ugWNnxaOeSUR8nnRnEN.html …pic.twitter.com/i3jQSQd6zI",,,,1238293830681513985,https://twitter.com/ConstantinoX/status/1238293830681513985
2020-03-13 02:39:11,paulsperry_,,126,1454,2827,"2020 will go down as the BIG AMERICAN FREAKOUT thanks to anti-Trump MSM overhyping COVID-19. Here is some perspective: The Hong Kong Flu killed 34,000 in the US in 1968-69 The Asian Flu killed 70,000 in the US in 1957-58",,,,1238293501676335104,https://twitter.com/paulsperry_/status/1238293501676335104
2020-03-13 02:27:09,chadfelixg,nytdavidbrooks,10,43,179,"Well there was that whole FDR putting Asian Americans in concentration camps thing... https://twitter.com/nytdavidbrooks/status/1238265080510373888 …",,,,1238290471451009025,https://twitter.com/chadfelixg/status/1238290471451009025
2020-03-13 02:26:14,gamespite,,62,967,4647,"FYI, your stupider breed of hoarder is also racist, so if you need pantry essentials, check your local Asian grocery",,,,1238290242798526464,https://twitter.com/gamespite/status/1238290242798526464
2020-03-13 02:00:50,AP,,28,191,240,"Japan's Nikkei 225 plunges 10%, many regional markets down about 7% as Asian shares extend coronavirus panic selling. http://apne.ws/pCKlFti",,,,1238283848783474688,https://twitter.com/AP/status/1238283848783474688
2020-03-13 02:00:07,vantescafe,RavenWood505,3,0,465,"GDHDHDHDDHJD they have the highest case of covid outside china... idk if it's pure ignorance or yall just selective towards asian ppl",,,,1238283670600835072,https://twitter.com/vantescafe/status/1238283670600835072
