date,username,to,replies,retweets,favorites,text,geo,mentions,hashtags,id,permalink
2020-03-07 23:59:19,SpencerKlavan,,24,94,779,"An atheist friend once said to me that Asian immigrants only become Christian in the West because they get lonely and church is a place to go. I thought, what a strange way to try and indict a religion—by saying it creates a home where lost people feel welcome and beloved.",,,,1236441330613542912,https://twitter.com/SpencerKlavan/status/1236441330613542912
2020-03-07 23:55:00,NaturewatchTH,,5,26,161,"Asian Openbill not a particularly attractive stork in my opinion. I snapped this yesterday as there aren't many about at the moment. On close inspection I noticed the radius/ulna(?) are visible under each wing. Is this normal in Storks? @Avibasepic.twitter.com/eKDWal4hcZ",,@Avibasepic,,1236440241541541888,https://twitter.com/NaturewatchTH/status/1236440241541541888
2020-03-07 23:43:32,Xtina_Dracarys,,2,15,68,"Christina Aguilera is really the first Asian, latina, black woman ever and I respect that",,,,1236437359123730432,https://twitter.com/Xtina_Dracarys/status/1236437359123730432
2020-03-07 23:37:51,Doaud_,,2,7,139,"Are you even asian if you don’t call yogurt dahi?",,,,1236435927381282820,https://twitter.com/Doaud_/status/1236435927381282820
2020-03-07 23:35:21,TPSOperations,,1,131,18,"MISSING: Nandanie, 17 - Last seen Mar 5, 4:30 pm, Jane St + Finch Av W - Woman, South Asian, 5'2, 150, medium build - Dark complexion, brown eyes, long straight brown hair - Black jacket, black pants, grey top - There is no picture available #GO475257 ^dh",,,#GO475257,1236435299590459393,https://twitter.com/TPSOperations/status/1236435299590459393
2020-03-07 23:32:25,Asian_Love4,,0,49,59,"I’ll neverrrrr hate another female over a man yanno cus we all know juuuust how they go",,,,1236434558914043905,https://twitter.com/Asian_Love4/status/1236434558914043905
2020-03-07 23:29:09,glokhy,,7,21,148,"just fucked an asian bitch using hand sanitiser as lube, I ain’t taking any risks today",,,,1236433737224724482,https://twitter.com/glokhy/status/1236433737224724482
2020-03-07 23:27:04,ChliGotSeoul,MrInappr0pri8,4,50,217,"Meanwhile the mother of this child hasn’t ordered Chinese food in weeks and won’t get on the same elevator as an Asian person https://twitter.com/MrInappr0pri8/status/1235992948531056640 …",,,,1236433213746294790,https://twitter.com/ChliGotSeoul/status/1236433213746294790
2020-03-07 22:59:46,AshleeMPreston,Elder_Mike_,6,51,171,"Being afraid to let an Asian child come to your kid’s birthday party, avoiding Chinatown or other Asian communities, blaming it on “what Asian people eat,” not letting Asian employees work the booth at festivals for fear sales will drop—and countless other gut-wrenching scenarios https://twitter.com/Elder_Mike_/status/1236421880778653697 …",,,,1236426341823602688,https://twitter.com/AshleeMPreston/status/1236426341823602688
2020-03-07 22:56:57,kimmythepooh,,5,18,306,"The literal only upside to coronavirus is that as an asian woman, you can finally walk freely as the racist dudes with yellow fever will now subscribe to the same asian sick man stereotypes and stay the fk away",,,,1236425636119564288,https://twitter.com/kimmythepooh/status/1236425636119564288
2020-03-07 22:56:30,noahreservation,,8,4,236,"Just heard two people talking about boba but they kept calling it tea balls No, they weren’t Asian",,,,1236425519425556484,https://twitter.com/noahreservation/status/1236425519425556484
2020-03-07 22:52:56,somebadideas,,3,2,76,"Man I really picked the wrong week to be a hypchondriac Asian American in NYC with a cold and compulsive obsessive research interests and insomnia",,,,1236424621425115136,https://twitter.com/somebadideas/status/1236424621425115136
2020-03-07 22:39:19,prof_erikalee,prof_erikalee,2,50,103,"And now this: citing the @NPRCodeSwitch #coronavirus & #xenophobia episode, Brookline (MA) Asian American Family Network launched a campaign to help Asian businesses impacted by virus stigma. https://brookline.wickedlocal.com/news/20200306/brookline-residents-support-asian-restaurants-impacted-by-coronavirus-stigma …https://twitter.com/prof_erikalee/status/1235406932795510784 …",,@NPRCodeSwitch,#coronavirus #xenophobia,1236421196389834752,https://twitter.com/prof_erikalee/status/1236421196389834752
2020-03-07 22:37:55,AshleeMPreston,,10,48,233,"Whenever I see people using the Coronavirus to justify their racism toward Asian people, it reminds me of when I was a kid and White kids were saying Black people carried AIDS because Africans had sex with monkeys and brought it to America. My little self-esteem was crushed.",,,,1236420843011375104,https://twitter.com/AshleeMPreston/status/1236420843011375104
2020-03-07 22:26:08,shomaristone,,27,137,162,"JUST IN: N.Y. Subway Rider Sprays Asian Man With Febreze in Possible Hate Crime. The Asian community has seen an uptick in racist incidents since the outbreak of the #Coronavirus, which began in China. ""I don't want him under me!...Tell him to move!""https://www.nbcwashington.com/news/national-international/irate-subway-passenger-sprays-asian-man-with-air-freshener-over-coronavirus-concerns/2233965/ …",,,#Coronavirus,1236417879467274246,https://twitter.com/shomaristone/status/1236417879467274246
2020-03-07 22:25:42,CentipedeMouse,paxthedog,16,3,467,"I love the idea that using Comet in bathrooms is seen as uniquely Asian. Or that any group of people before Coronavirus was regularly hitting buttons with elbows.",,,,1236417771254222850,https://twitter.com/CentipedeMouse/status/1236417771254222850
2020-03-07 22:23:21,BeijingPalmer,schlaf,1,10,78,"nah it's because there's a big East Asian presence and people's grandmothers (or their co-worker's grandmothers) were trapped in their house in Guangdong or worrying about masks in Hong Kong https://twitter.com/schlaf/status/1236379538814316549 …",,,,1236417176451645440,https://twitter.com/BeijingPalmer/status/1236417176451645440
2020-03-07 22:00:14,misterperfekt,_Kayaaaaaaaaaaa,1,5,302,"And he has an Asian wife. She cooking with seasoning and giving him all the anti-aging secrets lol",,,,1236411361401245696,https://twitter.com/misterperfekt/status/1236411361401245696
2020-03-07 21:15:40,zaichishka,emmawehipeihana,2,17,41,"""In New Zealand, Pākehā women earn between $3 and $6 more per hour than Māori, Pasifika and Asian women. For as long as 'more women on corporate boards' is the only solution we talk about, the gap will persist."" https://twitter.com/emmawehipeihana/status/1236382891879219200 …",,,,1236400144192438272,https://twitter.com/zaichishka/status/1236400144192438272
2020-03-07 21:06:54,BTSDailyCharts,,8,491,331,"100 Asian Heartthrobs — 2020 Battle Round Vote for Jimin [https://www.starmometer.com/2020/03/07/100-asian-heartthrobs-2020-battle-round-ten-vs-jimin/ …] Vote for Jin [https://www.starmometer.com/2020/03/06/100-asian-heartthrobs-2020-battle-round-xiao-zhan-vs-kim-seokjin/ …] Vote for Jungkook [https://www.starmometer.com/2020/03/05/100-asian-heartthrobs-2020-battle-round-jungkook-vs-taeyong/ …] #BoywithLuv #BestMusicVideo #iHeartAwards @BTS_twt",,@BTS_twt,#BoywithLuv #BestMusicVideo #iHeartAwards,1236397938122915843,https://twitter.com/BTSDailyCharts/status/1236397938122915843
2020-03-07 23:54:35,notagain_su,,1,14,45,"#NotAgainSU stands firmly against anti-Asian racism and xenophobia that has been particularly targeting Chinese national and international students. pic.twitter.com/g0BNAD5BJ0",,,#NotAgainSU,1236440137871097857,https://twitter.com/notagain_su/status/1236440137871097857
2020-03-07 23:47:44,WomxnWisdom,,1,15,18,"If you are interested in leading a workshop to support the well-being of young South Asian & Tamil womxn, apply today! Conference is on May 30, 2020 and will be in Markham. Link to apply to be a facilitator https://docs.google.com/forms/d/e/1FAIpQLSe-lKAK6wtz0kwFvG0C-FP6KjfkbAwwq3mbAYe-Pde5wmnlUQ/viewform …pic.twitter.com/CtIu6gPjrk",,,,1236438413424943104,https://twitter.com/WomxnWisdom/status/1236438413424943104
2020-03-07 23:29:21,tiffani,Elder_Mike_,5,7,68,"Was leaving hospital the other day and got an Asian Lyft driver. He said a lot of people had been cancelling on him as their driver smh. https://twitter.com/Elder_Mike_/status/1236421880778653697 …",,,,1236433788202127360,https://twitter.com/tiffani/status/1236433788202127360
2020-03-07 23:27:47,LindefjeldJ,MayorBowser,1,8,111,"@MayorBowser @_DCHealth my barber made a racist comment about an Asian woman wearing a mask on the @wmata. Pls remind 1. wearing a mask =/= sick & 2. The virus is not an Asian illness. We need to embrace our Asian neighbors & reassure them that they are safe here.",,@MayorBowser @_DCHealth @wmata,,1236433393430257664,https://twitter.com/LindefjeldJ/status/1236433393430257664
2020-03-07 23:25:10,QyieshaS,chico_dykey,0,3,124,"It was this Asian man at Walmart and my mom was having a conversation with him. He thanked her so many times for not being rude to him. People are being rude for no reason",,,,1236432733926305792,https://twitter.com/QyieshaS/status/1236432733926305792
2020-03-07 23:15:45,SenDougJones,,6,16,80,"Big thanks to @Bassmaster for coming to Alabama for its 50th #BassmasterClassic! It was great to get out on Lake Guntersville today to see some of the action and talk w/ Wade White about how we can protect our lakes from the spread of invasive Asian Carp. pic.twitter.com/V9GjnAcErg",,@Bassmaster,#BassmasterClassic,1236430365985816577,https://twitter.com/SenDougJones/status/1236430365985816577
2020-03-07 23:10:48,ProfVemsani,SuhagAShukla,0,13,21,"Hahaha, the ‘red herring’ on the table is gone. Yes, Hinduphobia is out now- media, politics, so called South Asian organizations, Wikipedia too many to name ... https://twitter.com/SuhagAShukla/status/1236414331505577984 …",,,,1236429119740620800,https://twitter.com/ProfVemsani/status/1236429119740620800
2020-03-07 23:09:33,SequoiaN,,2,2,51,"Really wish the damn media would stop portraying the coronavirus as an Asian thing. 1) It’s mostly white people who are infected in America for one thing. 2) We’re all going to get it sooner or later. Are you eliminating Asian food from your diet forever?",,,,1236428805025210369,https://twitter.com/SequoiaN/status/1236428805025210369
2020-03-07 23:05:23,lj_lawless,,3,6,29,"EVERYONE WASH YOUR HANDS, SIT DOWN, AND STOP BEING RACIST TO ASIAN PEOPLE GODDAMN IT",,,,1236427757392932864,https://twitter.com/lj_lawless/status/1236427757392932864
2020-03-07 22:47:14,ssitou,,0,5,23,"For organisers of #IWD events, please think about the #diversity of women you select. For every female who was inspired seeing @JuliaGillard become our first female PM, some of us were equally proud of seeing @SenatorWong as the 1st Asian woman in cabinet. Diversity matters",,@JuliaGillard @SenatorWong,#IWD #diversity,1236423188403212288,https://twitter.com/ssitou/status/1236423188403212288
2020-03-07 22:42:33,Shakil_ahmed21,,1,7,18,"asian boys after they slide their crush’s dms with ‘Eid Mubarak’ pic.twitter.com/LELVs89mhP",,,,1236422010005266432,https://twitter.com/Shakil_ahmed21/status/1236422010005266432
2020-03-07 22:38:23,MikeLovesTacosX,,0,6,18,"Call her, @nobu_sakakibara. Can't go wrong with a 3x Olympic gold medalist! Nevermind all those World Championship and Asian Game gold medals. 1x ratings grab or not. Do it. https://twitter.com/MikeLovesTacosX/status/1236419750848274437 …pic.twitter.com/UlOOk3roC4",,@nobu_sakakibara,,1236420962381443072,https://twitter.com/MikeLovesTacosX/status/1236420962381443072
2020-03-07 22:24:29,kevinwardrop,moistdrippings,1,3,205,"3rd Act Payoff: George puts on a mask quickly but when he looks up there is a large Asian family and it looks like he put it on after seeing them. Embarrassed, he then chases them yelling ""It's for Corona Cough"" but runs past people he had previously screamed the opposite, mortir",,,,1236417465170776064,https://twitter.com/kevinwardrop/status/1236417465170776064
2020-03-07 22:20:40,ElloEllenOh,,12,9,222,"Maybe they didn't see the first car. Maybe those women weren't glaring but just have intense angry bitch faces. Maybe I'm just being paranoid. At any other time I'd wonder if I smelled or something. But this feels different. I can't help but think they avoided me bc I'm Asian.",,,,1236416502561157132,https://twitter.com/ElloEllenOh/status/1236416502561157132
2020-03-07 22:20:39,ElloEllenOh,,2,6,179,"At Dulles I head to the train that connects the terminal to the gates. Two older women glare at me. I don't know why. I haven't coughed. They keep glaring. I wonder if I have boogers on my face. There's like 20ish people waiting. I think I'm the only Asian on the platform.",,,,1236416498983452673,https://twitter.com/ElloEllenOh/status/1236416498983452673
2020-03-07 22:06:23,sami_automatik,,4,5,31,"Saw an article about how a lot of #Asian owned businesses are taking a hit due to #COVID19 related racism. It was for my particular city but I don't doubt it's happening everywhere I say those of us who know better up our patronage to help them out & show solidarity",,,#Asian #COVID19,1236412908369858562,https://twitter.com/sami_automatik/status/1236412908369858562
2020-03-07 22:01:15,chengela,,12,5,55,"It was only a matter of time until someone yelled that I was spreading disease when I was merely walking down the street. But I admit I did not expect this to happen in...Chinatown. In such an environment, how does one choose which Asian person to insult?",,,,1236411618025709574,https://twitter.com/chengela/status/1236411618025709574
2020-03-07 21:51:21,wEojk5SJWUVb3hV,wEojk5SJWUVb3hV,7,79,70,"A good friend of mine got shoved by strangers, yelled at, kicked out of public transportations because she is Asian. She did not want to disclose the specific location but it happened near Toronto, Canada. #racism #Coronavirushttps://twitter.com/wEojk5SJWUVb3hV/status/1235704111024103426 …",,,#racism #Coronavirushttps,1236409126139248640,https://twitter.com/wEojk5SJWUVb3hV/status/1236409126139248640
2020-03-07 21:47:51,jessemermell,,8,8,36,"The Brookline Asian American Family Network is encouraging people to visit to the great Asian restaurants in town to combat the negative economic impacts of Coronavirus. Find a restaurant on the list near you. #mapoli #ma04 https://brookline.wickedlocal.com/news/20200306/brookline-residents-support-asian-restaurants-impacted-by-coronavirus-stigma …pic.twitter.com/2oEgkf4NWq",,,#mapoli #ma04,1236408244542865408,https://twitter.com/jessemermell/status/1236408244542865408
2020-03-07 21:13:56,explodikid,,2,7,142,"a small win but a win to me nonetheless: darker/tan east asian characters pic.twitter.com/xDYxiwy3vf",,,,1236399708454580224,https://twitter.com/explodikid/status/1236399708454580224
2020-03-07 21:08:55,kwong__,PittsburghPG,17,141,404,"Support Asian restaurants in Pittsburgh that are seeing a decline in their businesses due to racist coronavirus fears. Szechuan Express, Ginza, Pho Minh, Thai Gourmet, Taiwanese Bistro Cafe 33, Soju, Nak Won Garden, Ban Mi & Ti, Everyday Noodles are just a few of my favorites! https://twitter.com/PittsburghPG/status/1235985004016144384 …",,,,1236398445151358976,https://twitter.com/kwong__/status/1236398445151358976
2020-03-07 21:06:12,ProfHsieh,mrsjjee,0,9,24,"This is heartbreaking. Please read this. Please don’t give into xenophobic anti-Chinese/ anti-Asian / anti-Asian American racism. Please don’t let this public health issue dehumanize people in our community. https://twitter.com/mrsjjee/status/1236324370437586945 …",,,,1236397763702620161,https://twitter.com/ProfHsieh/status/1236397763702620161
2020-03-07 21:02:25,AxelGinger,,0,12,50,"#GingerPlantOfTheWeek is Alpinia zerumbet — the typical representative of the Asian species commonly known as SHELL GINGERS. It is now flowering in the Tropical Lowlands glasshouse with public access @TheBotanics in Edinburgh http://data.rbge.org.uk/living/19751777A …pic.twitter.com/UW9iMv1Vnr – at Royal Botanic Garden",,@TheBotanics,#GingerPlantOfTheWeek,1236396811776151552,https://twitter.com/AxelGinger/status/1236396811776151552
2020-03-07 20:59:57,CarlosR,,136,273,6103,"G2 the worst #1 team EU has ever produced lol Like do they really think that cheese shit where dumb luck is more important than skill will work against the asian teams? Shall we rewatch 2019 and see how they got stomped in the end? That makes me sick to watch lol",,,#1,1236396188364083200,https://twitter.com/CarlosR/status/1236396188364083200
2020-03-07 20:57:07,BICONlC,b0und_to_xtina,4,11,111,"Her Asian genes poppin https://twitter.com/b0und_to_xtina/status/1236350885271351299 …",,,,1236395476557144066,https://twitter.com/BICONlC/status/1236395476557144066
2020-03-07 20:44:09,Thristy4Spunk,,3,70,369,"Asian Spunk Face pic.twitter.com/VeLcNKd5GY",,,,1236392213506121729,https://twitter.com/Thristy4Spunk/status/1236392213506121729
2020-03-07 20:25:38,malcolmbarrett,JayR1085,7,6,131,"The show, that let go of two of its lead Asian actors because they wanted pay parity with the White actors? https://twitter.com/JayR1085/status/1236375157796732931 …",,,,1236387555857379331,https://twitter.com/malcolmbarrett/status/1236387555857379331
2020-03-07 20:24:00,Grace4NY,,6,92,234,"If you're a news outlet using a photo of Chinatown, Flushing, or just any, unrelated Asian in your coronavirus articles, you're perpetuating racism. Cut it out & start working with us to combat this misconception causing real harm in our communities. https://www.refinery29.com/amp/en-us/2020/03/9496462/coronavirus-racism-asian-photos-nyc-chinatown …",,,,1236387144723243009,https://twitter.com/Grace4NY/status/1236387144723243009
2020-03-07 20:21:29,MaxRose4NY,,11,30,411,"Incredible lunch at Golden Palace in Brooklyn today! It's been an unnecessarily tough time for the Asian community, and small business owners in particular. Let's be sure to have their backs pic.twitter.com/cUBSVMDUQX",,,,1236386508430618626,https://twitter.com/MaxRose4NY/status/1236386508430618626
2020-03-07 20:20:07,AdvancedMaushi,,7,54,215,"Remembering the less spoken women achievers of India: - Anna Chandy: First Indian High Court Judge (1959) - Kamaljit Sandhu: First to win a Gold in Asian Games (1970) - Bachendri Pal: Climbed Mt. Everest (1984) - Justice M.Fathima Beevi: First Woman SC Judge (1989) #WomensDay",,,#WomensDay,1236386166133280768,https://twitter.com/AdvancedMaushi/status/1236386166133280768
2020-03-07 20:15:55,chico_dykey,,12,1124,5662,"yesterday i decided to take an uber to class..me & my driver made small talk, after we reached my school, my uber driver said thank you for not canceling my ride when i saw he was asian. hes been struggling to get rides due to coronavirus panic. i was devastated cause are yall fr",,,,1236385106769489921,https://twitter.com/chico_dykey/status/1236385106769489921
2020-03-07 20:03:57,SoaRCrickets,,51,16,433,"its okay to be white its okay to be black its okay to be hispanic its okay to be asian its okay to be a woman its okay to be a man its okay to be gay its okay to be straight its okay to be yourself but it is never ok to steal tweets",,,,1236382096496545792,https://twitter.com/SoaRCrickets/status/1236382096496545792
2020-03-07 19:56:41,SohrabBaluch,,1,35,32,"Amnesty annual report2019 is incredible in context to HR violations in Pakistan. Balochistan is facing worst human rights violations & neglecting it prejudice the report. @amnesty should seriously reconsider its appointees &researcher of South Asian desk. https://www.amnesty.de/jahresbericht/2019/regionalkapitel-asien-und-pazifik …",,@amnesty,,1236380270422626304,https://twitter.com/SohrabBaluch/status/1236380270422626304
2020-03-07 19:48:29,PaulMer52,,2,33,77,"When you look at what has happened to #TommyRobinson daughter being molested by an Asian Man. Is it a bit of wonder why we dont want Muslim or Pakistanis in this country anymore. We have petitions going around so we can see the full scale of Grooming Gangs. #TommyRobinson Hero",,,#TommyRobinson #TommyRobinson,1236378203188613125,https://twitter.com/PaulMer52/status/1236378203188613125
2020-03-07 19:47:55,AGramuglia,,24,131,470,"Birds of Prey has broken a profit without the majority of the Asian market thanks to the Coronavirus. Anyone saying this film is a failure or box office flop no longer has a leg to stand on. pic.twitter.com/LzPzpNIKC6",,,,1236378062188617728,https://twitter.com/AGramuglia/status/1236378062188617728
2020-03-07 19:39:01,yasmeenxshearer,Lugisanii23,1,19,76,"i feel so bad for the stigma around this disease and how asian people get treated for it https://twitter.com/Lugisanii23/status/1236239389170307072 …",,,,1236375824225484800,https://twitter.com/yasmeenxshearer/status/1236375824225484800
2020-03-07 19:37:47,thetzechun,,15,10,368,"Clark Kent but make it Asian. pic.twitter.com/kRZfAt7KaK",,,,1236375512072605696,https://twitter.com/thetzechun/status/1236375512072605696
2020-03-07 19:36:18,originalspin,AJEnglish,11,23,150,"So as the disease slowly fades out of the Asian population and sharply amplifies among Europeans, do we think we’ll see a flip toward caucasians being shunned as potential plague sources? Sociologically curious here, not snarking. https://twitter.com/AJEnglish/status/1236201617403363329 …",,,,1236375140100792320,https://twitter.com/originalspin/status/1236375140100792320
2020-03-07 19:22:15,GoddessAsianDo1,,11,37,129,"Buuut, just because I can't talk doesn't mean I can't control everything you do. I want you wallet, your savings & your entire bank account . $end to be controlled by your Asian Goddess. { find findom finsub asianfindom finslave paypig cashslave humanatm cashcow asiandomme } pic.twitter.com/vzC67s2NfZ",,,,1236371601836240896,https://twitter.com/GoddessAsianDo1/status/1236371601836240896
2020-03-07 19:19:50,veryunfakenews,,9,303,314,"BBC Breaking Sorry, but @BBCNews haven't got time to mention the petition demanding the UK government release the ""Asian"" ""Grooming"" gang review in full. And neither have @itvnews or @SkyNews or @Channel4News or ... you get the idea.https://petition.parliament.uk/petitions/300239 …",,@BBCNews @itvnews @SkyNews @Channel4News,,1236370995818217472,https://twitter.com/veryunfakenews/status/1236370995818217472
2020-03-07 19:17:23,HeyDrMcCloud,,15,2,120,"Y’all I’m pissed as shit. I’m in the check out line. The cashier is an Asian American woman. No one is behind me and White people are being directed to her line, see her and keep going. She made a comment to me that it’s been happening to her all day!!! I’m so angry!!!",,,,1236370380144750592,https://twitter.com/HeyDrMcCloud/status/1236370380144750592
2020-03-07 19:12:49,mihirssharma,,8,18,49,"Just a reminder that if this Sangh affiliate is the South Asian outreach person for @JoeBiden that's unacceptable for a supposedly liberal party. (Note, Obama's first major S Asian appointment also had links to the RSS.) pic.twitter.com/cXbDqpijVs",,@JoeBiden,,1236369228682444800,https://twitter.com/mihirssharma/status/1236369228682444800
2020-03-07 19:12:29,drunkwxngji,,3,16,86,"hmm weird that people aren’t avoiding italian-owned businesses or italian food. weird? but people are avoiding asian owned businesses? it’s almost like. people just. like to be racist! wow!",,,,1236369146511646721,https://twitter.com/drunkwxngji/status/1236369146511646721
2020-03-07 19:00:02,MayoClinic,,8,24,48,"You may have it in your spice rack or enjoy it in South Asian meals. But can #turmeric, an ancient golden-yellow spice, be good for you? These FAQs can answer some of your questions about turmeric's health benefits. https://mayocl.in/2TaizDf pic.twitter.com/ORvQbVcA9J",,,#turmeric,1236366010690789376,https://twitter.com/MayoClinic/status/1236366010690789376
2020-03-07 18:59:28,Blackamazon,,3,21,65,"Italy seems to a constant point of infection. China ( as we know) is already seeing a tick down. Vietnam is the worlds model but most of the news stories are showing Asian people. Why isn’t this being animated with shots of Venice?",,,,1236365868516302848,https://twitter.com/Blackamazon/status/1236365868516302848
2020-03-07 18:55:34,loisbeckett,,4,42,64,"Three gun store owners--one in California, two in Washington state--told @teamtrace they had seen an increase in the number of Asian American customers buying guns in the past weeks, and citing fears that they might be violently targeted over coronavirus: https://www.thetrace.org/2020/03/coronavirus-gun-sales-washington-california-asian-americans/ …",,@teamtrace,,1236364887787319297,https://twitter.com/loisbeckett/status/1236364887787319297
2020-03-07 18:38:56,WAYVUNION,,1,86,79,"VOTING FOR TEN EVENT: Starmometer's 100 Asian Heartthrobs 2020 Round 3 VOTING: unlimited TIME REMAINING: 6 days 12h DEADLINE: March 14, 3pm CST LINK: http://www.starmometer.com/2020/03/07/100-asian-heartthrobs-2020-battle-round-ten-vs-jimin/ …",,,,1236360701045665792,https://twitter.com/WAYVUNION/status/1236360701045665792
2020-03-07 18:33:31,lightschoice,,88,4727,12143,"Can we take a hot minute to talk about Matthew? He grew up in La as one of the few asian kids in his area, and because of that dealt with slurs and discrimination most his youth. He was in college to become a phychiatrist for troubled youth when his mom signed him up +",,,,1236359338752524288,https://twitter.com/lightschoice/status/1236359338752524288
2020-03-07 18:22:04,diepthought,,1,3,96,"SIX has the following: girl groups, empowerment ballads, Tudor history, a 4’11” Asian queen, VOCALS. Finally someone took some of my favorite things and put them in a musical. I feel so seen.",,,,1236356458142412802,https://twitter.com/diepthought/status/1236356458142412802
