date,username,to,replies,retweets,favorites,text,geo,mentions,hashtags,id,permalink
2020-03-12 06:24:41,OpIndia_com,,0,29,65,"Nikkei Asian Review writes a strange, ill-informed article on PM Modi: Here are some things they got wildly wrong https://www.opindia.com/2020/03/nikkei-asian-review-article-lie-pm-modi-fact-check/ …",,,,1237987860831031296,https://twitter.com/OpIndia_com/status/1237987860831031296
2020-03-12 06:00:04,ABC7,,39,76,263,"Some gun stores in Asian communities seeing sales surge amid fears over #coronavirushttps://abc7.la/2IF2VuP",,,#coronavirushttps,1237981665160388609,https://twitter.com/ABC7/status/1237981665160388609
2020-03-12 05:59:56,kxinngzaiah,,2,18,63,"Corona virus does not give people a reason to be racist towards asian people!!",,,,1237981633661112325,https://twitter.com/kxinngzaiah/status/1237981633661112325
2020-03-12 05:59:02,tswiftan,turismoivyluna,37,30,909,"it’s not about. it’s about associating bts and the virus. you know damn well he’s doing it because they are Asians. the amount of discrimination asian people are facing right now and funny enough it was Europe who spread it everywhere.",,,,1237981407286304768,https://twitter.com/tswiftan/status/1237981407286304768
2020-03-12 05:53:10,chaturaalwis,,10,51,296,"Ayubowan! Wannakkam! Namaste ! Prince Charles was seen practising traditional Asian way of greeting amid coronavirus concerns . @PRINCECHARLEZpic.twitter.com/vEK1LzqrhV",,@PRINCECHARLEZpic,,1237979931599966208,https://twitter.com/chaturaalwis/status/1237979931599966208
2020-03-12 05:47:49,TechCrunch,,2,16,33,"Asian stock markets fall as COVID-19 is declared a pandemic https://tcrn.ch/2Qa7m4O by @catherineshupic.twitter.com/zcrUs7MT9S",,@catherineshupic,,1237978581734756353,https://twitter.com/TechCrunch/status/1237978581734756353
2020-03-12 05:44:21,SORDHAND,,1,20,136,"the relationship between rodrigue and felix is just so painfully ""asian parent who wants the best for their kid"" and ""reluctant kid who doesn't want to be bound to tradition but also lowkey feels obligated to be""",,,,1237977713044054017,https://twitter.com/SORDHAND/status/1237977713044054017
2020-03-12 05:44:09,rianaadams,,0,12,110,"i continually check my privilege as a white passing mixed person but can yall please stop trying to erase the fact that i am ASIAN just to spite me? i love being asian, i grew up only attached to my asian culture, i identify as ASIAN and always will so please stop erasing that",,,,1237977661600698368,https://twitter.com/rianaadams/status/1237977661600698368
2020-03-12 05:21:35,army_cavite,,11,253,185,"Calling all #BTSARMY around the world to help us vote for #KimSeokJin at Starmometer 100 Asian Heartthrobs 2020 Battle Round – votings are until March 13 only! Please widen the gap! #iHeartAwards #BestMusicVideo #BoyWithLuv @BTS_twtpic.twitter.com/Ku8ktCFt3U",,@BTS_twtpic,#BTSARMY #KimSeokJin #iHeartAwards #BestMusicVideo #BoyWithLuv,1237971982110486528,https://twitter.com/army_cavite/status/1237971982110486528
2020-03-12 05:15:52,foyinog,CNN_Oppmann,1,190,296,"italy was doing real damage while people were busy being racist and xenophobic towards asian people. unreal scenes https://twitter.com/CNN_Oppmann/status/1237902721216323590 …",,,,1237970544101818369,https://twitter.com/foyinog/status/1237970544101818369
2020-03-12 05:04:45,weiyingthinker,,1,36,93,"wwx going “just because i asked if he wants it doesn’t mean im buying it for him” is such a classic asian parent move pic.twitter.com/8DOBnhpeow",,,,1237967746735824896,https://twitter.com/weiyingthinker/status/1237967746735824896
2020-03-12 04:57:11,washikirei,,0,214,23,"Asian have been founded more cases on COVID-19 Westerners : Asians are over panic, just a flu. But get out of my country, Virus!! WHO : Just a epidemic. Westerners are founded more cases on COVID-19 Westerners : Med masks sold out. Toilet papers sold out. WHO : It’s pandemic.",,,,1237965842433732608,https://twitter.com/washikirei/status/1237965842433732608
2020-03-12 04:53:05,__stendo__,,2,26,381,"lil Uzi’s bio used to be “Asian on the inside”... he drops his album this week and also corona virus spreads...coincidence",,,,1237964810257563649,https://twitter.com/__stendo__/status/1237964810257563649
2020-03-12 04:48:04,jeanqasaur,,5,4,107,"TFW you Asian parent your own parents. pic.twitter.com/Fwf4myOgxl",,,,1237963548665327617,https://twitter.com/jeanqasaur/status/1237963548665327617
2020-03-12 04:45:57,PocPub,,0,13,16,"Applications for @kundimanforever’s Mentorship Lab closes this Sunday, March 15th! NYC-based Asian American writers will receive $1000 stipend & mentorship meetings, writing workshops & master classes from one of the mentors. There is no application fee. http://kundiman.org/mentorship-lab",,@kundimanforever,,1237963015598886913,https://twitter.com/PocPub/status/1237963015598886913
2020-03-12 04:26:24,IndianfootballH,,2,12,71,"Jarnail Singh captained Asian All Stars XI twice, in 1965 & 1966, against touring sides like Leicester City FC. He is the only Indian to hold this distinction. #IndianFootballpic.twitter.com/qnThAEKy6j",,,#IndianFootballpic,1237958092920254465,https://twitter.com/IndianfootballH/status/1237958092920254465
2020-03-12 04:07:28,itskeyon,,6,310,1176,"Pls remember none of this give you an excuse to be xenophobic towards Asian folks like..... what’s not clicking",,,,1237953328870559744,https://twitter.com/itskeyon/status/1237953328870559744
2020-03-12 04:04:00,DrewCrewWriters,,4,19,84,"We want to portray characters on screen who aren’t stereotypes — like Ace. Bess isn't a stereotypical character of Middle Eastern origin. Or George, as Asian American. Our writers’ room is diverse. We just tell stories we're going to tell naturally bc of who we are. @NogaLandau",,@NogaLandau,,1237952456203603968,https://twitter.com/DrewCrewWriters/status/1237952456203603968
2020-03-12 03:58:37,CeddyOrNot,NPR,41,8,362,"Like I told my viewers yesterday, I think even if Twitch Con NA is happening this year, I'm gonna skip this one until everyone calms down. The last thing I want is to worry about getting sick (You don't know who you'll meet at the airports) AND being harassed for being Asian. https://twitter.com/NPR/status/1235310560692121602 …",,,,1237951100549906433,https://twitter.com/CeddyOrNot/status/1237951100549906433
2020-03-12 03:46:51,jaycaspiankang,,7,2,79,"Said it before will say it again - the asian American community needs @xanga desperately right now for the exact right level of semi private conversations",,@xanga,,1237948140021399552,https://twitter.com/jaycaspiankang/status/1237948140021399552
2020-03-12 03:39:47,joe_soyar,,1,93,748,"My timeline has turned into all my Asian homies clapping back at any racist tweets they see on the TL due to the coronavirus and I’m all for it. drag those ignorant mfers",,,,1237946363494559745,https://twitter.com/joe_soyar/status/1237946363494559745
2020-03-12 03:36:51,KendallPatrice,,17,60,1435,"My @Uber driver just told me “I purposefully cancel trips on Asian passengers because of the coronavirus” I’m sorry, the virus doesn’t excuse your blatant racism Amidst this panic can we at least practice mindfulness Stand for something or be just as guilty with your silence",,@Uber,,1237945623178964994,https://twitter.com/KendallPatrice/status/1237945623178964994
2020-03-12 03:36:46,KeaganHoffman,,3,10,104,"Why are people letting racism towards Asian slide? What the fuck",,,,1237945605743210496,https://twitter.com/KeaganHoffman/status/1237945605743210496
2020-03-12 03:36:03,0heysteph,LilReese300,0,56,195,"Coronavirus is not an excuse to be racist against the Asian community https://twitter.com/LilReese300/status/1237916555297673218 …",,,,1237945421802147842,https://twitter.com/0heysteph/status/1237945421802147842
2020-03-12 03:33:35,carlyyyyynn,,0,7,78,"choose ur asian ghorlll pic.twitter.com/WUH83Zm6pi",,,,1237944804199170048,https://twitter.com/carlyyyyynn/status/1237944804199170048
2020-03-12 03:32:58,FinancialTimes,,14,263,413,"Here’s the latest coronavirus news: Asian markets markets fell after the WHO said coronavirus is a ‘pandemic’ The US suspended travel from Europe Australia launched an $11bn stimulus The NBA suspended its season Follow our live coverage: https://on.ft.com/2W6Orfg",,,,1237944645490966528,https://twitter.com/FinancialTimes/status/1237944645490966528
2020-03-12 03:20:25,MarketWatch,,1,23,43,"Asian markets resume plunge after Dow enters bear market https://on.mktw.net/2W6N93U",,,,1237941490871087106,https://twitter.com/MarketWatch/status/1237941490871087106
2020-03-12 03:10:32,floralkissy,,0,5,38,"stop! using! pictures! of! asian! people! with! masks! on! for! every! coronavirus! headline!",,,,1237939001056800773,https://twitter.com/floralkissy/status/1237939001056800773
2020-03-12 03:04:44,Yasouwildforbts,Camouflage_Wolf,31,3,777,"He still a white a$$coming for asian who did nothing to him so move",,,,1237937544131751936,https://twitter.com/Yasouwildforbts/status/1237937544131751936
2020-03-12 03:00:15,ShawnTheDon8,,16,59,146,"Y'all know this coronavirus isn't really affecting black people and the reason it's such a mass panic is because it's mostly affecting White & Asian people. The black people who have gotten it have gotten over it within a week. The media doesn't want to tell you that.",,,,1237936413301256197,https://twitter.com/ShawnTheDon8/status/1237936413301256197
2020-03-12 03:00:11,TMZ,,20,59,376,"Jeremy Lin Battling Anti-Asian Coronavirus Racism, Donates $150k http://tmz.me/VTng4iO",,,,1237936397685850112,https://twitter.com/TMZ/status/1237936397685850112
2020-03-12 02:59:01,taehyungpersxna,,1,19,75,"[coronavirus] things that are not okay - asking someone who coughs or sneezes around you if they have the coronavirus even if it’s joking - immediately thinking any Asian person has it -telling others not to go to Chinese restaurants bc they might have it - being xenophobic",,,,1237936103673532416,https://twitter.com/taehyungpersxna/status/1237936103673532416
2020-03-12 02:44:12,yumewarlock,iamchubbybunny,0,16,56,"Support your Asian American friends. We are scared. Stop calling it a China Virus. https://twitter.com/iamchubbybunny/status/1237876035590303746 …",,,,1237932375146819584,https://twitter.com/yumewarlock/status/1237932375146819584
2020-03-12 02:43:27,KaivanShroff,,1,22,140,"We just got amazing Chinese food at our local spot. Make sure to support local, and particularly Asian-owned, businesses where you can. They’ve been hit hard by Coronavirus panic. (Obviously take the precautions advised for your region first!) pic.twitter.com/XSFd5FeNuF",,,,1237932185988055041,https://twitter.com/KaivanShroff/status/1237932185988055041
2020-03-12 02:39:56,T0RONTO,,2,16,52,"Black ppl on here breaking a sweat defending an Asian community that doesn't speak up when we're going thru shit, its wild to see",,,,1237931302470500352,https://twitter.com/T0RONTO/status/1237931302470500352
2020-03-12 02:36:02,washingtonpost,,19,72,115,"Asian markets, oil fall sharply after Trump bans Europe travel https://wapo.st/2IBo0GB",,,,1237930321552838657,https://twitter.com/washingtonpost/status/1237930321552838657
2020-03-12 02:33:29,albinokid,,26,111,651,"For the people in the back: Cis actors playing trans roles in 2020 is no different from the bad old days when white actors played roles in blackface or with terrible Asian makeup. We are well past having proven that none of that should ever have happened. pic.twitter.com/aWKPtpjcWM",,,,1237929677420785664,https://twitter.com/albinokid/status/1237929677420785664
2020-03-12 02:30:22,VotingGolden,,6,139,229,"[ 100 Asian Heartthrobs 2020 Battle Round – Jungkook vs Taeyong ] We have one day to vote http://www.starmometer.com/2020/03/05/100-asian-heartthrobs-2020-battle-round-jungkook-vs-taeyong/ … #Jungkook #JeonJungKook #방탄소년단 #전정국 #방탄소년단정국 #田柾國 #ジョングク",,,#Jungkook #JeonJungKook #방탄소년단 #전정국 #방탄소년단정국 #田柾國 #ジョングク,1237928893459259393,https://twitter.com/VotingGolden/status/1237928893459259393
2020-03-12 02:23:23,ANI,ANI,1,18,105,"Bangladesh Cricket Board: Events included ‘Cricket Celebrates Mujib 100’ concert on 18 March by the legendary AR Rahman & the two Asian All-Star XI vs Rest of the World XI Twenty20 International matches at the Sher-e-Bangla National Cricket Stadium, Mirpur on 21 and 22 March. https://twitter.com/ANI/status/1237927097697353728 …",,,,1237927138071678976,https://twitter.com/ANI/status/1237927138071678976
2020-03-12 02:21:30,elerianm,elerianm,25,54,162,"With all the usual qualifications, Dow futures now indicated 1,000 points lower. Heightened risk aversion is clear in other market segments:Asian #stocks, #oil, fx, #bonds, etc This could turn uglier than today's session #economy #investors #investing @cnbc @ft #wsj @TheEconomisthttps://twitter.com/elerianm/status/1237911244356481025 …",,@cnbc @ft @TheEconomisthttps,#stocks #oil #bonds #economy #investors #investing #wsj,1237926662089502722,https://twitter.com/elerianm/status/1237926662089502722
2020-03-12 02:17:26,mahulaluu,Heyy_DoMonique,17,31,1196,"i sat next to an asian lady and she slapped me so hard when she was trying to wake me up for the snacks lmao",,,,1237925636926328833,https://twitter.com/mahulaluu/status/1237925636926328833
2020-03-12 02:14:14,krysheila,_SJPeace_,0,29,172,"I wanted to hug him. Then when I saw that people started hugging him and taking off the blindfold and mask, I started crying. Why do people seem more scared of our brothers and sisters of the Asian community than they are of the actual problem, the virus? https://twitter.com/_SJPeace_/status/1237865568696324096 …",,,,1237924832911790080,https://twitter.com/krysheila/status/1237924832911790080
2020-03-12 02:13:44,markets,,3,23,24,"U.S. futures slump more than 3%, Asian equities extend declines and the yen climbs after Trump bans travel from continental Europe to America https://trib.al/gxQn89Z",,,,1237924706558316545,https://twitter.com/markets/status/1237924706558316545
2020-03-12 02:11:07,you2nice2me,,17,60,226,"My fiance was verbally attacked on the subway to work. He is Asian, and sneezed (the 'right' way, into his arm). Things got heated when he stood up for himself. I have since canceled evening plans that involve public transportation out of fear of being attacked. #COVID19 /1",,,#COVID19,1237924049117995012,https://twitter.com/you2nice2me/status/1237924049117995012
2020-03-12 02:10:58,DavidInglesTV,,10,116,185,"Jeez. Markets in freefall. Losses on main Asian benchmarks and US/European now between 4-7% pic.twitter.com/A4oMyv7BrC",,,,1237924010995757056,https://twitter.com/DavidInglesTV/status/1237924010995757056
2020-03-12 02:10:03,SafetyPinDaily,,0,25,58,"Nancy Pelosi joins Asian American lawmakers in demanding McCarthy apology for 'bigoted' tweet || Via Politico https://www.politico.com/states/california/story/2020/03/10/pelosi-joins-asian-american-lawmakers-in-demanding-mccarthy-apology-for-bigoted-tweet-1266349 …",,,,1237923779021602816,https://twitter.com/SafetyPinDaily/status/1237923779021602816
2020-03-12 02:08:06,eugenegu,TomiLahren,88,143,3152,"It’s not about letting China off the hook. It’s about not subjecting Asian Americans to racism, bullying, and hate crimes.",,,,1237923291064438784,https://twitter.com/eugenegu/status/1237923291064438784
2020-03-12 02:06:34,maseratihottie,,4,54,240,"the anti asian racist shit y’all got going on w this virus is gross",,,,1237922902491779074,https://twitter.com/maseratihottie/status/1237922902491779074
2020-03-12 02:04:55,MaryKayHenry,,15,148,511,"There is no such thing as a foreign virus. The president needs to stop unfairly targeting immigrants, especially from the Asian American and Pacific Islander community, and travelers from other countries. Coronavirus is in the U.S. Blaming other countries will not save lives.",,,,1237922488983719942,https://twitter.com/MaryKayHenry/status/1237922488983719942
2020-03-12 01:57:22,RoseTheGod,,8,13,73,"Nah I’m done. Not even gonna load into Asian servers cuz im afraid of the corona virus",,,,1237920590335524864,https://twitter.com/RoseTheGod/status/1237920590335524864
2020-03-12 01:55:18,GolferGirl305,,7,41,125,"China. Iran. The EU. Those are the countries most infected. Despite the high Asian population in Canada, they remain relatively untouched. The EU is collateral damage. The US is for appearance. China and Iran, the target.",,,,1237920070472474625,https://twitter.com/GolferGirl305/status/1237920070472474625
2020-03-12 01:54:31,MiskwahyaAgwamo,,66,68,112,"So now we have to be mad because people aren't eating chinese or Asian takeout. Isn't that how the Coronavirus began? Eating the food? Aren't you blaming Trump for not preventing the outbreak, yet telling others it's racist to take precautions? pic.twitter.com/kM4ZwO2HYA",,,,1237919869829550080,https://twitter.com/MiskwahyaAgwamo/status/1237919869829550080
2020-03-12 01:52:34,emmamei18,kailslewis,1,6,459,"It’s a huge culture thing too. I noticed that the mom in the original video was Asian and bento boxes are so popular! If your mom didn’t make you a cute bento box for lunch, other kids make fun of you",,,,1237919380991807489,https://twitter.com/emmamei18/status/1237919380991807489
2020-03-12 01:45:48,kaushikcbasu,,54,126,383,"People should take precautions but they should also know this isn’t the biggest pandemic. (Flu 1968, 1 mill dead. Asian Flu 1956, 2 mill dead). This is causing such panic since it’s the FIRST Pandemic in the age of social media (PITASM, pronounce “pie tasm”). We’ll need the word.",,,,1237917679584808960,https://twitter.com/kaushikcbasu/status/1237917679584808960
2020-03-12 01:31:50,asmMelendez,YoungKimCA,5,21,76,"I served w/ @YoungKimCA in the Assembly & I know her heart. She is profoundly proud of her Asian American heritage & fiercely protective of all who share that heritage. This absurd accusation by her opponent shows one thing - he’s scared. And he should be. MM https://twitter.com/YoungKimCA/status/1237784617454895104 …",,@YoungKimCA,,1237914162103119872,https://twitter.com/asmMelendez/status/1237914162103119872
2020-03-12 01:25:33,Rparkerscience,,12,94,43,"CA Gun Sales Surge for Asian Americans Fearing Attacks over Corona Virus https://www.breitbart.com/politics/2020/03/11/ca-gun-sales-surge-asian-americans-fearing-attacks-corona-virus/ …",,,,1237912580624207874,https://twitter.com/Rparkerscience/status/1237912580624207874
2020-03-12 01:21:56,kimnewmoney,,5,25,139,"To be an Asian American right now... it’s tiring. I have so many words... I’m going to try to spit them out to prevent an outburst or mental break in a few months from now. On January 30th, I went to a hospital in Burbank, California to have eight vials of blood drawn to have... pic.twitter.com/ZSCrli7cYp",,,,1237911672527835137,https://twitter.com/kimnewmoney/status/1237911672527835137
2020-03-12 01:17:13,motherjuniper,,2,6,149,"Me: don’t you think it’s strange that there are no Asian character in Mario Kart. Kiki: Toad is Asian. Me: how? Kiki: mind your business.",,,,1237910482742321152,https://twitter.com/motherjuniper/status/1237910482742321152
2020-03-12 01:15:05,HelenGymPHL,,4,41,144,"Leave it to Trump, Miller & Co. being as anti-Asian and racist as possible to deflect from their incompetence and idiocy in getting ahead of a global pandemic.",,,,1237909947981205508,https://twitter.com/HelenGymPHL/status/1237909947981205508
2020-03-12 01:09:26,murshedz,,3,25,52,"Trump is taking his queue from Tucker Carlson prime time host of @BernieSanders campaign’s favorite network - Fox “News” - by playing up xenophobia around #COVID19 He will potentially get Asian-Americans killed with this stunt and Democratic leaders must stand up now.",,@BernieSanders,#COVID19,1237908527181520896,https://twitter.com/murshedz/status/1237908527181520896
2020-03-12 01:09:01,its_willyu,isabelle_khoo,0,7,44,"I wanted this interview to address the next gen of Asian American creators. It’s scary to put yourself out there. No one will grant you permission. Just go for it. Learn. Try again. The fear may not fade, but the courage will grow. Thanks @repasianproject @isabelle_khoo https://twitter.com/isabelle_khoo/status/1237834895319273472 …",,@repasianproject @isabelle_khoo,,1237908422969851904,https://twitter.com/its_willyu/status/1237908422969851904
2020-03-12 01:07:30,RILEY_CYRUS,,3,12,113,"with the exception of china, which we did not visit, we went to 7 asian countries during the “height” of the virus there. nobody panicked. nothing canceled. people who felt sick just stayed home. watching the left practically begging a virus to wipe out our people and the economy",,,,1237908039363104769,https://twitter.com/RILEY_CYRUS/status/1237908039363104769
2020-03-12 01:05:31,ElieNYC,,89,1024,4153,"This racist bigot is trying to tell people that we’re under attack by PEOPLE, “Foriegn” PEOPLE, instead of a biological contagion! What the HELL is this?? He’s going to get Asian-Americans killed with this crap.",,,,1237907542132621312,https://twitter.com/ElieNYC/status/1237907542132621312
2020-03-12 01:01:34,Excellion,ndrew_lawrence,7,8,360,"Asian counties were prepared and equipped after having to deal with SARS. The US hasn’t had to deal with anything of this magnitude since 1918. Even if there is an about face in terms of policy/gravitas, mobilization and coordination will be incredibly challenging. #COVID19https://twitter.com/ndrew_lawrence/status/1237761774738378752 …",,,#COVID19https,1237906547415625728,https://twitter.com/Excellion/status/1237906547415625728
2020-03-12 00:52:46,Celeste_pewter,,3,32,73,"Jim @Acosta just now: Stephen Miller was a ""driving force"" behind tonight's national address from Trump. I think we all know what that means, so I'm going to preemptively say: please call out any and all Asian-related racism when you see it.",,@Acosta,,1237904329878540289,https://twitter.com/Celeste_pewter/status/1237904329878540289
2020-03-12 00:46:30,macronikki,cnnphilippines,1,10,207,"Heart and her crazy rich asian vibe is hardly something we should care about... ever.",,,,1237902754476994560,https://twitter.com/macronikki/status/1237902754476994560
2020-03-12 00:42:24,alwaystheself,,2,210,727,"My Asian students have been sharing significant concerns about xenophobia and racism in the midst of #covid19. It is important for university administrators, professors and student life staff to send a strong message of anti-racist solidarity with Asian members of our communities",,,#covid19,1237901723743727616,https://twitter.com/alwaystheself/status/1237901723743727616
2020-03-12 00:33:12,yungJcurls,,3,28,215,"I told my Asian co worker “Black don’t crack” she gone say “Asian don’t raisin” i have never heard that before lmaoooo",,,,1237899406436753410,https://twitter.com/yungJcurls/status/1237899406436753410
2020-03-12 00:32:51,udy11,_SJPeace_,0,15,75,"Yea we gotta chill w the high key and low key Asian racism. https://twitter.com/_SJPeace_/status/1237865568696324096 …",,,,1237899317744005120,https://twitter.com/udy11/status/1237899317744005120
2020-03-12 00:31:00,KamalaHarris,TIMEHealth,724,3632,18395,"Discrimination against Asian Americans and Asian immigrants must stop. Now. https://twitter.com/TIMEHealth/status/1235999917816139777 …",,,,1237898855347179520,https://twitter.com/KamalaHarris/status/1237898855347179520
2020-03-12 00:18:22,RalfRivas,,1,64,110,"JUST IN: Staff at the Asian Development Bank’s (ADB) HQ in Manila, are temporarily working from home from today following advice that a visitor to the Bank has tested positive for COVID-19. @rapplerdotcom",,@rapplerdotcom,,1237895672990294016,https://twitter.com/RalfRivas/status/1237895672990294016
2020-03-12 00:14:46,Mont_Jiang,,9,18,90,"What this young Asian man and woman SHOULD have done while getting beaten up on the subway platform was take a look at the way they have benefited from their white adjacency and complicity in anti-Blackness. https://www.phillyvoice.com/philly-subway-assault-asian-couple-video-septa-police-coronavirus-fear-harassment/ …",,,,1237894767477796866,https://twitter.com/Mont_Jiang/status/1237894767477796866
2020-03-12 00:13:52,NoodleSparklez,,40,111,189,"Okay, hear me out... Dems have only gained votes based on identity politics for centuries. Am I the only one thinking that maybe the #coronavirus hype and pinning conservatives to be “racist” towards it , is a way of fearmongering & trying to gain the Asian vote?",,,#coronavirus,1237894541933309958,https://twitter.com/NoodleSparklez/status/1237894541933309958
2020-03-12 00:10:06,AMNH,,5,30,174,"Did you know that the sun bear is the smallest of all living bears? It’s nearly half the size of an American black bear! The Southeast Asian species' name refers to the golden patch on its chest, which is unique to each individual—like a fingerprint! pic.twitter.com/v2JHpWiLo7",,,,1237893592355450883,https://twitter.com/AMNH/status/1237893592355450883
2020-03-11 23:58:50,OneNationK,RealSaavedra,14,23,84,"Most of the customers at Chinese and Asian restaurants are Chinese and Asians! Is @AOC calling them racists? This woman is as dumb as a plank!https://twitter.com/RealSaavedra/status/1237635963800543232 …",,@AOC,,1237890760424349696,https://twitter.com/OneNationK/status/1237890760424349696
2020-03-11 23:48:25,VuzzLightyear,,8,46,160,"No, Asian people aren't savages because they ""eat dogs and cats"". The only difference between cats, dogs, pigs and cows is just your perception. Cows are big dogs and pigs are smarter dogs. Yet you all support killing them by the billion to eat their remains unnecessarily.",,,,1237888135628853254,https://twitter.com/VuzzLightyear/status/1237888135628853254
