date,username,to,replies,retweets,favorites,text,geo,mentions,hashtags,id,permalink
2020-03-14 03:54:45,ItsOkay2BeWhite,NicholsUprising,246,22,275,"Tfw you have an ethnically homogenous neighborhood, making this possible. Imagine if they were alll different races? Some blak some middle eastern, some Asian, some white. Would never happen. Only racially homogenous places can enjoy this type of social cohesion.",,,,1238674907086684162,https://twitter.com/ItsOkay2BeWhite/status/1238674907086684162
2020-03-14 03:50:15,ddeathgrips,,8,51,258,"GUYS DONT TELL THE RACIST PEOPLE ABOUT 99 RANCH MARKET OR LION SUPERMARKET OR ALL THE OTHER ASIAN SUPERMARKETS LET THEM SUFFER FOR THEIR INSTITUTIONALIZED RACISM",,,,1238673773076725765,https://twitter.com/ddeathgrips/status/1238673773076725765
2020-03-14 03:48:05,SORDHAND,,4,6,107,"pros and cons of asian felix: pros: almost everything cons: if hes anything like me my eyelashes are practically nonexistent without primer and two layers of mascara and falsies and even then i just look like a ""normal"" ""person"" instead of a bald rat",,,,1238673225577627650,https://twitter.com/SORDHAND/status/1238673225577627650
2020-03-14 03:47:42,Kellie_Pryor,winyeemichelle,30,95,319,"Blk ppl have been impacted by Asian anti-blk racism for YEARS : the rudeness, beating the shit out of our women in nail shops, bullet-proof windows in take-outs & the hurry-up-&-buy attitude when we patronize your establishments. #COVID19 = last strawhttps://twitter.com/winyeemichelle/status/1236919194794459136 …",,,#COVID19,1238673131197218816,https://twitter.com/Kellie_Pryor/status/1238673131197218816
2020-03-14 03:43:01,supjackjack,,6,11,53,"Prediction: Asian Markets will be safer to shop at in the weeks to come in US wearing masks is normal, and so your air space is more likely to be pathogen free than stores with no one wearing it you're less likely to get stabbed or shot",,,,1238671953231097857,https://twitter.com/supjackjack/status/1238671953231097857
2020-03-14 03:34:18,BaldingsWorld,,10,26,113,"Protip especially for journalists: all this ""look at what ____ Asian country is doing so well"" chatter is laughable given the number of cases I personally know aren't being reported as corona cases even though they tested positive.",,,,1238669759895355394,https://twitter.com/BaldingsWorld/status/1238669759895355394
2020-03-14 03:26:48,tony_zy,,8,9,64,"...on the street, in Costco, in Carnegie Hall, on NYU campus, on the subway, off the subway, by men, by women, for wearing masks, for not wearing masks, for being Asian, for being Chinese. I feel #Thisis2020 isn’t cut out for such rampant racism. #ThisIsNot1920",,,#Thisis2020 #ThisIsNot1920,1238667872886493186,https://twitter.com/tony_zy/status/1238667872886493186
2020-03-14 03:26:48,tony_zy,,10,35,149,"The sheer amount of verbal assaults my Asian friends recently received is fucking jaw-dropping. Nearly everyday someone new comes out with a new racist encounters they just had...",,,,1238667870122528768,https://twitter.com/tony_zy/status/1238667870122528768
2020-03-14 03:20:51,DoDatVu,mynameisbien,2,20,29,"How convenient they keep the same commercial and remove the Asian representative while #coronavirus is happening. Let’s talk @PopeyesChicken you got some explaining to do.https://twitter.com/mynameisbien/status/1238663470020780037 …",,@PopeyesChicken,#coronavirus,1238666372651069440,https://twitter.com/DoDatVu/status/1238666372651069440
2020-03-14 03:03:00,baleadalover,,1,16,57,"In 20 years there will be a Oscar winning movie called “Rona” and it’ll be about Mark Whalberg racing against the clock to find a cure for the coronavirus and in the end he succeeds and hugs his Asian wife (played by Scarlett Johansson)",,,,1238661880593264640,https://twitter.com/baleadalover/status/1238661880593264640
2020-03-14 03:02:35,Nigensei,,4,17,94,"The white boys that move to Korea/Japan and change their aesthetic to try and look as Asian as possible are absolutely demonic.",,,,1238661776859791360,https://twitter.com/Nigensei/status/1238661776859791360
2020-03-14 03:00:44,mygscene,,0,6,110,"sorry for the typos + errors but anyways, armys mocking the og tweet by bringing up billi bc her brother supported it is NOT racist and do not weigh the same bc a white woman will NEVER face the same treatment / criticism asian people have to go thru on the daily bc of the virus",,,,1238661312944603136,https://twitter.com/mygscene/status/1238661312944603136
2020-03-14 02:56:35,peachiitaee,,2,16,137,"support your local Asian restaurants these store owners are struggling and deserve so much!! it’s not fair pic.twitter.com/drkxA12o83",,,,1238660268307038209,https://twitter.com/peachiitaee/status/1238660268307038209
2020-03-14 02:56:01,Jennifer_deG,,2,14,69,"Being racist to Asian people who live in and were possibly born in the same country as you is racist, not xenophobic.",,,,1238660122919878656,https://twitter.com/Jennifer_deG/status/1238660122919878656
2020-03-14 02:55:51,lushsux,,159,446,10906,"oh no people think im a big titty asian now... pic.twitter.com/vJpypBWkhU",,,,1238660082461622272,https://twitter.com/lushsux/status/1238660082461622272
2020-03-14 02:51:16,MtfoxX3,,3,22,165,"Corvid-19 Hack: Go shopping for supplies at Asian run businesses. Not even just the Chinese ones. Racists are stupid they don't know what's up. If anyone's gonna have stock it's the places that the panic buying idiots are avoiding. I found a face mask, humidifier, and face wipes.",,,,1238658929128656896,https://twitter.com/MtfoxX3/status/1238658929128656896
2020-03-14 02:42:32,EllieAnderson00,,0,6,50,"To the beautiful Asian community; I will see you as clients. I know a lot of you are being exposed to unnecessary racism & I wanted you to know that not everyone feels this way.",,,,1238656733188222976,https://twitter.com/EllieAnderson00/status/1238656733188222976
2020-03-14 02:41:46,FortyDeuceTwits,bottomshelfbks,5,7,86,"the asian-owned bodega across from the street from me in DTLA is hella stocked https://twitter.com/bottomshelfbks/status/1238564625261555712 …",,,,1238656536781578240,https://twitter.com/FortyDeuceTwits/status/1238656536781578240
2020-03-14 02:25:40,datta_arvind,,38,42,421,"Do you know why Asian Paints trades at such a high PE being in a commodity biz like paints? 5 year CAGR for market cap is 22.2%, means it doubles your money in 30 months So, you can decide yourself if the stock is expensive or cheap??",,,,1238652487457857536,https://twitter.com/datta_arvind/status/1238652487457857536
2020-03-14 02:23:04,alwaystheself,,2,15,77,"We went to Flushing tonight to support an Asian owned business. Many of the grocery stores and restaurants were empty. Please think about what you can do to support the Asian American community right now.",,,,1238651830646771712,https://twitter.com/alwaystheself/status/1238651830646771712
2020-03-14 02:07:54,RKIVE_KOYA,,0,105,277,"Fake woke is hyping up Asian representation from Parasite but then two days later rting racist tweets towards Asians about the Corona virus",,,,1238648015742623745,https://twitter.com/RKIVE_KOYA/status/1238648015742623745
2020-03-14 02:06:43,dearbassy,,7,10,267,"Is it racist if they removed the Asian dude from a Popeyes commercial that’s been airing since, I dunno, the beginning of this year",,,,1238647718093996034,https://twitter.com/dearbassy/status/1238647718093996034
2020-03-14 02:02:19,IBexWeBex,TexasTribune,1,24,137,"Buy from Asian markets y’all https://twitter.com/TexasTribune/status/1238602430515941377 …",,,,1238646608499109888,https://twitter.com/IBexWeBex/status/1238646608499109888
2020-03-14 01:48:39,PhdParody,,18,177,221,"[Wuhan Hospital is still overcrowded, and patients in the ambulance are nowhere to be resettled.] Ambulance staff said that all hospitals are not accepting patients. They just went to 161 Hospital to be sent to Wuhan Asian Cardiology Hospital, but they are not accepted here. pic.twitter.com/Iabkmg9b1j",,,,1238643170461843456,https://twitter.com/PhdParody/status/1238643170461843456
2020-03-14 01:48:03,hyejoohobi,,24,1096,10837,"um.....did not expect this to blow up but my point still stands. southeast asian ppl have to deal with not only this virus but also have to face racism and discrimination. the social repercussions from this pandemic are NOT the same for asia and europe.",,,,1238643019336777728,https://twitter.com/hyejoohobi/status/1238643019336777728
2020-03-14 01:44:56,douglasfunniest,,2,16,101,"the representazn activism that blue check asian twitter has always been pushing has no real effect on actual racism that we face. crazy rich asians, fob, mulan, all just white products designed to make asian elites feel good about themselves for being part of white society. pic.twitter.com/J2EXzSd20S",,,,1238642237262553088,https://twitter.com/douglasfunniest/status/1238642237262553088
2020-03-14 01:42:59,WairarapaJane,BradfordPearson,7,32,48,"Yes! Do this! Shop Asian supermarkets, escape lines and shortages, combat racism and help your fellow citizens! https://twitter.com/BradfordPearson/status/1238511571770499075 …",,,,1238641746772291584,https://twitter.com/WairarapaJane/status/1238641746772291584
2020-03-14 01:39:43,elliotsang,,1,9,97,"by all accounts, he's not rich, but this is a thing he does often. once, he offered to send money to people to go see crazy rich asians as part of the big cultural movement that signified for asian ppl at the time. my friends and i were some of the people he sent money to! pic.twitter.com/eVMkfB5CP8",,,,1238640922696581120,https://twitter.com/elliotsang/status/1238640922696581120
2020-03-14 01:37:09,thenoblestroman,goldassrings,1,11,57,"as a former directioner i have not forgotten the way the GP dragged them for being a dumb boyband devoted to only their teenage fanbase but NOW y’all using them as a crutch to hide your xenophobic feelings bc you can’t stand seeing asian ppl win......... y’all ain’t slick https://twitter.com/goldassrings/status/1238570892554375172 …",,,,1238640276928892936,https://twitter.com/thenoblestroman/status/1238640276928892936
2020-03-14 01:36:01,yynncc323,AndrewHClark,104,46,578,"The #coronavirus is orginated in #wuhan #china . Whats the problem. I am asian and I dont’t think it is racism lol.",,,#coronavirus #wuhan #china,1238639991133097984,https://twitter.com/yynncc323/status/1238639991133097984
2020-03-14 01:33:06,stillgray,,82,103,1038,"Because people don't want to be ""racist"" they're doing dumb shit like hugging Asian people randomly. Can you literally not.",,,,1238639259457695745,https://twitter.com/stillgray/status/1238639259457695745
2020-03-14 01:28:07,wishbumpycoulda,wishbumpycoulda,9,98,212,"It’s disturbing that they know blk ppl R more likely than any other group 2make poverty wages but No-1 including the blk caucus has made any steps to fix the problem. Asian legislators immediately sprang N2 action to protect Chinese businesses as they should. No specifics 4us tho https://twitter.com/wishbumpycoulda/status/1238460764379381761 …",,,,1238638004773826562,https://twitter.com/wishbumpycoulda/status/1238638004773826562
2020-03-14 01:27:58,Loudwindow,,2,48,208,"It irks me when euro-centric fantasy settings can have grand vistas and diverse weather, but ethnic locales look either mundane or slapped on. Give me a winter wonderland Arabian city, Polynesian islands made of a crashed moon, a South East Asian rainforest themed maze crypt etc",,,,1238637964130791424,https://twitter.com/Loudwindow/status/1238637964130791424
2020-03-14 01:27:35,Hoseokielovebug,hyejoohobi,6,14,423,"Everyone boycotts Asian restaurant yet does nothing about Olive Garden",,,,1238637869490532352,https://twitter.com/Hoseokielovebug/status/1238637869490532352
2020-03-14 01:23:24,BrianAddisonLB,,11,36,136,"Fear of COVID-19 has racist implications, intentional or otherwise—and that includes the wide dismissal of Asian markets. If you find your market unable to fulfill your shopping needs b/c supplies are low, _visit an Asian marlet_. They’re stocked, welcoming & need our support.",,,,1238636814635659264,https://twitter.com/BrianAddisonLB/status/1238636814635659264
2020-03-14 01:21:29,Steve_Sailer,BradfordPearson,46,180,765,"Asian supermarkets in the U.S. are full of food ... because Asians in the U.S. are terrified to go in them. https://twitter.com/BradfordPearson/status/1238511571770499075 …",,,,1238636335147003904,https://twitter.com/Steve_Sailer/status/1238636335147003904
2020-03-14 01:20:47,PikaChulita,,1,52,182,"Also to mention: many of the cases outside of Asia aren't even Asian folks. It's John Smith who went on vacation or his business trip cuz they can afford to travel wherever the fuck they want. A lot of this is being spread by rich whites.",,,,1238636156914470912,https://twitter.com/PikaChulita/status/1238636156914470912
2020-03-14 01:19:40,CommanderLilly,,14,86,347,"*hey, psst* If available, try local asian grocery stores for things you need but can’t get right now because of panic buying Most of the same people panic buying are at least casually racist, so asian groceries are currently much better stocked",,,,1238635875283722243,https://twitter.com/CommanderLilly/status/1238635875283722243
2020-03-14 01:03:10,TamanishaJohn,,5,4,69,"During this pandemic, Sinophobia is widespread— last Friday at an Asian nail salon it was *EMPTY* I got my nails done, but . I also had to tell my mom to not believe WhatsApp messages saying you can get COVID-19 from Chinatown or Chinese food . STOP BEING RACIST. pic.twitter.com/qKnlsbFxjy",,,,1238631726387167233,https://twitter.com/TamanishaJohn/status/1238631726387167233
2020-03-14 01:02:20,kixxiesiete,,2,19,44,"Support your local Chinese restaurants and Asian grocery stores. Saigon Market on Hawthorne got amazing produce and Dat Moi on Van Ness got the freshest seafood yall ever seen. Little Asia on Imperial always a hit, you'd think Mike Will made it.",,,,1238631514998542337,https://twitter.com/kixxiesiete/status/1238631514998542337
2020-03-14 00:53:42,dezzymarch,,17,38,324,"Y’all know Jay is one of my favorite artists-singers period & my favorite Asian artist hands down next to Villain & Jessi. I think I’ma go ahead & put together a video about this man cause this hate train on him is crazy.. he can’t even breath without somebody losing their shit",,,,1238629344341159936,https://twitter.com/dezzymarch/status/1238629344341159936
2020-03-14 00:46:42,CongressmanRaja,Slate,6,31,145,"We are better than this and we must be. It's not just one anecdote: incidents like this are happening across the country as racism cloaked in coronavirus fears strikes at the personal and physical wellbeing of Asian Americans. Defeating hate and #Covid19 means standing together.https://twitter.com/Slate/status/1238624973159350272 …",,,#Covid19,1238627580653289473,https://twitter.com/CongressmanRaja/status/1238627580653289473
2020-03-14 00:45:59,jkslovejoon,ghostinsleep,5,17,287,"U have no say on this matter because u don't have any idea of how much bull$hit we go through with yall western artist and how much bts is ignored and not properly recognized because everyone scared that an ""Asian"" band would take over the charts, yall can't see that happening",,,,1238627399367110658,https://twitter.com/jkslovejoon/status/1238627399367110658
2020-03-14 00:43:30,ThreeKobolds,bottomshelfbks,4,8,282,"PLUS, and hear me out on this, the BEST ramyun. Shrimp chips. Asian fruits and veggies. Kimchi. Kimbap. Sūndae.",,,,1238626774914908163,https://twitter.com/ThreeKobolds/status/1238626774914908163
2020-03-14 00:42:36,hkwuliff,,2,25,62,"want to use an Asian country as a shining exam? TAIWAN IS YOUR ANSWER for gods sake read a newspaper and find out for yourself how badly the CCP botched its response. stop sucking up to China and let’s all get on the Taiwan Is Awesome bandwagon",,,,1238626549483491329,https://twitter.com/hkwuliff/status/1238626549483491329
2020-03-14 00:41:44,usnehal,Docbasia,7,37,123,"Can we stop with the anti-Asian xenophobia now? As soon as they close the last #Covid_19 facility they are helping another country with equipment and experts - they must be exhausted yet are soldiering on. This is what humanism looks like.https://twitter.com/Docbasia/status/1238615411756797953 …",,,#Covid_19,1238626332008951810,https://twitter.com/usnehal/status/1238626332008951810
2020-03-14 00:36:10,eddinask,gxiaca,6,148,1981,"Well, Asian and other minorities always experience ""being the black sheep"" everyday. Coronavirus or not, people still treat racism towards Asian as a joke. From the harmful representation on media to sneezing Asian got beatings from racist. All the time. It's not the same thing.",,,,1238624928737288193,https://twitter.com/eddinask/status/1238624928737288193
2020-03-14 00:25:29,bts__jen,joonfendi,4,8,567,"And many use “Asian people are racist too” as justification for this.",,,,1238622240020639745,https://twitter.com/bts__jen/status/1238622240020639745
2020-03-14 00:21:44,NAACP_LDF,,0,26,49,"There is no excuse for racism. The rise in anti-Asian hate crimes and other discrimination linked to #COVID19 is extremely disturbing. Elected officials must immediately condemn all acts of hate against Asian and Asian-American communities. https://www.naacpldf.org/press-release/ldf-calls-on-elected-officials-to-condemn-discrimination-linked-to-covid-19-2/ …",,,#COVID19,1238621296214396933,https://twitter.com/NAACP_LDF/status/1238621296214396933
2020-03-14 00:20:39,onphileek,,88,110,2146,"White woman put her scarf over her face as soon as I stood next to her. Refused to get into the same elevator as me. Not gonna lie, being Asian during COVID-19 is weird",,,,1238621025081995265,https://twitter.com/onphileek/status/1238621025081995265
2020-03-14 00:15:12,TheBass_Abides,ciarralifts,2,3,132,"Idk about your city but I found the asian market in mine to be nice and stocked full of a lot of essentials and even with toilet paper",,,,1238619654899326985,https://twitter.com/TheBass_Abides/status/1238619654899326985
2020-03-14 00:07:11,mtlawmiami,bottomshelfbks,1,8,230,"This is great. My neighbors and I all talked about this earlier in the week, and we have some great Asian grocers. Made sure to buy canned goods, soups, and the like.",,,,1238617635107098625,https://twitter.com/mtlawmiami/status/1238617635107098625
2020-03-14 00:05:47,RebelYellin65,RealSaavedra,23,104,193,"Banks aren't lending bc we're black, investors aren't investing bc we're black, we're over-policed bc we're black, social systems are in decay bc we're black, Asian businesses exploit & extract w/o compassion in our communities bc we're black. #Racism is our 400+ y/o virus. .https://twitter.com/RealSaavedra/status/1237635963800543232 …",,,#Racism,1238617281841762304,https://twitter.com/RebelYellin65/status/1238617281841762304
2020-03-13 23:57:54,rabiasquared,AshaRangappa_,33,68,886,"Also, check out south Asian and asian stores https://twitter.com/AshaRangappa_/status/1238614004815269890 …",,,,1238615301442371584,https://twitter.com/rabiasquared/status/1238615301442371584
2020-03-13 23:56:35,BergamotLoretto,,11,13,90,"My local favorite Thai restaurant is suffering due to the prejudices brought with Covid-19. I was unfortunately surprised since it is Thai rather than Chinese. Then I remembered that Asian is Asian. Anyone in the ATL area, please help support this business. pic.twitter.com/hdT1oDWciA – at Thai Restaurant Sandy Springs",,,,1238614970549645312,https://twitter.com/BergamotLoretto/status/1238614970549645312
2020-03-13 23:53:20,nancywyuen,,9,88,245,"“What we're seeing here is some of the growing pains of Hollywood wanting to be inclusive in terms of storytelling, and yet behind the scenes are not able or wanting to”—I was interviewed by ⁦ @kimmythepooh⁩ on the lack of Asian creators behind Mulan. https://www.nbcnews.com/news/asian-america/mulan-film-gets-backlash-lack-asian-talent-behind-camera-n1157801 …",,@kimmythepooh,,1238614150261010432,https://twitter.com/nancywyuen/status/1238614150261010432
2020-03-13 23:50:16,pittsed_off,,10,28,150,"Aldi: Barren Trader Joe's: A Wasteland HMart: Stocked to the tippy top So head's up, if you're looking for stuff, check out your local Asian grocer. pic.twitter.com/URzsOaqhkf",,,,1238613377204858880,https://twitter.com/pittsed_off/status/1238613377204858880
2020-03-13 23:47:10,victoriaying,,24,82,817,"If any of you are hitting up a Korean or Asian market, GET ONE OF THESE! So delicious, can be mixed with soda water or hot water!! pic.twitter.com/ShNHzF01KW",,,,1238612599320666112,https://twitter.com/victoriaying/status/1238612599320666112
2020-03-13 23:40:36,backthatelfup,,5,27,108,"Portland people, the newish Asian market on foster/82nd has lots of rice, dried noodles, dumplings, SPICES, frozen fish, dried and canned beans, like, please, give trader Joe's and Safeway and Freddy's a break",,,,1238610948174143488,https://twitter.com/backthatelfup/status/1238610948174143488
2020-03-13 23:40:04,cassie_complex,,2,5,58,"You're afraid to go to Asian restaurants because you're a dumb bigot I get sanitizing wipes at normal price from the store run by a lovely Asian family down the street We are not the same pic.twitter.com/PpKKfnlfzy",,,,1238610811624370176,https://twitter.com/cassie_complex/status/1238610811624370176
2020-03-13 23:27:15,viii_xiiu96,,33,15,472,"The way I lost followers after telling people who follow just bc of my face and bc I'm Asian to get lost LMAO",,,,1238607588100648961,https://twitter.com/viii_xiiu96/status/1238607588100648961
2020-03-13 23:22:43,elisabomb,SamSykesSwears,0,10,139,"Go to your local asian grocery store if you have one nearby! Asian businesses have been hit by covid-related racism lately and the one i went to today had plenty of food to go round",,,,1238606444951490561,https://twitter.com/elisabomb/status/1238606444951490561
2020-03-13 23:19:06,AntonioArellano,,4,60,177,"Help reduce the spread of rumors: Let people know that viruses cannot target people from specific populations, ethnicities, or racial backgrounds. Being of Asian descent does not increase the chance of getting or spreading #Covid_19.",,,#Covid_19,1238605535546683393,https://twitter.com/AntonioArellano/status/1238605535546683393
2020-03-13 23:15:08,lesbiansizhui,,7,30,90,"not new to nsfw, I just need 420 followers lol (I’m close) ~lyn ~asian ~soft ~switch ~california ~2005 ~rt for moot, like for dm pic.twitter.com/24GLe9hU2C",,,,1238604539063701504,https://twitter.com/lesbiansizhui/status/1238604539063701504
2020-03-13 23:09:48,joonaga_twt,adoringvmin,3,8,513,"EXACTLY. it's only when there's an Asian person in the fancam",,,,1238603197138309120,https://twitter.com/joonaga_twt/status/1238603197138309120
2020-03-13 23:09:26,treyvxughn,,2,16,75,"* Everybody wearing masks cause of the coronavirus * Asian transfer students: pic.twitter.com/WkIKSOdFlL",,,,1238603102351233027,https://twitter.com/treyvxughn/status/1238603102351233027
2020-03-13 23:02:03,NoTotally,,3,32,275,"Also if I was working at an Asian grocery and a group of determined-looking white folks came in I'd be the fuck out of there so fast. You all think your presence in unusual-for-you places is seen as neutral, lol (it is not)",,,,1238601243527770112,https://twitter.com/NoTotally/status/1238601243527770112
2020-03-13 23:01:30,urghming,,0,24,55,"modern au shimei is the dream son in law every asian mother wants because he’s pretty, smart, well mannered and most importantly is a doctor",,,,1238601105048612864,https://twitter.com/urghming/status/1238601105048612864
2020-03-13 23:00:24,malindalo,,5,64,599,"I keep seeing news about seniors ignoring the coronavirus precautions, but let me tell you... all the Asian American seniors I know have been following this news for 2 months and are way more prepped than any of us. They actually care about news from Asia.",,,,1238600827960537092,https://twitter.com/malindalo/status/1238600827960537092
2020-03-13 22:54:02,NoTotally,,15,62,465,"I'll acknowledge that I'm extremely cranky at the moment but white people saying ""go to Asian markets, there's no lines!! Also, this fights racism somehow"" isn't hitting me the way it seems to be hitting others",,,,1238599227040600069,https://twitter.com/NoTotally/status/1238599227040600069
2020-03-13 22:52:35,Sun_Soony,,14,58,350,"this guy on the tube tonight told my asian friend to “stop speaking chinese” (he wasn’t) and says angrily “no chinese in england”. the sad thing is, i wasn’t that surprised. racism surrounding coronavirus seems so common now. pls stop with the ignorance :/ pic.twitter.com/ObaCQfi7bT",,,,1238598860794142720,https://twitter.com/Sun_Soony/status/1238598860794142720
2020-03-13 22:51:17,MattHannaSGI,,6,29,76,"This last week has been the most volatile week for the S&P 500 since 1989. The Coronavirus has given us more vol in a 5 day period than the Great Recession, Debt Crisis, Tech Bubble, LTCM, & the Asian Econ Crisis. Never let the market lull you to sleep. Always manage your risk. pic.twitter.com/UHaKusIFt4",,,,1238598535227912192,https://twitter.com/MattHannaSGI/status/1238598535227912192
2020-03-13 22:45:59,sameergardezi,laithalid,6,9,61,"There are simply just too many South Asian Americans on the wrong side of things for me to not think this is an individual thing. https://twitter.com/laithalid/status/1238525293419257858 …",,,,1238597199543468032,https://twitter.com/sameergardezi/status/1238597199543468032
2020-03-13 22:42:11,oakkmusic,,2,28,95,"if you can’t find what you’re looking for in a big chain grocery store, seek small local markets for some essentials. Now, more than ever those small businesses need the income. Especially Asian markets that have taken a hit due to xenophobia and blatant racism.",,,,1238596245666426880,https://twitter.com/oakkmusic/status/1238596245666426880
