date,username,to,replies,retweets,favorites,text,geo,mentions,hashtags,id,permalink
2020-03-05 22:01:36,SanaSaeed,mehdirhasan,6,37,157,"The uncomfortable implication here, that is constantly made and not pointed out enough, is that every [South Asian] Muslim who is a critic of her very clear BJP ties and Islamophobia is Hinduphobic - something Gabbard herself has pushed as a counter-narrative.",,,,1235686929137643520,https://twitter.com/SanaSaeed/status/1235686929137643520
2020-03-05 21:58:46,aznbaebie,KALONSMERALDO,4,15,266,"absolutely disgusting. corona isn’t a disease asian people get. it just so happened it hit china first it’s always been around.",,,,1235686215153786882,https://twitter.com/aznbaebie/status/1235686215153786882
2020-03-05 21:55:17,radarsaturn,,34,24,767,"Hello everyone i am about to do a reveal. Devil is asian. But I won’t tell from where in asia LoL.",,,,1235685339462643713,https://twitter.com/radarsaturn/status/1235685339462643713
2020-03-05 21:47:38,SuzyKhimm,,6,39,153,"Unless your story is about 1) Coronavirus in an Asian country 2) Coronavirus in an Asian neighborhood or community 3) the origin of the virus there's little reason to use a default stock photo of Asian people for your Coronavirus story. That is all.",,,,1235683415740964864,https://twitter.com/SuzyKhimm/status/1235683415740964864
2020-03-05 21:46:16,TimothyDeLaG,,6,17,417,"Here’s another highschool throwback. That Asian girl could twerk really well. Me and the dude on the left used to freestyle together. The girl on my lap, I wrote her a poem. Not sure why I wore a shirt and tie that day, musta had a presentation lol pic.twitter.com/hG35xnbUxW",,,,1235683070570713088,https://twitter.com/TimothyDeLaG/status/1235683070570713088
2020-03-05 21:44:09,dalitdiva,,10,27,43,"South Asian Arab and Muslim organizers have raised these concerns for years. #Tulsi has always been a pretend progressive domestically & aligned with fascists abroad. Her attempt to shut down debate with spurious claims of #hinduphobia is disingenuous. #Tulsigottago #Tulsi2020pic.twitter.com/XABL5vaav0",,,#Tulsi #hinduphobia #Tulsigottago #Tulsi2020pic,1235682537118236679,https://twitter.com/dalitdiva/status/1235682537118236679
2020-03-05 21:40:46,EricDJuly,,42,12,265,"Chinaman is not the preferred nomenclature. Asian-American, please.",,,,1235681687507308544,https://twitter.com/EricDJuly/status/1235681687507308544
2020-03-05 21:37:55,GottaBernNow,emilycheath,1,10,79,"It’s not about people I like & people I hate cuz they are Blk/wht/Asian/Latino, LGBTQ/straight, nice/mean, rich/poor, rude/polite, old/young, male/female, Biden/Bernie/Warren supporters or whatever. It’s about saving our planet, justice & equality. OCEANS DYING = NO OXYGEN!!",,,,1235680967445995520,https://twitter.com/GottaBernNow/status/1235680967445995520
2020-03-05 21:16:43,vrimjai,HeyAnjan,7,4,85,"If you are a south Asian person who is interested in working in politics, hmu https://twitter.com/HeyAnjan/status/1235599472882827264 …",,,,1235675632022867968,https://twitter.com/vrimjai/status/1235675632022867968
2020-03-05 21:15:47,inLaurasWords,,5,10,62,"So I see we're still putting Asian people with masks on as the art on every single coronavirus story, regardless of the facts (and actual content of the story). pic.twitter.com/nuHpUiVrn3",,,,1235675398442283016,https://twitter.com/inLaurasWords/status/1235675398442283016
2020-03-05 21:13:49,burntbiryani,,6,6,54,"80% of Asian mandem think they're Thomas Shelby init",,,,1235674903375945728,https://twitter.com/burntbiryani/status/1235674903375945728
2020-03-05 21:09:26,RizeOT7addict,,6,6,318,"my asian a$$can't stand this,,,plus I'm literally addicted to tea,,and this is NOT how you make tea mf,,,",,,,1235673799414050821,https://twitter.com/RizeOT7addict/status/1235673799414050821
2020-03-05 21:07:52,spillseshYT,,13,151,1301,"If you think every single Asian has the corona virus, fuck you.",,,,1235673408458776576,https://twitter.com/spillseshYT/status/1235673408458776576
2020-03-05 21:07:43,NYDailyNews,,52,69,72,"Video catches an unhinged man spraying Febreze at an Asian straphanger on a Brooklyn train amid coronavirus fears. https://trib.al/DjBTkbZ",,,,1235673368386564097,https://twitter.com/NYDailyNews/status/1235673368386564097
2020-03-05 20:58:59,ZohranKMamdani,,3,6,57,"If you're looking for a candidate who is: a) South Asian b) Muslim c) a Community Land Trust enthusiast d) likely bumping a Kacey Musgraves track rn @MahfuzulFor24 and I have you covered from the South East of Queens to the Northwest. #KababKingCaucuspic.twitter.com/mdFYR8BA7u",,@MahfuzulFor24,#KababKingCaucuspic,1235671172114771985,https://twitter.com/ZohranKMamdani/status/1235671172114771985
2020-03-05 20:51:00,KeonheeLovesYou,,90,8,170,"OOOOO YOU GONNA BE SURPRISED they gave me: straight i am: Bi they gave me: 5’4 i am: 5’8.5” they gave me: single i am: Married they gave me: 22? i am: 24 they think my ethnic group is: Asian? i am: Latina drop an emoji and i'll tell you what i think based on your profile",,,,1235669163978272768,https://twitter.com/KeonheeLovesYou/status/1235669163978272768
2020-03-05 20:46:33,thatsonviperiod,2020predicts,0,15,224,"this is so heartbreaking :( just because the virus started in china does not mean every asian person in the world has the virus. stop with the ignorance and racism.",,,,1235668041918279686,https://twitter.com/thatsonviperiod/status/1235668041918279686
2020-03-05 20:43:40,modooborahae,shookytwts,10,9,167,"The opposite is true of Asian women. How many of you were told “I thought Asians were quiet?” Or, “I didn’t know Asian women could argue?” Bc I’ve been told this many times. It actually happened a few days ago. https://twitter.com/shookytwts/status/1235645466500648960 …",,,,1235667315930234880,https://twitter.com/modooborahae/status/1235667315930234880
2020-03-05 20:36:06,nypost,,33,38,54,"Straphanger sprays Asian man with Febreze in possible hate crime https://trib.al/UwoknoH pic.twitter.com/Pjf3sTcnAs",,,,1235665411204624384,https://twitter.com/nypost/status/1235665411204624384
2020-03-05 20:30:46,yuhline,ItsCeliaAu,3,22,43,"The anti-asian sentiment is real. This guy is spraying people with chemicals!!! Horrific. https://twitter.com/ItsCeliaAu/status/1235287380292235264 …",,,,1235664070608424960,https://twitter.com/yuhline/status/1235664070608424960
2020-03-05 20:19:01,HawluSenpai,,4,26,110,"hello, dont forget to: drink water wash hands eat more veggies and fruits listen to that way by lil uzi and dont treat asian people differently/harshly bc the media decided to fear monger the corona virus",,,,1235661113099837440,https://twitter.com/HawluSenpai/status/1235661113099837440
2020-03-05 20:17:19,terisasiagatonu,,3,66,500,"Warren's team reached out to me personally asking how they can improve their policy plan for Native Hawaiian/Pacific Islanders. Not AANHPI. Just NHPI. She was the only candidate who had a thorough policy plan for Asian Americans & Native Hawaiian/Pacific Islanders. That mattered.",,,,1235660683938639872,https://twitter.com/terisasiagatonu/status/1235660683938639872
2020-03-05 20:11:14,uh_velkommen,IvyKungu,2,21,201,"Tbh Asian Americans, specifically Chinese Americans, deal with so much surface level racism and no one ever talks about it. It starts with the jokes about them working in mail salons or eating their dogs and it turns into acting like they arent the same kind of human as we are",,,,1235659153202466816,https://twitter.com/uh_velkommen/status/1235659153202466816
2020-03-05 20:02:00,leonbergers,nyccookies,4,17,53,"He's already done that. It's safe to say it wasn't because he is a racist that he refused to work with Obama. Just a power hungry criminal who doesn't understand his job. Upper echelon Asian Mob by marriage.",,,,1235656832078589952,https://twitter.com/leonbergers/status/1235656832078589952
2020-03-05 19:52:53,marianne_eloise,,6,26,174,"our usually very busy local chinese restaurant has been dead the last few times we’ve been in for the first time ever. if you’d rather let a local business go under than wash your fucking hands you’re a racist and an idiot. support east asian businesses and people now and always",,,,1235654534569091073,https://twitter.com/marianne_eloise/status/1235654534569091073
2020-03-05 19:52:28,kaleenapd,,2,21,143,"s/o asian girls, let the lights dim sum pic.twitter.com/MLvvMvEANF",,,,1235654429929431040,https://twitter.com/kaleenapd/status/1235654429929431040
2020-03-05 19:44:10,CAKalish,kurteichenwald,4,18,124,"I noticed the oddest thing from his @maddow interview: she kept trying to get him to talk about his weak support from the African American community and he kept talking about his support from the Latino and Asian community. Like, the “not white” folk were fungible. It was gross.",,@maddow,,1235652341895847936,https://twitter.com/CAKalish/status/1235652341895847936
2020-03-05 19:43:17,veryunfakenews,,65,584,576,"Nearly 7,000 Brits have signed the petition since it was released this afternoon. If you think the government should no longer cover up the ""Asian"" ""Grooming"" scandal and are a UK resident you can sign here. https://petition.parliament.uk/petitions/300239 …",,,,1235652118977163266,https://twitter.com/veryunfakenews/status/1235652118977163266
2020-03-05 19:40:56,socialistdogmom,,2,29,281,"this is just gonna immediately devolve into karens screaming at asian people.",,,,1235651530776285186,https://twitter.com/socialistdogmom/status/1235651530776285186
2020-03-05 19:36:41,lulthiccgi,,4,12,109,"this lil asian grocery store is so fuckin barren bc of racist ass ppl. GUESS WHO FINNA GO RUN UP A CHECK IN DERE LMFAOOOOOOOOOOOOOO finna bibimbap my ass right on thru dem aisles",,,,1235650460083802112,https://twitter.com/lulthiccgi/status/1235650460083802112
2020-03-05 19:30:02,Geemme,Wnicholasgomes,9,18,69,"117 white & 111 Asian arrests. Now what % of the population is white & what % Asian. Also how much you wanna bet that the Asians represent people from countries of Islamic origin. Don’t be mislead by stats in this way. https://twitter.com/Wnicholasgomes/status/1235595491657814016 …",,,,1235648785528893440,https://twitter.com/Geemme/status/1235648785528893440
2020-03-05 19:27:31,angryasianman,,7,488,1018,"Anti-Asian harassment isn't new. It just got the green light. https://www.npr.org/2020/03/02/811363404/when-xenophobia-spreads-like-a-virus …",,,,1235648151802875904,https://twitter.com/angryasianman/status/1235648151802875904
2020-03-05 19:26:42,DanSlott,,1,23,136,"The news needs to stop running pictures of Asians and Asian Americans every time they post a story about the coronavirus. They do it when the article is *specifically* about a white woman who contracted it. When it's about *any* pet owners. When it's about NYC in general. STOP.",,,,1235647946735132674,https://twitter.com/DanSlott/status/1235647946735132674
2020-03-05 19:25:09,ketaminh,tarang_chawla,21,7,48,"I grew up with this kind of racist abuse on the streets of Adelaide , South Australia as an Asian refugee . Sad to hear that over 40 yrs later it’s still happening . Seems part of human DNA https://twitter.com/tarang_chawla/status/1235407929202761729 …",,,,1235647555523899392,https://twitter.com/ketaminh/status/1235647555523899392
2020-03-05 19:24:45,SWVAforPete,,12,10,120,"Warren was not my candidate & I have issues some issues with her strategy BUT I can't help but be so disappointed that after a diverse field including several women, multiple black people, an Asian American, a Mexican American, and a gay man, we're left with two old white men",,,,1235647455036923905,https://twitter.com/SWVAforPete/status/1235647455036923905
2020-03-05 19:09:45,88shits,,0,88,105,"i want new moots and people to dm. • zai. • fifteen turning sixteen. • she/her. • lesbian. • england. • dom. • poc. (south asian) rt to be mutuals and like for a possible dm. pic.twitter.com/0iQenZkOLg",,,,1235643682663120897,https://twitter.com/88shits/status/1235643682663120897
2020-03-05 19:02:43,bunzy55,AngryTiger__,1,19,71,"Me, in class, every damn time I see a chart that reads “White Black Latino Asian OTHER” https://twitter.com/AngryTiger__/status/1228943370137079808 …",,,,1235641913069404160,https://twitter.com/bunzy55/status/1235641913069404160
2020-03-05 18:57:19,BBCAfrica,,4,34,103,"""Whether you're black or white or Asian, this story will empower you."" Filmmaker @DirectedByKoby speaks to #FocusOnAfrica about directing new TV series, #NoughtsAndCrosses for @BBCOne https://bbc.in/2IzEZZX",,@DirectedByKoby @BBCOne,#FocusOnAfrica #NoughtsAndCrosses,1235640554622513152,https://twitter.com/BBCAfrica/status/1235640554622513152
2020-03-05 18:55:16,rjtejada803,markos,2,10,161,"As an Asian immigrant, @BernieSanders reflects my values and hopes for this country. I believe that in a country with the most billionaires, no human being should die because he/she can’t afford insulin. This is a class war. Capitalists vs working class.",,@BernieSanders,,1235640036965511168,https://twitter.com/rjtejada803/status/1235640036965511168
2020-03-05 18:49:49,KNatashaChandra,,5,24,19,"Hello Twitter - I’m looking for a South asian/ BAME animator to turn an important story into a reality. Please TAG , COMMENT, RT #animation #AnimationPower #southasian",,,#animation #AnimationPower #southasian,1235638664245456896,https://twitter.com/KNatashaChandra/status/1235638664245456896
2020-03-05 18:47:16,Peterhchau,,6,21,309,"PSA: The corona virus doesn't give you an avenue to be racist to any asian you see :)",,,,1235638024521695232,https://twitter.com/Peterhchau/status/1235638024521695232
2020-03-05 18:41:47,DavidAgStone,,1,19,60,"""White people are scared enough of coronavirus to avoid Asian people even if they're perfectly healthy, but not scared enough of coronavirus to vote for Medicare For All"" - my sibling Ness going INNN for #PresidentBernieSanders #NotMeUs",,,#PresidentBernieSanders #NotMeUs,1235636642498531328,https://twitter.com/DavidAgStone/status/1235636642498531328
2020-03-05 18:34:36,xeni,,8,29,176,"Whoever our candidate ends up being, it’s on us to hold them accountable to women and Black, Latinx, Native, Asian, and other marginalized Americans who still don’t get a fair shot at leadership. Old white guy, fine. But the old white guy owes it to the future to elevate others.",,,,1235634837647577088,https://twitter.com/xeni/status/1235634837647577088
2020-03-05 18:22:40,Youthen_me,,1,26,25,"Fake News Virus History. 1898 T.M.V. 1954 Polio. 1957 Asian. 1961 Measles. 1976-1996 Swine Flu 2002 West Nile. 2004 Sars. 2005 Bird Flu. 2009 H1N1 2014 Ebola. 2016 Zika. 2018 Measles. 2019 Coronavirus. common thread: fear. control. vaccines.",,,,1235631834597191680,https://twitter.com/Youthen_me/status/1235631834597191680
2020-03-05 18:14:58,Slasher,Slasher,15,18,364,"the initial gameplay reveal felt much more like they were trying to show off everything at once and also appeal to Asian markets, while all of the following clips are the more standard rounds we'll see https://twitter.com/Slasher/status/1235616395536330756 …",,,,1235629896703111168,https://twitter.com/Slasher/status/1235629896703111168
2020-03-05 18:08:01,jalamb86,jcinthelibrary,9,11,489,"As a young boy he also had no eyes. Such an inspiring story to go from all that to being a proud Asian American woman.",,,,1235628146319384576,https://twitter.com/jalamb86/status/1235628146319384576
2020-03-05 18:04:23,coldwars,IvyKungu,1,10,168,"Support your local Asian food restaurants during this difficult time. That's the best way to combat this sort of nonsense.",,,,1235627233215229953,https://twitter.com/coldwars/status/1235627233215229953
2020-03-05 17:58:21,Em_TeeGee,AnthonyIng,8,17,75,"To those in my mentions who questioned if Asian people were actually facing additional discrimination as a result of COVID-19: https://twitter.com/AnthonyIng/status/1235578757441826818 …",,,,1235625714558230529,https://twitter.com/Em_TeeGee/status/1235625714558230529
2020-03-05 17:53:38,silviamg,,8,6,78,"I'm waiting to get some blood tests done and in the waiting room an old white lady wearing a face mask asked me if I was Asian before sitting next to me. I said no but what kind of question is that?! At that point she picked another seat. WTF. pic.twitter.com/bpRVAxZIj5",,,,1235624528153214976,https://twitter.com/silviamg/status/1235624528153214976
2020-03-05 17:53:24,ANI,,11,41,467,"Junaid Qureshi, European Foundation for South Asian Studies at 43rd Session of UNHRC in Genava: The removal of restrictions on internet & social media (imposed in J&K on Aug 5, 2019 after the abrogation of Article 370) is a good step. It will contribute towards more peace&harmony pic.twitter.com/WLVRZvdckG",,,,1235624466102677504,https://twitter.com/ANI/status/1235624466102677504
2020-03-05 17:50:35,sccceo,,5,15,98,"May I respectfully draw my peers attention to the fact that if you are going to book me to talk at a conference, my role is to talk about #SmallCharities not my experience as an Asian woman working in a woke brave world of vouyeristic fascination with equality #CharitySoWhitepic.twitter.com/nLQ3bwwUBi",,,#SmallCharities #CharitySoWhitepic,1235623757500346368,https://twitter.com/sccceo/status/1235623757500346368
2020-03-05 17:48:42,jeanho,,4,6,121,"Why are there no Asian people on Love Is Blind do we not deserve to date in pods on a reality show and go through the various dramas and humiliations of choosing a spouse without seeing their face and body first",,,,1235623285498368000,https://twitter.com/jeanho/status/1235623285498368000
2020-03-05 17:48:18,brndouttt,longlastZ,2,23,1241,"thinking EVERY asian person uses racist undertones against african americans is racist in itself",,,,1235623185267163140,https://twitter.com/brndouttt/status/1235623185267163140
2020-03-05 17:45:54,victoriaxxviii,bethbourdon,8,22,381,"Every woke woman has 50 from 2012 where she makes fun of how asian people drive and every woke man has 50 tweets from 2012 where he talks about his repulsive fetish https://twitter.com/bethbourdon/status/1235396570000080896 …",,,,1235622580989673472,https://twitter.com/victoriaxxviii/status/1235622580989673472
2020-03-05 17:44:52,listephe,MTA,3,15,170,"We live in a country where people think drinking corona beer will get you Coronavirus and going to Asian restaurants put you at risk. Not surprised at all. This is BS. Stop this crap now.",,,,1235622319365795840,https://twitter.com/listephe/status/1235622319365795840
2020-03-05 17:42:55,LeMyTran2,minh81,3,285,910,"to add insult to injury, Vietnam has had no corona virus deaths. Unlike the US. not that it matters to white people what country an asian person is from or if we have been there recently. https://twitter.com/minh81/status/1235605810970910720 …",,,,1235621831119273985,https://twitter.com/LeMyTran2/status/1235621831119273985
2020-03-05 17:39:44,hxjrxh2,,271,13927,33077,"Disgusting isn’t the word. An old Asian man innocently asking for directions when it’s clear English isn’t his first language to be ridiculed unknowingly by an uneducated man thinking he must be funny by taking the piss out of someone who isn’t familiar with the language? pic.twitter.com/o9omBQLuiN",,,,1235621029994786823,https://twitter.com/hxjrxh2/status/1235621029994786823
2020-03-05 17:37:41,NCT127Union,,2,132,116,"STARMOMETER: 100 Asian Heartthrobs 2020 Battle Round Voting Period: Mar 5th-Mar 12th at 9pm KST TAEYONG is nominated in LVL 3 of the 100 Asian Heartthrobs 2020 Battle Round poll. Voting in this poll is unlimited. http://www.starmometer.com/2020/03/05/100-asian-heartthrobs-2020-battle-round-jungkook-vs-taeyong/ … #NCT127 #TAEYONG @NCTsmtown_127pic.twitter.com/NNR69WPNw5",,@NCTsmtown_127pic,#NCT127 #TAEYONG,1235620510530035712,https://twitter.com/NCT127Union/status/1235620510530035712
2020-03-05 17:36:15,theemilychee,KALONSMERALDO,21,435,5500,"If they think those asian kids had coronavirus, a virus that can be passed on through physical touch, that it would make sense to... physically touch them?",,,,1235620149685698560,https://twitter.com/theemilychee/status/1235620149685698560
2020-03-05 17:21:06,Klee_FilmReview,ItsCeliaAu,1,9,30,"I’m glad to see this tweet gain some more of attention, because it would certainly go more viral if it was a white guy doing this to a black guy. Asian discrimination in America still exists. The coronavirus is just an excuse to let it out publicly. https://twitter.com/ItsCeliaAu/status/1235287380292235264 …",,,,1235616338367766528,https://twitter.com/Klee_FilmReview/status/1235616338367766528
2020-03-05 17:14:32,longlastZ,IvyKungu,18,15,161,"Chile I never said it was ok but all of asian twitter ganged up on the one black girl who opened her own beauty supply with CLEAR racist undertones but you're leaping to their defense for what? They don't care about us and they never have. Put your cape away",,,,1235614686625714177,https://twitter.com/longlastZ/status/1235614686625714177
2020-03-05 17:13:27,Fubuki_twt,,10,775,1732,"""BTS went from being the First male kpop act to being first kpop act to First Korean act to first Asian act to first act to do things and that just shows how big they are. They are in their own league now "" pic.twitter.com/NMv8B3teY3",,,,1235614412112900096,https://twitter.com/Fubuki_twt/status/1235614412112900096
2020-03-05 17:02:16,mcjazzyjess,,1,23,57,"Hey here’s your reminder to stop racial profiling Asian Americans due to coronavirus scares",,,,1235611600519933954,https://twitter.com/mcjazzyjess/status/1235611600519933954
2020-03-05 17:01:46,yunhobearxo,KALONSMERALDO,13,81,1913,"My mother works in a doctors office and was telling me that there was a Asian patient who was waiting and he coughed and the entire waiting room started yelling for the doctor and for them to call police.",,,,1235611474493497345,https://twitter.com/yunhobearxo/status/1235611474493497345
2020-03-05 16:56:19,DawnHFoster,,5,21,121,"AOC won her seat through open selection and defeating a long-term incumbent. But the Labour right and the media belittle every person, but especially women and young Black and Asian women, for having socialists. We wouldn’t have a British AOC because you’d scream her down all day",,,,1235610101718962177,https://twitter.com/DawnHFoster/status/1235610101718962177
2020-03-05 16:51:30,AnnCoulter,jimgeraghty,37,148,664,"That's exactly how tax audits work, you complete nincompoop. 7x more likely to be audited with $1 mill + income; 30x more likely to be audited at $10 mill+ income. US Customs stops more honey from Asian countries to catch dangerous Chinese honey. Etc. https://twitter.com/jimgeraghty/status/1235595211922866178 …",,,,1235608889216733186,https://twitter.com/AnnCoulter/status/1235608889216733186
2020-03-05 16:51:25,karlawilson_,,2,105,506,"I’m tired of everyone freaking out about the coronavirus when ITS NOT THAT SERIOUS. JUST WASH UR FUCKING HANDS. I’m tired of this racist agenda making anyone of Asian background not able to do normal things without being singled out.",,,,1235608870279614464,https://twitter.com/karlawilson_/status/1235608870279614464
2020-03-05 16:50:53,vnagdale,,5,69,195,"yunb really did mess up from accepting the role to the way he handled the backlash but i’m so proud of the things he’s done to set things right because the musical will no longer be tupac x biggie based and nor will anyone be portraying any black characters if they’re asian pic.twitter.com/NY9DiWWO2l",,,,1235608735810285569,https://twitter.com/vnagdale/status/1235608735810285569
2020-03-05 16:50:06,JennRavenna,,4,4,137,"Some of us still have to struggle with issues of identity and disconnect well into our lives and our careers. This is part of the story for Asian-Americans.",,,,1235608536136052736,https://twitter.com/JennRavenna/status/1235608536136052736
2020-03-05 16:42:06,randomsubu,JulianCastro,6,24,100,"This was my dream ticket. But no, most Democratic voters - White, Black, Latino, Asian-American - wanted any one of three 78yo White men. For REASONS. https://twitter.com/JulianCastro/status/1235604904644956160 …",,,,1235606522597531654,https://twitter.com/randomsubu/status/1235606522597531654
2020-03-05 16:39:46,JennRavenna,,17,19,588,"As I make more films that touch on Asian identities I find myself struggling with my name again. I wanted to be Ravenna b/c I thought it would be easier & because Tran is so common. But now I’m yearning to bring my surname back into my professional life. I think it’s important.",,,,1235605935701147648,https://twitter.com/JennRavenna/status/1235605935701147648
2020-03-05 16:35:49,IAmAmnaNawaz,NewsHour,21,72,142,"Asian Americans, and Asians around the world, are facing increased racism and xenophobia because of ignorance around the #coronavirus. My latest for @NewsHour ...https://twitter.com/NewsHour/status/1235512881044692992 …",,@NewsHour,#coronavirus,1235604942741635073,https://twitter.com/IAmAmnaNawaz/status/1235604942741635073
2020-03-05 16:34:40,damn_toe,,2,169,496,"bro leave asian people alone. y’all are some fucking losers harassing these people like this....",,,,1235604655473913856,https://twitter.com/damn_toe/status/1235604655473913856
2020-03-05 16:18:21,TENzenter,,0,107,56,"#TEN is the winner of #100AsianHeartthrobs2020 Battle Level 2 #เตนล์ garnered 131,177 votes or 51.94% and will advance to level 3 and be one step closer to winning the title ”Ultimate Asian Heartthrob of 2020” Thank you very much to 10velys who voted for TEN #VoteForTen https://twitter.com/starmometer/status/1235598136145403904 …pic.twitter.com/wBqPU0tgs3",,,#TEN #100AsianHeartthrobs2020 #เตนล #VoteForTen,1235600548545490950,https://twitter.com/TENzenter/status/1235600548545490950
