date,username,to,replies,retweets,favorites,text,geo,mentions,hashtags,id,permalink
2020-03-14 23:57:38,TubularTransMan,,4,14,387,"A SHAMELESS MERCH PLUG. OF A HOODIE WITH CHINESE AND JAPANESE TEXT ON IT. ON A VIDEO ANOUT A PANDEMIC WHICH HAS SPARKED A MASSIVE AMOUNT OF ANTI ASIAN XENOPHOBIA AND RACISM. WHAT THE FUCK!! WHAT THE FUCK IS THIS THIS IS DISGUSTING @MatPatGT pic.twitter.com/MTTLDeLuAs",,@MatPatGT,,1238977619154132992,https://twitter.com/TubularTransMan/status/1238977619154132992
2020-03-14 23:48:25,guster,,21,12,309,"Empty shelves everywhere save the local Asian market, which delivered bigtime. Witness: my new favorite candy bar of all time— matcha KitKat. Find joy where you can y’all. And take care of each other. pic.twitter.com/iz3B6vSR7W",,,,1238975301138423809,https://twitter.com/guster/status/1238975301138423809
2020-03-14 23:41:37,lupeiflores,MrJeromeTrammel,2,2,121,"The percent Asian I am is in the negatives, that is how much i am not Asian. Your stank and racism is 110% tho.",,,,1238973590332215298,https://twitter.com/lupeiflores/status/1238973590332215298
2020-03-14 23:28:34,trzef,,5,8,109,"i went to an asian supermarket instead. lmao pic.twitter.com/wHCifXK3xj",,,,1238970306099843072,https://twitter.com/trzef/status/1238970306099843072
2020-03-14 23:25:59,big_data_kane,,0,6,49,"Aye...let me tell you what social distancing I'm not participating in: ignoring public racist attacks against Asian fam I already heard too many stories from students...makes my blood boil, want to flatten more than the epi curve....IJS",,,,1238969655731126272,https://twitter.com/big_data_kane/status/1238969655731126272
2020-03-14 23:21:09,mahogganyy,,2,13,26,"I hate when people refer to every Asian person they see as “ling ling”",,,,1238968440431480833,https://twitter.com/mahogganyy/status/1238968440431480833
2020-03-14 23:17:54,quincelikefruit,,1,28,113,"if you’re in portland fyi fubonn on se 82nd is like maybe slightly quieter than it usually is and has everything! walmart was absolutely ridiculous and out of a lot of stuff—support asian businesses especially now! pic.twitter.com/Haihnkh6U6 – at Fubonn Supermarket",,,,1238967622164557824,https://twitter.com/quincelikefruit/status/1238967622164557824
2020-03-14 23:15:44,ItsMrBanzai,,8,4,67,"Yesterday, I went to the grocery store. All the rice, instant ramen, pasta, flour, dry goods, etc. were wiped out. Today, I went to the Asian grocery store. It was completely stocked on everything. Welp... pic.twitter.com/WqZG11b9SZ",,,,1238967074698850305,https://twitter.com/ItsMrBanzai/status/1238967074698850305
2020-03-14 23:08:21,myvaluepicks,,7,45,245,"Companies which have eroded #least value include: Hindustan Unilever, GSK Consumer, Nestle India, Asian Paints, Pidilite Industries, Akzo Nobel India, Sanofi India, Wabco India, Bayer CropScience and Coromandel International. Note: Most of them are MNCs.",,,#least,1238965219310723072,https://twitter.com/myvaluepicks/status/1238965219310723072
2020-03-14 22:52:35,avilarenata,,2,16,50,"Asian & European friends from #COVIDー19 high risk countries: the touristic areas of my beautiful country #Guatemala are extremely vulnerable: chronic malnutrition levels in children and there are no hospitals w/x-rays, or hospitals at all. Abstain from visiting. pic.twitter.com/eODa1q9Cru",,,#COVIDー19 #Guatemala,1238961250123632641,https://twitter.com/avilarenata/status/1238961250123632641
2020-03-14 22:51:43,NoTotally,sarahkendzior,1,42,136,"White panic: the same news organizations consistently linking sickness with Muslim, Asian, other populations https://twitter.com/sarahkendzior/status/1238822282841198593 …",,,,1238961033982570496,https://twitter.com/NoTotally/status/1238961033982570496
2020-03-14 22:43:45,Black_Action,,10,40,124,"I'm not a African. I'm not a european. I'm not a asian. I'm not a middle easterner. I'm not a jew. I'm a BLACK AMERICAN. Yeah. I said it. #ADOSpic.twitter.com/8ndTxoSzor",,,#ADOSpic,1238959026584477697,https://twitter.com/Black_Action/status/1238959026584477697
2020-03-14 22:38:59,itsxdianaa,,0,8,144,"also, please support asian owned restaurants at a time like this",,,,1238957826875068416,https://twitter.com/itsxdianaa/status/1238957826875068416
2020-03-14 22:32:57,NYCMayor,,421,214,763,"We don't tolerate hatred and discrimination against Asian New Yorkers. We didn't before the COVID-19 crisis, we don't today and we NEVER will. Call 311 to report any acts of discrimination. Call 911 to report a hate crime. pic.twitter.com/aP0TwCXqmQ",,,,1238956308222619648,https://twitter.com/NYCMayor/status/1238956308222619648
2020-03-14 22:29:05,DionLimTV,lilaznboi113,15,16,91,"Thank you for sharing this. The racism Asian Americans are experiencing during this time of Coronavirus is an issue I feel strongly needs to be discussed. #CoronavirusPandemic #racismhttps://twitter.com/lilaznboi113/status/1238878324794855426 …",,,#CoronavirusPandemic #racismhttps,1238955336721039360,https://twitter.com/DionLimTV/status/1238955336721039360
2020-03-14 22:25:27,JacquiHeinrich,,4,7,33,"Some mention-worthy points reporting on panic shopping today: -local grocers are less picked over than wholesalers - fewer supply chain fears among grocers that source locally - for those who can’t afford to shop local/organic, liquor stores and Asian markets have plenty of stock",,,,1238954423453392899,https://twitter.com/JacquiHeinrich/status/1238954423453392899
2020-03-14 22:24:43,ocmillustration,,3,8,421,"My local asian grocery was fully stocked on everything and ALSO had cute pink homegoods!! I am moving in 2 months and cant wait for everything to be pink pic.twitter.com/T9y7q8WbIE",,,,1238954237628948480,https://twitter.com/ocmillustration/status/1238954237628948480
2020-03-14 22:13:13,_MercyWest_,,4,5,50,"My local grocery chain was completely out of necessities and fresh fruit/veggies. Then I went to the Asian market in the neighborhood aaaaannnddd... No panicked people. Plenty of politeness. Stocked shelves. I even bought a fresh egg puff waffle!",,,,1238951343772975105,https://twitter.com/_MercyWest_/status/1238951343772975105
2020-03-14 22:12:52,dcexaminer,,69,87,188,". @AOC can't seem to make up her mind. First she called people racists for not going to Asian restaurants, now she wants everyone to ""PLEASE"" stop going out and ""eat your meals at home,"" instead. Should I stay or should I go? https://washex.am/2WbvGXQ",,@AOC,,1238951256376463366,https://twitter.com/dcexaminer/status/1238951256376463366
2020-03-14 22:01:37,CoronaCoreanici,kathbarbadoro,2,13,23,"Support your local Asian groceries. Not only are they going to have a hard time of it, they're also likely to be well-stocked, because racism. Being Korean or Chinese or Italian doesn't magically make you more likely to have covid, because no one can afford to travel anyway. https://twitter.com/kathbarbadoro/status/1238675581513973760 …",,,,1238948425799831553,https://twitter.com/CoronaCoreanici/status/1238948425799831553
2020-03-14 23:44:17,Iridescent_Anny,monaeltahawy,1,7,34,"the whole world: judging us, racial discriminating us, beating random asian people on the street, even accusing us for ""creating"" the virus us: https://twitter.com/monaeltahawy/status/1238517693332029441 …",,,,1238974261986881538,https://twitter.com/Iridescent_Anny/status/1238974261986881538
2020-03-14 23:37:21,Greemoth,,3,10,38,"Due to recent xenophobia against the wonderful asian community i will be eating asian coochie for absolutely free ladies hit my line",,,,1238972514786668548,https://twitter.com/Greemoth/status/1238972514786668548
2020-03-14 23:26:56,Kyaandere,dumpling,1,0,124,"I don’t see the caption being that bad as most people have to stay home and she isn’t making fun of the situation and she is asian..?",,,,1238969893145411585,https://twitter.com/Kyaandere/status/1238969893145411585
2020-03-14 23:25:14,emilytwo,spamfriedrice,1,4,12,"I WOULD like to hear from businesses about their anti-racism and anti-discrimination stance. Anti-Asian/Am sentiment is amped up several notches right now. What can I expect to happen if an employee discriminates against a customer? https://twitter.com/spamfriedrice/status/1238922556482007040 …",,,,1238969466232373248,https://twitter.com/emilytwo/status/1238969466232373248
2020-03-14 23:16:01,Wygle,,1,4,13,"Also go to H Mart or another Asian grocery. They’re pretty stocked and no where near as busy as the other stores. We went there and Winco today, and Winco’s shelves were pretty sparse where H Mart didn’t look much different than normal. https://twitter.com/GrittyCitySndr/status/1238961622296621056 …pic.twitter.com/DQbMFr987x",,,,1238967147050594305,https://twitter.com/Wygle/status/1238967147050594305
2020-03-14 23:14:36,mandylemond,,5,2,146,"..NOT okay, one of my mommy peeps of Asian heritage was TARGETED earlier today. She was BORN here. She is an American, same as you. Surely to GOD. We are not going to be THAT kinda STUPID. #BeBetter",,,#BeBetter,1238966791508054016,https://twitter.com/mandylemond/status/1238966791508054016
2020-03-14 23:12:58,AliceLfc4,,6,1,144,"Things I did today to spite my depression: -went to the beach -shopped at my local Asian market -ate -got my nails done -read. A lot. -bought MM a special box for all his artwork and mementos -enjoyed the sunshine -ate again -did a whole bunch of calisthenic exercises",,,,1238966380369764357,https://twitter.com/AliceLfc4/status/1238966380369764357
2020-03-14 23:11:55,PhaedraXTeddy,,5,24,9,"Help Us Save The Asian Elephants by Liking and Sharing This Post #savetheasianelephants - Sign the Petition! http://chng.it/TY8HpkVh via @Change",,@Change,#savetheasianelephants,1238966115679821824,https://twitter.com/PhaedraXTeddy/status/1238966115679821824
2020-03-14 23:10:30,lowkeyamen,,1,13,43,"My bfs ordered a Chinese on their way home and it arrived before they did. We usually have to wait 40-60 mins from this one place bc it's so popular. Pls support ur local Chinese n Asian restaurants/take aways/food stores during this time if u can! This is people's livelihoods",,,,1238965758778097665,https://twitter.com/lowkeyamen/status/1238965758778097665
2020-03-14 22:59:04,nytopinion,,7,11,28,"""Coronavirus may have originated in China. But the disease doesn't discriminate in the way that people do,"" notes Asian-American teenager Katherine Oung pic.twitter.com/V1NCCMb277",,,,1238962881678446599,https://twitter.com/nytopinion/status/1238962881678446599
2020-03-14 22:58:09,DawnXianaMoon,,3,6,30,"The Asian groceries are nice and well-stocked. I shall now be surviving the Apocalypse with ALL THE DUMPLINGS. (Keep them alive, you all. But no panic-raiding. Deal?)",,,,1238962650882756616,https://twitter.com/DawnXianaMoon/status/1238962650882756616
2020-03-14 22:46:08,SanNuvola,,0,5,24,"regardless of if you think Asian others live in the colonial/exotic past or in an alternative/authoritarian/sci-fi future, you're assuming it's a world that exists outside of the Western present, which viruses clearly disprove",,,,1238959628169420800,https://twitter.com/SanNuvola/status/1238959628169420800
2020-03-14 22:37:26,ceejaybs,,0,3,25,"It’s crazy to see how all the yt people in full panic and clearing all the shelves at big named grocery stores but when I went into my local Asian market full of Asian senior citizens, NONE of their carts were extremely full and only got the essentials enough for them",,,,1238957437123588096,https://twitter.com/ceejaybs/status/1238957437123588096
2020-03-14 22:26:43,szwildcat,,7,7,42,"Taken early this afternoon. Local grocery store vs local asian grocery store. pic.twitter.com/rjBW3rjYJc",,,,1238954740500881408,https://twitter.com/szwildcat/status/1238954740500881408
2020-03-14 22:23:14,avatans,anandasjayant,5,21,38,"I am very skeptical about setting up Indic chairs overseas. That kind of money will go farther if spent in India. We know what those South Asian chairs are doing for India and Hindus: not good. https://twitter.com/anandasjayant/status/1238848036500955136 …",,,,1238953863597690881,https://twitter.com/avatans/status/1238953863597690881
2020-03-14 22:21:03,lrjlo,,1,6,19,"Among all the worry around at the moment, I'd like to share some nice wildlife photos & videos. This Asian short-clawed otter was having a good frolic at @WWTLondon on Thursday. It even took a dip in its water bowl. #cute #otterpic.twitter.com/CJ4Dv2vvUv",,@WWTLondon,#cute #otterpic,1238953313032376320,https://twitter.com/lrjlo/status/1238953313032376320
2020-03-14 22:15:56,ChrisShehanArt,,0,2,30,"Hit up your local Chinatown and Asian markets if you can. These businesses are hurting because people are racist. Plus, AMAZING FOOD. pic.twitter.com/X16lrJeNV4",,,,1238952026714918912,https://twitter.com/ChrisShehanArt/status/1238952026714918912
2020-03-14 22:13:13,danqdao,,2,1,25,"i realize coronavirus has basically spiraled into a universal fear now, & that we all need to come together...but even when this is all over, i will never forget how people beat, stabbed, & humiliated asian-americans bc they needed a scapegoat. i hope those ppl don’t survive",,,,1238951341655035904,https://twitter.com/danqdao/status/1238951341655035904
2020-03-14 22:05:21,GeekMelange,,2,2,43,"Did my grocery shopping by supporting a local Asian market which was unsurprisingly the lowest on instant soups and canned veggies & meats but got some fish & beef to portion & freeze to last a couple of weeks, along w/a bunch of other stuff. Not bad.",,,,1238949363839381510,https://twitter.com/GeekMelange/status/1238949363839381510
2020-03-14 22:02:55,TIME,,8,22,54,"At Census time, Asian Americans again confront the question of who ""counts"" as Asian. Here's how the answer got so complicated https://ti.me/33ksU47",,,,1238948749403095040,https://twitter.com/TIME/status/1238948749403095040
2020-03-14 22:00:52,theywantduhv,,9,229,854,"Y’all fw Asian food? Asian culture and inspired oriental pieces? into Asian women and men? got Asian friends? Ima need y’all to speak up and help call out racism and xenophobia. This corona virus is spreading quick but racism spreading quicker and It’s sick",,,,1238948235026157569,https://twitter.com/theywantduhv/status/1238948235026157569
2020-03-14 21:43:55,hailsatan420,,2,17,128,"hot tip: asian grocery stores are looking completely normal while places like TJs and Safeway are out of canned and frozen food, wipes, and hand sanitizers... if you need to shop, take advantage of white ignorance and go to Hong Phat or Fubonn",,,,1238943968005517312,https://twitter.com/hailsatan420/status/1238943968005517312
2020-03-14 21:38:50,FTrilliams,,18,164,379,"Notice how we haven’t seen any public pushback against Asian businesses seeking govt intervention and talking about racism. I have not heard anything about “the race-card”, or folks telling them to work harder, or talking to them about saving money to endure times like this. ijs",,,,1238942688503873538,https://twitter.com/FTrilliams/status/1238942688503873538
2020-03-14 21:35:39,ali,,8,16,32,"Which community in New York/New Jersey has been most affected? We know in Seattle, seniors were really impacted In California, we're closely watching the Asian population Why no Media curiosity over NY/NJ cases? Didn't they say most affected?",,,,1238941887752519681,https://twitter.com/ali/status/1238941887752519681
2020-03-14 21:30:44,gh0ulpunk,,2,24,103,"ppl avoiding asian markets are ridiculous... u think costco on a saturday isnt busier and higher risk for u to get sick???? like racism makes people so dumb",,,,1238940652211060736,https://twitter.com/gh0ulpunk/status/1238940652211060736
2020-03-14 21:30:15,Jhameel,,0,15,106,"Remember when Americans thought Asian people were weird for wearing facemasks everywhere?? Now ya’ll are hoarding toilet paper",,,,1238940531616440320,https://twitter.com/Jhameel/status/1238940531616440320
2020-03-14 21:28:06,LoLowerkey,,2,10,51,"Yt ppl suddenly “discovering” el super, tienditas, and Asian markets need to go to caucasia cuz we don’t want y’all here.",,,,1238939990677053441,https://twitter.com/LoLowerkey/status/1238939990677053441
2020-03-14 21:23:26,SpiggerAgenda2,TheBasedPluto,6,18,65,"See...incels aren’t just asian or white lol Many black men are susceptible to the movement because they feel even more entitled to the best women because of the bbc stereotype. Must suck when your bbc still isn’t granting you sex and respect from women lol https://twitter.com/TheBasedPluto/status/1238564293098049541 …",,,,1238938813776441344,https://twitter.com/SpiggerAgenda2/status/1238938813776441344
2020-03-14 21:22:16,daulizm,,2,11,79,"H-Mart was fully packed by like 95% Latino and Asian people. Most everything in stock! Even if busy. Shoutout to the white teenager who was on the phone w their mom (I think) who said ‘well if grandma doesn’t want to eat food from the Asian place she can starve’ lmaooo",,,,1238938521718722565,https://twitter.com/daulizm/status/1238938521718722565
2020-03-14 21:13:32,sen_ebooks,,4,14,106,"australia has more documented cases of covid19 from the united states than anywhere else, and yet people will still look at you funny for having the audacity to be asian in public lol",,,,1238936323341209600,https://twitter.com/sen_ebooks/status/1238936323341209600
2020-03-14 21:12:07,Abdullah_Azfal,,32,13,134,"Bro, some Asian shops have increased their prices on stuff, for example a big bag of rice that was £25 now going at £35. How do they sleep at night?",,,,1238935965147836416,https://twitter.com/Abdullah_Azfal/status/1238935965147836416
2020-03-14 21:11:45,NOIResearch,,3,48,46,"The Racial Life Expectancy Gap in the U.S. Center for Disease Control (CDC) data: Native Americans: 75.06 years African Americans: 75.54 years White Americans: 79.12 years Hispanic Americans: 82.89 years Asian Americans: 86.67 years https://www.thebalance.com/the-racial-life-expectancy-gap-in-the-u-s-4588898 …",,,,1238935875440050176,https://twitter.com/NOIResearch/status/1238935875440050176
2020-03-14 21:05:17,ashaxchandra,,7,8,147,"mine: discourse on colonialism, revolutionary suicide, indigenous people’s history of the us,wretched of the earth, collected poems of audre lorde, assata, south asian feminisms, native speaker, like water for chocolate, foundations of leninism, anything by gabriel garcia marquez",,,,1238934246124904449,https://twitter.com/ashaxchandra/status/1238934246124904449
2020-03-14 20:53:28,HiKittyKillz,,2,10,60,"Pro Tip: If you still need Coronavirus supplies, go to Asian grocery stores! They tend to always have stuff in stock long after the major stores are out! This was my secret for hurricane prep supply buying in Florida. pic.twitter.com/WiF0eOOHUA",,,,1238931275399884800,https://twitter.com/HiKittyKillz/status/1238931275399884800
2020-03-14 20:53:07,catcontentonly,,12,60,558,"Out of all the people at Costco, interesting photo choice to go with the one Asian woman wearing a face mask pic.twitter.com/sOxoCkyoiS",,,,1238931184568209409,https://twitter.com/catcontentonly/status/1238931184568209409
2020-03-14 20:48:39,TCC_Grouchy,AOC,3,16,62,"Unless you're patroning a Chinese or Asian restaurant... https://twitter.com/AOC/status/1238860728565747714 …",,,,1238930062948401155,https://twitter.com/TCC_Grouchy/status/1238930062948401155
2020-03-14 20:47:42,JohnCassidy,,15,49,142,"Hope I'm wrong, but judging by the trajectories in Italy, France, Spain, the UK, and the USA, western democracies can't hack the Asian response model until it's too late.",,,,1238929822811815936,https://twitter.com/JohnCassidy/status/1238929822811815936
2020-03-14 20:44:28,MissDaniDomme,,1,19,24,"Going to my local Asian market for a snack run. Send for ramen and Kit Kat’s {findom}",,,,1238929008085143552,https://twitter.com/MissDaniDomme/status/1238929008085143552
2020-03-14 20:42:52,cate_goff,,1,2,49,"coughing on the costco sample lady bc she offered everyone multiple samples and refused to let my asian mother have one<3",,,,1238928605490675719,https://twitter.com/cate_goff/status/1238928605490675719
2020-03-14 20:33:16,TheVTran,,1,3,48,"This is for free, but in return I ask that *IF YOU CAN AFFORD IT* - Donate to WHO's COVID-19 relief fund: https://www.who.int/emergencies/diseases/novel-coronavirus-2019/donate … - Or order food from a local Asian store if it's safe for you to do so If you CAN afford consulting, many freelancers would appreciate the work",,,,1238926188682399744,https://twitter.com/TheVTran/status/1238926188682399744
2020-03-14 20:29:15,Souvie,,3,6,38,"Order Chinese takeout today, go get boba, shop at the asian market, help out your local asian establishments",,,,1238925179125784576,https://twitter.com/Souvie/status/1238925179125784576
2020-03-14 20:28:52,Master_Splintr,maraaayy,0,3,90,"Try Asian and Mexican or just any cultural market “they” seem to stay out of those places.",,,,1238925081885040641,https://twitter.com/Master_Splintr/status/1238925081885040641
2020-03-14 20:17:03,calcuttajoons,,1,9,29,"must be nice to pretend racism towards south and south east asian cultures is something stan twt made up for attention",,,,1238922109419573248,https://twitter.com/calcuttajoons/status/1238922109419573248
2020-03-14 20:16:49,campmonday,,5,2,150,"shopping at an asian market is a rly good idea right now and i appreciate everyone suggesting it to me , but i do all my shopping at asian markets and i live in LA. they were picked clean before any of the western markets! some places have asian populations lol",,,,1238922051424882689,https://twitter.com/campmonday/status/1238922051424882689
2020-03-14 20:14:49,sasstricbypass,,0,10,43,"all i’m gonna say is that white people wanna panic buy and hurt asian owned businesses when just a couple seasons ago, y’all were having a real giggle about not washing your legs in the shower and using swimming pools instead of bathing in the summer time",,,,1238921546741121025,https://twitter.com/sasstricbypass/status/1238921546741121025
2020-03-14 20:10:39,JoyKOB,,18,19,58,"THIS IS NOT OKAY. Vandalism found behind an Asian restaurant in Albuquerque. This is xenophobia. This is racism. pic.twitter.com/dxio3iMGLT",,,,1238920499687600128,https://twitter.com/JoyKOB/status/1238920499687600128
2020-03-14 20:09:46,AdamGoesHam,,3,12,59,"I’m sure this has been tweeted already but just in case; I know the chain grocery stores are ravaged rn but the corner stores are fully stocked (even with toilet paper), also the Asian markets (Koreatown, Lil Tokyo) also fully stocked.",,,,1238920277582589954,https://twitter.com/AdamGoesHam/status/1238920277582589954
2020-03-14 20:04:48,mariameehye,bottomshelfbks,4,30,254,"This is true for ALL of the Asian grocery stores in Tucson right now. https://twitter.com/bottomshelfbks/status/1238564625261555712 …",,,,1238919026996170752,https://twitter.com/mariameehye/status/1238919026996170752
2020-03-14 20:02:18,betchitsbri,,7,18,236,"I’m waiting on someone to cross me with some corona/asian talk to I can have an excuse to rock a jaw clean off someone’s face... Don’t do it.",,,,1238918397523636224,https://twitter.com/betchitsbri/status/1238918397523636224
2020-03-14 19:52:49,_sophiecoyne_,,1,13,89,"Reasons to buy from your local Chinese restaurant right now: - supporting local asian-owned small businesses while racists are avoiding them - take out is better for social distancing than going out - lo mein is really good while watching netflix in self-quarantine",,,,1238916008817102850,https://twitter.com/_sophiecoyne_/status/1238916008817102850
2020-03-14 19:51:11,annakeiii,,6,10,64,"Tip: Cut the racism/xenophobia/entitled attitude and support Asian establishments- i.e Japanese stores have tons of rice, a variety of pre-made meals, fresh produce, delicious snacks/perishables, and household items. Most items have English labels, but I can provide descriptions! pic.twitter.com/LXvLenbhw0",,,,1238915600409190400,https://twitter.com/annakeiii/status/1238915600409190400
2020-03-14 19:45:34,annekem,,4,2,49,"Even though all the dinguses bought all the ramen in most grocery stores, y'all's Asian markets got ramen for daaaays and it's the good kind. Get down and get some. pic.twitter.com/OA580WYwk4 – at Asian Market",,,,1238914187490758657,https://twitter.com/annekem/status/1238914187490758657
2020-03-14 19:34:37,shieldoath,lallimusic,2,11,162,"this is also a GREAT time to find & support your local asian market, since many of them have experienced drops in sales since the beginning of the outbreak due to ignorance.",,,,1238911429224411143,https://twitter.com/shieldoath/status/1238911429224411143
2020-03-14 19:31:55,DrDenaGrayson,thespybrief,4,22,95,"Although highly contagious, 1957-58 Asian Flu was much less deadly than the #coronavirus & had a high % of deaths in younger people, as is typical with flu pandemics (older people often have partial immunity). #COVID19 is MUCH more deadly & affects older people disproportionally.",,,#coronavirus #COVID19,1238910749445152768,https://twitter.com/DrDenaGrayson/status/1238910749445152768
2020-03-14 19:28:29,nytopinion,,7,49,80,"""Not only do we have to be afraid about our health, but we have to be afraid about being ourselves,"" says Asian-American teenager Katherine Oung pic.twitter.com/S92FSdtjHI",,,,1238909887964471297,https://twitter.com/nytopinion/status/1238909887964471297
2020-03-14 19:20:22,bad_dominicana,,2,14,100,"spectros on netflix is a brazilian show and the leads are teen girls: an asian girl and a black girl involved in some supernatural affairs. im waiting for szn 2. pic.twitter.com/bYRMzjXuc6",,,,1238907842943430657,https://twitter.com/bad_dominicana/status/1238907842943430657
