date,username,to,replies,retweets,favorites,text,geo,mentions,hashtags,id,permalink
2020-03-07 23:58:00,SkyRacingAU,,1,8,29,"""For me #EachforEqual is pretty simple, it's about every person every day making an effort to move towards equality"" @racing_nsw Media and Communications Manager @JustJulieanne joined us to recognise International Women's Day 2020 #IWDpic.twitter.com/swbfBFtkQO",,@racing_nsw @JustJulieanne,#EachforEqual #IWDpic,1236440996587634689,https://twitter.com/SkyRacingAU/status/1236440996587634689
2020-03-07 23:58:00,CoachesVoice,,0,40,180,"""Playing football is very simple, but playing simple football is the hardest thing there is."" - Johan Cruyffpic.twitter.com/0n6gveSUrF",,,,1236440996570755072,https://twitter.com/CoachesVoice/status/1236440996570755072
2020-03-07 23:57:59,trinnbaby,,1,11,42,"if u can’t get lit to loud ass music in the car with me.. I don’t want it",,,,1236440995446706176,https://twitter.com/trinnbaby/status/1236440995446706176
2020-03-07 23:57:59,tj_delgado23,,153,768,5598,"Ok so imagine a festival with: Slander Kayzo Svdden Death I see stars Abandon all ships Asking Alexandria Kai Wachi Marauda Of mice and Men Said The Sky A Day to Remember Bring Me the Horizon August burns red Seven lions Excision Odesza Gryffin Green Day Linkin Park",,,,1236440993672634371,https://twitter.com/tj_delgado23/status/1236440993672634371
2020-03-07 23:57:59,mystikalgod666,MeekMill,2,10,8,"Bro you the older artisthttps://twitter.com/MeekMill/status/1236357731507998727 …",,,,1236440992787529728,https://twitter.com/mystikalgod666/status/1236440992787529728
2020-03-07 23:57:59,tiffaceee,nypost,1,31,52,"Meanwhile the SOAP, which is what you NEED is cheaper. Y’all really choosing hand sanitizer over soap? Idiotshttps://twitter.com/nypost/status/1236090831938912261 …",,,,1236440992661856256,https://twitter.com/tiffaceee/status/1236440992661856256
2020-03-07 23:57:59,GolfChannel,,2,3,26,"Marc Leishman's even par 72 on @PenskeNews #MovingDay at the #APInv leaves him tied for second going into final round play on Sunday pic.twitter.com/tQg9NX4MiB",,@PenskeNews,#MovingDay #APInv,1236440992515047424,https://twitter.com/GolfChannel/status/1236440992515047424
2020-03-07 23:57:58,Iadiesonfire,,31,6,342,"babysitting for this family and i found their movie collection pic.twitter.com/Z5DzRqGha2",,,,1236440991420297216,https://twitter.com/Iadiesonfire/status/1236440991420297216
2020-03-07 23:57:58,BrotherhoodCBB,,1,4,22,"Duke turned the energy and tempo up to a 100 tonight. Gave up too many open looks and offensive boards, but really good half nonetheless. 13-30 FG 4-11 3PT 12-14 FT Tre: 12 points, 4 assists, 3 boards Stanley: 8 points, 3 boards JRob: 7 points, 4 boards",,,,1236440989822324743,https://twitter.com/BrotherhoodCBB/status/1236440989822324743
2020-03-07 23:57:58,Trey_VonDinkis,,4,183,147,". MAGA HEALTH - INFECTIOUS DISEASE DOCTOR / TRUMP ACTING 'DILIGENTLY' Dr. Dan O'Brien, Public Heath and Infectious Disease Specialist, on Trump's Handling of Coronavirus - Trump has acted 'Very Diligently' . OAN Report >https://www.youtube.com/watch?v=jQMyvhCcVNk …",,,,1236440989482381312,https://twitter.com/Trey_VonDinkis/status/1236440989482381312
2020-03-07 23:57:58,RonDanChan,,3,3,27,"I saw a post pointing out that ""fridge"" has a D in it, but ""refrigerator"" doesn't, and I'll never recover from this.",,,,1236440989398515712,https://twitter.com/RonDanChan/status/1236440989398515712
2020-03-07 23:57:58,WayneMcGaheeIII,,2,32,166,"Video: Watch as #FSU celebrates its first ACC regular season title and the unveiling of a new banner at the Tucker Center https://www.tallahassee.com/videos/sports/college/fsu/mensbasketball/2020/03/07/video-fsu-basketball-celebrates-first-acc-regular-season-title/4990052002/ …pic.twitter.com/lPAvEAmrjM",,,#FSU,1236440988756959232,https://twitter.com/WayneMcGaheeIII/status/1236440988756959232
2020-03-07 23:57:58,DelCityHoops,44thRose,0,6,28,"We take pride in making our Alumni proud , you guys were part of the path that we want to continue to a Championship caliber program! #ClockIn Thanks for your support ! #Familyhttps://twitter.com/44thRose/status/1235966119263064075 …",,,#ClockIn #Familyhttps,1236440988249403392,https://twitter.com/DelCityHoops/status/1236440988249403392
2020-03-07 23:57:58,meszz_a,meszz_a,3,19,89,"What's wrong with me....https://twitter.com/meszz_a/status/1236428257190281216 …",,,,1236440987376840704,https://twitter.com/meszz_a/status/1236440987376840704
2020-03-07 23:57:57,SphatikaMenon,,0,20,31,"Dialogs poora suna karo, before name-calling!! He said clearly ""Mai jaantha hoon Maa, woh zinda hai""...how...wait for it to be revealed!! Kya hua..digest nahi hua that u can't call him a murderer! GULP IT DOWN & keep bashing till the next slap from the CVs!! #KasautiiZindagiiKay",,,#KasautiiZindagiiKay,1236440987268001793,https://twitter.com/SphatikaMenon/status/1236440987268001793
2020-03-07 23:57:57,navion1990,,6,90,214,"Clearly written on his face how smitten he was from start #SIDNAAZpic.twitter.com/miDhFoDHXA",,,#SIDNAAZpic,1236440986831720451,https://twitter.com/navion1990/status/1236440986831720451
2020-03-07 23:57:57,JheneAiko,IssaNotRaee,7,1,136,"nope!",,,,1236440985942380544,https://twitter.com/JheneAiko/status/1236440985942380544
2020-03-07 23:57:57,SDP_FANUNION,,6,269,567,"You’re the prettiest when you smile Have a lovely Sunday, everyone! #X1 #SONDONGPYO #손동표 @x1official101pic.twitter.com/tTllaR7EaM",,@x1official101pic,#X1 #SONDONGPYO #손동표,1236440985623597057,https://twitter.com/SDP_FANUNION/status/1236440985623597057
2020-03-07 23:57:57,Goon_Lagoon__,ReeraTakes,2,5,321,"He describes it like gay fan fiction written by a 12 year old girl",,,,1236440985606840321,https://twitter.com/Goon_Lagoon__/status/1236440985606840321
2020-03-07 23:57:57,a0rii,,1,166,392,"Here's the boys being stylish for the camera! Only a week left to preorder <3 #sorikupic.twitter.com/iqc6k37e4m",,,#sorikupic,1236440985095323651,https://twitter.com/a0rii/status/1236440985095323651
2020-03-07 23:57:57,MarcusGatling,,1,7,73,"Had a great Jr Day at Liberty today. Thanks for having me. @CoachA_LU @coachsymons @LibertyFootballpic.twitter.com/pbIneayzF4",,@CoachA_LU @coachsymons @LibertyFootballpic,,1236440984403181569,https://twitter.com/MarcusGatling/status/1236440984403181569
2020-03-07 23:57:57,clarebarnett137,,2,4,30,"Some of the reasons Loblaw’s is one of Canada’s Top employers..its Brampton HQ features reserved front-row parking for carpoolers and expectant mothers, a medical centre, an outdoor beach volleyball court, a basketball court and a skating rink. https://reviews.canadastop100.com/top-employer-loblaws …",,,,1236440984143237127,https://twitter.com/clarebarnett137/status/1236440984143237127
2020-03-07 23:57:57,silviaojeda896,,2,8,35,"Vamos Boca lpmqlp Que belleza por Favor pic.twitter.com/FttxjOjjpS",,,,1236440983526608896,https://twitter.com/silviaojeda896/status/1236440983526608896
2020-03-07 23:57:57,returningassets,,1,12,17,"Following the collapse of #Malaysia's ruling coalition anti-corruption chief who investigated #1MDB #corruption case resigns. #AssetRecoveryhttps://www.aljazeera.com/ajimpact/malaysia-anti-corruption-chief-investigated-1mdb-resigns-200306021953213.html …",,,#Malaysia #1MDB #corruption #AssetRecoveryhttps,1236440983476170752,https://twitter.com/returningassets/status/1236440983476170752
2020-03-07 23:57:56,CalBaseball,,2,7,32,"PSA: Joseph King is a baaaad man. The freshman strikes out a pair of Dons to end the 8th! 6-1 lead going into the 9th.pic.twitter.com/L6xLlgv0ZL",,,,1236440982431748096,https://twitter.com/CalBaseball/status/1236440982431748096
2020-03-07 23:57:56,uzbadyubi,,7,1,82,"I GENUINELY DON'T KNOW IF THAT WAS A BIRD OR A DINO I AM FEARFUL 233/- #YubiViews",,,#YubiViews,1236440981135859713,https://twitter.com/uzbadyubi/status/1236440981135859713
2020-03-07 23:57:56,Phil_Rips,BenjaminPDixon,2,3,165,"The major issue is that he can't correct himself even with three attempts and then he has to move on to something else. That's far from a minor fumble.",,,,1236440979126640640,https://twitter.com/Phil_Rips/status/1236440979126640640
2020-03-07 23:57:55,MarketWatch,,2,10,19,"Barron's on MarketWatch: San Francisco's aggressive coronavirus approachhttps://on.mktw.net/39yo31x",,,,1236440978665418752,https://twitter.com/MarketWatch/status/1236440978665418752
2020-03-07 23:57:55,tearygguk,voltarenpotas,0,12,39,"kissfm is supposed to be releasing info having to do with bts.... KISSFM IS SUPPOSED TO BE RELEASING INFO HAVING TO DO WITH BTS #BTSinSeattlehttps://twitter.com/voltarenpotas/status/1193920484234186753 …",,,#BTSinSeattlehttps,1236440978212311040,https://twitter.com/tearygguk/status/1236440978212311040
2020-03-07 23:57:55,dojacas,,1,29,105,"me taking the sandwiches that cas made from sam and dean because they didn’t appreciate them enoughpic.twitter.com/H0aeX7KoBj",,,,1236440977621090304,https://twitter.com/dojacas/status/1236440977621090304
2020-03-07 23:57:55,saddsapphic,,4,20,130,"my account is gradually becoming a jirou stan account which is probably the most brilliant thing I’ve done with my lifepic.twitter.com/Mulw7GC6xh",,,,1236440977432248326,https://twitter.com/saddsapphic/status/1236440977432248326
2020-03-07 23:57:55,susankey_key,JamilSmith,0,7,32,"Seems like a good night to watch Contagion. What think you, Matt? Going to wear your mask to the funerals of your constituents? @RepBobbyRush @mattgaetz",,@RepBobbyRush @mattgaetz,,1236440977335881734,https://twitter.com/susankey_key/status/1236440977335881734
2020-03-07 23:57:55,Coach_Alejo,pntrack,1,30,167,"“You get aerobically fit by stacking together anaerobic work.” What a great comment. Scientific and simple!https://twitter.com/pntrack/status/1236427038669656065 …",,,,1236440974840061952,https://twitter.com/Coach_Alejo/status/1236440974840061952
2020-03-07 23:57:54,briannagranados,,1,2,27,"I luv to take boomerangs pic.twitter.com/PQBZrgHss3",,,,1236440974508929024,https://twitter.com/briannagranados/status/1236440974508929024
2020-03-07 23:57:54,Vinny,,10,5,106,"Impractical jokers movie was hilarious",,,,1236440974206869504,https://twitter.com/Vinny/status/1236440974206869504
2020-03-07 23:57:54,yoomster,,11,70,218,"what'd you name him? (1/2) #yourturntodie #キミガシネpic.twitter.com/O9NMW0w44a",,,#yourturntodie #キミガシネpic,1236440974194286592,https://twitter.com/yoomster/status/1236440974194286592
2020-03-07 23:57:54,ghostinevans,,0,1,59,"goodnightpic.twitter.com/oVHDr6OWkd",,,,1236440972596256768,https://twitter.com/ghostinevans/status/1236440972596256768
2020-03-07 23:57:54,MichaelKistNFL,,10,15,159,"Some ""scout"" things I learned on #DraftTwitter: - Aggregate takes; work smarter - Die on the hill; you have limitless lives - Delete uber-bad takes quietly - Dunk when you blindly guess right - Block every critic - ""Go back to the film"" after 40s - Pretend to grind; have a life",,,#DraftTwitter,1236440972558512128,https://twitter.com/MichaelKistNFL/status/1236440972558512128
2020-03-07 23:57:54,ddl_needylover,,0,4,19,"hating on other artists won't get your favs to be more respected, it will just make people hate them even more",,,,1236440972294225921,https://twitter.com/ddl_needylover/status/1236440972294225921
2020-03-07 23:57:53,historylvrsclub,,2,17,111,"Rare photos of JFK in glasses. See more photos: http://cmore.pics/v0h1p pic.twitter.com/ZqqDdx6Apc",,,,1236440969328971776,https://twitter.com/historylvrsclub/status/1236440969328971776
2020-03-07 23:57:53,CollegeSquash,,0,7,21,"Aly Abou Eleinen of @PennSquash will take on Marwan Tarek of @harvardsquash for the 2020 @CollegeSquash Men’s Individual Title tomorrow at 1:30 PM EDT on Court 1: http://bit.ly/2020individualchamps … @USSQUASH @millmansquash @HotBalls5th @SquashMadDotCom #squashpic.twitter.com/gNGcMu0wJ1",,@PennSquash @harvardsquash @CollegeSquash @USSQUASH @millmansquash @HotBalls5th @SquashMadDotCom,#squashpic,1236440968624291840,https://twitter.com/CollegeSquash/status/1236440968624291840
2020-03-07 23:57:53,tinocoo08,,2,36,109,"I saw this on here, so I tried it on my dad and he was so pissed pic.twitter.com/jRTvp7IKDI",,,,1236440968112398336,https://twitter.com/tinocoo08/status/1236440968112398336
2020-03-07 23:57:53,chauntelpowell,,1,15,60,"A Shot of Henni: Sharp Shooting Destanni Henderson leads Gamecocks Past Arkansas https://www.si.com/college/southcarolina/basketball/sec-tourney-semis …",,,,1236440967898714112,https://twitter.com/chauntelpowell/status/1236440967898714112
2020-03-07 23:57:53,glazedbobohus,,0,26,64,"this angle pic.twitter.com/aDI5fVr0Js",,,,1236440967865139200,https://twitter.com/glazedbobohus/status/1236440967865139200
2020-03-07 23:57:53,mistressaleena,,2,17,68,"me being bored resulted in these pics, now send for them bc i’m too precious (°◡°♡) findom femdom finsub paypig sph joi cbt cei cashslave cashcow humanatm bodyworship findomfeet findombrat findomme pic.twitter.com/Y8GNyO37zH",,,,1236440966522736641,https://twitter.com/mistressaleena/status/1236440966522736641
2020-03-07 23:57:53,zanchez_XXX,,4,5,250,"Me waiting for a payment pic.twitter.com/vjN5Qk2UHj",,,,1236440966451449857,https://twitter.com/zanchez_XXX/status/1236440966451449857
2020-03-07 23:57:52,hoodcuIture,bitchbecareful,0,13,42,"No, because it has nothing to do with me. If i care about you i want to see you happy regardless. Just dont start complaining if you chose the wrong person. ALSO don’t expect me to be available after you made that choicehttps://twitter.com/bitchbecareful/status/1236438650889609216 …",,,,1236440965684002817,https://twitter.com/hoodcuIture/status/1236440965684002817
2020-03-07 23:57:52,kathleenmadigan,malonebarry,22,55,613,"I dont know who's cuter, the dog or the pres of ireland. Gr8 party crashing on the dogs part. Wait 4 it...https://twitter.com/malonebarry/status/1236437084728176641 …",,,,1236440964497051648,https://twitter.com/kathleenmadigan/status/1236440964497051648
2020-03-07 23:57:52,RyanJamesMN,,5,10,59,"Mora senior Lucas Athey at the buzzer!!! Mora defeats Annandale 67-64pic.twitter.com/5yOoPkV9AJ",,,,1236440964220190721,https://twitter.com/RyanJamesMN/status/1236440964220190721
2020-03-07 23:57:52,DJPooh,,8,26,63,"Don’t fall for it y’all pic.twitter.com/DQSW9Clu8T",,,,1236440963851010048,https://twitter.com/DJPooh/status/1236440963851010048
2020-03-07 23:57:52,Drjai32,,2,11,30,"#HellNoJoe We cant nominate this man. #JoeBiden needs to be at home resting and spending time with his family.pic.twitter.com/SPUj4QMkvT",,,#HellNoJoe #JoeBiden,1236440963775594497,https://twitter.com/Drjai32/status/1236440963775594497
2020-03-07 23:57:52,PoorlyAgedStuff,MarkSalling,23,29,423,"oh dearhttps://twitter.com/MarkSalling/status/645187366756478976 …",,,,1236440963377180673,https://twitter.com/PoorlyAgedStuff/status/1236440963377180673
2020-03-07 23:57:52,Mulboyne,,9,99,334,"Priests performed a ritual yesterday at Kinpusen-ji in Nara, to pray for an early end to the coronavirus epidemic. https://mainichi.jp/english/articles/20200307/p2a/00m/0na/006000c …pic.twitter.com/SoCtRGx800",,,,1236440963238596608,https://twitter.com/Mulboyne/status/1236440963238596608
2020-03-07 23:57:52,BigEastTourney,,6,13,52,"1995 Big East Tournament Championship Connecticut vs Villanovapic.twitter.com/3yYRpp5g3A",,,,1236440962760683520,https://twitter.com/BigEastTourney/status/1236440962760683520
2020-03-07 23:57:51,Vozable,prettycritical,0,4,707,"You mean he wasn’t getting paid 250k a speech somewhere? Wow! What a loser!",,,,1236440961313431552,https://twitter.com/Vozable/status/1236440961313431552
2020-03-07 23:57:51,roseayy_red,,1,5,48,"Jamaica you will be missed pic.twitter.com/foxSzS4lnO",,,,1236440961066172416,https://twitter.com/roseayy_red/status/1236440961066172416
2020-03-07 23:57:51,godisawomann,,33,1,34,"30 secs........",,,,1236440959161757702,https://twitter.com/godisawomann/status/1236440959161757702
2020-03-07 23:57:50,kurteichenwald,cenkuygur,77,5,63,"Cenk. Trump. I know youre working as hard as you possibly can on his behalf by tearing down the potential Dem nominee -rather than advocating FOR your preference. And I cant decide if its because of your narcissism, your intense desire to say ""I WAS RIGHT!"" or you being a GOPr.",,,,1236440957685563392,https://twitter.com/kurteichenwald/status/1236440957685563392
2020-03-07 23:57:50,reaganojohnson,,0,5,55,"Got a big WIN against a top ranked 6A school today.. this was the tying run #dontsleeponme #speedkills @kcbadger_SB @Thunderbolts04 @BhmBolts99pic.twitter.com/S2NwogEhJ2",,@kcbadger_SB @Thunderbolts04 @BhmBolts99pic,#dontsleeponme #speedkills,1236440956368543747,https://twitter.com/reaganojohnson/status/1236440956368543747
2020-03-07 23:57:50,OGaquafina,,0,9,46,"Kris Jenner is really the goat momager I have to respect it",,,,1236440955118473216,https://twitter.com/OGaquafina/status/1236440955118473216
2020-03-07 23:57:50,shadowfuzz,MSPFirstDist,1,9,49,"One of your troopers committing felony theft is a weird thing to brag about on twitter.https://twitter.com/MSPFirstDist/status/1235265810802888704 …",,,,1236440954304946176,https://twitter.com/shadowfuzz/status/1236440954304946176
2020-03-07 23:57:50,ScottHech,VOCALNewYork,0,13,42,"And despite the opportunity @NYCMayor De Blasio has right now to invest in public health instead of the status quo, he’s out fighting everyday alongside NYPD, spreading fake news about a debunked “uptick” in crime so he can go back to jailing thousands more Black & Brown people.https://twitter.com/VOCALNewYork/status/1236391839109918721 …",,@NYCMayor,,1236440954170679297,https://twitter.com/ScottHech/status/1236440954170679297
2020-03-07 23:57:49,Bloodround,,3,8,53,"Congrats to @Baronness324 for being the first female ref to work the @mhsaa state finals!!!pic.twitter.com/Pdn7BsZBta",,@Baronness324 @mhsaa,,1236440952547479553,https://twitter.com/Bloodround/status/1236440952547479553
2020-03-07 23:57:49,ASAPFERRRR,,1,22,25,"𝙏𝙍𝙄𝙋𝙈𝙊𝙇𝙇𝙔 // fer is the only one who matters #VINESELFIEpic.twitter.com/zisJUkHVgi",,,#VINESELFIEpic,1236440950550999040,https://twitter.com/ASAPFERRRR/status/1236440950550999040
2020-03-07 23:57:49,briancbarbour,,2,8,143,"I assume K was telling Mike Eades he did a great job and to keep up the good work",,,,1236440950165180416,https://twitter.com/briancbarbour/status/1236440950165180416
2020-03-07 23:57:48,YourLoveWonho,,0,9,24,"I'm your baby monbebe. ~~ (N) sfw ~~ Flirt ~~ Bisexual ~~ Monbebe's Protector ~~ Daddy Kink ~~ Cat Lover // Admin will talk like this\\pic.twitter.com/iS5jtKlXLJ",,,,1236440947212398593,https://twitter.com/YourLoveWonho/status/1236440947212398593
2020-03-07 23:57:48,_robanderson,,5,8,187,"Just realized that Creighton shot 12-for-13 from the field in the final 9:00 of the game, which was integral in the game-ending 30-10 run.",,,,1236440946092408834,https://twitter.com/_robanderson/status/1236440946092408834
2020-03-07 23:57:48,aylene_rv,,0,6,55,"you know the mf vibeee☆pic.twitter.com/7ZWjIghIeJ",,,,1236440945979281408,https://twitter.com/aylene_rv/status/1236440945979281408
2020-03-07 23:57:48,perth_meso_dr,,0,3,27,"#IWD20 We stand on the shoulders of our mothers & gmothers. Margaret Nowak - one of 2 women in her year at @USydneyEcon in the 1950s. Refused to wear a uniform at @ReserveBankAu as the only female with a degree. Returned 2 work married (shock!). Didn’t do canteen duty!",,@USydneyEcon @ReserveBankAu,#IWD20,1236440945962283008,https://twitter.com/perth_meso_dr/status/1236440945962283008
2020-03-07 23:57:48,manifestive,,59,77,1161,"Ah why... momo come turn “good evening” anaa... we dey give am daily to every bruh on sight? #AwakeTwitter",,,#AwakeTwitter,1236440945840795650,https://twitter.com/manifestive/status/1236440945840795650
2020-03-07 23:57:48,DianeFenton8,,0,3,21,"Another great @EdCampRockland. Fun seeing some familiar faces from my Caldors days. @schechter_barry @thehotTimAhle @KFelicello @NRCSDistrictpic.twitter.com/ZMzM93bXTj",,@EdCampRockland @schechter_barry @thehotTimAhle @KFelicello @NRCSDistrictpic,,1236440945647915010,https://twitter.com/DianeFenton8/status/1236440945647915010
2020-03-07 23:57:47,WeekendTwitr,,2,8,24,"blessing your timeline with a little scottish twitter this eveningpic.twitter.com/TUVp8afoZv",,,,1236440945278750724,https://twitter.com/WeekendTwitr/status/1236440945278750724
2020-03-07 23:57:47,lCYEOSANG,,45,7,317,"ok i edited a new pink layout is it ok pic.twitter.com/MsmZEQJ1a2",,,,1236440945266130946,https://twitter.com/lCYEOSANG/status/1236440945266130946
2020-03-07 23:57:47,Piano_IsMyForte,briscoepark,0,7,80,"these aren’t pictures, this is a feelinghttps://twitter.com/briscoepark/status/1236432995663241217 …",,,,1236440945186549761,https://twitter.com/Piano_IsMyForte/status/1236440945186549761
2020-03-07 23:57:47,DirtySouthSoc,,2,5,88,"A++ on the new pregame hype videos",,,,1236440942665760769,https://twitter.com/DirtySouthSoc/status/1236440942665760769
2020-03-07 23:57:47,judgeyourself99,,12,41,126,"America has a long way to go to remove the stain of @realDonaldTrump from the WhiteHouse, Putin has set you back decades. Long after Trump is deposed people will be still wondering how in f**ks sake was he ever allowed to get away with so much.",,@realDonaldTrump,,1236440942489542656,https://twitter.com/judgeyourself99/status/1236440942489542656
2020-03-07 23:57:47,oohpujie,BenjaminPDixon,4,1,125,"oh my god someone please let me off this carousel",,,,1236440942216908801,https://twitter.com/oohpujie/status/1236440942216908801
2020-03-07 23:57:47,BarstoolBDevils,,11,9,201,"HALFTIME: 42-34 -We could be playing better but it’s senior night and they have Cameron ELECTRIC -Cole Anthony SUCKS -One half left and I can honestly say every second of tenting was undoubtedly worth it",,,,1236440941902299143,https://twitter.com/BarstoolBDevils/status/1236440941902299143
2020-03-07 23:57:46,Neoavatara,,25,33,251,"I think all this proves that nobody would survive the zombie apocalypse.",,,,1236440940551770113,https://twitter.com/Neoavatara/status/1236440940551770113
2020-03-07 23:57:46,leonarrdomiguel,,1,20,58,"Let's talk about sex baby",,,,1236440939444547584,https://twitter.com/leonarrdomiguel/status/1236440939444547584
2020-03-07 23:57:46,AMRSAMYSELIM,,0,4,21,"My fav notification wallahi",,,,1236440938161025030,https://twitter.com/AMRSAMYSELIM/status/1236440938161025030
2020-03-07 23:57:46,JayneMarie007,,3,86,38,"LEVELLAND ANIMAL SHELTER #TEXAS Available for #ADOPTION Being #Fostered at the moment.. DIVA is a 2 year old Staffordshire Terrier female She loves people and is very well mannered. Good with most dogs.. Morepic.twitter.com/FJqBwgZvav",,,#TEXAS #ADOPTION #Fostered,1236440937699708934,https://twitter.com/JayneMarie007/status/1236440937699708934
2020-03-07 23:57:45,runtheirstops,,7,2,30,"Another day, another scammer blocking me. Please educate yourselves before throwing hundreds of dollars at someone because they have some followers and basic knowledge.pic.twitter.com/Sal5hwKpLn",,,,1236440936684630016,https://twitter.com/runtheirstops/status/1236440936684630016
2020-03-07 23:57:45,SweetSugaah,,8,2,41,"Still in search of that once in a lifetime necklace pic.twitter.com/5KGHGyKm5Z",,,,1236440936562839552,https://twitter.com/SweetSugaah/status/1236440936562839552
2020-03-07 23:57:45,NDCFalcons,,0,7,32,"Who’s ready for some MEC championship basketball tomorrow? #FlyAbovepic.twitter.com/T6YEd9MeQx",,,#FlyAbovepic,1236440936466571271,https://twitter.com/NDCFalcons/status/1236440936466571271
2020-03-07 23:57:45,annnahatcher,,1,11,234,"I finally did see 3 women and I walked up to them and asked if they were there for Meghan and Harry. And they got super excited and started showing me pics they took yesterday at the Endeavour thingy and we bonded immediately so we were literally standing next to their carpic.twitter.com/9ngmnEtPod",,,,1236440935568900102,https://twitter.com/annnahatcher/status/1236440935568900102
2020-03-07 23:57:45,lexisggabrielle,,5,3,42,"first y’all get mad at me for my pictures of dicks as food, now y’all mad bout the pics i post what do y’all want from me pic.twitter.com/e1sCQkvlkz",,,,1236440935258603520,https://twitter.com/lexisggabrielle/status/1236440935258603520
2020-03-07 23:57:45,bourgeoisalien,,6,4,76,"just spitballing here, but has anybody tried shoving the democratic party back in Pandora's box",,,,1236440934956572674,https://twitter.com/bourgeoisalien/status/1236440934956572674
2020-03-07 23:57:45,jarreauvandal,,4,6,54,"Shazaming a song in the club is like catching a pokemon but then very lowkey. Especially being a dj lolpic.twitter.com/p5tzSiZx9w",,,,1236440933417340928,https://twitter.com/jarreauvandal/status/1236440933417340928
2020-03-07 23:57:45,AndonCorleone,ArmzKorleone,1,3,37,"The way he effortlessly lifts up that fat dumbellhttps://twitter.com/ArmzKorleone/status/1194574263740710912 …",,,,1236440933262131201,https://twitter.com/AndonCorleone/status/1236440933262131201
2020-03-07 23:57:45,bts_sci,doyou_bangtan,2,7,131,"I really appreciate your translations and updates on BTS-related content. You don't have to explain what or who you like and I'm sure the majority of ARMY don't care. The problem is you supported the article degrading BTS artistry while defending a similar article targeting KPop.",,,,1236440933085765633,https://twitter.com/bts_sci/status/1236440933085765633
2020-03-07 23:57:45,kurlyamayaa,,0,4,39,"gone have that nigga crawling like a baby tryna get back to me pic.twitter.com/Mhg4YOmmlo",,,,1236440932934975488,https://twitter.com/kurlyamayaa/status/1236440932934975488
2020-03-07 23:57:44,wigu,,2,0,52,"I rode my bike 10 miles today and it's the first time I rode my bike in 3 months and I had to take a nap!",,,,1236440931479552006,https://twitter.com/wigu/status/1236440931479552006
