date,username,to,replies,retweets,favorites,text,geo,mentions,hashtags,id,permalink
2020-03-07 23:59:33,DawnOfShadow,,4,8,165,"It never occurred to me that ""Mozzie"" is stralian' for ""mosquito"". Where can I get me some Anti-Mozzie though? @MartinCoppingpic.twitter.com/AgSAB5VMTd",,@MartinCoppingpic,,1236441386121035779,https://twitter.com/DawnOfShadow/status/1236441386121035779
2020-03-07 23:59:32,AgharFb,,3,17,237,"Miss you pic.twitter.com/kFEd78MKES",,,,1236441385370357760,https://twitter.com/AgharFb/status/1236441385370357760
2020-03-07 23:59:32,js_06,,4,10,76,"This is how I imagine Aleister when he created the first esper.pic.twitter.com/mrL4o7mbIj",,,,1236441384846008320,https://twitter.com/js_06/status/1236441384846008320
2020-03-07 23:59:32,DCComics,,16,137,1389,"Batman responds to the Bat-Signal faster than texts, no question. Sound off on LOIS LANE #9!pic.twitter.com/G297NVrsMF",,,#9,1236441384573448192,https://twitter.com/DCComics/status/1236441384573448192
2020-03-07 23:59:32,Angels,,26,193,2201,"David watching his little brother’s first Cactus League AB pic.twitter.com/haUByhKGwA",,,,1236441383713435648,https://twitter.com/Angels/status/1236441383713435648
2020-03-07 23:59:32,BringdaSpring,,1,3,16,"I am far from perfect, I need to focus on changing a lot of things in my lifestyle to be a more productive healthier and happier person.",,,,1236441383277297665,https://twitter.com/BringdaSpring/status/1236441383277297665
2020-03-07 23:59:32,DRIPPINJOHNNY,Rude_Astrology,3,117,417,"Ahhh NCT 127 wins on music shows https://twitter.com/Rude_Astrology/status/1236096663363686400 …",,,,1236441382719352834,https://twitter.com/DRIPPINJOHNNY/status/1236441382719352834
2020-03-07 23:59:32,ChrisPeach001,,33,58,532,"Here's some pics of my Slaanesh Warband for Warcry....i use the Splintered Fang rules for these baby's.pic.twitter.com/vU2CauXknS",,,,1236441381700341761,https://twitter.com/ChrisPeach001/status/1236441381700341761
2020-03-07 23:59:31,mgtruth,BBCNolan,21,15,170,"Remember simpler times when it was a major story to “wrongly isolate” someone returning from Italy?https://twitter.com/BBCNolan/status/1232744722583769092 …",,,,1236441380827869184,https://twitter.com/mgtruth/status/1236441380827869184
2020-03-07 23:59:31,1stSFG,,2,25,24,"Tom clancy'spic.twitter.com/TLh1Z1JQ31",,,,1236441380672557062,https://twitter.com/1stSFG/status/1236441380672557062
2020-03-07 23:59:31,BrianaCeleste_,,1,7,98,"I was watching @LEXXXLIEEE mukbang today and now all I want for the rest of my life are noodles lol",,@LEXXXLIEEE,,1236441380177629184,https://twitter.com/BrianaCeleste_/status/1236441380177629184
2020-03-07 23:59:31,sdnorton,notorious_BID,5,6,86,"Tired of tweets like this. (1) The entire concept of morality can be summed up as “what we owe to each other.” Here, Warren owes us integrity. (2) Elected officials—presidents especially—owe citizens. That’s just called accountability. Here, Warren owes us some leadership.https://twitter.com/notorious_BID/status/1236354836972503040 …",,,,1236441379917578240,https://twitter.com/sdnorton/status/1236441379917578240
2020-03-07 23:59:31,shhhitsokay036,,7,17,62,"I dunno you guys I just can't seem to lose weight and I don't know wh... Holy shit are those nachos?!",,,,1236441379900973056,https://twitter.com/shhhitsokay036/status/1236441379900973056
2020-03-07 23:59:31,tmpear,,2,12,24,"Just a reminder the #SiteC megadam exists specifically to power fracking & the fracked gas industry. It’s. Not. Clean. Energy. #bcpoli",,,#SiteC #bcpoli,1236441379602980864,https://twitter.com/tmpear/status/1236441379602980864
2020-03-07 23:59:31,Wanderlust_Sope,,9,214,257,"Email her people as well and tell them how crazy she’s acting avenezia@penguinrandomhouse.com publicist Angie leslie@theshipmanagency.com speaking agent Leslie sfishman@thegernertco.com Agent Sethpic.twitter.com/Pa4tE0au8c",,@penguinrandomhouse @theshipmanagency @thegernertco,,1236441379368243200,https://twitter.com/Wanderlust_Sope/status/1236441379368243200
2020-03-07 23:59:31,keithfrankish,CNN,2,11,79,"The British tabloids have been doing this for years.https://twitter.com/CNN/status/1235585886236160000 …",,,,1236441379313778688,https://twitter.com/keithfrankish/status/1236441379313778688
2020-03-07 23:59:31,TheCensoredRock,,3,19,72,"Me[jumping for 10 minutes at the trampoline park] i’m gonna die",,,,1236441378479095808,https://twitter.com/TheCensoredRock/status/1236441378479095808
2020-03-07 23:59:31,declanganley,,10,24,44,"Seems from this the decree will be out some time tonight or tomorrow, barring outward travel etc. How many came into Dublin from there in the last three days? ‘Coronavirus: Milan set for lockdown with Italy poised to shut worst-hit region’https://news.sky.com/story/coronavirus-italy-to-tell-people-not-to-enter-or-leave-regions-worst-hit-by-outbreak-11952487 …",,,,1236441378416099329,https://twitter.com/declanganley/status/1236441378416099329
2020-03-07 23:59:31,Greg_P_C,PhysioGaryLewin,0,2,90,"My boy was 6 hours old when I got him in his first Arsenal gear pic.twitter.com/wQHfcphBTW",,,,1236441378315546627,https://twitter.com/Greg_P_C/status/1236441378315546627
2020-03-07 23:59:30,Besidoneee,,2,4,44,"Five years in four frames. pic.twitter.com/bMVJDTYTjZ",,,,1236441377208180736,https://twitter.com/Besidoneee/status/1236441377208180736
2020-03-07 23:59:30,ValfarisGame,,0,7,33,"There's sure as hell no love on this elevator. Get Valfaris now at the links below XB - http://bit.ly/XboxOneValfaris Steam - http://bit.ly/SteamValfaris Switch - http://bit.ly/SwitchValfaris PS4 - http://bit.ly/PS4Valfaris #Valfaris #ValfarisGame #ScreenshotSaturday #IndieGame #IndieDevpic.twitter.com/O668xvh4Uk",,,#Valfaris #ValfarisGame #ScreenshotSaturday #IndieGame #IndieDevpic,1236441377057185794,https://twitter.com/ValfarisGame/status/1236441377057185794
2020-03-07 23:59:30,SouffSideCee,,0,216,277,"Emotionally scarred.",,,,1236441376834928645,https://twitter.com/SouffSideCee/status/1236441376834928645
2020-03-07 23:59:30,FroggerOW,,6,22,643,"im in melbourne and this is the first thing i see in the citypic.twitter.com/x3fmz0HVLd",,,,1236441376176234496,https://twitter.com/FroggerOW/status/1236441376176234496
2020-03-07 23:59:30,angelaxmendoza,,0,13,34,"The way flight prices dropped cause of the virus got me looking like I’m going to Dubai",,,,1236441375752589312,https://twitter.com/angelaxmendoza/status/1236441375752589312
2020-03-07 23:59:30,mariiamariiee,,4,9,41,"“I made this playlist and thought to share “",,,,1236441373550804993,https://twitter.com/mariiamariiee/status/1236441373550804993
2020-03-07 23:59:29,BeckQuerels,,0,11,23,"Let the whiskey-tit countdown commence.",,,,1236441370757419009,https://twitter.com/BeckQuerels/status/1236441370757419009
2020-03-07 23:59:29,zomniums,,3,8,45,"adèle haenel and taylor swift both being born in 1989 is something incredibly interesting to me",,,,1236441369859756032,https://twitter.com/zomniums/status/1236441369859756032
2020-03-07 23:59:29,gcfsmrk,,6,7,60,"we were at little tokyo or whatever this morning and i was buying steamed buns and anh was waiting a few steps away and apparently some old guy was checking her out bc she was wearing a crop top and shorts and she really just says “there’s always space in jail for pedos” and +",,,,1236441369591177216,https://twitter.com/gcfsmrk/status/1236441369591177216
2020-03-07 23:59:28,cindergroves,,2,13,101,"start/finish I GAVE UP ON THAT ONE HAND LIKE NVM goodbyepic.twitter.com/smQJdsS9P0",,,,1236441368756719618,https://twitter.com/cindergroves/status/1236441368756719618
2020-03-07 23:59:28,quirklesscole,GEAR4ZACHMAN,0,2,20,"Read this extremely well written thread on the man that restored the balance of the world at birthhttps://twitter.com/GEAR4ZACHMAN/status/1236439012270845952 …",,,,1236441368613941248,https://twitter.com/quirklesscole/status/1236441368613941248
2020-03-07 23:59:28,centaurean,,13,3,109,"good morning everyone. happy sundaypic.twitter.com/JQVIejzHlI",,,,1236441367825412098,https://twitter.com/centaurean/status/1236441367825412098
2020-03-07 23:59:28,GeneseoKnights,,1,6,24,"We're bringing the noise tonight. #PackTheIra #OneKnight #d3hkypic.twitter.com/R3P2jHsY4A",,,#PackTheIra #OneKnight #d3hkypic,1236441367653605377,https://twitter.com/GeneseoKnights/status/1236441367653605377
2020-03-07 23:59:28,Jollz,,3,333,608,"It’s International Womens Day! My own motto for the day is “they can’t kill me I’m a bad bitch”",,,,1236441367427112960,https://twitter.com/Jollz/status/1236441367427112960
2020-03-07 23:59:28,GR0SSFISH,,38,36,61,"Requests time :^D - post some characters (th pages are allowed) - retweet, please ;w; - any character is welcome! (furry, human, etc) not sure what exactly the result will be, just whatever i'll feel like u know !! SFW refs only! (gore, horror is ok)pic.twitter.com/y0GXIwGenV",,,,1236441366600826881,https://twitter.com/GR0SSFISH/status/1236441366600826881
2020-03-07 23:59:28,MrBluestrip4,,0,18,7,"Keep all the fake love and vibes away for me",,,,1236441366479208448,https://twitter.com/MrBluestrip4/status/1236441366479208448
2020-03-07 23:59:28,ScottRSteeleMD,carolinama,0,5,15,"Go Cavs! #wearblue #ColorectalCancerAwarenessMonth @CleClinicMD @CCAlliancehttps://twitter.com/carolinama/status/1236440474266873856 …",,@CleClinicMD @CCAlliancehttps,#wearblue #ColorectalCancerAwarenessMonth,1236441364986056704,https://twitter.com/ScottRSteeleMD/status/1236441364986056704
2020-03-07 23:59:27,liladowns,,1,6,78,"Ready! #alchile #lilaattheuspic.twitter.com/BQ9Ch6W2fs – at Winspear Opera House",,,#alchile #lilaattheuspic,1236441363820032002,https://twitter.com/liladowns/status/1236441363820032002
2020-03-07 23:59:27,TexAgs,,0,2,97,"Musselman: [Buzz] has done a great job. They've certainly gotten better. We haven't been very good on the road. I think Buzz is one of the best coaches in the country and he's maximized his roster. They have an identity and a style. He's done a great job.",,,,1236441363799052288,https://twitter.com/TexAgs/status/1236441363799052288
2020-03-07 23:59:27,jorgewillshine,,7,5,50,"Not to be loud, but if Jorge didn't dmed benji he probably is part of the hype house or sway house rn and he probably would have never became friends with Syd. His personality would have been different by now.",,,,1236441363677237248,https://twitter.com/jorgewillshine/status/1236441363677237248
2020-03-07 23:59:27,WillThink4Money,ememess,1,4,15,"Ohmygod if Bernie just would have stepped down and supported Warren after his heart attack, the Progressive platform would still be alive. He and his surrogates put ego before the real change they say they want. They are just wasting their money at this point.",,,,1236441362641440778,https://twitter.com/WillThink4Money/status/1236441362641440778
2020-03-07 23:59:27,dykoid,,0,3,27,"naked on a rockpic.twitter.com/jFVErQOHwu",,,,1236441362402328581,https://twitter.com/dykoid/status/1236441362402328581
2020-03-07 23:59:27,wazupMac_,,0,8,31,"being homosexual and homophobic at the same time is G R O S S as fuck",,,,1236441361290637312,https://twitter.com/wazupMac_/status/1236441361290637312
2020-03-07 23:59:27,Cernovich,blackbeltscott,17,15,101,"If a lot of people die due to coronavirus then housing supply will increase as rates decrease. Probably a good time to get a real estate agent license just in case.https://twitter.com/blackbeltscott/status/1236438910500253702 …",,,,1236441361194168322,https://twitter.com/Cernovich/status/1236441361194168322
2020-03-07 23:59:26,paintedbluu,,5,14,262,"Finished Amalias arm up and i love it so much! Pansies & Maiden hair ferns IG: @paintedbluuart pic.twitter.com/hPo1kjoV6K",,@paintedbluuart,,1236441359390846976,https://twitter.com/paintedbluu/status/1236441359390846976
2020-03-07 23:59:26,MysteryNRS,,1,4,19,"After several tryouts, we have decided that this player deserves a spot in our team! and look closely at his development and growth in the game. Welcome @FrappeFGC to #MysteryFamilyNRS feel at home #MysteryNRS #MysteryNewBlood pic.twitter.com/MNzzgwHsvS",,@FrappeFGC,#MysteryFamilyNRS #MysteryNRS #MysteryNewBlood,1236441358472282112,https://twitter.com/MysteryNRS/status/1236441358472282112
2020-03-07 23:59:26,eversincewonnie,,4,27,87,"MX can't stop they'll lose all of their fanbase if they go on hiatus because their fans aren't loyal at ALL. A lot have already found a new group to stan.",,,,1236441357771771905,https://twitter.com/eversincewonnie/status/1236441357771771905
2020-03-07 23:59:26,dark_shark,,3,14,64,"OHM+: The Early Gurus Of Electronic Music #JohnCage #PaulineOliveros #LeonTheremin #AlvinLucier #IannisXenakis #BrianEno http://moredarkthanshark.org/feature_ohm.html …pic.twitter.com/xfOFqNzcyD",,,#JohnCage #PaulineOliveros #LeonTheremin #AlvinLucier #IannisXenakis #BrianEno,1236441356874084353,https://twitter.com/dark_shark/status/1236441356874084353
2020-03-07 23:59:25,xoDrVenture,,3,3,60,"Isaac is such a stunningly written character, my god",,,,1236441356010209290,https://twitter.com/xoDrVenture/status/1236441356010209290
2020-03-07 23:59:25,whimsicaltoad,,1,3,41,"hope i get to 666 followers by tomorrow",,,,1236441355443978242,https://twitter.com/whimsicaltoad/status/1236441355443978242
2020-03-07 23:59:25,soodoh_,,11,5,43,"Ok guys hear me outpic.twitter.com/e6XVpYNZw9",,,,1236441355091619840,https://twitter.com/soodoh_/status/1236441355091619840
2020-03-07 23:59:25,immatthewvega,,1,11,43,"Depressed because I can’t skate. So here is the most beautiful tre flip I have ever landed. pic.twitter.com/VeHZAKelTx",,,,1236441353594310656,https://twitter.com/immatthewvega/status/1236441353594310656
2020-03-07 23:59:25,SympLySimi,,94,374,3244,"Not gonna lie to you to make you feel comfortable.",,,,1236441353367715840,https://twitter.com/SympLySimi/status/1236441353367715840
2020-03-07 23:59:25,bobblegagger,,1,19,25,"As a conspiracy theorist I'd like to be the first to point out that this engineered COVID 19 virus does a great job targeting those that have paid into SSI all their lives, those in need of Universal Healthcare, as well as those surrounding themselves with champion sneezers.",,,,1236441352948326401,https://twitter.com/bobblegagger/status/1236441352948326401
2020-03-07 23:59:25,oh_itschx,,1,0,59,"not your president anymore pic.twitter.com/VhfiLPaIsa",,,,1236441352646406147,https://twitter.com/oh_itschx/status/1236441352646406147
2020-03-07 23:59:24,desertflyer,,2,2,32,"Got lucky today and saw @ACE_train's brand new SC44 Charger at Diridon Station.pic.twitter.com/ZhB7OlQa8y – at San Jose Diridon Caltrain & Amtrak Station",,@ACE_train,,1236441351081713666,https://twitter.com/desertflyer/status/1236441351081713666
2020-03-07 23:59:24,your3rights,kurteichenwald,1,6,39,"The difference?pic.twitter.com/XGbcZTsRLx",,,,1236441350960103424,https://twitter.com/your3rights/status/1236441350960103424
2020-03-07 23:59:24,GleamyGuts,,1,14,61,"Precious Angelpic.twitter.com/s3V1zuOksN",,,,1236441350347853825,https://twitter.com/GleamyGuts/status/1236441350347853825
2020-03-07 23:59:24,_RavenBranwen_,EmbersDying_,9,8,94,"I'M BISEXUAL. WE EXIST!!! https://twitter.com/EmbersDying_/status/1236260739926482952 …",,,,1236441349962051584,https://twitter.com/_RavenBranwen_/status/1236441349962051584
2020-03-07 23:59:24,inspectorbeans,,6,0,55,"I got a trim and some baby bangs! pic.twitter.com/OxjN4jlgq7",,,,1236441349265788928,https://twitter.com/inspectorbeans/status/1236441349265788928
2020-03-07 23:59:24,Trashlevania,,9,8,49,"The world needs more TurboGrafx 16, Master System, 32X, Sega CD, and Saturn written coverage.pic.twitter.com/bKXombOg5l",,,,1236441349030907905,https://twitter.com/Trashlevania/status/1236441349030907905
2020-03-07 23:59:24,CandidlyCarlo,,9,17,255,"That’s hot! @ParisHilton (too bad mine is still on backorder @UrbanOutfitters)pic.twitter.com/25CyYaYObG",,@ParisHilton @UrbanOutfitters,,1236441349009760256,https://twitter.com/CandidlyCarlo/status/1236441349009760256
2020-03-07 23:59:24,Bradooooooooooo,,0,5,19,"Bro God is amazing.",,,,1236441348238180352,https://twitter.com/Bradooooooooooo/status/1236441348238180352
2020-03-07 23:59:23,FlatlandCavalry,the_jflo23,2,3,76,"Come make some new amigos tonight!https://twitter.com/the_jflo23/status/1236438374728294401 …",,,,1236441346761687045,https://twitter.com/FlatlandCavalry/status/1236441346761687045
2020-03-07 23:59:23,CelestialPo3try,,0,3,20,"Jamaica pretty badpic.twitter.com/z0LCDfxzI3",,,,1236441345801302016,https://twitter.com/CelestialPo3try/status/1236441345801302016
2020-03-07 23:59:23,CultureCrave,,19,143,1431,"'Sonic the Hedgehog' star James Marsden confirms he's signed on for multiple sequels to the film (via @Variety)pic.twitter.com/N6pdDdvXVa",,@Variety,,1236441344727339008,https://twitter.com/CultureCrave/status/1236441344727339008
2020-03-07 23:59:22,maggiedottxt,,3,8,15,"this was going to be the opening track for my next album, but it’s now been dropped since it doesn’t quite fit with the rest of the material. enjoy!https://soundcloud.com/maggiedotwav/new-adventure-plus/s-2Fnn4 …",,,,1236441343842549760,https://twitter.com/maggiedottxt/status/1236441343842549760
2020-03-07 23:59:22,PrinceOfDingos,,4,9,33,"Some Kaaspic.twitter.com/Wi3rd3LxQX",,,,1236441342903017472,https://twitter.com/PrinceOfDingos/status/1236441342903017472
2020-03-07 23:59:22,Flocculencyy,,2,1,38,"Okay but Spicy kimchi veggie ramen slaps pic.twitter.com/mSMYfMlHKl",,,,1236441342852714496,https://twitter.com/Flocculencyy/status/1236441342852714496
2020-03-07 23:59:22,WildflowerSRQ,explauratory,1,6,29,"Thank you!pic.twitter.com/9QRbKl7Jo8",,,,1236441342064177153,https://twitter.com/WildflowerSRQ/status/1236441342064177153
2020-03-07 23:59:22,kickityong,,3,24,110,"If you have friends who’s first instincts are to make racist comments when you wanna talk about your kpop faves then you need better friends",,,,1236441341355331584,https://twitter.com/kickityong/status/1236441341355331584
2020-03-07 23:59:21,jinoreacts,aarthy__,41,37,419,"Too much https://twitter.com/aarthy__/status/1236436145648676865 …",,,,1236441338763231234,https://twitter.com/jinoreacts/status/1236441338763231234
2020-03-07 23:59:21,doc_revan,,13,161,164,"Protesters Greet Joe Biden at St. Louis Rally - One with ""Joe Biden Is a Pervert"" Sign -- At Least One Leftist Arrested https://www.thegatewaypundit.com/2020/03/protesters-greet-joe-biden-at-st-louis-rally-one-with-joe-biden-is-a-pervert-sign-at-least-one-leftist-arrested/ … via @gatewaypundit",,@gatewaypundit,,1236441336699592704,https://twitter.com/doc_revan/status/1236441336699592704
2020-03-07 23:59:21,UNCBarstool,,2,4,57,"Wide open shots are nice, I’d like some more pleasepic.twitter.com/0sKRVwUooV",,,,1236441336359915520,https://twitter.com/UNCBarstool/status/1236441336359915520
2020-03-07 23:59:21,bsnu_16,,0,5,16,"#thoughtoftheday ""Life is very interesting… in the end, some of your greatest pains, become your greatest strengths."" - Drew Barrymorepic.twitter.com/9iyIZ10xgr",,,#thoughtoftheday,1236441336271654912,https://twitter.com/bsnu_16/status/1236441336271654912
2020-03-07 23:59:21,JuveFaCose,,1,128,372,"In looppic.twitter.com/6fxXpFRl8P",,,,1236441336221519873,https://twitter.com/JuveFaCose/status/1236441336221519873
2020-03-07 23:59:20,Erudita96,,11,0,111,"Dear Melania Tramp, I worked every day of this past week. I supported homeless and about to be homeless persons at the Rent Control Board AND in SF Superior court. I baked food items in my own home for two days. I do this on a regular basis. How dare a POS like you criticize us?",,,,1236441334874947584,https://twitter.com/Erudita96/status/1236441334874947584
2020-03-07 23:59:20,genesisg0214,,0,51,79,"i wanna go to a museum, or the zoo , or idk anywhere",,,,1236441334828892161,https://twitter.com/genesisg0214/status/1236441334828892161
2020-03-07 23:59:20,nberlat,,4,10,89,"but highlight that; don't be ableist.",,,,1236441334657044481,https://twitter.com/nberlat/status/1236441334657044481
2020-03-07 23:59:20,PrincetonWBB,,2,8,60,"VICTORY Princeton 69, Cornell 50 The Tigers finish the regular season at and in the @IvyLeague. #WhyNot | #ncaaW A perfect Ivy record. Even Siri takes notice ... pic.twitter.com/83Bw5dIQeo",,@IvyLeague,#WhyNot #ncaaW,1236441333654528000,https://twitter.com/PrincetonWBB/status/1236441333654528000
2020-03-07 23:59:20,zentreya,,28,13,236,"So me and @_Silvervale_ will be working something ""special"".",,@_Silvervale_,,1236441332744413184,https://twitter.com/zentreya/status/1236441332744413184
2020-03-07 23:59:20,mary_f12,SSG_PAIN,44,25,81,"I've lost family and friends. I've helped wake some up but still some have shut me out. The pain of the loss is deep. I live alone and the loneliness is hard. Here on twitter I pretty much go unnoticed. Sometimes I feel if you don't have 10,000 or more followers you don't count.",,,,1236441331704217600,https://twitter.com/mary_f12/status/1236441331704217600
2020-03-07 23:59:20,WakingtheRed,,5,14,127,"THE ROOKIE SCORES ON HIS DEBUT! #TFCLive | #TORvNYCpic.twitter.com/165DczUDJF",,,#TFCLive #TORvNYCpic,1236441331519688705,https://twitter.com/WakingtheRed/status/1236441331519688705
2020-03-07 23:59:20,marlonjayy,,0,5,58,"you a whole ass weirdo if you listen to an album for the first time on shuffle",,,,1236441331355926528,https://twitter.com/marlonjayy/status/1236441331355926528
2020-03-07 23:59:19,PolitiBunny,jaketapper,10,43,159,"When people claim Trump supporters are the bad guys just send them to the responses to Jake’s tweet.https://twitter.com/jaketapper/status/1236419625774186497 …",,,,1236441330986950656,https://twitter.com/PolitiBunny/status/1236441330986950656
2020-03-07 23:59:19,SpencerKlavan,,24,93,778,"An atheist friend once said to me that Asian immigrants only become Christian in the West because they get lonely and church is a place to go. I thought, what a strange way to try and indict a religion—by saying it creates a home where lost people feel welcome and beloved.",,,,1236441330613542912,https://twitter.com/SpencerKlavan/status/1236441330613542912
2020-03-07 23:59:19,SECNetwork,,2,35,249,"Next stop for @GamecockWBB: #SECWBB Championship pic.twitter.com/3jZqyyjWnM",,@GamecockWBB,#SECWBB,1236441329875460098,https://twitter.com/SECNetwork/status/1236441329875460098
2020-03-07 23:59:19,beyondreasdoubt,bad_takes,9,5,64,"I know everyone is focusing on Roger, but Larry Klayman is oochttps://twitter.com/bad_takes/status/1236151010546069504 …",,,,1236441329258954752,https://twitter.com/beyondreasdoubt/status/1236441329258954752
2020-03-07 23:59:19,NOCMavsSoftball,,0,15,61,"Played lights out today and coming home with two wins against Allen Community College 7-4 and 10-0pic.twitter.com/q8HJrzquFe",,,,1236441328713596928,https://twitter.com/NOCMavsSoftball/status/1236441328713596928
2020-03-07 23:59:18,soledad_eternal,KSSOX,0,5,344,"saint just want that damn phone",,,,1236441326792704001,https://twitter.com/soledad_eternal/status/1236441326792704001
2020-03-07 23:59:18,MohMuseum,,0,9,35,"We were proud to partner with @XFLRenegades today to spread the word about the Museum coming to #Texas and #MOHMailCall. Thank you to all those who stopped to write letters to the 71 living #MedalOfHonor recipients!pic.twitter.com/cGV357jgjV",,@XFLRenegades,#Texas #MOHMailCall #MedalOfHonor,1236441326293483522,https://twitter.com/MohMuseum/status/1236441326293483522
2020-03-07 23:59:18,cheolass,,2,5,25,"i forgot what i was doing with this but what they saw is forbidden (t/n: it was not drawn)pic.twitter.com/aFzMWnOfXz",,,,1236441326088003584,https://twitter.com/cheolass/status/1236441326088003584
2020-03-07 23:59:18,shoumarie143,,0,48,130,"Love you Naddie #NadineLustrepic.twitter.com/omO34cEMK1",,,#NadineLustrepic,1236441324179435520,https://twitter.com/shoumarie143/status/1236441324179435520
2020-03-07 23:59:17,NathanAdlen,,0,6,21,"I know my little @suzuki project isn’t quite finished - but I couldn’t resist. @rushtheband @RushFamTourneys #RushFamily #2112 #RIPNeilPeartpic.twitter.com/dxsAyCXXqN",,@suzuki @rushtheband @RushFamTourneys,#RushFamily #2112 #RIPNeilPeartpic,1236441322682122240,https://twitter.com/NathanAdlen/status/1236441322682122240
2020-03-07 23:59:17,AJGHOSTFACE,,17,122,113,"I have been reading the coincidences regarding election years and UNRELATED disease. 2004-SARS 2008-AVIAN 2010-SWINE 2012-MERS 2014-EBOLA 2016-21KA 2018-EBOLA 2020-CORONA! One can’t help to think about the dangers of Deep State and the Democrats. pic.twitter.com/vduCY5rpoF",,,,1236441322602577920,https://twitter.com/AJGHOSTFACE/status/1236441322602577920
2020-03-07 23:59:17,tdhills_,,1,6,45,"clicked by me, drop yours https://twitter.com/Sharaandhillon/status/1236435434244202496 …pic.twitter.com/fjwfVjnDXo",,,,1236441321474154496,https://twitter.com/tdhills_/status/1236441321474154496
2020-03-07 23:59:17,jackbootedthot,MStRuebens,3,3,141,"Because Biden would get owned",,,,1236441321449144321,https://twitter.com/jackbootedthot/status/1236441321449144321
2020-03-07 23:59:17,StephenPunwasi,,13,35,64,"Update: Saudi Arabia just announced they’re going to obliterate oil markets. Fun reminder the free market works both ways. #ClimateAction #cdnpolihttps://www.bloomberg.com/news/articles/2020-03-07/saudis-plan-big-oil-output-hike-beginning-all-out-price-war …",,,#ClimateAction #cdnpolihttps,1236441320656449537,https://twitter.com/StephenPunwasi/status/1236441320656449537
2020-03-07 23:59:17,DirtySouthSoc,,1,6,124,"Your golden spiker today is......... Trinidad James because this is the greatest club in the world.",,,,1236441320207585287,https://twitter.com/DirtySouthSoc/status/1236441320207585287
2020-03-07 23:59:17,SeaEagleSpur,,4,7,97,"So sick of all this ad stuff. Can hardly wait until the actual footy starts so we can complain about the refs. Bring it on #NRL",,,#NRL,1236441319683158017,https://twitter.com/SeaEagleSpur/status/1236441319683158017
