date,username,to,replies,retweets,favorites,text,geo,mentions,hashtags,id,permalink
2020-03-07 23:58:47,LextheFlRST,,0,11,55,"Mans best friend am i rightpic.twitter.com/1fVoseELuA",,,,1236441193447215104,https://twitter.com/LextheFlRST/status/1236441193447215104
2020-03-07 23:58:46,_tonyjefferson,Cantguardmike,1,3,283,"Lolol facts tho",,,,1236441190544723969,https://twitter.com/_tonyjefferson/status/1236441190544723969
2020-03-07 23:58:46,JJohnsonLaw,fshakir,15,24,291,"Great! Then there’s no reason he shouldn’t release his medical records, seeing as he’s so fit and all. What happened in Selma, btw? He wasn’t up for it?",,,,1236441189513154560,https://twitter.com/JJohnsonLaw/status/1236441189513154560
2020-03-07 23:58:46,takiswhore,BernieSanders,7,27,173,"end himpic.twitter.com/ualnFU5bTW",,,,1236441189441822720,https://twitter.com/takiswhore/status/1236441189441822720
2020-03-07 23:58:46,dark_shark,,0,12,33,"The Eventide H3000: The Tech Behind The Classic Studio Processor #DavidBowie @Tonuspomus https://reverb.com/news/tech-behind-eventide-h3000-ultra-harmonizer …pic.twitter.com/BSuWAbUcsu",,@Tonuspomus,#DavidBowie,1236441189089329152,https://twitter.com/dark_shark/status/1236441189089329152
2020-03-07 23:58:45,DJSCHEME_,,38,77,965,"Must have @snot on my album",,@snot,,1236441188447719427,https://twitter.com/DJSCHEME_/status/1236441188447719427
2020-03-07 23:58:45,JoeInDallas1,fshakir,4,3,51,"Anyone seen @BernieSanders medical records?",,@BernieSanders,,1236441187407613953,https://twitter.com/JoeInDallas1/status/1236441187407613953
2020-03-07 23:58:45,ChappellTracker,NYCMayorsOffice,3,28,39,"Recently wondered what people should do if they feel symptoms. Do you go to the ER? A primary doc? Turns out NYC folks can call 311, which is just fantastic to know.https://twitter.com/NYCMayorsOffice/status/1236370028955602950 …",,,,1236441187017469952,https://twitter.com/ChappellTracker/status/1236441187017469952
2020-03-07 23:58:45,T20WorldCup,,2,10,90,"The weather, injuries, and an intense South African challenge – the hosts had plenty to overcome in the semi-final to keep their #T20WorldCup title defence on track. Relive every thrilling moment of an emotional roller coaster! #SAvAUSpic.twitter.com/WkCTvcaswH",,,#T20WorldCup #SAvAUSpic,1236441186002403328,https://twitter.com/T20WorldCup/status/1236441186002403328
2020-03-07 23:58:45,outrooyoongii,,1,26,87,"when the question was what they each loved about themselves and yoongi just replied with “ⁱ ˡⁱᵏᵉ ᵖᵘᵖᵖʸ” in the cutest pout :((( i’m literally going to give him the entire world rnpic.twitter.com/9YD8fDnVkU",,,,1236441185377570817,https://twitter.com/outrooyoongii/status/1236441185377570817
2020-03-07 23:58:45,Bubola,mdrache,40,5,112,"Sweet mother of God, I—https://twitter.com/mdrache/status/1236337523732905986 …",,,,1236441184815349760,https://twitter.com/Bubola/status/1236441184815349760
2020-03-07 23:58:44,victtorriiaa_,,0,14,47,"Since the coronavirus bouta kill us all, who’s tryna fuck???",,,,1236441183871586306,https://twitter.com/victtorriiaa_/status/1236441183871586306
2020-03-07 23:58:44,CoachDomAZ,,13,1,150,"I will not be returning to South Mountain Community College next season. I have officially accepted a position with a 4 year university, I’ll be announcing that sometime next week. Thank you to South Mountain and Coach Jackson for everything they’ve done for me. I love you guys!!",,,,1236441183506718721,https://twitter.com/CoachDomAZ/status/1236441183506718721
2020-03-07 23:58:44,TheAncientWorld,,7,71,245,"The famous Stele of Narim-sin, one of the finest works of art ever created in the ancient world. It depicts the Akkadian king Narim-sin (r. 2254-2218 BC) triumphant over the Lullubi tribe of the Zagros Mountains. The king wears a horned helmet, marking him as a (living) god.pic.twitter.com/2BJ9jFCeZX",,,,1236441183401824256,https://twitter.com/TheAncientWorld/status/1236441183401824256
2020-03-07 23:58:44,occupiedakh,,1,7,14,"Abu Sa’id al-Khudri: The prophet ﷺ said: “When the believers are saved from Hellfire, they will be held at a bridge between Paradise and Hell. They will requite each other for wrongs done in the world, until they are purified & absolved and they will be called to enter Paradise.",,,,1236441183100043266,https://twitter.com/occupiedakh/status/1236441183100043266
2020-03-07 23:58:44,Beckyboop24,Marylaw55555,1,10,32,"We need to start collecting the names and addresses of people who abandon animals and put them on a list like we do sex offenders. And make is so that they can not obtain another animal ever again.",,,,1236441182907047937,https://twitter.com/Beckyboop24/status/1236441182907047937
2020-03-07 23:58:44,cher,BetsyNevil3,18,13,119,"DEMOCRATS ARE SUPPOSED 2BE ABOVE HATRED.I KNOW ITS WRONG BECAUSE HEARD MOM TELL MY GRANDMOTHERS,“My Girls Dont Know These Words,If You Use Them,Girls CantAround You. MY 1st Best Friend Was Jewish,Cookie. I Didnt Know What It Was. BECAUSE MOM WERE DIVERSEMY KIDS,NEVER KNEW..",,,,1236441182831554560,https://twitter.com/cher/status/1236441182831554560
2020-03-07 23:58:44,toniblossoms,,0,13,67,"MY WHOLE HEARTpic.twitter.com/hWJr5jZxjR",,,,1236441182806441985,https://twitter.com/toniblossoms/status/1236441182806441985
2020-03-07 23:58:44,CentralPig,,0,3,31,"Serenity with the rare acceptance of chin rubs. #guineapigpic.twitter.com/B94vbGktpU",,,#guineapigpic,1236441180390424581,https://twitter.com/CentralPig/status/1236441180390424581
2020-03-07 23:58:43,tszzl,,2,3,34,"there is definitely a Platonically *correct* level of interest in politics, and I passed it long agopic.twitter.com/HrKuhOncEg",,,,1236441180126183427,https://twitter.com/tszzl/status/1236441180126183427
2020-03-07 23:58:43,rhgifford,,0,5,28,"AuD student and T35 fellow @nchdwyer represented @VUMCHearSpeech and @VBWC_CI_LAB exceptionally well at @amaudsoc #hearing2020 #AAS2020 We’re so proud of her and her accomplishments! #audpeeps #audiology @duane_g_watsonpic.twitter.com/BN2yG5afzU",,@nchdwyer @VUMCHearSpeech @VBWC_CI_LAB @amaudsoc @duane_g_watsonpic,#hearing2020 #AAS2020 #audpeeps #audiology,1236441180088324097,https://twitter.com/rhgifford/status/1236441180088324097
2020-03-07 23:58:42,RappersPlug,,0,16,56,"Dom Von Go @DomVonGo shares video for ""One Hand."" His album ""Go Mode"" is out now https://youtu.be/B3oFEcpFU_0 pic.twitter.com/z7y3fCfmGK",,@DomVonGo,,1236441173427978240,https://twitter.com/RappersPlug/status/1236441173427978240
2020-03-07 23:58:42,grizzlybara,,3,2,38,"just like they say: poggers bropic.twitter.com/xVACX9uaDm",,,,1236441172995903489,https://twitter.com/grizzlybara/status/1236441172995903489
2020-03-07 23:58:42,Oops43707851,,0,20,49,"Britney's music inspired even Queen Madonna and King Michael Jackson pic.twitter.com/K8UazzUEIi",,,,1236441172761075713,https://twitter.com/Oops43707851/status/1236441172761075713
2020-03-07 23:58:41,aster7_m,,0,9,22,"baby you look like you’d tear me to fucking pieces ... get your sexy over here pronto",,,,1236441171267911680,https://twitter.com/aster7_m/status/1236441171267911680
2020-03-07 23:58:41,WaveSinatraJr,,12,3,59,"The bill was really $130 lmao my sons get down. Even though its my cheat day I only had 8 wings pic.twitter.com/DduYf8KS7T",,,,1236441170215153665,https://twitter.com/WaveSinatraJr/status/1236441170215153665
2020-03-07 23:58:41,GCHSAA,,2,8,36,"CONGRATULATIONS TO THE VARSITY “AA” ALL LEAGUE TEAM #BETONUSpic.twitter.com/WHpW7q2BpH",,,#BETONUSpic,1236441170127052800,https://twitter.com/GCHSAA/status/1236441170127052800
2020-03-07 23:58:41,OMGitzAnLoLcat,dykeangst,3,3,78,"fire tat but that single needle shit aint ever gonna hold up",,,,1236441169795649536,https://twitter.com/OMGitzAnLoLcat/status/1236441169795649536
2020-03-07 23:58:41,mooncult,,12,11,103,"Joe Biden spoke for a grand total of 10 minutes and 13 seconds in St. Louis todaypic.twitter.com/24IaROhARA",,,,1236441167715127297,https://twitter.com/mooncult/status/1236441167715127297
2020-03-07 23:58:40,SomeRandomBee,,11,78,175,"We all make mistakes, it's how fast you run away from them that's important",,,,1236441167279149056,https://twitter.com/SomeRandomBee/status/1236441167279149056
2020-03-07 23:58:40,sellar_james,ScotGovFairer,0,4,14,"Compare this was @Jackson_Carlaw and the @ScotTories who appointed only 3 women out of 13 places in their shadow cabinet. A paltry 23%! They are neither representative or representing the diverse Scottish communityhttps://twitter.com/ScotGovFairer/status/1235973420052955136 …",,@Jackson_Carlaw @ScotTories,,1236441167132340226,https://twitter.com/sellar_james/status/1236441167132340226
2020-03-07 23:58:40,Aluddin19,,12,20,37,"Follow Gain | Grow Sharing the love @HARRYS1DEMPIRE @viviandeella @ishaz @GraphicDeziner5 @666_alhlwan @Therealroland02 @_MPHST_ @Stallion_Team2 @izmirliqr1 @hortkoff3 @Genn_Scog @MaJaVi_ @YNHallak @nealhailey @FLWRTR @izakira3 #TeamShaz #1DDrive #TEAMSTALLION",,@HARRYS1DEMPIRE @viviandeella @ishaz @GraphicDeziner5 @666_alhlwan @Therealroland02 @_MPHST_ @Stallion_Team2 @izmirliqr1 @hortkoff3 @Genn_Scog @MaJaVi_ @YNHallak @nealhailey @FLWRTR @izakira3,#TeamShaz #1DDrive #TEAMSTALLION,1236441166603681792,https://twitter.com/Aluddin19/status/1236441166603681792
2020-03-07 23:58:40,LEROPER1,novergirl,34,31,1805,"I don't know you at all, but this just gutted me. I am so very sorry.",,,,1236441166356328448,https://twitter.com/LEROPER1/status/1236441166356328448
2020-03-07 23:58:40,JamiahReloaded,,4,1,38,"The way she only had 1.1k views before I told y’all to watch this my impact is crazypic.twitter.com/dLqiP1xoI2",,,,1236441165416759296,https://twitter.com/JamiahReloaded/status/1236441165416759296
2020-03-07 23:58:40,rueliege18,BernieSanders,1,8,42,"Donate and volunteer!https://secure.actblue.com/donate/bern-site?refcode=website-national-nav …",,,,1236441165295017984,https://twitter.com/rueliege18/status/1236441165295017984
2020-03-07 23:58:40,trish_zornio,paintedsavvy,1,4,75,"Woohoo! Thank you so much!!! https://twitter.com/paintedsavvy/status/1236440385989328896 …",,,,1236441164758253571,https://twitter.com/trish_zornio/status/1236441164758253571
2020-03-07 23:58:40,RalphAidan,,8,38,244,"After a great visit today, I’m extremely blessed to say I have received my first offer from Iowa State University!! @ISUMattCampbell @TysonVeidt @AllenTrieupic.twitter.com/MkHp2l0bKg",,@ISUMattCampbell @TysonVeidt @AllenTrieupic,,1236441163500052481,https://twitter.com/RalphAidan/status/1236441163500052481
2020-03-07 23:58:39,desert_starr_57,,1,7,30,"Just FYI I actually have a Disney Blog. I don't think everyone realizes that. You can follow it here https://www.piratesandprincesses.net/ or Twitter @PNPDisney We usually on top of the news.",,@PNPDisney,,1236441163361591297,https://twitter.com/desert_starr_57/status/1236441163361591297
2020-03-07 23:58:39,PaxtonMackenzie,,0,60,122,"Feel ko mag pa-parkour grades ko this last grading.",,,,1236441163046875136,https://twitter.com/PaxtonMackenzie/status/1236441163046875136
2020-03-07 23:58:39,DJ_TPGReport,,75,645,634,"And somehow Democrats still think they have a say within their party... DNC nominees are handpicked from within - not from their people.https://pluralist.com/tulsi-gabbard-excluded-dnc-debate//44411 …",,,,1236441162078175232,https://twitter.com/DJ_TPGReport/status/1236441162078175232
2020-03-07 23:58:39,ashleygeraldo4,,1,3,30,"Anywaysssss what y’all up too ? pic.twitter.com/00aEVqr07o",,,,1236441160723333130,https://twitter.com/ashleygeraldo4/status/1236441160723333130
2020-03-07 23:58:39,Prog4Congress,BernieSanders,1,8,29,"@Oseguera2020 is for #MedicareForAll and he is running in New Jersey’s 8th district! The New Jersey primary is in 3 months, so please give $8.00 to help him get elected on June 2nd! #NJ08 https://secure.actblue.com/donate/hector-oseguera … #Hector2020",,@Oseguera2020,#MedicareForAll #NJ08 #Hector2020,1236441160488534017,https://twitter.com/Prog4Congress/status/1236441160488534017
2020-03-07 23:58:39,TorontoFC,,10,72,376,"Have yourself a night, rook! @AcharaIfy10 | #TFCLivepic.twitter.com/ZQ3mYpnfDf",,@AcharaIfy10,#TFCLivepic,1236441159888748545,https://twitter.com/TorontoFC/status/1236441159888748545
2020-03-07 23:58:39,bbb_senat,,1,4,26,"@waydamin Jayda girl I’m boutta see you in Indy on the 21st I really love you girl you better say hi to me",,@waydamin,,1236441159599349760,https://twitter.com/bbb_senat/status/1236441159599349760
2020-03-07 23:58:38,jessunee,slylawri,2,6,15,"jhene really hit different on a spiritual/healing level but everybody not gon understand..they be misinterpreting her lyrics for their own “toxic” agendas https://twitter.com/slylawri/status/1153394108528021505 …",,,,1236441159196725252,https://twitter.com/jessunee/status/1236441159196725252
2020-03-07 23:58:38,vicks058,,0,7,17,"I want a beer",,,,1236441159137976325,https://twitter.com/vicks058/status/1236441159137976325
2020-03-07 23:58:38,BeatemupsWood,,121,9,593,"I feel like me ""selling out"" would be if I did a entire sponsored video for State Farm or pushing a set of Steak Knives. I don't think playing a game on Nintendo Switch with a couple buddies is really that much of disconnect with my normal content to qualify pic.twitter.com/RDK5gKkaTq",,,,1236441158169100288,https://twitter.com/BeatemupsWood/status/1236441158169100288
2020-03-07 23:58:38,GZBGEN,,5,66,333,"Meghan and Harry on Reddit with 33k upvotes and this what people had to say pic.twitter.com/Q4zFBD8Y97",,,,1236441156218687490,https://twitter.com/GZBGEN/status/1236441156218687490
2020-03-07 23:58:37,CARP_English,,0,4,19,"The café at the Monumental right nowpic.twitter.com/ifhLDNUviy",,,,1236441154461327362,https://twitter.com/CARP_English/status/1236441154461327362
2020-03-07 23:58:37,kornrare,,1,6,28,"whoever shoots me in the head can have all the money in my bank account",,,,1236441154314366976,https://twitter.com/kornrare/status/1236441154314366976
2020-03-07 23:58:37,queerthoughts,shaw_sandy,0,4,11,"15 years and the Liberals never brought in a real pay equity law. Not even close. It's time we did and with MPPs like @shaw_sandy and @SuzeMorrison, an NDP govt will make it happen in Ontario.https://twitter.com/shaw_sandy/status/1236357497696509953 …",,@shaw_sandy @SuzeMorrison,,1236441153656033280,https://twitter.com/queerthoughts/status/1236441153656033280
2020-03-07 23:58:37,BCDreyer,,22,40,390,"Never say “old crone,” because crones are old by definition, but “wizened crone” at least allows for the possibility that some other crones moisturize.",,,,1236441153630883841,https://twitter.com/BCDreyer/status/1236441153630883841
2020-03-07 23:58:37,sofiasvgonzalez,,0,1,95,"not ur girlpic.twitter.com/FHKcLFiXV5",,,,1236441152737460225,https://twitter.com/sofiasvgonzalez/status/1236441152737460225
2020-03-07 23:58:37,beackupburner,,0,3,49,"these are not ppl angry bc they want the bigger winning number in an election and youre hindering them but ppl who are pissed at how removed from the concept of giving a shit/reality you choose to be",,,,1236441152653492224,https://twitter.com/beackupburner/status/1236441152653492224
2020-03-07 23:58:37,DGHisham,,1,307,245,"COVID-19; Home Surveillance shall be done for a person identified as below: Close contacts of confirmed positive case COVID-19 & Person under investigation (PUI) which not fulfilled admission criteria after assessment at screening centre.pic.twitter.com/8239Inust8",,,,1236441152590503936,https://twitter.com/DGHisham/status/1236441152590503936
2020-03-07 23:58:37,Prettyndthick_,,1,16,30,"I deadass don’t talk to anyone. This single shit is boring",,,,1236441152011763712,https://twitter.com/Prettyndthick_/status/1236441152011763712
2020-03-07 23:58:37,shimibread,OUTRODI0R,6,69,1129,"this pic.twitter.com/L9gusMn7Zd",,,,1236441151034531840,https://twitter.com/shimibread/status/1236441151034531840
2020-03-07 23:58:36,BABYPAKlSTAN,,17,18,119,"twitter really ruins the quality pic.twitter.com/8qonJEpr3z",,,,1236441150803894273,https://twitter.com/BABYPAKlSTAN/status/1236441150803894273
2020-03-07 23:58:36,MalakiStarks,,10,53,503,"Had a great visit today . Blessed to say I have received an offer from the University of Alabama.pic.twitter.com/vYtUCBSTBI",,,,1236441150577401857,https://twitter.com/MalakiStarks/status/1236441150577401857
2020-03-07 23:58:36,alstopp,JavierBlas,3,24,99,"My guess - #oil price drops $3+ Sunday night when the Asia session opens. Doubtful Russia blinks here, prices could fall into the $20s #tankers to be the main beneficiaries, #VLCC’s In particular Lots of losers here, foremost over-leveraged US shale",,,#oil #tankers #VLCC,1236441148555739136,https://twitter.com/alstopp/status/1236441148555739136
2020-03-07 23:58:35,UROCKlive1,joelockhart,17,93,318,"The president's mental health IS an issue, and everyone knows it except the MAGA crowd with their heads in the sand.https://twitter.com/joelockhart/status/1236244169888272385 …",,,,1236441146206736385,https://twitter.com/UROCKlive1/status/1236441146206736385
2020-03-07 23:58:35,thickimusprime,DepthGod,1,8,60,"I love the way Black women unapologetically gas EVERYBODY!https://twitter.com/DepthGod/status/1236411200277286914 …",,,,1236441145997168642,https://twitter.com/thickimusprime/status/1236441145997168642
2020-03-07 23:58:35,rhiannonlawson,BernieSanders,4,6,121,"Oh thank god Bernie, this is what we need.",,,,1236441144185081857,https://twitter.com/rhiannonlawson/status/1236441144185081857
2020-03-07 23:58:35,kristinnoeline,,1,1,59,"Turns out my dad loves David from Schitt’s Creek so here you can have this byepic.twitter.com/0JGt1zrkji",,,,1236441143950409729,https://twitter.com/kristinnoeline/status/1236441143950409729
2020-03-07 23:58:35,StevieGasko,,3,7,54,"I don't mind if anyone copies mine since I found it on Google. But it might too big for most of you, it takes up most of my forearm. #BeeTattoosForAllWhoWantThem @PeteButtigieg @PeteForAmerica #TeamPete #TeamPeteForever #BeLikePete https://twitter.com/NMforPete/status/1234940596193615872 …pic.twitter.com/1LuqJzBFmq",,@PeteButtigieg @PeteForAmerica,#BeeTattoosForAllWhoWantThem #TeamPete #TeamPeteForever #BeLikePete,1236441143891709952,https://twitter.com/StevieGasko/status/1236441143891709952
2020-03-07 23:58:35,Zizkil,,5,4,22,"I've been practicing Anatomy and shading/lighting. Here is some more kiwi art I drew!pic.twitter.com/0jUB81UiVh",,,,1236441143736324096,https://twitter.com/Zizkil/status/1236441143736324096
2020-03-07 23:58:34,ShiloTsukasa,doyou_bangtan,11,6,259,"People like these are why they say our fandom is toxic.... Because they dogpile on and attack people and threaten people. I'll be happy when Twitter implements the things they talked about that will give the option limit that. I'm sorry you have to deal with it. Take care",,,,1236441142494990336,https://twitter.com/ShiloTsukasa/status/1236441142494990336
2020-03-07 23:58:34,CODLeague,,29,75,866,". @OpTicGaming deliver a show for their home crowd! They win the series 3-2. #OGLA | #CDL2020pic.twitter.com/T98M04DXxL",,@OpTicGaming,#OGLA #CDL2020pic,1236441141345751044,https://twitter.com/CODLeague/status/1236441141345751044
2020-03-07 23:58:34,W3rl1ing,enterxgalactic,12,5,256,"There are sooo many good female rappers if dude just bothered to scratch beneath the surface.",,,,1236441141102489600,https://twitter.com/W3rl1ing/status/1236441141102489600
2020-03-07 23:58:34,tea_francis,,2,9,52,"Steatoda paykulliana male and female. I may try pairing these...pic.twitter.com/Ko8yWMcrwL",,,,1236441140980834310,https://twitter.com/tea_francis/status/1236441140980834310
2020-03-07 23:58:34,HxH_is_life,BRBRASTREISAND,3,118,2290,"Buying tickets to attend a riot is the whitest thing possible",,,,1236441140901150720,https://twitter.com/HxH_is_life/status/1236441140901150720
2020-03-07 23:58:34,RevSeanSmith,,1,7,19,"The downside of COMPROMISING Christianity is that you deprive yourself of SPIRITUAL INFLUENCE...U hand off a watered down spirituality to the next generation ...To accept your HIGH CALL..U MUST be true to your ASSIGNMENT and bridge culture (like Jesus)... I a new Gen arising!pic.twitter.com/JzuXhICbxE",,,,1236441140640940032,https://twitter.com/RevSeanSmith/status/1236441140640940032
2020-03-07 23:58:34,_nanagtz,,1,21,44,"-Sweetness- [What do you want to do? What do you want to be? Is that really the most important thing What's most stimulating and attracting me I like it and want it Is this the first time] By Lee Hong Ki approximate translation~ ㅋㅋ #LeeHongGi #イホンギ #이홍기pic.twitter.com/cMvshLyB0q",,,#LeeHongGi #イホンギ #이홍기pic,1236441140590714880,https://twitter.com/_nanagtz/status/1236441140590714880
2020-03-07 23:58:34,adulture,,2,58,214,"babushka titan and hunter + detailspic.twitter.com/7PcyRWZhVH",,,,1236441140083097601,https://twitter.com/adulture/status/1236441140083097601
2020-03-07 23:58:34,sussexworldwide,,2,17,66,"Any thought from the tabloids on the standing Ovation yet? Hmmm...Perhaps they went blackout on that. pic.twitter.com/qg7pciaMef",,,,1236441138958987265,https://twitter.com/sussexworldwide/status/1236441138958987265
2020-03-07 23:58:33,RealDeadLegend,,2,1,26,"I cant tell you how much I hate the fact this happenedpic.twitter.com/sNTBTnLOJd",,,,1236441137088356352,https://twitter.com/RealDeadLegend/status/1236441137088356352
2020-03-07 23:58:33,VividTheWarrior,,32,4,345,"First series as a pro got reverse swept .. GGs to Optic, didn’t play well in the respawns at all",,,,1236441136173944832,https://twitter.com/VividTheWarrior/status/1236441136173944832
2020-03-07 23:58:33,inmyimage007,,7,31,58,"My leftover sushi was stale. But my sushi burps taste the same.",,,,1236441136098676736,https://twitter.com/inmyimage007/status/1236441136098676736
2020-03-07 23:58:33,Blazer_Gang,,83,22,34,"You have 3 hours First person to guess Dame's Points, Rebounds, Assists and W or L tonight we'll venmo you $20 RT & COMMENT pic.twitter.com/D9LpuOZkuq",,,,1236441135108653056,https://twitter.com/Blazer_Gang/status/1236441135108653056
2020-03-07 23:58:33,_halalsi,bombantaclaat,0,6,84,"my other sock when no one is lookinghttps://twitter.com/bombantaclaat/status/1232776366417940482 …",,,,1236441134966222848,https://twitter.com/_halalsi/status/1236441134966222848
2020-03-07 23:58:32,beedub_4,,0,11,35,"how she on fye but still cool as a fan pic.twitter.com/BIchIQzmkn",,,,1236441133603065862,https://twitter.com/beedub_4/status/1236441133603065862
2020-03-07 23:58:32,HunterLJohnson,,8,1,85,"5 for $10 thopic.twitter.com/x8g8ucVZhc",,,,1236441133548548097,https://twitter.com/HunterLJohnson/status/1236441133548548097
2020-03-07 23:58:32,AHealthBlog,,0,11,35,"A group of scientists conducted tests in 2014, which showed the negative effects of heated vegetable oils and the risk factors associated with heart disease by constant use http://ahealthblog.live/images/aHR0cHM6Ly93d3cuYWhlYWx0aGJsb2cuY29tL2U4ZXE=/aHR0cHM6Ly93d3cuYWhlYWx0aGJsb2cuY29tL2ltYWdlcy9WZWdldGFibGUtY29va2luZy1vaWxzLWFyZS1pbmZsYW1tYXRvcnktZi5qcGc=/ICBWZWdldGFibGUgY29va2luZyBvaWxzIGFyZSBvbmUgb2YgdGhlIHdvcnN0IGluZmxhbW1hdG9yeSBmb29kcyB0byBhdm9pZCAgICA= …",,,,1236441131958689792,https://twitter.com/AHealthBlog/status/1236441131958689792
2020-03-07 23:58:32,D3V1NC00P3R,,11,9,99,"Best part of watching high school games are the fans. The refs are always wrong, the coach doesn't know how to coach, and if a player is open he/she suppose to shoot (even if it's a bad shot).",,,,1236441131375824896,https://twitter.com/D3V1NC00P3R/status/1236441131375824896
2020-03-07 23:58:32,SaraSalehOz,,2,38,93,"Forever a gaping Christchurch hole in my heart. So much love & solidarity to the survivors, their families, & everyone who supported them on their journeys this last year. Brutalised but defiant: Christchurch massacre survivors one year onhttps://www.theguardian.com/world/2020/mar/08/brutalised-but-defiant-christchurch-massacre-survivors-one-year-on?CMP=share_btn_tw …",,,,1236441131371491328,https://twitter.com/SaraSalehOz/status/1236441131371491328
2020-03-07 23:58:32,KjerstinSommer,,6,16,234,"KjerstinSommer commented on MailOnline: HRH Catherine the Great, future Queen consort looked adorable!!! Omg I fall more in love with my girl crush...https://www.dailymail.co.uk/news/article-8086047/Kate-Middleton-seen-Kensington-time-returning-royal-tour-Ireland.html?ito=twitter_share_comment_text#comments …",,,#comments,1236441130885165056,https://twitter.com/KjerstinSommer/status/1236441130885165056
2020-03-07 23:58:32,Innocentsimuko,MeizierW,0,4,11,"And I approve of this message @GrandaddyShoka pangine bine fast, fasthttps://twitter.com/MeizierW/status/1236362627720364036 …",,@GrandaddyShoka,,1236441130033655814,https://twitter.com/Innocentsimuko/status/1236441130033655814
2020-03-07 23:58:31,nargissxnamjoon,,6,1,31,"It was a great day for me hope you guys had a great day too..<3 & idc if I get 4 likes for these selfies i took 5 hours ago i think they have something ok goodnight to armybtspic.twitter.com/MphOX7fkHu",,,,1236441128305676290,https://twitter.com/nargissxnamjoon/status/1236441128305676290
2020-03-07 23:58:31,b_findom,,0,4,9,"Lunch earlier pic.twitter.com/9FxA3sw7Mm",,,,1236441128162885632,https://twitter.com/b_findom/status/1236441128162885632
2020-03-07 23:58:31,perto,,4,2,32,"funny bearpic.twitter.com/TaAT8la9dZ",,,,1236441128112545792,https://twitter.com/perto/status/1236441128112545792
2020-03-07 23:58:31,USC_Baseball,,2,12,73,"END7 | Owens comes through! He hits one off the pitcher to bring home the go ahead run, but is thrown out at first to end the inning. Trojans lead for the first time today! USC 2, VU 1 #FightOn | #GameDaypic.twitter.com/fgxQ1hfny5",,,#FightOn #GameDaypic,1236441127546261505,https://twitter.com/USC_Baseball/status/1236441127546261505
