date,username,to,replies,retweets,favorites,text,geo,mentions,hashtags,id,permalink
2020-03-14 19:12:24,telesurenglish,,2,66,98,"#LIVE | #Venezuela's Vice President @DrodriguezVen: ""We ask the UN to intervene to remove the blockades imposed by the United States and thus better serve #COVID19 cases."" pic.twitter.com/m6wii3Wqrr",,@DrodriguezVen,#LIVE #Venezuela #COVID19,1238905837218926592,https://twitter.com/telesurenglish/status/1238905837218926592
2020-03-14 19:10:35,BankofKigali,,14,51,174,"Dear customers As we continue to take precautions to avoid the spread of #COVID19, we wish to encourage you all to limit cash transactions and use the digital platforms available ( BK App, Internet Banking, USSD *334, MasterCard and Visa Cards. pic.twitter.com/QopV5jNeLX",,,#COVID19,1238905381470056450,https://twitter.com/BankofKigali/status/1238905381470056450
2020-03-14 19:10:16,QueenMab87,,9,54,266,"Providing paid sick leave to 20% of workers contributes to flattening the curve for everyone. Its a step that will help. Stop acting like democrats should have played chicken to get all or nothing #COVID19",,,#COVID19,1238905303111999488,https://twitter.com/QueenMab87/status/1238905303111999488
2020-03-14 19:10:01,educationweek,,0,30,65,"The House passes legislation to make it easier for more students to access meals amid spread of #COVID19, and up to 12 weeks of job-protected leave for many workers if a child's school has been closed. http://blogs.edweek.org/edweek/campaign-k-12/2020/03/coronavirus-paid-leave-school-closures-student-meals-advances.html?cmp=soc-edit-tw …",,,#COVID19,1238905238624579584,https://twitter.com/educationweek/status/1238905238624579584
2020-03-14 19:09:54,LouisianaGov,,401,2524,6661,"When Coach O speaks, we all listen. For more information on how to prevent the spread of COVID-19, visit: http://ldh.la.gov/Coronavirus/ @Coach_EdOrgeron @LADeptHealth #lagov #lalege #COVID19 pic.twitter.com/OxJ5u2xBmo",,@Coach_EdOrgeron @LADeptHealth,#lagov #lalege #COVID19,1238905211110019073,https://twitter.com/LouisianaGov/status/1238905211110019073
2020-03-14 19:09:34,AnnaFowlie,Political_AlanS,3,19,81,"@ClydesdAileen @KateForbesMSP Look forward to similar package of support for 3rd sector organisations and social enterprises. #COVID19 https://twitter.com/Political_AlanS/status/1238826725922025478 …",,@ClydesdAileen @KateForbesMSP,#COVID19,1238905126028562432,https://twitter.com/AnnaFowlie/status/1238905126028562432
2020-03-14 19:08:12,ciarakellydoc,Docbasia,9,61,284,"This is on top of Italy already increasing their ICU capacity x 12 fold. We are weeks behind them. Please #stayhome #staysafe #StopTheSpread It’s about to hit hard here #covid19 https://twitter.com/Docbasia/status/1238615411756797953 …",,,#stayhome #staysafe #StopTheSpread #covid19,1238904783823568907,https://twitter.com/ciarakellydoc/status/1238904783823568907
2020-03-14 19:08:11,Laurie_Garrett,,242,574,2336,"Walking around #NYC today I am struck by the normalcy. Clearly, #COVID19 concern hasn't hit Gotham. I have seen 4 mask-wearers in 5 hours, and plenty of people jostling in crowds, including Euro-tourists. WAKE UP, NEW YORK",,,#NYC #COVID19,1238904778874380290,https://twitter.com/Laurie_Garrett/status/1238904778874380290
2020-03-14 19:08:06,doctor_oxford,,103,589,1342,"It isn't easy to contemplate our own mortality. But every medical intervention has cons as well as pros. There's never been a more urgent time to discuss with your loved ones your views on advance care planning. Please have that conversation #COVID19 https://www.theguardian.com/world/2020/mar/14/talk-about-death-coronavirus-covid-19-nhs-doctors-patients?utm_source=dlvr.it&utm_medium=twitter …",,,#COVID19,1238904755143028738,https://twitter.com/doctor_oxford/status/1238904755143028738
2020-03-14 19:06:37,Ruthlessindia,,22,174,186,"A hospital in #Chongqing exploded, huge fire broke out. People say: many #coronavirus patients trapped inside, #China state media won’t be able to cover this up #WuhanVirus #COVID19 #coronavirus #CoronaVirusUpdatespic.twitter.com/TPXv4ls7tP",,,#Chongqing #coronavirus #China #WuhanVirus #COVID19 #coronavirus #CoronaVirusUpdatespic,1238904383691096070,https://twitter.com/Ruthlessindia/status/1238904383691096070
2020-03-14 19:05:09,WHOEMRO,,20,114,231,". @WHO is working w/ faith-based organizations worldwide as part of its community engagement efforts to combat #COVID19 pandemic/infodemic. This includes @WHOEMRO's collaboration w/ @IslamicAdvisory Group to reach out to IAG network of religious scholars/partners. Daily Update pic.twitter.com/5kVdxofDNe",,@WHO @WHOEMRO @IslamicAdvisory,#COVID19,1238904016324702210,https://twitter.com/WHOEMRO/status/1238904016324702210
2020-03-14 19:05:07,BCGovNews,,32,80,79,"Provincial Health Officer Dr. Bonnie Henry and Health Minister Adrian Dix give an update to the media on COVID-19 in BC. For the latest updates and answers to common questions about #COVID19 follow @CDCofBC and see http://www.bccdc.ca/health-info/diseases-conditions/covid-19 …https://twitter.com/i/broadcasts/1kvJpXZkkNVJE …",,@CDCofBC,#COVID19,1238904007747186688,https://twitter.com/BCGovNews/status/1238904007747186688
2020-03-14 19:05:00,UN,,36,148,414,"Every day, all around the world, nurses & midwives provide essential care services and save lives, including during the current #COVID19 outbreak. 2020 is the Year of the Nurse & Midwife. https://bit.ly/2QfB4Wl #HealthForAllpic.twitter.com/6ewXhvmMwK",,,#COVID19 #HealthForAllpic,1238903975962968064,https://twitter.com/UN/status/1238903975962968064
2020-03-14 19:04:32,KATVChrisMay,,15,82,897,"The three new #COVID19 cases in Arkansas are all workers who treated the state’s initial patient in the ICU at Jefferson Regional Medical Center in Pine Bluff. Where would we be without our health care workers? They deserve all our thanks and support.",,,#COVID19,1238903860019822592,https://twitter.com/KATVChrisMay/status/1238903860019822592
2020-03-14 19:03:45,Sunil_Sawhney,,8,77,114,"#SaturdayThoughts #TooGoodNotToShare This may sound preachy or even philosophical but do reflect .. Churchill made a profound statement during WW 2 'Never let a good crisis go waste' #Covid19, though it has tragically killed many worldwide, has also altered global scenario.",,,#SaturdayThoughts #TooGoodNotToShare #Covid19,1238903664254869505,https://twitter.com/Sunil_Sawhney/status/1238903664254869505
2020-03-14 19:03:04,BogochIsaac,,11,70,126,"Many countries facing significant impact from #COVID19 today: -Italy: >3000 new cases today -Iran: >1000 new cases per day since March 11 -Spain: >6000 total cases -UK: 10 deaths -USA: still does not have widespread testing https://wapo.st/33oT71x",,,#COVID19,1238903491894161414,https://twitter.com/BogochIsaac/status/1238903491894161414
2020-03-14 19:02:31,kevinnbass,,9,52,151,"Amazing seminar from February 27 by a world expert on COVID19. https://panopto.lshtm.ac.uk/Panopto/Pages/Embed.aspx?id=83ba0783-b1ce-4053-aaa5-ab6600da76d8 … Hat tip @KevinH_PhD A few things that struck me: 1. Household restriction highly effective; travel restriction not. 2. COVID19 vaccine may be impossible. 3. Asymptomatic cases are rare.",,@KevinH_PhD,,1238903353041510400,https://twitter.com/kevinnbass/status/1238903353041510400
2020-03-14 19:00:42,GovMikeDeWine,,59,190,622,"Next week, we know that numbers are going to dramatically rise. We're in this for the long run. The more we can distance ourselves from others, the better we all will be. #COVID19 #COVID19OhioReadypic.twitter.com/xqTbyk5UMw",,,#COVID19 #COVID19OhioReadypic,1238902894289661952,https://twitter.com/GovMikeDeWine/status/1238902894289661952
2020-03-14 19:00:38,AneesaBaluch,,35,288,954,"Pakistan itself is #Coronavirus #COVIDー19 from which we Baloch have been suffering since 1948. #COVID19 may kills undividuals but Pakistani virus is destroying our culture, heritage, history and entire society. #PakistanVirus's far dangerous than #COVID19. #CoronaVirusUpdates",,,#Coronavirus #COVIDー19 #COVID19 #PakistanVirus #COVID19 #CoronaVirusUpdates,1238902879035015168,https://twitter.com/AneesaBaluch/status/1238902879035015168
2020-03-14 19:00:06,CTULocal1,,6,36,116,"It’s time. #COVID19 #coronavirushttps://nyti.ms/2Qd5J6I",,,#COVID19 #coronavirushttps,1238902741944188928,https://twitter.com/CTULocal1/status/1238902741944188928
2020-03-14 19:00:02,TNDeptofHealth,,20,126,121,"The COVID-19 case count for Tennessee is now 32 as of March 14, 2020. For more information, go to: https://www.tn.gov/health/cedep/ncov.html … #COVID19 pic.twitter.com/aKyE3tZSMA",,,#COVID19,1238902725502533633,https://twitter.com/TNDeptofHealth/status/1238902725502533633
2020-03-14 18:59:46,DrTedros,Google,77,891,1741,"It's been great to see all the creative & effective ways people are sharing @WHO's public health advice in the worldwide fight against #COVID19. I really like ""Do the 5,"" which @Google launched today! We thank them for support & collaboration.https://twitter.com/Google/status/1238893403821113344 …",,@WHO @Google,#COVID19,1238902658104209408,https://twitter.com/DrTedros/status/1238902658104209408
2020-03-14 18:59:21,jameskmcauley,,21,594,742,"BREAKING: French gov announces all non-essential businesses shut starting midnight tonight. Banks, pharmacies, supermarkets and gas stations will remain open. #COVID19",,,#COVID19,1238902556409180162,https://twitter.com/jameskmcauley/status/1238902556409180162
2020-03-14 18:59:08,CMichaelGibson,business,8,84,134,"Even if you have no symptoms you can have #COVID19. 20% of people on the Diamond Princess who tested positive had no symptoms Even if you have no symptoms #WashYourHands and practice #SocialDistancinghttps://twitter.com/business/status/1238845825155031040 …",,,#COVID19 #WashYourHands #SocialDistancinghttps,1238902500431990784,https://twitter.com/CMichaelGibson/status/1238902500431990784
2020-03-14 18:58:44,hiral4congress,,0,28,66,"I know my fellow healthcare workers aren’t looking for thanks, but we all owe them a huge debt of gratitude. They’re on the frontlines, risking their own safety, working tirelessly to save lives. Let’s take care of them as they take care of us. #COVID19 https://www.wired.com/story/the-us-health-depends-on-how-it-cares-for-healthcare-workers/ …",,,#COVID19,1238902398627639297,https://twitter.com/hiral4congress/status/1238902398627639297
2020-03-14 18:58:42,ztsamudzi,,2,131,322,"You don’t have to be an anarchist to participate in these initiatives and community structures, they just happen to be some of the folks for whom it’s a central organizing/political principle here’s a piece from @IGD_News about COVID19 + mutual aid: https://itsgoingdown.org/autonomous-groups-are-mobilizing-mutual-aid-initiatives-to-combat-the-coronavirus/ …",,@IGD_News,,1238902391984074752,https://twitter.com/ztsamudzi/status/1238902391984074752
2020-03-14 18:58:11,DrJasonWestin,,17,325,595,"Them: Why can't I go out to the bar? This #COVID19 is just like the flu Me: The 1918 pandemic flu killed ~ 50 - 100 MILLION people worldwide. Going any place with other people puts you at risk of infection, and of infecting people you love. #StayHomeNowhttps://www.smithsonianmag.com/history/journal-plague-year-180965222/#.Xm0f1FyoX88.twitter …",,,#COVID19 #StayHomeNowhttps #,1238902261255987200,https://twitter.com/DrJasonWestin/status/1238902261255987200
2020-03-14 18:58:06,GovMurphy,,54,195,271,"We now has 69 presumed positive cases of #COVID19: •Bergen: 25 •Burlington: 3 •Camden: 2 •Essex: 7 •Hudson: 5 •Mercer: 1 •Middlesex: 10 •Monmouth: 8 •Morris: 3 •Ocean: 1 •Passaic: 2 •Somerset: 1 •Union: 1 For regular updates: https://www.nj.gov/health/cd/topics/covid2019_dashboard.shtml … pic.twitter.com/cyLtR4kqdz",,,#COVID19,1238902239621713925,https://twitter.com/GovMurphy/status/1238902239621713925
2020-03-14 18:58:06,GovMurphy,,91,115,411,"As of 1:00 PM, #COVID19 statewide stats: • Positive Tests: 69 • Deaths: 1",,,#COVID19,1238902238719901697,https://twitter.com/GovMurphy/status/1238902238719901697
2020-03-14 18:54:32,JackDunc1,,6,130,308,"Just a reminder that the UK not having enough beds, or testing capacity, or protective clothing for hospital staff, or ventilators for critically unwell people - did not happen in a vacuum. We're here because of the Tory party & their cuts. Never let them forget it. #COVID19",,,#COVID19,1238901343294828545,https://twitter.com/JackDunc1/status/1238901343294828545
2020-03-14 18:53:18,Alex_Verbeek,,17,94,201,"Dutch researchers find Corona virus antibody http://ow.ly/RKoo30qpOTq #science #coronavirus #CoronaVirusUpdates #covid #covid19 #health #coronapic.twitter.com/v8RQ3O94ih",,,#science #coronavirus #CoronaVirusUpdates #covid #covid19 #health #coronapic,1238901034023600130,https://twitter.com/Alex_Verbeek/status/1238901034023600130
2020-03-14 18:53:01,MaryInMarseille,,5,100,226,"French PM has announced the closure from midnight tonight of all restaurants, bars, shops (apart from supermarkets & pharmacies), cinemas/theatres & other gathering places. He appeals for people “to understand the gravity of the moment” #COVID19",,,#COVID19,1238900961520816133,https://twitter.com/MaryInMarseille/status/1238900961520816133
2020-03-14 18:52:58,stuboybaggins,,88,133,885,"Toilet paper aisle at Walmart in Minnesota. Someone remind me what the connection between upper respiratory virus and diarrhea is? #panicbuying #panicshopping #ToiletPaperApocalypse #COVID19 pic.twitter.com/JYY89kRfVR",,,#panicbuying #panicshopping #ToiletPaperApocalypse #COVID19,1238900949307006977,https://twitter.com/stuboybaggins/status/1238900949307006977
2020-03-14 18:52:18,1900Messenger,,39,752,1351,"The fight against #COVID19 is a war against capitalism Capitalism says we can't test everyone Capitalism says can't have more ventilators Capitalism says sick pay must be low Capitalism says underfund the NHS Capitalism says don't #lockdown the UK Capitalism says let 500,000 die",,,#COVID19 #lockdown,1238900780796698626,https://twitter.com/1900Messenger/status/1238900780796698626
2020-03-14 18:52:16,BarbaraBollier,,12,65,245,"Our nation is facing the biggest public health crisis I've seen in my lifetime. It's normal to be concerned. The most important thing we all can do right now is listen to the experts. We can't let this become another partisan issue. #COVID19 pic.twitter.com/iQ30P16aHT",,,#COVID19,1238900772550688769,https://twitter.com/BarbaraBollier/status/1238900772550688769
2020-03-14 18:52:13,JMakamba,,28,64,485,"Who had expected that to fight a globalised pandemic, while requiring global coordination, would also require de-globalisation? #COVID19",,,#COVID19,1238900757895819270,https://twitter.com/JMakamba/status/1238900757895819270
2020-03-14 18:52:00,WHO,,14,401,769,"Learn simple daily physical exercises you can perform at home. This will help to keep you active and reduce boredom, in case you need to stay home. http://bit.ly/2xDnG7X #COVID19 #coronavirus #MentalHealthpic.twitter.com/id4TcL6kFf",,,#COVID19 #coronavirus #MentalHealthpic,1238900705697677314,https://twitter.com/WHO/status/1238900705697677314
2020-03-14 18:51:54,austintexasgov,,15,83,112,"Critical advice has been issued for people in Austin-Travis Co. who are aware they've had contact w/ an individual w/ #COVID19. Based on our first 3 cases, @AusPublicHealth is conducting contact tracing on hundreds of people. See the Dr.'s advice: http://bit.ly/2vqnRmm pic.twitter.com/rUH2NlDzuD",,@AusPublicHealth,#COVID19,1238900679500070912,https://twitter.com/austintexasgov/status/1238900679500070912
2020-03-14 18:51:20,Alkebulan_,cgtnafrica,7,167,861,"These Italians have broken world record for Spreading Virus in Africa. No Chinese has been detected with #COVID19 in Africa. That tells you how China is serious about containing the pandemic.",,,#COVID19,1238900536923115520,https://twitter.com/Alkebulan_/status/1238900536923115520
2020-03-14 18:51:10,pipers_corner,,28,57,582,"Due to the escalating Covid19 crisis Pipers Corner will close tomorrow Sunday Mar 15 until further notice. Thanks for your support and understanding Agus an ghéarchéim Covid19 ag dul in olcas beidh Pipers ag dúnadh amárach. Beimid i dteagmháil amach anseo. GRMA as do thacaíocht pic.twitter.com/fFM6zc2rrG",,,,1238900493990199296,https://twitter.com/pipers_corner/status/1238900493990199296
2020-03-14 18:50:39,MannyWallace,,48,222,465,"Just drove by the line for drive-thru #COVID19 testing. pic.twitter.com/86zvtCNbAf",,,#COVID19,1238900367372554243,https://twitter.com/MannyWallace/status/1238900367372554243
2020-03-14 18:50:06,NJ_DOC,,21,70,157,"To mitigate the spread of #COVID19, NJDOC is temporarily suspending visits for the next 30 days, effective 5 p.m., today. Ensuring the health and safety of inmates, residence, staff, and the public is our top priority. https://njdoc.gov/pdf/PressRelease_PS/200314_PRESS_RELEASE_NJDOC%20SUSPENDS%20VISITATIONS%20TO%20STATE%20PRISONS%20AND%20HALFWAY.pdf …",,,#COVID19,1238900228104716288,https://twitter.com/NJ_DOC/status/1238900228104716288
2020-03-14 18:49:51,GovMikeDeWine,,26,117,543,". @DrAmyActon: We are not flying blind. We have science behind us, and we have a pandemic plan. We are deploying early, targeted, layered interventions. #COVID19 #COVID19OhioReadypic.twitter.com/GmxflOfdi2",,@DrAmyActon,#COVID19 #COVID19OhioReadypic,1238900164557000704,https://twitter.com/GovMikeDeWine/status/1238900164557000704
2020-03-14 18:49:32,EmiliaSykesOH,,7,85,238,"So far the Dewine administration has handled the #COVID19 crisis well. However refusing economic security for Ohioans is not a good move. A good public health response that keeps people alive means nothing if folks are homeless and can’t afford to eat. https://www.cleveland.com/business/2020/03/ohio-declines-to-make-more-coronavirus-victims-eligible-for-unemployment-benefits.html …",,,#COVID19,1238900083250397185,https://twitter.com/EmiliaSykesOH/status/1238900083250397185
2020-03-14 18:47:59,QuickTake,,23,158,251,"President Trump says he was tested for #Covid19 on March 13 after coming in contact with several infected people in the days prior pic.twitter.com/Po210DMD8c",,,#Covid19,1238899694882955264,https://twitter.com/QuickTake/status/1238899694882955264
2020-03-14 18:47:32,PaulKagame,,58,450,1836,"Together, we shall prevail in this fight against #COVID19",,,#COVID19,1238899579870986243,https://twitter.com/PaulKagame/status/1238899579870986243
2020-03-14 18:47:31,PaulKagame,,104,596,3508,"This afternoon I had a call with my brother and friend HH @TamimBinHamad I thank you very much for reaching out and the msg of support & solidarity for my country and our people regarding #COVID19.",,@TamimBinHamad,#COVID19,1238899577497010183,https://twitter.com/PaulKagame/status/1238899577497010183
2020-03-14 18:47:28,USMC,,29,240,648,"New @DeptofDefense guidance about #COVID19 is out, and MARADMIN 167/20 explains the new domestic travel, permanent change of station, temporary duty and leave restrictions. : https://go.usa.gov/xdMfK pic.twitter.com/xgi6zCHB6W",,@DeptofDefense,#COVID19,1238899563727126535,https://twitter.com/USMC/status/1238899563727126535
2020-03-14 18:45:06,themaxburns,,9,161,676,"A year ago, UBI was considered a futurist pipe dream and @AndrewYang was mocked for making it a centerpiece of his economic argument. Hell, even I mocked him. #COVID19 caused a rethinking among policy elites about securing our way of life from shocks. https://thehill.com/homenews/house/487485-lawmakers-call-for-economic-stimulus-ubi-amid-coronavirus-crisis …",,@AndrewYang,#COVID19,1238898967229992961,https://twitter.com/themaxburns/status/1238898967229992961
2020-03-14 18:44:58,onduhungirehe,RwandaHealth,28,157,469,"Starting tomorrow: Places of worship, schools & universities to be closed; Employees to work from home, where possible; Large gatherings to be postponed; One-meter distance in businesses & restaurants; Unnecessary movements to be avoided. #COVID19 #Rwandahttps://twitter.com/RwandaHealth/status/1238886882408312834 …",,,#COVID19 #Rwandahttps,1238898935755943937,https://twitter.com/onduhungirehe/status/1238898935755943937
2020-03-14 18:44:47,patriciakombo,,4,64,176,"We listen to science Avoid gathering to avoid spread of #COVID19 After 1st case #covid19kenya ,I will carry my climate strikes online Let's be safe #ClimateStrikeOnline #ClimateCrisis #mission1point5 @Fridays4future @GretaThunberg #DigitalStrike @vanessa_vashpic.twitter.com/fJSb7wac5F",,@Fridays4future @GretaThunberg @vanessa_vashpic,#COVID19 #covid19kenya #ClimateStrikeOnline #ClimateCrisis #mission1point5 #DigitalStrike,1238898888305717248,https://twitter.com/patriciakombo/status/1238898888305717248
2020-03-14 18:43:28,RachelDonadio,,71,2330,3509,"PM of France: Starting at midnight tonight all restaurants, bars, retail stores, cinemas, gathering places CLOSED. Food stores & pharmacies open. Because #of people on respirators is rising dramatically. #COVID19 pic.twitter.com/4Y3QmfojTF",,,#of #COVID19,1238898557320650752,https://twitter.com/RachelDonadio/status/1238898557320650752
2020-03-14 18:43:05,JeffWilson_YYC,,13,44,163,"Grateful for the time CMO Dr. Hinshaw spent with Supe’s & Board Chairs today. My takeaway re school closures: her recommendations are based on scientific evidence, WHO protocols, & are constantly evaluated within our evolving circumstances. I trust her guidance. #abed #COVID19",,,#abed #COVID19,1238898460360724481,https://twitter.com/JeffWilson_YYC/status/1238898460360724481
2020-03-14 18:42:51,GovMikeDeWine,,10,56,204,". @LtGovHusted: In our society today, we have become accustomed to on-demand everything. We're not accustomed to waiting. We are now at a time where that is going to occur. Our economic circumstances will be impacted. Everyone needs to have patience and understanding. #COVID19 pic.twitter.com/PFTwg46HaK",,@LtGovHusted,#COVID19,1238898403096121346,https://twitter.com/GovMikeDeWine/status/1238898403096121346
2020-03-14 18:42:43,TravelGoC,,21,245,234,"#Globalpandemic: Many countries are reporting community or widespread transmission of #COVID19. Avoid all non-essential travel outside of Canada. Check our new Travel Health Notice: http://ow.ly/g3XQ50yLRZm pic.twitter.com/sHRW9Vwch9",,,#Globalpandemic #COVID19,1238898367620661252,https://twitter.com/TravelGoC/status/1238898367620661252
2020-03-14 18:42:13,nancylevine,jdawsey1,21,160,635,"Sincerely hope GOP Chairwoman Ronna McDaniel gets well soon. Good reminder: This 'hoax' virus is nothing to sneeze at. CC: Jerry Falwell @JerryFalwellJr #coronavirus #COVID19 https://twitter.com/renato_mariotti/status/1238457616260530176?s=20 …",,@JerryFalwellJr,#coronavirus #COVID19,1238898243997581312,https://twitter.com/nancylevine/status/1238898243997581312
2020-03-14 18:42:00,CDCgov,,270,2981,4835,"Everyone can help prevent the spread of #COVID19. Practice healthy habits like avoiding close contact with people who are sick. Learn more prevention tips: http://bit.ly/37Ay6Cm .pic.twitter.com/Jm12EQkfkJ",,,#COVID19,1238898187676442624,https://twitter.com/CDCgov/status/1238898187676442624
2020-03-14 18:41:30,disruptionary,,2,135,502,"You know the corporate media is in full force when their bosses force reporters to ask stupid questions like “how will you pay for it?” to @berniesanders when he says #COVID19 vaccines should be free but ask nothing about how the banks flooded 1.5 trillion into Wall Street.",,@berniesanders,#COVID19,1238898062862491648,https://twitter.com/disruptionary/status/1238898062862491648
2020-03-14 18:41:23,Beingsajiddarr,,10,137,511,"I Don't think any nation is doing that much efforts to fight #COVID19 what India is doing currently. Evacuating citizens from China,Italy & Iran is not a Joke. Sending Medical Lab by IAF Aircraft to Iran is not a joke. Sending 3 months Medical supply to Madagascar is not a joke.",,,#COVID19,1238898032889884672,https://twitter.com/Beingsajiddarr/status/1238898032889884672
2020-03-14 18:40:03,CitImmCanada,,45,438,499,"There is some misinformation circulating about the Government of Canada’s response to the evolving #COVID19 situation, including false messaging about changes to Canadian visa validity. For official info about Canada’s COVID-19 response, please see: https://www.canada.ca/en/public-health/services/diseases/2019-novel-coronavirus-infection/canadas-reponse.html …",,,#COVID19,1238897700176826370,https://twitter.com/CitImmCanada/status/1238897700176826370
2020-03-14 18:39:56,BuffyWicks,,5,170,266,"During this #COVID19 public health emergency, access to food is a challenge for many of our neighbors—esp. kids who rely on free & reduced lunches at school, seniors, & our food-insecure neighbors. Thread w/information on food access in #AD15, & ways you can help (if able)—(1/9)",,,#COVID19 #AD15,1238897669969346560,https://twitter.com/BuffyWicks/status/1238897669969346560
2020-03-14 18:38:20,cspotweet,,6,41,128,"BREAKING: Edmonton #Oilers step up to help game-day staff impacted by Rogers Place going dark during COVID19 pandemic. #yegpic.twitter.com/XjRL5zwNov",,,#Oilers #yegpic,1238897268083666944,https://twitter.com/cspotweet/status/1238897268083666944
2020-03-14 18:38:16,DrEricDing,,14,99,285,"JUST DO IT. #COVID19 pic.twitter.com/NOLGvZwIjF",,,#COVID19,1238897247842156544,https://twitter.com/DrEricDing/status/1238897247842156544
2020-03-14 18:38:15,WOTB07,,9,115,240,"Somewhere in Poland, first responders. #COVID19 in effect, going in an emergency. Exhausted and overworked but good attitude in hard times is everything. More Love and Support to these People Retweet Maximum pic.twitter.com/RQpKlErsWi",,,#COVID19,1238897247145938945,https://twitter.com/WOTB07/status/1238897247145938945
