date,username,to,replies,retweets,favorites,text,geo,mentions,hashtags,id,permalink
2020-03-07 17:44:17,voxdotcom,,28,92,148,"In 2002, a coronavirus emerged in a market in southern China. It eventually reached 29 countries and killed nearly 800 people. 18 years later, #Covid19 is in at least 71 countries and has already killed over 3,100 people. http://bit.ly/32Uj9JV pic.twitter.com/WpDNK8Uoro",,,#Covid19,1236346948342382592,https://twitter.com/voxdotcom/status/1236346948342382592
2020-03-07 17:43:34,VirusesImmunity,NathanGrubaugh,2,22,115,"We are so fortunate to have you here at @Yale, @NathanGrubaugh Read this thread to find out what he and his lab members are doing to respond rapidly to enable #COVID19 surveillance, and how they're making reagents available to all #TeamYaleCOVIDhttps://twitter.com/NathanGrubaugh/status/1236337684831928320 …",,@Yale @NathanGrubaugh,#COVID19 #TeamYaleCOVIDhttps,1236346770399080448,https://twitter.com/VirusesImmunity/status/1236346770399080448
2020-03-07 17:42:09,evankirstel,,18,250,316,"How viruses like #Coronavirus spread #COVID19 #COVIDー19. Thoughts on this video @daniel_kraft?pic.twitter.com/v2vmfPzXZu",,@daniel_kraft,#Coronavirus #COVID19 #COVIDー19,1236346410481659904,https://twitter.com/evankirstel/status/1236346410481659904
2020-03-07 17:39:42,EricTopol,,15,59,163,"The transcript from @CDCgov visit yesterday is like a #COVID19 horror show, w/ @POTUS (aka ""Dr Trump"" by @milbank) spouting off, while @CDCDirector smiles and @SecAzar looks w/ adulation https://www.rev.com/blog/transcripts/transcript-donald-trump-visits-cdc-calls-jay-inslee-a-snake …pic.twitter.com/sDdm3hWw5t",,@CDCgov @POTUS @milbank @CDCDirector @SecAzar,#COVID19,1236345794153738241,https://twitter.com/EricTopol/status/1236345794153738241
2020-03-07 17:38:01,ProfAkinAbayomi,,12,170,227,"#COVID19Lagos Situation Report as of 6th March, 2020 One confirmed case identified. 40 new samples collected for analysis. 349 Persons of interest from endemic countries under follow up. Training of stakeholders and awareness on #COVID19 ongoing #ForAGreaterLagos @LSMOHpic.twitter.com/TVVk6qN24P",,@LSMOHpic,#COVID19Lagos #COVID19 #ForAGreaterLagos,1236345371539968002,https://twitter.com/ProfAkinAbayomi/status/1236345371539968002
2020-03-07 17:35:12,Mom101,,6,393,1940,"Our govt agencies must do EVERYTHING possible to test likely #COVID19 cases, provide the public with accurate numbers, and prevent it from spreading further. That includes listening to the excellent doctors at @GWHospital, and every other hospital dealing with this./ 7",,@GWHospital,#COVID19,1236344664829149184,https://twitter.com/Mom101/status/1236344664829149184
2020-03-07 17:31:15,janephilpott,,6,23,132,"Kudos to @CIHR_IRSC on this rapid turnaround in research grant applications to support discovery science. Hope we will see continued significant investments in #COVID19 research. https://www.theglobeandmail.com/business/technology/science/article-ottawa-injects-268-million-into-coronavirus-research/ …",,@CIHR_IRSC,#COVID19,1236343667851325442,https://twitter.com/janephilpott/status/1236343667851325442
2020-03-07 17:27:55,DrEricDing,tancredipalmeri,39,254,399,"Gee. Italy is now a runaway #COVID19 . New cases spiked over + 1200 cases overnight, to now 5883 cases. Below timeline outdated but the limited ~589 recovered is true (ie don’t try to calculate CFR yet). 37k tests in much smaller Italy... ~32k neg1 in 6 have tested positive. https://twitter.com/tancredipalmeri/status/1236339184652234753 …",,,#COVID19,1236342831217815552,https://twitter.com/DrEricDing/status/1236342831217815552
2020-03-07 17:27:55,statesdj,,3,104,143,"Good discussion of the COVID19 epidemic and the imporance of hygiene and social distancing. Actually may be even more important than they suggest. Let me explain: 1/ https://www.thelancet.com/pb-assets/Lancet/pdfs/S0140673620305675.pdf …",,,,1236342828990693378,https://twitter.com/statesdj/status/1236342828990693378
2020-03-07 17:27:03,Mom101,,19,642,2409,"So here's what the hospital had to do with a likely #COVID19 infected, high-risk patient: They sent her home without testing her. Which also means, without reporting a likely positive patient in DC. /5",,,#COVID19,1236342613374009345,https://twitter.com/Mom101/status/1236342613374009345
2020-03-07 17:26:19,thehowie,marcorubio,124,215,1901,"In the midst of a pandemic, where testing in your home state and too many others is inadequate to protect the public's health, THIS is your tweeting priority? #COVID19 #coronavirus #TESTVIRUSNOW",,,#COVID19 #coronavirus #TESTVIRUSNOW,1236342427264389124,https://twitter.com/thehowie/status/1236342427264389124
2020-03-07 17:25:19,nancylevine,FLOTUS,75,759,1861,"At least 314 people with the Covid-19 illness have been treated in 28 states, and at least 17 patients with the virus have died. Melania Trump: We're building a Tennis Pavilion at the @WhiteHouse! #BeBest #COVID19 https://www.nytimes.com/interactive/2020/us/coronavirus-us-cases.html …",,@WhiteHouse,#BeBest #COVID19,1236342175811506176,https://twitter.com/nancylevine/status/1236342175811506176
2020-03-07 17:25:18,coregan999,,40,66,580,"Spent the last 3 days with @AmbulanceNAS doing home testing across the S/SE for @HSELive . interesting experience & well done to all patients who welcomed me into their home. Hopefully making a difference against #COVID19 #COVID19ireland @PeopleofHSE @NasDirector @paulreiddublinpic.twitter.com/z2Tl6khr5b",,@AmbulanceNAS @HSELive @PeopleofHSE @NasDirector @paulreiddublinpic,#COVID19 #COVID19ireland,1236342172355624961,https://twitter.com/coregan999/status/1236342172355624961
2020-03-07 17:24:54,marcorubio,,338,257,1138,"Sad news in #Florida as 2 deaths reported from #COVID19 The case in #SantaRosa County was previously known The case in Lee County was not previously known as the deceased was only tested after they had passed away Both were over 70 years of age May they Rest In Peace",,,#Florida #COVID19 #SantaRosa,1236342071327424512,https://twitter.com/marcorubio/status/1236342071327424512
2020-03-07 17:24:43,CAgovernor,,11,59,153,"The state is stepping up to protect Californians during the global #COVID19 outbreak. Governor @GavinNewsom‘s emergency proclamation helps to protect Californians from illegal price gouging on housing, gas, food and other essential supplies.https://www.sacbee.com/news/politics-government/capitol-alert/article240925526.html …",,@GavinNewsom,#COVID19,1236342023680114689,https://twitter.com/CAgovernor/status/1236342023680114689
2020-03-07 17:24:20,maiamajumder,niais,18,114,279,"Public school meal programs are such an important source of calories for disadvantaged kids — calories that disappear when schools go online. This is a fantastic example of the broader consequences that we need to consider when employing social distancing measures for #COVID19. https://twitter.com/niais/status/1236340988802564096 …",,,#COVID19,1236341927844470789,https://twitter.com/maiamajumder/status/1236341927844470789
2020-03-07 17:24:20,TRHLofficial,,21,46,402,"195 countries make their own decisions- take Coronavirus. Some made smart decisions. Some made terrible decisions. Now if a global central planning board banned border closings & flight suspensions for being “racist”, COVID19 could be an epidemic. That’s why globalism is bad.",,,,1236341926548422657,https://twitter.com/TRHLofficial/status/1236341926548422657
2020-03-07 17:20:31,MrMasonMills,,110,368,609,"Italy Coronavirus Update Active Cases: 5883 New Cases: 1247 Deaths: 233 (36 New) The situation in Italy is very serious, the disease is in every region of the country & all forecasts point toward them having tens of thousands of cases by the end of March. #COVID19",,,#COVID19,1236340968376414218,https://twitter.com/MrMasonMills/status/1236340968376414218
2020-03-07 17:17:11,NaveedAJamali,AlaskaAir,9,53,131,"#Seattle has had 14 deaths from #CoronaVirusSeattle and we don’t know how many are actually infected, now might be a good time for the @cdc to issue a travel advisory starting with #Seattle. #CoronaVirusSeattle #COVID19 https://twitter.com/AlaskaAir/status/1236338017104801792 …",,@cdc,#Seattle #CoronaVirusSeattle #Seattle #CoronaVirusSeattle #COVID19,1236340127825182721,https://twitter.com/NaveedAJamali/status/1236340127825182721
2020-03-07 17:15:21,jacknielsenN7,,16,301,332,"The WHO shipped #Covid19 tests to <60 countries. The US declined to use them, even though the CDC did not have it’s own test developed. This administration’s policy of #DontTestDontTell will ensure more Americans die for a #GOPCoverup. https://politi.co/3ayBmPF pic.twitter.com/QuB2tA7xoj",,,#Covid19 #DontTestDontTell #GOPCoverup,1236339668620214273,https://twitter.com/jacknielsenN7/status/1236339668620214273
2020-03-07 17:14:06,WHOEMRO,,16,166,181,"7 Mar 20, 7pm GMT+2 #of confirmed #COVID19 cases in the Region Afghanistan 4 Bahrain 63 Egypt 15 IR Iran 5823 incl 145 deaths Iraq 54 incl 2 deaths Jordan 1 Kuwait 61 Lebanon 22 Morocco 2 Oman 16 OPT 19 Pakistan 6 Qatar 12 Tunisia 1 KSA 7 UAE 45 pic.twitter.com/6GAzbTT7mw",,,#of #COVID19,1236339353934336001,https://twitter.com/WHOEMRO/status/1236339353934336001
2020-03-07 17:13:55,ddiamond,SeemaCMS,29,70,187,"Verma, who was only added to the coronavirus task force after Pence took over response from Azar, has now announced a flurry of #COVID19 moves on nursing homes, Medicare and Medicaid. (Her defenders say this is why she should have been added her sooner.) https://twitter.com/SeemaCMS/status/1236089014773600256 …",,,#COVID19,1236339306127593472,https://twitter.com/ddiamond/status/1236339306127593472
2020-03-07 17:09:53,DrEricDing,OHAOregon,53,305,529,"Oregon tested just 22 people yesterday... low, but almost 1 in 5 was positive from just the limited tests. That’s really bad sign. There’s no way the epidemic is confined to just Seattle area anymore. #COVID19 https://twitter.com/OHAOregon/status/1236337568234364928 …",,,#COVID19,1236338290720215048,https://twitter.com/DrEricDing/status/1236338290720215048
2020-03-07 17:07:41,CDCDirector,,478,54,184,"Great to have @POTUS & @SecAzar at CDC yesterday to discuss #COVID19 and see firsthand part of what makes @CDCgov a world renowned public health agency.",,@POTUS @SecAzar @CDCgov,#COVID19,1236337740020670464,https://twitter.com/CDCDirector/status/1236337740020670464
2020-03-07 17:07:28,NathanGrubaugh,,7,103,358,"The #covid19 epidemic is obviously terrible, and I feel for all of the families that are effected. The honest truth is that it could be my family too. Emergencies also can bring out the best in people, and I want to make sure that they get recognition. A short personal thread.",,,#covid19,1236337684831928320,https://twitter.com/NathanGrubaugh/status/1236337684831928320
2020-03-07 17:07:16,DrEricDing,,14,121,227,"When doctors test positive, it creates a tricky cascade in potentially infecting many patients: “Connecticut doctor who lives in New York and made rounds at a Bridgeport hospital tests positive for #COVID19. https://www.nbcnewyork.com/news/local/tri-state-at-49-covid-19-cases-and-counting-as-nationwide-death-toll-climbs-to-17/2316253/ …",,,#COVID19,1236337633795739648,https://twitter.com/DrEricDing/status/1236337633795739648
2020-03-07 17:06:12,HealthyFla,,9,107,103,"@HealthyFla #COVID19 Call Center is available 24 hours a day, 7 days a week at 1 (866) 779-6121 or email your questions to COVID-19@flhealth.gov",,@HealthyFla @flhealth,#COVID19,1236337363531563008,https://twitter.com/HealthyFla/status/1236337363531563008
2020-03-07 17:05:51,MichelleBee,,19,143,437,"People keep asking how it’s going in Seattle with #COVID19 and the answer is mostly fine with the exception: Small businesses are hurting. If you can, find your favorite Seattle small business website and order something from them to keep them alive.",,,#COVID19,1236337275782311937,https://twitter.com/MichelleBee/status/1236337275782311937
2020-03-07 17:05:42,DrJacobsRad,,15,33,105,"What a complete sociopath. #COVID19 https://www.independent.co.uk/news/world/asia/coronavirus-japan-bar-crawl-spread-gamagori-a9384541.html …",,,#COVID19,1236337241108156417,https://twitter.com/DrJacobsRad/status/1236337241108156417
2020-03-07 17:03:44,Crof,,9,111,296,"Wise: @Pontifex cancels public appearances to stop crowds gathering amid #COVID19 /via @globeandmailhttps://www.theglobeandmail.com/world/article-pope-francis-cancels-public-appearances-to-stop-crowds-gathering-amid/?utm_medium=Referrer:+Social+Network+/+Media&utm_campaign=Shared+Web+Article+Links …",,@Pontifex @globeandmailhttps,#COVID19,1236336744556974080,https://twitter.com/Crof/status/1236336744556974080
2020-03-07 17:01:39,GwenGraham,GovRonDeSantis,12,61,166,"You are just doing this now, @GovRonDeSantis? Leadership is preparing not reacting. I tweeted at you on February 25th asking what Florida was doing to prepare for #COVID19. I now have the answer. Not nearly enough. https://twitter.com/GovRonDeSantis/status/1236319360475705349 …",,@GovRonDeSantis,#COVID19,1236336218721443840,https://twitter.com/GwenGraham/status/1236336218721443840
2020-03-07 17:01:17,cpgYALE,,50,356,495,"UPDATED list of crowdsourced Academic Med Center #COVID19 Travel Restrictions. Now in Google doc format - open for additions and edits. Please share! https://bit.ly/2TS4hHY pic.twitter.com/6J0gpKY4VC",,,#COVID19,1236336129215025155,https://twitter.com/cpgYALE/status/1236336129215025155
2020-03-07 16:56:06,DaKidGowie,,13,35,156,"Coronavirus really has everyone shook! I've witnessed West Nile, Swine Flu, SARS, Ebola, and more. I am not worried about #COVID19 nor will I allow it to force me to live quarantined.",,,#COVID19,1236334822710181889,https://twitter.com/DaKidGowie/status/1236334822710181889
2020-03-07 16:52:58,BehtarIran,chawshin_83,4,98,123,"Two more nurses passed away in Gilan,N Iran today. #AyatollahsSpreadCOVID19 all over the country when they refused to be honest with ppl, when they didn’t quarantine Qom, when they didn’t stop flights to/from China. our friends on Twitter are no exception! an example! #COVID19 https://twitter.com/chawshin_83/status/1236329247418896385 …",,,#AyatollahsSpreadCOVID19 #COVID19,1236334034449567748,https://twitter.com/BehtarIran/status/1236334034449567748
2020-03-07 16:51:39,SeattleCCA,,4,61,81,". @FredHutch has advice for cancer patients, survivors and caregivers on who’s most at risk for #COVID19 and what you can do to stay healthy. Read more here: https://www.fredhutch.org/en/news/center-news/2020/03/coronavirus-what-cancer-patients-need-to-know.html …",,@FredHutch,#COVID19,1236333703241977857,https://twitter.com/SeattleCCA/status/1236333703241977857
2020-03-07 16:50:51,Lights4Chester,,21,96,251,"According to @WHO, one of the most important things you can do during this challenging time is to wash your hands properly. It should take up to 60 seconds so we thought this might help you keep track of the time @linkinpark #LPFamily #LightsForChester #COVID19 #coronaviruspic.twitter.com/kRKgN2s1EM",,@WHO @linkinpark,#LPFamily #LightsForChester #COVID19 #coronaviruspic,1236333502569893888,https://twitter.com/Lights4Chester/status/1236333502569893888
2020-03-07 16:50:50,BethCameron_DC,Channel4News,11,513,889,"I know @CEPIvaccines CEO Richard Hatchett well. He doesn't panic. He's proactive. He does math more quickly than anyone I know. He gets sh!t done. If you're questioning whether there's an over-reaction to #COVID19, pls listen. By April no-one will be wishing they had done *less* https://twitter.com/Channel4News/status/1235994748005085186 …",,@CEPIvaccines,#COVID19,1236333498937544710,https://twitter.com/BethCameron_DC/status/1236333498937544710
2020-03-07 16:47:00,HanianEmpress,,2,98,80,"The BEST tracking for COVID19 is this you tube live feed if you want to see in live technicolor just how badly @realDonaldTrump is bungling this. Retweet this if you think this is a pandemic and you want trump out of office!!!https://www.youtube.com/watch?v=qgylp3Td1Bw …",,@realDonaldTrump,,1236332531311673345,https://twitter.com/HanianEmpress/status/1236332531311673345
2020-03-07 16:45:39,JasonWilliamsNY,,5,46,231,"With all the cancellations this is one of the first times I’ve seen normalization of an “it’s everybody’s problem approach.” Yes, your one cancelled event probably won’t save lives but the fact that everyone is doing this will. Same mentality is needed for climate change #COVID19",,,#COVID19,1236332192172838912,https://twitter.com/JasonWilliamsNY/status/1236332192172838912
2020-03-07 16:43:55,JohnRMoffitt,,72,233,623,"Seriously folks ... how can you tell the #CoronaVirus from a Trump Nazi Hate Rally? #COVID19 pic.twitter.com/OKdGLNHWzk",,,#CoronaVirus #COVID19,1236331758376882181,https://twitter.com/JohnRMoffitt/status/1236331758376882181
2020-03-07 16:42:44,globaltimesnews,,8,45,111,"Wuhan closes the largest of its first three makeshift hospitals, on Saturday, as more #COVID19 patients continue to recover. http://bit.ly/39xLfwT pic.twitter.com/dPCisIuT5b",,,#COVID19,1236331458001801217,https://twitter.com/globaltimesnews/status/1236331458001801217
2020-03-07 16:41:02,ErikSTownsend,biancoresearch,15,29,122,"My own back-of-envelope calculations suggest ex-China case count should hit the psychologically important 100k mark around March 15. Governments and to a lesser extent financial markets are still completely out of touch with the scale of what's coming. #COVID19 https://twitter.com/biancoresearch/status/1236327488030154752 …",,,#COVID19,1236331032229621762,https://twitter.com/ErikSTownsend/status/1236331032229621762
2020-03-07 16:40:35,TimKennedyMMA,,147,437,3384,"I have two major takeaways from the #coronavirus. First, this is not bad; low death rate. Second, we are wholly unprepared if there is a serious virus that is as easily transmitted but more deadly. #COVID19 #COVID19",,,#coronavirus #COVID19 #COVID19,1236330917112811532,https://twitter.com/TimKennedyMMA/status/1236330917112811532
2020-03-07 16:34:16,rabernat,,6,25,80,"Reposting this as it seems very relevant to the #COVID19 situation. This is the best thing I've ever read on how to make remote meetings actually work: https://chelseatroy.com/2018/04/05/how-do-we-make-remote-meetings-not-suck/ …",,,#COVID19,1236329329635799046,https://twitter.com/rabernat/status/1236329329635799046
2020-03-07 16:34:05,naa3999,,5,87,284,"If you’re young, fit and healthy you have a good chance of recovering from #COVID19. Think about others with compromised immunity due to any reason, children, elderly, pregnant women and people with multiple comorbidities. Prevention starts from you.",,,#COVID19,1236329281954828288,https://twitter.com/naa3999/status/1236329281954828288
2020-03-07 16:33:06,JohnsHopkins,,5,51,99,"STAY INFORMED: Johns Hopkins experts gathered on Capitol Hill to provide facts and perspective on how #COVID19 is transmitted, how it's being tracked, and how governments, institutions, and individuals can prevent its spread. https://www.youtube.com/watch?v=Pnk8DuAly9Y …",,,#COVID19,1236329034608529408,https://twitter.com/JohnsHopkins/status/1236329034608529408
2020-03-07 16:32:36,SpokespersonCHN,DrTedros,92,68,641,"We are together in the global fight against #COVID19. https://twitter.com/DrTedros/status/1236288105382117378 …",,,#COVID19,1236328907789361152,https://twitter.com/SpokespersonCHN/status/1236328907789361152
2020-03-07 16:32:11,DrTedros,,94,484,1295,"It's been a very busy week for everyone. The world is fighting #COVID19 together as one. And yet life must go on. I hope everyone is taking rest this weekend. Here are some recommendations from @WHO",,@WHO,#COVID19,1236328803435233280,https://twitter.com/DrTedros/status/1236328803435233280
2020-03-07 16:31:20,NavdeepSBains,,2,31,74,"University of Toronto's Keith Pardee is harnessing government funding to create a #COVID19 lab-in-a-box : a kit about twice the size of a standard moving box that would make testing available on a global scale. https://www.ctvnews.ca/health/coronavirus/canada-funds-development-of-covid-19-lab-in-a-box-1.4843150 …",,,#COVID19,1236328592063291393,https://twitter.com/NavdeepSBains/status/1236328592063291393
2020-03-07 16:29:47,PaulyShore,,25,25,163,"Dudes, I’m scared to go out too! If you guys wanna see me, come see me at the 4plex where I will be sequestered for quite some time. I guess it’s @UberEats. I’m living in my own Bio-Dome! #paulyshore reports on #COVID19 (coronavirus) Watch: http://bit.ly/PaulyReports pic.twitter.com/u8S2BClqtY",,@UberEats,#paulyshore #COVID19,1236328198650179589,https://twitter.com/PaulyShore/status/1236328198650179589
2020-03-07 16:29:23,farishussain,,6,57,153,"May Allah protect the front line medical workers who put their lives on the line in the effort against #COVID19",,,#COVID19,1236328099307900934,https://twitter.com/farishussain/status/1236328099307900934
2020-03-07 16:27:19,ALT_uscis,,4,72,182,"You do know CBP-ICE and the private prison industry will TELL YOU JACK SH*T about the #COVID19 pandemic if spreading within the 100,000+ locked up immigrants and children daily.",,,#COVID19,1236327581357608960,https://twitter.com/ALT_uscis/status/1236327581357608960
2020-03-07 16:26:58,NaaSolih,,1,22,81,"Now is the time to stick together. To help each other. Be kind. Lend a hand where needed. Help the health workers as much as you can. Always be honest when they’re contact tracing. #Covid19",,,#Covid19,1236327493511991297,https://twitter.com/NaaSolih/status/1236327493511991297
2020-03-07 16:25:48,EricTopol,,7,144,256,"Learning what works from ~100 years ago https://www.pnas.org/content/104/18/7582 … @PNASNews by @DrRHatchett @mlipsitch @CCDD_HSPH Philly vs St. Louis (<-why we need to be St. Louis) https://www.wsj.com/articles/what-we-can-learn-from-the-20th-centurys-deadliest-pandemic-11583510468?mod=searchresults&page=1&pos=1 … @jonoquick @DukeGHI @WSJopinion #COVID19 pic.twitter.com/EucHKLPx7C",,@PNASNews @DrRHatchett @mlipsitch @CCDD_HSPH @jonoquick @DukeGHI @WSJopinion,#COVID19,1236327199759675394,https://twitter.com/EricTopol/status/1236327199759675394
2020-03-07 16:23:53,DrTedros,,68,385,852,"Any death due to the #coronavirus is one too many. This smart piece by @mlipsitch makes very important points about the #COVID19 case fatality rate https://www.washingtonpost.com/opinions/2020/03/06/why-its-so-hard-pin-down-risk-dying-coronavirus/ … I also like how my colleague @mvankerkhove explained it at yesterday's press conference.pic.twitter.com/gerq8s7cYD",,@mlipsitch @mvankerkhove,#coronavirus #COVID19,1236326714638307330,https://twitter.com/DrTedros/status/1236326714638307330
2020-03-07 16:23:35,jmover,,25,93,524,"1/ I don't think it will be possible to fully understand the economic impact of #COVID19, but I am fairly certain whatever it is, we are underestimating the actual collateral damage bc of the complexities that cannot be grasped today. Thread...",,,#COVID19,1236326641854558210,https://twitter.com/jmover/status/1236326641854558210
2020-03-07 16:23:16,DrZweliMkhize,,34,60,80,"Government Is Indentifying Accommodation Facilities To Accommodate South African Nationals To Be Evacuated From China #Coronavirus #COVID19 pic.twitter.com/sxzKGqRZnu",,,#Coronavirus #COVID19,1236326561864986624,https://twitter.com/DrZweliMkhize/status/1236326561864986624
2020-03-07 16:21:19,BiologistDan,LizSpecht,4,43,84,"This is a must read if you want to understand why experts are NOT overreacting to the #coronavirus ( #COVID19) threat. The numbers are spot on. This is not a hoax. https://twitter.com/LizSpecht/status/1236095180459003909 …",,,#coronavirus #COVID19,1236326069520785418,https://twitter.com/BiologistDan/status/1236326069520785418
2020-03-07 16:12:07,MohamedHamdhoon,,2,45,125,"Take a deep breath & follow the instruction given by authorities. Don't panic, wash your hands frequently & most importantly refrain from spreading false information. In shaa Allah, we will defeat #Covid19!",,,#Covid19,1236323753329487874,https://twitter.com/MohamedHamdhoon/status/1236323753329487874
2020-03-07 16:10:59,vijayprashad,,3,94,249,"Humanitarianism: immediately end all sanctions on Iran so it can get supplies to handle the #COVID19 outbreak. No barriers, no hesitation.",,,#COVID19,1236323470998474752,https://twitter.com/vijayprashad/status/1236323470998474752
2020-03-07 16:09:24,RealDoctorMike,YouTube,79,204,2078,"Sad to see that my #covid19 videos with milllions of views almost never come up on the top search results despite 100% facts from @cdc and @WHOhttps://twitter.com/YouTube/status/1236088497242607617 …",,@cdc @WHOhttps,#covid19,1236323070572408834,https://twitter.com/RealDoctorMike/status/1236323070572408834
2020-03-07 16:06:13,DrTedros,,30,266,478,"This is a useful @guardian piece by @jonhenley about the #COVID19 outbreak. My favorite line & an accurate one is: ""It is worth remembering the world has never had better tools to fight it, and that if we are infected, we are unlikely to die from it."" https://www.theguardian.com/world/2020/mar/07/coronavirus-reasons-to-be-reassured?fbclid=IwAR14viVrMuuMFzuI53DYBR33zSDji2J57KWhaIeaCbI4zGGjSFz5G3YfM0c …",,@guardian @jonhenley,#COVID19,1236322270890594305,https://twitter.com/DrTedros/status/1236322270890594305
2020-03-07 16:05:05,EricTopol,,39,783,1276,"Mitigating #COVID19 @TheLancet, the difficult decisions, is superb https://www.thelancet.com/pb-assets/Lancet/pdfs/S0140673620305675.pdf … by Roy Anderson, @DeirdreHoll and colleagues ""Best estimates suggest a CFR for COVID-19 of about 0·3–1%, which is higher than the order of 0·1% CFR for a moderate influenza A season""pic.twitter.com/uNNwE8MQor",,@TheLancet @DeirdreHoll,#COVID19,1236321986122375168,https://twitter.com/EricTopol/status/1236321986122375168
