date,username,to,replies,retweets,favorites,text,geo,mentions,hashtags,id,permalink
2020-03-14 17:36:53,10News,,12,106,149,"#Breaking: Second Marine stationed at MCAS Miramar tests positive for COVID-19 #CoronaVirus #COVID19 https://www.10news.com/news/national/coronavirus/second-marine-stationed-at-mcas-miramar-tests-positive-for-covid-19 …",,,#Breaking #CoronaVirus #COVID19,1238881803538030593,https://twitter.com/10News/status/1238881803538030593
2020-03-14 17:35:10,AdvoBarryRoux,,97,260,1377,"The CoronaVirus is not spreed, it’s being brought in South Africa by Abelungu. #COVID19 #coronavirus #CoronavirusInSA",,,#COVID19 #coronavirus #CoronavirusInSA,1238881371772178437,https://twitter.com/AdvoBarryRoux/status/1238881371772178437
2020-03-14 17:34:12,ashtonpittman,,8,24,79,"Woman: *takes her job seriously* Man: ""Just take it nice and easy. Just relax."" (Moments later, Trump suggested everyone should quit shaking hands forever). Telling women to relax for doing their jobs. Not just a #COVID19 thing. #TrumpPressConferencepic.twitter.com/K46kdZF0LB",,,#COVID19 #TrumpPressConferencepic,1238881125361160200,https://twitter.com/ashtonpittman/status/1238881125361160200
2020-03-14 17:33:38,MontyBoa99,DonaldJTrumpJr,5,27,106,"If you thought POUTS's trade wars were just going to bankrupt soybean and dairy farmers and solar panel installers, you've got another think coming when one of your parents shows up in the ER w/ COVID19 and they don't have the supplies they needed. https://twitter.com/ChadBown/status/1238570924527489026?s=20 …",,,,1238880983115599872,https://twitter.com/MontyBoa99/status/1238880983115599872
2020-03-14 17:33:08,itsnotjessica,,74,101,154,"I have all the symptoms of covid19. THT clinic refused to see me because I have symptoms. Quickcare won’t refer me to be tested and told me to self quarantine. I’m a teacher in the CCSD. I’m sick nobody will help me.",,,,1238880856321605633,https://twitter.com/itsnotjessica/status/1238880856321605633
2020-03-14 17:33:07,maikelele,,9,20,304,"""You're young and healthy you gonna be fine. It's only older people dying from it."" That's still someones mother, father or grandparents and they're worth as much as anyone else. This extremly used quote just shows how retarded some people are. #COVID19 #coronavirus",,,#COVID19 #coronavirus,1238880852639088640,https://twitter.com/maikelele/status/1238880852639088640
2020-03-14 17:33:02,AndyBiotech,,14,104,218,"#COVID19 Italy total cases now exceeds 20,000 -Total cases: 1766021157 -Death toll: 12661441 -Hospitalized: 74268372 -ICU: 13281518 Kudos to all the Italian people trying their best to stay positive amid this #Coronavirus pandemic https://twitter.com/leonardocarella/status/1238511612270690305 …pic.twitter.com/K2AXO1M1dn",,,#COVID19 #Coronavirus,1238880831608946691,https://twitter.com/AndyBiotech/status/1238880831608946691
2020-03-14 17:32:51,CBCQueensPark,walrusmagazine,1,66,103,"THREAD - an important one - from intensive care doctor @kevinpatterson: “If we control the spread, if we slow transmission down, even the people who will get ill have much, much better odds. The fatality rate changes based on how we respond to #COVID19” https://twitter.com/walrusmagazine/status/1238857459902668800 …",,@kevinpatterson,#COVID19,1238880787983974407,https://twitter.com/CBCQueensPark/status/1238880787983974407
2020-03-14 17:32:47,iCandy_pw,,22,123,311,"For those worried about me. I’m living in #Qatar where our shelves are still full. Absolutely no sign of panic buying. Our health care is amongst the finest. And the decisions our ministries are taking seem well thought out, unlike other countries. I’m fine. #Coronavirus #COVID19",,,#Qatar #Coronavirus #COVID19,1238880769424216064,https://twitter.com/iCandy_pw/status/1238880769424216064
2020-03-14 17:32:47,CapitalistGhoul,,31,16,110,"Your last saved image is your response to catching COVID19 https://twitter.com/ComradeSnake/status/1238879865509515264 …pic.twitter.com/EPyytKN53V",,,,1238880769306537984,https://twitter.com/CapitalistGhoul/status/1238880769306537984
2020-03-14 17:32:34,pentru_tine,,2,42,155,"Viva Italia! Wish you all the best! Thank you for sharing this ""Joy of life""! #COVIDー19 #coronavirus #coronaitalia #COVID19 #CoronaVirusDEpic.twitter.com/sFjJGlGcU8",,,#COVIDー19 #coronavirus #coronaitalia #COVID19 #CoronaVirusDEpic,1238880716022317057,https://twitter.com/pentru_tine/status/1238880716022317057
2020-03-14 17:32:20,JohnsHopkinsSPH,,2,55,63,"Our @PublicHealthPod is on multiple platforms, with more coming. Evidence-based insights on #COVID19. https://www.jhsph.edu/podcasts/public-health-on-call/ … Spotify: https://open.spotify.com/show/0ipz4Jv2D7utXXzaQ7wKzU … Google: https://podcasts.google.com/?feed=aHR0cDovL2pvaG5zaG9wa2luc3NwaC5saWJzeW4uY29tL3Jzcw%3D%3D … YouTube (w/ captions): https://www.youtube.com/playlist?list=PLtgdsdWLoHgTiUYXtC2PYoxAku6iBgQtg … Apple:https://podcasts.apple.com/us/podcast/public-health-on-call/id1501336958 …",,@PublicHealthPod,#COVID19,1238880654638669826,https://twitter.com/JohnsHopkinsSPH/status/1238880654638669826
2020-03-14 17:31:31,skysports_bryan,,11,45,395,"UEFA: European football attempting to agree clarity for summer - but nobody yet knows what will happen with pandemic. Calls to still take place on Tuesday: #SSN #COVID19 https://www.skysports.com/football/news/11095/11957627/future-of-european-football-set-to-be-decided-by-uefa-with-four-conference-calls-on-tuesday …",,,#SSN #COVID19,1238880449717579776,https://twitter.com/skysports_bryan/status/1238880449717579776
2020-03-14 17:31:17,WCraigFugate,casciano_lou,3,12,51,"Maybe Congress could appoint a 911 style commission to review what worked and didn’t work, recommend changes to laws, rules, policies, and funding before another pandemic. #COVID19 #coronavirushttps://twitter.com/casciano_lou/status/1238833581084028928 …",,,#COVID19 #coronavirushttps,1238880391450308615,https://twitter.com/WCraigFugate/status/1238880391450308615
2020-03-14 17:30:59,weddady,,6,13,71,"At this rate #COVID19 will soon turn Saharan turbans into a fashion statement for Americans pic.twitter.com/J3zfdJyw5s",,,#COVID19,1238880315738918912,https://twitter.com/weddady/status/1238880315738918912
2020-03-14 17:30:22,abc3340,,0,70,76,"UPDATING LIST: Free meals for central Alabama kids during coronavirus #COVID19 school closures https://abc3340.com/news/coronavirus/free-meals-for-central-alabama-kids-during-covid-19-school-closures …",,,#COVID19,1238880163385028615,https://twitter.com/abc3340/status/1238880163385028615
2020-03-14 17:30:05,bestfriends,,4,74,179,"Good news for pets: @IDEXX tested thousands of cats and dogs for coronavirus. NONE had it. Get the full details on @PressHerald: http://bit.ly/2Qh0dQq . #covid19 #coronavirus ^ND",,@IDEXX @PressHerald,#covid19 #coronavirus,1238880088428593152,https://twitter.com/bestfriends/status/1238880088428593152
2020-03-14 17:30:00,DHSWI,,3,120,86,"If all the talk about #COVID19 is making you feel overwhelmed or frightened, support is available. Call @distressline at 1-800-985-5990 or text TalkWithUs to 66746. You are not alone. #COVID19_WI #NoStigma @GovEvers @DHSWIpic.twitter.com/ou0fQwV2Yb",,@distressline @GovEvers @DHSWIpic,#COVID19 #COVID19_WI #NoStigma,1238880068849373184,https://twitter.com/DHSWI/status/1238880068849373184
2020-03-14 17:29:00,MDHealthDept,,8,41,56,"Though Marylanders may be eager to celebrate St. Patrick’s Day this weekend, please take every precaution to protect yourself and those around you during this public health emergency. For resources regarding #COVID19, visit http://health.maryland.gov/coronavirus pic.twitter.com/3k9YXqPBPp",,,#COVID19,1238879819443646468,https://twitter.com/MDHealthDept/status/1238879819443646468
2020-03-14 17:28:57,DrTomFrieden,,94,1001,2132,"Shocking, unacceptable @CDCgov not allowed to speak. Can be w @POTUS & @VP. Reporters/public best served by best scientific experts. Today's CDC media brief cancelled last minute. SINGLE most important action now get & share more info on #COVID19. So much we need to know & don't.",,@CDCgov @POTUS @VP,#COVID19,1238879803505287168,https://twitter.com/DrTomFrieden/status/1238879803505287168
2020-03-14 17:28:48,bigfatsurprise,,35,254,617,"Risk of #COVID19 death worse for those w/ heart disease vs. people70-79y. Diabetes also worsens outcomes. To preserve metabolic health: Avoid vegetable oils (inflammatory), Avoid sugar, foods that turns to sugar in ur body-grains, pasta, even sugary fruits https://www.wsj.com/articles/whos-most-at-risk-from-the-coronavirus-11584048476 …",,,#COVID19,1238879767060975616,https://twitter.com/bigfatsurprise/status/1238879767060975616
2020-03-14 17:28:32,picardonhealth,,15,158,228,"They dogma is that #coronavirus isn't airborne—but “airborne” means different things to different scientists, and that confusion needs to be addressed, by @rkhamsi https://www.wired.com/story/they-say-coronavirus-isnt-airborne-but-its-definitely-borne-by-air/?utm_source=twitter&utm_medium=social&utm_campaign=onsite-share&utm_brand=wired&utm_social-type=earned … via @wired #COVID19",,@rkhamsi @wired,#coronavirus #COVID19,1238879701105627137,https://twitter.com/picardonhealth/status/1238879701105627137
2020-03-14 17:28:24,TheRealColmRyan,,7,45,97,"We will have 15 Minute Rapid Tests for #COVID19 freely available for some Irish hospitals in the next 10 days. Only 1 drop of blood and results determined by eye. Please DM and RT to relevant contacts. @ciaraKellydoc @PatKennyNT @TodaySORhttps://www.assaygenie.com/covid-19-rapid-poc-test/ …",,@ciaraKellydoc @PatKennyNT @TodaySORhttps,#COVID19,1238879666766782464,https://twitter.com/TheRealColmRyan/status/1238879666766782464
2020-03-14 17:28:24,stevesilberman,,29,131,198,"This allegedly bold new approach to #COVID19 advocated by some UK officials - which boils down to letting old and disabled people die to build up ""herd immunity"" - is straight-up #eugenics.https://www.theguardian.com/world/2020/mar/13/herd-immunity-will-the-uks-coronavirus-strategy-work …",,,#COVID19 #eugenics,1238879664895971328,https://twitter.com/stevesilberman/status/1238879664895971328
2020-03-14 17:27:31,_DebSchulte,,41,105,238,"As Minister of Seniors, I have a special message for seniors about #COVID19. https://youtu.be/ThXTThyU4Pk",,,#COVID19,1238879444879761410,https://twitter.com/_DebSchulte/status/1238879444879761410
2020-03-14 17:26:58,sshinaz,MvCrisis,5,53,189,"Covid19 confirmation kits are distributed on limited quota. It would be foolish to expect every person with a temperature be tested. Seeing how even the first World countries are struggling with resources, I must say Government has been handling this commendably well! https://twitter.com/MvCrisis/status/1238730208884035584 …",,,,1238879307394461696,https://twitter.com/sshinaz/status/1238879307394461696
2020-03-14 17:26:56,AntonioArellano,,12,244,233,"6 Texas Republicans voted against the U.S. House bill that will provide free #COVID19 testing. Reps. Brian Babin of Woodville, Michael Cloud of Victoria, Louie Gohmert of Tyler, Lance Gooden of Terrell, Chip Roy of Austin and Randy Weber of Friendswood voted against the package.",,,#COVID19,1238879298146185224,https://twitter.com/AntonioArellano/status/1238879298146185224
2020-03-14 17:26:31,colleenmfarrell,,2,34,148,"An invitation for maintaining social connection during #SocialDistancing #COVID19: 1st and 3rd Wed of each month, my team and I host a Twitter chat (ie real-time online discussion) of short works of arts & humanities. It's called Medical Humanities Chat @MedHumChat 1/n",,@MedHumChat,#SocialDistancing #COVID19,1238879191560605697,https://twitter.com/colleenmfarrell/status/1238879191560605697
2020-03-14 17:25:52,jackiedevega,,2,65,228,"JUST IN: Coronavirus update from head of Italy's Civil Protection Agency, Angelo Borrelli: 17750 positive (+2795) 1966 recovered (+527) +175 deaths from yesterday 1441 deaths 1518 in ICU 21,157 - TOTAL CASE OF COVID19 @ABSCBNNews",,@ABSCBNNews,,1238879030914547712,https://twitter.com/jackiedevega/status/1238879030914547712
2020-03-14 17:25:39,mlipsitch,,12,397,753,"Regretting I am just now finding the excellent detailed an no-paywall #covid19 coverage in @wired. Bravo. How Long Does the Coronavirus Last on Surfaces? | WIREDhttps://www.wired.com/story/how-long-does-the-coronavirus-last-on-surfaces/ …",,@wired,#covid19,1238878973062504448,https://twitter.com/mlipsitch/status/1238878973062504448
2020-03-14 17:25:09,mannkibaat,,6,78,589,"Acclaimed sand artist Shri @sudarsansand's sand art of PM Shri @narendramodi with message “Say Yes to #Namaste; Say No to Handshake”. #COVID19 pic.twitter.com/Z2ItVzfVMM",,@sudarsansand @narendramodi,#Namaste #COVID19,1238878848877387776,https://twitter.com/mannkibaat/status/1238878848877387776
2020-03-14 17:25:08,CT_Bergstrom,,13,70,179,"You may have seen the #COVID19 #coronavirus post going around about why the #FlattenTheCurve curve is a lie. Even the author himself apparently doesn't mean this. For an article all about how the professional epidemiologists aren't being precise enough, this is not a good look.pic.twitter.com/1puRlGHGLH",,,#COVID19 #coronavirus #FlattenTheCurve,1238878844183969796,https://twitter.com/CT_Bergstrom/status/1238878844183969796
2020-03-14 17:24:20,RepThomasMassie,,164,115,939,"Is there a test yet that can determine whether someone had COVID19 in the past but has now recovered?",,,,1238878643146940419,https://twitter.com/RepThomasMassie/status/1238878643146940419
2020-03-14 17:23:52,NYorNothing,,36,13,342,"Avoid the coronavirus lovers, less talk & hand holding, more oral & fingering! Dating 2020 #COVID19 #coronavirus",,,#COVID19 #coronavirus,1238878525454798848,https://twitter.com/NYorNothing/status/1238878525454798848
2020-03-14 17:22:15,GermHunterMD,GermHunterMD,11,56,111,"Canada has conducted >492 #covid19 tests per million people (compared to 23 tests per million in USA)... and not a penny out of pocket for patients Tell me again about socialist medicine? https://twitter.com/GermHunterMD/status/1238834886527422466 …",,,#covid19,1238878119617892352,https://twitter.com/GermHunterMD/status/1238878119617892352
2020-03-14 17:22:11,CatchTheseWords,,3,50,114,"#covid19 is hitting disabled people especially hard, partly because many of us will be impacted by the virus far more than healthy people. But also because the steps to avoiding it are more difficult.",,,#covid19,1238878100554842113,https://twitter.com/CatchTheseWords/status/1238878100554842113
2020-03-14 17:20:45,RichardBarrow,,16,158,310,"Now that world citizens shouldn’t shake hands with each other, the Thai Wai has become the perfect alternative for greeting each other during the #COVID19 pandemic #Thainess #AmazingThailand #ThaiWai #Thailandpic.twitter.com/PsuEhvHtrf",,,#COVID19 #Thainess #AmazingThailand #ThaiWai #Thailandpic,1238877743128940546,https://twitter.com/RichardBarrow/status/1238877743128940546
2020-03-14 17:19:59,HealthySCC,,39,104,122,"Update: 17 new cases of #COVID19 in Santa Clara County. This brings the total number of cases to 91. We expect numbers to grow and urge everyone to follow Public Health recommendations. For additional information, visit: http://direc.to/dY2d pic.twitter.com/WxuoTD04GE",,,#COVID19,1238877548890578946,https://twitter.com/HealthySCC/status/1238877548890578946
2020-03-14 17:19:38,PeterMacKay,,154,173,563,"#COVID19 is a serious problem. We need to be serious about the solution. pic.twitter.com/rZGB2OyVRu",,,#COVID19,1238877462328758275,https://twitter.com/PeterMacKay/status/1238877462328758275
2020-03-14 17:19:05,SnarkishDanno,,9,183,534,"Oh another thing about the Celebs. Notice how the ones that are “catching” Covid19 are spread all over with no obvious contact to the contaigion? How could they have gotten it? Well... by injection, not by regular contact.",,,,1238877323241254913,https://twitter.com/SnarkishDanno/status/1238877323241254913
2020-03-14 17:18:41,JoyAnnReid,,170,1199,3377,"I have a question! Can states now buy the @WHO-OKd COVID19 test to speed up testing? It is apparently inexpensive, highly effective and is being used all over the world. NYC mayor @BilldeBlasio told me today if it was legal, the city would want it. #CoronaVirusUpdates",,@WHO @BilldeBlasio,#CoronaVirusUpdates,1238877223018528771,https://twitter.com/JoyAnnReid/status/1238877223018528771
2020-03-14 17:18:34,AJEnglish,,34,455,745,"What are the latest #CoronaVirusUpdates Which countries have confirmed cases? What happens if you catch the virus? Follow our live coverage for the latest developments on #COVID19 here https://aje.io/ap539 pic.twitter.com/gnVSVBxMaD",,,#CoronaVirusUpdates #COVID19,1238877190764322816,https://twitter.com/AJEnglish/status/1238877190764322816
2020-03-14 17:18:29,FlyoverStateMom,,2,38,182,"#COVID19 may have us indoors — but Indiana @MomsDemand #KeepGoing. We’re emailing, calling, and using social media to tell our legislators and supporters to help us #EndGunViolence. Join us by texting READY with those clean hands to 644-33.pic.twitter.com/DJX3qrkpFy",,@MomsDemand,#COVID19 #KeepGoing #EndGunViolence,1238877171638206465,https://twitter.com/FlyoverStateMom/status/1238877171638206465
2020-03-14 17:18:02,PublicHealth,,0,62,80,"A failure to invest in U.S. public health has left local & state health departments struggling to respond to the #COVID19 outbreak, reports @nytimes:https://www.nytimes.com/2020/03/14/us/coronavirus-health-departments.html …",,@nytimes,#COVID19,1238877057578340353,https://twitter.com/PublicHealth/status/1238877057578340353
2020-03-14 17:17:24,SnarkishDanno,,11,155,419,"Anyway, in summation, I believe we have two different sources for Covid19, naturally spreading from Wuhan, and then from spiked adrenochrome.",,,,1238876900493103106,https://twitter.com/SnarkishDanno/status/1238876900493103106
2020-03-14 17:16:46,disclosetv,,5,138,150,"BREAKING - Norway closes all borders, airports, and seaports amid the #COVID19 pandemic. pic.twitter.com/OrmMd8HGV0",,,#COVID19,1238876740174467076,https://twitter.com/disclosetv/status/1238876740174467076
2020-03-14 17:16:40,HPA_MV,,0,99,107,"#COVID19 - March 14 As of 09:00pm: - Confirmed cases: 10 - Farukolhu Isolation: 11 - Villivaru quarantine: 17 For more information: https://covid19.health.gov.mv pic.twitter.com/X8HN99OQMW",,,#COVID19,1238876715184566272,https://twitter.com/HPA_MV/status/1238876715184566272
2020-03-14 17:16:17,ABSCBNNews,,1,52,184,"Number of coronavirus cases worldwide passes 150,000, according to an @AFP tally #COVID19 pic.twitter.com/aOMFsvjOV2",,@AFP,#COVID19,1238876616203227137,https://twitter.com/ABSCBNNews/status/1238876616203227137
2020-03-14 17:15:52,megtirrell,,71,87,281,"LabCorp and Quest are seeing 98-99% of tests for #COVID19 come back negative, Dr Deborah Birx says in White House Coronavirus Task Force briefing (at least I think that's what ""are running at 99, 98% negativity"" means)",,,#COVID19,1238876514307002368,https://twitter.com/megtirrell/status/1238876514307002368
2020-03-14 17:15:35,KanchanGupta,,6,133,206,"#Kerala just refuses to acknowledge the efforts being made. All it does is to pass resolutions against Modi Govt. Sad and deplorable to see such petty politics over #Covid19 https://twitter.com/MukulAgarwal66/status/1238788127444979713 …pic.twitter.com/oCA7Snk1u7",,,#Kerala #Covid19,1238876440545742849,https://twitter.com/KanchanGupta/status/1238876440545742849
2020-03-14 17:15:34,rkwadhera,,0,16,58,"#Socialdistancing in the #COVID19 era ""The one that stays away can help the rest"" pic.twitter.com/FSkC4ginS2",,,#Socialdistancing #COVID19,1238876435256872961,https://twitter.com/rkwadhera/status/1238876435256872961
2020-03-14 17:15:31,cityofplanotx,,7,72,91,"Coronavirus (COVID-19) Update: March 14, The Collin County Health Department reports 47-year-old Plano woman has tested presumptive positive for novel coronavirus #COVID19. Information can be found at https://share.plano.gov/COVID-19update .",,,#COVID19,1238876423655473153,https://twitter.com/cityofplanotx/status/1238876423655473153
2020-03-14 17:14:59,johnsweeneyroar,,6,62,196,"#PanicDiary March 14th #COVID19 #coronavirus In Britain, we're panic-buying loo roll. In Italy, where things are far worse, a thousand dead and a nation in lockdown, they are celebrating the human spirit. Edited by Giovanni Culmone. https://youtu.be/zerqSalUZJ0 #Italyfightsbackpic.twitter.com/DbboWKFHOR",,,#PanicDiary #COVID19 #coronavirus #Italyfightsbackpic,1238876292386258944,https://twitter.com/johnsweeneyroar/status/1238876292386258944
2020-03-14 17:14:54,ZAEffendy,waltonkate,13,128,516,"Best ever seen leadership communication since 2014 in management crisis handling of the pandemic #COVID19 pic.twitter.com/i24lteivwy",,,#COVID19,1238876269523005440,https://twitter.com/ZAEffendy/status/1238876269523005440
2020-03-14 17:14:28,RepSeanMaloney,,3,34,163,"When it comes to fighting #COVID19, we need to prepare for the worst as we work for the best. That's why I'm working closely with local leaders and experts in the Hudson Valley to make sure families have the resources they need. More pic.twitter.com/mU5A610qO7",,,#COVID19,1238876159716229122,https://twitter.com/RepSeanMaloney/status/1238876159716229122
2020-03-14 17:14:19,StevieC30,,256,865,6754,"Should supermarkets only open for the first hour of the day to pensioners / disabled etc to allow them to get what they need before all the selfish nobheads in perfect health stock pile all the bog roll and beans? Just a thought #COVID19",,,#COVID19,1238876124446367747,https://twitter.com/StevieC30/status/1238876124446367747
2020-03-14 17:13:18,WIRED,,5,42,89,"Part of managing #Covid19 is keeping sick people out of hospitals. Telemedicine is emerging as a possible filter, keeping those with moderate symptoms at home while routing more severe cases to hospitals. https://wired.trib.al/puzYCUi",,,#Covid19,1238875865049706499,https://twitter.com/WIRED/status/1238875865049706499
2020-03-14 17:13:17,vijayanpinarayi,,678,4953,21879,"#COVID19 | Solving The Mask Problem In light of the shortage, directions were given to engage the prisons in the State in manufacturing masks. It has commenced on a war footing basis. Today, the Prison officials of Thiruvananthapuram Jail have handed over the first batch. pic.twitter.com/QKgHWqYNOg",,,#COVID19,1238875861769543680,https://twitter.com/vijayanpinarayi/status/1238875861769543680
2020-03-14 17:12:55,capt_amarinder,,121,314,2182,"I assure everyone that there is no need to panic on account of #COVID19. We are proactively screening everyone coming from abroad & all necessary arrangements are in place. I urge all Punjabis to take due precautions. Together we shall successfully overcome this challenge. pic.twitter.com/TNrTWDzLMk",,,#COVID19,1238875769272598528,https://twitter.com/capt_amarinder/status/1238875769272598528
2020-03-14 17:12:50,SammyHudes,,13,66,169,"A Saddledome concessions worker says part-time employees like himself stand to lose $1,200-$1,400 for shifts that had been scheduled up until the end of April. ""It just sucks for my fellow employees,"" he says. UPDATED file: https://calgaryherald.com/sports/hockey/nhl/calgary-flames/flames-employees-wont-be-paid-beyond-march-12-for-cancelled-shifts/ … #COVID19 #Flames",,,#COVID19 #Flames,1238875749072777216,https://twitter.com/SammyHudes/status/1238875749072777216
2020-03-14 17:12:41,DonovanWoods,,15,7,273,"I’m gonna be the first white, bearded male singer/songwriter to release a folk album “recorded while in deep isolation during the dramatic #covid19 quarantine”, mark that down.",,,#covid19,1238875712066670593,https://twitter.com/DonovanWoods/status/1238875712066670593
2020-03-14 17:12:24,SriLankaTweet,,0,74,109,"#CoronaVirusSriLanka 10 tested positive 107 under observations 1500 at Quarantine centers March 16 declared holiday All major events banned for 2 weeks #LKA #SriLanka #CoronaVirus #CoronaVirusPandemic #COVID19 https://www.lankaeducation.com/coronavirus-covid19-latest-news-updates-live-sri-lanka/ …pic.twitter.com/Ol47C8vAJ2",,,#CoronaVirusSriLanka #LKA #SriLanka #CoronaVirus #CoronaVirusPandemic #COVID19,1238875640935284737,https://twitter.com/SriLankaTweet/status/1238875640935284737
2020-03-14 17:12:00,GovMikeDeWine,Enquirer,11,46,276,"Good read from @jbalmert and @JMBorchardt at the Cincinnati @Enquirer on #Ohio's response to #COVID19 -- it all comes down to science. https://twitter.com/Enquirer/status/1238817923659071495 …",,@jbalmert @JMBorchardt @Enquirer,#Ohio #COVID19,1238875538657329153,https://twitter.com/GovMikeDeWine/status/1238875538657329153
2020-03-14 17:11:38,saschalobo,RegBerlin,12,56,158,"Berlin total shutdown #COVID19 #Coronahttps://twitter.com/RegBerlin/status/1238872479810179076 …",,,#COVID19 #Coronahttps,1238875446378364929,https://twitter.com/saschalobo/status/1238875446378364929
2020-03-14 17:11:02,jdgreear,,16,89,438,"The @realDonaldTrump Administration and @BenSasse et al have priorities right here. Emergency funding to fight #COVID19 is no place for Speaker Pelosi to advance the abortion agenda. re: #abortion funding. #HydeAmendment #ProLifehttps://www.nationalreview.com/news/sasse-rips-pelosi-for-trying-to-smuggle-hyde-amendment-loophole-into-coronavirus-package/ …",,@realDonaldTrump @BenSasse,#COVID19 #abortion #HydeAmendment #ProLifehttps,1238875296453079040,https://twitter.com/jdgreear/status/1238875296453079040
2020-03-14 17:10:31,RGrosjean,,14,99,982,"Speed is of the essence. We must “Be Ready” for the new #coronavirus today. Look out for the most common symptoms for #COVID19: fever, dry cough & shortness of breath. Find out other ways to prepare for the virus by reading the latest @WHOadvice: http://www.who.int/COVID-19 pic.twitter.com/5rBw4LJKcW",,@WHOadvice,#coronavirus #COVID19,1238875167989862408,https://twitter.com/RGrosjean/status/1238875167989862408
