date,username,to,replies,retweets,favorites,text,geo,mentions,hashtags,id,permalink
2020-03-14 23:59:26,UnfilteredSE,,21,31,132,"Some news you can use on #COVID19… @secupp asks, ""what do we do if one person in our household is sick?"" @DrPhillipsMD has the answer.pic.twitter.com/H1YpShLAw8",,@secupp @DrPhillipsMD,#COVID19,1238978073883742210,https://twitter.com/UnfilteredSE/status/1238978073883742210
2020-03-14 23:58:16,RachelDonadio,,8,72,96,"NOT JUST OLD PEOPLE ARE HIT HARD BY #COVID19 / This is in Italian, but at minute 6:30 there's an interview with a healthy 48-year-old man with no other health problems hospitalized in Italy. @PiazzapulitaLA7https://www.la7.it/piazzapulita/video/coronavirus-dentro-gli-ospedali-del-nord-la-corsa-contro-il-tempo-per-sconfiggerlo-12-03-2020-313003?fbclid=IwAR0FSfCC7B2juDTkUCKkbdbWROtdHeuLqTqWf2s8IWlEqORarYFQL4cbuX8 …",,@PiazzapulitaLA7https,#COVID19,1238977778655145984,https://twitter.com/RachelDonadio/status/1238977778655145984
2020-03-14 23:58:14,iamjessallen,,15,14,176,"I can’t wait until COVID19 is just a random thing on my Timehop app because I’m tired of this already",,,,1238977772590170112,https://twitter.com/iamjessallen/status/1238977772590170112
2020-03-14 23:58:00,not2far2right,,15,178,238,"#Leftists everywhere must be devastated. @POTUS has NOT contracted #WuhanVirus #COVID19 More #winning #KeepCalmWashYourHands #GodBlessAmerica #GodBlessPresidentTrumphttps://fxn.ws/3aOfgca",,@POTUS,#Leftists #WuhanVirus #COVID19 #winning #KeepCalmWashYourHands #GodBlessAmerica #GodBlessPresidentTrumphttps,1238977711525318659,https://twitter.com/not2far2right/status/1238977711525318659
2020-03-14 23:57:21,porpentina2017,,11,57,76,"The inner scientist in me just had the “AHA” moment of why it’s important to wash your hands with soap & water Why? It’s because this little bugger ( #COVID19) has a protective coating of FAT & soap has an element that binds to oil/fat & another that binds to water (food bits). pic.twitter.com/2DKavv4PRf",,,#COVID19,1238977547871948801,https://twitter.com/porpentina2017/status/1238977547871948801
2020-03-14 23:56:59,MoRocca,,12,28,224,"To all those who think fears of #COVID19 are overblown, just remember: Tippi was right, Mrs. Bundy was wrong. Don’t be a Mrs. Bundy. pic.twitter.com/IPxzT0b4EP",,,#COVID19,1238977457488879619,https://twitter.com/MoRocca/status/1238977457488879619
2020-03-14 23:55:42,thoughtsofaphd,,14,28,286,"I've been fielding a lot of COVID19 q's from my non-scientist friends, here's a list of the key points: - You don't need to buy Vitamin C - Essential oils (yes, even the anal ones <- I don't recommend googling that, but do as you wish) don't cure COVID - Wash your hands",,,,1238977133529219074,https://twitter.com/thoughtsofaphd/status/1238977133529219074
2020-03-14 23:53:26,wutrain,Ross_Jankins,31,135,515,"Small businesses need govt help so they don’t have to choose between facilitating #COVID19 spread or going bankrupt. To my fellow millennials/Gen Z, I know we feel safer bc data shows seniors are most vulnerable, but avgs mask the risk & it’s on us to protect all our loved ones https://twitter.com/Ross_Jankins/status/1238916587463364609 …",,,#COVID19,1238976563452010498,https://twitter.com/wutrain/status/1238976563452010498
2020-03-14 23:52:24,ChristinaNDP,,4,35,105,"Thank you to Dr. Deena Hinshaw and everyone working on the COVID19 outbreak. Your efforts and updates are appreciated. I have policy questions for @jkenney and @JasonCoppingAB following today's 3:30 update which can be viewed here: https://www.alberta.ca/coronavirus-info-for-albertans.aspx#statement … #ableg",,@jkenney @JasonCoppingAB,#statement #ableg,1238976305137213440,https://twitter.com/ChristinaNDP/status/1238976305137213440
2020-03-14 23:51:54,Pinche_Pi,kylegriffin1,15,37,161,"Either this is a blatant lie or snorting copious amounts of Adderall for more than a decade has just been proven to ward off Covid19 ¯\_(ツ)_/¯ https://twitter.com/kylegriffin1/status/1238969520997490689 …",,,,1238976175751319552,https://twitter.com/Pinche_Pi/status/1238976175751319552
2020-03-14 23:51:38,CanadianPM,,10,28,98,"Prime Minister Justin Trudeau spoke with Premier of Quebec @francoislegault to discuss the evolution of #COVID19. Read a summary of the call here: http://ow.ly/1CQJ50yLXuI",,@francoislegault,#COVID19,1238976112077783041,https://twitter.com/CanadianPM/status/1238976112077783041
2020-03-14 23:51:03,douglasmerritt,,1,84,162,"Data will play a huge role in solving the world’s biggest challenges, including #COVID19. @Splunk has developed an interactive dashboard to understand the data behind the pandemic, and we invite everyone to collaborate with their own data & visualizations:https://splk.it/3aVKpdB",,@Splunk,#COVID19,1238975965365067776,https://twitter.com/douglasmerritt/status/1238975965365067776
2020-03-14 23:50:36,SenTedCruz,,124,300,1201,"We must pursue every step necessary to develop a vaccine & a cure for #COVID19. My RESULTs for Coronavirus Patients Act would allow @US_FDA 30 days to approve pharmaceutical/medical devices approved in another major developed country to help increase access to #coronavirus cures.",,@US_FDA,#COVID19 #coronavirus,1238975852572000257,https://twitter.com/SenTedCruz/status/1238975852572000257
2020-03-14 23:50:15,clicky_here,,41,55,92,"Hey everyone. To support businesses taking the difficult but right decision to close I've started a list. Can you spread the word, and if there are any errors/additions needed, just let me know? Thank you. #CloseThePubs #Covid19 #CoronaVirushttps://docs.google.com/spreadsheets/d/1hSV0IJFvP45WcBBZAdFF4c0L2-QE4pkZ43jNy1i7zEM/edit?usp=sharing …",,,#CloseThePubs #Covid19 #CoronaVirushttps,1238975763644383233,https://twitter.com/clicky_here/status/1238975763644383233
2020-03-14 23:50:00,unfoundation,,15,99,204,"$1 MILLION That's how much you’ve helped us raise on @Facebook in 24 hours for the #COVID19Fund. Every bit counts to help @WHO combat the #COVID19 pandemic. But we can’t stop now, more is needed to take on the #coronavirus. Join the fight & donate: http://bit.ly/38Pz11x pic.twitter.com/4jwqgBWbt9",,@Facebook @WHO,#COVID19Fund #COVID19 #coronavirus,1238975698477277186,https://twitter.com/unfoundation/status/1238975698477277186
2020-03-14 23:49:37,maduro_en,,3,87,73,"RT @dariovivaspsuv COMUNES OR NOTHING! From the Antonio Jose de Sucre Comune, the People's Power actively works in the making of masks for our people's protection, complying with the orders of Pres. @NicolasMaduro to face #COVID19 #CoronavirusEnVenezuelapic.twitter.com/aR6CdwY9Fc",,@dariovivaspsuv @NicolasMaduro,#COVID19 #CoronavirusEnVenezuelapic,1238975602574663682,https://twitter.com/maduro_en/status/1238975602574663682
2020-03-14 23:49:33,RianOCeallaigh,,6,17,106,"Opinion: Pubs and bars which have completely neglected their responsibility to facilitate and implement social distancing measures should be heavily fined or shut down by government They’ve put money before the good of society and should be punished #COVID19",,,#COVID19,1238975585742979072,https://twitter.com/RianOCeallaigh/status/1238975585742979072
2020-03-14 23:49:21,PaulStewartII,ifindkarma,11,48,139,"Fox belatedly realized it’s killing the geese that lay it’s golden eggs. Covid19 dramatically and disproportionately kills its viewers who are also Trump’s base, at a rate of 10 to 15% of those infected.",,,,1238975535151185921,https://twitter.com/PaulStewartII/status/1238975535151185921
2020-03-14 23:48:28,beingrichard,,14,149,231,""" #NHS could also buy up thousands of beds in private hospitals."" 'Buy up'?! Beds should be requisitioned as part of private healthcare's contribution to crisis. Otherwise, guess what, private sector makes massive #profits out of #Covid19 at our expense. https://www.bbc.com/news/uk-51889957 …",,,#NHS #profits #Covid19,1238975313540812800,https://twitter.com/beingrichard/status/1238975313540812800
2020-03-14 23:47:53,White_K8,,15,90,381,"With two days notice to move courses online, this is what it feels like right now! #OnlineTeaching #Coronavirus #Covid19 #COVID19Vancouverpic.twitter.com/NagtwHPcs7",,,#OnlineTeaching #Coronavirus #Covid19 #COVID19Vancouverpic,1238975165960093697,https://twitter.com/White_K8/status/1238975165960093697
2020-03-14 23:59:03,Smartraveller,,3,36,51,"#COVID19: things are changing rapidly overseas. We’re working around the clock to keep our advisories up to date. Read our global bulletin first (http://smartraveller.gov.au/COVID19 ) - our advisories are being updated to reflect our global advice: Reconsider all overseas travel.",,,#COVID19,1238977977364312064,https://twitter.com/Smartraveller/status/1238977977364312064
2020-03-14 23:58:03,Marty_Chan,,11,8,66,"Building my #Covid19playlist: - Don’t Stand So Close To Me - It’s the End of the World - Can’t Touch This #covid19 #covid19alberta #coronavirus",,,#Covid19playlist #covid19 #covid19alberta #coronavirus,1238977725823475713,https://twitter.com/Marty_Chan/status/1238977725823475713
2020-03-14 23:57:10,shagunsodhani,,3,12,73,"Due to #COVID19, I am not commuting to work and have some spare time. I am happy to do mock interviews/review resumes for folks preparing for #ML/ #SWE roles. DM me if this could be helpful for you.",,,#COVID19 #ML #SWE,1238977501914779650,https://twitter.com/shagunsodhani/status/1238977501914779650
2020-03-14 23:57:09,MetiPali,,1,5,37,"Protecting the king of bounce from #COVID19 at all costs pic.twitter.com/XCynPgWXH5",,,#COVID19,1238977500321058816,https://twitter.com/MetiPali/status/1238977500321058816
2020-03-14 23:55:34,RonRuggless,,2,16,25,"Children are going w/o school meals because of #coronavirus/ #Covid19 closures ~ “We are in uncharted territory here,” @billshore of @nokidhungry says on @MSNBCpic.twitter.com/w6BCLRtpdZ",,@billshore @nokidhungry @MSNBCpic,#coronavirus #Covid19,1238977099320393728,https://twitter.com/RonRuggless/status/1238977099320393728
2020-03-14 23:54:59,StephenMcDonell,,12,13,84,"If the pattern in #Singapore #HongKong etc is anything to go by the panic buying will stop in coming weeks. Great Walls of Toiletpaper will have been built and everyone will realise they should’ve bought for an extended Christmas rather than nuclear winter. #coronavirus #covid19",,,#Singapore #HongKong #coronavirus #covid19,1238976954570686464,https://twitter.com/StephenMcDonell/status/1238976954570686464
2020-03-14 23:54:51,Datagraver,,10,21,74,"On a personal note: it's depressing now to keep all the data up to date and seeing again and again countries going into the exponential curve. And them probably still thinking they can avoid disaster until it's too late. Now 3/4 of countries in the world have infections. #covid19",,,#covid19,1238976919615549441,https://twitter.com/Datagraver/status/1238976919615549441
2020-03-14 23:54:36,maringov,,10,20,23,"Marin Public Health has confirmed two new #COVID19 cases in #MarinCounty. Both cases are quarantined and believed to be a result of community spread. Both were tested at Marin’s field-testing site, launched to enhance local testing capacity: https://www.marincounty.org/main/county-press-releases/press-releases/2020/hhs-covidcommunitycases-031420 … #COVIDpic.twitter.com/RB4SbKLbpM",,,#COVID19 #MarinCounty #COVIDpic,1238976857266982913,https://twitter.com/maringov/status/1238976857266982913
2020-03-14 23:53:23,hevalkellimd,,2,32,48,"We adopted @HopkinsMedicine , @CDCgov and @WHO information and translated to simple patient information on #COVID19 in #Kurdish language in both dialects ( #kurmanci & #sorani). Please share with your communities. #CoronaVirusUpdates #medtwitter #cardiotwitter #Kurdspic.twitter.com/zmo4IyYFJJ",,@HopkinsMedicine @CDCgov @WHO,#COVID19 #Kurdish #kurmanci #sorani #CoronaVirusUpdates #medtwitter #cardiotwitter #Kurdspic,1238976552156704770,https://twitter.com/hevalkellimd/status/1238976552156704770
2020-03-14 23:53:21,HoustonHealth,,10,50,67,"Today we announced #Houston's fifth #COVID19 case. The man is in the hospital but in good condition. Learn how to protect your family at http://HoustonEmergency.org #HouNewspic.twitter.com/sPbsVq5Mew",,,#Houston #COVID19 #HouNewspic,1238976544724471809,https://twitter.com/HoustonHealth/status/1238976544724471809
2020-03-14 23:52:16,CibaiLokter,,5,43,79,"If covid19 still spiking in april and Chinese are gathering for Cheng Beng at the cemetery, then it's our own funerals soon Say No to Cheng Beng mass gathering! Don't be a Cina Babi! #fightcovid19 #DontGatherInChengBeng",,,#fightcovid19 #DontGatherInChengBeng,1238976269171060736,https://twitter.com/CibaiLokter/status/1238976269171060736
2020-03-14 23:52:12,PreventionTips,,1,93,60,"URGENT CALL FOR NURSES: Due to intensity of efforts to support Level 3 activation, enhanced border measures and quarantine of repatriated Canadians, Canada has an urgent need to establish a roster of nurses to support ongoing efforts APPLY: https://emploisfp-psjobs.cfp-psc.gc.ca/psrs-srfp/applicant/page1800?toggleLanguage=en&poster=1423325 … #COVID19 pic.twitter.com/mCH2AlNOUi",,,#COVID19,1238976255296446465,https://twitter.com/PreventionTips/status/1238976255296446465
2020-03-14 23:51:41,hardlynormal,,5,10,70,"The homeless camp I just visited had space so people were not next to each other, lots of porta potties with lots of handwashing stations, trash pickup, and hand sanitizer in abundance. I found it all very encouraging. #COVID19",,,#COVID19,1238976124622954496,https://twitter.com/hardlynormal/status/1238976124622954496
2020-03-14 23:51:20,COVIDPandemic,,5,28,36,"#COVID19 — Coronavirus World Update China 80,824 (+11) Italy 21,157 (+3,497) Iran 12,729 (+1,365) S. Korea 8,086 (+107) Spain 6,391 (+1,159) Germany 4,585 (+910) France 4,499 (+838) USA 2,847 (+1,132) Switzerland 1,359 (+220) Norway 1,108 (+112)",,,#COVID19,1238976034738974721,https://twitter.com/COVIDPandemic/status/1238976034738974721
2020-03-14 23:50:35,BridgieCasey,,14,9,198,"took my baby to go visit my Oma in her retirement home and they were under lockdown I expected this to happen, which is why I tried to go today when risk of us having COVID19 was nil but they locked down just 2hrs before we got there. Good for safety, sad for family.",,,,1238975845873508354,https://twitter.com/BridgieCasey/status/1238975845873508354
2020-03-14 23:50:33,erikadreifus,,5,40,47,"#COVID19 moved me to create this page of emergency resources (financial and other) for the #WritingCommunity:http://bit.ly/EmergencyResourcesWriters …",,,#COVID19 #WritingCommunity,1238975839443783681,https://twitter.com/erikadreifus/status/1238975839443783681
2020-03-14 23:49:51,Devin_Reaves,,0,23,24,". @preventionpp created an Amazon wish list to meet the needs of their participants Your generosity will go directly to the people. Because of the #COVID19 pandemic there are less services and food distribution in north Philadelphia than ever. Please Help http://amzn.to/2Qdtv27 pic.twitter.com/EaxxD3riYD",,@preventionpp,#COVID19,1238975661521481734,https://twitter.com/Devin_Reaves/status/1238975661521481734
2020-03-14 23:48:17,KrisAnneHall,,1,11,24,"Episode 1056 Current Events Besides #CoronaVirus Yes! There are things going on in the world that are not about the Corona Virus You wouldn't know if if you turned on the news or the radio Podacst http://bit.ly/CoronaFree1 YouTube https://youtu.be/nkim_5eSURc #LibertyFirst #COVID19 pic.twitter.com/EEKZqseMUv",,,#CoronaVirus #LibertyFirst #COVID19,1238975268942946305,https://twitter.com/KrisAnneHall/status/1238975268942946305
2020-03-14 23:47:48,SharonIsbin,,3,36,48,"Brilliant research, the math & science on flattening #COVID19 curve & saving lives by @tomaspueyo @Medium: https://link.medium.com/aNvjs2ctL4 @Martina @maddow @AudraEqualityMc",,@tomaspueyo @Medium @Martina @maddow @AudraEqualityMc,#COVID19,1238975144799936512,https://twitter.com/SharonIsbin/status/1238975144799936512
2020-03-14 23:46:40,KevinSkrepnek,trudeanstudents,3,6,113,"Well, that’s probably the highest praise I’ve ever received. I had the chance to work with Dr. Henry a lot in 2017/2018. She was a consummate professional then, and quite frankly, a hero now. #COVID19 https://twitter.com/trudeanstudents/status/1238971160064184320 …",,,#COVID19,1238974859855548416,https://twitter.com/KevinSkrepnek/status/1238974859855548416
2020-03-14 23:45:39,JohnsHopkinsSPH,,1,128,121,"What is social distancing and should everyone practice it? What masks are necessary and when? We adapted @T_Inglesby and @DrJoshS’s @PublicHealthPod conversation into an easy-to-read Q&A. Please share! https://www.jhsph.edu/covid-19/questions-and-answers/coronavirus-questions-and-answers.html … #COVID19 #coronavirus",,@T_Inglesby @DrJoshS @PublicHealthPod,#COVID19 #coronavirus,1238974603520888838,https://twitter.com/JohnsHopkinsSPH/status/1238974603520888838
2020-03-14 23:45:34,IDEpiPhD,,4,28,100,"Perhaps a helpful clarification: #COVID19 #SocialDistancing means distancing yourself from others in social settings to prevent contact, NOT distancing yourself from society itself. Cut down on your physical contacts, maintain social connections w/family, friends, & neighbors!",,,#COVID19 #SocialDistancing,1238974582553563142,https://twitter.com/IDEpiPhD/status/1238974582553563142
2020-03-14 23:45:03,GovCanHealth,,30,798,536,"The #PublicHealthAgencyofCanada is looking for #quarantineofficers, #nursemanagers, and other #registerednurses to establish an inventory of nurses who can support ongoing efforts related to #COVID19. Apply today: http://ow.ly/kTVN50yLXfP",,,#PublicHealthAgencyofCanada #quarantineofficers #nursemanagers #registerednurses #COVID19,1238974453247344642,https://twitter.com/GovCanHealth/status/1238974453247344642
2020-03-14 23:44:40,leahmcelrath,,30,539,583,"Unconscious for days, a previously healthy Houston area police officer in his 40s is hospitalized in critical condition with #COVID19. He appears to have contracted the virus via community spread. He also attended Houston Rodeo cookoff on February 28th. https://www.houstonchronicle.com/news/houston-texas/houston/article/As-Patton-Village-officer-fights-coronavirus-15131723.php …",,,#COVID19,1238974357868892160,https://twitter.com/leahmcelrath/status/1238974357868892160
2020-03-14 23:44:07,iihtishamm,,26,18,474,"Breaking News Trump tests negative for coronavirus says White House #COVID19",,,#COVID19,1238974217389047808,https://twitter.com/iihtishamm/status/1238974217389047808
2020-03-14 23:43:29,EoghandeB,,2,84,112,"Ireland v Italy #COVID19 curves as of today. If we don't intervene the destination is the same. #SocialDistancingNow @IDSIreland Thanks to Christine Kelly for putting this together.pic.twitter.com/ywawJMhQjS",,@IDSIreland,#COVID19 #SocialDistancingNow,1238974061373534211,https://twitter.com/EoghandeB/status/1238974061373534211
2020-03-14 23:43:19,charlesornstein,,1,52,125,". @propublica staff have been working day and night to cover #COVID19. It's all hands on deck. Support our work: Subscribe to our newsletter: https://go.propublica.org/big-story-2019 Consider a donation if you can: https://donate.propublica.org/give/203438/#!/donation/checkout … Support journalism. Now more than ever.",,@propublica,#COVID19 #,1238974019409346561,https://twitter.com/charlesornstein/status/1238974019409346561
2020-03-14 23:42:22,Sarah___Clarke,Instacart,3,65,115,"It's finally happening. 3 of our fellow gig workers are showing signs of COVID19. The catch? They can't actually get tested. So they're sick and sitting at home but can't get properly compensated. https://twitter.com/Instacart/status/1237460643474702337 …",,,,1238973777754517504,https://twitter.com/Sarah___Clarke/status/1238973777754517504
2020-03-14 23:41:44,rajivpant,,10,101,187,"Viruses do not recognize borders. Nor should medical help. I have enrolled to make automatic monthly donations to help Doctors Without Borders, USA @MSF_USA save lives of people caught in crisis worldwide. Join me: http://bit.ly/msf-donate-now #coronavirus #COVID19 #pandemic",,@MSF_USA,#coronavirus #COVID19 #pandemic,1238973620245929984,https://twitter.com/rajivpant/status/1238973620245929984
2020-03-14 23:40:40,C_Resistance,,1,164,301,"Abolitionist measures, while often deemed too drastic by mainstream voices, are now being lifted up as the most effective & practical steps to protect the health of people under the control of the prison industrial complex during the spread of #COVID19 - https://mailchi.mp/criticalresistance/abolitionist-steps-to-combat-covid-19-behind-bars …pic.twitter.com/KE5wemzcEx",,,#COVID19,1238973352859127809,https://twitter.com/C_Resistance/status/1238973352859127809
2020-03-14 23:40:20,Robbin_Young,,14,34,173,"Breaking News: @POTUS @realDonaldTrump has tested negative for #COVID19.",,@POTUS @realDonaldTrump,#COVID19,1238973265617379328,https://twitter.com/Robbin_Young/status/1238973265617379328
2020-03-14 23:40:05,SharkeyCTU1,,7,57,201,"As I’ve reflected with colleagues and educators over the past couple of weeks, it’s even more clear how crisis reveals the underlying disasters of poverty, racism and exploitive social relations that are already present in our society. #thread #COVID19 #coronavirus",,,#thread #COVID19 #coronavirus,1238973203109875714,https://twitter.com/SharkeyCTU1/status/1238973203109875714
2020-03-14 23:39:22,HelenBranswell,,8,83,151,"While I'm tweeting @sciencecohen's work, here's a deep dive into what's known about why some infectious diseases transmit seasonally & whether there's any reason to hope #Covid19 activity will wane with the advent of warmer weather. https://www.sciencemag.org/news/2020/03/why-do-dozens-diseases-wax-and-wane-seasons-and-will-covid-19 …",,@sciencecohen,#Covid19,1238973022729576454,https://twitter.com/HelenBranswell/status/1238973022729576454
2020-03-14 23:38:40,adamkelsey,,7,23,112,"During his live-streamed fireside chat tonight, @BernieSanders says he thinks that #COVID19 is helping people understand the ""irrationality"" and ""stupidity"" of the current health care system.",,@BernieSanders,#COVID19,1238972848993177610,https://twitter.com/adamkelsey/status/1238972848993177610
2020-03-14 23:38:14,saraehoward1,FOX42KPTM,3,40,138,"Douglas county now has its first case of community spread which means the case can’t be traced back to travel or exposure to a person known to have COVID19. This is a serious development in Nebraska. https://twitter.com/FOX42KPTM/status/1238962706901860355 …",,,,1238972739722997761,https://twitter.com/saraehoward1/status/1238972739722997761
2020-03-14 23:36:43,GHS,Reuters,31,567,1265,"Breaking Spain’s Prime Minister Pedro Sanchez announced the country will be put on lockdown due to #coronavirus. Additionally, the PM’s wife Begoña Gómez has tested positive for #COVID19. has 4,231 cases & 120 deaths so far. https://twitter.com/Reuters/status/1238953159948713987 …",,,#coronavirus #COVID19,1238972355851976704,https://twitter.com/GHS/status/1238972355851976704
2020-03-14 23:35:38,davidasinclair,,440,8740,17953,"Since my Harvard lab closed yesterday, I've been reading and interpreting this week's published papers on #COVID19. What follows is a thread of information, my interpretation, links to sources & predictions. Let's start with what you need to know... #coronavirus #COVIDー19",,,#COVID19 #coronavirus #COVIDー19,1238972082756648960,https://twitter.com/davidasinclair/status/1238972082756648960
2020-03-14 23:35:13,Eastlink,,18,42,136,"We are doing all we can to serve you in the best way possible and keep you connected to the things and people that matter most during this complicated time #COVID19. As a result, we are temporarily suspending data limits on all internet plans. Please take care.",,,#COVID19,1238971978167525376,https://twitter.com/Eastlink/status/1238971978167525376
2020-03-14 23:34:45,DavidJHarrisJr,,80,447,1947,"President @realDonaldTrump has tested NEGATIVE for the Wuhan Coronavirus!!! #COVID19 pic.twitter.com/tyCBeWsFHw",,@realDonaldTrump,#COVID19,1238971860500582403,https://twitter.com/DavidJHarrisJr/status/1238971860500582403
2020-03-14 23:33:35,RymMomtaz,Prof_S_Taylor,3,87,137,"What every govt is grappling with right now re: #COVID19 : “In emergency response, if you need to be right before you move you will never win. Perfection is the enemy of the good, speed trumps perfection... everyone is afraid of making a mistake...greatest error is not to move” https://twitter.com/Prof_S_Taylor/status/1238598239902994433 …",,,#COVID19,1238971570250567681,https://twitter.com/RymMomtaz/status/1238971570250567681
2020-03-14 23:32:59,xeni,,1,47,74,"«That is math, not prophecy. The spread can be slowed, public health professionals say, if people practice “social distancing” by avoiding public spaces and generally limiting their movement.» #Coronavirus #covid19 https://www.washingtonpost.com/graphics/2020/world/corona-simulator/ …",,,#Coronavirus #covid19,1238971415782514689,https://twitter.com/xeni/status/1238971415782514689
2020-03-14 23:32:28,CGTNOfficial,,22,33,151,"The White House doctor said on Saturday that U.S. President Donald Trump's #COVID19 test result was negative https://news.cgtn.com/news/2020-03-15/Trump-s-COVID-19-test-result-was-negative-says-White-House-OS1FfjZxPW/index.html …",,,#COVID19,1238971288820936707,https://twitter.com/CGTNOfficial/status/1238971288820936707
2020-03-14 23:31:30,ivanividivici,,23,212,1481,"Imagine risking your health and the health of others to run experiments that are probably gonna fail. WILD. #AcademicChatter #Science #COVID19",,,#AcademicChatter #Science #COVID19,1238971046000295937,https://twitter.com/ivanividivici/status/1238971046000295937
