date,username,to,replies,retweets,favorites,text,geo,mentions,hashtags,id,permalink
2020-03-07 00:57:09,DrEricDing,WilliamYang120,27,106,217,"UK epidemic of #COVID19 had an increase of 42% overnight to 168 cases. They’ve done 20,000 test already. America, why are we so behind in testing???? #TESTVIRUSNOWhttps://twitter.com/WilliamYang120/status/1236083075911536640 …",,,#COVID19 #TESTVIRUSNOWhttps,1236093497058435072,https://twitter.com/DrEricDing/status/1236093497058435072
2020-03-07 00:55:04,DrEricDing,WilliamYang120,12,108,162,"France’s epidemic of #COVID19 is just exploding. Up 45% overnight with +190. Oy. https://twitter.com/WilliamYang120/status/1236083432473505792 …",,,#COVID19,1236092971319255040,https://twitter.com/DrEricDing/status/1236092971319255040
2020-03-07 00:53:27,lokiimanzano,,20,4855,21144,"People aren't panicking about #COVID19. People are pancking about the dishonesty and ignorance of this government in dealing with it.",,,#COVID19,1236092563242635264,https://twitter.com/lokiimanzano/status/1236092563242635264
2020-03-07 00:47:00,SecAzar,,333,625,2645,". @CDCgov plays a critical role in our response to #COVID19. Thank you for hosting @POTUS’s visit today and for your tireless response efforts. Americans should know that the entire CDC team, including some of the best scientists in the world, is working to keep Americans safe.",,@CDCgov @POTUS,#COVID19,1236090942861475842,https://twitter.com/SecAzar/status/1236090942861475842
2020-03-07 00:43:41,charles_haig01,,229,197,790,"Hahahahahaha I’m dying. People are morons #COVID19 pic.twitter.com/Y5dVbEZ6c7",,,#COVID19,1236090107439902722,https://twitter.com/charles_haig01/status/1236090107439902722
2020-03-07 00:39:21,SeemaCMS,,86,460,1489,"Today, @CMSGov issued frequently asked questions & answers for #healthcare providers regarding #Medicare billing & payment for #COVID19 laboratory tests, telehealth, diagnostic services, drugs & vaccines, & other medical services. They can be viewed here: https://www.cms.gov/newsroom/press-releases/covid-19-response-news-alert-cms-issues-frequently-asked-questions-assist-medicare-providers …",,@CMSGov,#healthcare #Medicare #COVID19,1236089014773600256,https://twitter.com/SeemaCMS/status/1236089014773600256
2020-03-07 00:37:32,joshmich,XihongLin,16,103,143,"The key policy recommendations to come from this analysis of how Wuhan eventually controlled #COVID19 - heavy duty quarantines and movement restrictions, scaled up testing and case finding - are they very things not being done in the US. https://twitter.com/XihongLin/status/1236075174069440512 …",,,#COVID19,1236088557078491136,https://twitter.com/joshmich/status/1236088557078491136
2020-03-07 00:36:32,1Jedi_Rey,Acosta,13,124,182,"Members of the #COVID19 task force need to stop biting their tongues & start talking, whistleblow if need be! People are dying, the vulnerable being the most susceptible, with the possibility of millions of infections! Somebody be a patriot & tell the American people the truth! https://twitter.com/Acosta/status/1235986029930311685 …",,,#COVID19,1236088306804244481,https://twitter.com/1Jedi_Rey/status/1236088306804244481
2020-03-07 00:35:48,USAmbROK,,15,31,141,"Glad to be back home in the ROK. Thank you @RokEmbDC Amb Lee Soo-hyuck for a delicious dinner last week at DC's #1 restaurant: Anju. Appreciated our discussion on #USROKAlliance, #COVID19, gamjatang, & other key bilateral issues. Hats off to team @Anjufrc for a terrific meal.pic.twitter.com/KcIbFOGOEc",,@RokEmbDC @Anjufrc,#1 #USROKAlliance #COVID19,1236088121965477888,https://twitter.com/USAmbROK/status/1236088121965477888
2020-03-07 00:34:52,phylogenomics,,4,62,103,"Here is an example of why we need to cancel conferences ASAP: people travel to them, pick up #COVID19 and then travel home before they know they have it: Top Biogen execs were present at meeting where attendees had Covid-19 https://www.statnews.com/2020/03/06/biogen-workers-test-positive-for-coronavirus-transmission-linked-to-leadership-meeting/ … via @statnews cc: @jgi",,@statnews @jgi,#COVID19,1236087886425944065,https://twitter.com/phylogenomics/status/1236087886425944065
2020-03-07 00:32:01,CGTNOfficial,,100,507,1437,"On Friday, 99 more #coronavirus cases reported on Chinese mainland, including 24 imported cases: - 80,651 confirmed with another 107 in HK, 10 in Macao, 45 in Taiwan - 55,404 discharged from hospitals - 60 imported cases among the confirmed #CoronavirusOutbreak #COVID19 pic.twitter.com/S2OVNKsYlT",,,#coronavirus #CoronavirusOutbreak #COVID19,1236087169304768512,https://twitter.com/CGTNOfficial/status/1236087169304768512
2020-03-07 00:30:10,AndyBiotech,,22,159,329,"11 -> 22 -> 44 New York #COVID19 cases quadruple over 48hrs These cases didn't develop overnight. They could have been detected days even wks ago if we had proper testing/tracing procedures. Instead these people were all walking around and infecting more people w/ #coronaviruspic.twitter.com/wryRDLElev",,,#COVID19 #coronaviruspic,1236086707050680320,https://twitter.com/AndyBiotech/status/1236086707050680320
2020-03-07 00:25:29,MollyShenKOMO,,16,79,92,"A breakdown of #covid19 numbers from @KCPubHealth: Of the 58 cases, 34 are residents of or associated with Life Care Center of Kirkland. 18 are residents, 6 are staff, 10 are visitors or family. Of the 11 deaths reported, 9 are associated with Life Care Center. #KOMONews",,@KCPubHealth,#covid19 #KOMONews,1236085525527724032,https://twitter.com/MollyShenKOMO/status/1236085525527724032
2020-03-07 00:25:28,PeterDiamandis,,26,107,201,"#COVIDー19 has come out of left field and left us blindsided. But people are largely fearful because we don’t understand it. So let’s look first at the numbers… You can read more about #coronavirus ( #COVID19) in my latest blog: http://bit.ly/coronavirus-fear-vs-reality …pic.twitter.com/5wmX1jSvKs",,,#COVIDー19 #coronavirus #COVID19,1236085520586825728,https://twitter.com/PeterDiamandis/status/1236085520586825728
2020-03-07 00:23:14,marvicleonen,,6,317,926,"Wash your hands intensely. Avoid touching your face: it is alright the way it is. Sneeze or cough into your elbows: you get some exercise that way. Share true information: you save others that way. Boost your immune system. Eat lots of fruits, vegetables. Drink water. #Covid19",,,#Covid19,1236084959338573824,https://twitter.com/marvicleonen/status/1236084959338573824
2020-03-07 00:21:06,DrEricDing,,48,145,336,"Wowzers- “All of the 3,533 people aboard a cruise ship idling off San Francisco will be tested for the coronavirus, after 19 crew members and 2 passengers tested positive”. Halting Grand Princess from docking in SF was great move. But poor pax. #COVID19 https://www.nytimes.com/2020/03/06/world/coronavirus-news.html …",,,#COVID19,1236084423373832192,https://twitter.com/DrEricDing/status/1236084423373832192
2020-03-07 00:20:58,PublicHealth,,2,66,61,"Do you know the right way to wash your hands? Watch and share our new @GetReady video to make sure that others do too! #COVID19 #Handwashing #WashYourHandspic.twitter.com/WCZbtuxSvK",,@GetReady,#COVID19 #Handwashing #WashYourHandspic,1236084389848772609,https://twitter.com/PublicHealth/status/1236084389848772609
2020-03-07 00:17:36,JohnsHopkinsSPH,AAUniversities,4,47,59,"You can see all of @JohnsHopkins's #COVID19 resources on this site, aggregating content from @JohnsHopkinsSPH and @HopkinsMedicine, among others: http://coronavirus.jhu.edu We're also aggregating content from @JohnsHopkinsSPH, @JHSPH_CHS and @GHN_News here: http://jhsph.edu/covid-19 https://twitter.com/AAUniversities/status/1236029693532483586 …",,@JohnsHopkins @JohnsHopkinsSPH @HopkinsMedicine @JohnsHopkinsSPH @JHSPH_CHS @GHN_News,#COVID19,1236083543966724096,https://twitter.com/JohnsHopkinsSPH/status/1236083543966724096
2020-03-07 00:14:43,PoliticsWolf,,1,58,161,"All the congressional Republicans refusing to speak out right now against Trump's lies about the #coronavirus #COVID19 & his refusal to put the country ahead of his self-perceived political interest are culpable as this increasingly spirals out of control https://twitter.com/chrislhayes/status/1236071974536908800 …pic.twitter.com/132y7R4O94",,,#coronavirus #COVID19,1236082817257238529,https://twitter.com/PoliticsWolf/status/1236082817257238529
2020-03-07 00:13:28,GovMurphy,,54,139,327,"This evening, we identified a fourth presumptive positive case of #COVID19 in New Jersey. The individual, a male in his 50s, is hospitalized at @englewoodhosp in Bergen County. An extensive public health investigation is underway. http://www.nj.gov/health pic.twitter.com/qLUXQR6So8",,@englewoodhosp,#COVID19,1236082503838052352,https://twitter.com/GovMurphy/status/1236082503838052352
2020-03-07 00:12:48,disclosetv,,1,60,89,"Latest stats for #COVID19 in Italy. - 4,636 infected - 197 dead - 462 in intensive care - 4.4% fatality rate - 10% in intensive care That fatality and intensive care rate are much worse than ""just the flu"".",,,#COVID19,1236082332840402944,https://twitter.com/disclosetv/status/1236082332840402944
2020-03-07 00:10:16,_EricCarr,Mike_Pence,5,94,90,". @MikePence: all state health labs that have requested #COVID19 testing kits have them in hand. Between 3/2 - 3/5 more than 900,000 tests have been distributed across the country, w/ another 4 million by end of next week. THANK YOU @POTUS @VP @SecAzar for keeping Americans safe!https://twitter.com/Mike_Pence/status/1236059456254783488 …",,@MikePence @POTUS @VP @SecAzar,#COVID19,1236081697218846721,https://twitter.com/_EricCarr/status/1236081697218846721
2020-03-07 00:09:13,ForSyteSaga2013,,8,73,197,"A magnified image of #COViD19 cluster transferred to the US by Iran regime. @StateDept @MessageFromLenpic.twitter.com/OqZsUPDvWp",,@StateDept @MessageFromLenpic,#COViD19,1236081432101089287,https://twitter.com/ForSyteSaga2013/status/1236081432101089287
2020-03-07 00:03:21,thehowie,,13,64,166,"Do you think that WA, CA, & NY are #covid19 hotspots? They have the largest #s of cases, thus far. But, that is likely because they are testing more & have a better public health infrastructure. They are the canary in the coal-mine. #TESTVIRUSNOWhttps://www.theatlantic.com/health/archive/2020/03/how-many-americans-have-been-tested-coronavirus/607597/ …",,,#covid19 #s #TESTVIRUSNOWhttps,1236079956503015424,https://twitter.com/thehowie/status/1236079956503015424
2020-03-07 00:02:31,Styx666Official,,44,92,314,"https://www.youtube.com/watch?v=cyRpzcN_S44 … If Wierd Al won't do it, I will. #MyCorona #COVID19",,,#MyCorona #COVID19,1236079745667915781,https://twitter.com/Styx666Official/status/1236079745667915781
2020-03-07 00:00:00,Tokyo_gov,,9,80,172,"Washing your hands is one of the most effective ways to prevent infections, including the #coronavirus. But do you know how to do it properly? Learn how in the video below! #COVID19 #Handwashpic.twitter.com/45LTJQ8SVT",,,#coronavirus #COVID19 #Handwashpic,1236079114035040256,https://twitter.com/Tokyo_gov/status/1236079114035040256
2020-03-06 23:53:16,rivatez,,5,11,166,"the best thing to come out of #COVID19 is hopefully people’s appreciation of scientific progress. everyone hopes for a simple solution forgetting it relies on a complex system of diagnostics, tools, basic research and information sharing, industries that most neglect year round..",,,#COVID19,1236077417493491712,https://twitter.com/rivatez/status/1236077417493491712
2020-03-06 23:48:40,CGTNOfficial,,83,540,1785,"Latest figures from WHO on #CoronavirusOutbreak (as of 1600CET, March 6): - 99,624 cases reported globally - 3,400 deaths - 90 countries, areas or territories with cases #COVID19 #coronaviruspic.twitter.com/JeaXvPYREY",,,#CoronavirusOutbreak #COVID19 #coronaviruspic,1236076261803307008,https://twitter.com/CGTNOfficial/status/1236076261803307008
2020-03-06 23:48:37,DrDenaGrayson,washingtonpost,20,138,201,"#NewYork announces 44 total #coronavirus cases, DOUBLE yesterday's total. 8 patients are in Westchester, 3 on Long Island. Unfortunately, we should expect the number of #COVID19 cases in the U.S. to surge over the next several weeks. #CoronavirusOutbreakhttps://twitter.com/washingtonpost/status/1236056346811863043 …",,,#NewYork #coronavirus #COVID19 #CoronavirusOutbreakhttps,1236076250151751683,https://twitter.com/DrDenaGrayson/status/1236076250151751683
2020-03-06 23:47:54,7im,,8,29,54,"more #covid19 questions I haven't seen answered. Why did the CDC reject the WHO's test? What company/contractor developed the CDC's test? (any conflicts of interest here?) Why hasn't the WHO test been used as a backup? How can SK test 10,000 people a day?",,,#covid19,1236076067619663872,https://twitter.com/7im/status/1236076067619663872
2020-03-06 23:46:05,marinagamba1909,,2,192,280,"Not sure why case 26 is behaving defensive. That's how epidemiology works. So what if he was case zero in that cluster? The incubation period can be prolonged This is how privilege works in our healthcare system. Covid19 don't care for your feelings.",,,,1236075609974951937,https://twitter.com/marinagamba1909/status/1236075609974951937
2020-03-06 23:44:01,IWF,,82,749,775,"Some of China’s state-run propaganda outlets are claiming #COVID19 originated in the U.S. — with others going so far as to claim the virus is a CIA bioweapon. #IWhc #IWfp #FreeHongKong #StandWithHongKonghttps://bit.ly/2wwpLlv",,,#COVID19 #IWhc #IWfp #FreeHongKong #StandWithHongKonghttps,1236075088887402497,https://twitter.com/IWF/status/1236075088887402497
2020-03-06 23:41:04,DrEricDing,elonmusk,206,223,1698,"You are still my hero Elon, but on this the #math says the epidemic is real. Not dumb. Respect the #COVID19, not underestimate it. https://twitter.com/elonmusk/status/1236029449042198528 …",,,#math #COVID19,1236074347879706625,https://twitter.com/DrEricDing/status/1236074347879706625
2020-03-06 23:40:50,verbalese,,2,68,93,"#COVID19 now in 22 states, supply chains broken, and the economy officially now in a recession. Still think it’s a Hoax? Still think it’s under control? The GOP is a failed experiment #OneVoice1 #wtpTeamhttps://reut.rs/2PT0RTY",,,#COVID19 #OneVoice1 #wtpTeamhttps,1236074290836959232,https://twitter.com/verbalese/status/1236074290836959232
2020-03-06 23:39:40,CGTNOfficial,,6,44,127,"A group of volunteers in New York City are patrolling the streets to Asians from COVID-19 related hate crimes. #COVID19 nyc https://newsus.cgtn.com/news/2020-03-07/Guardian-Angels-out-to-protect-Asians-against-hate-crimes--OEJwBvf2vu/index.html …pic.twitter.com/DRXUyypTjU",,,#COVID19,1236073994685755392,https://twitter.com/CGTNOfficial/status/1236073994685755392
2020-03-06 23:38:12,DeltaNewsHub,,102,108,332,"Bill Lentsch, @Delta’s Chief Customer Experience Officer: We’re doing everything in our power to ensure you continue to fly safely, and with peace of mind. #coronavirus #covid19 https://bit.ly/38yccPM pic.twitter.com/D29q9ldIY8",,@Delta,#coronavirus #covid19,1236073625511485441,https://twitter.com/DeltaNewsHub/status/1236073625511485441
2020-03-06 23:37:56,hectorology,,21,112,156,"THE CDC WEBSITE NOW READS: ""The potential public health threat posed by #COVID19 is very high, to the United States and globally."" https://www.cdc.gov/coronavirus/2019-nCoV/summary.html …",,,#COVID19,1236073560809943041,https://twitter.com/hectorology/status/1236073560809943041
2020-03-06 23:36:37,DrEricDing,AIPAC,174,1021,1532,"Holy moly guacamole - AIPAC confirms that two conference attendees have now tested positive for coronavirus. conf size? 18,000 attendees, including 2/3rds of Congress. this week, thousands of conference goers visited Capitol Hill offices. Will MoC’s test positive? #COVID19 https://twitter.com/AIPAC/status/1236056463740735488 …",,,#COVID19,1236073229032271872,https://twitter.com/DrEricDing/status/1236073229032271872
2020-03-06 23:35:39,DrDenaGrayson,atrupar,49,200,449,"Trump has LIED repeatedly about the #CoronavirusOutbreak, and his cronies have falsely claimed that the #coronavirus is ""contained."" Far from ""decisive leadership,"" Trump/Pence's INACTION has delayed availability of sufficient #COVID19 tests, as the number of cases surge. https://twitter.com/atrupar/status/1236047190897934337 …",,,#CoronavirusOutbreak #coronavirus #COVID19,1236072984030441473,https://twitter.com/DrDenaGrayson/status/1236072984030441473
2020-03-06 23:35:15,RepHarley,thehill,18,21,82,"Governor @JayInslee is right — misinformation and mismanagement is unacceptable in the midst of a public health threat like #COVID19. This Administration should be held accountable for its failures and be pushed to do better for the American people. https://twitter.com/thehill/status/1236067305009881088 …",,@JayInslee,#COVID19,1236072882930880513,https://twitter.com/RepHarley/status/1236072882930880513
2020-03-06 23:32:00,GHS,,56,339,761,"Today’s #coronavirus recap : -99,624 confirmed cases globally & 3,400 deaths -New countries reporting cases: -Containment is highest priority, says @DrTedros @WHO -Asymptomatic transmission does not appear to be major driver of #COVID19",,@DrTedros @WHO,#coronavirus #COVID19,1236072065956003848,https://twitter.com/GHS/status/1236072065956003848
2020-03-06 23:31:00,VirusesImmunity,,12,56,139,"Why Is Washing Your Hands So Important Anyway? The brilliant @KatherineJWu discusses the science behind how washing hand with soap and using hand sanitizer kill #COVID19. Including expert quotes from @kelliejurado @VirusWhisperer and others http://disq.us/t/3mp88ig",,@KatherineJWu @kelliejurado @VirusWhisperer,#COVID19,1236071814805237761,https://twitter.com/VirusesImmunity/status/1236071814805237761
2020-03-06 23:29:34,DrDenaGrayson,DrDenaGrayson,121,1026,1963,"Pence promised 1 million #coronavirus tests available by the end of this week, yet *only 46 people* of 3,533 passengers/crew on the #GrandPrincess ""hot zone"" were tested. How many are ≥60 yo or have underlying health issues that increase risk for serious #COVID19 illness? https://twitter.com/DrDenaGrayson/status/1236061749532659712 …",,,#coronavirus #GrandPrincess #COVID19,1236071453394710531,https://twitter.com/DrDenaGrayson/status/1236071453394710531
2020-03-06 23:27:53,Gifted_Program,,21,63,344,"#Seattlecovid19 has been a great argument for why we need medicare for all, but the amount of small businesses that are being hurt because lack of customers is a great argument for rent control. Because when those landlords come for payment, they aren't giving a Covid19 Discount.",,,#Seattlecovid19,1236071030684143616,https://twitter.com/Gifted_Program/status/1236071030684143616
2020-03-06 23:26:30,Jimmyjude13,,239,130,1304,"Markets going to 4300 when everyone realizes Covid19 is nothing more than intense flu + new world forum of over sensationalizing news caused Govs+CBs to panic and throw the kitchen sink at an economy that was already running at a decent clip. Just matter of timing the awakening",,,,1236070681785315330,https://twitter.com/Jimmyjude13/status/1236070681785315330
2020-03-06 23:25:11,katestarbird,,11,28,68,"Fascinating and vexing for our researchers. A high volume hashtag term for #covid19 (currently recommended by Twitter & used in tweets from all over the world) is #COVIDー19. This term has a Chinese character (the long dash) that we can’t seem to use in our API search. Ideas?",,,#covid19 #COVIDー19,1236070349998981120,https://twitter.com/katestarbird/status/1236070349998981120
2020-03-06 23:23:15,YourAlberta,,8,67,56,"LIVE - Alberta’s chief medical officer of health provides the latest update on Alberta's first presumptive case of #COVID19 and the work underway to protect public health. The latest information is also available online at http://alberta.ca/COVID19 https://twitter.com/i/broadcasts/1lPJqVDdAQZxb …",,,#COVID19,1236069862817927169,https://twitter.com/YourAlberta/status/1236069862817927169
2020-03-06 23:11:15,shaunwarnock_sw,,18,111,329,"#COVID19 #auspol Perhaps the single most important mechanism to get through this crisis is to have Medical Experts become the public face of the response. No politician and certainly not @ScottMorrisonMP should be on the television in relation to it. Misinformation does not help!",,@ScottMorrisonMP,#COVID19 #auspol,1236066844865224705,https://twitter.com/shaunwarnock_sw/status/1236066844865224705
2020-03-06 23:05:09,HealthySCC,,9,75,73,"Update: Four new confirmed cases of #COVID19 in Santa Clara County. This brings the total number of cases to 24. For additional information, visit: https://www.sccgov.org/sites/phd/diseaseinformation/novel-coronavirus/pages/known-cases-of-coronavirus.aspx?utm_campaign=covid-19-known-cases&utm_medium=social&utm_source=twitter …pic.twitter.com/6c7g75daS8",,,#COVID19,1236065311062994944,https://twitter.com/HealthySCC/status/1236065311062994944
2020-03-06 23:01:21,jodyvance,JProskowGlobal,22,11,76,"This thread is tremendously terrifying. I feel for our brothers and sisters in the US who are being failed by their broken political system — to have this person navigating (or incapable of navigating?) a once great nation through a global health emergency. #COVID19 https://twitter.com/JProskowGlobal/status/1236045450957987841 …",,,#COVID19,1236064353884893184,https://twitter.com/jodyvance/status/1236064353884893184
2020-03-06 23:00:51,minhealthnz,,16,117,153,"Misinformation about #COVID19 is spreading much faster than the disease itself. The best way to protect yourself from both is to get your updates and guidelines from http://health.govt.nz/covid-19 pic.twitter.com/ObgbpbYzJ1",,,#COVID19,1236064225690345473,https://twitter.com/minhealthnz/status/1236064225690345473
2020-03-06 23:00:25,HealthyFla,,5,61,69,"Try to reduce how often you touch your face – your eyes, nose and mouth are most common routes of infection. Visit http://ow.ly/loah30qnKfi #COVID19 http://ow.ly/62vR30qnKfj",,,#COVID19,1236064120203599872,https://twitter.com/HealthyFla/status/1236064120203599872
2020-03-06 23:00:05,ChinaDaily,,16,86,281,"Now people greet each other in many new ways, how do you greet people? #coronavirus #COVID19 pic.twitter.com/0nIrvyFmIR",,,#coronavirus #COVID19,1236064036321558528,https://twitter.com/ChinaDaily/status/1236064036321558528
2020-03-06 22:59:16,Omojuwa,,73,379,1448,"Nigeria should be looking to assist the United States in addressing its #COVID19 challenge. They clearly need some help at this point.",,,#COVID19,1236063829332824064,https://twitter.com/Omojuwa/status/1236063829332824064
2020-03-06 22:57:53,Vaccinologist,,4,220,341,"As the #COVID19 #outbreak evolves, comparisons have been made with #influenza. Both cause respiratory disease but there are important differences between #SARSCoV2 #virus causing COVID-19 & the influenza virus causing the #flu [from WHO COVID situation report 06.03.2020] #scicommpic.twitter.com/N89y4I4hYj",,,#COVID19 #outbreak #influenza #SARSCoV2 #virus #flu #scicommpic,1236063480844898304,https://twitter.com/Vaccinologist/status/1236063480844898304
2020-03-06 22:57:18,DavidBegnaud,,22,161,230,"BREAKING: 21 passengers on board the Grand Princess Cruise Ship, off the coast of California have tested positive for #COVID19 (coronavirus). The 21 include, 19 crew members + 2 passengers, according to @VP",,@VP,#COVID19,1236063334715265026,https://twitter.com/DavidBegnaud/status/1236063334715265026
2020-03-06 22:56:16,SebaValenz,,3,31,156,"When your massive, annual academic conference gets canceled because of #COVID19, like #ica20 just did, this is the right way to announce it: https://cdn.ymaws.com/www.icahdq.org/resource/resmgr/conference/2020/ICA20conferenceupdate.pdf … Full transparency, pros and cons, details, etc. // Thank you @icahdq for the great explainer",,@icahdq,#COVID19 #ica20,1236063076002250758,https://twitter.com/SebaValenz/status/1236063076002250758
2020-03-06 22:54:17,DrDenaGrayson,,25,270,416,"Contra Costa County #California confirms 3 new #COVID19 cases: 2 were prior passengers on the #GrandPrincess; the 3rd had close contact with a #coronavirus-infected person in ""another jurisdiction."" Expect a massive surge in March. #CoronavirusOutbreakhttps://www.ktvu.com/news/3-new-coronavirus-cases-in-contra-costa-co-with-connection-to-grand-princess-ship …",,,#California #COVID19 #GrandPrincess #coronavirus #CoronavirusOutbreakhttps,1236062574216646657,https://twitter.com/DrDenaGrayson/status/1236062574216646657
2020-03-06 22:52:46,DrDenaGrayson,DrDenaGrayson,62,269,674,"Unfortunately, given the very tight quarters onboard + long incubation period for #coronavirus, I expect the number of #COVID19 cases of #GrandPrincess passengers to increase substantially. #CoronavirusOutbreakhttps://twitter.com/DrDenaGrayson/status/1236061749532659712?s=20 …",,,#coronavirus #COVID19 #GrandPrincess #CoronavirusOutbreakhttps,1236062194967683074,https://twitter.com/DrDenaGrayson/status/1236062194967683074
2020-03-06 22:52:01,KaijiTang,,4,18,211,"dear covid19: don't infect me, that'd be racist",,,,1236062006773288960,https://twitter.com/KaijiTang/status/1236062006773288960
2020-03-06 22:49:56,leahmcelrath,,56,467,1742,"I am not panicking about #COVID19, and I’ve been following the issue since early January. I am, however, beginning to panic about the Trump administration’s disinformation campaign and failure to respond. The lies and inaction are going to kill people. There’s no way around it.",,,#COVID19,1236061480295989248,https://twitter.com/leahmcelrath/status/1236061480295989248
2020-03-06 22:49:13,nature,,2,42,81,"Washington state has become the United States’ ground zero for #COVID19, which has now spread to more than 90 countries worldwide in what seems to be a new and dangerous phase of the outbreak. https://go.nature.com/2uZMINw",,,#COVID19,1236061299336978432,https://twitter.com/nature/status/1236061299336978432
