date,username,to,replies,retweets,favorites,text,geo,mentions,hashtags,id,permalink
2020-03-07 23:59:56,GovMurphy,,53,191,456,"The @NJDeptofHealth is providing regularly updated info on #COVID19 testing and investigations on its homepage: http://nj.gov/health As of 6 p.m., New Jersey has: • Presumptive Positive Tests: 4 • Negative Tests: 25 • Tests in Process: 4 • Persons Under Investigation: 15pic.twitter.com/GmuMtm0Azm",,@NJDeptofHealth,#COVID19,1236441484813049856,https://twitter.com/GovMurphy/status/1236441484813049856
2020-03-07 23:59:47,chrismartenson,,28,164,420,"My daily video update is out. Today: The math says the US HC system will be crushed somewhere around the 1st week of May. Now that Pense and other DC ""leaders"" were exposed possibly at an AIPAC conf, expect a more serious approach at tackling #covid19 https://youtu.be/3etuaYTDwFI",,,#covid19,1236441448385576960,https://twitter.com/chrismartenson/status/1236441448385576960
2020-03-07 23:57:43,ChiPublicHealth,,18,70,113,"Dr. Allison Arwady, Commissioner of Chicago Dept. of Health, and Dr. Janice Jackson, CEO of @ChiPubSchools provide an update and guidance on the most recent, confirmed case of #COVID19. pic.twitter.com/4NRQOVW5E7",,@ChiPubSchools,#COVID19,1236440927314440192,https://twitter.com/ChiPublicHealth/status/1236440927314440192
2020-03-07 23:57:03,leahmcelrath,,7,64,91,"NYC orders mandatory #COVID19 testing for all “educators, healthcare workers, and first responders” employed by the city who are deemed to present a “danger of infection to others” https://www1.nyc.gov/assets/doh/downloads/pdf/imm/order-of-the-commissioner-to-all-educators-first-responders-healthcare-covid19.pdf …pic.twitter.com/u9H4aDRnMf",,,#COVID19,1236440758883954695,https://twitter.com/leahmcelrath/status/1236440758883954695
2020-03-07 23:54:38,TNDeptofHealth,,5,52,54,"COVID-19 is currently a hot topic of conversation. We want to make sure Tennesseans are educated with the facts. Many have asked what are the symptoms. Below is a great visual. Please share with your loved ones, neighbors, colleagues, fellow parishioners and more. #COVID19 pic.twitter.com/XUT1Sy32eq",,,#COVID19,1236440148864315392,https://twitter.com/TNDeptofHealth/status/1236440148864315392
2020-03-07 23:54:27,AnnetteJH,,19,54,311,"What if this country responded to gun violence with the same urgency it’s responding to #COVID19 ?",,,#COVID19,1236440105226768386,https://twitter.com/AnnetteJH/status/1236440105226768386
2020-03-07 23:49:06,alikhedery,JavierBlas,104,698,1168,"$20 oil in 2020 is coming. Huge geopolitical implications. Timely stimulus for net consumers. Catastrophic for failed/failing petro-kleptocracies Iraq, Iran, etc - may prove existential 1-2 punch when paired with COVID19. https://twitter.com/JavierBlas/status/1236430793838342144 …",,,,1236438757718532096,https://twitter.com/alikhedery/status/1236438757718532096
2020-03-07 23:45:51,V2019N,Tony__Heller,34,205,1415,"case fatality rate flu on left, #covid19 on right pic.twitter.com/DsGOuOZz4S",,,#covid19,1236437942073053185,https://twitter.com/V2019N/status/1236437942073053185
2020-03-07 23:44:44,marynmck,nxthompson,6,125,220,"Here’s a perfect example of the need to foreground science and health journos on #COVID19 coverage. Colleague @jetjocko has the background and experience to be able to list every inaccuracy and to assert, ""The president’s statements to the press were terrifying.""https://twitter.com/nxthompson/status/1236431830242508800 …",,@jetjocko,#COVID19,1236437660853567490,https://twitter.com/marynmck/status/1236437660853567490
2020-03-07 23:42:20,thehowie,washingtonpost,13,137,374,"Brief thread Over the next few days or weeks, there will be more reports of ""exposure"" to a #Covid19 #coronavirus patient. As with much else about this infection, we do not know a lot about risk, but we have some info and it is worth keeping in mind. 1/xhttps://twitter.com/washingtonpost/status/1236425504904921089 …",,,#Covid19 #coronavirus,1236437055850373120,https://twitter.com/thehowie/status/1236437055850373120
2020-03-07 23:41:59,_KevinSteele_,,125,244,526,"He #coronavirus #COVID19 #CoronavirusUSA #CoronaVirusUpdate #CoronaVirusUpdates #Coronavirusflorida you will not kill me today. If I die before #2020Elections I want my vote for @realDonaldTrump @POTUS. I pray I stay alive long enough to vote for #Trump2020pic.twitter.com/jIK0nZJm4f",,@realDonaldTrump @POTUS,#coronavirus #COVID19 #CoronavirusUSA #CoronaVirusUpdate #CoronaVirusUpdates #Coronavirusflorida #2020Elections #Trump2020pic,1236436967795183617,https://twitter.com/_KevinSteele_/status/1236436967795183617
2020-03-07 23:41:44,XrpYoda,,49,24,111,"Drying your corona panties on a plane not cool #coronavirus maybe it’s because she couldn’t buy toilet paper it’s in high demand apparently #COVID19 #toiletpaperpanic #panickbuying #DragRace #helppic.twitter.com/GYTteHn50c",,,#coronavirus #COVID19 #toiletpaperpanic #panickbuying #DragRace #helppic,1236436902645022720,https://twitter.com/XrpYoda/status/1236436902645022720
2020-03-07 23:39:17,DrMel_T,,25,270,426,"Okay World, I’m putting this offer out there.... Given that my expertise is no longer required for paid work? I’m offering my services pro bono to any Comms Professionals, to fact check their work in light of the #covid19australia #COVID19 Emerging Infection.",,,#covid19australia #COVID19,1236436286052765696,https://twitter.com/DrMel_T/status/1236436286052765696
2020-03-07 23:37:26,L0gg0l,,25,140,218,"Footage from Milan train station where suddenly people arrive to flee from the possible quarantine zone pic.twitter.com/gj52lSQgWZ (via @amos8125) #Covid19",,@amos8125,#Covid19,1236435821013630977,https://twitter.com/L0gg0l/status/1236435821013630977
2020-03-07 23:36:56,awzurcher,learyreports,14,76,183,"It is only a matter of time before US politicians start getting #COVID19 https://twitter.com/learyreports/status/1236419140405125120 …",,,#COVID19,1236435697936084995,https://twitter.com/awzurcher/status/1236435697936084995
2020-03-07 23:36:07,drkatmclean,,5,90,142,"A GP perspective - hoping this information is practical and helpful Written in the Australian context but relevant also elsewhere Share & feel free to steal & use shamelessly Thanks @Lady_Gwendoline Also @MackayIM #COVID19 #coronavirus #GPsCanhttps://www.gps-can.com.au/covid19-practical-information …",,@Lady_Gwendoline @MackayIM,#COVID19 #coronavirus #GPsCanhttps,1236435492104634368,https://twitter.com/drkatmclean/status/1236435492104634368
2020-03-07 23:32:42,HelenBranswell,,57,124,315,"Will other countries try China's #Covid19 containment measures? Could they? Would populations comply? Pandemic response science will be a brisk & burgeoning field when this is all over. https://www.nytimes.com/2020/03/07/world/coronavirus-news.html …",,,#Covid19,1236434632222150659,https://twitter.com/HelenBranswell/status/1236434632222150659
2020-03-07 23:32:05,codepo8,,5,39,114,"Time to move your TCP apps to UDP to avoid handshakes #COVID19",,,#COVID19,1236434476965736450,https://twitter.com/codepo8/status/1236434476965736450
2020-03-07 23:29:42,senatormachaela,,0,40,102,"Part of protecting yourself from #COVID19 infection is having the right facts. The people at @unmc have put together a Q&A page with everything you need to know. https://www.nebraskamed.com/biocontainment/coronavirus-qa-what-it-is-and-how-to-avoid-it …",,@unmc,#COVID19,1236433875200544768,https://twitter.com/senatormachaela/status/1236433875200544768
2020-03-07 23:25:06,primaryshares,,7,20,78,"Working in Singapore at the moment. A hotspot on the coronavirus map yet its life as usual. 130 cases, no deaths, no panic, nobody's hoarding supplies, people are living their lives. Please view the below video from the Health Minister of Singapore regarding #COVID19 pic.twitter.com/xH7ztCFRIS",,,#COVID19,1236432717438316544,https://twitter.com/primaryshares/status/1236432717438316544
2020-03-07 23:54:41,thehowie,,1,22,113,"We only have limited data to give us guidance, but it is COMFORTING (to me, at least). Even among household contacts of #covid19 infected patients, only 10.5% developed symptomatic disease. 4/x https://www.cdc.gov/mmwr/volumes/69/wr/mm6909e1.htm …",,,#covid19,1236440164404166656,https://twitter.com/thehowie/status/1236440164404166656
2020-03-07 23:53:12,HoustonHealth,,20,35,44,"Mayor Turner's March 7 #COVID19 update: “I know Houstonans are concerned about COVID-19, especially with the recent positive cases identified in our area... Read more: http://HoustonEmergency.org @HoustonOEM @HoustonTX @COHEmployeeNews @hcphtx @HoustonFire @houstonpolice #hounewspic.twitter.com/G6UDtkA99c",,@HoustonOEM @HoustonTX @COHEmployeeNews @hcphtx @HoustonFire @houstonpolice,#COVID19 #hounewspic,1236439790213640193,https://twitter.com/HoustonHealth/status/1236439790213640193
2020-03-07 23:52:08,Cloud1Bk,,8,16,28,"Did some folks not wash their hands before this virus? I guess those of us that washed are hands before COVID19, we were ""trendy"" before washing your hands was ""trendy""? What does that say about the people that are hoarding toilet paper? I guess we were ""trendy"" on that one too pic.twitter.com/u4bX6raDsZ",,,,1236439522637803520,https://twitter.com/Cloud1Bk/status/1236439522637803520
2020-03-07 23:51:17,ipacuhn,picardonhealth,0,7,30,"At @UHN, our current case definition includes any travel outside of Canada. Strong clinician suspicion will also trigger testing at our sites. We re-evaluate constantly as developments arise. #COVID19 #IPACtwitterhttps://twitter.com/picardonhealth/status/1236432059868106752 …",,@UHN,#COVID19 #IPACtwitterhttps,1236439308728483841,https://twitter.com/ipacuhn/status/1236439308728483841
2020-03-07 23:48:47,TexanForTrump21,,5,18,32,"IMHO... My take of the #COVID19 scare is the MSM's ""Hell Mary"" pass to try and take out Trump. Since everything else they have thrown at him so far hasn't got the results they desire. I think its DISGUSTING how he's treated by the media!",,,#COVID19,1236438680178429953,https://twitter.com/TexanForTrump21/status/1236438680178429953
2020-03-07 23:47:44,DolphinDemVoter,,2,26,35,"Hmmm ... not such a Dem hoax now, eh @CPAC, @GOP? #COVIDー19 #Covid19 #coronavirushttps://www.cnn.com/2020/03/07/politics/cpac-coronavirus-tested-positive/index.html …",,@CPAC @GOP,#COVIDー19 #Covid19 #coronavirushttps,1236438414016143361,https://twitter.com/DolphinDemVoter/status/1236438414016143361
2020-03-07 23:47:16,davidalim,,4,12,39,"We're about to detect an awful lot of cases now that some #COVID19 testing is up at public health labs. One thing I've been thinking a lot about is what @michaelmina_lab told me weeks ago on how the organization of the United States will impact our response.",,@michaelmina_lab,#COVID19,1236438295514697737,https://twitter.com/davidalim/status/1236438295514697737
2020-03-07 23:47:07,cyntiadkins,NewsbySmiley,28,2,57,"Good for them. They understand the importance of limiting spread of COVID19. There be a global effort to minimize spread.",,,,1236438258176815104,https://twitter.com/cyntiadkins/status/1236438258176815104
2020-03-07 23:46:44,FluTrackers,,1,19,25,"US - Washington D.C.: Late this afternoon, testing at the Public Health Lab at the DC Department of Forensic Sciences yielded its first presumptive positive #coronavirus (COVID-19) case. https://flutrackers.com/forum/forum/-2019-ncov-new-coronavirus/united-states-2019-ncov/district-of-columbia-covid-19/834784-1st-presumptive-case-in-d-c … h/t Treyfish, Pathfinder, Rose #COVID19 #CoronavirusUSA",,,#coronavirus #COVID19 #CoronavirusUSA,1236438160609087488,https://twitter.com/FluTrackers/status/1236438160609087488
2020-03-07 23:42:29,subgap,,16,23,87,"A hotel with 70+ #Covid19 patients in quarantine has collapsed in china. https://twitter.com/fiteray/status/1236281828782133249?s=20 …pic.twitter.com/DmsIdJzphV",,,#Covid19,1236437092902764544,https://twitter.com/subgap/status/1236437092902764544
2020-03-07 23:41:35,FluTrackers,,0,26,18,"US - New York: There are 13 additional cases of #Coronavirus in NYS since earlier today, bringing total to 89. Westchester: 70 NYC: 11 Nassau: 4 Rockland: 2 Saratoga: 2 https://flutrackers.com/forum/forum/-2019-ncov-new-coronavirus/united-states-2019-ncov/new-york-covid-19/832717-new-york-covid-19-cases-89?p=834800#post834800 … #COVID19 #CoronavirusUSA",,,#Coronavirus #post834800 #COVID19 #CoronavirusUSA,1236436865458282496,https://twitter.com/FluTrackers/status/1236436865458282496
2020-03-07 23:40:23,7freedomwriters,MostafaMe4,0,19,24,"I’m heart broken and lost for words watching these scenes. Probably the naivety of being from the younger generation but every day I feel more and more shocked at the extent to which Khomeini and this regime have ruined our country. SOS @WHO #CoronaVirus #COVID19 https://twitter.com/MostafaMe4/status/1236391080767127552 …",,@WHO,#CoronaVirus #COVID19,1236436564168802304,https://twitter.com/7freedomwriters/status/1236436564168802304
2020-03-07 23:39:32,Michael_Rae,,14,34,50,"All that’s missing is the Hat... #COVID19 #COVID #cornoravirus #SaturdayThoughts #coronvirusuk #DoctorWho #panickbuyingpic.twitter.com/xfgviPhSJK",,,#COVID19 #COVID #cornoravirus #SaturdayThoughts #coronvirusuk #DoctorWho #panickbuyingpic,1236436350976606208,https://twitter.com/Michael_Rae/status/1236436350976606208
2020-03-07 23:38:45,strattacaster,,53,1,129,"So, traveling is one of my biggest soul-filling things. It’s why I work hard and I think about my next adventure often. With COVID19 I’ve had to cancel some major int’l trips so I need to re-focus. So, followers, what makes your city/state/country special? Should I visit?",,,,1236436152254517248,https://twitter.com/strattacaster/status/1236436152254517248
2020-03-07 23:37:12,coopesdetat,,2,17,24,"This is where things stand currently with #COVID19 in Australia, per @healthgovau 63 cases, 2 deaths 15 link Wuhan 10 link Diamond Princess 16 link Iran 12 other travel 10 no travel: 5 cluster to a Sydney NH, 3 to a radiology workshop at Liverpool Hospitalpic.twitter.com/beMUKgUC18",,@healthgovau,#COVID19,1236435762385571842,https://twitter.com/coopesdetat/status/1236435762385571842
2020-03-07 23:36:36,lkjtexas,PhilipWegmann,2,8,72,"But...but I thought you could still go to work even if you had #COVID19. Trump said it was contained",,,#COVID19,1236435610795204609,https://twitter.com/lkjtexas/status/1236435610795204609
2020-03-07 23:35:20,Kaetrena,,1,19,48,"1/ With the #COVID19 discussion circling around #libraries, a reminder that #PublicLibrarians #LowMorale Impact factors are: #PersonalSafety (incl. exposure to communicable diseases), #SocialImpacts (no available resources/agencies to refer library users to), &...",,,#COVID19 #libraries #PublicLibrarians #LowMorale #PersonalSafety #SocialImpacts,1236435293504487425,https://twitter.com/Kaetrena/status/1236435293504487425
2020-03-07 23:33:28,thevoiceteensph,,0,24,88,"God, we are praying for your healing be upon the Philippines and the whole world brought by coronavirus #COVID19. Protect everyone by Your Mighty Hands. Amen.",,,#COVID19,1236434822597185536,https://twitter.com/thevoiceteensph/status/1236434822597185536
2020-03-07 23:31:24,Monica_Wilcox,NorbertElekes,5,10,30,"We've known about Kirkland nursing home for almost a week. Why hasn't the #CDC tested ALL of the residents, all of the employees, the employee's families and then worked there way out from there? Why would they hold test kits back??? #CoronaVirusSeattle #COVID19 #COVIDhttps://twitter.com/NorbertElekes/status/1236420067358842880 …",,,#CDC #CoronaVirusSeattle #COVID19 #COVIDhttps,1236434305376759808,https://twitter.com/Monica_Wilcox/status/1236434305376759808
2020-03-07 23:28:01,SnoopAround1,BBCWorld,9,17,129,"If you think your country is not affected by COVID19 it’s just because people is not being tested and your government is strategically being silent. #justsaying",,,#justsaying,1236433450724405255,https://twitter.com/SnoopAround1/status/1236433450724405255
2020-03-07 23:25:23,bronnaghOS,Filmandwriting,59,1337,6886,"I see #covid19 managed to get into Portmarnock Golf Cub before women did. https://twitter.com/Filmandwriting/status/1236419180020273152 …",,,#covid19,1236432789702086656,https://twitter.com/bronnaghOS/status/1236432789702086656
2020-03-07 23:24:41,ElizabethEThorp,,43,72,232,"But it’s no big deal, right ⁦ @realDonaldTrump⁩? #COVID19 pic.twitter.com/v5kKVRdtas",,@realDonaldTrump,#COVID19,1236432613637787651,https://twitter.com/ElizabethEThorp/status/1236432613637787651
2020-03-07 23:22:59,KeriLeighMerrit,,15,109,452,"Hi Loves - making sure y’all know an easy way to help reduce the mortality rate of #COVID19. Ask your elderly neighbors or people who are immunocompromised if you can do their grocery shopping, pick up prescriptions, or run errands for them.",,,#COVID19,1236432183587454977,https://twitter.com/KeriLeighMerrit/status/1236432183587454977
2020-03-07 23:17:18,RachelDonadio,,260,6454,6871,"The head of the Lombardy's intensive care crisis unit says the health system is on the brink of collapse, intensive care being set up in hallways. By March 26 they predict ~18,000 #Covid19 cases in Lombardy, of which ~3,000 will need intensive care. https://www.corriere.it/cronache/20_marzo_07/coronavirus-stiamo-creando-terapie-intensive-anche-corridoi-cb01190a-60be-11ea-8d61-438e0a276fc4.shtml …",,,#Covid19,1236430756412567559,https://twitter.com/RachelDonadio/status/1236430756412567559
2020-03-07 23:14:42,David_Leavitt,RepMattGaetz,41,199,724,"Matt Gaetz thought it wasfunny to wear a gas mask during the #COVID19 vote, and just a couple days later one of his constituents died from #coronavirus. This asshole should not be running a taco stand, nevermind part of our government #MattGaetzIsAToolhttps://twitter.com/RepMattGaetz/status/1235309294146539520 …",,,#COVID19 #coronavirus #MattGaetzIsAToolhttps,1236430099328774145,https://twitter.com/David_Leavitt/status/1236430099328774145
2020-03-07 23:13:51,20committee,,45,143,714,"There's a lot of sane space between ""It's just a cold, go to work!"" and ""We're all gonna die horrible deaths but we're gonna eat our pets first."" It would be good to find it. Quickly. #COVID19",,,#COVID19,1236429887579308032,https://twitter.com/20committee/status/1236429887579308032
2020-03-07 23:13:16,Millie__Weaver,,74,153,398,"EMERGENCY REPORT: Coronavirus Is An Engineered Weapon For The Global Take-down Of The Western World #CoronavirusUSA #CoronaVirusUpdate #COVID19 https://www.banned.video/watch?id=5e64158ce6a8ff004a4dfcc4 …",,,#CoronavirusUSA #CoronaVirusUpdate #COVID19,1236429738694017024,https://twitter.com/Millie__Weaver/status/1236429738694017024
2020-03-07 23:10:59,MeanwhileinCana,,29,90,566,"Is your Costco out of #toiletpaper due to #COVID19 panic? No problem. I highly recommend these alt-right rags: #cdnpolipic.twitter.com/hoWGawiYqW",,,#toiletpaper #COVID19 #cdnpolipic,1236429167316676613,https://twitter.com/MeanwhileinCana/status/1236429167316676613
2020-03-07 23:10:36,DrEricDing,,25,192,376,"#BREAKING: The first case of coronavirus has been confirmed in Washington, D.C., according to Mayor Muriel Bowser. Bowser is scheduled to hold a briefing tonight at 7:30 p.m. on the situation. #COVID19 http://www.politico.com",,,#BREAKING #COVID19,1236429070998687744,https://twitter.com/DrEricDing/status/1236429070998687744
2020-03-07 23:08:46,muttonshunter,,28,37,512,"So in London they're fighting over bog roll and hand gell while they panic like a shower of cowards. Meanwhile popped into Mum's local MORRISONS up north and the shelves are full and no one's acting like a gutless bitch. #northsouthdevide #coronvirusuk #panickbuying #COVID19",,,#northsouthdevide #coronvirusuk #panickbuying #COVID19,1236428607649730561,https://twitter.com/muttonshunter/status/1236428607649730561
2020-03-07 23:08:09,SeanBradbery,,6,38,170,"If Scott Morrison wanted to slow the spread of #COVID19 & therefore save lives he'd protect workers and people on #Newstart who have to self-isolated, he'd also raise Newstart as a part of the economic stimulus. He won't do any of that because he is an ideological wingnut.",,,#COVID19 #Newstart,1236428451797544960,https://twitter.com/SeanBradbery/status/1236428451797544960
2020-03-07 23:05:08,DrEricDing,,16,109,221,"+8 new cases in Santa Clara County, CA. All unclear the origin. Hope they are travel cases because community cases would be bad news that community transmission is accelerating. #COVID19 https://www.sccgov.org/sites/phd/DiseaseInformation/novel-coronavirus/Pages/known-cases-of-coronavirus.aspx …",,,#COVID19,1236427694960791554,https://twitter.com/DrEricDing/status/1236427694960791554
2020-03-07 23:04:23,DrDenaGrayson,,171,935,2156,"#CPAC attendee—who was exposed to #coronavirus PRIOR to the conference—has tested positive. @realDonaldTrump and #COVID19 task force “leader” @Mike_Pence attended the conference. Maybe now, they’ll admit that the #CoronavirusOutbreak is NOT a “hoax.”https://www.washingtonpost.com/world/2020/03/07/coronavirus-live-updates/ …",,@realDonaldTrump @Mike_Pence,#CPAC #coronavirus #COVID19 #CoronavirusOutbreak,1236427505483100161,https://twitter.com/DrDenaGrayson/status/1236427505483100161
2020-03-07 23:01:59,_rallycap,,9,86,299,"#COVID19: Muahaha wash your hands! Canada: Common sense. COVID19: DONT TRAVEL! Canada: Honestly had no plans. COVID19: Roll up the rim is CANCELLED. Canada: pic.twitter.com/ITw6ipAE4R",,,#COVID19,1236426901863964675,https://twitter.com/_rallycap/status/1236426901863964675
2020-03-07 23:01:58,HanianEmpress,,39,49,149,"Is it just me or does no one really know how to differentiate a cold or flu from COVID19 as symptoms seem to range from a mild cold, to something similar to a really bad flu, to pneumonia, to you need an ICU. Seriously, it sounds like without a test you wouldn't even know.",,,,1236426898202386433,https://twitter.com/HanianEmpress/status/1236426898202386433
2020-03-07 23:00:25,HealthyFla,,18,70,70,"The most up to date information regarding #COVID19 in Florida can be found at http://ow.ly/9pN630qnKfs . Check your sources when sharing social media posts and be careful of misinformationhttp://ow.ly/zM6I30qnKfu",,,#COVID19,1236426504525041671,https://twitter.com/HealthyFla/status/1236426504525041671
2020-03-07 23:00:18,wef,,10,165,292,"These pictures show how China's air pollution has dropped during the coronavirus outbreak http://bit.ly/3an48mm #coronavirus #covid19 pic.twitter.com/46LAOJMKvX",,,#coronavirus #covid19,1236426475433340928,https://twitter.com/wef/status/1236426475433340928
2020-03-07 22:57:09,DrDenaGrayson,DrDenaGrayson,18,147,307,"The “draconian” and unprecedented measures would close down the northern region of Lombardy, #Italy’s largest and most productive, until April 3. Weddings, funerals, sporting and cultural events would be BANNED. #coronavirus #COVID19 #CoronavirusOutbreakhttps://twitter.com/drdenagrayson/status/1236424584418787328?s=21 …",,,#Italy #coronavirus #COVID19 #CoronavirusOutbreakhttps,1236425684878327808,https://twitter.com/DrDenaGrayson/status/1236425684878327808
2020-03-07 22:57:04,AHS_media,,10,96,91,"Health Link is experiencing very high call volume due to individuals seeking advice on #COVID19. We are fully staffed up & working with our Telecommunications provider to add call support. For ongoing info, please continue to see http://alberta.ca/COVID19 .pic.twitter.com/2GJFvgjmSh",,,#COVID19,1236425661360685056,https://twitter.com/AHS_media/status/1236425661360685056
2020-03-07 22:52:47,DrDenaGrayson,,143,1710,2460,"BREAKING: #Italy may lock down entire sections in its north and restrict movement for 25% of its population, as #coronavirus cases more than DOUBLED from 2,500 to >5,800 in 3 days. Expect major closures in the US soon. #CoronavirusOutbreak #COVID19 https://www.nytimes.com/2020/03/07/world/coronavirus-news.html?referringSource=articleShare …",,,#Italy #coronavirus #CoronavirusOutbreak #COVID19,1236424584418787328,https://twitter.com/DrDenaGrayson/status/1236424584418787328
2020-03-07 22:47:07,VirusWhisperer,virusninja,7,51,139,"This took years of experience and expertise. Stefan Pöhlmann and I were postdocs together in Bob Doms’ lab and Stefan has been working tirelessly on other hu CoVs (cleavage and entry) for many years! This is important! Congrats Stefan; we need you! #SARSCoV2 #COVID19 https://twitter.com/virusninja/status/1236301426642620416 …",,,#SARSCoV2 #COVID19,1236423157654880258,https://twitter.com/VirusWhisperer/status/1236423157654880258
2020-03-07 22:47:00,MillerCrime,kurteichenwald,13,355,400,"The United States is going to be responsible for spreading #COVID19 around the world. Why? Because former #bigpharma exec Alex Azar rejected WHO’s tests so his buddies could cash in on the patent https://bit.ly/39z8U07 #CoronavirusUSA #CoronaVirus #fascism #M4A #OneVoice1https://twitter.com/kurteichenwald/status/1236404011143741441 …",,,#COVID19 #bigpharma #CoronavirusUSA #CoronaVirus #fascism #M4A #OneVoice1https,1236423130870173696,https://twitter.com/MillerCrime/status/1236423130870173696
2020-03-07 22:46:49,MartinPakulaMP,,9,26,104,"As a side bar, it’s interesting that even in the midst of #covid19 & the global efforts to create a vaccine, Victorian state politicians are still getting spammed, daily, by dozens of emails from anti vaxxers objecting to mandatory vaccination of frontline health workers. Bizarre",,,#covid19,1236423084564869120,https://twitter.com/MartinPakulaMP/status/1236423084564869120
