date,username,to,replies,retweets,favorites,text,geo,mentions,hashtags,id,permalink
2020-03-07 09:49:15,DrTedros,,30,44,262,"Pleased to meet with @DrChristou, @MSF President. We discussed the #Ebola in & #COVID19 outbreaks. We agreed that @WHO and MSF both have unique but complementary roles to play in health and humanitarian crises, and share a commitment to deliver a healthier, safer world. pic.twitter.com/poDkk7xsab",,@DrChristou @MSF @WHO,#Ebola #COVID19,1236227402856046597,https://twitter.com/DrTedros/status/1236227402856046597
2020-03-07 09:46:07,observerug,,15,99,178,"#Coronavirus: #Uganda has cancelled all international conferences that were scheduled to take place in the country this month. A travel ban has also been placed on France, Italy, Iran, Spain and China - countries that are mostly affected by #COVID19 outbreak pic.twitter.com/udNs2iDmWn",,,#Coronavirus #Uganda #COVID19,1236226613643223040,https://twitter.com/observerug/status/1236226613643223040
2020-03-07 09:41:58,coopesdetat,SezClom,4,43,108,"Lots of very angry doctors today, and rightly so. Blaming doctors, who swear a professional oath to care for others, for going to work, and holding the threat of AHPRA over their heads, is a gross misunderstanding of your portfolio #COVID19 https://twitter.com/SezClom/status/1236184708205043713 …",,,#COVID19,1236225569689186304,https://twitter.com/coopesdetat/status/1236225569689186304
2020-03-07 09:41:28,ChinaDaily,,5,34,126,"#BackToWork Starbucks has opened 90 percent of its stores in #China, although under modified hours and conditions. At peak time in early Feb, about 80 percent of its stores in China were closed. #coronavirus #COVID19 pic.twitter.com/eCACqE611a",,,#BackToWork #China #coronavirus #COVID19,1236225445118365696,https://twitter.com/ChinaDaily/status/1236225445118365696
2020-03-07 09:40:00,CGTNOfficial,,7,55,145,"Inside look into an ICU ward in #Wuhan #COVID19 pic.twitter.com/hFXd6Jsf9k",,,#Wuhan #COVID19,1236225073700274176,https://twitter.com/CGTNOfficial/status/1236225073700274176
2020-03-07 09:36:42,SFdirewolf,,1,49,161,"As a disabled person who uses a ventilator & has little reserves fighting a flu or infection, one thing I’m doing to protect myself is signing up for text alerts from my local department of public health in San Francisco #coronavirus #SF #COVIDー19 #COVID19 #PublicHealthpic.twitter.com/75q8brKOcM",,,#coronavirus #SF #COVIDー19 #COVID19 #PublicHealthpic,1236224246658953216,https://twitter.com/SFdirewolf/status/1236224246658953216
2020-03-07 09:25:02,PDChina,,6,65,89,"#Germany reported 150 new #COVID19 confirmed cases on Saturday local time, bringing the total number to 684, according to the country’s disease control agency. (Photo/CGTN) pic.twitter.com/rxu6Elnlg8",,,#Germany #COVID19,1236221308322697217,https://twitter.com/PDChina/status/1236221308322697217
2020-03-07 09:24:20,GuntramWolff,,50,469,543,"Taking up the idea of @SMerler , I compare Hubei, Italy, France and Germany #COVID19 confirmed cases. The four lines look remarkably similar. The scary part of the picture is in next Tweet: Biggest part of problem is ahead, even for Italy. pic.twitter.com/3eZNxmQCcO",,@SMerler,#COVID19,1236221132732329984,https://twitter.com/GuntramWolff/status/1236221132732329984
2020-03-07 09:21:20,globaltimesnews,,9,62,193,"#Wuhan is coming out of its darkest moment, #China's CDC chief epidemiologist Zeng Guang said on Saturday, commenting on the fight against #COVID19. Some countries may have just started to enter their darkest moments, which will take quite long period to get through, he said. pic.twitter.com/84QEJKE3rd",,,#Wuhan #China #COVID19,1236220378915262475,https://twitter.com/globaltimesnews/status/1236220378915262475
2020-03-07 09:19:43,ASRomaEN,,3,24,174,"Masks donated to hospitals Sanitizing gel distributed to public Safety awareness video launched Three initiatives the club is embarking on to help address the #COVID19 crisis. http://on.asroma.com/3aEqqzV | #ASRomapic.twitter.com/f6hnkGL55c",,,#COVID19 #ASRomapic,1236219971644030978,https://twitter.com/ASRomaEN/status/1236219971644030978
2020-03-07 09:15:40,MelGohCNA,,6,343,211,"10 new cases reported today, all linked to case 33 cluster. Case 33 was detected via contact tracing, was involved in meeting with case 26 ( Khazanah) on Feb 21. His wife, staff, driver were tested positive . Total #COVID19 cases in Malaysia stood at 93 , 23 cases discharged. https://twitter.com/MelGohCNA/status/1235874667241455616 …pic.twitter.com/ooproUacTt",,,#COVID19,1236218950939111424,https://twitter.com/MelGohCNA/status/1236218950939111424
2020-03-07 09:07:33,graham74GC,NeelaJan,4,15,66,"Important issue! Australian Doctor with COVID19 had mild symptoms eg mild fever, runny nose. Until now, most docs would continue working as there is no cover for doctors off sick apart from colleagues working harder. Clearly this has to change now. #COVID19 #protectpatientshttps://twitter.com/NeelaJan/status/1236094118553477121 …",,,#COVID19 #protectpatientshttps,1236216909961494528,https://twitter.com/graham74GC/status/1236216909961494528
2020-03-07 09:06:04,IranNW,,4,102,110,"Mar. 6- Karun River, Ahwaz, SW #Iran Voice says Khomeini Hospital has disposed of its medical waste along the beaches of Karun during the country's #COVID19 crisis. This is what we mean when we say we are dealing with an incompetent regime that cares nothing for Iranians. pic.twitter.com/b4XAkBoWbz",,,#Iran #COVID19,1236216535053549569,https://twitter.com/IranNW/status/1236216535053549569
2020-03-07 09:05:03,corsarof,,43,84,441,"What happens if the Eu comes up with a vaccine for #COVID19 ? Will brexiteers refuse to take it because it is not made in Uk ?",,,#COVID19,1236216280111296512,https://twitter.com/corsarof/status/1236216280111296512
2020-03-07 09:03:16,DrJV75,,1,26,86,"Across the country directors of public health and their teams are working flat out to work with @PHE_uk @CMO_England & their NHS partners to protect the public & delay the spread of Covid19. Self care is essential for all of us - this is the sprint at the start of a marathon!",,@PHE_uk @CMO_England,,1236215830569984000,https://twitter.com/DrJV75/status/1236215830569984000
2020-03-07 09:02:30,FIT_President,,0,53,79,"Independent #interpreters and #translators are feeling the economic effects of #COVID19 as conferences and meetings are being cancelled. Read the joint appeal issued by @aiiconline, @fit_ift and @WASLI_tweets to authorities worldwide. https://www.fit-ift.org/joint-appeal/ #1nt #xl8pic.twitter.com/JjocYwQn68",,@aiiconline @fit_ift @WASLI_tweets,#interpreters #translators #COVID19 #1nt #xl8pic,1236215636684046336,https://twitter.com/FIT_President/status/1236215636684046336
2020-03-07 09:02:00,wef,,1,57,75,"Be Safe if #COVID19 arrives in your community. Find out: how to prevent #coronavirus infection (regular handwashing & respiratory hygiene) the symptoms of COVID-19 who to call if you develop symptoms Be Ready: https://buff.ly/2uA6LBt pic.twitter.com/erIET5grMX",,,#COVID19 #coronavirus,1236215511127486464,https://twitter.com/wef/status/1236215511127486464
2020-03-07 08:59:02,decdevane,,14,172,374,"What he said ”Facts not fear. Clean hands. Open hearts. Our children will thank us for it.” #COVID19ireland #COVID19 pic.twitter.com/WF1qdDY1RS",,,#COVID19ireland #COVID19,1236214764289867778,https://twitter.com/decdevane/status/1236214764289867778
2020-03-07 08:56:36,raphbosano,,24,215,712,"READ: Secretary Francisco Duque's letter to Executive Secretary Salvador Medialdea recommending the immediate declaration of a State of Public Health Emergency due to recorded local transmissions #COVID19. pic.twitter.com/T74IOvmNe1",,,#COVID19,1236214151933874176,https://twitter.com/raphbosano/status/1236214151933874176
2020-03-07 08:48:03,CGTNOfficial,,6,61,95,"The number of #COVID19 cases worldwide has passed 100,000, as the @WHO called on countries to make ""containment their highest priority."" https://bit.ly/2TJuyYN pic.twitter.com/ZQaIqRNXJh",,@WHO,#COVID19,1236212001698795520,https://twitter.com/CGTNOfficial/status/1236212001698795520
2020-03-07 08:41:11,dermotor,,16,31,68,"'Flabbergasted': Melbourne doctor with coronavirus symptoms continued seeing patients. Doctor likely caught #Covid19 while in US but had seen 70 patients since return. Here’s a lesson for doctors: you won’t be thanked for soldiering with flu-like symptoms https://www.theguardian.com/world/2020/mar/07/flabbergasted-melbourne-doctor-with-coronavirus-symptoms-continued-seeing-patients?CMP=Share_iOSApp_Other …",,,#Covid19,1236210272928444416,https://twitter.com/dermotor/status/1236210272928444416
2020-03-07 08:40:58,lcameronross,,3,30,76,"This would be much more fun in the communal bathrooms than folk muttering Happy Birthday under their breath #COVID19 #coronasongs #coronavirusukpic.twitter.com/rZ7gO1Dsbv",,,#COVID19 #coronasongs #coronavirusukpic,1236210218578710534,https://twitter.com/lcameronross/status/1236210218578710534
2020-03-07 08:36:04,iingwen,,524,1947,8490,"I visited a pharmacy in #Taipei to learn how they’re working to prevent the spread of #COVID19 & ensure people have access to a steady supply of face masks. Truly touched by their dedication to keeping #Taiwan safe & healthy.pic.twitter.com/6K6KEBQy4s",,,#Taipei #COVID19 #Taiwan,1236208986724024321,https://twitter.com/iingwen/status/1236208986724024321
2020-03-07 08:34:21,rthk_enews,,7,46,49,"Health officials say one of the #HongKong residents evacuated from Wuhan this week has tested positive for #COVID19 pic.twitter.com/iBW5L29kzl",,,#HongKong #COVID19,1236208555176243200,https://twitter.com/rthk_enews/status/1236208555176243200
2020-03-07 08:30:27,Calumets,,14,48,118,"Covid19 medical advice warns against touching the mouth, nose or eyes. These high-quality face-isolators are available for £29.99 from all good pet-supermarkets for a limited time only. Rush out and get yours now! Go, now! #coronvirusukpic.twitter.com/SeLeiuXuk2",,,#coronvirusukpic,1236207572618801152,https://twitter.com/Calumets/status/1236207572618801152
2020-03-07 08:25:25,ABSCBNNews,,2,41,135,"President Rodrigo Duterte ""has agreed"" to declare a state of public health emergency after DOH confirmed the first case of local transmission of #COVID19. http://bit.ly/32WJQxu",,,#COVID19,1236206304970104833,https://twitter.com/ABSCBNNews/status/1236206304970104833
2020-03-07 08:20:37,CGTNOfficial,,8,39,90,"#SouthKorea saw 448 new #COVID19 cases in the past 24 hours, bringing the total to 7,041 in the country, as of Saturday, according to the Korean Center for Disease Control and Prevention. 47 people have died from the virus. pic.twitter.com/t6gVA0XinZ",,,#SouthKorea #COVID19,1236205096888725506,https://twitter.com/CGTNOfficial/status/1236205096888725506
2020-03-07 08:17:51,DrEricDing,,29,126,389,"5) The fact that companies are ordering work-from-home, big conventions are canceling like Seattle Comic Con and SXSW, lower sporting attendances, increased hand washing, sanitizing measures, etc all can lower the infection rates. So don’t fret. We can still beat this. #COVID19",,,#COVID19,1236204399292297217,https://twitter.com/DrEricDing/status/1236204399292297217
2020-03-07 08:15:55,CT_Bergstrom,,52,508,1003,"New epidemiological study of 25,000 #COVID19 cases reveals that infection control measures in Wuhan reduced infections by over 90%, reducing R0 to roughly 0.3. Remarkable and cause for hope that aggressive measures in the US can make a huge difference. https://www.medrxiv.org/content/10.1101/2020.03.03.20030593v1 …pic.twitter.com/DfnhS0nE4O",,,#COVID19,1236203915131019264,https://twitter.com/CT_Bergstrom/status/1236203915131019264
2020-03-07 08:13:25,DrEricDing,,2,50,97,"4) also doubling time can be reduced by PH measures. And unclear what the serial interval is in the model. Hence actual cases, load, and deaths could be also likely be much much lower than the above estimate- there are many over aggressive assumptions made basically. #COVID19",,,#COVID19,1236203284312002560,https://twitter.com/DrEricDing/status/1236203284312002560
2020-03-07 08:09:18,paulbhampton,theJeremyVine,4,27,58,"If you get chance, watch the full interview of @DrRHatchett by @cathynewman below. Just short of 20 mins, but it explains so much. By the end of the discussion, any doubts I had about the potential impact of #COVID19 in UK & RoW were largely dispelled. https://youtu.be/dcJDpV-igjs",,@DrRHatchett @cathynewman,#COVID19,1236202250743296000,https://twitter.com/paulbhampton/status/1236202250743296000
2020-03-07 08:09:12,coronaviruscare,,6,92,138,"India Update 7.02.2020 The Indian Council of Medical Research has notified 52 centres for COVID19 testing in India. pic.twitter.com/2t8x1ko6Tq",,,,1236202223035506688,https://twitter.com/coronaviruscare/status/1236202223035506688
2020-03-07 08:07:45,DrEricDing,,4,61,125,"3) And yes, the estimate above uses a conservative CFR estimate for mortality of just 0.5%, which is much lower than WHO’s 3.4% this week. Other experts peg the CFR is 1-2.5%. But the model also assumes no PH control measures to lower R to a smaller R(effective) value #COVID19",,,#COVID19,1236201857757962240,https://twitter.com/DrEricDing/status/1236201857757962240
2020-03-07 08:03:45,WilliamYang120,,3,39,65,"More on #COVID19 - US now has 342 cases and 17 deaths. 8 patients have recovered. California and Washington State are the top 2 states with the highest number of cases. pic.twitter.com/SMNhd7wkcM",,,#COVID19,1236200851896590337,https://twitter.com/WilliamYang120/status/1236200851896590337
2020-03-07 08:01:58,CGTNOfficial,,11,55,255,"Live: Chinese officials hold 40th news conference on efforts to contain #COVID19 in Hubei https://www.pscp.tv/w/cTH69jFkclFlWlBNeHJ2S2J8MURYeHllYmVRVlp4TTjtkEQPqwU25L0c1AHeDsMlQglp0v67WsFfxluXdec1 …",,,#COVID19,1236200402283974656,https://twitter.com/CGTNOfficial/status/1236200402283974656
2020-03-07 08:00:21,bmj_latest,,1,118,138,"#BMJInfographic What should I do if I suspect that a patient may have #COVID19? This infographic by @will_s_t offers a practical guide for GPs and others working in UK primary care on when to suspect covid-19 and how to respond http://ow.ly/WghR50yEyH7 pic.twitter.com/HqMRk3AKCJ",,@will_s_t,#BMJInfographic #COVID19,1236199998192312320,https://twitter.com/bmj_latest/status/1236199998192312320
2020-03-07 08:00:18,MillerCrime,,24,276,208,"The delay in coronavirus test kits is so Alex Azar’s pharma buddies can secure their patents Read about how it’s delaying development of a vaccine http://bit.ly/2VRXfVV #coronavirus #TestKits #CoronavirusOutbreak #COVIDー19 #COVID19 #BigPharma #GOP #M4A #OneVoice1",,,#coronavirus #TestKits #CoronavirusOutbreak #COVIDー19 #COVID19 #BigPharma #GOP #M4A #OneVoice1,1236199984086880258,https://twitter.com/MillerCrime/status/1236199984086880258
2020-03-07 08:00:02,ChinaDaily,,17,43,164,"Good news! About one-third of residential communities in #Wuhan, the epicenter of the novel #coronavirus outbreak, have had no newly confirmed cases in the past two weeks as of Thursday. #COVID19 https://bit.ly/2IoV8Rx pic.twitter.com/brWpYoin89",,,#Wuhan #coronavirus #COVID19,1236199918391267328,https://twitter.com/ChinaDaily/status/1236199918391267328
2020-03-07 07:59:50,robmathews,,1,18,86,"At a time when GPs are feeling completely unsupported by our government @JennyMikakos goes and throws the Toorak GP under a bus despite him not breaching Vic health Covid19 guidelines. GP bashing, it appears, is a favourite past time of Australian governments!",,@JennyMikakos,,1236199867187367936,https://twitter.com/robmathews/status/1236199867187367936
2020-03-07 07:57:40,dtgphoto,,3,13,108,"So to brighten up the mood a little from covid19 A fantastic evening spent on the coast in Madeira... Needs a click to show it all (portrait) #madeira #madeiraislandpic.twitter.com/nrTtZ1RyPD",,,#madeira #madeiraislandpic,1236199320589910017,https://twitter.com/dtgphoto/status/1236199320589910017
2020-03-07 07:53:50,FirstSquawk,,7,43,84,"78 million Chinese rural workers have already returned to work, accounting for 60% of the total who left for home for the Chinese New Year holiday, a government official said on Saturday, as China steps up measures to limit the disruption to businesses from the Covid19 outbreak.",,,,1236198357833572352,https://twitter.com/FirstSquawk/status/1236198357833572352
2020-03-07 07:49:24,DrEricDing,,10,119,201,"2) Contrast above with vs flu in 2018-2019 season... which is worse? Still believe it’s “just the flu?” #COVID19 35,500,000 infections 490,600 hospitalizations 49,000 ICU admissions 34,200 deaths (source: https://www.cdc.gov/flu/about/burden/2018-2019.html …)",,,#COVID19,1236197243658670081,https://twitter.com/DrEricDing/status/1236197243658670081
2020-03-07 07:47:54,DrEricDing,,73,670,831,"REPOST: Scientist at AHA webinar presented this ""Best Guess Epidemiology"" for #COVID19 for 2 months (using conservative numbers - eg doubling time can be ~6.2 days): 96,000,000 infections 4,800,000 hospitalizations 1,900,000 ICU admits 480,000 deaths https://www.businessinsider.com/presentation-us-hospitals-preparing-for-millions-of-hospitalizations-2020-3 …pic.twitter.com/ZdhDhXN2dI",,,#COVID19,1236196862157377537,https://twitter.com/DrEricDing/status/1236196862157377537
2020-03-07 07:39:57,NCDCgov,,4,94,150,"#PreventCOVID19Spread Do not spread fake news. These are the official channels for #COVID19 updates on Twitter: @Fmohnigeria @NCDCgov @LSMOH #COVID19Nigeriapic.twitter.com/ga9IKaiP4v",,@Fmohnigeria @NCDCgov @LSMOH,#PreventCOVID19Spread #COVID19 #COVID19Nigeriapic,1236194863227514880,https://twitter.com/NCDCgov/status/1236194863227514880
2020-03-07 07:36:06,MOPHQatar,,13,72,136,"MOPH Reports a New Case of #coronavirus Disease ( #COVID19) , bringing the total number of cases in #Qatar to twelve.https://www.moph.gov.qa/english/mediacenter/News/Pages/NewsDetails.aspx?ItemId=92 …",,,#coronavirus #COVID19 #Qatar,1236193893072412673,https://twitter.com/MOPHQatar/status/1236193893072412673
2020-03-07 07:36:01,AddressingLife,,24,100,383,"I applaud the doctors speaking out about the need to cancel gatherings such as Paddy's day! And I would encourage the doctors not doing so, those agreeing w/Dr. Holohan, to please change your minds. He's wrong. Speak up for the most vulnerable #COVID19 https://www.independent.ie/world-news/coronavirus/it-should-be-cancelled-st-patricks-day-plan-criticised-by-doctors-amid-coronavirus-fears-39023034.html …",,,#COVID19,1236193873044672513,https://twitter.com/AddressingLife/status/1236193873044672513
2020-03-07 07:29:43,THE_Russell,,25,85,85,"Italy is now closing down nursing homes after 49 nursing home deaths in one day due to the #Covid19 virus. The Italian government says nursing homes are a breeding ground for the virus. #auspolpic.twitter.com/rVW8207eMI",,,#Covid19 #auspolpic,1236192286670647296,https://twitter.com/THE_Russell/status/1236192286670647296
2020-03-07 07:26:28,peerashiq,,5,27,94,"All primary schools closed in Samba and Jammu districts due to COVID19 scare, but high participation allowed in Gulmarg with around 900 athletes, presided by none other than Union minister Rijiju. Is Sports Council risking the lives of sportsmen to make a point on normalcy?",,,,1236191468441632768,https://twitter.com/peerashiq/status/1236191468441632768
2020-03-07 07:26:10,lauraandreoli80,,8,73,89,"Please RT: I want to warn all the Countries which are not seriously affected by #COVID19 that the only way to slow down the outbreak is #SocialDistance. Please learn from our desperate situation in #Lombardy this is NOT common influenza!! PROTECT YOURSELF - PROTECT OTHERS pic.twitter.com/APW9k4OIAc",,,#COVID19 #SocialDistance #Lombardy,1236191394773061632,https://twitter.com/lauraandreoli80/status/1236191394773061632
2020-03-07 07:23:30,DrTedros,annietrev,63,103,430,"Huge thanks, @annietrev, Secretary of State and @DFID_UK, for 's staunch support in the global fight against #COVID19. @WHO truly appreciates your commitment to a healthier, safer world. Together, we will win #coronavirus!https://twitter.com/annietrev/status/1235970049040580611?s=20 …",,@annietrev @DFID_UK @WHO,#COVID19 #coronavirus,1236190723541696512,https://twitter.com/DrTedros/status/1236190723541696512
2020-03-07 07:18:21,PTI_News,,0,33,92,"Indian national among 15 new cases of #coronavirus in UAE, taking the total number of confirmed infections in the country to 45: Officials . #COVID19",,,#coronavirus #COVID19,1236189425798803458,https://twitter.com/PTI_News/status/1236189425798803458
2020-03-07 07:18:14,ABSCBNNews,,7,202,409,"DOH just raised the country's #COVID19 alert system to Code Red, Sub-level 1 after the first case of a local transmission was confirmed. #coronavirushttp://bit.ly/2TvSeRC",,,#COVID19 #coronavirushttp,1236189399932530689,https://twitter.com/ABSCBNNews/status/1236189399932530689
2020-03-07 07:14:06,calixye1,,8,102,150,"ATTENTION PH MOOTS The department has raised #COVID19 Philippines alert to Code Red. | via #coronavirus PLEASE WASH YOUR HANDS, WEAR YOUR MASKS, AND STAY VIGILANT i everest u all rt to spread the wordpic.twitter.com/fSLhVc94iD",,,#COVID19 #coronavirus,1236188358537351168,https://twitter.com/calixye1/status/1236188358537351168
2020-03-07 07:12:32,ruskin147,stevenportnoy,5,19,54,"Wow. US government told the press about the number of people testing positive for #COVID19 aboard a cruise ship before the passengers themselves were informed https://twitter.com/stevenportnoy/status/1236076199018991618 …",,,#COVID19,1236187962565681152,https://twitter.com/ruskin147/status/1236187962565681152
2020-03-07 07:12:11,billmaher,,295,1272,6244,"Trump said he had a hunch that the virus wasn't as bad as the World Health Organization says. So on the one side, you have the World Health Organization. On the other side, you have a guy who stared at an eclipse. #TrumpHunch #Covid19 pic.twitter.com/LYhJLN3NxU",,,#TrumpHunch #Covid19,1236187877714743296,https://twitter.com/billmaher/status/1236187877714743296
2020-03-07 07:05:31,fresh_sadegh,,1,26,52,"In town of Talesh, #Gilan province, generous local donors have equipped the town’s sole hospital with several ventilators as Covid19 virus sweeps across #Iran. Gilan is 2 of the virus-stricken regions.pic.twitter.com/lc9tnitKof",,,#Gilan #Iran,1236186199154397184,https://twitter.com/fresh_sadegh/status/1236186199154397184
2020-03-07 07:00:28,trvrb,nextstrain,47,504,1015,"One additional #HCoV19 genome from the Seattle area #COVID19 outbreak. This also groups with the emerging outbreak clade. Evidence so far supports a single introduction into the area and subsequent spread. https://twitter.com/nextstrain/status/1236181165683269633 …",,,#HCoV19 #COVID19,1236184926665322497,https://twitter.com/trvrb/status/1236184926665322497
2020-03-07 07:00:00,CGTNOfficial,,48,76,223,"#FactsTell: There's no need for China to apologize #CoronavirusOutbreak #COVID19 pic.twitter.com/73Nj7zdFzA",,,#FactsTell #CoronavirusOutbreak #COVID19,1236184808457416705,https://twitter.com/CGTNOfficial/status/1236184808457416705
2020-03-07 06:43:04,earthshakerph,,0,128,172,"@WHOPhilippines on Code Red: “..the raising of the alert level to Code Red sublevel 1 is a preemptive call to ensure that national and local governments and public and private healthcare providers can prepare for possible increase in cases.” #COVID19 pic.twitter.com/khTD36YivG",,@WHOPhilippines,#COVID19,1236180548218839040,https://twitter.com/earthshakerph/status/1236180548218839040
2020-03-07 06:30:09,WOTB07,,5,119,166,"#Iran #coronavirus patients being buried secretly in Midnight hours when everyone is asleep to hide the actual figures of cases and deaths Iran is hiding. This is only one site, reportedly mass grave sites are present for #COVID19 victims in Iran pic.twitter.com/OXhTZgEIx4",,,#Iran #coronavirus #COVID19,1236177296610021376,https://twitter.com/WOTB07/status/1236177296610021376
2020-03-07 06:20:02,DrEricDing,,33,178,514,"2) ‘Endemic’ is defined by Mayo Clinic as “An infection within a geographic location that is existing perpetually”. So is @CDCgov / @EvergreenHosp claiming #COVID19 is “perpetual” to Seattle area now? Epidemic has barely just begun. What bogus nonsense. https://newsnetwork.mayoclinic.org/discussion/pandemic-versus-endemic-versus-outbreak-terms-to-know/ …pic.twitter.com/BmBatdCPK4",,@CDCgov @EvergreenHosp,#COVID19,1236174753142059008,https://twitter.com/DrEricDing/status/1236174753142059008
2020-03-07 06:19:54,ABSCBNNews,,8,142,217,"DOH: The fifth and sixth positive case of #COVID19 are residents of Cainta, Rizal. #coronavirus",,,#COVID19 #coronavirus,1236174716957626369,https://twitter.com/ABSCBNNews/status/1236174716957626369
2020-03-07 06:16:50,Lady_Star_Gem,,12,76,205,"The stigma around coronavirus is hurting Asian people I have read stories of Asians getting fired, stared at, judged, thrown out/refused services at hotels & beaten cause they associate #COVID19 to Asians Please for the love of everything sacred, don't let prejudice do that",,,#COVID19,1236173947764342787,https://twitter.com/Lady_Star_Gem/status/1236173947764342787
2020-03-07 06:07:55,DrEricDing,,303,989,1716,"Most batshit bullshit thing I’ve heard all day. WA nursing home is ending all #COVID19 tests claiming that it’s endemic, so just forget it and not try to test and isolate people anymore? Millions of area residents are still at risk, hello?! Brain dead idea http://www.evergreenhealth.com/community-message-3420 … pic.twitter.com/FlhCYFb6oN",,,#COVID19,1236171700632420354,https://twitter.com/DrEricDing/status/1236171700632420354
