date,username,to,replies,retweets,favorites,text,geo,mentions,hashtags,id,permalink
2020-03-14 21:40:18,DrStager,,35,682,1029,"Twenty somethings are MAJOR vectors for the virus. Current US protocols won't get them tested but S Korea data shows they are spreading the virus everywhere. It's time for the healthy young adults to stay home and stop spreading the virus. #COVID19 #StayHomepic.twitter.com/5WVoYE83PD",,,#COVID19 #StayHomepic,1238943057489334272,https://twitter.com/DrStager/status/1238943057489334272
2020-03-14 21:40:03,NewJerseyDOE,,39,146,763,"The NJDOE Internal COVID19 Taskforce reviewing school preparedness plans to maintain food security for NJ students. 550 plans received. Thank you to our districts for ensuring continuity of instruction & food security. @NJGov @GovMurphy @LtGovOliver @NJSP @NJDeptofHealth @NJDApic.twitter.com/3NKW5IrrAx",,@NJGov @GovMurphy @LtGovOliver @NJSP @NJDeptofHealth @NJDApic,,1238942998710423553,https://twitter.com/NewJerseyDOE/status/1238942998710423553
2020-03-14 21:40:01,HMcEntee,SimonHarrisTD,345,174,871,"A decision to close pubs restaurants and other outlets will have a devastating impact on so many workers. Unless people listen to public health advice and take this seriously then that’s where this is headed. Please think about your actions. #COVID19 https://twitter.com/SimonHarrisTD/status/1238929572701384704 …",,,#COVID19,1238942989470380034,https://twitter.com/HMcEntee/status/1238942989470380034
2020-03-14 21:40:01,brian4NY,,25,169,239,"18 #coronavirus #COVID19 cases in this 1 town, >25% of all cases in NJ! Mayor calling for all 40k residents to self-quarantine. My story at 6 @NBCNewYork #Teaneckpic.twitter.com/zz3ajOdB6B",,@NBCNewYork,#coronavirus #COVID19 #Teaneckpic,1238942987473891331,https://twitter.com/brian4NY/status/1238942987473891331
2020-03-14 21:39:57,CryptoFinally,,35,17,174,"Yes, I’ve been on a cruise ship for the past two weeks as COVID19 unfolds. Yes, I’ll be on one of the first ships at sea attempting to return to the US since the mandate refusing ships. No, theres been no mass hysteria and no known outbreak of the virus. Keep you posted",,,,1238942970369490949,https://twitter.com/CryptoFinally/status/1238942970369490949
2020-03-14 21:39:29,elliotthaut,,3,41,96,"One of my new favorite #COVID19 memes. pic.twitter.com/P8GMRLzfgf",,,#COVID19,1238942855214837760,https://twitter.com/elliotthaut/status/1238942855214837760
2020-03-14 21:38:39,londyloo,,28,33,160,"Quick question? What if a resident gets sick? What happens at your hospital? What I mean is that it’s come to my attention that many hospitals informed residents if they test positive for #covid19 that it will use ALL of their vacation/sick leave time to self quarantine.",,,#covid19,1238942643712860166,https://twitter.com/londyloo/status/1238942643712860166
2020-03-14 21:37:47,WFLAJustin,,4,27,75,"#BREAKING: @NikkiFriedFL says the USDA approved @FDACS request for flexible food delivery options like ""grab and go"" meals, multiple meals at a time, and distribution outside the cafeteria while schools closed due to #COVID19 until March 30. @WFLAhttps://www.wfla.com/community/health/coronavirus/florida-to-still-provide-children-meals-as-schools-close/ …",,@NikkiFriedFL @FDACS @WFLAhttps,#BREAKING #COVID19,1238942424514297857,https://twitter.com/WFLAJustin/status/1238942424514297857
2020-03-14 21:37:32,WSU_Provost,,1,29,83,"Here’s an answer to a question I’m getting regularly about why @WichitaState is moving (temporarily) from f2f instruction to online and/or remote because of #COVID19 pic.twitter.com/4AaH9ekcHL",,@WichitaState,#COVID19,1238942361377550336,https://twitter.com/WSU_Provost/status/1238942361377550336
2020-03-14 21:37:21,RachelDonadio,,24,380,341,"CX to earlier Tweet. Jérôme Salomon, the head of France's health service: France is heading toward a generalized epidemic. CHANGE YOUR BEHAVIOR NOW. 4,500 cases in France, which doubled in the past 72 hours. OF 300+ SERIOUS #COVID19 CASES IN FRENCH ICUs, 50% ARE YOUNGER THAN 60. pic.twitter.com/KvsU9artLi",,,#COVID19,1238942318054592513,https://twitter.com/RachelDonadio/status/1238942318054592513
2020-03-14 21:36:57,YourAlberta,,92,133,177,"Alberta’s Chief Medical Officer will provide an update on #COVID19 and the ongoing work to protect public health. The latest info is also available at http://alberta.ca/covid19 https://twitter.com/i/broadcasts/1LyxBNllXWbxN …",,,#COVID19,1238942217315606528,https://twitter.com/YourAlberta/status/1238942217315606528
2020-03-14 21:36:51,Djfury4412,BillBlair,7,37,68,"What about the false information your providing to the Cda. This is @farahnasser explaining her families experience when they came back into Canada from Mexico. The only question we were asked upon our return to Toronto #Covid19 pic.twitter.com/C4aXz19T2p",,@farahnasser,#Covid19,1238942193047482377,https://twitter.com/Djfury4412/status/1238942193047482377
2020-03-14 21:36:50,EmergMedDr,,83,248,629,"The rationing begins. Patient in resus needs non-invasive ventilation, with suspected Covid-19. Has a DNAR. No anaesthetist wants to risk their health by using NIV in neg pressure room. ""We have to protect ourselves"" No NIV. I will call the family in now then.. #COVID19",,,#COVID19,1238942186990899202,https://twitter.com/EmergMedDr/status/1238942186990899202
2020-03-14 21:36:39,petertimmins3,,26,34,127,"That's it, we're in lock down. Only retail places open now are banks, grocery stores, petrol stations and pharmacies. #Coronavirus #COVID19",,,#Coronavirus #COVID19,1238942142157946880,https://twitter.com/petertimmins3/status/1238942142157946880
2020-03-14 21:36:38,JacquiDelaney,,9,106,98,"Again today the PM is giving the impression that screening measures have been changed at airports. And that’s just not true. The last screen cap is taken from the CBSC website this afternoon. They are the same measures that have been in place since early February. #COVID19 pic.twitter.com/ps8AeaMM1F",,,#COVID19,1238942135312842756,https://twitter.com/JacquiDelaney/status/1238942135312842756
2020-03-14 21:35:21,jackyklein28,,4,40,118,"Evening spent clearing out old papers. Came across @thetimes, Sat 18 Jan 2020, when #coronavirus was a story only as big as a showbiz chicken eaten by a dog. Time flies #CoronaVirusUpdates #COVID19 pic.twitter.com/O3xDFDHmDi",,@thetimes,#coronavirus #CoronaVirusUpdates #COVID19,1238941815077773313,https://twitter.com/jackyklein28/status/1238941815077773313
2020-03-14 21:32:59,StrangeAttract5,,15,96,198,"Okay then, by request, a gimp thread, how to have pneumonia. For backstory, I've had it countless times because I have asthma and can't cough germs out as well as normal people. Viral pneumonia is the big risk with #COVID19 and antibiotics don't work.",,,#COVID19,1238941218102489088,https://twitter.com/StrangeAttract5/status/1238941218102489088
2020-03-14 21:32:43,SamuelJJack,,14,28,155,"I just left a pub in Notting Hill where a lot of regulars take cocaine. I heard genuine conversations about not sharing notes because of #COVID19 Maybe be more concerned about the toilet you're sniffing it off and perhaps the class A drug you're putting up your nose?",,,#COVID19,1238941149689253890,https://twitter.com/SamuelJJack/status/1238941149689253890
2020-03-14 21:32:15,NikkiFriedFL,,5,85,137,"This afternoon, @USDANutrition granted @FDACS' waiver requests, giving schools flexibility in serving meals during Florida's #COVID19 school closures. We're committed to partnering with schools, non-profits, and families to feed millions of kids during the #coronavirus pandemic.",,@USDANutrition @FDACS,#COVID19 #coronavirus,1238941034178060291,https://twitter.com/NikkiFriedFL/status/1238941034178060291
2020-03-14 21:31:32,GovNedLamont,,20,41,101,"This afternoon I signed another executive order taking action to mitigate the spread of #COVID19, including by encouraging social distancing and helping the healthcare industry obtain needed medical equipment and other supplies. The seven actions it orders include: (1/7)",,,#COVID19,1238940852896043008,https://twitter.com/GovNedLamont/status/1238940852896043008
2020-03-14 21:31:25,TheRoyalMHC,,3,92,101,"News about #COVID19 is around us all the time, and it can be extremely anxiety-inducing & stressful to keep up with. So what can we do when we're feeling anxious or distressed? Andrew Jacobs, one of our Psychologists, shared some tips on @cbcradio:https://www.cbc.ca/listen/live-radio/1-92-all-in-a-day/clip/15765700-managing-anxieties-caused-by-fears-of-the-coronavirus …",,@cbcradio,#COVID19,1238940825532465152,https://twitter.com/TheRoyalMHC/status/1238940825532465152
2020-03-14 21:30:52,AgnessMack,,7,64,174,"Glad you raised that. And yes, #insiders. should deal, esp in light of advice PM & cabinet don't need to self isolate after contact with Dutton. Once #COVID19 passes, Brendan Murphy resumes the role of Departmental Secretary - a post he holds at the Prime Minister's pleasure.",,,#insiders #COVID19,1238940685811585025,https://twitter.com/AgnessMack/status/1238940685811585025
2020-03-14 21:30:00,RT_com,,14,175,299,"What a difference a few weeks make... Iconic landmarks are uncharacteristically devoid of human traffic and have fallen eerily quiet as #Covid19 crisis sweeps the globe. pic.twitter.com/93gY3uN1zl",,,#Covid19,1238940466244136960,https://twitter.com/RT_com/status/1238940466244136960
2020-03-14 21:29:47,JesseLehrich,,2,58,49,"in 48 hours, the #of confirmed #COVID19 cases in Louisiana has jumped from 19 to 77 & the first death was just reported. https://gov.louisiana.gov/index.cfm/newsroom/detail/2407 …",,,#of #COVID19,1238940413890826248,https://twitter.com/JesseLehrich/status/1238940413890826248
2020-03-14 21:29:11,DrTedros,,115,131,508,"Appreciated the chance to talk with @MattHancock today about #COVID19 in the . @WHO is committed to working with the government and deeply grateful to the people of the for their support to the global response, and R&D. #coronavirus",,@MattHancock @WHO,#COVID19 #coronavirus,1238940261138530312,https://twitter.com/DrTedros/status/1238940261138530312
2020-03-14 21:28:42,moms4housing,,8,685,1314,"With all our lives dependent on social distancing and the ability to quarantine at home, we demand that all publicly-owned homes and land be made available to people without shelter NOW. #HousingIsHealthcare #COVID19 https://www.latimes.com/homeless-housing/story/2020-03-14/homeless-moms-occupy-house-los-angeles-caltrans-coronavirus-pandemic …",,,#HousingIsHealthcare #COVID19,1238940138505265152,https://twitter.com/moms4housing/status/1238940138505265152
2020-03-14 21:27:56,Manolo4Miami,,10,5,126,"I am happy to announce that my wife and I have gotten our results back from the #COVID19 test and they are both negative. I do not regret my decision to self-isolate, as the safety of our residents, my family and my friends comes first.",,,#COVID19,1238939945957576710,https://twitter.com/Manolo4Miami/status/1238939945957576710
2020-03-14 21:27:13,sadler_squared,,7,21,261,"Today in public I’ve seen someone coughing (without covering), sneezing (without covering), digging their ear before making my smoothie, and smoking-blowing it into people faces, (don’t even get me started on this one). We can do better America... #keepitclassy #COVID19",,,#keepitclassy #COVID19,1238939768810921989,https://twitter.com/sadler_squared/status/1238939768810921989
2020-03-14 21:25:56,Albert0_Cresp0,,3,33,99,"We are officially under lockdown from Monday. The whole of Spain just joined in a two minute clap from their windows to honour the medical staff around the country...lovely stuff #COVID19 #coronaviruspic.twitter.com/p57bAx0wrO",,,#COVID19 #coronaviruspic,1238939442670374914,https://twitter.com/Albert0_Cresp0/status/1238939442670374914
2020-03-14 21:25:36,NFitzPsychology,,248,90,4059,"Grieving during Covid19 with older & younger family members kept apart: ~Separate visits to the grave ~No hugs ~The ache for the deceased but also for each other Today even more than usual, I REALLY appreciate the messages of support. I've read each one. #Gratitude",,,#Gratitude,1238939361963659267,https://twitter.com/NFitzPsychology/status/1238939361963659267
2020-03-14 21:25:29,WHO,,29,872,1495,"#HealthWorkers, take care of yourself at this time. Try and use helpful coping strategies: ensuring sufficient rest & respite during work or between shifts eat sufficient & healthy food engage in physical activity stay in contact with family & friends #COVID19 pic.twitter.com/gFlViRDS9y",,,#HealthWorkers #COVID19,1238939331244560385,https://twitter.com/WHO/status/1238939331244560385
2020-03-14 21:24:50,DrJenGunter,,42,38,407,"Anyone know if antibody dependent enhancement is the reason young kids seem at very low risk of illness and older people seem uniquely at risk for severe illness due to #COVID19? If so, how does that bode for a second wave in a few years and vaccine development?",,,#COVID19,1238939168882880512,https://twitter.com/DrJenGunter/status/1238939168882880512
2020-03-14 21:24:43,Titmousie,,3,61,214,"Did you even clean your cellphone today? get that filthy thing away from me! #COVID19 #Caturday Cats know best!pic.twitter.com/3C0IMohIAp",,,#COVID19 #Caturday,1238939136960147457,https://twitter.com/Titmousie/status/1238939136960147457
2020-03-14 21:23:55,DesNYDC,,6,39,104,"The most dangerous coronavirus myth is that only old people will die. When this disease consumes every ICU bed, anaesthetist, ventilator available, the 25 year old in a car accident and the 19 year old with appendicitis will suffer. We are ALL in this together. #StayHome #COVID19",,,#StayHome #COVID19,1238938935813902339,https://twitter.com/DesNYDC/status/1238938935813902339
2020-03-14 21:23:40,C3_Nik,,34,25,181,"A few weeks ago: ""It's just the flu!"" Today: ""It's just the elderly in Italy."" In two weeks (maximum): ""We are fu**ed."" This arrogance and complacency just blows my mind! It's absolutely insane! #corona #covid2019 #covid19 #coronaUSA #coronaEU #COVID_19uk #CoronaVirusUpdates",,,#corona #covid2019 #covid19 #coronaUSA #coronaEU #COVID_19uk #CoronaVirusUpdates,1238938873046208519,https://twitter.com/C3_Nik/status/1238938873046208519
2020-03-14 21:22:55,USNavyEurope,,184,1224,2998,"Amazing video from Gaeta, #Italy showing #US6thFleet Flag Ship #USSMountWhitney playing the #Italian national anthem in solidarity with the Italian people! THIS is what friendship and support looks like. Viva l'Italia #COVID_19italia #COVIDー19 #COVID19 pic.twitter.com/vJu7SPieyb",,,#Italy #US6thFleet #USSMountWhitney #Italian #COVID_19italia #COVIDー19 #COVID19,1238938684101197824,https://twitter.com/USNavyEurope/status/1238938684101197824
2020-03-14 21:22:42,JMessersmith_JH,,3,7,94,"Our office is usually singularly focused on expanding the research enterprise @JohnsHopkins. It was surreal + heartbreaking to begin ramping down research activities today but it’s necessary to protect the community’s safety and health. Full steam ahead with all #COVID19 research",,@JohnsHopkins,#COVID19,1238938630124638208,https://twitter.com/JMessersmith_JH/status/1238938630124638208
2020-03-14 21:22:23,YourMarkLubbers,,4,107,83,"Anonymous Bites Back is live in a few minutes with a new #CoronaVirus special. Guest: Italian Journalist @lorenzodista will report to us about the situation in #Italy. Stream: https://pscp.tv/Anonymousbitesback/1zqKVlprEEdJB … #Anonymous #AnonymousBitesBack #COVIDー19 #Covid19 #Europe",,@lorenzodista,#CoronaVirus #Italy #Anonymous #AnonymousBitesBack #COVIDー19 #Covid19 #Europe,1238938550214758400,https://twitter.com/YourMarkLubbers/status/1238938550214758400
2020-03-14 21:22:13,andrewkimmel,,32,14,171,"Not to be an alarmist, but I can’t stop thinking I’ve already had Covid19. I was in Indonesia for 3 weeks and then Hong Kong for 24 hrs at the end of December. I then became ill for nearly 3 weeks in January w/ all the symptoms. It got so bad, I went to urgent care to get tested.",,,,1238938507722121216,https://twitter.com/andrewkimmel/status/1238938507722121216
2020-03-14 21:22:05,L0gg0l,,4,73,48,"Worrying news from Italy's epicenter in Bergamo: Hospitals have reached full capacity, a burial every half-hour, crematorium works 24 hours a day https://www.ilfattoquotidiano.it/2020/03/14/coronavirus-muore-sindaco-nel-bergamasco-in-citta-e-emergenza-una-sepoltura-ogni-mezzora-sembra-una-guerra-e-il-crematorio-lavora-24-ore-al-giorno/5736518/ … #Covid19",,,#Covid19,1238938474050473986,https://twitter.com/L0gg0l/status/1238938474050473986
2020-03-14 21:21:56,dafrankel,,254,698,3301,"Since last Sunday, I’ve been locked in my study with a dry cough/fever/headache. Despite trying since Monday, I was tested Friday - extended family had same symptoms and tested positive for COVID19 on Wednesday It wasn't been a good week, but it’s given me time to think. /1",,,,1238938437606146049,https://twitter.com/dafrankel/status/1238938437606146049
2020-03-14 21:21:30,GovKemp,,16,80,191,"Important reminder: If a test is negative after experiencing symptoms, that’s not an “all clear.” You could still be contagious with other viruses, so continue to use best practices to keep people safe and prevent the spread of #COVID19 or any other respiratory illness. #gapolpic.twitter.com/fgvuFlXUOU",,,#COVID19 #gapolpic,1238938326289260544,https://twitter.com/GovKemp/status/1238938326289260544
2020-03-14 21:20:09,timrichter,,2,25,156,"I hope the upside of #Covid19 will be an appreciation for the value of public services, the end of blind austerity & seeing paying tax as an important way we look after one another. #cdnpoli",,,#Covid19 #cdnpoli,1238937989637533696,https://twitter.com/timrichter/status/1238937989637533696
2020-03-14 21:18:43,Crawfordmcguff3,,0,19,176,"Witnessing the massive efforts across the whole system preparing a response for COVID19 has been truly humbling. Building teams that could last a clinical lifetime. Supporting patients and staff.",,,,1238937627010707457,https://twitter.com/Crawfordmcguff3/status/1238937627010707457
2020-03-14 21:18:21,RianOCeallaigh,,6,27,199,"Ireland isolation suggestion: Learn/develop your Gaeilge #COVID19 #Ireland",,,#COVID19 #Ireland,1238937537370095617,https://twitter.com/RianOCeallaigh/status/1238937537370095617
2020-03-14 21:16:24,GianlucaPellino,,5,61,162,"A normal Saturday night during #COVID19 in #Barcelona Almost desert streets; people in their houses applaud doctors and health workers... breathtaking thank you!! #YoMeQuedoEnCasa #iorestoacasa #andratuttobene #TodoIraBien #lovespain #SoMe4Surgery #staysafe pic.twitter.com/H2GcjYXcdv",,,#COVID19 #Barcelona #YoMeQuedoEnCasa #iorestoacasa #andratuttobene #TodoIraBien #lovespain #SoMe4Surgery #staysafe,1238937043893456896,https://twitter.com/GianlucaPellino/status/1238937043893456896
2020-03-14 21:16:19,ScottGottliebMD,,57,320,1011,"The approval of #COVID19 tests to run on high throughput systems by Roche and Thermo Fisher is a major expansion in test availability and reflects efforts by the professional staff of FDA's device center to lean into this challenge and advance patient care https://www.statnews.com/2020/03/14/thermo-fisher-to-produce-millions-of-coronavirus-diagnostic-tests/ …",,,#COVID19,1238937023458795527,https://twitter.com/ScottGottliebMD/status/1238937023458795527
2020-03-14 21:15:44,SDG2030,,7,80,224,"Please applaud #Doctors #Nurses #Technicians #MedicalStaff for their selfless dedication to humanity Italians held a nationwide round of applause for are helping fight the #COVID19 @PattyArquette @_PriyankaCRaina @ImRaina @ANANursingWorld @Benioff @bizpic.twitter.com/0QLuTmGQG6",,@PattyArquette @_PriyankaCRaina @ImRaina @ANANursingWorld @Benioff @bizpic,#Doctors #Nurses #Technicians #MedicalStaff #COVID19,1238936876783996929,https://twitter.com/SDG2030/status/1238936876783996929
2020-03-14 21:15:18,claesdevreese,,6,65,200,"I will do my part in the fight against #COVID19. I urge you to do the same! https://staythefuckhome.com #StayTheFuckHome",,,#COVID19 #StayTheFuckHome,1238936769082667011,https://twitter.com/claesdevreese/status/1238936769082667011
2020-03-14 21:14:19,tedlieu,JasonHi16192489,19,57,299,"Mortality rate for swine flu was around .02%. According Dr. Fauci at @NIH, the mortality rate for COVID19 is between 1-2%. That’s a difference of orders of magnitude. That’s why Italy went into lockdown and Spain just followed. This is not about Obama or Trump. It’s about lives.",,@NIH,,1238936519898849280,https://twitter.com/tedlieu/status/1238936519898849280
2020-03-14 21:10:06,marktigheST,boucherhayes,7,24,134,"The HSE should be releasing information about the ages of those affected by #Covid19 as the more real this is the better the chance that people will pay attention to the advice on physical distancing. https://twitter.com/boucherhayes/status/1238904532039589889 …",,,#Covid19,1238935459277004811,https://twitter.com/marktigheST/status/1238935459277004811
2020-03-14 21:09:05,WHO,,14,369,819,"#HealthWorkers, stress and the feelings associated with it are by no means a reflection that you cannot do your job or that you are weak. http://bit.ly/2xDnG7X #COVID19 #coronavirus #MentalHealthpic.twitter.com/IYRGWjOzmJ",,,#HealthWorkers #COVID19 #coronavirus #MentalHealthpic,1238935202568851456,https://twitter.com/WHO/status/1238935202568851456
2020-03-14 21:08:03,MakisMD,ahopeross,5,99,136,"As of today, I can read PET/CT & Nuclear Medicine scans & help free up several full time Radiologists who can put their efforts to reading lung CTs for #COVID19 patients. Instead, @RachelNotley just spent another $100,000 filing her 8th Court Application to silence me on Twitterhttps://twitter.com/ahopeross/status/1238908690624700416 …",,@RachelNotley,#COVID19,1238934945629782017,https://twitter.com/MakisMD/status/1238934945629782017
2020-03-14 21:07:56,xruiztru,,7,96,333,"Right now in Spain: people applauded and cheered to thank doctors and nurses on the front line of this emergency. #COVID19 #COVIDー19pic.twitter.com/cykxFKo9Zh",,,#COVID19 #COVIDー19pic,1238934914072010754,https://twitter.com/xruiztru/status/1238934914072010754
2020-03-14 21:06:59,louiseckenny,,11,101,396,"#COVID19 is an unprecedented challenge to society. We are a civic university & we have always put our city first. To be clear, we are not shutting down- we are going on line. We’ve been working on this for weeks & we are ready. We will see you on Monday! https://news.liverpool.ac.uk/2020/03/14/university-moves-2019-20-classes-online/ …",,,#COVID19,1238934674245910529,https://twitter.com/louiseckenny/status/1238934674245910529
2020-03-14 21:06:42,toorumlk,,9,53,392,"HFJDKKSKAK the most bothersome covid19 precaution is not touching your face with your hands bC IM LITERALLY ALWAYS TOUCHING MY FACE WTFWTWFWGYEYDJSJ IM SO FRUSTRATED i don’t wear makeup for this exact reason i’m",,,,1238934602674253825,https://twitter.com/toorumlk/status/1238934602674253825
2020-03-14 21:05:32,SeeMiaRoll,,3,101,366,"Sobering thought: likely ALL of us will know someone who will be hospitalized by #covid19. Many of us will likely know of someone who will die from it. Stop flaunting your sociability and go home to #SelfIsolate. #CripTheVote #FlattenTheCurve",,,#covid19 #SelfIsolate #CripTheVote #FlattenTheCurve,1238934311585398784,https://twitter.com/SeeMiaRoll/status/1238934311585398784
2020-03-14 21:05:28,ElizabethMay,TheTyee,12,66,160,"That's Green Party policy. And now, in midst of #COVID19 , is time to move on Guaranteed Livable Income. We have to remove fears of falling thru the cracks in crisis. #GuaranteedLivableIncome #GPChttps://twitter.com/TheTyee/status/1238887618479349762 …",,,#COVID19 #GuaranteedLivableIncome #GPChttps,1238934292522102785,https://twitter.com/ElizabethMay/status/1238934292522102785
2020-03-14 21:05:19,SeanCarleton,,0,28,99,"From each according to their ability, to each according to their needs. Social distance does not mean community abandonment. We can share toilet paper, food, and health supplies. It's simple. We are in this together. Let's hold each other up in these times, in all times. #COVID19",,,#COVID19,1238934255884890112,https://twitter.com/SeanCarleton/status/1238934255884890112
2020-03-14 21:05:18,j_mcelroy,,12,60,148,"Here's another chart that might help people understand how B.C. has avoided the worst of #COVID19 so far. This is the daily percentage increase in cases since a country: 1) had at least 20 cases b) started having new cases every day B.C. is in blue. https://www.datawrapper.de/_/9FFV3/ pic.twitter.com/oKUOyqH26b",,,#COVID19,1238934250872655873,https://twitter.com/j_mcelroy/status/1238934250872655873
2020-03-14 21:05:06,Martina,BarryKleiman,29,116,376,"Omg. This is the trump presidency in a nutshell. He has been able to skate and escape everything but not this- one doesn’t lie #COVID19 away…. The worst president in our lifetime to have to deal with something like this… he only follows, he doesn’t lead, playing catch-up… https://twitter.com/BarryKleiman/status/1238921937696354305 …",,,#COVID19,1238934200562180099,https://twitter.com/Martina/status/1238934200562180099
2020-03-14 21:04:39,RepPressley,,163,419,1899,"One vulnerable population that has been ignored during #COVID19 response are the 2.3 million people in prison who are at high risk for virus spreading. Prisons can be incubators for infectious disease. I'll be discussing this & more w/ @TheRevAl shortly on @MSNBC #TuneIn",,@TheRevAl @MSNBC,#COVID19 #TuneIn,1238934086762344452,https://twitter.com/RepPressley/status/1238934086762344452
