date,username,to,replies,retweets,favorites,text,geo,mentions,hashtags,id,permalink
2020-02-21 14:39:42,thomaskaine5,,4,73,80,"Hmm. How does Fed pump up stock prices if banks no longer want to sell them treasuries & buy stocks with $$? (Since 9/19, Fed INDIRECTLY bought $1/2 TRILLION in stocks by buying treasuries from banks who used $$to buy stocks. Corona-virus scare may cut bank's demand for stocks",,,,1230864680429682688,https://twitter.com/thomaskaine5/status/1230864680429682688
2020-02-21 14:37:54,saharwho,,3,78,132,"Corona symptoms, precautions and measurements Share to save lives #كوروناpic.twitter.com/bbWq2r8sFQ",,,#كوروناpic,1230864224630509568,https://twitter.com/saharwho/status/1230864224630509568
2020-02-21 14:36:30,allah_lb,,0,32,232,"Two things are infinite: Nabih Berry and the spreading of Corona Virus. And im not sure about Corona.",,,,1230863875291189248,https://twitter.com/allah_lb/status/1230863875291189248
2020-02-21 14:34:13,tracybeanz,,5,83,145,"Celia took this piece in a really amazing direction, focusing more on the human side of the outbreak: “Love in the Time of Corona” https://uncoverdc.com/2020/02/21/love-in-the-time-of-corona/ … via @CeliaFarber",,@CeliaFarber,,1230863299518005253,https://twitter.com/tracybeanz/status/1230863299518005253
2020-02-21 14:33:46,2dJazz,jiyunaJP,14,67,442,"Theory: The corona virus was bioengineered to destroy the fgc https://twitter.com/jiyunaJP/status/1230815389803667456 …",,,,1230863183914700802,https://twitter.com/2dJazz/status/1230863183914700802
2020-02-21 14:23:28,russian_market,,7,53,75,"TWO NEW CORONA CASES DIAGNOSED IN THE UAE",,,,1230860594070347778,https://twitter.com/russian_market/status/1230860594070347778
2020-02-21 14:17:13,romyjournalist,,9,15,67,"Lebanese Health minister: •She has corona but is in good health (can someone explain this to me?) • Patient arrived from Iran but leb wont stop fights from and to Iran (Iraq already did) A Very competent technocrat and not a Hezb puppet",,,,1230859021244149761,https://twitter.com/romyjournalist/status/1230859021244149761
2020-02-21 14:15:14,ParkYeolove,,2,74,93,"Can we talk about how beautiful this charity song for corona by Yixing is ?? @LayZhang #Yixing #Lay #레이pic.twitter.com/pTW5ZQvTvw",,@LayZhang,#Yixing #Lay #레이pic,1230858523237650432,https://twitter.com/ParkYeolove/status/1230858523237650432
2020-02-21 14:10:24,eliasjescart,,15,53,202,"corona arriving to lebanon effectively ruining any chance of recovery this country still had pic.twitter.com/wauRPhINf4",,,,1230857307313070085,https://twitter.com/eliasjescart/status/1230857307313070085
2020-02-21 14:02:47,georgesabh,,2,11,50,"Me when i heard about corona in Lebanon pic.twitter.com/wQMsaICOCG",,,,1230855390499418113,https://twitter.com/georgesabh/status/1230855390499418113
2020-02-21 13:55:07,bbcweather,,32,281,915,"Some spooky & fun physics going on in Manitoba, Canada! The halos are from the refraction of light by ice crystals in the shape of hexagonal prisms. The diffraction corona around the moon is caused by light getting bent between super-cooled water droplets. pic.twitter.com/XBZ2c1aa50",,,,1230853457877381120,https://twitter.com/bbcweather/status/1230853457877381120
2020-02-21 13:54:12,SolomonYue,HuXijin_GT,78,736,1166,"#coronavirus is made in China & exported to the world. China's coverup of this drop dead virus has killed more Chinese people & earned the title of Emperor Corona's Chernobyl. https://twitter.com/HuXijin_GT/status/1230540360494903296 …",,,#coronavirus,1230853227320446977,https://twitter.com/SolomonYue/status/1230853227320446977
2020-02-21 13:46:41,MyManMap2020,,2,51,28,"The Corona Virus is 100x's Deadlier in China because of Communism! The Communist Leaders have locked citizens in their homes! People do not access to Life Saving Medicine, food, Necessities, etc.. Socialism is the 1st step to Commumism! #VoteThemAllOut2020pic.twitter.com/DdUg8sNeNK",,,#VoteThemAllOut2020pic,1230851335781801984,https://twitter.com/MyManMap2020/status/1230851335781801984
2020-02-21 13:46:25,Abedmoukalled,,1,24,54,"Corona isn’t as scary as it’s being made out to be. Stay safe and spread awareness not fear",,,,1230851268199026688,https://twitter.com/Abedmoukalled/status/1230851268199026688
2020-02-21 13:38:13,95vore,SpringDayKV613,11,5,124,"i think its because of the corona virus, so many factories are shut down :( https://www.wsj.com/articles/chinas-factories-struggle-to-resume-operations-after-virus-shutdown-11581157800 … at least we got posters yaay",,,,1230849206820245504,https://twitter.com/95vore/status/1230849206820245504
2020-02-21 13:31:05,perlaunfiltered,,13,30,122,"who has corona & wants to make out",,,,1230847410143973378,https://twitter.com/perlaunfiltered/status/1230847410143973378
2020-02-21 13:24:34,WalidMRihane,,2,7,36,"The lebanese government calling batoul khalil to help cure the corona cases pic.twitter.com/fOU8ax0FO0",,,,1230845770930302977,https://twitter.com/WalidMRihane/status/1230845770930302977
2020-02-21 13:06:54,MoeedNj,,23,15,115,"Yarris used to be a much smaller car than Corolla, unless it has somehow changed its form. Corolla in 1970's had replaced the bigger Corona! So now Pakistani economy will not let citizens afford a basic Toyota Corolla? https://www.globalvillagespace.com/new-toyota-yaris-to-be-launched-in-pakistan-main-features-price/ …",,,,1230841326025003008,https://twitter.com/MoeedNj/status/1230841326025003008
2020-02-21 12:56:44,skoonheid_a,,1,14,78,"Corona while enterning Rafic al Hariri Airport pic.twitter.com/9ZsN32C95n",,,,1230838767772143619,https://twitter.com/skoonheid_a/status/1230838767772143619
2020-02-21 12:56:11,mperlaa,MissSafadi,6,6,197,"It’s corona season but ok. https://twitter.com/MissSafadi/status/1230703974614831106 …",,,,1230838628571590656,https://twitter.com/mperlaa/status/1230838628571590656
2020-02-21 12:48:32,SolomonYue,IndoPac_Info,28,194,358,"Emperor Corona won't allow his people to use this experimental medication because it is developed by two Taiwanese researchers. https://twitter.com/IndoPac_Info/status/1230826687941636096 …",,,,1230836701846654977,https://twitter.com/SolomonYue/status/1230836701846654977
2020-02-21 12:45:19,HorLevnon,lebanondebate,7,45,170,"Apparently, a Lebanese woman who just got back from Iran has the corona. Not the first disease Iran exports to Lebanon https://twitter.com/lebanondebate/status/1230831692627267584 …",,,,1230835894321602560,https://twitter.com/HorLevnon/status/1230835894321602560
2020-02-21 12:40:43,SupYouFoundJay,,3,33,63,"Just a reminder that the Corona death toll is only 11% compared to 89% recoveries; mainly on China and mainly elders with weak immune systems. In other words, you're probably not gonna die,l even if you catch it, just stay clean. pic.twitter.com/O8PUFobbtA",,,,1230834734403588097,https://twitter.com/SupYouFoundJay/status/1230834734403588097
2020-02-21 12:39:41,memelaxx,SylvioSarkis,1,82,346,"Corona Virus arriving to Lebanon and seeing the economic crisis https://twitter.com/SylvioSarkis/status/1230834022890299393 …",,,,1230834475057262592,https://twitter.com/memelaxx/status/1230834475057262592
2020-02-21 12:30:40,Nadinesutherlan,,9,25,97,"Descendants of Africans should be ultra sensitive in making disparaging broadbrush comments about the people of Chinese descent,specifically during this corona virus issue.Let's not forget we are still fighting to debunk negative beliefs held by some about our people.Just saying!",,,,1230832207897473024,https://twitter.com/Nadinesutherlan/status/1230832207897473024
2020-02-21 12:24:35,AdamCC75,,15,33,47,"Breaking News Is racism spreading faster than the corona virus??.. In New York City, a man assaults a woman wearing a face mask, calling her a ""diseased b****."" On a Los Angeles subway, a man proclaims Chinese people are filthy... CNN https://www.cnn.com/2020/02/20/us/coronavirus-racist-attacks-against-asian-americans/index.html …",,,,1230830674434719744,https://twitter.com/AdamCC75/status/1230830674434719744
2020-02-21 12:15:36,sidhant,,7,19,91,"Just in: No clearance yet by Beijing yet for India's relief assistance to China to deal with Corona virus; Sources say some reluctance by the Chinese side to give clearance"" which authorities in New Delhi are ""unable to figure out"". #WuhanCoronavirus",,,#WuhanCoronavirus,1230828416443785218,https://twitter.com/sidhant/status/1230828416443785218
2020-02-21 12:01:06,DeItaOne,,33,141,285,"IRAN HEALTH MINISTRY OFFICIAL SAYS IT IS POSSIBLE THE NEW CORONA VIRUS EXISTS IN ALL IRANIAN CITIES",,,,1230824765289615360,https://twitter.com/DeItaOne/status/1230824765289615360
2020-02-21 11:45:53,cleopatraaa12,,0,316,123,"(+480, -3) ""Respond now, despite the fact that corona is a global issue, fans have tried to protest. How long are you going to shut your mouth? Stop consumer deception. It's not over here. "" #원잇은_유닛결성_절대포기안해 #Oneits_Never_Giveup_X1Unit @x1official101",,@x1official101,#원잇은_유닛결성_절대포기안해 #Oneits_Never_Giveup_X1Unit,1230820935206203394,https://twitter.com/cleopatraaa12/status/1230820935206203394
2020-02-21 11:41:55,RaoulGMI,,21,72,336,"It feels like the next step for markets is to give up the believe that the Corona Virus is a V-shaped recovery opportunity as it accelerates growth outside of China. Oil bound 10% in the last week or so but is rolling over. If it breaks $45, things are bad. 1/ pic.twitter.com/nSoZGa8Wt1",,,,1230819938539057153,https://twitter.com/RaoulGMI/status/1230819938539057153
2020-02-21 11:33:26,jiyunaJP,,14,71,477,"For everyone concerned about all of the fun events being cancelled in Japan in order to prevent the spread of the Corona Virus; please don't worry, you can still commute on overcrowded trains to Work/School 5 days a week",,,,1230817801562025985,https://twitter.com/jiyunaJP/status/1230817801562025985
2020-02-21 11:32:23,high10sion,,22,348,383,"So because one old lady refused to be tested she exposed and infected a couple hundred people to the corona virus, this the spike in South Korea. The old lady traveled many places in 2 days... pic.twitter.com/7Op5driDFo",,,,1230817540848394240,https://twitter.com/high10sion/status/1230817540848394240
2020-02-21 10:57:49,eliejyacoub,AFPar,11,4,82,"Will corona arrive to Lebanon from Iran? Stay tuned https://twitter.com/AFPar/status/1230804830966423553 …",,,,1230808840612044800,https://twitter.com/eliejyacoub/status/1230808840612044800
2020-02-21 10:45:09,bbcweather,,2,30,104,"Some fun physics going on in Manitoba, Canada last week! The halos are from the refraction of light by ice crystals in the shape of hexagonal prisms. The diffraction corona around the moon is caused by light getting bent between super-cooled water droplets. Pic: Brent McKean pic.twitter.com/it8tgJDOtQ",,,,1230805652211150849,https://twitter.com/bbcweather/status/1230805652211150849
2020-02-21 09:51:01,EmergMedDr,,14,34,158,"Had someone in Corona Pod. 111 'taking responsibility'. No obs. People in waiting room staring at them through door. Eventually they left as they felt so abandoned. This is not what I signed up for. Someone will die. @NHSuk keep saying we are well prepared... #COVIDー19",,@NHSuk,#COVIDー19,1230792030131048448,https://twitter.com/EmergMedDr/status/1230792030131048448
2020-02-21 09:45:04,cherrynoona2_,,21,886,1542,":Mom,it was cancelled :What? :The offline protest tomorrow was cancelled :Why? :Corona's fault,this is so sad :Bi :Ya? :What do u ask every time u pray for X1? :All the best for them :Then God is still looking for when is the best time for them to return",,,,1230790530247753728,https://twitter.com/cherrynoona2_/status/1230790530247753728
2020-02-21 09:30:18,jeongssaem,,75,56,419,"eventhough there's no graduation this year due to corona virus outbreak, still manage to dress up for today (+ dikasih foto studio juga hihi) but still, alhamdulillah, officially master of science, cant believe i manage to survive here for 2 years!!! pic.twitter.com/RBIwva6v2y",,,,1230786816694898688,https://twitter.com/jeongssaem/status/1230786816694898688
2020-02-21 09:09:37,puerto_rojo,,0,15,57,"Americans are skeptic about the unity Chinese people have in each other and their trust in the govt during the corona virus crisis bc we lack unity amongst our own, and have a shared distrust in govt. Our system breeds isolation, making us cynical to unity and trust elsewhere.",,,,1230781611370844161,https://twitter.com/puerto_rojo/status/1230781611370844161
2020-02-21 08:45:20,googyule,,2,119,104,"""The organizer prepared a Corona virus safety strategy such as thermal camera equipment, quarantine, questionnaire preparation, temperature measurement, disinfectant use, mask distribution & emergency team which awaits on the demonstration day."" http://www.xportsnews.com/?ac=article_view&entry_id=1239048 …",,,,1230775498952736768,https://twitter.com/googyule/status/1230775498952736768
2020-02-21 08:43:08,colinmckerrache,,18,53,134,"I think the corona virus impact on the auto sector will be much worse than many realize. My guess: March data will show Q1 global car sales dropped by 10-20%. April earnings season will dent consumer confidence. Heading for biggest annual drop in global car sales in a decade.",,,,1230774944675631104,https://twitter.com/colinmckerrache/status/1230774944675631104
2020-02-21 08:41:24,googyule,,3,1529,1540,"X1 New Group Fan Union ""Protests on 22nd is cancelled due to the spread of Corona 19"" ""The organizer have prepared for two weeks ago & decided to hold a large-scale demonstration"" Please react and comments to this article to show supports. https://sports.donga.com/3/all/20200221/99815217/1 …",,,,1230774511936528385,https://twitter.com/googyule/status/1230774511936528385
2020-02-21 08:39:37,Perpetualmaniac,,5,35,64,"Telegram channel for corona virus updates. Please bookmark this and if social media is shutdown you can still use this to get updates. https://t.me/CoronavirusCentral …",,,,1230774063099830272,https://twitter.com/Perpetualmaniac/status/1230774063099830272
2020-02-21 08:38:49,ImtiazMadmood,,7,23,111,"Of the 27 FATF action points, they have rebuked us on 13. More than half the job is done. China has assured us Pakistan will be removed from grey list if we don't report Corona virus. We told 800 students in China to stay put. Allah is bigger than Corona. ~ PM Imran Khan",,,,1230773859030224897,https://twitter.com/ImtiazMadmood/status/1230773859030224897
2020-02-21 08:30:35,winnerschedules,,1,103,83,"[ANNOUNCEMENT] PLAC by YOU showcase and talk show session on February 28 is cancelled due to corona virus outbreak. https://instagram.com/stories/plac_official/2248590468731730677?igshid=1xj184nd3qkz0 … #WINNER #위너 #강승윤 #송민호 #YOON #MINO @official_yoon_ @official_mino_pic.twitter.com/V1fQ3u99nH",,@official_yoon_ @official_mino_pic,#WINNER #위너 #강승윤 #송민호 #YOON #MINO,1230771786666524672,https://twitter.com/winnerschedules/status/1230771786666524672
2020-02-21 08:26:47,Perpetualmaniac,,5,40,55,"http://Change.org petition to STOP YOUTUBE FROM CENSORING CORONA VIRUS blows past 15,000 signature goal in hours. I signed, please do the same and put @YouTube on notice.https://www.change.org/p/google-lcc-google-is-censoring-legitimate-youtube-videos-about-the-new-coronavirus-in-china?signed=true …",,@YouTube,,1230770832651124738,https://twitter.com/Perpetualmaniac/status/1230770832651124738
2020-02-21 08:20:04,TheKoreaHerald,,9,111,110,"South Korea reports 48 more cases of novel coronavirus, total rises to 204 #COVID19 #Corona #Coronavirus #coronaviruschinahttp://www.koreaherald.com/view.php?ud=20200221000227 …",,,#COVID19 #Corona #Coronavirus #coronaviruschinahttp,1230769139536429056,https://twitter.com/TheKoreaHerald/status/1230769139536429056
2020-02-21 08:09:00,f4iryoun,,4,31,43,"corona and cj are bestfriend when they're in middle school",,,,1230766355416141826,https://twitter.com/f4iryoun/status/1230766355416141826
2020-02-21 08:07:34,_shanmoho,,25,14,148,"Hang on...riddle me this. If you’ve tested POSITIVE for Corona virus while in quarantine....shouldn’t you STAY IN QUARANTINE??? Not be flown, exposing more people (cabin crew, airport, hospital staff etc) to your home states to be quarantined again?",,,,1230765995041517568,https://twitter.com/_shanmoho/status/1230765995041517568
2020-02-21 08:01:51,LarkanviNimra,,5,29,75,"Food delivery to corona patient at the new hospital in China.. Simply amazing and mind blowing pic.twitter.com/BPlNiB1B8H",,,,1230764556453941248,https://twitter.com/LarkanviNimra/status/1230764556453941248
2020-02-21 07:45:24,gentlehyeongjun,,8,444,791,"Cj and corona u guys are secretly married or what",,,,1230760417594466306,https://twitter.com/gentlehyeongjun/status/1230760417594466306
2020-02-21 07:41:04,takiinoue,,0,36,115,"Suzuka motorsport thanksgiving festival in March has been cancelled due to Corona Virus. Hey, what's going on in Japan? Hope get well soon !!!",,,,1230759326022696961,https://twitter.com/takiinoue/status/1230759326022696961
2020-02-21 07:40:34,mindthiskapoor,,12,13,122,"It's been almost a week, me and wife are working from home due to Corona Virus situation. I think we will kill each other before the Virus does ! #from fb",,,#from,1230759199337902080,https://twitter.com/mindthiskapoor/status/1230759199337902080
2020-02-21 07:30:07,MrsNigel,,24,52,231,"Oh dear, our Corona party last night did not go well. After a few too many, Colonel Mustard, Betty and Marjorie took a pedalo out to sea and now Basil the coastguard won’t let them back on shore until they have completed a 14 day quarantine period. pic.twitter.com/lOkIdWDZFT",,,,1230756569710641152,https://twitter.com/MrsNigel/status/1230756569710641152
2020-02-21 07:06:02,exo_schedules,Insight_Since96,1,1174,2387,"INFO | https://twitter.com/Insight_Since96/status/1230732086828359681 … Due to Corona 19, 귀환: 그날의 약속 (The Promise Of The Day) musical stages in Gimhae have been cancelled. Shows: 28th Feb - 1st March #EXO #XIUMIN @weareoneEXO",,@weareoneEXO,#EXO #XIUMIN,1230750509344026625,https://twitter.com/exo_schedules/status/1230750509344026625
2020-02-21 07:05:53,twinkyystar,,2,37,174,"FNC did the correct decision to postpone the fanmeeting looking at the state of corona virus cases in the country, it's worrisome. I mean I'm already here in SK and even so i did expect a postponement when i heard the news",,,,1230750474149621760,https://twitter.com/twinkyystar/status/1230750474149621760
2020-02-21 07:04:16,mylovelywooseok,,1,45,97,"Earlier today I received two alert messages about the corona virus outbreak and maybe that’s why the government is taking serious precautions regarding this issue :(((",,,,1230750067503460358,https://twitter.com/mylovelywooseok/status/1230750067503460358
2020-02-21 07:03:11,paiminshow,gennarojusuf,2,129,286,"This is why corona hates us.",,,,1230749791841243137,https://twitter.com/paiminshow/status/1230749791841243137
2020-02-21 06:59:29,gyulsoo,,8,271,269,"Due to corona virus outbreak in south korea, THE 4TH OFFLINE PROTEST IS CANCELLED TOMORROW. There are now 156 cases of corona virus in korea, postpone the protest is the best solution at the moment. I believe God has the best plan for X1 and One It, we can do it another time!",,,,1230748860785446912,https://twitter.com/gyulsoo/status/1230748860785446912
2020-02-21 06:56:33,chochoseungyoun,X1NewUnit,2,180,164,"They cancelled the protest tomorrow due to Corona Virus Outbreak omg it's heartbreaking cz they've prepared anything ready but still safety first! Let's respect the decision https://twitter.com/X1NewUnit/status/1230742639978278912 …",,,,1230748124064256001,https://twitter.com/chochoseungyoun/status/1230748124064256001
2020-02-21 06:54:29,X1_FANCAFE,,11,649,832,"EVERYONE! PLEASE DON'T BLAME THE KONEITS STAFF WHO PREPARED THIS 4TH PROTEST... THE CORONA VIRUS IS SPREADING IN KOREA. SO LET'S UNDERSTAND. DON'T BLAME @/support_ourboys staff for this. We still have another chance to do this 4th protest. Don't worry and don't give up!",,@,,1230747605497286656,https://twitter.com/X1_FANCAFE/status/1230747605497286656
2020-02-21 06:53:21,WingsForX1,,1,272,463,"We organized the protest two weeks ago and decided to hold a large demonstration as the corona virus seemed to have lulled.",,,,1230747316824367105,https://twitter.com/WingsForX1/status/1230747316824367105
2020-02-21 06:49:36,X1_FANCAFE,,2,299,416,"Tomorrow's offline protest is CANCELLED due to CORONA VIRUS. It's fine as long as everyone is safe. We still have another chance. Cheer up everyone!",,,,1230746372506128385,https://twitter.com/X1_FANCAFE/status/1230746372506128385
2020-02-21 06:49:17,mylovelywooseok,,3,477,469,"Don’t you dare to blame @/support_ourboys staffs for what have happened now. This is something that we don’t expected to be happened and it’s all bcs of that BAD CORONA VIRUS",,@,,1230746294861230080,https://twitter.com/mylovelywooseok/status/1230746294861230080
2020-02-21 06:45:31,iambestb,AsiwajuLerry,4,7,150,"Not even top 3.... Corona virus is a loser",,,,1230745345488867330,https://twitter.com/iambestb/status/1230745345488867330
2020-02-21 06:45:07,GodHanbin131,,3,48,233,"I read that there's already a case of corona virus in Gimpo. I don't know if Hanbin's family lives there or just lives near that area. He has a land there & their store TRY is in Gimpo too. I hope they are ok",,,,1230745248214568963,https://twitter.com/GodHanbin131/status/1230745248214568963
2020-02-21 06:41:46,namdohy0n,,1,97,75,"Health and safety come first before anything. The protest is cancelled due to corona. It's okay. It's okay.",,,,1230744402831663104,https://twitter.com/namdohy0n/status/1230744402831663104
2020-02-21 06:15:20,hyejinjunyoung,,15,241,338,"Got this from my friend who lives in Korea now. ""Korea didn't have many corona virus cases but now it's exploded in numbers because of this crazy Christian cult. They deliberately lied to authorities and are encouraging members to lie and hide. Now the virus is spreading...",,,,1230737751126884352,https://twitter.com/hyejinjunyoung/status/1230737751126884352
2020-02-21 05:51:56,yongshidae_,,1,44,177,"yong: be careful of corona. wear a mask. wash your hands. be careful.",,,,1230731860969263107,https://twitter.com/yongshidae_/status/1230731860969263107
2020-02-21 05:33:12,MX5turn,,2,19,136,"Have some re-edited Corona Mark II wallpapers pic.twitter.com/8UOHQo2noC",,,,1230727147641167874,https://twitter.com/MX5turn/status/1230727147641167874
2020-02-21 05:16:05,laurelchinedu,,19,171,291,"Early this year a virus known as Corona Virus broke out killing many people. Who would have thought that Chloroquine an antimalarial medication that used to itch our body back in those days will now be the cure. This life when is your turn it will come to easily. #FridayThoughts",,,#FridayThoughts,1230722839554052096,https://twitter.com/laurelchinedu/status/1230722839554052096
2020-02-21 05:14:55,V_4_Vendatta,,7,98,72,"CORONA VIRUS TRACED TO THE BRITISH CROWN BILL AND MELINDA GATES NOBODY CAN ESCAPE WHAT IS COMING https://americans4innovation.blogspot.com/2020/01/coronavirus-traced-to-british-crown.html … #DCQStaff #trump2020 @realDonaldTrump @YouMustOvercome @deanomight1 @StormIsUponUspic.twitter.com/BqUXiFiXlo",,@realDonaldTrump @YouMustOvercome @deanomight1 @StormIsUponUspic,#DCQStaff #trump2020,1230722548729434115,https://twitter.com/V_4_Vendatta/status/1230722548729434115
2020-02-21 04:46:06,lotusjuice,,20,199,855,"Beginning to hear n read racism news toward Asians on Corona Virus COVID-19. Who ever thinks all Asians are infected with the virus you are incredibly ignorant and a shame, come on now",,,,1230715292906508288,https://twitter.com/lotusjuice/status/1230715292906508288
2020-02-21 04:07:59,1anti_s,StormIsUponUs,0,33,76,"I agree, Joe. I think the Corona virus story is getting my publisher to do an earlier release then April 14, 2020. PRAY BIG! I genuinely believe I am putting my life at risk with this book. Dr. Jeff Bradstreet was one of my daughter’s doctors and we know what happened to him! pic.twitter.com/fNURhQ85te",,,,1230705702726815744,https://twitter.com/1anti_s/status/1230705702726815744
2020-02-21 03:57:26,crunchy_gowon,,59,1767,7153,"Just a reminder that YG cancelled all their bg events due to safety issues from the Corona Virus, but blackpink will still be performing for their concert. They literally give zero shts about their gg's and they aren't afraid to show it",,,,1230703047367462913,https://twitter.com/crunchy_gowon/status/1230703047367462913
2020-02-21 03:29:37,sydthekid7675,,11,10,135,"Hi guys. Because of the spread of the Corona virus in Daegu, our final week of school is cancelled along with my graduation. I was not sure what to feel at first, but looking at all the work my kids did this year and how much I love them made me extremely sad.",,,,1230696046071648257,https://twitter.com/sydthekid7675/status/1230696046071648257
2020-02-21 03:06:20,tracyalloway,,7,10,74,"For a second, I thought this was Corona rebranding and really leaning into the whole epidemic thing. https://techcrunch.com/2020/02/20/liquid-death-series-a/ …pic.twitter.com/thSoF7nhlo",,,,1230690188621254656,https://twitter.com/tracyalloway/status/1230690188621254656
2020-02-21 03:06:07,lavrntv,,1,4,40,"Mfs be drinking 13 beers every night of the week and worrying about coronavirus, you worried about the wrong corona",,,,1230690134040961025,https://twitter.com/lavrntv/status/1230690134040961025
