date,username,to,replies,retweets,favorites,text,geo,mentions,hashtags,id,permalink
2020-04-04 20:54:48,pepesgrandma,,2,39,39,"Nevada Governor Sisolak Found Hoarding Coronavirus Treatment Drug Just about a week after the Trump hating Democrat Governor of Nevada limited the ability for physicians to prescribe Hydroxychloroquine to treat Corona virus patients. #coronavirushttps://www.newsbreakapp.com/news/0Oeip6Xl/nevada-governor-sisolak-found-hoarding-coronavirus-treatment-drug?docid=0Oeip6Xl&s=ws_tw_o …",,,#coronavirushttps,1246541752883970048,https://twitter.com/pepesgrandma/status/1246541752883970048
2020-04-04 20:53:31,JerryMpiana,,7,56,229,"#vaccine the virus we have is Bill Gates not Corona. Your media have been pay to updates you rubbish about #PandemicCovid19 liespic.twitter.com/vaYKlEBW9a",,,#vaccine #PandemicCovid19,1246541432602705920,https://twitter.com/JerryMpiana/status/1246541432602705920
2020-04-04 20:52:22,toelickbonerjam,,5,35,146,"just found out objects cant get corona virus thank god im a woman",,,,1246541143426371584,https://twitter.com/toelickbonerjam/status/1246541143426371584
2020-04-04 20:51:33,THEBLAKEWEBBER,,4,102,363,"ACTUAL FOOTAGE OF WHERE THE CORONA VIRUS CAME FROM pic.twitter.com/gfkvEyFis1",,,,1246540937766952960,https://twitter.com/THEBLAKEWEBBER/status/1246540937766952960
2020-04-04 20:49:40,fifiharoon,,23,15,66,"Some of you are friends of @sohailanjum who is currently in a London hospital on a ventilator fighting for his life after contracting Corona. Im in touch with his nephew via FB. The sad news is Sohail's mum, who also contracted Corona has passed away. Please say a prayer for her",,@sohailanjum,,1246540463793831937,https://twitter.com/fifiharoon/status/1246540463793831937
2020-04-04 20:49:37,EinatWilf,,10,19,152,"B.C Before Corona A.C After Corona The new timeline of our lives?",,,,1246540450527395841,https://twitter.com/EinatWilf/status/1246540450527395841
2020-04-04 20:49:22,TransalpinoO,,14,73,560,"Liverpool FC @LFC have sold their tickets in advance for the season, they are still selling merchandise, pay your workers will yer! @PeterMooreLFC If Any of our followers think we support FSGs stance feel free to unfollow and stop tagging us to score Corona points.",,@LFC @PeterMooreLFC,,1246540386744643585,https://twitter.com/TransalpinoO/status/1246540386744643585
2020-04-04 20:48:35,kwadwosheldon,,175,437,3150,"Shatta brought his personal Doctor to talk to Ghanaians about Corona virus..Your MCM is organizing battles for obi man so! We stan Nima Buju Banton!",,,,1246540188068859906,https://twitter.com/kwadwosheldon/status/1246540188068859906
2020-04-04 20:47:33,jcourtsull,,6,15,233,"Out for a hike. Just crossed paths with a guy who warned us about ticks. “No one likes Corona with Lyme,” he said. Granted I’ve been trapped inside for a long time, but I found that pretty darn amusing.",,,,1246539929779200000,https://twitter.com/jcourtsull/status/1246539929779200000
2020-04-04 20:47:02,ValaAfshar,,19,249,481,"This gives you an idea how many layers of protection doctors must protect themselves everyday from the corona virus. https://twitter.com/AMAZlNGSCIENCE/status/1244283402750013442/video/1 …",,,,1246539798497591296,https://twitter.com/ValaAfshar/status/1246539798497591296
2020-04-04 20:46:46,cblackst,TheDailyShow,5,24,68,"What makes this non-journalism even more repugnant is that the median age of a Fox Network viewer is 65 meaning their audience is at the most risk of corona. They should be held accountable. https://twitter.com/TheDailyShow/status/1246146713523453957 …",,,,1246539731472732167,https://twitter.com/cblackst/status/1246539731472732167
2020-04-04 20:46:29,missingskep,,3,17,88,"pov: you are skeppy and you're at the trio reunion but you dont want corona pic.twitter.com/9T7HUpy51C",,,,1246539662837022725,https://twitter.com/missingskep/status/1246539662837022725
2020-04-04 20:46:21,dwnews,,43,80,162,"A couple has named their newborn twins ""Corona"" and ""Covid"" amid the lockdown in India. https://p.dw.com/p/3aSJX",,,,1246539629429321728,https://twitter.com/dwnews/status/1246539629429321728
2020-04-04 20:46:04,cousinjuIes,,2,4,53,"if lady bird took place in 2020 she would be losing her virginity while kyles watching corona virus briefings on tv",,,,1246539555878158337,https://twitter.com/cousinjuIes/status/1246539555878158337
2020-04-04 20:43:32,TristonMarez,,3,12,140,"I should be blaming a hungover today on Terrell Texas and @RandallKingBand but corona... we’ll be back @silver_saloon",,@RandallKingBand @silver_saloon,,1246538919057010688,https://twitter.com/TristonMarez/status/1246538919057010688
2020-04-04 20:43:30,WeHo_1985,kylegriffin1,15,36,266,"Trump is the WORST president in U.S. history. He knew about Corona virus. He knew it was coming. They had the facts. The writing was on the wall. He chose to not act. He chose to not prepare our country. He chose to let down the American people and jeopardize millions of lives.",,,,1246538910165057537,https://twitter.com/WeHo_1985/status/1246538910165057537
2020-04-04 20:42:15,kamaalrkhan,,129,56,947,"I was having 2000+ phone numbers in my phone and thanks to #Corona that I got time to delete 800 numbers today. I can’t believe that I was having numbers of biggest flop ppl like Raima Sen and Ria Sen. Unbelievable!",,,#Corona,1246538597324541952,https://twitter.com/kamaalrkhan/status/1246538597324541952
2020-04-04 20:40:56,ughhkookie,quenblackwell,1,9,206,"corona.... i ain't ready to fight kpop stans anime stans and gamers all in real life",,,,1246538262572761088,https://twitter.com/ughhkookie/status/1246538262572761088
2020-04-04 20:40:53,drag0nccc,quenblackwell,2,3,237,"Corona,, cinna died for the hunger games nd he was the best ngl",,,,1246538250895810560,https://twitter.com/drag0nccc/status/1246538250895810560
2020-04-04 20:40:17,MojoMoomey,,0,13,25,"Corona Virus Coping Meeting Notes from last night #BoomRadio @Hurricane_Stacy @Littleelvis40 @CateDailyBoom @MikeDeAngelis @OuchYOMH @HammerDownHard1 @SIOLoudcast @BrexleyReese @RealTommyAlaska @tcgigliotti @italiajohnny85 @johnpopevil @_Lypswitch_ @deesnider @MercuryRisingUKpic.twitter.com/e92HSqo1pK",,@Hurricane_Stacy @Littleelvis40 @CateDailyBoom @MikeDeAngelis @OuchYOMH @HammerDownHard1 @SIOLoudcast @BrexleyReese @RealTommyAlaska @tcgigliotti @italiajohnny85 @johnpopevil @_Lypswitch_ @deesnider @MercuryRisingUKpic,#BoomRadio,1246538100341432331,https://twitter.com/MojoMoomey/status/1246538100341432331
2020-04-04 20:40:06,quenblackwell,,476,962,23252,"okay I’m bored so would you rather the hunger games existing or corona?",,,,1246538054870933504,https://twitter.com/quenblackwell/status/1246538054870933504
2020-04-04 20:38:29,heidiblakeley,,1,18,48,"just found out the corona virus can’t infect objects. what a time to be a woman! amiright ladies",,,,1246537646844850179,https://twitter.com/heidiblakeley/status/1246537646844850179
2020-04-04 20:38:25,SiyaMtitshana,,3,10,41,"The vaccine for Corona Virus must be first tested with Bill Gates’ family, Trevor Noah, Cyril Ramaphosa and his cabinet as well as some freedom fighters who are quiet now. pic.twitter.com/PqaYERKALP",,,,1246537633045635073,https://twitter.com/SiyaMtitshana/status/1246537633045635073
2020-04-04 20:38:03,lildessi_,,4,16,40,"This corona shit is getting serious so if we ever had beef or a problem I just wanna say fuck you from the bottom of my heart",,,,1246537539755761669,https://twitter.com/lildessi_/status/1246537539755761669
2020-04-04 20:37:56,SenDonPius,,7,13,90,"No body is forcing you to agree with Pastor Chris' view on Corona virus, the 5G network and the totalitarian agenda of a few power individual across the world. If you are a Christian and you read your Bible very well, you will know that all that is happening points to rapture.",,,,1246537510584541190,https://twitter.com/SenDonPius/status/1246537510584541190
2020-04-04 20:37:34,CandyCornball,,2,3,50,"me: focus on your activities today, sis. we have things to do also me: i cannot believe the NYC government told us to masturbate in case we get horny during corona. i mean, yeah, that makes sense, but WHAT A WORLD. yall put that on official letterhead. mood.",,,,1246537417202511872,https://twitter.com/CandyCornball/status/1246537417202511872
2020-04-04 20:36:59,_Mhlava,CyrilRamaphosa,2,6,11,"Why focus of Africa? [Thread] Europeans and USA are dying daily from Corona Virus This reminds me of how Colonization started since it did not take place from friendship arrangements, It was evil and well planned. Hence the vaccine testing also. #TshamaKayahttps://twitter.com/CyrilRamaphosa/status/1246452035022700548 …",,,#TshamaKayahttps,1246537268921319424,https://twitter.com/_Mhlava/status/1246537268921319424
2020-04-04 20:36:48,TWEETORACLE,,24,38,65,"According to @CNN, The total number of Confirmed #COVIDー19 cases in the USA has now exceeded 300,000 with 8,162 deaths. The total worldwide case of Corona Virus Infections stand shockingly at 1,181,825 with 63,902 deaths. May GOD heal the world !",,@CNN,#COVIDー19,1246537223287312385,https://twitter.com/TWEETORACLE/status/1246537223287312385
2020-04-04 20:34:41,Mohamadlapai,,8,38,65,"Benue fails lone COVID-19 patient; FG takes over, moves Susan Okpe to Abuja https://kaftanpost.com/benue-fails-lone-covid-19-patient-fg-takes-over-moves-susan-okpe-to-abuja/ … @tfx47 I'm so happy for her, the Ortomatic treatment in Benue is worst than Corona itself",,@tfx47,,1246536689746657281,https://twitter.com/Mohamadlapai/status/1246536689746657281
2020-04-04 20:34:38,Vainness__,,0,25,30,"Jersey City has the most corona cases and y’all still out here shooting niggas. Y’all are ruthless fr.",,,,1246536678782763017,https://twitter.com/Vainness__/status/1246536678782763017
2020-04-04 20:34:36,danny_jacques1,,1,3,30,"All i wanna say is if corona shuts down snowcone places I’m gonna riot that is where i draw the line",,,,1246536669420867585,https://twitter.com/danny_jacques1/status/1246536669420867585
2020-04-04 20:34:04,PolitiekBIJ1,,2,16,27,"The Dutch government has neglected its responsibility towards the Caribbean part of the Kingdom for years and is even presenting demands in return for support during the corona crisis. The islands must be regarded as equal. Solidarity can save lives. http://www.bij1.org/articles/ook-de-coronacrisis-is-geen-excuus-voor-neokolonialisme …",,,,1246536537220820996,https://twitter.com/PolitiekBIJ1/status/1246536537220820996
2020-04-04 20:33:50,WayneDupreeShow,,4,20,43,"This is wild...Weddings ""Corona-style"" https://www.waynedupree.com/michigan-cardboard-wedding/ …",,,,1246536476524974081,https://twitter.com/WayneDupreeShow/status/1246536476524974081
2020-04-04 20:32:50,lesshumbleteej,BreitbartNews,5,35,54,"Saying this during Trump’s handling of corona is such a wild thing to say frfr https://twitter.com/BreitbartNews/status/1246444551897833472 …",,,,1246536225550286853,https://twitter.com/lesshumbleteej/status/1246536225550286853
2020-04-04 20:32:39,CastlesWay,,1,41,70,"It’s crazy the amount of people that hit me up telling me they have corona virus and asking what to do. For those scared to hit me, if your young they won’t keep you in the hospital unless your going into respiratory failure (which most likely you won’t).Treat the symptoms @home",,@home,,1246536178217766913,https://twitter.com/CastlesWay/status/1246536178217766913
2020-04-04 20:32:00,TimesNow,,5,9,63,"The 21-day lockdown ends on April 15th. PM @narendramodi takes stock of Corona war & urges states to draw an 'exit plan' but experts are divided on the next step. Join Rahul Shivshankar on INDIA UPFRONT SPL EDITION at 1 PM today. | #MegaLockdownDebatepic.twitter.com/BcWLif438J",,@narendramodi,#MegaLockdownDebatepic,1246536015331770368,https://twitter.com/TimesNow/status/1246536015331770368
2020-04-04 20:31:39,UltraRaw26,,4,438,1581,"""There you go, Little Shits!"" #Corona #coronavirus #AntMan #Marvel #MarvelStudios pic.twitter.com/lZyWfJd4IM",,,#Corona #coronavirus #AntMan #Marvel #MarvelStudios,1246535930401263616,https://twitter.com/UltraRaw26/status/1246535930401263616
2020-04-04 20:30:28,JonnyBlack93,,0,2,27,"If corona virus was a guy. pic.twitter.com/lCTuAqKaBI",,,,1246535630252920832,https://twitter.com/JonnyBlack93/status/1246535630252920832
2020-04-04 20:30:25,MandyHubbard,,23,2,188,"Please meet Corona and Noice. I’ve always wanted bottle goats but usually too much is going on.... but hey that’s not a problem these days. pic.twitter.com/917Hdugjgi",,,,1246535617778835456,https://twitter.com/MandyHubbard/status/1246535617778835456
2020-04-04 20:30:04,AmanGurdov,,8,8,30,"Here is why Turkmenistan doesn’t have corona virus. Explained by Turkmenistan President. #Turkmenistan #COVID2019pic.twitter.com/scSfoJTZDN",,,#Turkmenistan #COVID2019pic,1246535528129929218,https://twitter.com/AmanGurdov/status/1246535528129929218
2020-04-04 20:29:29,AIAseanjacoby,Breaking911,2,5,121,"@rlopezcjr he is not talking about the corona virus",,@rlopezcjr,,1246535382360920064,https://twitter.com/AIAseanjacoby/status/1246535382360920064
2020-04-04 20:26:51,pureodiasaswata,,0,6,18,"Ready To Turn Off And Turn On ? 9PM 9 Minutes Corona Warriors #9pm9minutespic.twitter.com/zQJTh1JZWD",,,#9pm9minutespic,1246534718461485062,https://twitter.com/pureodiasaswata/status/1246534718461485062
2020-04-04 20:25:18,abdbozkurt,,6,60,48,"EU & @NATO bashing continues on a Turkish TV, owned by President #Erdogan, while regime propagandists portraying neighboring #Bulgaria as vassal state of #Turkey. One depicting Bulgarian Prime Minister as begging Turkish border province governor for a mask. #Corona. pic.twitter.com/GvQrL7m12E",,@NATO,#Erdogan #Bulgaria #Turkey #Corona,1246534331478269961,https://twitter.com/abdbozkurt/status/1246534331478269961
2020-04-04 20:25:03,littllemel,,5,34,88,"POTUS 4/4/20 Corona Brief: “There will be a lot of death... There will be death” Brief started at 4:16pm EST Q416 You have no idea how sick and evil these people are. Fight, fight, fight. Day of days. Game over. Q pic.twitter.com/ZCuas1QUuY",,,,1246534267338919939,https://twitter.com/littllemel/status/1246534267338919939
2020-04-04 20:24:34,StevenKwak1,,0,20,89,"My 65 year old cancer survivor mother (immunocompromised) now has to nurse at a hospital exponentially being taken over by corona because people can’t just not party for a few weeks. This is bigger than your night out",,,,1246534146777911296,https://twitter.com/StevenKwak1/status/1246534146777911296
2020-04-04 20:24:04,RyherdPhyllis,,8,13,23,"I wonder what the normal daily death rate was in New York before the virus and how many normal deaths are in New York now, which are not counting the Corona Virus?",,,,1246534021426839552,https://twitter.com/RyherdPhyllis/status/1246534021426839552
2020-04-04 20:23:57,Karosin_,,1,12,41,"Norbert Elekes calculating Corona Positive cases everyday pic.twitter.com/i5y2jK5duw",,,,1246533989294366720,https://twitter.com/Karosin_/status/1246533989294366720
2020-04-04 20:22:42,HeleneBismarck,,3,8,106,"A good friend very unexpectedly lost his mother. Not to Corona. The crisis means that there cannot be a memorial service, that his friends and extended family cannot see&console him. Thinking of the many people who are now forced to grieve in isolation.",,,,1246533676667715585,https://twitter.com/HeleneBismarck/status/1246533676667715585
2020-04-04 20:22:17,goodyweaver,,21,65,342,"Lol... watching clips from Bill Maher from last night, and Bill just said he's not that worried about Corona because Tom Hanks is the same age as him and he's doing ok. These rich people... they really have no idea...",,,,1246533569725575168,https://twitter.com/goodyweaver/status/1246533569725575168
2020-04-04 20:22:11,castaneda_yuli,,1,62,98,"We all need to have the mindset of “what if I’m carrying corona right now” and act like it. Because if you really are carrying it, you won’t have a single symptom for DAYS. (1/7)",,,,1246533546312740864,https://twitter.com/castaneda_yuli/status/1246533546312740864
2020-04-04 20:21:32,officerdaddo,,14,18,474,"My dad is a super chill dude. Unshakeable. Never freaks out. He’s also a doctor. The fact that he’s constantly calling and texting me to make sure I don’t have corona symptoms and am taking precautions says to me all I need to know about the gravity of this pandemic.",,,,1246533380918988800,https://twitter.com/officerdaddo/status/1246533380918988800
2020-04-04 20:20:06,Mayorspeaks,,5,20,40,"After this Corona Virus lockdown, a lot of small scale businesses will be non-existent, because the meager capital has been used for feeding. It's sadden that microfinance banks would enslave some traders that have obtain loans without even knowing the meaning of interest.",,,,1246533020187856903,https://twitter.com/Mayorspeaks/status/1246533020187856903
2020-04-04 20:20:03,sexhaver4200,,12,70,319,"we must Find a cure for the corona violence",,,,1246533007248367617,https://twitter.com/sexhaver4200/status/1246533007248367617
2020-04-04 20:19:51,Kingfreespeech,,2,39,46,"The Democrat News & politicians who are politicizing & fear mongering over the Corona Virus are the ones who are making it clear they don’t see it as a real Crisis. No one who loves America & Americans would spend their time doing that instead of encouraging & helping Americans.",,,,1246532958720274434,https://twitter.com/Kingfreespeech/status/1246532958720274434
2020-04-04 20:19:29,UnclePamilerin,MaziIbe_,3,2,108,"Let corona end first",,,,1246532867582296064,https://twitter.com/UnclePamilerin/status/1246532867582296064
2020-04-04 20:18:46,Stan_Subru,,2,10,32,"So am now avoiding Shee leave alone Corona. My Gaaad...",,,,1246532686770057224,https://twitter.com/Stan_Subru/status/1246532686770057224
2020-04-04 20:18:35,ethanj10_,,1,12,82,"the only ones who can stop corona pic.twitter.com/Dq1aCUWJ2G",,,,1246532638724194304,https://twitter.com/ethanj10_/status/1246532638724194304
2020-04-04 20:16:47,pew_laser,,1,6,66,"I miss a good burger. Please cure the corona faster so my burger joints can open again. pic.twitter.com/SLAYNLjkrK",,,,1246532185139658752,https://twitter.com/pew_laser/status/1246532185139658752
2020-04-04 20:15:26,SalmanNizami_,,4,40,59,"Fake News 3: Muslims sneezing in Unison to spread Corona - https://thelogicalindian.com/fact-check/covid19-muslim-sneeze-delhi-hazrat-nizamuddin-mosque-20436 … Fake News 4: Fake whatsapp videos led to attack on health team in Indore - https://indianexpress.com/article/coronavirus/indore-coronavirus-video-mob-attacks-health-officials-6343475 …",,,,1246531847997145088,https://twitter.com/SalmanNizami_/status/1246531847997145088
2020-04-04 20:14:57,SalmanNizami_,,101,514,825,"Thread; 10 fake/old videos shared by Islamophobics to defame Indian Muslims over Coronavirus. Fake News 1: Muslim man spitting on fruits to spread Corona - https://www.thequint.com/news/india/man-spitting-on-fruits-held-in-madhya-pradesh-raisen-viral-video-as-old-as-16-february … Fake News 2: Muslims licking utensils to spread Corona - https://www.altnews.in/old-unrelated-video-shared-as-muslims-licking-utensils-to-spread-coronavirus-infection/ …",,,,1246531726949539840,https://twitter.com/SalmanNizami_/status/1246531726949539840
2020-04-04 20:14:27,SelimSeesYou,,11,19,95,"So how do I join one of those Corona Chan cults? I wanna pay my respects. pic.twitter.com/yXIV3joJ2V",,,,1246531599883214849,https://twitter.com/SelimSeesYou/status/1246531599883214849
2020-04-04 20:14:11,kenobiology,,0,26,79,"my last two braincells as we prepare to enter week 3 of corona quarantining pic.twitter.com/lIZx82QYKk",,,,1246531532745048066,https://twitter.com/kenobiology/status/1246531532745048066
2020-04-04 20:14:00,Repr00f,LucasFoxNews,1,6,30,"This story was reported by FOX NEWS, so as expected, reported in a misleading way. The patients were NOT covid patients. They were other patients who tested positive for corona only after being on ship - perhaps if there were MORE TESTS it wouldn't have happened.",,,,1246531485756203011,https://twitter.com/Repr00f/status/1246531485756203011
2020-04-04 20:13:52,TheSagachristos,,2,16,16,"If you believe that 5G and corona nonsense I put it to you that you don't have sense.",,,,1246531453904715777,https://twitter.com/TheSagachristos/status/1246531453904715777
2020-04-04 20:13:33,Hazem_F,,3,7,37,"LA before and after Corona. Now we just have to avoid the vaccines. . . Look for my upcoming videos. Today I had to stop my research. It had me depressed. Sometime this week, I’ll be doing videos to connect the dots for you. pic.twitter.com/xh9OBbut5N",,,,1246531371625000962,https://twitter.com/Hazem_F/status/1246531371625000962
2020-04-04 20:11:42,YonSolitary,MrsC_Assange,3,31,34,"UK RELEASES CONVICTED CRIMINALS UK REFUSES TO RELEASE JULIAN #ASSANGE from CORONA infested Prison. He's ON REMAND UN SR on TORTURE & >200 Doctors WARN he's FRAIL, has WEAK LUNGS & COULD DIE @MarisePayne @ScottMorrisonMP Your COMMITMENT to AUSTRALIAN SOVEREIGNTY is at TEST herehttps://twitter.com/MrsC_Assange/status/1246467974308835330 …",,@MarisePayne @ScottMorrisonMP,#ASSANGE,1246530906614980608,https://twitter.com/YonSolitary/status/1246530906614980608
2020-04-04 20:10:49,FAMEKILLED,,4,11,86,"corona doctor in her office while other celebs announce her cover pic.twitter.com/u5kr42SDjw",,,,1246530683448811527,https://twitter.com/FAMEKILLED/status/1246530683448811527
2020-04-04 20:10:38,SalmanNizami_,,16,44,102,"THREAD: 10 fake/old videos shared by Islamophobics to defame Muslims over Coronavirus. Fake News 1: Muslim man spitting on fruits to spread Corona - https://www.thequint.com/news/india/man-spitting-on-fruits-held-in-madhya-pradesh-raisen-viral-video-as-old-as-16-february … Fake News 2: Muslims licking utensils to spread Corona - https://www.altnews.in/old-unrelated-video-shared-as-muslims-licking-utensils-to-spread-coronavirus-infection/ …",,,,1246530637932015616,https://twitter.com/SalmanNizami_/status/1246530637932015616
2020-04-04 20:10:27,dancohen3000,,13,32,187,"The Corona virus crisis has led me to take growing food more seriously. Weening ourselves off of fragile global supply chains can insulate from disruptions. Hopefully I’ll be able to supplement my and my neighbor’s produce supply. pic.twitter.com/bJHmg122rC",,,,1246530591639646208,https://twitter.com/dancohen3000/status/1246530591639646208
2020-04-04 20:10:04,3ohBlack,,9,17,58,"Y’all needa take this corona shit serious...my uncle died from it and my pops in the hospital isolated on a breathing machine",,,,1246530498270240769,https://twitter.com/3ohBlack/status/1246530498270240769
2020-04-04 20:09:34,aimadnet,,9,8,36,"li3ndo Linux w bgha i7di stats dyal corona I made this small script pic.twitter.com/2b34lfKDJB",,,,1246530372999032834,https://twitter.com/aimadnet/status/1246530372999032834
2020-04-04 20:09:27,ReubsT_,,1,51,113,"Corona is taking lives more and more but ppl still wanna do link ups in the park, twats",,,,1246530340698624001,https://twitter.com/ReubsT_/status/1246530340698624001
2020-04-04 20:09:21,tayyrainn,,0,12,89,"This nigga said “you were on quarantine even before corona, when tf ima see you”",,,,1246530318166867969,https://twitter.com/tayyrainn/status/1246530318166867969
2020-04-04 20:09:12,Ibraheemsmuhd,,32,358,1106,"I don’t understand why they’re not testing this vaccines in Italy, the epicenter of this corona virus and they want to test them on Africans. We are not lab rats. Go to Italy or where the virus comes from. Africa is not a jungle! #AfricansAreNotLabRats #vaccinepic.twitter.com/bCeXkxV43f",,,#AfricansAreNotLabRats #vaccinepic,1246530277024948225,https://twitter.com/Ibraheemsmuhd/status/1246530277024948225
2020-04-04 20:06:37,samanders4,WEfocusUSA,2,7,139,"of course intentional! i'm in europe and know Comfort is NOT for corona patients",,,,1246529627532808198,https://twitter.com/samanders4/status/1246529627532808198
2020-04-04 20:04:45,dhh,,92,26,1356,"I haven’t had long hair since ~1988. I’m pretty sure corona is going to bring this back in style. Maybe even bandanas too?!? pic.twitter.com/sn69b4Mx9f",,,,1246529157141413891,https://twitter.com/dhh/status/1246529157141413891
2020-04-04 20:04:14,maryjessmusic,,1,8,28,"Throwback to when I met the gorgeous girls of @voiceswithsoul while on tour with @G4Official! These girls are so much fun, really hoping we can all share the stage again when this corona-craziness is over! . . . #voiceswithsoul #g4 #throwback #singers #singing #sopranopic.twitter.com/TBPDo5ZczM",,@voiceswithsoul @G4Official,#voiceswithsoul #g4 #throwback #singers #singing #sopranopic,1246529030716825606,https://twitter.com/maryjessmusic/status/1246529030716825606
2020-04-04 20:04:06,straturka,,3,33,74,"#Corona #COVID19 report #Turkeypic.twitter.com/io6uuUcDuo",,,#Corona #COVID19 #Turkeypic,1246528994540953605,https://twitter.com/straturka/status/1246528994540953605
2020-04-04 20:03:58,jjbadluck,,0,10,29,"This corona shit ain't gonna end cuz people are still throwing parties and having huge gatherings and putting it all on snapchat.",,,,1246528960403574784,https://twitter.com/jjbadluck/status/1246528960403574784
2020-04-04 20:03:37,WolfPupTK,,1,17,18,"Charity stream 1-5 PM PST! Fundraising for @GlobalGiving's Corona Virus Relief efforts! Streaming with @RainCoug and @ScatterplotDog! Steam, schedule, and donation info all here:https://tiltify.com/@letsplaytk/ffl-corona-virus-relief …",,@GlobalGiving @RainCoug @ScatterplotDog @letsplaytk,,1246528873329639424,https://twitter.com/WolfPupTK/status/1246528873329639424
2020-04-04 20:03:34,lasizwe,,649,82,1909,"Predict a date on when you think this whole corona pandemic will come to an end.",,,,1246528861644500995,https://twitter.com/lasizwe/status/1246528861644500995
