date,username,to,replies,retweets,favorites,text,geo,mentions,hashtags,id,permalink
2020-02-22 23:54:28,PlayoffCeltics,,2,2,23,"haven’t heard much about corona lately. did y’all finish off the bottle?",,,,1231366678627393536,https://twitter.com/PlayoffCeltics/status/1231366678627393536
2020-02-22 23:46:29,VickieLouise7,GaryRivers18,1,12,28,"The cost of being swindled at the 2019 election is incalculable given the consequences of this weak economy & catastrophic bushfires as well as mismanagement of corona virus.",,,,1231364671271096321,https://twitter.com/VickieLouise7/status/1231364671271096321
2020-02-22 23:32:01,PeterSweden7,,8,43,141,"Italy is literally throwing in the kitchen sink to curb the Corona outbreak here.",,,,1231361027314536448,https://twitter.com/PeterSweden7/status/1231361027314536448
2020-02-22 23:20:19,SiavoushF,,5,8,80,"The corona virus emergency, the suspended games in Italy and the euro's coming up in June. Not sure Italy will manage to cope with all this",,,,1231358082992820224,https://twitter.com/SiavoushF/status/1231358082992820224
2020-02-22 23:18:25,celine__tinista,,0,4,31,"At the meet and feet: don’t touch her, don’t hug her don’t do anything. LIKE WTF CALM DOWN I DONT HAVE CORONA VIRUS",,,,1231357605626470401,https://twitter.com/celine__tinista/status/1231357605626470401
2020-02-22 23:06:11,PeterSweden7,,324,1982,4224,"Oh boy. I'm only 1.5 hours away from the latest Corona virus outbreak here in Italy. People are not allowed to enter or leave affected areas. Towns are in lockdown. Schools and shops are shut down. I've stacked food, supplies, face masks and gloves today. It's happening",,,,1231354528840200197,https://twitter.com/PeterSweden7/status/1231354528840200197
2020-02-22 23:04:26,InsiderFood,,2,33,87,"Lemon Ice King of Corona is the most legendary Italian-ice shop in NYC pic.twitter.com/GXQWJ9FBu1",,,,1231354086018240513,https://twitter.com/InsiderFood/status/1231354086018240513
2020-02-22 22:42:43,SelOnTheBrain,,13,23,270,"She really paired the corona and lime song with this post..... pic.twitter.com/sb2BCG2tpr",,,,1231348621028671488,https://twitter.com/SelOnTheBrain/status/1231348621028671488
2020-02-22 22:33:54,SiavoushF,,13,80,201,"Inter - Sampdoria tomorrow seems to be suspended due to the Corona virus outbreak in Milan",,,,1231346401839386636,https://twitter.com/SiavoushF/status/1231346401839386636
2020-02-22 22:16:04,Mdais,,0,12,18,"Anyone who has been in contact with a Corona patient or someone who is suspected of being infected with the virus, and who has symptoms such as fever, cough, or other respiratory symptoms, should call the MDA 101 #Emergency Call Center.pic.twitter.com/C0ngGi55Mh",,,#Emergency,1231341915129491456,https://twitter.com/Mdais/status/1231341915129491456
2020-02-22 22:08:27,Joeingram1,,92,4,167,"Will the Corona Virus potentially impact this years WSOP in Vegas??",,,,1231339996457529344,https://twitter.com/Joeingram1/status/1231339996457529344
2020-02-22 21:50:44,XRays_Insider,1981MediaLtd,28,43,187,"The Mayor of Boston say: ""Sony you are liars, you are scared by Microsoft, not by Corona virus"" https://twitter.com/1981MediaLtd/status/1231332305060405251 …",,,,1231335540487806976,https://twitter.com/XRays_Insider/status/1231335540487806976
2020-02-22 21:49:40,a_r_1ta,,0,8,32,"The Iranian people have very little chance of surviving the corona virus! Please take action before a human disaster occurs @WHO #HelpIranCoronaWHO",,@WHO,#HelpIranCoronaWHO,1231335272735965186,https://twitter.com/a_r_1ta/status/1231335272735965186
2020-02-22 21:46:26,Giorgiyo,,1,4,18,"Mom is selling Masks for corona 4 for 1,000LL at Pharmacie Meridien Sed l Bawchrieh. Go Buy it there.",,,,1231334457455415296,https://twitter.com/Giorgiyo/status/1231334457455415296
2020-02-22 21:44:17,AyarFreedom1,,3,3,37,"Just think about a serious relationship with corona virus and it will run away.",,,,1231333915039850507,https://twitter.com/AyarFreedom1/status/1231333915039850507
2020-02-22 21:38:04,rottenbanana101,WarRoom2020,5,83,66,"My intuition tells me it’s a little to coincidental that in all of China ( millions of sq. miles ) just by chance ground zero for this pandemic is a few miles from the Chinese militaries Level 4 bio lab where they experiment with Corona viruses . Bat soup uuummm ? https://twitter.com/WarRoom2020/status/1230926463051931650 …",,,,1231332351868915713,https://twitter.com/rottenbanana101/status/1231332351868915713
2020-02-22 21:36:11,lyoneyama,,0,5,19,"One Jpn expert suggests on TV, best way to stop the corona virus spread is not necessarily quarantine (and sacrifice) but ""stoppage"" of all economic activities. But this capitalism cannot. Reminded me of Walter Benjamin: ""That things 'just keep on going' is the catastrophe.""",,,,1231331878373904389,https://twitter.com/lyoneyama/status/1231331878373904389
2020-02-22 21:23:48,Baaalllllaaaeee,,0,16,25,"#IRDetainees @realDonaldTrump #Coronavirus in #Iran is extremely prevalent, please give an aid to Iranian people, while people are suffering from #corona Iranian terrorist authorities are executing detainees of November protests, humanitarian catastrophe has taken place in Iran",,@realDonaldTrump,#IRDetainees #Coronavirus #Iran #corona,1231328763922640896,https://twitter.com/Baaalllllaaaeee/status/1231328763922640896
2020-02-22 21:15:56,txtkilI,EVERGLOW_STAFF,4,45,206,"the fact that antis are dragging everglow cause of this even tho over a thousand suspected corona cases were revealed in sk literally yesterday is sad and inconsiderate https://twitter.com/EVERGLOW_STAFF/status/1231190848399765507 …",,,,1231326781694791680,https://twitter.com/txtkilI/status/1231326781694791680
2020-02-22 21:13:31,ACEYEEUN,,6,83,410,"all jokes aside, Everglow’s fansign was so empty because of the sudden increase of corona cases in Korea. ALL their other fansign events were literally full. pic.twitter.com/UG70N5BHXx",,,,1231326174581751809,https://twitter.com/ACEYEEUN/status/1231326174581751809
2020-02-22 23:54:52,AzadiRojava,curdistani,0,10,16,"Turk State will probably start acting when no longer only Kurds are victim of Corona Virus but when Turks get infected. https://twitter.com/curdistani/status/1231282552230629378 …",,,,1231366778464460801,https://twitter.com/AzadiRojava/status/1231366778464460801
2020-02-22 23:38:16,buterasimh,nickis0n,0,2,50,"also if he stans corona b then make the water boiling pic.twitter.com/I9IxKwkxLr",,,,1231362599951982593,https://twitter.com/buterasimh/status/1231362599951982593
2020-02-22 23:33:49,eggshellfriend,,2,0,28,"this old woman at the pupuseria is straight up roasting her husband for getting a corona with no lime. love is beautiful",,,,1231361483214217217,https://twitter.com/eggshellfriend/status/1231361483214217217
2020-02-22 23:28:44,akarlin88,,8,0,32,"Smol brain: All races are equally vulnerable to Corona. Normal brain: Only kills Mongoloids (Lance Welton). Galaxy brain: Virulence higher for Caucasians (see 6:15). https://youtu.be/VasccCzr2TY?t=375 …",,,,1231360204169760773,https://twitter.com/akarlin88/status/1231360204169760773
2020-02-22 23:24:42,JonnyVamExplore,,1,2,8,"It's about time someone in Government told us the truth about the spread of the corona virus. Italy are bringing in police and military to control people in infected areas.",,,,1231359185817915400,https://twitter.com/JonnyVamExplore/status/1231359185817915400
2020-02-22 23:08:55,StrawberrieGukk,,5,8,52,"I really don’t want bts to go to South Korea... not right now until the corona virus is gone I’m so scared for k army and bts :(",,,,1231355214084673536,https://twitter.com/StrawberrieGukk/status/1231355214084673536
2020-02-22 23:00:21,MoojaRedux,,0,3,26,"The league is doing a good enough job at killing itself, why the fuck is it worrying about corona",,,,1231353059181244418,https://twitter.com/MoojaRedux/status/1231353059181244418
2020-02-22 22:54:57,__therapyy,,0,1,33,"Are you guys not tired of living in Namibia ug ae this country is draining... So much going on like corona virus is even better",,,,1231351702625931264,https://twitter.com/__therapyy/status/1231351702625931264
2020-02-22 22:45:56,shafei_d,Jalalapeno,3,5,20,"Schools/universities are cancelled in 10 provinces. Cinemas and concerts are also shut down. Special hospitals are prepared for corona patients. Yeah it seems it’s more serious than we were expecting!",,,,1231349431414480897,https://twitter.com/shafei_d/status/1231349431414480897
2020-02-22 22:45:40,lilslockk,,8,6,44,"Me: relaxing listening to Spotify Spotify ads: IF YOU HAVE THE CORONA VIRUS- Me: pic.twitter.com/gVRzGfdOUe",,,,1231349363902996480,https://twitter.com/lilslockk/status/1231349363902996480
2020-02-22 22:44:04,mwparrott,,1,0,18,"Got a comically oversized torta (fist for reference) from Tortas Neza and a new drip on my way back from AOC's town hall. North Corona has everything. pic.twitter.com/VCtqeWxDSf",,,,1231348961300156417,https://twitter.com/mwparrott/status/1231348961300156417
2020-02-22 22:37:54,sweetchaoske,,10,2,63,"Ahh guys ㅠㅠ please pray for us that the Corona virus situation in Korea improves ㅠㅠ its gotten quite serious in the last few days.",,,,1231347410447650816,https://twitter.com/sweetchaoske/status/1231347410447650816
2020-02-22 22:36:26,Tallyn_,,2,3,20,"all i want is to be somewhere on a hot beach, sipping a corona with lime, blasting country music with some good company",,,,1231347039457480704,https://twitter.com/Tallyn_/status/1231347039457480704
2020-02-22 22:28:19,itsmermeag,,5,0,14,"Well the guy i was talking to called corona virus the “Kung flu” so i am not going to be talking to him again lol",,,,1231344996634132480,https://twitter.com/itsmermeag/status/1231344996634132480
2020-02-22 22:16:23,0hMyGabe,fanysyoungone,0,1,49,"These empty seats are because of people who didn't go because of the 250% corona virus increase in the last 24 hours...",,,,1231341996339605509,https://twitter.com/0hMyGabe/status/1231341996339605509
2020-02-22 22:14:00,Mdais,,3,12,14,"Thread : Tonight (Saturday), Magen David Adom opened a special hotline focusing on treating people suspected of contracting #Coronavirus. 100s of citizen inquiries have been received regarding the Corona at Magen David Adom's 101 hotline. #stopcoronapic.twitter.com/csVNoiyjIG",,,#Coronavirus #stopcoronapic,1231341393341227012,https://twitter.com/Mdais/status/1231341393341227012
2020-02-22 21:45:50,LaboumInter,,0,11,14,"[200222] Soyeon Instagram update "" A homebody's schedule! Home-workout-home Be careful about Corona virus! "" #라붐 #소연 #laboum #soyeonpic.twitter.com/DHvv5VxG6W",,,#라붐 #소연 #laboum #soyeonpic,1231334307723141120,https://twitter.com/LaboumInter/status/1231334307723141120
2020-02-22 21:33:24,LadyLovesTaft,sgtjanedoe,3,0,74,"jane are you concerned about the corona virus",,,,1231331178709442561,https://twitter.com/LadyLovesTaft/status/1231331178709442561
2020-02-22 21:27:16,bai_mina,,1,9,26,"People gathering in #talesh #Gilan in front of a hospital that houses Corona patients to express their concern about #Coronavirus outbreak and authorities' mismanagement.pic.twitter.com/UaxUyrtsW2",,,#talesh #Gilan #Coronavirus,1231329635977306122,https://twitter.com/bai_mina/status/1231329635977306122
2020-02-22 21:13:45,DearSoodi,Lghara93,1,11,15,"You are a big shame for Iranians @Lghara93!I’m ashamed knowing you are from my motherland!Thousands lives are in danger!Either because of Corona or because of tortures & death sentences in the regime’s detention centers. And all you have to talk about is lies about the sanction! https://twitter.com/Lghara93/status/1231295573594034177 …",,@Lghara93,,1231326231762698243,https://twitter.com/DearSoodi/status/1231326231762698243
2020-02-22 21:00:15,rottenbanana101,DrEricDing,1,41,21,"This is bad news for S. Korea & the U.S. military . It’s easily conceivable with this type of a jump in cases S.Korea could get hit very hard by the Corona virus. https://twitter.com/DrEricDing/status/1231304647731744772 …",,,,1231322835248959489,https://twitter.com/rottenbanana101/status/1231322835248959489
2020-02-22 20:42:06,calebhart42,,13,10,173,"I mentioned I might have Corona virus on stream last night and a chatter said he's been drinkin a 12 pack of Corona a day to develop an immunity to it. Hey, don't.",,,,1231318266200707072,https://twitter.com/calebhart42/status/1231318266200707072
2020-02-22 20:37:14,aluuandayy,IanSams,2,9,23,"That’s what you call journalism - not what Munafiq Mir, Snake Safi, Nurse Naseem, Petrol Shami, Makeup Khanzada, Rape Apologist Sethi, IRS Haider, Jiyala Nasir, Khurram Corona, and others practice in Pak https://twitter.com/IanSams/status/1231027617802989569 …",,,,1231317041337991170,https://twitter.com/aluuandayy/status/1231317041337991170
2020-02-22 20:35:29,MaeWest52499669,,1,24,18,"Trump is 'furious' about bungling Diamond Princess coronavirus evac https://mol.im/a/8032645 via @MailOnline Official said it was a big mistake to bring 14 people with the CORONA VIRUS from Japan to the USA.. Yeah... There is a reason Obama said ""A wall can't stop diseases""",,@MailOnline,,1231316604413194241,https://twitter.com/MaeWest52499669/status/1231316604413194241
2020-02-22 20:34:34,dingo_1916,,12,16,109,"Pat Ramsey's taking no more chances of the Corona virus in Derry. pic.twitter.com/g7jMI0GvGX",,,,1231316370949918721,https://twitter.com/dingo_1916/status/1231316370949918721
2020-02-22 20:30:12,bradosst,,1,6,214,"Take care of yourselves, corona is serious stop fooling around.",,,,1231315274424627210,https://twitter.com/bradosst/status/1231315274424627210
2020-02-22 20:16:59,maga_cali,,4,99,70,"Breakdown in communication. @POTUS is right to be furious! #Corona infected sent home ""as long as they are isolated upon arrival"" ...but they aren't. UCSF is calling patients incl me to reschedule appoint IF we have it. Obviously ppl are showing up w/ it.. https://www.foxnews.com/politics/trump-furious-americans-infected-with-coronavirus-flew-back-in-u-s-without-his-permission-report …",,@POTUS,#Corona,1231311948806930432,https://twitter.com/maga_cali/status/1231311948806930432
2020-02-22 20:16:11,AyatollahSanaZ,Hashshaashin,4,15,50,"Here is a video that shows the deepness of the #CoronaVirus Tragedy in #Iran. A child to be dead today in #Shiraz because of #Corona. #IRDetaineeshttps://twitter.com/Hashshaashin/status/1231310322004348930 …",,,#CoronaVirus #Iran #Shiraz #Corona #IRDetaineeshttps,1231311743625789440,https://twitter.com/AyatollahSanaZ/status/1231311743625789440
2020-02-22 20:15:47,resurgentsheep,,7,10,46,"The importance of choosing your words carefully. WHO Lady on Ch4 news tonight offering reassurance on the Corona Virus. “The good news is that the virus doesn’t kill everybody”",,,,1231311643436601346,https://twitter.com/resurgentsheep/status/1231311643436601346
2020-02-22 20:14:16,ActorOdongo,,17,151,420,"Pray for South Korea . The Corona virus covid 19 is no joke as we've witnessed in China. Hopefully the authorities aren't in a state of denial about this pandemic. #coronaviruspic.twitter.com/MZo4G0q8N3",,,#coronaviruspic,1231311264963584001,https://twitter.com/ActorOdongo/status/1231311264963584001
2020-02-22 19:58:33,Jaffer_AJ001,,9,55,178,"#CoronaVirus Everyone is taking personal hygiene seriously after the Corona-Virus. pic.twitter.com/3Tdl4cFO3h",,,#CoronaVirus,1231307307985690624,https://twitter.com/Jaffer_AJ001/status/1231307307985690624
2020-02-22 19:50:03,BKhajepoor,,1,17,36,"The students of Beheshti University are protesting in demand of cancelling all classes bc of #corona risk. In some cities also there were some protests against lack of transparency from regime. @WHO should know that regime is incapable of stopping virus spread. Strikes needed...pic.twitter.com/3ToiTlGDYt",,@WHO,#corona,1231305170274914304,https://twitter.com/BKhajepoor/status/1231305170274914304
2020-02-22 19:41:42,blankspacebabyd,,2,2,60,"teacher just cancelled class because someone coughed he thought he had corona pic.twitter.com/9gcvc0QB7r",,,,1231303067343167490,https://twitter.com/blankspacebabyd/status/1231303067343167490
2020-02-22 19:31:52,MostafaMe4,,6,53,71,"#BREAKING #Iran Feb 22 Students Girls gather in Tehran Beheshti University to protest against university not closure (to prevent #coronavirus spreading) Iran regime is trying to cover up corona spreading the news Chants: "" Beheshti (University) should be closed"" pic.twitter.com/uYQoMQKRCr",,,#BREAKING #Iran #coronavirus,1231300593379094529,https://twitter.com/MostafaMe4/status/1231300593379094529
2020-02-22 19:29:32,Natsecjeff,zain91,4,26,35,"Pakistan declares emergency in Balochistan in districts near Pakistan-Iran border due to threat from Corona Virus in Iran. Movement of Shia pilgrims also blocked for time being. https://twitter.com/zain91/status/1231299502239293440 …",,,,1231300006159749124,https://twitter.com/Natsecjeff/status/1231300006159749124
2020-02-22 19:26:44,GrainStats,,26,226,342,"I'm in Rome and this just happened. COVID/Corona? Who knows. They aren't taking chances. #italy #COVID #COVID19italiapic.twitter.com/W0lNQgxvCH",,,#italy #COVID #COVID19italiapic,1231299302657576962,https://twitter.com/GrainStats/status/1231299302657576962
2020-02-22 19:26:35,D43SHHUNT3R,,4,27,28,"The new terrorist Revolutionary Guards commander Esmail Ghaani has been infected with the fatal virus Corona. pic.twitter.com/OxeCJH0OnT",,,,1231299261423398912,https://twitter.com/D43SHHUNT3R/status/1231299261423398912
2020-02-22 19:20:22,JKalashi,,1,9,23,"Can the Islamic Republic resist Corona virus? #Iran #coronavirus #ویروس_کرونا #تعطیلی_تا_پایان_کرونا",,,#Iran #coronavirus #ویروس_کرونا #تعطیلی_تا_پایان_کرونا,1231297700060180483,https://twitter.com/JKalashi/status/1231297700060180483
2020-02-22 19:11:10,eath1223,,5,9,25,"How the corona virus will be used by the 1% Depopulation Creating a reason to increase censorship of the internet because of so called fake news about the virus People will fear the virus and focus on it",,,,1231295384506503170,https://twitter.com/eath1223/status/1231295384506503170
2020-02-22 18:58:25,Peacef_Warrior,,2,10,21,"3 points of concerns wrt Corona Virus: 1. Corona virus cases showing up around the world with no epidemiological link at all - Iran 2. CDC found that the corona virus was viable in feces 3. Corona virus found in patient's urine",,,,1231292176987901952,https://twitter.com/Peacef_Warrior/status/1231292176987901952
2020-02-22 18:38:13,ImtiazMadmood,,8,8,63,"A serial killer with the Corona virus could infect and kill thousands of people without getting caught.",,,,1231287092933730304,https://twitter.com/ImtiazMadmood/status/1231287092933730304
2020-02-22 18:33:00,MihrThakar,disclosetv,7,34,24,"When people say countries with weak health systems are most vulnerable, this is what they mean. Iran has a mortality rate of 21% compared to about 2% in China & even less in other regions. Now imagine a Corona Virus outbreak in a country like Kenya, Ethiopia or even DRC! https://twitter.com/disclosetv/status/1231277393882599425 …",,,,1231285778036162560,https://twitter.com/MihrThakar/status/1231285778036162560
2020-02-22 18:29:03,ThatEthiopian,,2,4,77,"Some Russian guy came up to someone in the library and said “I heard you sneezing and it’s dangerous, leave” in a stern voice and the other guy says “it’s just allergies, I am certain it’s not corona virus” and then they just stared at each other… Fam, it was me that sneezed.. pic.twitter.com/vmvFhTDOg0",,,,1231284785349373952,https://twitter.com/ThatEthiopian/status/1231284785349373952
2020-02-22 18:28:24,EndGameWW3,,6,22,54,"Breaking: Iran's Ministry of Culture announced that all art and cinema activities in the country were stopped for 1 week due to the spread of the Corona virus.",,,,1231284623008837633,https://twitter.com/EndGameWW3/status/1231284623008837633
2020-02-22 18:25:01,Saund65,,8,8,79,"Things more popular than Paul Lambert in Ipswich right now: > Corona virus > Spam > Ian Duncan-Smith > Wasp stings > Mrs Brown's Boys .... pic.twitter.com/QTv8XTAUGc",,,,1231283768897523717,https://twitter.com/Saund65/status/1231283768897523717
2020-02-22 18:23:25,Be_Demon3,,2,3,77,"Corona reaches Kurdistan People who posted “izrael hsabaka bena”: pic.twitter.com/IyedUUJLbK",,,,1231283365246046209,https://twitter.com/Be_Demon3/status/1231283365246046209
2020-02-22 18:22:32,aftabnaseer6,,56,135,170,"This is Iran shahar سیستان Balochistan, Corona virus entered in Balochistan now what Pakistan government do for Rich Balochistan and there poor people. pic.twitter.com/sHhwY9Dj9p",,,,1231283143019319297,https://twitter.com/aftabnaseer6/status/1231283143019319297
2020-02-22 18:21:49,HadiNasrallah,,16,117,427,"CoronaVirus is a health and humanitarian issue only when it is discovered in countries like Italy, Germany and the UK. But it is regarded as an “economic threat” by the west to countries with Corona cases like Iran and China that must be boycotted and isolated from the world.",,,,1231282963452760070,https://twitter.com/HadiNasrallah/status/1231282963452760070
2020-02-22 18:06:44,EinsteinsMagic,,1,40,25,"The fruits of lying Political Correctness are death, diseases and stupidity. Better add the corona virus to this song Michigan & Smiley - Diseases 12"" 1981 https://youtu.be/kd-LVvKfkaE via @YouTube",,@YouTube,,1231279167045398528,https://twitter.com/EinsteinsMagic/status/1231279167045398528
2020-02-22 18:02:28,saraghavamian,,2,17,42,"IRI did boycott the #coronavirus news for a month, they are still in denial, ppl are panicking since regime keeps the news away from them. Here in Talesh,a northern city are protesting infront of a hospital that hospitalized 4 patients with corona virus. Ppl want update. pic.twitter.com/ow21B7YaVs",,,#coronavirus,1231278093161111552,https://twitter.com/saraghavamian/status/1231278093161111552
2020-02-22 17:44:01,StirringTrouble,,0,11,26,"How quickly man-made climate change scam and the corona virus fake hysteria that was preceded with a campaign of promoting vaccines as the answer to all health problems blew away cover of people on the payroll of the globalist mafia. They are all in the open now.",,,,1231273449747886083,https://twitter.com/StirringTrouble/status/1231273449747886083
2020-02-22 17:41:26,don_koxyn,odinweruka,12,8,141,"FG just approved 300+ million to fight corona virus",,,,1231272800964485120,https://twitter.com/don_koxyn/status/1231272800964485120
2020-02-22 17:30:55,MichaelMAGAUSN,thehill,25,103,71,"""Corona-boat, Beleaguered with flu. Come aboard, Need more cash from YOU."" https://twitter.com/thehill/status/1231263648859009024 …",,,,1231270156384505857,https://twitter.com/MichaelMAGAUSN/status/1231270156384505857
2020-02-22 17:26:14,PeterSweden7,,102,502,1432,"Yikes. Italy has now declared a state of emergency in the region I am in because of Corona virus. It's getting real",,,,1231268977080442883,https://twitter.com/PeterSweden7/status/1231268977080442883
2020-02-22 17:16:45,manojmanila,,2,26,85,"#swarabhaskar Tum bhi corona virus Ho wait Karma will reply you pic.twitter.com/yTgsoB5FwR",,,#swarabhaskar,1231266590810935296,https://twitter.com/manojmanila/status/1231266590810935296
2020-02-22 16:57:53,CamelPhat,,12,2,157,"Just had our 1st ever screening at an airport for Corona virus there. It was proper vintage Total Recall shit, a digital thermometer to the Fod...!!!",,,,1231261841575337985,https://twitter.com/CamelPhat/status/1231261841575337985
2020-02-22 16:57:04,JuanDelmass,FEREEON,1,10,23,"Iranian regime announced 2 cases of Corona virus just before the election knowing Iranian people had campaigned for election boycott under the tags of #NoVote4Terrorists and #رای_بی_رای to blame lack of support on Corona . Just after the election was widely ignored they https://twitter.com/FEREEON/status/1231241468636954624 …",,,#NoVote4Terrorists #رای_بی_رای,1231261636427735040,https://twitter.com/JuanDelmass/status/1231261636427735040
2020-02-22 16:49:01,Inevitable_ET,,29,198,505,"If you’re planning int’l trips in the next few months I recommend staying here Not that you should be worried about catching the “corona” but bc all these countries infected w/ “corona” are undergoing political/humanitarian revolutions >>you might get stuck there during lockdown pic.twitter.com/qjFkjSPrlK",,,,1231259611057020928,https://twitter.com/Inevitable_ET/status/1231259611057020928
2020-02-22 16:43:45,bigbadwulff510,DylanTweetin,5,1,178,"Patient 0 for the Corona virus",,,,1231258286713737216,https://twitter.com/bigbadwulff510/status/1231258286713737216
2020-02-22 16:10:56,eur34,,0,114,706,"Woke up with sore throat and a cough...if this is the corona virus I at least better drop five lbs",,,,1231250026673950720,https://twitter.com/eur34/status/1231250026673950720
2020-02-22 16:07:29,EstersOfMalt,,1,4,29,"Lebanese before and after Corona pic.twitter.com/W7NHjD4LtU",,,,1231249158272626688,https://twitter.com/EstersOfMalt/status/1231249158272626688
2020-02-22 15:50:16,SheTweeting,,2,10,113,"Love in the Time of Cholera vs. Love in the Time of Corona ‌ ‌ #وضعیت #coronavirus #كرونا #كورونا",,,#وضعیت #coronavirus #كرونا #كورونا,1231244825346920448,https://twitter.com/SheTweeting/status/1231244825346920448
2020-02-22 15:49:10,usamijane,,1,8,54,"i hoped that she finally gave us some tea but it’s just about corona #FUCKYOUCORONAVIRUS pic.twitter.com/SSJ9KVxiGS",,,#FUCKYOUCORONAVIRUS,1231244549483352067,https://twitter.com/usamijane/status/1231244549483352067
