date,username,to,replies,retweets,favorites,text,geo,mentions,hashtags,id,permalink
2020-04-04 18:29:28,ggf_india,,3,14,83,"Our night warriors are out again! They have spent several sleepless nights to ensure that nobody sleeps hungry! It is a long road ahead but we will not stop until #Corona is defeated! #IndiaFightsCorona #FeedTheNeedy @GautamGambhir Serving at Anand Vihar - JJ Clusterspic.twitter.com/9H2WpSDmFm",,@GautamGambhir,#Corona #IndiaFightsCorona #FeedTheNeedy,1246505178947186689,https://twitter.com/ggf_india/status/1246505178947186689
2020-04-04 18:29:25,I_am_AlphaX1,,7,16,44,"Uhuru Kenyatta, while defending Moody Awori, implied that the youth are thieves. Does Mutahi Kagwe want the youth in the front line so we can steal Corona Virus? U weren't there when we needed u, we won't be there when u need us. #KOTNightSpree #KOTpic.twitter.com/aMegSk0UDh",,,#KOTNightSpree #KOTpic,1246505165936635905,https://twitter.com/I_am_AlphaX1/status/1246505165936635905
2020-04-04 18:29:21,mathieuflamini,,32,66,647,"Sitting and watching the world go by.I miss you all ! Peace #staypositive #staysafe #corona pic.twitter.com/RfaAeqwhx8",,,#staypositive #staysafe #corona,1246505149453021186,https://twitter.com/mathieuflamini/status/1246505149453021186
2020-04-04 18:29:08,TheOfficialSBI,,13,18,174,"To fight against the novel Coronavirus, every staff member of SBI branch from Chandigarh Circle contributed a total amount of ₹2,31,000 for the Chief Minister Relief Fund for Corona. Let’s fight this pandemic together. #COVID19 #Coronavirus #SBIFamily #ProudSBIpic.twitter.com/ZDMkBCitOR",,,#COVID19 #Coronavirus #SBIFamily #ProudSBIpic,1246505094427734017,https://twitter.com/TheOfficialSBI/status/1246505094427734017
2020-04-04 18:26:49,ledamalekina,,174,232,821,"So the USA suspend mortgage payments for a year to help deal with the Corona Virus ... @KenyaBankers Can you can do the same and allow landlords not to charge rent for a year ... Rent holiday right ? Or are Your investors greedy to care ? @KCBGroup @NCBABankKenya @KeEquityBank ?",,@KenyaBankers @KCBGroup @NCBABankKenya @KeEquityBank,,1246504511503585282,https://twitter.com/ledamalekina/status/1246504511503585282
2020-04-04 18:26:38,katie_meir,,8,21,167,"Two of my family members are in hospital with corona so if you don’t think it’ll happen to you please get ya head out ya arse and stay the fuck indoors, the quicker people wrap their head around it the quicker it’s over",,,,1246504467777929217,https://twitter.com/katie_meir/status/1246504467777929217
2020-04-04 18:25:57,caelestjjk,,13,14,129,"low quality webcam photos because miss corona has me locked up and I can’t go outside xxx pic.twitter.com/JPf1DqtVZU",,,,1246504293391306752,https://twitter.com/caelestjjk/status/1246504293391306752
2020-04-04 18:25:35,ayubharshad81,,16,95,79,"A poster in Karnataka, saying “no muslim traders are allowed in this village till corona virus go”.... from a group of hindus pic.twitter.com/AJPkev0Sek",,,,1246504201749962753,https://twitter.com/ayubharshad81/status/1246504201749962753
2020-04-04 18:25:21,wholesomezak,Izzzaac_lc,0,14,38,"when I say COVID-19 instead of Corona https://twitter.com/Izzzaac_lc/status/1245932601988112385 …",,,,1246504144841695233,https://twitter.com/wholesomezak/status/1246504144841695233
2020-04-04 18:24:45,Rybeckford,,117,17968,14887,"When corona virus meets Ebola pic.twitter.com/okFvO0FdWy",,,,1246503993133727746,https://twitter.com/Rybeckford/status/1246503993133727746
2020-04-04 18:24:37,cachelrumbo,,2,11,24,"If the corona virus was a person it would look like my ex boyfriend",,,,1246503958992097292,https://twitter.com/cachelrumbo/status/1246503958992097292
2020-04-04 18:24:07,PathToManliness,,0,5,30,"When restaurants start going bankrupt, soft chinned city journalists will dig up old “Millenials are killing X Reataurant” and replace the word Millenial with Corona Copy pasta clickbait soon",,,,1246503831623610372,https://twitter.com/PathToManliness/status/1246503831623610372
2020-04-04 18:22:17,Akua_Nana_,,2,5,59,"Eh so I can't cough in peace er There was cough before corona oo Now deir when my throat is itching koraa I have to swallow Tsw",,,,1246503371588198401,https://twitter.com/Akua_Nana_/status/1246503371588198401
2020-04-04 18:22:10,HealthPunjabGov,,0,16,72,"Punjab to learn from Chinese best practices ""China has made a remarkable achievement by effectively controlling the pandemic. On our part, we utilizing all resources to control the spread of Corona and learn from their experience. "" Dr. Yasmin Rashid #PunjabFightsCoronapic.twitter.com/jIVKoOWS33",,,#PunjabFightsCoronapic,1246503342412566532,https://twitter.com/HealthPunjabGov/status/1246503342412566532
2020-04-04 18:21:37,AsantebaEkua,,6,10,15,"Why are Africans angry the “supposed corona virus vaccine “ is going to be tested in Africa on Africans? My qtn is, if you always wait to be fed, if u always want to be a consumer, why won’t you be used as the pawn!!!",,,,1246503206089351168,https://twitter.com/AsantebaEkua/status/1246503206089351168
2020-04-04 18:21:13,TboozeSA,,10,7,32,"So you guys also won’t be testing for Corona because government will install a tracking chip on you. do you know how important you had to be for any government to go that extreme? Do they want to steal your family recipes?",,,,1246503102615781376,https://twitter.com/TboozeSA/status/1246503102615781376
2020-04-04 18:20:45,x_lisabrown,,47,20,3500,"What a shit night. In the space of 1 hour we have been informed that the corona virus is now in my nanas care home, and a separate call to tell us that my grandads care home also has it and unfortunately he is one of the people to have caught it. My heart hurts I am so scared",,,,1246502984340692993,https://twitter.com/x_lisabrown/status/1246502984340692993
2020-04-04 18:20:01,CBSNews,,57,107,176,"Corona beer halts production during coronavirus pandemic https://cbsn.ws/2RaOALg pic.twitter.com/CWjKWGmcUW",,,,1246502801175429123,https://twitter.com/CBSNews/status/1246502801175429123
2020-04-04 18:19:36,Nader723,,0,12,28,"My cousin posted this on Instagram about the Corona Virus. They live in California. Please read. pic.twitter.com/qDd2wSyzWI",,,,1246502697148329984,https://twitter.com/Nader723/status/1246502697148329984
2020-04-04 18:19:34,chgroenhuijsen,,21,14,43,"#Corona, #VS en #Trump in cartoons.pic.twitter.com/CCB3CP34NG",,,#Corona #VS #Trump,1246502689544028160,https://twitter.com/chgroenhuijsen/status/1246502689544028160
2020-04-04 18:18:57,WhismanSucks,,39,64,618,"Corona beer is halting production because you guys can’t discern between a beer and an unfortunately named virus. That’s like not using a first aid kit because you think you’ll get full blown AIDS. Deliver it to my house, @corona.",,@corona,,1246502533402464256,https://twitter.com/WhismanSucks/status/1246502533402464256
2020-04-04 18:18:20,Ali4omNY,mehdirhasan,2,19,149,"Joe Biden makes NO sense at all. It is naked pandering. We need #MedicareForALL for ALL sicknesses - not just for the Corona virus. Make note of it #Wisconsin",,,#MedicareForALL #Wisconsin,1246502378939076615,https://twitter.com/Ali4omNY/status/1246502378939076615
2020-04-04 18:18:09,Dark_Wizzy_,,6,8,259,"NOOOOO BROFFINA GOT CORONA #AnimalCrossing #ACNH #NintendoSwitchpic.twitter.com/VgnAz2hGTy",,,#AnimalCrossing #ACNH #NintendoSwitchpic,1246502333669724160,https://twitter.com/Dark_Wizzy_/status/1246502333669724160
2020-04-04 18:17:41,bismeen1,KlasraRauf,13,20,100,"Excellent analysis from simple definition of subsidy , to highlighting the joint ventures b/w industrialists @politicians . This publication should be called IK’s corona killing move..as if Ik able to eliminate them from the system , he will win the war bigger than Covid 19. https://twitter.com/KlasraRauf/status/1246492949229326337 …",,@politicians,,1246502216095215620,https://twitter.com/bismeen1/status/1246502216095215620
2020-04-04 18:15:04,AndColorPockeT,,7,24,62,"Please install Arogya setu app by GOI, it is related to Corona chain, just like Singapore.. https://play.google.com/store/apps/details?id=nic.goi.aarogyasetu …",,,,1246501555919925248,https://twitter.com/AndColorPockeT/status/1246501555919925248
2020-04-04 18:15:00,adam_tooze,,3,32,87,"“Whatever it takes”? National fiscal responses to corona will reinforce the dangerous asymmetries in the EZ. And so far the only answer is the ECB. NOT what Draghi envisioned in 2012! https://www.ft.com/content/d7d08772-7583-11ea-95fe-fcd274e920ca …pic.twitter.com/WQUs33Jo1y",,,,1246501538178179082,https://twitter.com/adam_tooze/status/1246501538178179082
2020-04-04 18:13:51,allisonpearson,,109,217,1092,"Correction: four-fifths of Corona cases may be asymptomatic. A mild illness for many. We need the antibody test ASAP so those who have had it can kick-start the economy so our kids have a future. #coronavirus",,,#coronavirus,1246501248968396806,https://twitter.com/allisonpearson/status/1246501248968396806
2020-04-04 18:12:22,oldschoolmonk,_pallavighosh,1,6,44,"Thanks a ton to Rahul Gandhi If he wasn't there entire medial staff and govt would have been so clueless about Corona. https://twitter.com/_pallavighosh/status/1246445396416581632 …",,,,1246500875675328516,https://twitter.com/oldschoolmonk/status/1246500875675328516
2020-04-04 18:12:12,stinkywife,,0,7,58,"apparently during the corona pandemic the labor party is trying socialism distancing",,,,1246500834571104256,https://twitter.com/stinkywife/status/1246500834571104256
2020-04-04 18:11:47,keiotik,,42,4,114,"Getting myself tested for Corona Virus tomorrow, please pray for me guys. I’m pretty sick.",,,,1246500730263011328,https://twitter.com/keiotik/status/1246500730263011328
2020-04-04 18:11:44,WanKanCHIN,,35,109,191,"Why are we afraid of corona virus as we know it is just a common flu? https://www.youtube.com/watch?v=GjXWq1l1wH8&fbclid=IwAR1xN7lmherjlr-ojxTqSJ1c50qqVi0mYXKoWLu0DnxLMoek9ekViseyUtk …",,,,1246500715544989697,https://twitter.com/WanKanCHIN/status/1246500715544989697
2020-04-04 18:11:23,AOC,MarkLevineNYC,2262,4139,14671,"To all the people that said “there’s no evidence racial disparities in COVID impact exist.” I represent the most impacted neighborhoods in the country: Corona & East Elmhurst. These are overwhelmingly Black & Latino neighborhoods. Louis Armstrong’s house is here. https://twitter.com/MarkLevineNYC/status/1246177752098705408 …",,,,1246500629264154624,https://twitter.com/AOC/status/1246500629264154624
2020-04-04 18:10:50,Dr_XYZ,DimitarBechev,1,5,100,"B.C. stands for ""Before Corona""?",,,,1246500492634738689,https://twitter.com/Dr_XYZ/status/1246500492634738689
2020-04-04 18:10:00,timesofindia,,9,44,163,"Corona war erupts as Germany, Canada accuse US of hijacking supplies http://toi.in/6X8HKb60/a24gk via @TOIWorld",,@TOIWorld,,1246500279899447297,https://twitter.com/timesofindia/status/1246500279899447297
2020-04-04 18:09:50,adambtyler,,10,13,307,"idk who COVID19 is, but she doesn’t seem like too good of a person, i hope she gets corona and dies",,,,1246500239844020225,https://twitter.com/adambtyler/status/1246500239844020225
2020-04-04 18:09:37,0thebrodie,,84,2,179,"Pray for me y'all. My pops just tested positive for corona virus, and I've been in contact with him so I'm expecting to get it any day now",,,,1246500185829715970,https://twitter.com/0thebrodie/status/1246500185829715970
2020-04-04 18:08:22,draper_robert,kirstiealley,3,15,143,"I don't believe in big foot, ghosts, the lockness monster, or aliens but something doesn't seem right about Corona",,,,1246499870657187845,https://twitter.com/draper_robert/status/1246499870657187845
2020-04-04 18:08:06,FrostedMitts,,18,35,317,"Saw Kate Upton trending, thought she had corona pic.twitter.com/MOakdh2CtX",,,,1246499804173271043,https://twitter.com/FrostedMitts/status/1246499804173271043
2020-04-04 18:08:06,News24,,26,17,54,"http://News24.com | WATCH | Corona se p**s! Man arrested after bragging about 'doing tik' in front of Pretoria police station https://www.news24.com/SouthAfrica/News/watch-corona-se-ps-man-arrested-after-bragging-about-doing-tik-in-front-of-pretoria-police-station-20200404 …",,,,1246499803858710529,https://twitter.com/News24/status/1246499803858710529
2020-04-04 18:07:49,hadizahm,,5,9,41,"Ya Allah let this rain wash away all the illnesses especially Corona virus amin.",,,,1246499733469880322,https://twitter.com/hadizahm/status/1246499733469880322
2020-04-04 18:07:35,AkshayKatariyaa,,4,15,56,"Takle @OfficeofUT instead of giving them so much money you could have donated the same amount for corona relief fund. pic.twitter.com/bYKKwsJVdW",,@OfficeofUT,,1246499671322705921,https://twitter.com/AkshayKatariyaa/status/1246499671322705921
2020-04-04 18:06:58,AntifaPinneberg,,1,17,35,"Protect yourself, mask your face and smash fascism! #Corona #CoronaVirus #COVIDー19 #COVID19 #CoronaCrisis #CoronaPandemic #Antifapic.twitter.com/5JQ5E0HCS2",,,#Corona #CoronaVirus #COVIDー19 #COVID19 #CoronaCrisis #CoronaPandemic #Antifapic,1246499515605057536,https://twitter.com/AntifaPinneberg/status/1246499515605057536
2020-04-04 18:05:13,crisdeluca,,1,24,64,"Proud of the @JNJInnovation @JNJNews @JLABS #Technology and #DataScience teams supporting and mentoring over 2000 hackers fighting Corona Virus in this weekends #MITCOVID19Challenge #COVID19 #coronaviruspic.twitter.com/VQo7LdxD9y",,@JNJInnovation @JNJNews @JLABS,#Technology #DataScience #MITCOVID19Challenge #COVID19 #coronaviruspic,1246499075626881030,https://twitter.com/crisdeluca/status/1246499075626881030
2020-04-04 18:04:05,financepapi_,,4,8,74,"Can’t wait to go Hakkasan after corona is finished With the £10,000 a month I’m saving right now, I’ll be able to drive the Lambo there as soon as it’s open Have to drink some Ace of Spades to ease the pain",,,,1246498792762990592,https://twitter.com/financepapi_/status/1246498792762990592
2020-04-04 18:02:38,oyevivekk,,1,23,76,"Correction: Every 3rd corona patient is from Tablighi Jammat.",,,,1246498425694072833,https://twitter.com/oyevivekk/status/1246498425694072833
2020-04-04 18:02:16,GatHanzo,,12,9,98,"Im tired of this corona shit. Media trying to shove it down your throat every day. It's turning into a social experiment for the govt. and economic exploitation for the mega rich. I dont care who is to blame. Not even worth arguing over. Normies out here getting irritated now.",,,,1246498333969068034,https://twitter.com/GatHanzo/status/1246498333969068034
2020-04-04 18:01:52,SumitkadeI,,12,29,250,"America situation is very critical, they might surpass Italy death toll in next few days. May God protect America & their citizens. #covid19 #corona #usapic.twitter.com/RyX4E79yRQ",,,#covid19 #corona #usapic,1246498235444756483,https://twitter.com/SumitkadeI/status/1246498235444756483
2020-04-04 18:01:45,RobBluez,,0,14,31,"If corona not gone by this summer then me and the glizzy just gon handle it fr",,,,1246498205526876160,https://twitter.com/RobBluez/status/1246498205526876160
2020-04-04 18:01:33,iFearGodNotThem,,10,10,133,"Y’all 400m runners lucky they shut the Olympics down. I’ve been secretly training to drop this 43. , corona spared y’all.",,,,1246498155367186434,https://twitter.com/iFearGodNotThem/status/1246498155367186434
2020-04-04 18:00:00,dw_culture,,2,7,36,"#Berlin before the Corona crisis and today. The restrictions have been imposed on public life. People are only supposed to congregate in twos or with the other members of their household. Due to extensive restrictions there are far fewer people on the streets of Berlin. pic.twitter.com/4cSvmYqIok",,,#Berlin,1246497764344651777,https://twitter.com/dw_culture/status/1246497764344651777
2020-04-04 17:59:56,w_karve,,19,8,51,"Many citizens/organisations are donating to #PMCaresFunds and #Corona #ReliefFunds. Some do it quietly. Others boast about it on #Media and #SocialMedia. Isn't donation/charity a private matter...? Why publicize it...? #Donation #Charity #COVID #CoronaReliefFund #CSR #PR #Ethics",,,#PMCaresFunds #Corona #ReliefFunds #Media #SocialMedia #Donation #Charity #COVID #CoronaReliefFund #CSR #PR #Ethics,1246497749127671809,https://twitter.com/w_karve/status/1246497749127671809
2020-04-04 17:59:49,SpheWaseMbo,sya_nkabinde,6,12,161,"No, Juju doesn't need vaccination, but definitely Cyril. Infact Cyril must be given concentrated corona pic.twitter.com/4r6Tw0g40b",,,,1246497718274490369,https://twitter.com/SpheWaseMbo/status/1246497718274490369
2020-04-04 17:59:31,Conniewestwater,,1,6,28,"Honestly couldn’t be more thankful for my amazing friends !! can’t wait for corona to be over so I can give em all a big snog",,,,1246497641577447425,https://twitter.com/Conniewestwater/status/1246497641577447425
2020-04-04 17:59:24,boldaxis69,,0,37,207,"She said she rather catch corona then feeling for me Ima cough on her",,,,1246497612888489984,https://twitter.com/boldaxis69/status/1246497612888489984
2020-04-04 17:59:21,x_montiea,,3,13,11,"Corona really trying to ruin my hoe summer. I mean WHOLE summer",,,,1246497599399616512,https://twitter.com/x_montiea/status/1246497599399616512
2020-04-04 17:58:27,JenKirkman,,14,15,239,"Those goddamn scooters are partly to blame for spreading Corona. They have to be. Thanks for coming to my Jen Talk.",,,,1246497374685429761,https://twitter.com/JenKirkman/status/1246497374685429761
2020-04-04 17:58:17,prashant1delhi,,3,16,67,"Corona. Got impressed with theirs gesture shown towards the needy society.kudos to both of you. @DelhiPolice @DCPNewDelhi @rohini_sgh @PMOIndia @LtGovDelhi @ArvindKejriwalpic.twitter.com/3q9MwH1ikz",,@DelhiPolice @DCPNewDelhi @rohini_sgh @PMOIndia @LtGovDelhi @ArvindKejriwalpic,,1246497331526025216,https://twitter.com/prashant1delhi/status/1246497331526025216
2020-04-04 17:57:10,upcoprahul,,18,25,98,"Which would be an appropriate hashtag to describe those who are serving people against all odds & displaying exceptional kindness & generosity towards needy people during #COVID19Pandemic. #Corona #Covid #Lockdown21 #SocialDistancing #COVID2019 #IndiaFightsCorona #COVIDー19",,,#COVID19Pandemic #Corona #Covid #Lockdown21 #SocialDistancing #COVID2019 #IndiaFightsCorona #COVIDー19,1246497050172129280,https://twitter.com/upcoprahul/status/1246497050172129280
2020-04-04 17:56:48,acetaesli,,11,378,820,"BLACKPINK cb got delayed couz of corona but their dome tour continued also their boy groups keep having cb nothing effecting like i know you have problem with women just be more clear btch #BLACKPINK1YearOfHiatus #블랙핑크_공백기_1주년 @ygofficialblink pic.twitter.com/RXBa7tTsPv",,@ygofficialblink,#BLACKPINK1YearOfHiatus #블랙핑크_공백기_1주년,1246496957914202112,https://twitter.com/acetaesli/status/1246496957914202112
2020-04-04 17:56:32,PplsReliefFund,,17,47,65,"Many of you may know me as @Freeyourmindkid but I am starting this page as an effort to pool money for people who are having trouble paying their bills during the corona crisis. My ultimate goal is to find enough people who are willing to contribute small sums of money to follow",,@Freeyourmindkid,,1246496893263392768,https://twitter.com/PplsReliefFund/status/1246496893263392768
2020-04-04 17:56:13,Willis_Hubbard_,elaineyvette1,5,19,28,"I don't have a lot, but I have a friend who needs my help, during this Corona Virus. So I shared the food & the few dollars I could give to her. Tears was in her eyes, when I made her take the items. I asked her, ""Remember Bill Withers song, LEAN ON ME?"" https://www.youtube.com/watch?v=2YapAxPfRyI …",,,,1246496810467831809,https://twitter.com/Willis_Hubbard_/status/1246496810467831809
2020-04-04 17:55:59,DomezTV,,20,12,151,"This Corona virus is not “fake” like some of you “woke” people are saying on social media. Lost a family member to it a few days ago.",,,,1246496754712940548,https://twitter.com/DomezTV/status/1246496754712940548
2020-04-04 17:55:38,Doug_NinjaPiper,johncardillo,1,7,62,"Jeffrey Epstein died from Corona virus",,,,1246496666804293632,https://twitter.com/Doug_NinjaPiper/status/1246496666804293632
2020-04-04 17:55:14,MysteryGrove,verge,3,36,194,"I don't think 5G causes corona but I do think that the officials who lied about the effectiveness of masks for months are also lying about how good an understanding they have of the long-term health impact from blasting people with extremely high frequency radio waves. https://twitter.com/verge/status/1246478813212684289 …",,,,1246496563045810180,https://twitter.com/MysteryGrove/status/1246496563045810180
2020-04-04 17:54:06,ajthahippie,,0,15,29,"America: Corona is a serious virus, stay home, it’s not only affecting ppl with underlying health issues and the elderly it affects everyone STAY HOME Italy: pic.twitter.com/Zd3gIQznCK",,,,1246496280433643520,https://twitter.com/ajthahippie/status/1246496280433643520
2020-04-04 17:54:02,smitha_tk,,3,29,85,"#ChennaiCorporation to deploy 16000 workers for daily door-to-door #Corona screening for 90 days #Chennai has 88 positive cases, highest in #TamilNadu #coronaupdatesindia #COVID19outbreak",,,#ChennaiCorporation #Corona #Chennai #TamilNadu #coronaupdatesindia #COVID19outbreak,1246496263324831747,https://twitter.com/smitha_tk/status/1246496263324831747
2020-04-04 17:53:25,funshographix,,146,203,665,"Corona virus has showed us that we need to build more hospitals than churches/mosques If truly there's a God who created humans & answered prayers. Pastor Chris should go to hospitals to pray & heal people with coronavirus instead of talking nonsense about 5G #5GinNigeriaBants",,,#5GinNigeriaBants,1246496105694728199,https://twitter.com/funshographix/status/1246496105694728199
2020-04-04 17:52:24,FEMMY466,,13,8,55,"Guys, so I just discovered that money is part of the pathophysiology of the spread of the Corona virus. When you have money, you are exposed to ""money rays"" which is dangerous and can damage your lungs. So please, send me the money. I'll hold it for everybody. Love you all.",,,,1246495850450296833,https://twitter.com/FEMMY466/status/1246495850450296833
2020-04-04 17:51:53,DanCChamberlain,,7,37,83,"Wouldn't it be funny if the cure for Corona Virus was on Hillary's computer, and the FBI can't admit they have it?",,,,1246495723765616641,https://twitter.com/DanCChamberlain/status/1246495723765616641
2020-04-04 17:51:12,Deputy_Hockey,,30,7,87,"Well folks, it’s finally happened. A woman in New Delhi, India gave birth to twins and named them Corona and Covid. https://metro.co.uk/2020/04/03/uk-coronavirus-death-toll-jumps-12503008/ …",,,,1246495548829556736,https://twitter.com/Deputy_Hockey/status/1246495548829556736
2020-04-04 17:50:52,no_silenced,,53,656,1058,"If Pelosi was handed the cure for Corona....She would hold it ransom until she got every single Socialist bill she wants passed and our borders opened.... #SaturdayThoughts Democrats don’t care how many of us die",,,#SaturdayThoughts,1246495465811488768,https://twitter.com/no_silenced/status/1246495465811488768
2020-04-04 17:50:44,Investigator_51,,2,105,62,"CORONA CRAZY: THE 12 MOST INSULTING ATTACKS ON TRUMP OF THE WEEK https://conservativechoicecampaign.com/corona-crazy-the-12-most-insulting-attacks-on-trump-of-the-week/ …",,,,1246495431112167425,https://twitter.com/Investigator_51/status/1246495431112167425
2020-04-04 17:50:30,Iaressa,,26,13,160,"I never thought that i’d witness this day. I was making sure all my family members are being safe and not leaving their homes and forgot about the ones living abroad. Jeddo Toni caught corona and is now being hospitalized in Marseille. He caught it because he had to go to the-",,,,1246495372903698432,https://twitter.com/Iaressa/status/1246495372903698432
2020-04-04 17:50:00,timesofindia,,8,34,255,"Chandigarh: 90 jail inmates contribute Rs 1.1 lakh to fight corona http://toi.in/UgqG9a45/a24gk via @TOICitiesNewspic.twitter.com/Nxx4mi1GCm",,@TOICitiesNewspic,,1246495246604632064,https://twitter.com/timesofindia/status/1246495246604632064
2020-04-04 17:49:31,Girishvhp,,0,13,30,"For some Fiberals, keeping black DP for terror attack in Syria, Italy & anywhere around is Logical. But lighting the diya in India for corona disaster is illogical!",,,,1246495124986540032,https://twitter.com/Girishvhp/status/1246495124986540032
2020-04-04 17:49:19,TheJessieWoo,,2,36,184,"I remember when “BC” stood for “Before Christ”.... now it stands for “Before Corona” pic.twitter.com/SDzB7h4Z3N",,,,1246495077779886080,https://twitter.com/TheJessieWoo/status/1246495077779886080
2020-04-04 17:48:34,kuwmaria_,,0,20,23,"Corona really fucking the money up. I hate it here",,,,1246494885869486081,https://twitter.com/kuwmaria_/status/1246494885869486081
2020-04-04 17:48:25,Being_Humor,,52,318,817,"For all those who are abusing @OfficeofUT that he’s not fighting Corona Virus enough. See he has donated pic.twitter.com/Sl2qp3Xxfr",,@OfficeofUT,,1246494849395593216,https://twitter.com/Being_Humor/status/1246494849395593216
2020-04-04 17:47:59,rinsana,,9,18,34,"If you read nothing else about the fight against Corona, please read this: https://www.washingtonpost.com/national-security/2020/04/04/coronavirus-government-dysfunction/?arc404=true …",,,,1246494742092939265,https://twitter.com/rinsana/status/1246494742092939265
2020-04-04 17:47:24,citizensforale1,,5,32,44,"Barrack obama takes swipe at Trump's handling of the corona virus response: but understand this, The day the United States declared a national health emergency for H1N1 Obama went golfing. Never replaced medical supplies, waited till 1,200 died before doing anything.",,,,1246494595443232770,https://twitter.com/citizensforale1/status/1246494595443232770
2020-04-04 17:46:06,itsqail,,2,68,437,"Wake up Check corona virus death count Ruin my mood Make breakfast",,,,1246494266169479169,https://twitter.com/itsqail/status/1246494266169479169
