date,username,to,replies,retweets,favorites,text,geo,mentions,hashtags,id,permalink
2020-02-17 22:21:27,Handy_Red_,,4,43,195,"Roman Reigns sending well wishes to China with the outbreak of the Corona virus! #WWEChina #WWEpic.twitter.com/EPJqWZY3r2",,,#WWEChina #WWEpic,1229531332017037312,https://twitter.com/Handy_Red_/status/1229531332017037312
2020-02-17 22:19:40,BardsOfWar,,55,255,518,"Question. Why are so many people trying to prove the CHINESE Corona Virus is a pandemic? Why are more people NOT questioning the narrative? Are we addicted to the adrenaline that FEAR produces? Why is FEAR easier to accept than the idea of [propaganda]? FEAR blinds.",,,,1229530880776892416,https://twitter.com/BardsOfWar/status/1229530880776892416
2020-02-17 22:12:16,Ifcmatt,,39,17,543,"Ighalo stats vs Chelsea 1 touch 1 loss of possession 1 take on 1 failed take on 1 shot 1 lost ball 1 corona 9 new cases Thoughts on his first performance? pic.twitter.com/dyktlG8YxJ",,,,1229529018145419264,https://twitter.com/Ifcmatt/status/1229529018145419264
2020-02-17 22:07:21,t_a_s_p_1_3,,11,72,212,"39 years ago, a book was written about the corona virus and Wuhan Province. The book that published on 10th may 1981 pic.twitter.com/SjDOSkoWfV",,,,1229527780683124737,https://twitter.com/t_a_s_p_1_3/status/1229527780683124737
2020-02-17 22:02:49,oslersweb,,3,12,31,"Tony Fauci named to Trump's Corona virus task force. Fauci's judgement on infectious disease highly suspect given his ME history. From '80s to current, Fauci demanded NIH avoid epi and virological ME research. Now possibly 65 million PWME world wide. https://www.whitehouse.gov/briefings-statements/statement-press-secretary-regarding-presidents-coronavirus-task-force/ …",,,,1229526639580766209,https://twitter.com/oslersweb/status/1229526639580766209
2020-02-17 22:02:46,Its_FAIEF,,1,6,9,"LIVE SNIPING FOR @Authority_AuRa 5 cases of corona virus was found in my County get in here before I die! http://Twitch.tv/its_faief http://Twitch.tv/its_faief #twitch #gaming #gamer #streamer #ps #twitchstreamer #twitchtv #twitchaffiliate #TwitchTVGaming #TwitchPrime",,@Authority_AuRa,#twitch #gaming #gamer #streamer #ps #twitchstreamer #twitchtv #twitchaffiliate #TwitchTVGaming #TwitchPrime,1229526626901405701,https://twitter.com/Its_FAIEF/status/1229526626901405701
2020-02-17 21:57:18,Kaypoisson1,,4,40,447,"If Ighalo had done it we would have deleted chelsea Corona virus being lethal in London no be small breaking news",,,,1229525254764138498,https://twitter.com/Kaypoisson1/status/1229525254764138498
2020-02-17 21:54:38,AstroGann33,,1,5,26,"#coronavavirus considering that the Lunar nodes having been transiting the Cancer/Capricorn axis, Eclipses have activated Corona Australis by longitude since 2019, last one on July 5th 2020. Mars has also just ingressed into Capricorn adding fuel to infections and fevers. pic.twitter.com/UHMCPVyjcx",,,#coronavavirus,1229524581154619392,https://twitter.com/AstroGann33/status/1229524581154619392
2020-02-17 21:49:38,RealDavidJensen,RealDavidJensen,3,12,17,"and here it comes https://www.zerohedge.com/economics/us-firms-china-suffering-severe-shortages-workers-warn-virus-impact-hitting-supply-chains … The highly unstable supply chain pushed by globalists will damage those most dependent. #fintwit #gold #crytpo #btc #corona #cdnpoli #coronavirus #china",,,#fintwit #gold #crytpo #btc #corona #cdnpoli #coronavirus #china,1229523322238431232,https://twitter.com/RealDavidJensen/status/1229523322238431232
2020-02-17 21:46:01,JamieApody,,8,4,53,"I know this little boy's Uncle. I'm heartbroken for this family. This is now the 2nd child I've personally ""known"" to die from the flu. Forget Corona Virus - THIS to me is the scariest thing out there. I literally have no words. https://6abc.com/health/delaware-county-2nd-grader-dies-from-flu-complications/5940166/?fbclid=IwAR3ZofWrynlUV4wVoyKMBau-bj7GfuHNuj9RqEk9ZzEQv9IIcB3Si4-F0yA …",,,,1229522414805114890,https://twitter.com/JamieApody/status/1229522414805114890
2020-02-17 21:35:36,BardsOfWar,,16,133,225,"We are deeply programmed. Time to wake up. FEAR is the trigger. FEAR is the control mechanism. [They] use FEAR to create ""Trust"" in [their] lies. Corona isn't what it seems. Think logically. Fear blinds. Follow the debt. Follow the protestors. Wag the Dog. End of thread.",,,,1229519793117466624,https://twitter.com/BardsOfWar/status/1229519793117466624
2020-02-17 21:17:12,BardsOfWar,,4,121,179,"Twitter locks down Wikileaks? Just hours after WHO meets with BIG TECH to discuss Corona Virus censorship, Twitter locks down Wikileaks account? Up is down. Left is right. Wag the Dog. Fear controls. Think logically. https://www.zerohedge.com/technology/why-did-twitter-just-lockdown-wikileaks-account …",,,,1229515161448243202,https://twitter.com/BardsOfWar/status/1229515161448243202
2020-02-17 20:57:51,TheColistin,MaddyWithKhan,0,8,19,"This will be a suicide. The rights of few cannot trump rights of many. Individual rights matter till they don't infringe upon interests of majority. If we get Corona virus outbreak we will be simply dependent on its natural history. Which is to say, at the mercy of it.",,,,1229510292637462531,https://twitter.com/TheColistin/status/1229510292637462531
2020-02-17 20:43:24,Deisesupes,,8,11,47,"Today at approximately 3pm a patient, recently returned from China, was rushed to UHW after presenting to a GP with some corona virus symptoms. Still no confirmed cases in Ireland and hopefully tomorrow that will still be the case.",,,,1229506654674223104,https://twitter.com/Deisesupes/status/1229506654674223104
2020-02-17 20:33:52,Rainmaker1973,,1,19,121,"Corona discharge is often seen as a glow in the air adjacent to pointed metal conductors carrying high voltages https://buff.ly/2Jb03F8 [source of the gif: https://buff.ly/2JN65iP ]pic.twitter.com/GjAppxKO6U",,,,1229504254815227911,https://twitter.com/Rainmaker1973/status/1229504254815227911
2020-02-17 20:27:44,BardsOfWar,,10,82,174,"Question. With all of the Chinese citizens testimonies about the Corona virus that are somehow by-passing the Digital Wall... Where are the testimonies from the Hong Kong protestors? Why are the Hong Kong protestors so silent? Logical thinking. Emotions cloud judgement.",,,,1229502715081838593,https://twitter.com/BardsOfWar/status/1229502715081838593
2020-02-17 20:09:01,HanianEmpress,,11,35,77,"Why the Corona Virus is a likely bigger issue than most realize - it's early & we know little - spreads easy - asymptomatic cases - China shut down whole country - Quarantine ship, many cases - Africa, India, etc no medical infrastructure - can't cure millions of people at once",,,,1229498002659827713,https://twitter.com/HanianEmpress/status/1229498002659827713
2020-02-17 20:04:02,JoanofAmerica,realDonaldTrump,4,100,65,"Q Proof > 1013 2213 CIA Trying to Impersonate Q TWITTER. CLOWNS. Operation Q-T2810C. False drops. Bot push. Future ""Conspiracy"" push to norms. Bad mixed w/ good. Taint. They are scared. Q CIA Satellite Offline >>2804887 [DEAC>KILLBOX1AZB] CORONA 1 NOW OFFLINE. Q pic.twitter.com/KzO5NOpp9L",,,,1229496750072881157,https://twitter.com/JoanofAmerica/status/1229496750072881157
2020-02-17 20:00:31,jurinorAmb,,4,12,20,"Can we say then that Corona Virus is a premeditated evil? Or may be an experiment? #COVIDー19 #COVD19pic.twitter.com/KCa7XQH6PQ",,,#COVIDー19 #COVD19pic,1229495865448058881,https://twitter.com/jurinorAmb/status/1229495865448058881
2020-02-17 19:58:10,HaydnSchneider,,39,64,1384,"My corona virus paranoia has increased from a level 2 to a 4. Will keep you updated as I dive deeper into the rabbit hole.",,,,1229495272281169926,https://twitter.com/HaydnSchneider/status/1229495272281169926
2020-02-17 19:49:40,statsgh,,1,21,15,"There are about 400 Ghanaian students at the Corona Virus ridden Chinese city of Wuhan.",,,,1229493132515041286,https://twitter.com/statsgh/status/1229493132515041286
2020-02-17 19:26:04,PatriotM1A777,,3,37,14,"Breaking News - https://www.infowars.com/watch-alex-jones-show/ … Corona Virus is a weapon planned by China & Russia to attack & clean up America so Nation would collapse and be attacked & divided up between Russia & China. Could only be God's Intervention made it all go South?",,,,1229487194731171841,https://twitter.com/PatriotM1A777/status/1229487194731171841
2020-02-17 19:25:44,PeterSweden7,,39,336,967,"Wow. 760 million people are under lock down / travel restriction in China because of Corona virus. This is the biggest restriction on movement in history.",,,,1229487109330886660,https://twitter.com/PeterSweden7/status/1229487109330886660
2020-02-17 19:24:04,Murk361,,0,22,54,"‘It’s Crazy All This Talk About The Corona Virus Nowadays ... Funny Thing Is I Been Sick Ever Since You Left’ pic.twitter.com/tDhUpPgehI",,,,1229486688742912000,https://twitter.com/Murk361/status/1229486688742912000
2020-02-17 19:19:22,_High_Octane,,4,18,43,"Food delivery to corona patient at the new hospital. pic.twitter.com/a1DHiylhJ7",,,,1229485508637622277,https://twitter.com/_High_Octane/status/1229485508637622277
2020-02-17 19:18:49,Cernovich,,176,214,886,"No one in my generation has anything close to as culturally traumatic as the Great Depression. Corona Virus, if it spreads as it might, will mean that everyone reading this will lose someone they love to the sickness, in a horrific death.",,,,1229485368061227008,https://twitter.com/Cernovich/status/1229485368061227008
2020-02-17 19:14:07,MightiJamie,News24,170,358,815,"Is it me or is Bill Gates too interested in our medical well being in Africa. He cares about our malaria, polio and now corona. No schools built in Africa but a real passion for what makes us sick ? Maybe it’s just me ... https://twitter.com/News24/status/1229352322926628864 …",,,,1229484185246748681,https://twitter.com/MightiJamie/status/1229484185246748681
2020-02-17 19:05:25,Ikumar7,,8,8,24,"Religion is cancer - be it Islam, Hinduism, Christian or any. And religious practices are corona virus these practice will kill your brain cells slowly-slowly Wake me up the day these religions start providing Jobs, health care facilities & shelter to needy or else just FO.",,,,1229481995396239360,https://twitter.com/Ikumar7/status/1229481995396239360
2020-02-17 18:44:35,KelMaundu,,2,6,24,"THREAD: Kenyans should stop rejoicing now that Corona Virus is slowly killing the Chinese. These ninjas are Now a very important part of our lives. They control the biggest share of the Electronics Market. Mostly Businesses here depend on China.",,,,1229476754164715526,https://twitter.com/KelMaundu/status/1229476754164715526
2020-02-17 18:25:19,StephenPunwasi,SkyNews,4,7,28,"The impact of the corona virus was retroactive? Q4 ended weeks before the #CoronaVirus was first acknowledged. This was the global household debt bubble. https://twitter.com/SkyNews/status/1229354861898104833 …",,,#CoronaVirus,1229471904949555203,https://twitter.com/StephenPunwasi/status/1229471904949555203
2020-02-17 18:21:48,WanguthiClive,,14,111,197,"This is stranger than fiction. A book by Dean Koontz in 1981 speaks about the Corona virus even mentioning Wuhan,the place where the outbreak was first reported. We are being decimated! pic.twitter.com/NiWY0J2dxb",,,,1229471021239021570,https://twitter.com/WanguthiClive/status/1229471021239021570
2020-02-17 18:20:12,Blippblapp,,3,3,49,"Throwing darts at random numbers on a dartboard to make better guesstimates at chinese corona death toll than what the offical numbers show",,,,1229470619122720769,https://twitter.com/Blippblapp/status/1229470619122720769
2020-02-17 18:11:45,Valinomycin001,,6,12,14,"I remember I criticised Lagos state government when they talked about self-quarrantine with respect to people returning from countries with Corona virus. Recently found out they're doing the same thing in the UK so I have to chop this L",,,,1229468489779490817,https://twitter.com/Valinomycin001/status/1229468489779490817
2020-02-17 17:57:36,JuliusMaresh,,2,18,14,"PUTTING THINGS INTO PROPER PERSPECTIVE!!! Corona Virus has killed about 1700? people this far. ABORTION KILLS over 1000 daily & 60,000,000 since Roe vs Wade. Imagine the outcry if the virus was killing 1000 daily!!",,,,1229464929691951111,https://twitter.com/JuliusMaresh/status/1229464929691951111
2020-02-17 17:34:25,Ahmadinejad1956,,123,324,1370,"My deepest sympathy to the people and government of China and the respected families of the deceased by #Corona lab-made virus. I hope the Chinese nation , contrary to the will of their ill wishers, will soon overcome this imposed problem and pursue their progress. #China",,,#Corona #China,1229459096241307649,https://twitter.com/Ahmadinejad1956/status/1229459096241307649
2020-02-17 17:34:21,SidrahDP,SidrahDP,2,8,21,"Attn: @doctorsoumya Being the Chief Scientist of the @WHO and an Indian at that, would you like to comment on the sheer genius peeking out of India? Cow dung masks to keep corona away. The WHO is doing its best to fight the #coronoavirusoutbreak The Hindu Mahasabha may help.https://twitter.com/SidrahDP/status/1229455642861219842 …",,@doctorsoumya @WHO,#coronoavirusoutbreak,1229459078478348289,https://twitter.com/SidrahDP/status/1229459078478348289
2020-02-17 17:32:24,noonanjo,BrandyZadrozny,11,183,278,"A Chinese professor published a paper saying corona came from poor safety conditions at Wuhan lab. He published, then quick redacted. Went dark. Not suspicious at all given China's PR crackdown. Fortunately for China, reporters have decided this is all just a conspiracy theory https://twitter.com/BrandyZadrozny/status/1229450171274186753 …",,,,1229458590173421576,https://twitter.com/noonanjo/status/1229458590173421576
2020-02-17 17:20:42,SidrahDP,,11,34,105,"Hindu Mahasabha rocks. They will take India to unprecedented heights. First they said that Gobar ka mask will help fight corona virus & now this. I pray that this Corona anger doesn't incl. @smritiirani because she recently did a Egg fried rice & Chicken manchurian adventure.pic.twitter.com/qAMimJBySG",,@smritiirani,,1229455642861219842,https://twitter.com/SidrahDP/status/1229455642861219842
2020-02-17 17:13:08,RvanderDonk1,,9,52,55,"Xiaogan, Hubei: villagers refusing being detained in their homes fighting back. Police firing shots #covid19 #coronavirus #RandomActsOfKindnessDay #wuhan #wuhanflu #china #chinaflu #Corona pic.twitter.com/xdhDzWtBOd",,,#covid19 #coronavirus #RandomActsOfKindnessDay #wuhan #wuhanflu #china #chinaflu #Corona,1229453740484198402,https://twitter.com/RvanderDonk1/status/1229453740484198402
2020-02-17 17:00:54,KASHMIResque,SoporePolice,3,2,25,"Sopore Police exercising full precaution against the novel Corona Virus. https://twitter.com/SoporePolice/status/1229449960741097473 …",,,,1229450662926311427,https://twitter.com/KASHMIResque/status/1229450662926311427
2020-02-17 16:54:22,SolomonYue,VamosNadalClay,12,79,136,"We call a good/bad cop routine in politics. But Emperor Corona sees it as Trump stabs him in the back. Trump tested Emperor Corona at Mar-a-Lago in 2017 by unprecedentedly orderingSyria strike during their 1st state dinner. Xi failed the test w/o walking out 2 protest rudeness. https://twitter.com/VamosNadalClay/status/1229442703378636802 …",,,,1229449017634852875,https://twitter.com/SolomonYue/status/1229449017634852875
2020-02-17 16:49:26,yinkanubi,,0,18,61,"If anyone had predicted in Nov 2019, that in 2020 a Corona virus will strike the second biggest economy in the world and threatened global economic growth he would have been called crazy. Well here we are. The only thing constant right now is that nothing really is constant.",,,,1229447776200790017,https://twitter.com/yinkanubi/status/1229447776200790017
2020-02-17 16:49:22,khalidjoho,,22,54,102,"Can someone explain to me here.. book written and released in 1981 talking about Corona virus pic.twitter.com/qMvpKgjzGW",,,,1229447758869942275,https://twitter.com/khalidjoho/status/1229447758869942275
2020-02-17 16:33:05,saadrafi_,,4,42,62,"Everyone should be aware of whats happening in China! Yes we know there is Corona virus over there but dont forget whats happening with UIGHUR MUSLIMS either! This is whats happening in China! SHARE it and let everyone know about this! #China #UighurMuslims #China_is_terroristpic.twitter.com/CJERDLiXlK",,,#China #UighurMuslims #China_is_terroristpic,1229443659860467717,https://twitter.com/saadrafi_/status/1229443659860467717
2020-02-17 16:12:09,derrickmugonU,kanyindo,1,16,26,"God might be disappointed with the world Corona virus and locusts all in attack.Let us pray harder. https://twitter.com/kanyindo/status/1229368641227051009 …",,,,1229438391764357127,https://twitter.com/derrickmugonU/status/1229438391764357127
2020-02-17 16:03:15,LarryBoorstein,nytimes,14,7,31,"Senator Tom Cotton has outdone himself with the idiocy of implying that China attacked itself with biological weapons in the Corona virus epidemic. China is a signatory of international bans on biological weapons.",,,,1229436151875936258,https://twitter.com/LarryBoorstein/status/1229436151875936258
2020-02-17 16:00:20,csthetruth,,4,41,37,"Is Mainstream Media Finally Acknowledging Corona Virus as a Man Made Bioweapon? with Ole Dammegard https://www.pscp.tv/w/cRqwFDFBbVF6dkRyeE5xUWV8MWxQSnFWZ0RYRE54YuMCixw0ylzLYKbp4cqx_l2psh084Ol9J0cjYJAz3vIq …",,,,1229435419898417152,https://twitter.com/csthetruth/status/1229435419898417152
2020-02-17 15:46:03,SolomonYue,RFA_Chinese,11,95,125,"Former Chongqing Mayor 黄奇帆 Huang Qifan is right about #coronaviruschina will destroyas the world's factory. Emperor Corona's coverup is responsible for further decoupling. https://twitter.com/RFA_Chinese/status/1229421855007793152 …",,,#coronaviruschina,1229431823140175872,https://twitter.com/SolomonYue/status/1229431823140175872
2020-02-17 15:31:38,BTN49093417,,5,11,28,"Why is fox news calling the Corona Virus a disease all of a sudden? Wtf is going on Now? Smdh",,,,1229428195155378176,https://twitter.com/BTN49093417/status/1229428195155378176
2020-02-17 15:18:04,Reddsaidit,,4,6,87,"While corona out here virusing you got about a half a cough before you getting knocked out. I’m not playing with none of y’all!!",,,,1229424783734919168,https://twitter.com/Reddsaidit/status/1229424783734919168
2020-02-17 15:13:00,dramanksingh,,3,9,41,"@Shehzad_Ind - saying due to corona virus Jamia students were wearing masks.",,@Shehzad_Ind,,1229423508486144001,https://twitter.com/dramanksingh/status/1229423508486144001
2020-02-17 15:04:27,YnysAfallon,,0,6,20,"Caer Arianrhod - the Fortress of Arianrhod - was an isle off the coast of Wales ruled by its namesake lady. A legendary sunken isle, rock formations are visible from shore when the tide is low enough. Caer Arianrhod is also the Welsh name for the Corona Borealis. #MythologyMondaypic.twitter.com/gbz6rMV9uO",,,#MythologyMondaypic,1229421355738783744,https://twitter.com/YnysAfallon/status/1229421355738783744
2020-02-17 15:01:55,news_translator,arunprakash4,2,5,20,"It’s going to die out in spring when temps rise. Pathogens like Corona don’t last long in warmer weather. April will be the end of Corona. At least in surrounding countries with low levels of infected population.",,,,1229420720649887744,https://twitter.com/news_translator/status/1229420720649887744
2020-02-17 14:34:41,LydiaMw09347995,,5,9,28,"The miracles are here,the judgements are here including the corona virus,the zika virus,the locusts and all of them have the same message, repent and prepare for the coming of the MESSIAH pic.twitter.com/aoxbNNBrOi",,,,1229413866486083584,https://twitter.com/LydiaMw09347995/status/1229413866486083584
2020-02-17 14:28:25,SolomonYue,,8,86,146,"Can you guys picture powerful Emperor Corona kneels down & beg President Trump for delaying the purchases under the Phase I trade deal? Would @remonwangxt like to draw another picture for us? https://twitter.com/SCMPNews/status/1229400649399521282 …pic.twitter.com/MXj3WcwdSg",,@remonwangxt,,1229412289750564864,https://twitter.com/SolomonYue/status/1229412289750564864
2020-02-17 14:26:10,PatriotZk7,StormIsUponUs,0,15,33,"Corona virus—The Latest Desperate act—of [Cabal] assets! Gates Foundation—holds the Patent!!—WHY IS THIS??!! BECAUSE: THIS WAS ALL PLANNED OUT! EXPECT—More FFs as arrests & indictments materialize!! STAY STRONG—Patriots IN CONTROL! #TrustThePatriots",,,#TrustThePatriots,1229411720818515968,https://twitter.com/PatriotZk7/status/1229411720818515968
2020-02-17 14:18:12,we_are_stardom,,14,32,281,"Due to the current situation in Japan with the corona virus outbreak, we will provide information tomorrow around 16:00 Japan time in regards to the status of upcoming Stardom related events.",,,,1229409718537347074,https://twitter.com/we_are_stardom/status/1229409718537347074
2020-02-17 14:14:39,nakablackksheep,,1,7,55,"Kavango rappers: I was sharing a corona with an HIv positive person, call it corona virus.",,,,1229408825238835202,https://twitter.com/nakablackksheep/status/1229408825238835202
2020-02-17 14:01:50,THE_REDLILY,,7,184,97,"THREAD: CORONA VIRUS IN AMERICA QUARANTINED COMES HOME The first plane touched down at Travis Air Force Base in California just before 11:30 p.m. local time. The second flight landed at Lackland Air Force Base in Texas roughly 2 1/2 hours later. https://www.foxnews.com/health/coronavirus-quarantine-diamond-princess-cruise-ship-chartered-flights …",,,,1229405596367179778,https://twitter.com/THE_REDLILY/status/1229405596367179778
2020-02-17 14:00:06,libertytarian,,6,87,124,"Watch Live: China Corona-Effect: Destroying, Hoarding Toilet Paper - SHTF Cashless Society https://www.pscp.tv/w/cRqT5jFXTEVSWlBlRHpFYkR8MUJSSmpRZG9wcWpHd2S3j7N4HenHspCSyEaHLLv3yUgXPFWoWCvVtJzYbWAo …",,,,1229405162168438785,https://twitter.com/libertytarian/status/1229405162168438785
2020-02-17 13:56:59,MADE__USA,,83,275,656,"Was the corona-virus used to kill the protesters in Hong Kong on purpose??? Population control gone wrong?? Was it just another fatal man made mistake?? What the heck is really going on??",,,,1229404377389162504,https://twitter.com/MADE__USA/status/1229404377389162504
2020-02-17 13:53:43,TravisABC13,,3,12,94,"Words fail me to describe this wonder in the night sky. You’re looking at an intense moon halo with moon dogs and a corona. Captured by photographer Brent Mckean in Manitoba, Canada. You can see more of his work with 501 North Photography here: @BrentMckean501.pic.twitter.com/PYQAQr9lvL",,@BrentMckean501,,1229403555590737921,https://twitter.com/TravisABC13/status/1229403555590737921
2020-02-17 13:43:17,pete58bos,GoP__Botched,7,9,110,"Does that mean every MAGA will get the virus if they drink corona while wearing the hat?",,,,1229400929083981824,https://twitter.com/pete58bos/status/1229400929083981824
2020-02-17 12:57:18,docolumide,,1,12,25,"Interesting. A lot of the technologies being deployed by China in response to their Corona virus crisis are going to become table stakes in how things are done in many places in the world, even after the threat of Corona has significantly receded. https://www.scmp.com/tech/policy/article/3050940/schools-remaining-closed-during-coronavirus-outbreak-china-launches …",,,,1229389356667981825,https://twitter.com/docolumide/status/1229389356667981825
2020-02-17 12:47:55,comeonandfarce,,21,3,108,"There is a high probability that @billhandelshow will say today that I have Covid 2019 corona virus. That is false and he is a putz.",,@billhandelshow,,1229386995790540809,https://twitter.com/comeonandfarce/status/1229386995790540809
2020-02-17 12:47:20,JustineLumumba,,7,22,67,"Message Of Goodwill and Solidarity with the Communist Party Of China in respect to the outbreak of the Corona Virus. @NRMOnline @ChineseEmb_Ugapic.twitter.com/pLLcwczTmz",,@NRMOnline @ChineseEmb_Ugapic,,1229386848033746945,https://twitter.com/JustineLumumba/status/1229386848033746945
2020-02-17 12:39:06,AllanMargolin,,4,14,33,"EVERY Corona Virus Report Should Also Include The Fact That More Than 14K Americans Died From The Flu Last Year - To Put The 'Zombie Apocalypse' In Perspective. Agree?",,,,1229384779579219968,https://twitter.com/AllanMargolin/status/1229384779579219968
2020-02-17 12:33:18,caravanistan,,5,22,39,"I'm getting reports of tourists quarantined (for unknown duration) in Turkmenistan for fear of corona. I recommend everyone to not visit Turkmenistan at the moment, unless you want to spend a few weeks in a hospital for no reason other than paranoia.",,,,1229383316823998464,https://twitter.com/caravanistan/status/1229383316823998464
2020-02-17 12:30:30,devin_beavers,,3,24,15,"It will be interesting to see how we handle this influx of corona virus. https://www.yahoo.com/gma/14-americans-evacuated-cruise-ship-japan-test-positive-095501551--abc-news-topstories.html?soc_src=newsroom&soc_trk=com.apple.UIKit.activity.PostToTwitter&.tsrc=newsroom …",,,,1229382613996949504,https://twitter.com/devin_beavers/status/1229382613996949504
2020-02-17 12:18:22,fsulayman_,,7,17,25,"“If you hear that there’s plague in a land, do not go there, and if it breaks out in a land where you are, do not leave, fleeing from it.” So what about this case of corona? Does it apply to cases like this? Anyone with reliable answers? Islam based please, I want to know.",,,,1229379561567199234,https://twitter.com/fsulayman_/status/1229379561567199234
2020-02-17 11:46:25,DjNewAfrica,News24,10,47,84,"Bill gates is about to unleash the Corona virus on us. South Africans will be the first to die considering he loves coming here https://twitter.com/News24/status/1229352322926628864 …",,,,1229371517856813056,https://twitter.com/DjNewAfrica/status/1229371517856813056
