date,username,to,replies,retweets,favorites,text,geo,mentions,hashtags,id,permalink
2020-04-04 16:23:15,Perrid13,yashar,49,97,2212,"""Corona 19, meaning there's been at least 18 other ones"" and Drew agrees with the caller... IT WAS DISCOVERED IN 2019, THAT'S WHY IT'S COVID-*19*.",,,,1246473414661079042,https://twitter.com/Perrid13/status/1246473414661079042
2020-04-04 16:23:00,maingi_muchiri,,8,13,81,"Corona came to the wrong continent! pic.twitter.com/j6j2eMSBdT",,,,1246473353822711809,https://twitter.com/maingi_muchiri/status/1246473353822711809
2020-04-04 16:22:42,NickGriffinBU,,21,41,132,"Muslims hit far harder by Corona than the natives.Give it a couple of weeks and that'll be our fault too... https://web.archive.org/web/20200320142508/https://www.independent.co.uk/voices/coronavirus-muslim-mosque-closure-prayer-nhs-a9411936.html …",,,,1246473278010593281,https://twitter.com/NickGriffinBU/status/1246473278010593281
2020-04-04 16:21:47,abhijeet_dipke,,8,171,299,"Modi continues his vendetta politics against @ArvindKejriwal, even during the pandemic. Centre allocated 17,000 crores for all states amid corona crisis, but didn't allocate a single rupee for Delhi. Shame on this Government! Don't stoop so low, not at least in this crisis.",,@ArvindKejriwal,,1246473047906762752,https://twitter.com/abhijeet_dipke/status/1246473047906762752
2020-04-04 16:19:07,MajorTheBull,pnschmidt,0,14,78,"WE WILL DESTROY YOU CORONA https://twitter.com/pnschmidt/status/1246441976372789248 …",,,,1246472378143715328,https://twitter.com/MajorTheBull/status/1246472378143715328
2020-04-04 16:18:49,reshma_alam9,,17,30,209,"1st Sunday: Clap 2nd Sunday: Candle 3rd Sunday: Cake Happy Birthday Corona",,,,1246472300213526546,https://twitter.com/reshma_alam9/status/1246472300213526546
2020-04-04 16:18:34,_Diri_B,,1,21,35,"Me when this Corona shit is over pic.twitter.com/FmzLqDOtCH",,,,1246472237173129216,https://twitter.com/_Diri_B/status/1246472237173129216
2020-04-04 16:17:11,Being_Humor,nikhilchinapa,14,172,572,"When #TablighiJamaat caught spreading Corona.. this mf wants to take us back to about migrants whom @ArvindKejriwal chased away from Delhihttps://twitter.com/nikhilchinapa/status/1246400112814768129 …",,@ArvindKejriwal,#TablighiJamaat,1246471891155668992,https://twitter.com/Being_Humor/status/1246471891155668992
2020-04-04 16:17:08,neiljetel,,4,13,28,"corona lock down daily dip a sable doing what a sable does pic.twitter.com/ileNcJSwWO",,,,1246471875150196740,https://twitter.com/neiljetel/status/1246471875150196740
2020-04-04 16:16:39,Pirano_Dj,,12,59,232,"The #HomeBrewed Livestream residency w/ @RealBlackCoffee starts tonight. 12PM, LA / 3PM, NYC / 9PM, JNB Feel free to donate as he is raising funds for SA's Solidarity Fund to assist in anyway with the Corona Virus. #WeAreOne Visit https://gf.me/u/xuwpn6 to donate.pic.twitter.com/AWYlZsSW43",,@RealBlackCoffee,#HomeBrewed #WeAreOne,1246471755956457472,https://twitter.com/Pirano_Dj/status/1246471755956457472
2020-04-04 16:16:29,21WIRE,,12,135,236,"GOV'T POST 9/11: Invisible enemy is everywhere, must give up all rights, liberties to 'keep us all safe'. Dissent: unpatriotic GOV'T POST CORONA: Invisible enemy is everywhere, must give up all rights, liberties to 'keep us all safe'. Dissent: dangerous #coronavirus #COVID19",,,#coronavirus #COVID19,1246471714210529280,https://twitter.com/21WIRE/status/1246471714210529280
2020-04-04 16:15:37,JournoAshutosh,,20,237,375,"Delhi dy CM Manish Sisodia writes to Union Finance Minister N. Sitharaman - ""Centre gave Rs 17,287 Crores to States as relief assistance to fight Corona virus, but not a single rupee to Delhi."" pic.twitter.com/7uZB3UcPu2",,,,1246471494957318144,https://twitter.com/JournoAshutosh/status/1246471494957318144
2020-04-04 16:15:14,FOX19Tricia,,21,13,164,"On that video surfacing showing people gathering and saying “F—- the corona virus” etc in OTR @GovMikeDeWine says, “Very dangerous. Vast majority of Ohioans doing a great job on distancing. Thanks to mayor Cranley , PD’s , sheriff and health Dept for their great work.” @FOX19",,@GovMikeDeWine @FOX19,,1246471399478345730,https://twitter.com/FOX19Tricia/status/1246471399478345730
2020-04-04 16:15:00,Yeonyxf,,2,65,48,"X1 REBOOT CORONA DISBAND.",,,,1246471340611100673,https://twitter.com/Yeonyxf/status/1246471340611100673
2020-04-04 16:14:42,emmieluwh0,,2,5,18,"Something ain’t adding up with this whole corona virus thing.",,,,1246471266749394944,https://twitter.com/emmieluwh0/status/1246471266749394944
2020-04-04 16:14:19,NationalERKe,,2,25,27,"Learn how to wear and remove a mask as taught by Dr. Mary Beth Maritim. We are in this together. Tukomeshe Corona. #komeshacorona #COVID19KE #WeShallOvercomeCoronapic.twitter.com/jzJLGPvzm3",,,#komeshacorona #COVID19KE #WeShallOvercomeCoronapic,1246471168074416128,https://twitter.com/NationalERKe/status/1246471168074416128
2020-04-04 16:14:19,saahilmenghani,,12,147,451,"#VERIFIED Number of samples tested in India-79950 Samples tested today-11,182. Highest in a day. Yesterday- 10034 A total of 3113 corona positives till date Took 4 days to go from 1k to 2k & 2 days to touch 3k Deaths till date-75 These are offical figs from govt",,,#VERIFIED,1246471166866239488,https://twitter.com/saahilmenghani/status/1246471166866239488
2020-04-04 16:13:26,MinhajulQuran,,1,38,55,"May ALLAH Almighty keep you, your family & your loved ones safe & healthy from #CORONA Virus, all evils & diseases. Aameen @eLearningMQI by Minhaj-ul-Quran International (Official) WhatsApp #: +92-321-642-8511 http://www.eQuranClass.com http://www.eIslamLearning.com pic.twitter.com/mLyiJhmfmb",,@eLearningMQI,#CORONA #,1246470944027291654,https://twitter.com/MinhajulQuran/status/1246470944027291654
2020-04-04 16:13:15,pauldashworth,,59,187,285,"RIP DANIEL: A man, 34, who suffered bipolar disorder has taken his own life after being unable to cope with self-isolation during the #COVID19 pandemic. Daniel Furniss died last week after struggling with the lockdown. #coronavirus #corona #coronavirusukhttps://uk.news.yahoo.com/coronavirus-covid-19-suicide-isolation-123941486.html …",,,#COVID19 #coronavirus #corona #coronavirusukhttps,1246470901266251785,https://twitter.com/pauldashworth/status/1246470901266251785
2020-04-04 16:13:10,Owolabi357,,9,9,33,"Even in this quarantine period see as pesin eyes bulge out . This boredom is entering another level I swear. Corona please na you’ve done enough you can go now pic.twitter.com/PGVsZ9TfWt",,,,1246470879929872384,https://twitter.com/Owolabi357/status/1246470879929872384
2020-04-04 16:11:24,arjunmodhwadia,,4,17,27,"In hours of crisis, nation’s strength needs to be focused on defeating Corona. PM's thoughtless announcement of “switching lights & Light A Candle/ Diya"" are feared to cause disaster of nationwide breakdown of electricity. GoI is on damage control! #ModiDisasterpic.twitter.com/uXqUgcryor",,,#ModiDisasterpic,1246470435065049094,https://twitter.com/arjunmodhwadia/status/1246470435065049094
2020-04-04 16:09:15,sunandavashisht,,30,220,770,"Only Arundhati Roy can write 2345679632 words on #coronavirus without mentioning China:) You can be forgiven if you thought Corona is a Brahminical disease which finds its genesis in caste system:) You got to love Godess of zero intellect - Ms. Roy",,,#coronavirus,1246469895098957826,https://twitter.com/sunandavashisht/status/1246469895098957826
2020-04-04 16:08:21,DenzelMabasa1,AdvoBarryRoux,2,9,65,"After this corona thingy you will learn that money is made to take care of u not for u to take care of it because it becomes useless to have it but not having a place to spend it",,,,1246469667381817344,https://twitter.com/DenzelMabasa1/status/1246469667381817344
2020-04-04 16:08:16,thakur_shivangi,,13,23,147,"Update : #Maharashtra corona positive cases stands at 635 and as of now 32 people lost their lives due to Covid 19.",,,#Maharashtra,1246469645206355968,https://twitter.com/thakur_shivangi/status/1246469645206355968
2020-04-04 16:05:52,fussybabybitch,,3,13,105,"It’s incredible how the corona crisis is really demonstrating the feasibility and necessity of previously “radical” policies; M4A, Universal Basic Income, gov’t issued GFs, mandated sick pay",,,,1246469041637560321,https://twitter.com/fussybabybitch/status/1246469041637560321
2020-04-04 16:05:36,VishweshwarBhat,,6,21,101,"Pope is reluctant to shaking hands or refraining people to kissing his ring in the time of pandemic Corona. It’s really funny. pic.twitter.com/ucUUlqOIR8",,,,1246468973215936517,https://twitter.com/VishweshwarBhat/status/1246468973215936517
2020-04-04 16:05:29,twtselma,,29,44,1311,"maybe if millennials weren’t addicted to their phones all the time the corona virus wouldn’t exist. staying inside all day being lazy just makes you weaker. get off your phone and go outside. live life!",,,,1246468944296169472,https://twitter.com/twtselma/status/1246468944296169472
2020-04-04 16:05:00,homorrsexual,,4,3,45,"you’d think republicans would take corona more seriously since their entire voter base is about to d!e",,,,1246468823152287747,https://twitter.com/homorrsexual/status/1246468823152287747
2020-04-04 16:04:54,JimmLF,OhioState,0,54,341,"O come let's mourn Ohio State And tweets to all who graduate While our moneys refunding still With Joy which corona Alone can kill Spring breaks length Our hometowns old The semesters passed We're zoom enrolled Time and change Will surely show How firm thy WiFi O-God-No https://twitter.com/OhioState/status/1246202029011279876 …",,,,1246468797734834176,https://twitter.com/JimmLF/status/1246468797734834176
2020-04-04 16:03:44,saba_bee,,4,13,38,"I have teamed up with @sikanderbizenjo & @BanariMengal & volunteers in various districts of Balochistan under BYAC (Balochistan Youth Against Corona) @BYACBalochistan we are raising funds for providing ration to the needy people of the province & protective gear. @jam_kamalpic.twitter.com/AqlNLrc9ow",,@sikanderbizenjo @BanariMengal @BYACBalochistan @jam_kamalpic,,1246468505379188736,https://twitter.com/saba_bee/status/1246468505379188736
2020-04-04 16:02:02,DoveSyriana,LotusOak2,4,23,38,"Why doesn't he test out on the new corona vaccine on his kids before telling the public to do it? https://twitter.com/LotusOak2/status/1246154696437489664 …",,,,1246468076566204417,https://twitter.com/DoveSyriana/status/1246468076566204417
2020-04-04 16:01:27,MahmudKullane,millardayo,2,9,18,"Social distancing is not all about protecting yourself from the Corona Virus, Social Distancing is also there so we reduce the rapid rate of this highly contagious virus but what do I know, twendeni tukafanye kazi!!!!! https://twitter.com/millardayo/status/1246423971085639681 …",,,,1246467931376160769,https://twitter.com/MahmudKullane/status/1246467931376160769
2020-04-04 16:01:26,dancohen3000,,9,134,162,"Neoliberalism in action: Emergency medical services in Guayaquil, Ecuador continue to be totally overwhelmed by Corona virus. A corpse was left on a bench in the street with a sign saying they called 911 and help never came. pic.twitter.com/aHCpnOFio7",,,,1246467926443667456,https://twitter.com/dancohen3000/status/1246467926443667456
2020-04-04 16:01:11,KEENANMULVANEY,,5,40,158,"HATE CORONA? LOVE TO PARTY? pic.twitter.com/ysmUbbM2Jk",,,,1246467862849519616,https://twitter.com/KEENANMULVANEY/status/1246467862849519616
2020-04-04 16:00:01,Indianfemdomboy,,16,244,171,"Must Check Pin Tweet ✓ Maybe She is from South •Foot Gagging • Video Lenght ✓ 12Min Retweet This Video to get Full Video #Indianfemdom #Indianfemdomvideo Please Drop msg after doing retweet in Dm/Inbox Follow ✓ @Indianfemdomboy ←Stay Safe From Corona→ pic.twitter.com/inxI9g6qdG",,@Indianfemdomboy,#Indianfemdom #Indianfemdomvideo,1246467569537691653,https://twitter.com/Indianfemdomboy/status/1246467569537691653
2020-04-04 16:00:01,thecaravanindia,,1,19,24,"""This man was deliberately aiming at my face and shouted ‘corona.’ He could clearly identify a ‘chinky,’ a race deemed inferior than that of the mainland Indians."" @KimiColney reports: http://bit.ly/2RbcciN #CoronavirusPandemic",,@KimiColney,#CoronavirusPandemic,1246467568556060675,https://twitter.com/thecaravanindia/status/1246467568556060675
2020-04-04 16:00:00,NinjaEconomics,,3,8,21,"Mexico stops brewing Corona beer, deemed non-essential http://a.msn.com/00/en-us/BB126lw8?ocid=st2 …",,,,1246467564919820288,https://twitter.com/NinjaEconomics/status/1246467564919820288
2020-04-04 15:59:38,LicypriyaK,,1,17,73,"Lockdown orders in 1918 to prevent spread of Spanish Influenza, which must be twin brother/sister of corona virus. According to Wikipedia, the toll of this flue was very high:The Spanish flu (also known as the 1918 flu pandemic[2])was an unusually deadly influenza pandemic.(1/3) pic.twitter.com/2e9acqqDhf",,,,1246467474863738880,https://twitter.com/LicypriyaK/status/1246467474863738880
2020-04-04 15:59:14,SportaSmile,,1,28,59,"This is an informative dashboard built by @danielgavrilov and team at https://ourworldindata.org/coronavirus#are-countries-bending-the-curve … #coronavirus #CoronavirusPandemic #Corona pic.twitter.com/YysD1KgkOt",,@danielgavrilov,#are #coronavirus #CoronavirusPandemic #Corona,1246467373969870853,https://twitter.com/SportaSmile/status/1246467373969870853
2020-04-04 15:57:55,theMemesBot,,2,47,259,"Corona's an operation created by the Chinese bourgeois pic.twitter.com/QNqitVTt8n",,,,1246467042460434433,https://twitter.com/theMemesBot/status/1246467042460434433
2020-04-04 15:56:59,DaharwalK,,3,16,21,"Only #ModiTheWorldLeader can Pahle: Main tumhare khaton me 15lakh black money Swiss bank se lakar dalunga Ab::Tum log pahle ""PMCares fund"" Me paisa dalo, tab Corona virus ka illaj karenge Can you ever expect any other leader in d world could plan it? #ModiTheWorldLeader",,,#ModiTheWorldLeader #ModiTheWorldLeader,1246466804592959488,https://twitter.com/DaharwalK/status/1246466804592959488
2020-04-04 15:56:21,papichulomin,,9,7,89,"$35k for a corona test i wouldn’t pay that if it cured depression lmao",,,,1246466647096987648,https://twitter.com/papichulomin/status/1246466647096987648
2020-04-04 15:55:50,DownieSeb,,3,9,57,"If you don’t come out of this quarantine with either: 1) A beard and mental trauma like Tom Hanks in Cast Away, 2) 500 empty Amazon boxes to build a Corona Fort from 3) A desperate hatred of the people in the flat above You didn’t ever lack the time, you lacked the discipline.",,,,1246466516545146882,https://twitter.com/DownieSeb/status/1246466516545146882
2020-04-04 15:55:27,ThePlacardGuy,,36,31,553,"Marked safe during Corona Outbreak! pic.twitter.com/aub4wISF39",,,,1246466419535085568,https://twitter.com/ThePlacardGuy/status/1246466419535085568
2020-04-04 15:51:45,zerofskaya,,4,36,64,"Germans have “corona taxis,” medics who visit patients 5-6 days into illnesss, looking for decline. “When I have an early diagnosis and can treat early—for example put them on a ventilator before they deteriorate—the chance of survival is much higher.” https://nyti.ms/2JEVPH6",,,,1246465487548153857,https://twitter.com/zerofskaya/status/1246465487548153857
2020-04-04 15:51:27,docbhooshan,,7,9,52,"Dhauladhar visible from Jalandhar, Pir Panjal from Jammu. India gate visible in Delhi. Blue Yamuna meandering happily. Squirrels in parks. Will we be mindful of our polluting actions once Corona is behind us and we aim to be 5 T economy soon?",,,,1246465412209889280,https://twitter.com/docbhooshan/status/1246465412209889280
2020-04-04 15:50:17,Jed38111039,CyrilRamaphosa,0,11,15,"The headlines must be: ""The chairperson of AU has endorsed Bill Gates Corona viccination meant to be used on Africans as guinea pigs"" https://twitter.com/CyrilRamaphosa/status/1246452035022700548 …",,,,1246465120223584257,https://twitter.com/Jed38111039/status/1246465120223584257
2020-04-04 15:50:06,ExtinctionR,,7,144,293,"The system was already broken. Corona is just making it more evident how much. #SystemChange #NewStoryhttps://www.ft.com/content/10d8f5e8-74eb-11ea-95fe-fcd274e920ca …",,,#SystemChange #NewStoryhttps,1246465072261746693,https://twitter.com/ExtinctionR/status/1246465072261746693
2020-04-04 15:49:53,HinaMaharN,,0,8,11,"Meet up w/ TariqJameel was d 1st step taken by #IK against corona. Not sarcasm but fact. His backing resulted in Ijtama's continuation. As Punjab has crossed 1k cases & 285 r from TableegiJamat, organizers of Ijtama must b jailed & tried. This national damage cld hv bn prevented.",,,#IK,1246465021393109003,https://twitter.com/HinaMaharN/status/1246465021393109003
2020-04-04 15:49:22,HgAbhi,,5,78,90,"Media is more dangerous then Corona now a Days.... #टीवी_देखना_बंद_करोpic.twitter.com/g07dJAK1fQ",,,#ट,1246464891398967296,https://twitter.com/HgAbhi/status/1246464891398967296
2020-04-04 15:48:47,RdFalls,,7,7,59,"A wee 5 year old child died of Corona Virus. Such a tragedy.",,,,1246464742807539712,https://twitter.com/RdFalls/status/1246464742807539712
2020-04-04 15:47:51,Sarah_Badawi,,6,2,33,"News: My fiancé @the_omeed hit peak #corona boredom and joined Twitter. Please help me welcome him with a follow! (Working our way towards TikTok. Baby steps! ) pic.twitter.com/DfD6Ukg5KK",,@the_omeed,#corona,1246464508601733122,https://twitter.com/Sarah_Badawi/status/1246464508601733122
2020-04-04 15:47:08,Coal_City,,7,13,18,"We went into the Streets Of Enugu and Abakaliki to ask people what they know about Corona Virus #COVIDー19 and how to stay safe during the #COVID19Pandemic Here are cuts for your viewing pleasure. Main video coming soon. #CoalcityConnectpic.twitter.com/TpGEhJIdJD",,,#COVIDー19 #COVID19Pandemic #CoalcityConnectpic,1246464329127538689,https://twitter.com/Coal_City/status/1246464329127538689
2020-04-04 15:46:11,stjohnsambulanc,,1,2,36,"We would like to reassure our volunteers and Amanda Holden that our high tech communications do not operate on 5G so will not pass on corona virus. We just wanted to make that clear. pic.twitter.com/bhAQmWJE0u",,,,1246464087355203584,https://twitter.com/stjohnsambulanc/status/1246464087355203584
2020-04-04 15:46:03,deniasza,,5,28,74,"As we diligently and religiously respond to the lockdown calls, the whole idea is about observing & implementing Preventive & Safety measures to save lives and stop the spread of the CORONA virus. With God & requisite discipline, Zimbabwe will overcome the scourge and its effects pic.twitter.com/jwvQdejGMB",,,,1246464052756393988,https://twitter.com/deniasza/status/1246464052756393988
2020-04-04 15:45:45,Shiling_Oil,sirpayne,1,4,19,"Corona might just be in that fridge https://twitter.com/sirpayne/status/1246393744020160512 …",,,,1246463979246911488,https://twitter.com/Shiling_Oil/status/1246463979246911488
2020-04-04 15:45:08,katiefox0,,7,124,495,"corona betta get her ass back in the house before @RollingLoud comes pic.twitter.com/hSuhQrqgi6",,@RollingLoud,,1246463825689313280,https://twitter.com/katiefox0/status/1246463825689313280
2020-04-04 15:44:47,MKG_II_0,,3,18,26,"4) Subhash Babu also knew that there wud be no freedom by asking for blood. 5) Ramdas Swami also knew that Hindus would not come together by just chanting Jai Jai Raghuvir Samarth. 6) Similarly, Modi knows that corona will not go by clapping or deepotsav. @Mahesh10816 @rspchary",,@Mahesh10816 @rspchary,,1246463734991577094,https://twitter.com/MKG_II_0/status/1246463734991577094
2020-04-04 15:44:04,XcusMy_cARIsma,,1,6,62,"My 90 year old great grandmother beat Corona. Tell me what God won’t do.",,,,1246463556415115264,https://twitter.com/XcusMy_cARIsma/status/1246463556415115264
2020-04-04 15:43:58,CharlesFinch,,1,42,102,"LAT is just killing this kind of corona service journalism. It's the first paper I go to in the mornings now. https://www.latimes.com/business/story/2020-04-03/freelancers-unemployment-pay-coronavirus …",,,,1246463531932733441,https://twitter.com/CharlesFinch/status/1246463531932733441
2020-04-04 15:43:42,chandrashmi1,,5,38,37,"Within 6 years, the global image of India has changed. The world is seeing us with more respect & expectations. This Chinese Corona virus attack is just world war 3 and India will win this war and wil save world. Thanks to @narendramodi Ji. #ModiTheWorldLeaderpic.twitter.com/JyMoK0aMEq",,@narendramodi,#ModiTheWorldLeaderpic,1246463461837570048,https://twitter.com/chandrashmi1/status/1246463461837570048
2020-04-04 15:42:33,Agent_AKie,,6,51,76,"In times like this, the Muslim community has pledged 7 million to assist with Corona.... Are Christians getting together to plant ""thier"" seed to assist? #Day9ofLockdown",,,#Day9ofLockdown,1246463175337357312,https://twitter.com/Agent_AKie/status/1246463175337357312
2020-04-04 15:42:29,ZahoorBuledi,,4,12,39,"LATEST Update on COVID-19 in Balochistan at 08:00 pm on 04/4/20: Total tests conducted = 2,513 Corona positive = 185 Negative = 2,206 Results awaited = 122 Deaths = 1 Persons recovered = 17 No of people in Quarantine = 335",,,,1246463155733245952,https://twitter.com/ZahoorBuledi/status/1246463155733245952
2020-04-04 15:41:40,FaheemTanoli,,4,67,113,"Prime minister @ImranKhanPTI was right about the corona virus affect on youngsters. The below chart about the deaths in England confirms what he said but our pinhead journalists made fun of him. @Aakbar84 @MashwaniAzhar @umar8528 @Lalika79 @MaddyWithKhan @PTIofficialpic.twitter.com/XDS8gTZnqx",,@ImranKhanPTI @Aakbar84 @MashwaniAzhar @umar8528 @Lalika79 @MaddyWithKhan @PTIofficialpic,,1246462952963739650,https://twitter.com/FaheemTanoli/status/1246462952963739650
2020-04-04 15:41:33,UvesKha7863,,14,81,118,"Two-faced journalists are more deadly than Corona. #टीवी_देखना_बंद_करोpic.twitter.com/L4po3jfLCB",,,#ट,1246462922974347264,https://twitter.com/UvesKha7863/status/1246462922974347264
2020-04-04 15:41:23,martijnkatan,,1,17,46,"Chinese doctors injected serum of recovered patients into patients with life-threatening COVID-19. First results hopeful; larger trials needed to tell if this works. Requires ~ 1 liter of blood each. This may be the fastest route to a cure for corona. https://jamanetwork.com/journals/jama/fullarticle/2763983 …",,,,1246462880037449739,https://twitter.com/martijnkatan/status/1246462880037449739
2020-04-04 15:41:19,TheAmitLakhani,,1,83,50,"In the times when all indian citizens r fighting against the spread of corona in whatever way they can, @NCWIndia is spreading hate against men. Trying to form a false perception tht men r subjecting their wifes to domestic violence in these times. Shameful! #NCWmisusesCorona",,@NCWIndia,#NCWmisusesCorona,1246462861959991296,https://twitter.com/TheAmitLakhani/status/1246462861959991296
2020-04-04 15:41:01,elie_h,,0,5,20,"CORONA! We will rock you To all healthcare professionals in this world, we say Thank You @Anghami x @8eArtLB #StayHome #staysafe #healthworkers #Covid_19 https://play.anghami.com/video/73170197?branchId=/Q45zzHmBp5 …pic.twitter.com/fROQsWT5fK",,@Anghami @8eArtLB,#StayHome #staysafe #healthworkers #Covid_19,1246462788718952450,https://twitter.com/elie_h/status/1246462788718952450
2020-04-04 15:40:10,eduolpe,,3,11,30,"I know this is not a corona paper, but I am so proud of this review published today in @IJMS_MDPI on ""Potential Molecular Pathways Related to Pulmonary Artery Aneurysm Development: Lessons to Learn from the Aorta"". Amazing job @JorgeNuche! @MDPIOpenAccesshttps://www.mdpi.com/682840",,@IJMS_MDPI @JorgeNuche @MDPIOpenAccesshttps,,1246462574402600960,https://twitter.com/eduolpe/status/1246462574402600960
2020-04-04 15:39:56,abisat,,4,15,55,"Some thoughts on #EmergingMarkets FX. @RobinBrooksIIF has been making a compelling case for letting EM FX play the role of (Corona) shock absorber. The alternative—the “real economy” adjusting instead— is economically, politically and socially an inferior outcome. 1/5",,@RobinBrooksIIF,#EmergingMarkets,1246462516340887552,https://twitter.com/abisat/status/1246462516340887552
2020-04-04 15:39:49,AparnaKarthi,,137,988,5364,"At least three CMs - TN, Kerala and Maharashtra - have spoken decisively asking people not to communalise the corona virus spread. Thank god for them!",,,,1246462486087426050,https://twitter.com/AparnaKarthi/status/1246462486087426050
2020-04-04 15:38:44,MiriamRehm,,1,12,21,"What can we learn from the treatment of thousands of #Corona patients in Wuhan? Shorter work hours! Moving from 12-14 hours to 6 hour shifts dramatically reduced the infection rates of essential health personnel. https://www.riffreporter.de/corona-virus/corona-wuhan-exit-maskenpflicht-krankenhaus-interview-nagel/ …",,,#Corona,1246462215454101504,https://twitter.com/MiriamRehm/status/1246462215454101504
2020-04-04 15:38:27,JalalQazi,,3,47,178,"2 more patients in #Peshawar who were serious Corona case recovered Alhamdullilah #KPFightsCorona",,,#Peshawar #KPFightsCorona,1246462143601524736,https://twitter.com/JalalQazi/status/1246462143601524736
2020-04-04 15:38:18,DegenerateThing,,3,4,36,"People saying ""humans are the disease, Corona is the cure"" really aren't trying very hard to hide their ecofascism. This is a virus which predominantly kills old and disabled people and they know it.",,,,1246462106452602881,https://twitter.com/DegenerateThing/status/1246462106452602881
2020-04-04 15:38:11,AquarianTruths,,7,16,44,"Has any journalist, I mean any from the National Media asked where was Amit Shah, while Delhi burned, Corona Virus took root... even know what is he doing to contain the situation?",,,,1246462074999324672,https://twitter.com/AquarianTruths/status/1246462074999324672
