date,username,to,replies,retweets,favorites,text,geo,mentions,hashtags,id,permalink
2020-02-20 01:17:00,TheKoreaHerald,,0,95,41,"South Korea reports 31 new cases of coronavirus, total now at 82 #COVID2019 #Corona #CoronavirusOutbreakhttp://www.koreaherald.com/view.php?ud=20200220000241&np=1&mp=1 …",,,#COVID2019 #Corona #CoronavirusOutbreakhttp,1230300285727203329,https://twitter.com/TheKoreaHerald/status/1230300285727203329
2020-02-20 01:14:59,satyug20201,,0,189,191,"#GodMorningThursday Their is place when we don't die We were living that place where no birth no death Yes that place ""Satlok SantRampalJi Can help you to reach their if we believe on him #Corona Jesus Muslim beef Shut Freedom Correct #ThursdayMotivationpic.twitter.com/GrFK4joa0C",,,#GodMorningThursday #Corona #ThursdayMotivationpic,1230299779307012096,https://twitter.com/satyug20201/status/1230299779307012096
2020-02-20 00:41:37,JohnTrumpFanKJV,,68,256,567,"Father, Please keep the Corona Virus off of our shores. Have mercy on the people who have contracted the virus. Please heal, save and deliver. Thou art the Great Physician. Our hope is in Thee. We give Thee thanks and praise, in Jesus name, Amen.",,,,1230291380137811970,https://twitter.com/JohnTrumpFanKJV/status/1230291380137811970
2020-02-20 00:37:09,michael23perez,,4,60,1650,"I wish the corona virus was giving out cornas",,,,1230290254902562816,https://twitter.com/michael23perez/status/1230290254902562816
2020-02-20 00:01:34,CronkiteSays,,5,25,86,"BREAKING NEWS Chinese doctors have discovered an unexplained attraction between women afflicted with Lymes Disease and men infected with the Corona virus.",,,,1230281303406370816,https://twitter.com/CronkiteSays/status/1230281303406370816
2020-02-19 23:25:10,IHAVETHEANSWER3,,30,44,69,"Prediction, when corona takes hold in us it will be grouped around these distribution , I mean quarantine stations. #coronaviruspic.twitter.com/2F4batRuyG",,,#coronaviruspic,1230272139670020097,https://twitter.com/IHAVETHEANSWER3/status/1230272139670020097
2020-02-19 23:14:48,bai_mina,,3,20,36,"2 ppl died of Corona virus today in the big religious city of #Qom. Situation seems critical when the regime has sent out strange looking vehicles into the city to quarantine some area/ppl according to the sender of video from Qom. God help them all.pic.twitter.com/onGQIKoHqp",,,#Qom,1230269530741579776,https://twitter.com/bai_mina/status/1230269530741579776
2020-02-19 22:54:08,jpalmiotti,,30,14,111,"Business in Chinatown has dropped by 50% but there is not one case of the Corona virus in NYC.",,,,1230264332514209793,https://twitter.com/jpalmiotti/status/1230264332514209793
2020-02-19 22:20:51,HMKilla,HMKilla,1,7,108,". @Soraalam1 and @thegamersjoint when they are the only X-Keepers that don't have to be careful of the Corona Virus next weekend https://twitter.com/HMKilla/status/1229148295982915586 …",,@Soraalam1 @thegamersjoint,,1230255955453054977,https://twitter.com/HMKilla/status/1230255955453054977
2020-02-19 22:18:16,FunnyZimPics,,109,133,446,"Chinese Doctors dealing with Corona Virus Vs Zim Doctors... ....Hanzi we are prepared pic.twitter.com/JXKZxmCBV0",,,,1230255303398170624,https://twitter.com/FunnyZimPics/status/1230255303398170624
2020-02-19 22:18:09,liamalexander,AustraliaPM,0,6,20,"Don't be surprised if Labor supporters wear Hawaiian shirts next polling day - QTIC wrote to PM requesting special assistance - Morrison - former CEO of Tourism Aust says he didn't get the letter?!! Corona virus impact worse than GFC. Even Sky News turning on #ScottyFomMarketinghttps://twitter.com/AustraliaPM/status/1230102241161490432 …",,,#ScottyFomMarketinghttps,1230255276739031040,https://twitter.com/liamalexander/status/1230255276739031040
2020-02-19 22:15:15,RealDoctorMike,,115,430,1449,"Corona virus renamed and 5 more HONEST updates that I think you should know. https://youtu.be/RSiW6ZvPqeg #alertnotanxious #coronaviruspic.twitter.com/hFYKsVzH95",,,#alertnotanxious #coronaviruspic,1230254545248432128,https://twitter.com/RealDoctorMike/status/1230254545248432128
2020-02-19 21:59:45,Daffodil27,,0,68,86,"Reports coming from #Iran that people have died from Corona virus infection in Qom. The Islamic Regime instead of putting a medical crisis plan in place is deploying anti-riot vehicles in the streets. #41YearsOfMisery. #BoycottIranElectionspic.twitter.com/xtwb6a1onm",,,#Iran #41YearsOfMisery #BoycottIranElectionspic,1230250645795549184,https://twitter.com/Daffodil27/status/1230250645795549184
2020-02-19 21:59:31,docdhj,,3,26,52,"NEW WTF SHOW> CORONA VURUS BIOWEAPON, MCCABE, GENERAL FLYNN & ROGER STONE - https://mailchi.mp/1df5669030d9/new-wtf-show-corona-vurus-bioweapon-mccabe-general-flynn-roger-stone …pic.twitter.com/S0UmdrAJXf",,,,1230250587557593090,https://twitter.com/docdhj/status/1230250587557593090
2020-02-19 21:56:52,CyrusAParsa1,,2,43,49,"Breaking: Washington State Department of Health ""779 People being monitored for exposure to Corona Virus"" I have text messages 3 months ago begging 2 ""Trusted Reporters"" run my book, Warnings, #AI simulations show world in Danger. ""No"" https://www.doh.wa.gov/Emergencies/Coronavirus … @MariaBartiromopic.twitter.com/S7NvDyFgJg",,@MariaBartiromopic,#AI,1230249919258120193,https://twitter.com/CyrusAParsa1/status/1230249919258120193
2020-02-19 21:42:09,johnbaniaga,,0,7,33,"The corona virus reached the United States.. good thing I live in America lol",,,,1230246217315012608,https://twitter.com/johnbaniaga/status/1230246217315012608
2020-02-19 21:20:55,gauri_maulekhi,OpIndia_com,0,14,19,"If your identity revolves around flesh of animals, if you indulge in politics of meat, then you are a wicked coward. Can political parties not find better use of their workers and funds? Repairing roads? Planting trees? Volunteering in hospitals? Enjoy the Corona BTW. https://twitter.com/OpIndia_com/status/1229984597091307520 …",,,,1230240872396029952,https://twitter.com/gauri_maulekhi/status/1230240872396029952
2020-02-19 21:17:52,hopelove_17,,0,6,38,"Please keep those affected by the corona virus in your thoughts and prayers. The situation is getting worse and so far there is no cure. Lots of lives are in danger and many have already been lost.",,,,1230240104612028419,https://twitter.com/hopelove_17/status/1230240104612028419
2020-02-19 21:17:03,QTAnon1,,9,26,88,"Just seen on Tinder... Man with Corona Virus Seeks a relationship with Lady must have Lyme diesase.",,,,1230239901662117888,https://twitter.com/QTAnon1/status/1230239901662117888
2020-02-19 21:07:48,ShadayaTawona,nickmangwana,0,5,55,"Stop with the propaganda, these people aren't properly dressed to treat corona virus. Those bald heads in the open, those formal trousers will be handled home, those formal shoes will be stepping everywhere not to mention the other one is holding a phone. Hayii itai serious mhani",,,,1230237572946956288,https://twitter.com/ShadayaTawona/status/1230237572946956288
2020-02-19 21:05:41,Beinomugisha_Iv,,3,10,73,"Pallaso's state and the Corona virus have been a lesson to many, never feel sweet on people you left home just because you're flying to another country",,,,1230237038684884993,https://twitter.com/Beinomugisha_Iv/status/1230237038684884993
2020-02-19 20:57:16,MOWGALE,TumiMatheba,45,82,1246,"It’s just sex. A lot like coughing, it doesn’t mean I have corona",,,,1230234921299521536,https://twitter.com/MOWGALE/status/1230234921299521536
2020-02-19 20:52:46,ShadayaKnight,,6,10,102,"Yet almost if not every African hasn't banned people from going to & coming from China. Just another health disaster waiting to happen. Africa can't contain corona virus but our leaders are busy with useless SONAs",,,,1230233788174741504,https://twitter.com/ShadayaKnight/status/1230233788174741504
2020-02-19 20:49:53,Perpetualmaniac,,8,18,20,"If I did a quick crowdfunding to raise $1000 for @MaryamHenein and I to continue digging and producing original content on “hiv-sars-corona virus”, would you support it?",,@MaryamHenein,,1230233062555832321,https://twitter.com/Perpetualmaniac/status/1230233062555832321
2020-02-19 20:38:47,Immort4l_Legacy,,2,8,20,"This reply got deleted, but screenshots are forever: “Go go eat Jachnun you humiliated yemenite, go scrub for another Ashkenazi you sorry floor rag Zionist. All ashkenazim Corona (the virus)! You dog (said in Arabic kalb).” Then you wonder why I won’t be silent. pic.twitter.com/TSYo3xAgdo",,,,1230230269807992832,https://twitter.com/Immort4l_Legacy/status/1230230269807992832
2020-02-19 20:28:57,juliaoftoronto,,9,4,64,"This is the best corona PR pitch I've received in a while pic.twitter.com/kb2QiB1A54",,,,1230227794187214848,https://twitter.com/juliaoftoronto/status/1230227794187214848
2020-02-19 20:13:43,jitenshasw,,12,26,124,"I'm heartbroken to hear I lost yet another friend and fellow lady size artist... If you haven't heard the horrible news, Giantess Vivian, a super sweet lady who liked size smut and was an amazing fucking artist, passed away Monday from corona virus. https://www.patreon.com/GTS_VIVIAN",,,,1230223960035536897,https://twitter.com/jitenshasw/status/1230223960035536897
2020-02-19 19:58:32,capitalweather,,1,5,36,"Incredible ""eye in the sky"" moon haloes, corona shine above Manitoba https://www.washingtonpost.com/weather/2020/02/19/incredible-moon-haloes-corona-shine-over-manitoba-canada/ …",,,,1230220139129450496,https://twitter.com/capitalweather/status/1230220139129450496
2020-02-19 19:49:47,NATRAJSHETTY,,1,55,91,"China sends SOS to Vatican to send those pastors who roam in Africa Asia India for religious conversion stating they cure illness , to visit China and cure Corona Virus ... All disappeared Lol",,,,1230217938143207424,https://twitter.com/NATRAJSHETTY/status/1230217938143207424
2020-02-19 19:43:38,ryantaylorbmx,,14,13,311,"Just got asked to promote a Corona Virus mask for 18k THEY MAKING MONEY OF THIS NOW!!!!",,,,1230216392600891392,https://twitter.com/ryantaylorbmx/status/1230216392600891392
2020-02-19 19:38:31,nickmangwana,,308,44,233,"This is the Team of Zimbabwean Medical Scientists who performed the first Corona virus test at the National Microbiology Reference Laboratory situated at the Sally Mugabe Central Hospital, which tested negative pic.twitter.com/3how8xmrzU",,,,1230215101304754176,https://twitter.com/nickmangwana/status/1230215101304754176
2020-02-19 19:22:25,Perpetualmaniac,lisaabramowicz1,2,28,53,"Unconfirmed reports indicate the “hiv-sars-corona virus” was a bioweapon made by China to be used against Japan. Reports that Japan can’t contain the virus is alarming... as is this https://twitter.com/lisaabramowicz1/status/1230209618846081030 …",,,,1230211051095855104,https://twitter.com/Perpetualmaniac/status/1230211051095855104
2020-02-19 19:19:39,manlykchohan,,19,30,93,"Corona Virus in Streatham (SW London) ??? pic.twitter.com/ZY4Livv24F",,,,1230210353721729026,https://twitter.com/manlykchohan/status/1230210353721729026
2020-02-19 19:16:30,P0A_Triot23,,4,28,56,"It's Not Looking Like [They] Want You Talking About The [Fake] CoronA Virus .. TIK TOK TIK TOK *+* https://twitter.com/P0A_Triot23/status/1230199254855114752 …pic.twitter.com/phbfapJe8f",,,,1230209562554355714,https://twitter.com/P0A_Triot23/status/1230209562554355714
2020-02-19 19:06:44,nwabuezekenech1,,20,25,78,"Magu don kill person. Imagine saying corona virus is caused by corruption. #coronaviruskenyapic.twitter.com/jOZU2AFq2H",,,#coronaviruskenyapic,1230207103853375488,https://twitter.com/nwabuezekenech1/status/1230207103853375488
2020-02-19 19:06:10,SerakiDavisKgol,sihlelilx55,1,7,142,"But why not with corona, since we have 'corona virus ' black label is my thing bru!! pic.twitter.com/Tv7Hlip6uD",,,,1230206963595825158,https://twitter.com/SerakiDavisKgol/status/1230206963595825158
2020-02-19 18:57:48,ChakatsvaMelody,,34,34,105,"Observation: I have never seen such idiots in #Zimbabwe. Who visits a suspected corona virus patient without protective clothing? @matigarypic.twitter.com/FdCPUu4GR1",,@matigarypic,#Zimbabwe,1230204856583041029,https://twitter.com/ChakatsvaMelody/status/1230204856583041029
2020-02-19 18:46:49,jakeadelstein,,10,8,28,"Paging all epidemiologists and armchair crisis management experts. What are the lessons to be learned from Japan's handling of the Corona Virus outbreak on the #DiamondPrincess? What did they do right? What did they do wrong? How will it end? Links welcome",,,#DiamondPrincess,1230202093077614592,https://twitter.com/jakeadelstein/status/1230202093077614592
2020-02-19 18:34:56,Perpetualmaniac,MaryamHenein,1,24,36,"Check out the video I did on corona virus with @MaryamHenein!https://twitter.com/MaryamHenein/status/1230194769776664577 …",,@MaryamHenein,,1230199102861803520,https://twitter.com/Perpetualmaniac/status/1230199102861803520
2020-02-19 18:32:48,HazbinHotel,,4,17,498,"Restocks of pins, once they sell out, might take a bit longer than usual, due to overseas manufacturing delays due to the ongoing corona virus outbreak. We will keep you posted, as always!",,,,1230198564602560513,https://twitter.com/HazbinHotel/status/1230198564602560513
2020-02-19 18:31:00,ChrisGotClapped,,5,18,78,"Corona Virus fell off",,,,1230198111118733312,https://twitter.com/ChrisGotClapped/status/1230198111118733312
2020-02-19 18:28:57,cohsunshinecity,,60,60,130,"Suspected Corona Virus patient certified negative. pic.twitter.com/MOirDJhU0d",,,,1230197596175597569,https://twitter.com/cohsunshinecity/status/1230197596175597569
2020-02-19 18:23:32,Perpetualmaniac,LizGoodale,5,52,79,"Please welcome CALIFORNIA STATE to the 2020 “hiv-sars-corona virus” hunger games. The bad joke without a punchline known as the CDC knowingly brought the disease here. Now it’s out of spreading! 5,400 being monitored! California, may the odds be ever in your favor!! https://twitter.com/LizGoodale/status/1230158517140688897 …",,,,1230196230795325440,https://twitter.com/Perpetualmaniac/status/1230196230795325440
2020-02-19 18:20:40,KiranKS,,5,45,87,"China makes:- 90% of the world's 30,00,00,000 computers sold each year. 70% of the 200,00,00,000 phones sold in the world each year. 80% of the 11,00,00,000 air conditioners sold in the world each year. Imagine the plight of global dealers and retailers after Corona Virus.",,,,1230195510184685569,https://twitter.com/KiranKS/status/1230195510184685569
2020-02-19 18:03:19,cakejallender,,2,19,100,"Yeah I got the Corona Virus: Can someOne R O N PleAse let me fuck, please anyone",,,,1230191145965248515,https://twitter.com/cakejallender/status/1230191145965248515
2020-02-19 17:26:26,GreatLigo,,1,14,15,"I feel it in the air, no Corona Just bars from this Album-GoGetter https://www.deezer.com/en/album/125464192?deferredFl=1 …",,,,1230181864889102341,https://twitter.com/GreatLigo/status/1230181864889102341
2020-02-19 17:21:17,otuathail,,5,38,79,"Lots of people coming in to us who have travelled abroad concerned that they may have corona virus We need to get the message out If you are concerned CALL US but please don’t make an appointment And remember YOURE FAR MORE LIKELY TO GET THE FLU SO *GET THE FLU VACCINE* pic.twitter.com/WACr3eGZRR",,,,1230180568932982784,https://twitter.com/otuathail/status/1230180568932982784
2020-02-19 17:19:27,orb1tzy,,1,12,100,"Idk just think it’d be cool to have another cinema theory soon since 2018/02/29 teaser was for the first cinema theory teaser, but the 29th actually exists in 2020.... soooo. Online cinema theory plz cuz corona.",,,,1230180107018526720,https://twitter.com/orb1tzy/status/1230180107018526720
2020-02-19 17:18:15,KiranKS,,1,56,156,"China accounts for 70% of Asian bond issuances. But since Corona Virus in China, Indian companies have become hot for global investors. In just 2 weeks, Indian companies received bids for $11 billion in the Dollar bond market, while they had lined up for just $1.55 bn issues.",,,,1230179802604359682,https://twitter.com/KiranKS/status/1230179802604359682
2020-02-19 17:13:45,imAri_Official,,49,257,359,"Anti HK gang's logic #UnitedByAsim This spread Then what this Love Spread!!!!!! Corona??? pic.twitter.com/O6Fd6d2bcj",,,#UnitedByAsim,1230178672407175168,https://twitter.com/imAri_Official/status/1230178672407175168
2020-02-19 17:08:08,OscarFigure,,7,52,124,"International media be like ""a Corona virus case has been reported in Kenya"" pic.twitter.com/CPhRWeH7sV",,,,1230177256502386688,https://twitter.com/OscarFigure/status/1230177256502386688
2020-02-19 17:06:14,eksodeux,,3,322,393,"I know most of exols probably won't even care but yixing is releasing a song tomorrow which was created in collaboration with xbacks. Even the album art is designed by a fan to support those fighting against the corona virus outbreak so please support it! pic.twitter.com/9tXMQvgID2",,,,1230176781652480000,https://twitter.com/eksodeux/status/1230176781652480000
2020-02-19 16:56:48,kazimotoxii,,7,28,57,"So Corona Virus was planned we are living in a world of series unknowingly pic.twitter.com/iDt925IjzJ",,,,1230174404430245890,https://twitter.com/kazimotoxii/status/1230174404430245890
2020-02-19 16:45:41,arunv2808,,8,60,369,"Apple expresses its concern about continuing to manufacture goods with China due to Corona virus. I'm sure Modi is eyeing this as an opportunity to entice them here. The meet with Trump could materialize this shift (I hope).",,,,1230171606967672832,https://twitter.com/arunv2808/status/1230171606967672832
2020-02-19 16:43:44,EmericanJohnson,,8,59,499,"Vietnam has repatriated every Vietnamese national with Corona virus, as of today every Vietnamese Corona patient and every foreign Corona patient in Vietnam has been treated and discharged. Zero deaths and zero active cases. If this holds for 2 weeks Vietnam will be on a streak:",,,,1230171119304364032,https://twitter.com/EmericanJohnson/status/1230171119304364032
2020-02-19 16:43:11,AqeelahCarrim,,2,7,74,"If one person from tuks gets the corona virus we’re all gonna be screwed because of the fingerprint scanners",,,,1230170979038646272,https://twitter.com/AqeelahCarrim/status/1230170979038646272
2020-02-19 16:33:25,tariqnasheed,tariqnasheed,52,228,727,"If millions of people in Africa suddenly start dying off from other bio weapons, they can now just blame it on the corona virus, right? https://twitter.com/tariqnasheed/status/1230002591087521793 …",,,,1230168520874323970,https://twitter.com/tariqnasheed/status/1230168520874323970
2020-02-19 16:30:27,POE_Ro,,1,13,28,"me comin bacc mad asfucc after i let da corona virus catch me laccin pic.twitter.com/RXS36kpm24",,,,1230167775836016644,https://twitter.com/POE_Ro/status/1230167775836016644
2020-02-19 16:05:31,EmbiidIsAss,,30,273,1154,"2020 is the one of the worst years I’ve experienced •WW3 talks •Corona virus •Kobe and Gigi died •Pop Smoke died •Personal shit Fuck this I’m skipping to 2021 pic.twitter.com/gSDiBpum6L",,,,1230161499685105664,https://twitter.com/EmbiidIsAss/status/1230161499685105664
2020-02-19 15:33:18,QuteJR,,22,47,206,"Imagine corona wipes out everyone apart from Africans Nesoose enyumba ya bill gates",,,,1230153391768248322,https://twitter.com/QuteJR/status/1230153391768248322
2020-02-19 15:30:59,frankdonga_,,11,15,68,"Shoutout to those clapping in the corruption vs corona virus video. They’re the real mvp pic.twitter.com/GtJAq3SWmD",,,,1230152808487411714,https://twitter.com/frankdonga_/status/1230152808487411714
2020-02-19 15:24:53,TomBrow38006074,BorisJohnson,30,100,81,"Boris, please remember the horrific things the Chinese do whilst giving them aid to fight the corona virus. Yes I believe in fighting the virus now rather than later. When will the Chinese pass laws against animal torture? pic.twitter.com/BzaP0sitBR",,,,1230151273418297345,https://twitter.com/TomBrow38006074/status/1230151273418297345
2020-02-19 15:21:50,casima001,,7,57,87,"The government is hiding from us that corona virus has arrived in RSA #coronavirusptapic.twitter.com/DjevlXp83I",,,#coronavirusptapic,1230150504493260802,https://twitter.com/casima001/status/1230150504493260802
2020-02-19 15:20:27,valcano,,3,10,48,"#tarotsupercard update: the printing factory had to shut down due to Corona Virus and put production about a month behind. They just re-opened this week so I’m hoping to have orders ready to ship in early May if everything stays on schedule! Thanks for your support and patience",,,#tarotsupercard,1230150158567931907,https://twitter.com/valcano/status/1230150158567931907
2020-02-19 14:40:36,FinMinIndia,,7,39,109,"Dept. of Expenditure vide its O.M. dated 19.2.2020 has advised Ministries, disruption of supply chain due to spread of Corona Virus in China or any other country would be considered as a case of natural calamitiy and Force Majeure Clause may be invoked in appropriate cases (2/2)",,,,1230140131262128128,https://twitter.com/FinMinIndia/status/1230140131262128128
2020-02-19 13:49:00,MrsNigel,,9,25,112,"For our EU Invasion Taskforce training, Mark Francois is insisting we all catch the Corona Virus to show those forriners that we are an unstoppable fighting force. He will get some from the off-licence tonight. He’ll pick up some nibbles too and we can have a Corona party.",,,,1230127142459101184,https://twitter.com/MrsNigel/status/1230127142459101184
2020-02-19 13:46:42,xxwonhobebexx,TWOTUCKGOM,1,16,40,"Twotuckgom postponing the fansign event after fan showing their concern on corona virus outbreak. They have responded well and fast not like others certain company which is good. They did listen to their consumer voices. https://twitter.com/TWOTUCKGOM/status/1230123082108420097 …",,,,1230126563594686470,https://twitter.com/xxwonhobebexx/status/1230126563594686470
2020-02-19 13:39:11,wonniebee,wonniebee,3,78,486,"Rough translation, The schedule was initially announced on the day before Corona virus outbreak and they will rearrange and reschedule it again for safety purposes. They promise to put Monsta X and monbebes' safety as priority.",,,,1230124674576633856,https://twitter.com/wonniebee/status/1230124674576633856
2020-02-19 13:38:25,MaJaluza,VusiThembekwayo,4,4,37,"This Corona Virus is messing with our projections and manufacturing lead times. https://twitter.com/VusiThembekwayo/status/1230099110889435139 …",,,,1230124481156468742,https://twitter.com/MaJaluza/status/1230124481156468742
2020-02-19 13:24:10,PoliticalKida,,3,696,1823,"Students, who were air-lifted from Wuhan during Corona Virus evacuation, are full of praise for the Modi Government, This is the slap on those faces who are making kids abuse Modi & Shah in Shaheen bagh. pic.twitter.com/GFSuhTbEg7",,,,1230120894489513984,https://twitter.com/PoliticalKida/status/1230120894489513984
2020-02-19 13:13:21,__Alexsam,,4,8,38,"Russian is a first world country. Russia authorities banned any Chinese from entering China . This is because they are not prepared to curb Corona virus. Kenya is a third world country and its very ready to deal with any Corona virus. Nani alituroga?",,,,1230118173166448640,https://twitter.com/__Alexsam/status/1230118173166448640
2020-02-19 12:23:28,retsonbiz,,2,20,47,"IMAGINE; The Chinese Even Believed Corruption is The Cause of The Corona Virus. So The EFCC BOSS Did His Research and Spoke Truth With Facts and He We Are Making Mockery of Our Collective Certificates. WE CAN'T DO WELL With This Mentality. Thank You Ibrahim Abu. WE NO WAN WELL!",,,,1230105620185001986,https://twitter.com/retsonbiz/status/1230105620185001986
2020-02-19 12:22:42,MinofHealthUG,,5,43,54,"Corona is a new contagious virus that infects both humans and animals. Signs and Symptoms: Fever Cough Shortness of Breath #COVID19pic.twitter.com/d9W8gKYnX2",,,#COVID19pic,1230105425955229696,https://twitter.com/MinofHealthUG/status/1230105425955229696
2020-02-19 12:15:25,DjManzoSA,,15,61,61,"An Important message guys eish on This Corona Virus from the CHINA Embassy in Pretoria,EISH Its bad, RT for Awareness. @PrinceKBDube Thusa hle abuti #FearFokolpic.twitter.com/4dmvv8Uehh",,@PrinceKBDube,#FearFokolpic,1230103591555387394,https://twitter.com/DjManzoSA/status/1230103591555387394
2020-02-19 11:47:58,yooku_s,,11,17,89,"What if the Corona Virus is a genetically modified virus that is aimed at reducing the Chinese population and prevent overpopulation?",,,,1230096684182626306,https://twitter.com/yooku_s/status/1230096684182626306
2020-02-19 11:36:54,HeshmatAlavi,,19,275,304,"#BREAKING Initial tests confirm two cases of the Corona virus in the city of Qom, central #Iran. The regime has been keeping a lid on all reports of Corona cases in Iran, fearing concerns will prevent people from taking part in Friday's parliamentary elections. pic.twitter.com/FhkxZVBxQF",,,#BREAKING #Iran,1230093900431405056,https://twitter.com/HeshmatAlavi/status/1230093900431405056
2020-02-19 11:33:39,retsonbiz,,3,7,34,"THE EFCC BOSS; Misspoke. This is What You See With Politicians and Public Office Holders Worldwide. What The EFCC Statement Tried Doing Was Make Clear What The Chairman Was TRYING to Say Which is That 'CORRUPTION is Deadlier Than Any Known Disease Including Corona Virus'...",,,,1230093082122760192,https://twitter.com/retsonbiz/status/1230093082122760192
2020-02-19 11:25:45,jojjeols,chinascio,6,10,24,"Treating Corona virus with traditional Chinese medicine? What could possibly go wrong.. https://twitter.com/chinascio/status/1229982146896392192 …",,,,1230091092491567105,https://twitter.com/jojjeols/status/1230091092491567105
2020-02-19 11:25:26,slkaye,,9,28,47,"If you were wondering if South Africa is taking the Corona Virus seriously, let me assure you that they are. Our flight from Singapore stopped in Johannesburg where every person was temperature checked by two seperate machines before anyone was allowed to disembark. pic.twitter.com/somhFvCyJj",,,,1230091014054055937,https://twitter.com/slkaye/status/1230091014054055937
