date,username,to,replies,retweets,favorites,text,geo,mentions,hashtags,id,permalink
2020-02-22 09:32:57,hmryder,AfricaCDC,4,12,49,"So proud of my team who worked overnight on a briefing to support this important @_AfricanUnion discussion on #coronavirus and #Africa's response, including data on Africans in the epicenter in Hubei, #China & 3 options for coordinated action #COViD19https://twitter.com/AfricaCDC/status/1231111430763614208 …",,@_AfricanUnion,#coronavirus #Africa #China #COViD19https,1231149868762222593,https://twitter.com/hmryder/status/1231149868762222593
2020-02-22 09:32:18,uk_nola,,3,47,47,"A gift idea for anyone that needs a reminder of how beautiful they are, this cup & saucer set is made from bone china & personalised with any name https://nolagiftstore.co.uk/collections/for-her/products/personalised-be-you-tiful-bone-china-cup-saucer … #tea #cupandsaucer #giftideas #mothersday #ukgifthour #ukgiftampic.twitter.com/lgpDLgElKY",,,#tea #cupandsaucer #giftideas #mothersday #ukgifthour #ukgiftampic,1231149707956817920,https://twitter.com/uk_nola/status/1231149707956817920
2020-02-22 09:31:41,AdityaRajKaul,,8,56,142,"Cabinet Secretary chairs high level review meeting on #COVID19. Indian Citizens advised to avoid all non-essential travel to Singapore. Total 10 countries with universal screening: China, Hong Kong, Singapore, Thailand, Japan, South Korea, Nepal, Indonesia,Vietnam & Malaysia. pic.twitter.com/wXTW3WMths",,,#COVID19,1231149551676846081,https://twitter.com/AdityaRajKaul/status/1231149551676846081
2020-02-22 09:30:39,XHNews,,6,35,91,"Two provinces in China lower their emergency response level after reporting no new coronavirus case http://xhne.ws/CM86i pic.twitter.com/8DMLPNQAxy",,,,1231149291193819137,https://twitter.com/XHNews/status/1231149291193819137
2020-02-22 09:27:46,XHNews,,19,212,505,"15 minutes! New rapid test kits for #coronavirus have been developed by a biotech company in Hefei, China #FightViruspic.twitter.com/625g4b34pC",,,#coronavirus #FightViruspic,1231148566619418626,https://twitter.com/XHNews/status/1231148566619418626
2020-02-22 09:23:47,sidhant,,19,115,301,"Just in: India to screen passengers from 10 countries now as precautionary measure against #WuhanCoronavius. These are China, Hong Kong, Singapore, Thailand, Japan, South Korea, Kathmandu, Indonesia, Vietnam & Malaysia.",,,#WuhanCoronavius,1231147563644080129,https://twitter.com/sidhant/status/1231147563644080129
2020-02-22 09:20:27,chinafrica1,,4,15,80,"A Cameroonian student shares experience of recovering from novel coronavirus in China: So long as we make joint efforts, the Chinese and foreigners, we can defeat any disease in the world. #CORONAVIRUS #COVID19 http://www.chinafrica.cn/Homepage/202002/t20200222_800194127.html …pic.twitter.com/51o7GtFV8z",,,#CORONAVIRUS #COVID19,1231146725039058944,https://twitter.com/chinafrica1/status/1231146725039058944
2020-02-22 09:17:25,AfricaCDC,,2,22,24,"Africa has confirmed only one case of #CoronavirusOutbreak but Africa is already feeling the economic & social effects because China is one of our strong economic partners, says @AUC_MoussaFakipic.twitter.com/PmXS0Q01fk",,@AUC_MoussaFakipic,#CoronavirusOutbreak,1231145962887897088,https://twitter.com/AfricaCDC/status/1231145962887897088
2020-02-22 09:17:14,globaltimesnews,,17,217,199,"#COVID19 strains isolated from urine pose a threat to China’s sewer system, especially in hospitals. The discovery also explains how the virus is traveling with blood to harm hearts and kidneys. http://bit.ly/2VcjtSn pic.twitter.com/AspHBV4A54",,,#COVID19,1231145913797705728,https://twitter.com/globaltimesnews/status/1231145913797705728
2020-02-22 09:13:59,fkeverycountry,,167,1671,9142,"Fuck #China.",,,#China,1231145099247149056,https://twitter.com/fkeverycountry/status/1231145099247149056
2020-02-22 09:10:00,thewire_in,,4,29,91,"""India simply lacks the kind of clout that gains Trump’s attention. Even though its trade with the US is handsome by our standards, it pales into insignificance when compared to that between the US and China."" | Manoj Joshi writes. https://thewire.in/diplomacy/india-us-trump-visit-motera-trade-arms …",,,,1231144094128205825,https://twitter.com/thewire_in/status/1231144094128205825
2020-02-22 09:09:27,yarotrof,,3,42,33,"If a mayor of a Tehran district got the #COVID19 chances are that the virus has spread all over Iran by now. Could well be the same infection level as China outside Hubei. http://english.alarabiya.net/en/News/middle-east/2020/02/22/Iranian-official-confirmed-positive-for-coronavirus-State-TV.html …",,,#COVID19,1231143954935975937,https://twitter.com/yarotrof/status/1231143954935975937
2020-02-22 09:06:33,WHOWPRO,,5,52,65,"The total number of #COVID19 cases reported from mainland China to date is 76,288. The figures include 11,477 severe cases and 2,345 people who have died. #coronaviruspic.twitter.com/3wIqsjQGu0",,,#COVID19 #coronaviruspic,1231143228318961664,https://twitter.com/WHOWPRO/status/1231143228318961664
2020-02-22 09:05:38,Sajeda_Akhtar,,3,27,102,"Picture of a wailing mother of a Pakistani student stuck in China, pleading IK's state minister to bring her son back. The govt's response is: ""they're safe in China"". #Pakistan has a history of disowning its own. @TarekFatah @madhukishwar @sankrant @Sanjay_Dixit @TheSamirAbbaspic.twitter.com/lL9uHSvuax",,@TarekFatah @madhukishwar @sankrant @Sanjay_Dixit @TheSamirAbbaspic,#Pakistan,1231142998273978368,https://twitter.com/Sajeda_Akhtar/status/1231142998273978368
2020-02-22 09:05:21,Ianszhan,,1,21,43,"yibo released a new song (a collab) about the current situation in china, as a sort of hopeful supportive thing. it’s currently only on qq music but you can listen here: https://m.weibo.cn/status/4474707237297617?#&video …",,,#,1231142925255364609,https://twitter.com/Ianszhan/status/1231142925255364609
2020-02-22 09:00:00,CGTNOfficial,,2,15,40,"China's major logistics companies including EMS, SF Express, and JD Express are back to work, like many other logistics companies. In the last case, the ""return rate"" reached 66 percent, Wu Chungeng, a Ministry of Transportation official, said in a press conference. pic.twitter.com/RttAYVoGMR",,,,1231141578455937024,https://twitter.com/CGTNOfficial/status/1231141578455937024
2020-02-22 09:00:00,RT_com,,1,21,60,"Red-crested #pochards winter with #swans #China pic.twitter.com/aVmhl6l0EL",,,#pochards #swans #China,1231141577348636672,https://twitter.com/RT_com/status/1231141577348636672
2020-02-22 08:58:30,TibetPeople,TibetPeople,0,15,25,"My warning was heard, a big #setback for #China's Propaganda. Tibetan's determine is hard like rock, this has showed past 6 decades against #CCP's occupation & we'll continue our #Nonviolent struggle until #FreeTibet. #QPLNYC #XiJinping #COVID19 #XiVirus #KarmaVirus #ChinaVirushttps://twitter.com/TibetPeople/status/1230954109462876162 …",,,#setback #China #CCP #Nonviolent #FreeTibet #QPLNYC #XiJinping #COVID19 #XiVirus #KarmaVirus #ChinaVirushttps,1231141202491269121,https://twitter.com/TibetPeople/status/1231141202491269121
2020-02-22 08:55:37,Reuters,,6,24,45,"China reports fall in new coronavirus cases but concerns grow over spread elsewhere https://reut.rs/2SYLDgM pic.twitter.com/Y6W8ZH0rvk",,,,1231140473961615366,https://twitter.com/Reuters/status/1231140473961615366
2020-02-22 08:54:30,htTweets,,8,20,67,"‘Compare India to China not Pakistan’: Congress leader @GouravVallabh slams Modi government #HSS2020 #HindustanShikharSamagam2020pic.twitter.com/T6ZWArmkM2",,@GouravVallabh,#HSS2020 #HindustanShikharSamagam2020pic,1231140194021232642,https://twitter.com/htTweets/status/1231140194021232642
2020-02-22 08:51:14,forwardarc,realDonaldTrump,17,103,167,"What an idiot, con man, and pathological liar! Your tens of billions of dollars of wasteful bailouts didn’t prevent record farm bankruptcies. And despite your brazen lies, the “massive tariff money” is NOT coming into the USA from China: it is paid for by American consumers. https://twitter.com/realDonaldTrump/status/1230875946334318593 …",,,,1231139370394161153,https://twitter.com/forwardarc/status/1231139370394161153
2020-02-22 08:50:54,GWR,,6,17,65,"George reclaimed his record title from China's Mao Weidong, with an incredible time of 8 hours 15 minutes and 15 seconds http://bit.ly/GWR-PlankRecord",,,,1231139289930633216,https://twitter.com/GWR/status/1231139289930633216
2020-02-22 08:49:54,unclemahad,kanyindo,1,20,39,"We source shop and ship from the UK to Uganda.. dubai, china, turkey coming soon Follow us @UK2UGpic.twitter.com/bC7pDVcSF6",,@UK2UGpic,,1231139036905033729,https://twitter.com/unclemahad/status/1231139036905033729
2020-02-22 08:49:52,srivatsayb,,49,746,1732,"Manmohan's Foreign Policy Nuclear Deal Indo-Japan Strategic Partnership Trade deals with ASEAN & Korea Result: India is the next China Modi's Foreign Policy Howdy Modi Namaste Trump Nepal becomes pro-China Result: India is the next Pakistan #Jumla7MillionKa",,,#Jumla7MillionKa,1231139028990222336,https://twitter.com/srivatsayb/status/1231139028990222336
2020-02-22 08:43:19,caroletwitt_,,1,63,45,"This futuristic #robotic restaurant in south China's metropolis Guangzhou is unlike anything the country has seen before. http://xhne.ws/XDAdk @XinhuaTravel v/ @jeanyvesgonin @MikeQuindazzi @jblefevre60 @mvollmer1 @Alvinfoo @jrzaranoid @antgrassopic.twitter.com/XkfaJwubnx",,@XinhuaTravel @jeanyvesgonin @MikeQuindazzi @jblefevre60 @mvollmer1 @Alvinfoo @jrzaranoid @antgrassopic,#robotic,1231137381350330370,https://twitter.com/caroletwitt_/status/1231137381350330370
2020-02-22 08:39:21,janisfrayer,lala_roux,25,265,781,"An outbreak becomes an epidemic (like China), and when epidemics are rampant in multiple countries and on different continents simultaneously, then it's closer to pandemic status. A tipping point for the WHO to declare isn't clear but their recent language does seem more gloomy.",,,,1231136380979273728,https://twitter.com/janisfrayer/status/1231136380979273728
2020-02-22 08:39:00,Peters_Glen,,7,84,132,"The coronavirus outfall has wiped ~25% of China's CO₂ emissions over the past two weeks, which would reduce annual emissions by ~1%. Will the changes be sustained, or be offset / reversed by the government response to the crisis? @laurimyllyvirta https://www.carbonbrief.org/analysis-coronavirus-has-temporarily-reduced-chinas-co2-emissions-by-a-quarter …pic.twitter.com/vWv0RyvPdW",,@laurimyllyvirta,,1231136292483686400,https://twitter.com/Peters_Glen/status/1231136292483686400
2020-02-22 08:34:44,ImtiazGul60,,3,16,30,"The following news shows how most of #Indian media has mastered the art of FAKE NEWS when it comes to #Pakistan @zlj517 #China joins India, US to set new deadline for Pakistan https://indianexpress.com/article/india/china-joins-india-us-to-set-new-deadline-for-pakistan-6276740/ … via @IndianExpress",,@zlj517 @IndianExpress,#Indian #Pakistan #China,1231135220964974593,https://twitter.com/ImtiazGul60/status/1231135220964974593
2020-02-22 08:34:04,business,,25,46,122,"The WHO and China both seem doomed to repeat their mistakes of the past in their response to the coronavirus https://trib.al/daQwjcb via @bopinion",,@bopinion,,1231135050575552513,https://twitter.com/business/status/1231135050575552513
2020-02-22 08:33:34,rob_schmitz,limlouisa,1,15,35,"Little Red Podcast hits it out of the park with this episode featuring measured, insightful views from @ChuBailiang @orvilleschell, and Shaun Roache. If you want to understand the implications of #COVID2019 on China and its economy, do listen: https://twitter.com/limlouisa/status/1230012934710935553 …",,@ChuBailiang @orvilleschell,#COVID2019,1231134924524183554,https://twitter.com/rob_schmitz/status/1231134924524183554
2020-02-22 08:29:04,cnni,,7,27,73,"From shopping to eating out, virus control measures — such as temperature checks — are still having an impact on everyday life in Shanghai, China's economic juggernaut. https://cnn.it/38PR8oX",,,,1231133795228815360,https://twitter.com/cnni/status/1231133795228815360
2020-02-22 08:20:00,CGTNOfficial,,3,27,67,"How do people in China keep working when most of the country is under some kind of travel restrictions? Let's follow the story of Ryan, a foreigner working at a Chinese university, who has been making videos to update his friends and family back home. #CoronavirusOutbreakpic.twitter.com/JUXpQUFCjx",,,#CoronavirusOutbreakpic,1231131511166054400,https://twitter.com/CGTNOfficial/status/1231131511166054400
2020-02-22 08:17:00,seriousfunnyguy,,12,106,234,"Trash is the biggest problem of modern life. We have mountains of Trash called Landfills in every city & they keep piling up Well here's a simple & practical solution from China. Sounds doable.. @amitabhk87 @NITIAayog @narendramodi @PMOIndia @GautamGambhir @ArvindKejriwal Contd.pic.twitter.com/DU21eapa2b",,@amitabhk87 @NITIAayog @narendramodi @PMOIndia @GautamGambhir @ArvindKejriwal,,1231130758820945920,https://twitter.com/seriousfunnyguy/status/1231130758820945920
2020-02-22 08:14:45,lala_roux,janisfrayer,53,103,495,"Can I just ask what constitutes a pandemic announcement? Mainland China has only slowed the virus but outbreaks are all over the world ATM.",,,,1231130192891924480,https://twitter.com/lala_roux/status/1231130192891924480
2020-02-22 08:14:35,Reuters,,43,387,709,"Coronavirus patient re-hospitalized in China's Chengdu after testing positive again https://reut.rs/39Tp5VK pic.twitter.com/V7GnPodcUl",,,,1231130150584176640,https://twitter.com/Reuters/status/1231130150584176640
2020-02-22 08:13:39,Indian_Index,,5,83,349,"Trillon-Dollar economies. GDP (2019 Estimates, In trillion $) U.S: $21.44 China: $14.14 Japan: $5.15 Germany: $3.86 India: $2.94 U.K: $2.74 France: $2.71 Italy: $1.99 Brazil: $1.85 Canada: $1.73 Russia: $1.64 S Korea: $1.63 Spain: $1.40 Australia: $1.38 Mexico: $1.27 (IMF)",,,,1231129912209108992,https://twitter.com/Indian_Index/status/1231129912209108992
2020-02-22 08:11:58,ABSCBNNews,,3,13,80,"JUST IN: The repatriated OFWs from Hubei, China and the government's repatriation team were finally released this Saturday, following the completion of their 14-day quarantine in New Clark City in Capas, Tarlac. #COVID19 | via @biancadavapic.twitter.com/3DIk8usO0J",,@biancadavapic,#COVID19,1231129489310019584,https://twitter.com/ABSCBNNews/status/1231129489310019584
2020-02-22 08:10:07,shiroihamusan,SSIReview,0,40,82,"Democracy is not perfect, so we need separation of powers, to prevent corruption of govt But in China and Hong Kong, there's no such thing pic.twitter.com/x0i3NYz2UY",,,,1231129024216219648,https://twitter.com/shiroihamusan/status/1231129024216219648
2020-02-22 08:09:44,jblefevre60,,4,97,107,"China is testing hyperloop technology! #mobility #SmartCity via @wef @evankirstel @rwang0 @Fabriziobustama @mvollmer1 @SpirosMargaris @HaroldSinnott @Paula_Piccard @ShiCooks @Droit_IA @diioannid @ipfconline1 @labordeolivier @sebbourguignon @kalydeoo @tewoz @Ym78200 @Nicochan33pic.twitter.com/96vZSkmUgX",,@wef @evankirstel @rwang0 @Fabriziobustama @mvollmer1 @SpirosMargaris @HaroldSinnott @Paula_Piccard @ShiCooks @Droit_IA @diioannid @ipfconline1 @labordeolivier @sebbourguignon @kalydeoo @tewoz @Ym78200 @Nicochan33pic,#mobility #SmartCity,1231128928355520514,https://twitter.com/jblefevre60/status/1231128928355520514
2020-02-22 08:06:24,JINGWAJINGWA,pico97468892,93,447,438,"A Chinese peeing on a bus in Hong Kong. How ugly and aggressive the people from China. https://twitter.com/pico97468892/status/1230641945929711616 …",,,,1231128088274034690,https://twitter.com/JINGWAJINGWA/status/1231128088274034690
2020-02-22 08:06:00,shiroihamusan,YahooSG,0,58,109,"It's the time HKPolice start not to cover the collusion with thugs to oppress dissents Paramilitary force collude with thugs is not news in communist states, like China and Russia CCP just uses its common strategy in Hong Kong This labelled the end of rule of law in HK pic.twitter.com/jyqaZ9UURb",,,,1231127991121403904,https://twitter.com/shiroihamusan/status/1231127991121403904
2020-02-22 08:05:52,lookner,,25,112,284,"New virus cases in past day in South Korea (population 51 million): 229 New virus cases in past day in all of China besides Hubei province (population 1.3 billion): 31",,,,1231127955977515009,https://twitter.com/lookner/status/1231127955977515009
2020-02-22 08:03:47,Melbourne,,0,14,97,"1/3: Last night, Melbourne lit up its streets in red and yellow in support of our Chinese communities and their families and Friends in China. pic.twitter.com/yMHLCFXQxf",,,,1231127430678577153,https://twitter.com/Melbourne/status/1231127430678577153
2020-02-22 08:02:02,business,,20,59,140,"The WHO has been far too deferential to China during this crisis. That has slowed its response and made the epidemic more threatening (via @bopinion)https://trib.al/sf1XNyB",,@bopinion,,1231126991644057600,https://twitter.com/business/status/1231126991644057600
2020-02-22 08:00:48,PDChina,,3,27,172,"Looking for some spring brightness? The tulips inside an ecological garden of Xianju County, E China’s Zhejiang, bloom cheerfully as the local temperature has been rising steadily. pic.twitter.com/bWURzdwhQF",,,,1231126681865220097,https://twitter.com/PDChina/status/1231126681865220097
2020-02-22 08:00:11,WSJ,,11,24,82,"Global garlic prices are high because of China's supply https://on.wsj.com/3bUJ34j",,,,1231126525983981568,https://twitter.com/WSJ/status/1231126525983981568
2020-02-22 08:00:00,DigitalTrends,,1,22,45,"China is fighting fires with missiles... pic.twitter.com/CknXyVXIA5",,,,1231126477808295936,https://twitter.com/DigitalTrends/status/1231126477808295936
2020-02-22 07:58:18,__werewolf__,,0,54,23,"Q U R A N is Quran (spelt Khooran). China tried to mess. And now china Q U R A N T I N E D (written as quarantined), meaning, never mess with Allah, and Islam...",,,,1231126050307854336,https://twitter.com/__werewolf__/status/1231126050307854336
2020-02-22 07:47:41,russian_market,fangshimin,16,60,119,"China fell back to the Middle Ages within 3 weeks. https://twitter.com/fangshimin/status/1231121351114539009 …",,,,1231123378574184448,https://twitter.com/russian_market/status/1231123378574184448
2020-02-22 07:40:00,CGTNOfficial,,9,87,322,"China's first high-speed mask production line: 500,000 per day #CoronavirusOutbreak #COVID19pic.twitter.com/t1VS9VLVCt",,,#CoronavirusOutbreak #COVID19pic,1231121444601417728,https://twitter.com/CGTNOfficial/status/1231121444601417728
2020-02-22 07:39:42,russian_market,ajplus,4,87,109,"A 70-year-old man in China’s Hubei Province was infected with Covid-19 coronavirus but did not show symptoms until 27 days later, the local government said on Saturday, meaning the virus’ incubation period could be much longer.. https://twitter.com/ajplus/status/1231018611004735490 …",,,,1231121370815307776,https://twitter.com/russian_market/status/1231121370815307776
2020-02-22 07:34:48,QAnonNotables,,5,126,215,"Change in flights across China before and after outbreak. pic.twitter.com/ZVamkxprej",,,,1231120136955813888,https://twitter.com/QAnonNotables/status/1231120136955813888
2020-02-22 07:33:36,tveitdal,,3,68,86,"Coronavirus cuts China’s greenhouse gas emissions by a quarter https://www.independent.co.uk/environment/coronavirus-china-co2-climate-crisis-greenhouse-gas-carbon-emissions-coal-a9351436.html … Experts say the drop not permanent but outbreak highlights how ‘vulnerable’ society ispic.twitter.com/wOZUDAZmd9",,,,1231119837004533760,https://twitter.com/tveitdal/status/1231119837004533760
2020-02-22 07:30:45,two_oh_teen,,2,27,106,"pls note that among china, japan and rok, obvioulsy rok seems to be the most transparent with all the detailed updates every minute from the press. rok must have steep rise in cases but that’s just cos they count every single case w/o reservarion&they can test thousands in a day",,,,1231119118406844418,https://twitter.com/two_oh_teen/status/1231119118406844418
2020-02-22 07:29:18,TheCartoonLoon,,3,18,137,"China ""The Coronavirus is devastating us"" Disney ""Well I see China is no longer a viable market"" pic.twitter.com/cTFD9Ot7Oz",,,,1231118754978902016,https://twitter.com/TheCartoonLoon/status/1231118754978902016
2020-02-22 07:25:59,evazhengll,,9,24,93,"Descendant of Genghis Khan, the man who is the storm. Xilingol League, Inner Mongolia, China pic.twitter.com/d4plkym1QT",,,,1231117920606019584,https://twitter.com/evazhengll/status/1231117920606019584
2020-02-22 07:24:21,Schuldensuehner,,10,166,284,"Good morning from #Germany, which could be hard hit by the Coronavirus. German companies do a good deal of their business w/ #China. Above all the chip manufacturer Infineon, which makes a third of its sales in the Middle Kingdom. Car comps also threatened by sharp drop in sales. pic.twitter.com/raVaHDnvVq",,,#Germany #China,1231117509551644672,https://twitter.com/Schuldensuehner/status/1231117509551644672
2020-02-22 07:19:33,BJP4India,,5,118,449,"Regional forums like JAI (Japan-America-India), RIC (Russia, India, China) have been given added impetus only under PM Modi. This has enabled a fast growth in India's global projection: Dr. @sambitswarajpic.twitter.com/jQcAldtAnz",,@sambitswarajpic,,1231116297758339072,https://twitter.com/BJP4India/status/1231116297758339072
2020-02-22 07:18:45,globaltimesnews,,2,29,80,"This photo went viral on Chinese social media platforms Saturday. Holding their 9-month-old son, the husband watched his wife, a nurse on duty at a local hospital, having lunch at a distance of about 2 meters, in Hubei, the epicenter of the #COVID19 in #China. pic.twitter.com/9fYq0HbhPI",,,#COVID19 #China,1231116097409232898,https://twitter.com/globaltimesnews/status/1231116097409232898
2020-02-22 07:18:15,IndoPac_Info,,6,37,58,"#coronavirus Update: My Worldwide Case Count Just updated: New cases in #SouthKorea (137), #Japan, #Australia & #Italy - 1 new death in Italy 826 new cases & 109 deaths in #China Note: #China is likely downplaying the numbers #WuhanCoronavirus #CoronavirusOutbreakpic.twitter.com/l27sbl0IOL",,,#coronavirus #SouthKorea #Japan #Australia #Italy #China #China #WuhanCoronavirus #CoronavirusOutbreakpic,1231115973010186245,https://twitter.com/IndoPac_Info/status/1231115973010186245
2020-02-22 07:15:48,NindaTurtles,,6,38,60,"Tunisia,Austria, Denmark, France, Belgium, Tajikistan, Latvia, Bulgaria, Cameroon, Chad, Congo-Brazzaville, Gabon, Netherlands, China, Morocco have already banned the Burqa and now Sri Lanka will follow. India needs to follow pic.twitter.com/Tq9YVKRhci",,,,1231115357802418176,https://twitter.com/NindaTurtles/status/1231115357802418176
2020-02-22 07:13:36,GracieNunyabiz,,25,183,174,"WHY has US Biz Leaders trust OUR health to a Communist Regime who openly opposes us? China is top producer of antibiotics, surgical tools, prescription RX ingredients & many essentials needed to stay alive. 80% of our antibiotics right now come from China https://www.foxnews.com/opinion/tucker-carlson-china-is-dangerous-us-enemy-bloomberg …",,,,1231114800995934208,https://twitter.com/GracieNunyabiz/status/1231114800995934208
2020-02-22 07:13:14,Piclogy,,0,35,77,"Sunrise on the Great Wall of China | Photography by ©Robert King pic.twitter.com/WWLGBwaIlW",,,,1231114708238815237,https://twitter.com/Piclogy/status/1231114708238815237
2020-02-22 07:09:00,SCMPNews,,10,39,74,"Three overseas Chinese students discuss how China “lost the gamble” trying to control the outbreak quietly and why the #coronavirus crisis could serve as “an awakening moment”pic.twitter.com/OBg6WtTbnG",,,#coronavirus,1231113643179200520,https://twitter.com/SCMPNews/status/1231113643179200520
2020-02-22 07:07:05,MackayIM,drrjgoodman,4,42,144,"China has bought us all time. But we really should *already* be using it.",,,,1231113161643704320,https://twitter.com/MackayIM/status/1231113161643704320
2020-02-22 07:05:55,WHO,,49,290,345,"""The increasing signs of transmission outside #China show that the window of opportunity we have for containing this #coronavirus is narrowing. We are calling on all countries to invest urgently in preparedness""- @DrTedros #COVID19",,@DrTedros,#China #coronavirus #COVID19,1231112868608823298,https://twitter.com/WHO/status/1231112868608823298
2020-02-22 07:01:29,XHNews,,9,32,134,"Laos will stand side by side with China and is willing to provide assistance within its capacity to support China's fight against the novel #coronavirus (COVID-19) outbreak, Lao Prime Minister Thongloun Sisoulith said Fridaypic.twitter.com/sabv4SEefC",,,#coronavirus,1231111752810520576,https://twitter.com/XHNews/status/1231111752810520576
2020-02-22 07:00:23,morganisawizard,,41,42,713,"not to be a total doomsday prepper or anything (jk i totally am), but stock up on your meds if you can. a lot of them come from china so coronavirus will likely impact their production and supplies might drop here.",,,,1231111475298742272,https://twitter.com/morganisawizard/status/1231111475298742272
2020-02-22 07:00:00,CGTNOfficial,,8,60,216,"Meet the youngest #coronavirus patient – a three-month-old baby girl – who was recently discharged from a hospital in Hangzhou City, east China's Zhejiang Province. Nurses at the hospital became ""temporary moms"" to the little girl, feeding and cleaning her. pic.twitter.com/lzPgOxrCbr",,,#coronavirus,1231111379987374080,https://twitter.com/CGTNOfficial/status/1231111379987374080
2020-02-22 06:59:09,WHO,,50,385,591,"""Although the total number of #COVID19 cases outside #China remains relatively small, we are concerned about the number of cases with no clear epidemiological link, such as travel history to or contact with a confirmed case""- @DrTedros #coronavirus",,@DrTedros,#COVID19 #China #coronavirus,1231111164492419072,https://twitter.com/WHO/status/1231111164492419072
