date,username,to,replies,retweets,favorites,text,geo,mentions,hashtags,id,permalink
2020-02-22 16:00:00,spectatorindex,,61,264,1371,"Aircraft carriers, 2019. US: 11 China: 2 Italy: 2 UK: 2 France: 1 India: 1 Russia: 1 Spain: 1 Thailand: 1",,,,1231247276796006401,https://twitter.com/spectatorindex/status/1231247276796006401
2020-02-22 16:00:00,PDChina,,5,56,130,"China's Gansu Province and Liaoning Province have downgraded their public health emergency response from the highest level to level three, according to local government. The adjustment for these 2 low-risk areas makes sure production and transportation return normal. pic.twitter.com/YQ0CdHz95c",,,,1231247276036636672,https://twitter.com/PDChina/status/1231247276036636672
2020-02-22 15:59:34,GordonGChang,Apex_WW,5,53,91,"This dramatic decline suggests the economy is weak across the country. At least at this moment, #China is in contraction. #COVID19 #CoronavirusOutbreakhttps://twitter.com/Apex_WW/status/1231037274852352001 …",,,#China #COVID19 #CoronavirusOutbreakhttps,1231247166817083395,https://twitter.com/GordonGChang/status/1231247166817083395
2020-02-22 15:57:25,cchukudebelu,,16,86,227,"There's something Ndigbo call ""nkpali"". If you have a strong economy & your middle class isn't hustling to escape the hell you've made of the nation, nobody will insult you. China ""lacks democracy"", but nobody insults them. What impact has ""democracy"" had on your green passport?",,,,1231246623726022657,https://twitter.com/cchukudebelu/status/1231246623726022657
2020-02-22 15:55:49,NorbertElekes,,9,149,137,"Coronavirus fatality rate as of February 22: Iran: 17.9% Italy: 6.1% China: 3.1% S Korea: 0.5% Globally: 3.0%",,,,1231246222381461504,https://twitter.com/NorbertElekes/status/1231246222381461504
2020-02-22 15:55:16,XHNews,,7,33,109,"Landmarks in Melbourne were lit up in red and gold to express solidarity with China. #coronavirus #StayStrongChinapic.twitter.com/j6R85PueDs",,,#coronavirus #StayStrongChinapic,1231246082631356416,https://twitter.com/XHNews/status/1231246082631356416
2020-02-22 15:52:26,JennieStan_Lov,,2,57,174,"so jennie is now the highest pre order/sales from chinese fans with 25,579 Copies... this is such a huge achievement.. jennie even thought she doesn't have fans there.. and now she's the highest among other kpop girl group sales in china.. proud... pic.twitter.com/U8JEQ9YmZQ",,,,1231245372590215168,https://twitter.com/JennieStan_Lov/status/1231245372590215168
2020-02-22 15:50:05,FiveRights,,1,44,73,"The Left lies. I could give 1,000 examples (Dems re Trump, media re racial issues, soc media re bias, etc.). Always, the Left needs false narratives to sell its rights-reducing, self-serving, authoritarian policies. China is further left. So imagine what's really going on there.",,,,1231244778932666370,https://twitter.com/FiveRights/status/1231244778932666370
2020-02-22 15:49:44,GordonGChang,HuXijin_GT,18,118,262,"""Wuhan's mistakes""? Don't lay off blame on local officials, @HuXijin_GT. The Communist Party caused this disaster. #COVID19 #CoronavirusOutbreak #China https://twitter.com/HuXijin_GT/status/1231216691561893894 …",,@HuXijin_GT,#COVID19 #CoronavirusOutbreak #China,1231244691057848322,https://twitter.com/GordonGChang/status/1231244691057848322
2020-02-22 15:47:58,mrbcyber,,6,42,58,"China is destroying a Cambodian paradise - New York Post https://nypost.com/2020/02/22/how-china-is-destroying-a-precious-cambodian-paradise/ …",,,,1231244245031239680,https://twitter.com/mrbcyber/status/1231244245031239680
2020-02-22 15:47:57,PandemicCovid20,,2,38,73,"The Coronavirus situation has shifted in the last 24 hours with an acceleration of cases outside China. The impact on national economies will be major. Our sister account gives you headlines to help you navigate turbulent times. https://twitter.com/coronavirusEco1",,,,1231244243693338629,https://twitter.com/PandemicCovid20/status/1231244243693338629
2020-02-22 15:45:07,QuickTake,,6,49,86,"Supermarkets in China are fighting to stay open as the #coronavirus outbreak forces restaurants and offices to close nationwidepic.twitter.com/8JnStxFcrb",,,#coronavirus,1231243528493244416,https://twitter.com/QuickTake/status/1231243528493244416
2020-02-22 15:45:04,cnni,,8,76,130,"Concerns are growing over the global spread of the novel coronavirus after a spike in cases outside of mainland China among people with no connection to China or the city of Wuhan, ground zero for the outbreak https://cnn.it/2SOZXJV",,,,1231243516241682433,https://twitter.com/cnni/status/1231243516241682433
2020-02-22 15:43:47,GordonGChang,HuXijin_GT,10,79,154,"#SouthKorea was slow in taking action because #China prevailed upon Prez #MoonJaein to not impose travel restrictions. Beijing is a culprit as well as Moon. #COVID19 #CoronavirusOuthttps://twitter.com/HuXijin_GT/status/1231216691561893894 …",,,#SouthKorea #China #MoonJaein #COVID19 #CoronavirusOuthttps,1231243193813000194,https://twitter.com/GordonGChang/status/1231243193813000194
2020-02-22 15:37:04,IndoPac_Info,,13,106,119,"THREAD: #Coronavirus found in patients’ urine poses challenge to #China’s sewer system #Chinese scientists found traces of coronavirus in patients' urine, suggesting the virus is capable of traveling with the blood to the body to harm multiple organshttps://www.globaltimes.cn/content/1180418.shtml …",,,#Coronavirus #China #Chinese,1231241503042764800,https://twitter.com/IndoPac_Info/status/1231241503042764800
2020-02-22 15:36:52,EnzoMazak,meilong15,43,288,433,"Real Chinese. Let the fists do the talking. #coronaviruschina #WuhanCoronavius #WuhanVirus #ccp #china #coronavirushttps://twitter.com/meilong15/status/1230934721846136840 …",,,#coronaviruschina #WuhanCoronavius #WuhanVirus #ccp #china #coronavirushttps,1231241453222760449,https://twitter.com/EnzoMazak/status/1231241453222760449
2020-02-22 15:36:06,ChristinePolon1,,1,37,46,"This woman hired Snowden's lawyers in China. Chongqing. When Bloomberg News’s reporting on China was challenged, Bloomberg tried to ruin me for speaking out https://interc.pt/2V1etQp by Leta Hong Fincher",,,,1231241258351255552,https://twitter.com/ChristinePolon1/status/1231241258351255552
2020-02-22 15:35:19,DerekJGrossman,,5,41,59,"Duterte consistently undermines the Philippines' national security by embracing China & distancing from US. He has also used extrajudicial killings to prosecute his drug war. And yet, he remains immensely popular. Thus there is no incentive to change. https://www.theatlantic.com/international/archive/2020/02/philippines-rodrigo-duterte-china/606754/ …",,,,1231241061684531201,https://twitter.com/DerekJGrossman/status/1231241061684531201
2020-02-22 15:34:45,WilliamYang120,HuXijin_GT,11,41,168,"What laughable conclusion from someone who works for a regime that is responsible for the suffering of millions in #China. #Beijing has no right to “question” other countries’ ability to deal with #COVID19 outbreak when it continues to fail to be transparent about ...https://twitter.com/HuXijin_GT/status/1231216691561893894 …",,,#China #Beijing #COVID19,1231240921930354689,https://twitter.com/WilliamYang120/status/1231240921930354689
2020-02-22 15:32:22,adjunctprofesor,,21,150,102,"China is using using advanced technology to fight #COVID19 that could wind up collapsing its economy. #Drones deployed across China to spray disinfectant in public spaces to fight #coronavirus. . @POTUS . @realDonaldTrump #PatriotsAwakened #FlynnFighters #WWG1WGA #AdjunctProfessrpic.twitter.com/pl7sDCbpu8",,@POTUS @realDonaldTrump,#COVID19 #Drones #coronavirus #PatriotsAwakened #FlynnFighters #WWG1WGA #AdjunctProfessrpic,1231240322262425602,https://twitter.com/adjunctprofesor/status/1231240322262425602
2020-02-22 15:31:44,flightradar24,,8,170,361,"Air traffic at China’s busiest airports down 80% since the beginning of the year. Find the latest numbers from this week at https://www.flightradar24.com/blog/air-traffic-at-chinas-busiest-airports-down-80-since-the-beginning-of-the-year/ …pic.twitter.com/ee2yKQ5E1o",,,,1231240162656555016,https://twitter.com/flightradar24/status/1231240162656555016
2020-02-22 15:30:09,NoTatsClassy,PatTxguy77,6,32,78,"Promises that matter to me: *Mass deportations *Ending birthright citizenship *Ending voter fraud *Ending illegal immigration *Ending H1b visas *Ending our dependence on China and Mexico *Building a REAL wall *America First Trump broke his promises to me. @realDonaldTrumphttps://twitter.com/PatTxguy77/status/1231237949490155523 …",,@realDonaldTrumphttps,,1231239762448670720,https://twitter.com/NoTatsClassy/status/1231239762448670720
2020-02-22 15:30:06,OnlyGod4ever,,4,188,98,"The Internet has changed the relationship between rulers and ruled worldwide Some rulers have been surprisingly successful in censoring and controlling Internet use by their subjects The most successful Internet censors are North Korea and China #TAP https://strategypage.com/htmw/htiw/articles/20200222.aspx …",,,#TAP,1231239748733173766,https://twitter.com/OnlyGod4ever/status/1231239748733173766
2020-02-22 15:29:55,RavirajDesai10,GabbbarSingh,17,27,327,"I am in health department... we checked every individual came from China ,Hongkong and all ASEAN countries... after 14 days of daily feedback.. we are 100% sure that In India conovirus cases are in single digit....3 +1 may be...Not greater than 4",,,,1231239704605069313,https://twitter.com/RavirajDesai10/status/1231239704605069313
2020-02-22 15:28:00,iHeartRadio,,57,557,2705,"Justin Bieber is showing his support to China. pic.twitter.com/85Rel5QwHr",,,,1231239220989251585,https://twitter.com/iHeartRadio/status/1231239220989251585
2020-02-22 15:22:15,onlyyoontv,,22,46,190,"Good news! My local @Starbucks started accepting pop-in visits as of Fri. (Till now I could only pay via the app for pick-up or food delivery.) BUT customers still can’t lounge around - police tape keeps you away from the chairs and movin’ out the door. $SBUX #China #coronaviruspic.twitter.com/UjRX4UFQD5",,@Starbucks,#China #coronaviruspic,1231237775564783617,https://twitter.com/onlyyoontv/status/1231237775564783617
2020-02-22 15:20:17,KarluskaP,,44,243,403,"Why is #WuhanCoronavius showing up in places with no connection to China? pic.twitter.com/sa6wLf8Xyl",,,#WuhanCoronavius,1231237281773735936,https://twitter.com/KarluskaP/status/1231237281773735936
2020-02-22 15:20:15,sep_hk,epw_in,0,15,80,"Hong Kong is a frontline to fight against authoritarian ideology. What we demand are democracy & freedom that are PROMISED in the law. And CCP's response to our protests clearly shows to the free world that authoritarian China see democratic ideology as a threat. #StandWithHKpic.twitter.com/ePrA0LHREs",,,#StandWithHKpic,1231237272386719744,https://twitter.com/sep_hk/status/1231237272386719744
2020-02-22 15:17:05,SPACEdotcom,,8,32,76,"China wants to build a new space station. A planned launch in April will set the stage. http://dlvr.it/RQXtGR pic.twitter.com/RQS0OMrR3v",,,,1231236475615768577,https://twitter.com/SPACEdotcom/status/1231236475615768577
2020-02-22 15:16:38,mr_sewali,HBCUfessions,2,16,64,"Uganda govt Uganda govt asking US for aid after getting aid from US,China https://twitter.com/HBCUfessions/status/1231004984193490944 …",,,,1231236362415804416,https://twitter.com/mr_sewali/status/1231236362415804416
2020-02-22 15:16:23,BaoGan_CN,,9,218,471,"As of 02.22 23:00 BJT, Chinese BLINKs have collected enough money to purchase 84,686 copies of BLACKPINK’s upcoming album (non-shipping back + shipped back to China). 职业黑粉操盘手吧 @ygofficialblinkpic.twitter.com/mnPADLAgzZ",,@ygofficialblinkpic,,1231236300092522496,https://twitter.com/BaoGan_CN/status/1231236300092522496
2020-02-22 15:14:29,zeynep,,5,69,369,"People often misunderstand what technology does for authoritarianism and that's there is more than one path. The way China handled its digital public sphere *before* Xi made it more responsive and resilient. Xi turned back to the Orwellian lane—repressive but brittle. So we see.",,,,1231235820197117955,https://twitter.com/zeynep/status/1231235820197117955
2020-02-22 15:14:12,PHREUTERS,shahrooz_khan,1,23,47,"Iran's Mahan air flights to China continued for the sake of Tehran's ""national interests"" (China backs Iran in its nuke standoff with US)some 2 million masks were sent to China . ""now we have #coronavirus, no masks + Blacklisted by FATF,"": member of Iran's chamber of commercehttps://twitter.com/shahrooz_khan/status/1230941462751215621 …",,,#coronavirus,1231235747849654273,https://twitter.com/PHREUTERS/status/1231235747849654273
2020-02-22 15:12:20,steve_hanke,,69,856,904,"On Thursday, #China's #HubeiProvince reported 349 new cases of #Coronavirus, but #Wuhan, Hubei's capital, reported 615 cases all by itself. The #CCP can't even get its own story straight. This is why no one should believe a word coming out of #Beijing.https://www.thehour.com/news/article/Confusion-mounts-over-China-s-counting-methods-as-15071671.php …",,,#China #HubeiProvince #Coronavirus #Wuhan #CCP #Beijing,1231235278804865029,https://twitter.com/steve_hanke/status/1231235278804865029
2020-02-22 15:08:09,fascinatorfun,,2,20,14,"How IBM Designed China’s Surveillance Regime – Byline Times Major Western companies helped build China’s surveillance state –a model which is now being quietly exported back to the West under the guise of installing efficient and sustainable ‘smart cities’ https://bylinetimes.com/2019/05/24/smart-cities-and-automated-racism-how-ibm-designed-chinas-surveillance-regime/ …",,,,1231234225606680577,https://twitter.com/fascinatorfun/status/1231234225606680577
2020-02-22 15:07:16,biancoresearch,,5,25,44,"Here are the latest numbers. These are log charts, if they are upward sloping, it means exponential growth. South Korea and Japan have a real problem. Are they about to ""re-run"" what China is going through? (1/3) @chrismartenson @jodigraphics15 @ErikSTownsend @MishGEApic.twitter.com/BFHqG2VdvR",,@chrismartenson @jodigraphics15 @ErikSTownsend @MishGEApic,,1231234004457787393,https://twitter.com/biancoresearch/status/1231234004457787393
2020-02-22 15:06:42,DavidBCollum,,94,59,637,"I see economists still claiming that covid-19 will take 1% off China's GDP. My math isn't following how that is even possible.",,,,1231233863495626757,https://twitter.com/DavidBCollum/status/1231233863495626757
2020-02-22 15:06:08,KE_YUKIKAZE,,1,37,154,"E: MS-05 GP Custom Block 2 扎古I-GP改乙型 R.O.B.O Vol.EX：GUNDAM 40th anniversary 2019 , China R.O.B.O @lab_robopic.twitter.com/zzxE1VWEtt",,@lab_robopic,,1231233718586470400,https://twitter.com/KE_YUKIKAZE/status/1231233718586470400
2020-02-22 15:05:27,Eric_Ericeiri,,45,208,177,"Dear #Family #Friends #Followers I'm having the flu, a heavy one. I got a tip from a friend in #Wuhan China: W ash hands U se mask properly H ave temperature checked A void large crowds N ever touch face with unclean hands Be safe! #CoronaVirushttps://www.independent.co.uk/news/world/asia/coronavirus-news-china-quarantine-symptoms-outbreak-hubei-a9352186.html …",,,#Family #Friends #Followers #Wuhan #CoronaVirushttps,1231233548704735232,https://twitter.com/Eric_Ericeiri/status/1231233548704735232
2020-02-22 15:03:52,KenRoth,,5,24,31,"Questions as coronavirus spreads to Iran: 1. Did Iran downplay the outbreak to avoid offending China (it may have originated in the large number of Chinese workers)? 2. Is Iran's public-health system, crippled due to US sanctions, able to treat people? https://trib.al/PU1th6U pic.twitter.com/ChOuHic1WB",,,,1231233150459752449,https://twitter.com/KenRoth/status/1231233150459752449
2020-02-22 15:00:01,dailynation,,32,19,51,"China has emerged as the favourite potential partner to help Kenya realise its oil dream after the key players, Tullow Oil Plc & Total SA, kicked off the process of selling part of their stakes in oil discoveries in South Lokichar, Turkana #NationPrimehttp://bit.ly/37KsIf3",,,#NationPrimehttp,1231232178866008064,https://twitter.com/dailynation/status/1231232178866008064
2020-02-22 14:58:14,marabutler67,KerrinHester,3,17,22,"America's pharmaceutical industry relies on a communist country for manufacturing. It concerns me!! China makes our medications! https://twitter.com/KerrinHester/status/1231229179145936897 …",,,,1231231732793401349,https://twitter.com/marabutler67/status/1231231732793401349
2020-02-22 14:57:03,JayinShanghai,,12,79,360,"Tesla China resumes full production of China Made Tesla Model 3 at Gigafactory Shanghai. Yesterday's CCTV XinWen LianBo news program, watched by millions! #Tesla #TeslaChina #Gigafactory #ChinaMade #Model3 #特斯拉 #中国 $TSLApic.twitter.com/LbsaFLVSfJ",,,#Tesla #TeslaChina #Gigafactory #ChinaMade #Model3 #特斯拉 #中国,1231231435173810176,https://twitter.com/JayinShanghai/status/1231231435173810176
2020-02-22 14:56:43,911CORLEBRA777,AmbLiuXiaoMing,0,23,28,"China's Ambassador to the UK tap dancing around the question as to whether Beijing stopped a World Health Organization delegation from entering Hubei province cc @DrDenaGrayson @thespybrief @LouiseMenschhttps://twitter.com/AmbLiuXiaoMing/status/1231173655658364929 …",,@DrDenaGrayson @thespybrief @LouiseMenschhttps,,1231231348439830528,https://twitter.com/911CORLEBRA777/status/1231231348439830528
2020-02-22 14:51:41,GordonGChang,,8,60,108,"#China's handling of the #COVID19 epidemic has shown no appreciable signs of improvement, and in some areas--especially the management of information--things have gotten worse. We'll talk about this on @TeamCavuto at 10:15 ET. #CoronavirusOutbreak",,@TeamCavuto,#China #COVID19 #CoronavirusOutbreak,1231230081751769089,https://twitter.com/GordonGChang/status/1231230081751769089
2020-02-22 14:51:23,QTRResearch,BNODesk,22,32,215,"Hey @realDonaldTrump — still think China is telling the truth on coronavirus? FYI, a good idea would be to provide billions to states to make sure everyone has consistent, accurate and ubiquitous tests for coronavirus so we can have accurate numbers on its spread thru the US. https://twitter.com/BNODesk/status/1231197859103625216 …",,@realDonaldTrump,,1231230008699637761,https://twitter.com/QTRResearch/status/1231230008699637761
2020-02-22 14:50:54,mefbama,,2,9,20,"I watched @TuckerCarlson piece on ""Ruling class incompetence"" is the truth. Politicians backed China instead of us, for their rich donors instead of us as millions were laid off and business, factories etc closed their doors around the country.",,@TuckerCarlson,,1231229887362609155,https://twitter.com/mefbama/status/1231229887362609155
2020-02-22 14:44:39,zeynep,,14,49,344,"Yes, it's a bold claim. Do convince me otherwise! China's authoritarianism is important, not just because of the billion-plus who live there—look how it's now mishandled its way into what almost certainly looks like a serious pandemic. (And it may well reshape the US, too. Soon).",,,,1231228310795038721,https://twitter.com/zeynep/status/1231228310795038721
2020-02-22 14:44:32,FrankSowa1,Apex_WW,4,30,27,"BREAKING - Attention Wall Street & economy futures watchers - ESPECIALLY TRUMP believers: Top 3 countries affected by COVID-19 are 1) China, 2) South Korea, 3) Japan. What does it do to cars, electronics, large appliances (Samsung, Apple, etc.)? You can't prop up markets forever. https://twitter.com/Apex_WW/status/1231037274852352001 …",,,,1231228285201387522,https://twitter.com/FrankSowa1/status/1231228285201387522
2020-02-22 14:43:27,conetec2010,,0,27,19,"China is testing hyperloop technology! #mobility #SmartCity via @wef @rwang0 @Fabriziobustama @mvollmer1 @SpirosMargaris @HaroldSinnott @ShiCooks @Droit_IA @diioannid @ipfconline1 @labordeolivier @sebbourguignon @kalydeoo @tewoz @Ym78200 @Nicochan33pic.twitter.com/bshDtmA7Zb",,@wef @rwang0 @Fabriziobustama @mvollmer1 @SpirosMargaris @HaroldSinnott @ShiCooks @Droit_IA @diioannid @ipfconline1 @labordeolivier @sebbourguignon @kalydeoo @tewoz @Ym78200 @Nicochan33pic,#mobility #SmartCity,1231228012328189952,https://twitter.com/conetec2010/status/1231228012328189952
2020-02-22 14:42:00,GHS,,1,15,34,"According to @WHO Director-General @DrTedros, experts are concerned about the cases of #COVID19 outside #China with no apparent epidemiological link, such as contact with a confirmed case or travel to #Wuhan or wider . (Photo: @CDCgov)pic.twitter.com/VoYAUrdBmP",,@WHO @DrTedros @CDCgov,#COVID19 #China #Wuhan,1231227644613578753,https://twitter.com/GHS/status/1231227644613578753
2020-02-22 14:40:00,dwnews,,9,44,52,"Outraged residents of a central Ukrainian town protested against the arrival of evacuees from China amid fears of the #coronavirus. So far, no confirmed cases of the virus have been registered in Ukraine.pic.twitter.com/eHVsjFiHAG",,,#coronavirus,1231227141234147328,https://twitter.com/dwnews/status/1231227141234147328
2020-02-22 14:37:35,sidhant,,3,26,96,"Picture of the C17 plane with relief supplies/ evacuation that was to go to Wuhan, China. No permission has been given yet for the plane by Bejing despite India requesting on 13th for the proposed flight on 20th feb. #WuhanCoronaviruspic.twitter.com/EiB9tgZNRW",,,#WuhanCoronaviruspic,1231226532569505794,https://twitter.com/sidhant/status/1231226532569505794
2020-02-22 14:37:07,LawrenceGostin,,2,5,21,"Community transmission in Korea, Iran, Japan turning pt for #COVIDー19. Is this start of wave of cases? @CDCgov prepares for non-travel cases. Enhanced screening of travellers from China won't work if mini epidemics occur in multiple countries. @DrTedros: ""window of opty closing""",,@CDCgov @DrTedros,#COVIDー19,1231226418488430593,https://twitter.com/LawrenceGostin/status/1231226418488430593
2020-02-22 14:36:13,zeynep,,76,1241,2773,"New piece. Hear me out. What if Xi Jinping didn't even *know* of key details of the coronavirus outbreak until it was too late? What if his authoritarian blindspot was *worsened* by China's use of surveillance and censorship technology? https://www.theatlantic.com/technology/archive/2020/02/coronavirus-and-blindness-authoritarianism/606922/ …pic.twitter.com/Zof3Ct6taI",,,,1231226188288471040,https://twitter.com/zeynep/status/1231226188288471040
2020-02-22 14:34:45,AngelaRaeBoon1,ReesusP,6,27,96,"They're made in China. Think of all the money and jobs trump took from Americans by having all those make America great again hats made in China. That alone proves he's Never put America first. I'm thankful for his courage to burn it.",,,,1231225821018324993,https://twitter.com/AngelaRaeBoon1/status/1231225821018324993
2020-02-22 14:34:11,ANINewsUP,,20,143,953,"A Special Air Force aircraft that has to fly to Wuhan (China) for the evacuation of Indians, has been loaded with medical equipment, at Hindon Air Force Station, in Ghaziabad. #CoronaViruspic.twitter.com/yljEsnoU2G",,,#CoronaViruspic,1231225678877450241,https://twitter.com/ANINewsUP/status/1231225678877450241
2020-02-22 14:33:20,thetwigpenpeopl,,12,15,83,"Some people think it's a easy job I do. Being self employed working from home. I don't buy my stock online from China. I go out at least once a week collecting. It doesn't matter about the weather I have to go out. Yup I fell in the bog lol x I still love my job #digthetwigpic.twitter.com/E2KZNGyiyr",,,#digthetwigpic,1231225463500091392,https://twitter.com/thetwigpenpeopl/status/1231225463500091392
2020-02-22 14:32:34,Paula55855,,31,56,98,"STOP THINK Guys we need to watch closely the figures that are now being announced regarding Coronavirus. China’s figures can’t be trusted . But, beware, western governments will act like Chinese government, in the event the virus takes hold. Is this an escaped Bio Weapon?",,,,1231225273372348417,https://twitter.com/Paula55855/status/1231225273372348417
2020-02-22 14:31:26,CGTNOfficial,,97,708,1494,"First batch of #coronavirus test kits donated by China arrives in Japan pic.twitter.com/mrH8NXKzrL",,,#coronavirus,1231224986259484672,https://twitter.com/CGTNOfficial/status/1231224986259484672
2020-02-22 14:31:03,cnni,,14,38,73,"China is a leading supplier of wedding dresses, and some brides-to-be may be unable to get the gown they want for their big day https://cnn.it/2SQfeuj",,,,1231224892147871746,https://twitter.com/cnni/status/1231224892147871746
2020-02-22 14:30:11,xiaozhanism,,9,61,216,"something positive we can take from the 100 Asian Heartthrobs 2020 voting is that xiaozhan's international fandom has grown so much. we know his fandom in china is huge (and they didn't help at all in this voting) but we got him nearly 2 million votes with just intl fans alone pic.twitter.com/rlZiSvFfNf",,,,1231224673570054144,https://twitter.com/xiaozhanism/status/1231224673570054144
2020-02-22 14:28:00,Paula_Piccard,,6,190,232,"#China is testing #hyperloop technology to end gridlock in its cities @wef #smartcity #Transport #innovation #Tech @MikeQuindazzi @SpirosMargaris @jblefevre60 @HaroldSinnott @kuriharan @chboursin @sallyeaves @ipfconline1 @Ym78200 @rajat_shrimal @hwingo @diioannid @Hal_Goodpic.twitter.com/dUjF1vk7DB",,@wef @MikeQuindazzi @SpirosMargaris @jblefevre60 @HaroldSinnott @kuriharan @chboursin @sallyeaves @ipfconline1 @Ym78200 @rajat_shrimal @hwingo @diioannid @Hal_Goodpic,#China #hyperloop #smartcity #Transport #innovation #Tech,1231224121347866625,https://twitter.com/Paula_Piccard/status/1231224121347866625
2020-02-22 14:25:58,DevelopmentPk,,2,73,372,"Pakistan plans second phase of Pak-China fibre optic cable #Pakistan is planning to start work on phase-II of the Pak-China fibre optic cable that will be laid along three main routes of the #China-Pakistan Economic Corridor ( #CPEC), including railway tracks.pic.twitter.com/WzHeh2MZlu",,,#Pakistan #China #CPEC,1231223612490776576,https://twitter.com/DevelopmentPk/status/1231223612490776576
