date,username,to,replies,retweets,favorites,text,geo,mentions,hashtags,id,permalink
2020-04-18 21:52:58,JonathanTurley,,155,1021,2374,"Dr. Birx just put up a chart that shows how ridiculous even the adjusted Chinese figures are. She spoke of the moral obligation of China. The real problem is imposing a legal obligation when current laws shield nations even for triggering a pandemic. https://thehill.com/opinion/judiciary/493467-why-china-will-likely-avoid-liability-in-spread-of-coronavirus-pandemic …",,,,1251629823136600065,https://twitter.com/JonathanTurley/status/1251629823136600065
2020-04-18 21:52:11,caseboltc9,,10,46,423,"This could be us. But people from China wanna eat bats. pic.twitter.com/hNQOsddMX7",,,,1251629623806513156,https://twitter.com/caseboltc9/status/1251629623806513156
2020-04-18 21:52:10,joegooding,,17,165,261,"President Trump is right to call out China on their death “reporting” figures on COVID19. No serious person believes their numbers. @POTUS @realDonaldTrumppic.twitter.com/TQCoyuCEqR",,@POTUS @realDonaldTrumppic,,1251629620878872578,https://twitter.com/joegooding/status/1251629620878872578
2020-04-18 21:52:09,CalforNC,,14,160,450,"This is exactly why I called for an investigation. We need to get to the bottom of why this administration allowed PPE to be shipped to China—while we’re now short on supplies here at home. https://www.washingtonpost.com/health/us-sent-millions-of-face-masks-to-china-early-this-year-ignoring-pandemic-warning-signs/2020/04/18/aaccf54a-7ff5-11ea-8013-1b6da0e4a2b7_story.html …",,,,1251629616512581632,https://twitter.com/CalforNC/status/1251629616512581632
2020-04-18 21:51:56,epacheco255,,14,168,198,"There you have it. US COVID mortality rate is lower than all countries at 11 % per 100,000 only Iran and China are lower than us if you can believe that. So our @realDonaldTrump has done a phenomenal job in combating this biowarfare Virus from China. Thank you for your hard work!",,@realDonaldTrump,,1251629562380849152,https://twitter.com/epacheco255/status/1251629562380849152
2020-04-18 21:51:15,greta,,111,159,500,"So the country where this all started claims this? Really? Why can’t China be honest about this pandemic? See below (this was the chart Dr. Birx showed at the coronavirus briefing...) pic.twitter.com/e3rhSAZmRy",,,,1251629391102332939,https://twitter.com/greta/status/1251629391102332939
2020-04-18 21:51:13,QStorm1111,,51,279,993,"Whoa!!! Did you hear Trump while Birx is talking?! “Does anyone REALLY believe this about China?!?!” He’s BLASTING the narrative to SHREDS in front of the WORLD! Making her look like a TOTAL FOOL. He KNOWS the numbers are complete BS. He’s exposing it!",,,,1251629380821856257,https://twitter.com/QStorm1111/status/1251629380821856257
2020-04-18 21:50:30,ErinMPerrine,,180,1695,3940,". @realDonaldTrump RIGHTLT points out how unbelievable China’s reported numbers are. Dr. Birx —> “I put China on there so you could basically see how unrealistic this could be.” pic.twitter.com/3g0SeI8i2F",,@realDonaldTrump,,1251629202635456513,https://twitter.com/ErinMPerrine/status/1251629202635456513
2020-04-18 21:49:04,JoeConchaTV,,43,290,644,"Dr. Birx showing charts of potential hot spots in New Orleans, Detroit that didn’t materialize. Then she pivoted to deaths per 100K population in underscoring (A) USA health system performance and (B) How utterly ridiculous the China number is, which some news orgs push as gospel pic.twitter.com/FBgKflsGaE",,,,1251628841862340609,https://twitter.com/JoeConchaTV/status/1251628841862340609
2020-04-18 21:48:58,DeAnna4Congress,,68,778,2136,"Even Dr. Birx, who is usually very measured and just adheres to the data, is slamming China for their lack of transparency and discussing how unbelievable their numbers are. We have to hold China accountable for what they've done.",,,,1251628816608497671,https://twitter.com/DeAnna4Congress/status/1251628816608497671
2020-04-18 21:48:37,TarekFatah,,87,1764,4019,"Germany’s largest paper tells China's President #Jinping: ”You're endangering the world. You [Jinping], your government and your scientists had to know long ago that coronavirus is highly infectious, but you left the world in the dark about it.""https://www.jpost.com/international/germanys-largest-paper-to-chinas-president-youre-endangering-the-world-625074 …",,,#Jinping,1251628729727680513,https://twitter.com/TarekFatah/status/1251628729727680513
2020-04-18 21:48:30,ECMcLaughlin,,132,446,1545,"This needs to be said: no matter what China did, no matter the accuracy of their numbers, this President knew a pandemic was on the way as early as November. AND DID NOTHING. Approaching 750,000 Americans infected, and 40,000 dead. IT'S ON HIM.",,,,1251628696714137600,https://twitter.com/ECMcLaughlin/status/1251628696714137600
2020-04-18 21:47:43,k_ovfefe2,,17,83,363,"Trump keeps interrupting Dr Birx to point out how fake China & Iran's numbers are he is in a mood today",,,,1251628499653328902,https://twitter.com/k_ovfefe2/status/1251628499653328902
2020-04-18 21:47:39,sam_vinograd,,47,36,284,"Today, Trump tells Americans not to believe China's numbers on covid-19 deaths. That took awhile.",,,,1251628484671221760,https://twitter.com/sam_vinograd/status/1251628484671221760
2020-04-18 21:47:34,RadioFreeTom,,579,891,3575,"Trump just interrupted Birx to challenge her slide, asking “does anybody really believe this about China?” Birx trying to stay on track. Wow. Trump trying to hijack the moment again. Birx is trying to speak. He has lost his shit, and every American needs to be watching this.",,,,1251628463771078663,https://twitter.com/RadioFreeTom/status/1251628463771078663
2020-04-18 21:47:33,PhilipWegmann,,9,32,68,"Trump on mortality rates from China: Does anybody “really believe” this number? pic.twitter.com/pBLmoR0mCZ",,,,1251628458129719296,https://twitter.com/PhilipWegmann/status/1251628458129719296
2020-04-18 21:47:26,RaheemKassam,,22,160,754,"Amb. Dr. Birx says China’s mortality rate is completely implausible.",,,,1251628429834944514,https://twitter.com/RaheemKassam/status/1251628429834944514
2020-04-18 21:47:17,IndianaMike75,,5,60,125,"China must be brought to their knees unmercifully by the United States for this virus release! Make the ChiComs pay dearly, so they never ever forget! #AmericaFirst",,,#AmericaFirst,1251628393201840130,https://twitter.com/IndianaMike75/status/1251628393201840130
2020-04-18 21:47:12,KellyO,,263,155,777,"The president is interrupting Dr. Birx's presentation to note that China and Iran show very low mortality rates reported and the president repeated ""Does anybody believe that number?""",,,,1251628370800128000,https://twitter.com/KellyO/status/1251628370800128000
2020-04-18 21:46:57,BWH85,,34,163,803,"Feel like China should at least report a semi-realistic death rate.... Like when you cheat on a test and still miss one or two questions just to make it look less suspicious.",,,,1251628307050688512,https://twitter.com/BWH85/status/1251628307050688512
2020-04-18 21:46:52,BrugesGroup,,24,328,1135,"President Trump, standing in front of a graph comparing Deaths Per 100,000 Population, points at China and asks “Does anybody believe this number?” Excellent. No, Mr President, we don’t believe it.",,,,1251628287966818305,https://twitter.com/BrugesGroup/status/1251628287966818305
2020-04-18 21:45:55,charliespiering,,20,68,146,"Dr. Birx shows mortality rate chart Trump points out China: “Does anyone really believe this number?” pic.twitter.com/qvChSSJ0pK",,,,1251628047452733441,https://twitter.com/charliespiering/status/1251628047452733441
2020-04-18 21:45:40,KellyO,,40,23,85,"DR BIRX; The US has a lower mortality rate than several European countries. China reports a rate of 0.33 and the president said ""Does anybody really believe this number?""",,,,1251627983745568770,https://twitter.com/KellyO/status/1251627983745568770
2020-04-18 21:45:28,CyrusAParsa1,,77,622,577,"Cyborg Beetles on #5G can Kill Humans Guided by #AI Poison/Virus Delivery Systems. Published in my Books https://cyrusaparsa.selz.com/item/artificial-intelligence-dangers-to-humanity … Used to Crawl into UR Homes by Terrorists/Big Tech=MBT? China CCP Stole this #biotech Retweet, Support My Efforts Pls Demand Media Stop Censoring me.pic.twitter.com/fMdODtpbc0",,,#5G #AI #biotech,1251627936613953536,https://twitter.com/CyrusAParsa1/status/1251627936613953536
2020-04-18 21:45:14,VertueCo,RyanAFournier,4,26,200,"We should not be funding anything to do with China after this. They should be funding stuff for us, such as ALL the economic recovery efforts.",,,,1251627878271389697,https://twitter.com/VertueCo/status/1251627878271389697
2020-04-18 21:45:00,ChinaInFocusNTD,,41,229,429,"#China's economy shrinks for the first time since records began 3 decades ago. Its GDP fell almost 6.8% in the first quarter. Factories shut down and exports fell due to the #CCPVirus. Many countries are re-evaluating their trading relationship with China. pic.twitter.com/zP8nbxWTeJ",,,#China #CCPVirus,1251627816787087371,https://twitter.com/ChinaInFocusNTD/status/1251627816787087371
2020-04-18 21:43:57,RyanAFournier,,1675,14036,55048,"President Trump has announced that he will end Obama era funding to the Wuhan lab accused of spreading the China virus. Why were we funding it in the first place?",,,,1251627552889856007,https://twitter.com/RyanAFournier/status/1251627552889856007
2020-04-18 21:42:52,WarRoomPandemic,,2,73,111,". @BillGertz: China has produced scientific papers revealing that it has done incredibly dangerous work on viruses, including manufacturing new bat viruses. This research must be exposed. #WarRoomPandemic #DescentIntoHell #CCPVirus http://warroom.org/podcast pic.twitter.com/enGKaGwQwk",,@BillGertz,#WarRoomPandemic #DescentIntoHell #CCPVirus,1251627282592129025,https://twitter.com/WarRoomPandemic/status/1251627282592129025
2020-04-18 21:42:27,BardsOfWar,,11,138,324,"Notable. Today's China Virus Press briefing with @POTUS. YouTube TV LIVE moderator appeared again with: WRWY (translated: We Are With You) pic.twitter.com/bTB5ezSXiR",,@POTUS,,1251627176090234880,https://twitter.com/BardsOfWar/status/1251627176090234880
2020-04-18 21:41:42,wdunlap,BryanDeanWright,2,103,237,"China wants a Return on their Investment... pic.twitter.com/AOXlypVIK6",,,,1251626986008543232,https://twitter.com/wdunlap/status/1251626986008543232
2020-04-18 21:41:11,wdunlap,realDonaldTrump,6,42,87,"China want a Return on their Investment... pic.twitter.com/xBZAgEnovu",,,,1251626858262622208,https://twitter.com/wdunlap/status/1251626858262622208
2020-04-18 21:40:18,MoS_Politics,,1,51,56,"Inside that Wuhan lab... and Britain's suited svengalis doing China's bidding... https://www.dailymail.co.uk/news/article-8233185/Shock-photos-inside-Wuhan-lab-stores-1-500-virus-strains.html …pic.twitter.com/n5fC9RCIFl",,,,1251626636652445702,https://twitter.com/MoS_Politics/status/1251626636652445702
2020-04-18 21:39:20,OANN,,125,132,294,"Biden Changes Tune On China As He Takes Aim At President Trump Over COVID-19 Response https://www.oann.com/biden-changes-tune-on-china-as-he-takes-aim-at-president-trump-over-covid-19-response/ … #OANNpic.twitter.com/EwjVOvGWVA",,,#OANNpic,1251626390014705665,https://twitter.com/OANN/status/1251626390014705665
2020-04-18 21:38:40,breeadail,,8,116,151,"""Police arrested 15 high-profile pro-democracy figures in connection with allegedly “organizing and participating in unlawful assemblies,” according to the security bureau."" #CCP: Never let a crisis go to waste. #COVID #China #HongKong @HongKongFPhttps://hongkongfp.com/2020/04/18/8-hong-kong-pro-democracy-figures-arrested-in-latest-police-round-up-party-says/?fbclid=IwAR34eRpRJryPSVY_vfn6VhGCCCWmWgIEMgwMs8tR5GcEZfXJpDxlN7VJH2o …",,@HongKongFPhttps,#CCP #COVID #China #HongKong,1251626222951505922,https://twitter.com/breeadail/status/1251626222951505922
2020-04-18 21:38:25,ewong,maggieNYT,7,16,26,"Trump keeps trying to please Xi despite GOP’s desire to bash China. And Trump keeps touting his travel ban on flights from China as a major action on the coronavirus. But about 40,000 people traveled to US from China in the 2 months after the travel ban: https://www.nytimes.com/2020/04/04/us/coronavirus-china-travel-restrictions.amp.html …https://twitter.com/maggieNYT/status/1251624756505436160 …",,,,1251626159588155393,https://twitter.com/ewong/status/1251626159588155393
2020-04-18 21:38:04,mickitiki,realDonaldTrump,8,148,145,"President Trump, China is still dreaming of sniffing Joe winning! Well, they can dream on because that’s all they will get! You r winning as always! Trump 2020! That’s not a dream it’s reality! 4 more years! pic.twitter.com/SnTEGqFYwK",,,,1251626071998504962,https://twitter.com/mickitiki/status/1251626071998504962
2020-04-18 21:36:30,TeamTrump,,226,1316,4590,"President @realDonaldTrump: #Coronavirus “could have been stopped in China.” pic.twitter.com/eJqv8RagBr",,@realDonaldTrump,#Coronavirus,1251625679726227456,https://twitter.com/TeamTrump/status/1251625679726227456
2020-04-18 21:35:19,michaelbeatty3,,17,606,967,"IT COULD HAVE BEEN STOPPED IN CHINA... AND IT WASN'T AND NOW THE WHOLE WORLD IS SUFFERING"" @realDonaldTrumppic.twitter.com/uAhXjGCXvM",,@realDonaldTrumppic,,1251625381670469632,https://twitter.com/michaelbeatty3/status/1251625381670469632
2020-04-18 21:35:09,RealNZParty,,2,15,27,"This is worth reading if you are a Kiwi. While Australia can play India and China off each other, it is clear that this Government has all but surrendered our Sovereignty to China and the UN. https://www.eastasiaforum.org/2020/03/15/why-india-isnt-going-to-save-australia-from-chinas-power/ …",,,,1251625339907784706,https://twitter.com/RealNZParty/status/1251625339907784706
2020-04-18 21:34:44,dennismpe,JoeNBC,886,69,986,"Hunter Biden. $1.5 billion. China. My ad. 5 words.",,,,1251625235943763970,https://twitter.com/dennismpe/status/1251625235943763970
2020-04-18 21:34:43,weijia,,35,59,247,"Trump is slamming China much harder than he has in recent weeks. He may or may not have seen this @maggieNYT @jmartNYT piece:https://www.nytimes.com/2020/04/18/us/politics/trump-china-virus.html?referringSource=articleShare …",,@maggieNYT @jmartNYT,,1251625228519735297,https://twitter.com/weijia/status/1251625228519735297
2020-04-18 21:34:36,okezie_moses,ChrisJZullo,25,49,156,"At least you now agreed he shut down travel to China. That's progress. Now apply yours to it and you may just decipher all the other things he's done to combat #Covid_19, maybe in time for November. Here I've laid out crumbs for ya.pic.twitter.com/KATNYHYX8O",,,#Covid_19,1251625201277771776,https://twitter.com/okezie_moses/status/1251625201277771776
2020-04-18 21:34:17,NelsonGafanha,MarkDice,7,17,295,"We have become communist China.",,,,1251625118918488064,https://twitter.com/NelsonGafanha/status/1251625118918488064
2020-04-18 21:34:12,NekoYasha09,,14,101,587,"I can't believe I have to say this in 2020. Mulan is not wearing geisha makeup. Mulan is not wearing a kimono. Mulan is bit Japanese, she is chinese. Geisha and kimono come from japan. Mulan is wearing hanfu and traditional wedding makeup from that time period in china.",,,,1251625098160803849,https://twitter.com/NekoYasha09/status/1251625098160803849
2020-04-18 21:33:27,BadFoxGraphics,,1,14,35,"""Unfortunately some partisan voices are attempting to politicize the issue of testing, which they shouldn't be doing, because I inherited broken JUNK!"" –Pres. Donald J. Trump The novel coronavirus — 2019-nCoV — was first reported in Wuhan, China in Dec 2019. There was no test. pic.twitter.com/lNnquxrz2A",,,,1251624912923623427,https://twitter.com/BadFoxGraphics/status/1251624912923623427
2020-04-18 21:32:50,maggieNYT,,109,166,459,"“Even as the president tries to rebut criticism of his slow response to the outbreak by highlighting his January travel restrictions on China, he has repeatedly called Mr. Xi a friend and said ‘we are dealing in good faith’ with the repressive government” https://www.nytimes.com/2020/04/18/us/politics/trump-china-virus.html …",,,,1251624756505436160,https://twitter.com/maggieNYT/status/1251624756505436160
2020-04-18 21:32:03,HKrassenstein,,14,264,670,"BREAKING: Trump says “It could have been stopped in China.” Trump knew about the virus the same week in November that the first case of COVID19 occurred. He’s the one who didn’t do anything to stop it. No one else! Him! #TrumpPressConf",,,#TrumpPressConf,1251624558102294534,https://twitter.com/HKrassenstein/status/1251624558102294534
2020-04-18 21:31:04,jomareewade,,11,98,98,"New evidence that the Trump administration actively encouraged US companies to export PPE to China (because the price was so good) - - in late February and March - - even after everyone knew about thousands of deaths in Wuhan https://www.washingtonpost.com/health/us-sent-millions-of-face-masks-to-china-early-this-year-ignoring-pandemic-warning-signs/2020/04/18/aaccf54a-7ff5-11ea-8013-1b6da0e4a2b7_story.html …pic.twitter.com/0z864hF2Ya",,,,1251624310487371784,https://twitter.com/jomareewade/status/1251624310487371784
2020-04-18 21:30:25,denisewu,maggieNYT,1,29,93,"What Trump did is 11 times worst than China China = 6 days delay Trump = #70DaysDeadlyDelay #TrumpLiedAmericansDied",,,#70DaysDeadlyDelay #TrumpLiedAmericansDied,1251624149698506752,https://twitter.com/denisewu/status/1251624149698506752
2020-04-18 21:30:25,AnonymousJourn9,,4,48,31,"People dropping like flies in #Heilongjiang Province in #China as it emerges as the new epicentre in China... pic.twitter.com/NWmDTMsZp5",,,#Heilongjiang #China,1251624147429572608,https://twitter.com/AnonymousJourn9/status/1251624147429572608
2020-04-18 21:30:18,ddale8,,142,152,794,"Trump: ""You're going to see some incredible hard facts and evidence that what we did was right."" Had we done it ""a different way,"" millions would've died; 60,000 is ""horrible,"" especially when ""it could've been stopped in China""... He is now boasting about the former economy",,,,1251624116697866241,https://twitter.com/ddale8/status/1251624116697866241
2020-04-18 21:30:06,JoeNBC,,7961,66194,148067,"This is the most devastating political ad I’ve seen in years. It reveals the truth about Trump and China, and that truth is ugly. pic.twitter.com/52cNf9Ay9u",,,,1251624069398749184,https://twitter.com/JoeNBC/status/1251624069398749184
2020-04-18 21:30:00,ChinaInFocusNTD,,52,493,711,"“Someone needs to take responsibility for this epidemic."" A #Hubei resident is suing the Chinese regime for its coverup in the #CCPVirus pandemic. It's the first known lawsuit of its kind in China. The police summoned him the night he filed the lawsuit. pic.twitter.com/mYfr1Os39X",,,#Hubei #CCPVirus,1251624042106195968,https://twitter.com/ChinaInFocusNTD/status/1251624042106195968
2020-04-18 21:29:49,davidaxelrod,davidaxelrod,44,268,899,"One other thing. Even if this were the case, this president has been in office for more than three years. What’s HE been doing? He folded the NSC unit in WH designed to mobilize our defenses at the first hint of pandemic. He folded U.S. gov labs in China meant to prevent them. https://twitter.com/davidaxelrod/status/1251621527998435329 …",,,,1251623997386526721,https://twitter.com/davidaxelrod/status/1251623997386526721
2020-04-18 21:29:24,nypost,,32,43,47,"US ignored early coronavirus warning signs, sent medical gear to China: analysis https://trib.al/gncaSlI pic.twitter.com/d1r4lAIztr",,,,1251623893082804228,https://twitter.com/nypost/status/1251623893082804228
2020-04-18 21:28:10,AKA_RealDirty,,36,713,1366,". @realDonaldTrump says China is way ahead of us in deaths. You know it, I know it, and they know it but the #FakeNews doesn’t want to talk about that. They’ll have to explain why and one day @realDonaldTrump will. pic.twitter.com/Uv11wkcfdI",,@realDonaldTrump @realDonaldTrump,#FakeNews,1251623579365539840,https://twitter.com/AKA_RealDirty/status/1251623579365539840
2020-04-18 21:27:41,4YrsToday,,45,140,66,"Donald Trump said Joe Biden is China’s dream candidate... ...is he really?",,,,1251623459723137029,https://twitter.com/4YrsToday/status/1251623459723137029
2020-04-18 21:27:18,datumx11,,6,31,141,"If Digong just heeded the call of VP Leni on the last week of January to ban the travellers from China immediately, then the situation of COVID cases would not be as bad as now.",,,,1251623364780675072,https://twitter.com/datumx11/status/1251623364780675072
2020-04-18 21:26:13,TDucklo,,6,170,269,"ATTN WH reporters: Here is a suggested Q to ask Trump right now (h/t @MichaelJGwin) @washingtonpost reports that your administration was actively encouraging U.S. manufacturers of PPE and ventilators to sell their equipment to China as late as March -- why did you do this? pic.twitter.com/o1ZAzQRe6N",,@MichaelJGwin @washingtonpost,,1251623092146839552,https://twitter.com/TDucklo/status/1251623092146839552
2020-04-18 21:25:16,Yahnnisse,,3,10,34,"I had a nightmare that the US pursued legal action against China and the rest of the world was saying forgive China, but their apology was fake then i saw Xi Jinping face smirking while a bomb went off in NYC",,,,1251622850915598338,https://twitter.com/Yahnnisse/status/1251622850915598338
2020-04-18 21:24:26,makaumutua,,43,69,241,"An eye for an eye leaves us all blind, but on this China issue… — https://www.nation.co.ke/oped/opinion/An-eye-for-an-eye-leaves-us-all-blind/440808-5528320-13kqxrdz/index.html … via @dailynation – at Garden Of Eden",,@dailynation,,1251622641984851969,https://twitter.com/makaumutua/status/1251622641984851969
2020-04-18 21:24:09,Leighforusa1,,6,222,128,"Canadian government scientist & staff were under investigation in July 2019 at Level 4 Wuhan lab in China. RT non-coincidental Please follow @Leighforusa1 #ChinaMustPayhttps://www.cbc.ca/news/canada/manitoba/national-microbiology-lab-scientist-investigation-china-1.5307424 …",,@Leighforusa1,#ChinaMustPayhttps,1251622570430009347,https://twitter.com/Leighforusa1/status/1251622570430009347
2020-04-18 21:23:39,mmpadellan,,166,2570,6559,"Every goddamn day trump tells the lie that he ""inherited a broken and obsolete system."" 1. You've been there for 3.5 years 2. There was no COVID before you 3. You gave away 18 tons of PPE to China while saying ""it's under control""",,,,1251622443732611072,https://twitter.com/mmpadellan/status/1251622443732611072
2020-04-18 21:22:31,Mnr_Baloyi,,8,74,218,"For china to fall, African leaders must first fall!!! #Chinamustfallpic.twitter.com/FSp68EzxnY",,,#Chinamustfallpic,1251622161229516801,https://twitter.com/Mnr_Baloyi/status/1251622161229516801
2020-04-18 21:22:30,qiaocollective,CGTNOfficial,3,41,100,"Due to 370 imported cases in China's northeast city Suifenhe, within days China has built a 600 bed hospital, bused in thousands of health & gov workers, & brought in millions of supplies. This is the power of a state that swiftly allocates resources to meet the people's needs. https://twitter.com/CGTNOfficial/status/1248526128643334144 …",,,,1251622157064507392,https://twitter.com/qiaocollective/status/1251622157064507392
2020-04-18 21:21:45,MrDiddy85,,18,94,93,"China Tries (and Fails) to Get Wisconsin to Pass Law Praising Beijing on Coronavirus WTF!! Wow China really needs to keep out of other Countries business!! https://www.breitbart.com/national-security/2020/04/17/china-tries-fails-get-wisconsin-pass-law-praising-beijing-on-coronavirus/ …",,,,1251621968648036353,https://twitter.com/MrDiddy85/status/1251621968648036353
2020-04-18 21:19:22,Rectitude20,,3,19,102,"Trump was discussing the MSM underreporting on COVID19 deaths in China and the fact China is no.1 in per capita deaths & said, “You know it, I know it, they know it, but you don’t want to report it. Why? You’ll have to explain that. Someday, I’ll explain it.” He knows.",,,,1251621366115205122,https://twitter.com/Rectitude20/status/1251621366115205122
2020-04-18 21:17:25,plantlady293,,20,283,309,"CBS, WGN, Fox local and Fox News only channels covering the President Task force report for today. #BoycottFakeNews including, NBC,ABC, MSNBC,& CNN for violating the rights people have to have free and fair media. Check their sponsors. They are probably China! #Women4Trump2020pic.twitter.com/lwqQRcQy7E",,,#BoycottFakeNews #Women4Trump2020pic,1251620875318820866,https://twitter.com/plantlady293/status/1251620875318820866
2020-04-18 21:16:46,RN_JB7,WhiteHouse,11,316,298,"The world must come together and Hold China, WHO and Democrats accountable for #CoronavirusOutbreakhttps://twitter.com/WhiteHouse/status/1251567197849337861 …",,,#CoronavirusOutbreakhttps,1251620711380275205,https://twitter.com/RN_JB7/status/1251620711380275205
2020-04-18 21:14:52,atrupar,,174,334,1199,"Trump attacks media for reporting stats indicating US has more coronavirus deaths than China: ""China's number 1. Just so you understand. China is number 1 by a lot. They are way ahead of us in terms of death. It is not even close. You know it, I know it, they know it."" pic.twitter.com/X06QJvfimH",,,,1251620232650727424,https://twitter.com/atrupar/status/1251620232650727424
2020-04-18 21:14:40,AndrewFeinberg,,19,145,209,". @realDonaldTrump just blatantly lied about whether the US has the highest number of COVID-19 deaths. It does. China does not. pic.twitter.com/WNdJk9aBdN",,@realDonaldTrump,,1251620185984860165,https://twitter.com/AndrewFeinberg/status/1251620185984860165
