date,username,to,replies,retweets,favorites,text,geo,mentions,hashtags,id,permalink
2020-04-18 18:25:35,MongezyI,,42,370,1884,"Finally China is trending for all the bad things they’re doing to our African people #Chinamustfallpic.twitter.com/WBNztEXGnk",,,#Chinamustfallpic,1251577632648564737,https://twitter.com/MongezyI/status/1251577632648564737
2020-04-18 18:25:30,V_of_Europe,,20,202,184,"Spain: Government recalls hundreds of thousands of defective facemasks made in China https://voiceofeurope.com/2020/04/spain-government-recalls-hundreds-of-thousands-of-defective-facemasks-made-in-china/ …pic.twitter.com/VCzzEmJ4rn",,,,1251577613094715395,https://twitter.com/V_of_Europe/status/1251577613094715395
2020-04-18 18:24:46,Aya_Yamz,,36,48,351,"#Chinamustfall finally y'all are back to your senses.. we need to boycott all china towns, china city, china anything.. These ppl must leave our khantri effective immediately. An eye for an eye, they must go. If u buy from them u go with them pic.twitter.com/cIUN0rCpzz",,,#Chinamustfall,1251577428209799169,https://twitter.com/Aya_Yamz/status/1251577428209799169
2020-04-18 18:24:15,haveaconcern,,24,107,98,"UCLA Professor Stole Missile Secrets for China, Faces 219 Years in Prison https://www.newsweek.com/ucla-professor-stole-missile-secrets-china-219-years-prison-espionage-1447286 …",,,,1251577295774547973,https://twitter.com/haveaconcern/status/1251577295774547973
2020-04-18 18:23:48,matbhh,hapynthsaddle,7,26,841,"It’s California trying to be China.",,,,1251577183992197122,https://twitter.com/matbhh/status/1251577183992197122
2020-04-18 18:23:33,db_is_db,,8,189,564,"Today's decision on not allowing the automatic route for FDI from China is a historic one, comes almost 22 years after George Fernandes' prescient statement. Let us raise a toast to the great, the one and only one George Fernandes and dedicate today's decision to him.",,,,1251577122000220160,https://twitter.com/db_is_db/status/1251577122000220160
2020-04-18 18:23:32,db_is_db,,4,43,166,"Not just that, in a superb Parthian shot from George Fernandes barely a few days after General Fu left India, George declared China to be India ’s potential ""threat number one"".",,,,1251577116920909825,https://twitter.com/db_is_db/status/1251577116920909825
2020-04-18 18:23:32,db_is_db,,1,42,150,"But like lightning which accompanies thunder, history has shown that the Chinese indulged in sneaky tactics to gain leverage, or anchor dominance before such visits and talks. This time George Fernandes turned the tables by deriding the Pak's missile firing and bringing in China",,,,1251577115209658368,https://twitter.com/db_is_db/status/1251577115209658368
2020-04-18 18:22:57,RonaldKlain,jmartNYT,6,38,96,"The other problem: Trump slathered China with praise in when it mattered! https://youtu.be/PmieUrXwKCc https://twitter.com/jmartNYT/status/1251569999887695873 …",,,,1251576968799272966,https://twitter.com/RonaldKlain/status/1251576968799272966
2020-04-18 18:22:29,donald_j_putin,,10,10,28,"Without supplying evidence, Trump says China has more coronavirus deaths than the U.S. Just as his inaugural crowd MUST HAVE BEEN larger than Obama's, or that hurricane MUST HAVE been headed for Alabama. SAY... has anyone seen Drumpf's SHARPIES? https://aol.it/2Kg5pAx",,,,1251576851321049088,https://twitter.com/donald_j_putin/status/1251576851321049088
2020-04-18 18:21:11,japansociety,,6,198,530,"Happy #Caturday, everyone! Since arriving in Japan aboard ships transporting sacred Buddhist scriptures from China in the mid-sixth century, cats have proceeded to purr and paw their way into the heart of Japanese life, folklore, and art. pic.twitter.com/vj5lY0MUrQ",,,#Caturday,1251576526493167618,https://twitter.com/japansociety/status/1251576526493167618
2020-04-18 18:20:43,Ruptly,,5,32,86,"This 4-year-old #driver is racing to become a social media #sensation #China pic.twitter.com/JrUQi2dwpG",,,#driver #sensation #China,1251576407479783424,https://twitter.com/Ruptly/status/1251576407479783424
2020-04-18 18:20:29,terzzm,,12,48,66,"#Chinamustfall but guys what is happening to our African people in China can not be tolerated, it's Rubbish and thuggish behavior, Insane racism at its best *sad pic.twitter.com/hFMPXsb3XZ",,,#Chinamustfall,1251576347371155458,https://twitter.com/terzzm/status/1251576347371155458
2020-04-18 18:20:28,KijanaWaFacts,,2,14,45,"President Uhuru sold our Country's dignity to China #ChineseInKenyaMustGopic.twitter.com/omeugIaZKq",,,#ChineseInKenyaMustGopic,1251576345391480839,https://twitter.com/KijanaWaFacts/status/1251576345391480839
2020-04-18 18:18:57,yesheger_lij,amnesty,1,13,30,"Fuck China https://twitter.com/amnesty/status/1251124298636496898 …",,,,1251575964095504385,https://twitter.com/yesheger_lij/status/1251575964095504385
2020-04-18 18:18:23,KingYusufYusuff,,9,10,60,"From now on I will call it the #ChineseVirus I will no longer call it anything else, but where it was originated from and that’s China, hence the appropriate name: The Chinese virus",,,#ChineseVirus,1251575821728350209,https://twitter.com/KingYusufYusuff/status/1251575821728350209
2020-04-18 18:17:55,AfidahKD94,KKMPutrajaya,2,5,35,"Kenapa x fokus on Italy or other country yg affected teruk psl covid19 ni? Kenapa Malaysia? Kenapa datang time2 everything is under control sedangkan China pun msh ada kes lagi. Sorry i just dont trust them. Remember where the outbreak started people.",,,,1251575701360132096,https://twitter.com/AfidahKD94/status/1251575701360132096
2020-04-18 18:17:43,GlenwoodNate,,18,49,100,"My wife, who is an all-star for a provincial health organization in China, is now receiving the majority of her salary in Groupons. They have an expiration date and there are limited events where she can spend them. This was a very recent change.",,,,1251575651661787138,https://twitter.com/GlenwoodNate/status/1251575651661787138
2020-04-18 18:17:34,nijireiki,unpr0bl0matic,5,16,800,"""When The Sun Goes Down"" wasn't an awful album for Miss Gomez, but like... China Anne McClain was RIGHT THERE & Disney did not appear to push their work equally hard to radio once it was recorded hmm...",,,,1251575615637069830,https://twitter.com/nijireiki/status/1251575615637069830
2020-04-18 18:17:03,Proverbs_China,,0,40,63,"Chinese Proverb: If you are patient in one moment of anger, you will escape a hundred days of sorrow. ❖ Chinese Proverbs #Quotes",,,#Quotes,1251575484821000192,https://twitter.com/Proverbs_China/status/1251575484821000192
2020-04-18 18:17:02,rinuk86,ylliSharon,0,13,32,"They climbed up to rank 8!!! Omg Thank you ZS fans in China, you guys always work so hard for our boys #ZaintSeehttps://twitter.com/ylliSharon/status/1251574092026662914 …",,,#ZaintSeehttps,1251575479058010112,https://twitter.com/rinuk86/status/1251575479058010112
2020-04-18 18:16:54,DavidThomsen15,,3,6,10,"Calif. Gov. Newsom signs billion-dollar contract to buy masks from Chinese manufacturer with troubled record - http://oann.com Looks like California is already a province of Communist China",,,,1251575447009148928,https://twitter.com/DavidThomsen15/status/1251575447009148928
2020-04-18 18:16:37,IrmaBel53130008,,8,59,54,"OH YES!! HOLD CHINA ACCOUNTABLE!! Ted Cruz introducing legislation to hold China accountable for hiding and suppressing public health information about the #coronavirus that has endangered the lives of millions across the globe.pic.twitter.com/uRngBVJ1mj",,,#coronavirus,1251575377048342529,https://twitter.com/IrmaBel53130008/status/1251575377048342529
2020-04-18 18:16:32,Khanoisseur,,1,7,17,"6. Can think of two explanations for why Trump/CDC didn’t mandate masks after **China mandated mask use in public in January**: 1. Incompetence/overconfidence/embarrassment because Trump failed to stock up on masks 2. They wanted virus to spread/people to develop “immunity” pic.twitter.com/y9Jr0Q0NjC",,,,1251575354797539330,https://twitter.com/Khanoisseur/status/1251575354797539330
2020-04-18 18:16:10,mutazamd,,1,10,27,"It only took a few coronavirus cases among African immigrants for China to fully embrace apartheid. I fear the discussion around flights into Heathrow, which scientists say pose minimal threat, will have a similar effect here. Already seeing tweets equating migrants to the virus.",,,,1251575264506777600,https://twitter.com/mutazamd/status/1251575264506777600
2020-04-18 18:15:49,saletan,,14,203,548,"Schiff tells @DavidCornDC the House intel committee is investigating ""When did the intelligence community first start reporting"" on COVID? ""What did they first observe going in in China? When did it first make its way into the President’s Daily Briefing?"" https://bit.ly/2Vh9tHc",,@DavidCornDC,,1251575175872753670,https://twitter.com/saletan/status/1251575175872753670
2020-04-18 18:15:41,Smoke56895160,,6,48,71,"Its Saturday April 18 and here is what we know: China wrecked our economy with 'coronavirus'. Dem's helped. MSM helped.",,,,1251575142410522633,https://twitter.com/Smoke56895160/status/1251575142410522633
2020-04-18 18:15:41,ProfKapilKumar,,4,13,54,"I am so happy today ! on 23rd march I had tagged PMO with a request to bring ordinance to stop take over of any Indian industry by any country !Its all China money floating for take overs ! Wish Carona Warriors Protection Ordinance also comes ! @PMOIndia @HMOIndia @rsprasad",,@PMOIndia @HMOIndia @rsprasad,,1251575140392943616,https://twitter.com/ProfKapilKumar/status/1251575140392943616
2020-04-18 18:15:18,AugusTyme,LauraPh27961838,157,127,1312,"In February the WHO was criticising countries for placing travel restrictions on people from China. In January the WHO said there was no human-to-human transmission of the virus. Stop rewriting history.",,,,1251575045069168643,https://twitter.com/AugusTyme/status/1251575045069168643
2020-04-18 18:14:47,RedPillBlackMan,,2,15,37,"With China's economy on life support, it's time to turn off the ventilator https://nypost.com/2020/04/18/why-america-desperately-needs-a-hard-decoupling-from-china/?utm_source=twitter_sitebuttons&utm_medium=site%20buttons&utm_campaign=site%20buttons … via @nypost",,@nypost,,1251574913552572416,https://twitter.com/RedPillBlackMan/status/1251574913552572416
2020-04-18 18:14:36,brandondarby,,45,53,273,"I have the belief that Joe Biden and most Democratic Party leadership are okay with us continuing to be dependent on China and that he doesn’t see that government as a threat to us and to our planet. Am I mistaken?",,,,1251574870263107585,https://twitter.com/brandondarby/status/1251574870263107585
2020-04-18 18:13:32,BaldingsWorld,,41,254,675,"Good thing we aren't blaming China. I wouldn't want them to get blamed for like not sharing data, biologic samples, restricting medical supply exports, arresting Hong Kong democracy advocates, threatening Taiwan, or annexing the South China Sea. Be nice to them guys",,,,1251574602326630401,https://twitter.com/BaldingsWorld/status/1251574602326630401
2020-04-18 18:11:04,HKWORLDCITY,,50,547,767,"Vietnam says that China is mislabeling products as Vietnamese to avoid U.S. tariffs #Vietnam #China #AnywherebutChinahttps://amp.usatoday.com/amp/1408023001",,,#Vietnam #China #AnywherebutChinahttps,1251573977601851392,https://twitter.com/HKWORLDCITY/status/1251573977601851392
2020-04-18 18:09:56,pittman_george,,5,20,26,"Why is Lebron so quiet about this? Africans in China: ‘You Can’t Go Out on the Street if You Are Black’ https://www.breitbart.com/asia/2020/04/17/africans-in-china-you-cant-go-out-on-the-street-if-you-are-black/ …",,,,1251573694255767552,https://twitter.com/pittman_george/status/1251573694255767552
2020-04-18 18:08:58,Hickyparma,,11,3,49,"I find it ironic that it was China who (allegedly) gave us the Covid 19 virus and yet we are relying on them for PPE equipment. Why cannot we just make the stuff in the Uk? #musings",,,#musings,1251573448985456640,https://twitter.com/Hickyparma/status/1251573448985456640
2020-04-18 18:08:16,FluTrackers,,0,31,58,"Taiwan accuses W.H.O. of deleting recent references to ""Taiwan"" on its web site in a political move to support mainland China in its pandemic actions. https://flutrackers.com/forum/forum/-2019-ncov-new-coronavirus/-2019-ncov-taiwan/851100-who-official-website-taiwan-was-disappeared-taiwan-public-health-experts-questioned-political-manipulation … #coronavirus",,,#coronavirus,1251573275152482304,https://twitter.com/FluTrackers/status/1251573275152482304
2020-04-18 18:08:13,shambhav15,Iyervval,12,101,385,"""Modi has been on a crusade to end the coronavirus in India. Why is coronavirus being ethnically cleansed by Hindutva ideology? Just because coronavirus is from China? This man is a genocidal fascist and he must be stopped."" - Arundhati Roy https://twitter.com/Iyervval/status/1251429592729964546 …",,,,1251573264016703488,https://twitter.com/shambhav15/status/1251573264016703488
2020-04-18 18:08:00,TrueNorthCentre,,72,412,502,"In a year when China repeatedly threatened and insulted Canada, the Trudeau government gave the Chinese communist regime millions in aid money. #cdnpolihttps://tnc.news/2020/04/17/canada-gave-china-41-million-in-aid-in-2019/ …",,,#cdnpolihttps,1251573206709911554,https://twitter.com/TrueNorthCentre/status/1251573206709911554
2020-04-18 18:07:56,Original_Gio,,1,19,65,"How Jordan Brand paid China to spread Coronavirus so Bron wouldn't get #4 Thread: pic.twitter.com/5ntwWZZlUT",,,#4,1251573192176447488,https://twitter.com/Original_Gio/status/1251573192176447488
2020-04-18 18:07:33,JohnFMauldin,ianbremmer,17,30,90,"First, they cover up the virus data. Then blame foreigners and blacks and stir up racism. Then they take away freedom. China is not a responsible member of a civilized world. https://twitter.com/ianbremmer/status/1251551678123380737 …",,,,1251573094336118791,https://twitter.com/JohnFMauldin/status/1251573094336118791
2020-04-18 18:07:13,SortedEagle,,1,22,22,"Senior Advocate Sidharth Luthra Hails FDI Policy Change, Calls It 'Imperative'. Senior Advocate Harish Salve On FDI Policy Change: 'China To Be Under Watchful Eye Of The World'. The step taken well in time by the government should be lauded. pic.twitter.com/VMhkmc5Zn7",,,,1251573010651176960,https://twitter.com/SortedEagle/status/1251573010651176960
2020-04-18 18:07:08,PlaysTrumpCard,realDonaldTrump,4,43,73,"The Democrats & the evil fake news hoaxed America with collusion, then the border, then Kavanaugh, and we thought they peaked with the Ukraine hoax, but they're doing precisely what POTUS said they'd do, and are HOAXING the USA over the WuWHO virus that came from China!",,,,1251572990141181952,https://twitter.com/PlaysTrumpCard/status/1251572990141181952
2020-04-18 18:05:48,Starrnyota2,NYCMayor,5,17,11,"It is clear now. Communism in America has arrived. Now way out of social distancing violations especially if you come accross a raging liberal lunatic with a phone or China drones yelling at you from the sky. @NYCMayor pushes fear as new normal!https://twitter.com/NYCMayor/status/1251496378372632577 …",,@NYCMayor,,1251572653824962561,https://twitter.com/Starrnyota2/status/1251572653824962561
2020-04-18 18:05:38,VeeryaSorry,,9,22,65,"An diehard Indian 'Republic' deshbhakt... Uses a chinese phone.. Uses chinese lights on Diwali.. Wears a made in china chaddi.. Visits China made #StatueOfUnity and then Cheers for an FDI amendment...and feels proud enough to trend #IndiaCheckmatesChina",,,#StatueOfUnity #IndiaCheckmatesChina,1251572610623668224,https://twitter.com/VeeryaSorry/status/1251572610623668224
2020-04-18 18:04:49,adamhousley,,36,142,855,"I haven't said much about Anthony Fauci....but headlines today are saying he doesn't 'feel confident at all' about China's coronavirus data. Really? Has he been watching sports all this time? Oh wait....we don't have any.",,,,1251572406629498880,https://twitter.com/adamhousley/status/1251572406629498880
2020-04-18 18:04:01,johnnjenga,,14,56,119,"On Evacuation Kenya's government is still wondering how to spell e.v.a.c.u.a.t.i.o.n yet some of the approximately 3000 Kenyans in China are desperately waiting for Kenya's help. Germany's government evacuated 200,000 German citizens in 20 days from all over the world. 200,000! pic.twitter.com/8XzWsUvWRt",,,,1251572203268853760,https://twitter.com/johnnjenga/status/1251572203268853760
2020-04-18 18:03:45,truthandfiction,,5,34,79,"This is your daily reminder that #ChinaLiedAndPeopleDied The number of reported #COVID deaths in Belgium (5,453) is now higher than reported deaths in China (4,632). Belgium has a population of 11.5 million. China has a population of 1.4 BILLION. pic.twitter.com/rOshsXOJ9r",,,#ChinaLiedAndPeopleDied #COVID,1251572138777214976,https://twitter.com/truthandfiction/status/1251572138777214976
2020-04-18 18:03:24,Snack8671,,54,113,137,"If you think you are having a bad day, watch this! Wonder if the shelving is made in China? —-Add me if you haven’t! #Trump2020pic.twitter.com/UXwzsZfH6o",,,#Trump2020pic,1251572051204280322,https://twitter.com/Snack8671/status/1251572051204280322
2020-04-18 18:03:13,status_culture,,11,29,74,"100% of high blood pressure medication comes from China. This should worry every living Black person. That medication in the hands of those racist. Yikes.",,,,1251572003888418818,https://twitter.com/status_culture/status/1251572003888418818
2020-04-18 18:02:36,evdefender,,3,28,81,"Meet American chemist Charles Lieber, who was arrested for illegal dealings with China and has connections to @elonmuskhttps://www.economist.com/science-and-technology/2020/02/01/an-american-chemist-is-suspected-of-illegal-dealings-with-china …",,@elonmuskhttps,,1251571850498445312,https://twitter.com/evdefender/status/1251571850498445312
2020-04-18 18:02:36,FlyingEagle555,,7,93,101,"We must start manufacturing our own products. China Can Not Be Trusted Ever!Coronavirus pressures US manufacturers to bring plants home from China https://fxn.ws/3bl06f5 #FoxBusiness",,,#FoxBusiness,1251571849672060931,https://twitter.com/FlyingEagle555/status/1251571849672060931
2020-04-18 18:02:14,gen_jackkeane,,20,22,70,"ICYMI: @LouDobbs @FoxBusiness US investigating China's possible cover-up of where coronavirus came from | https://video.foxbusiness.com/v/6150402369001/ …",,@LouDobbs @FoxBusiness,,1251571757561139200,https://twitter.com/gen_jackkeane/status/1251571757561139200
2020-04-18 18:00:34,MailOnline,,18,39,47,"China reports 27 new confirmed cases of COVID-19 https://trib.al/Kde7oPO",,,,1251571338214608896,https://twitter.com/MailOnline/status/1251571338214608896
2020-04-18 18:00:25,TheBabylonBee,,98,1698,5719,"China Impressed By Michigan Governor's Totalitarian Policies https://buff.ly/3bigFZf",,,,1251571298326712320,https://twitter.com/TheBabylonBee/status/1251571298326712320
2020-04-18 18:00:14,michaeljohns,,38,547,653,"Is there even one #publichealth expert in the world, outside of the China-influenced @WHO, who seriously believes China has had only 4,632 COVID19 deaths, as they are reporting currently? It is almost an insult to logic. The lack of #CCP transparency is concerning--and telling.",,@WHO,#publichealth #CCP,1251571252453691399,https://twitter.com/michaeljohns/status/1251571252453691399
2020-04-18 18:00:00,WattersWorld,,75,303,1342,"President @realDonaldTrump announced that the U.S. will halt all funding for the W.H.O. after its role in severely mismanaging and covering up the spread of Coronavirus. @TGowdySC joins the show detailing how we can hold China and the W.H.O. accountable, tonight. #FoxNews 8PM ET.pic.twitter.com/Im29WbVVNM",,@realDonaldTrump @TGowdySC,#FoxNews,1251571193729220617,https://twitter.com/WattersWorld/status/1251571193729220617
2020-04-18 17:59:15,frankgaffney,,6,77,107,"Highlights of @BryanDeanWright's interview with @TuckerCarlson: “We’ve all lived in a country for the past 30 yrs that has been sold out to the Chinese government. We were promised in the late 1990s that China goes into the WTO and we would all benefit. That didn’t take place.",,@BryanDeanWright @TuckerCarlson,,1251571003760746498,https://twitter.com/frankgaffney/status/1251571003760746498
2020-04-18 17:58:46,ForbesTech,,9,40,43,"China just admitted coronavirus death toll in Wuhan was 50% higher than reported http://on.forbes.com/6014128Aa By @bissienesspic.twitter.com/XkCvqXfSQX",,@bissienesspic,,1251570886181822469,https://twitter.com/ForbesTech/status/1251570886181822469
2020-04-18 17:58:32,marlo451,marklevinshow,5,262,275,"Amen! President Trump is not only having to take on the problems here in the U.S. but he has had to clean up after China and assist the rest of the world in this pandemic! #COVID19 #Trump2020https://twitter.com/marklevinshow/status/1251491567430443011 …",,,#COVID19 #Trump2020https,1251570826161389568,https://twitter.com/marlo451/status/1251570826161389568
2020-04-18 17:57:38,News24,,68,57,154,"Coronavirus: ANC calls on Communist Party of China to act swiftly on alleged ill-treatment of African nationals | @ntwaagae http://ow.ly/eSQm50zhYTq pic.twitter.com/AtvxwX21fL",,@ntwaagae,,1251570598632927232,https://twitter.com/News24/status/1251570598632927232
2020-04-18 17:57:24,GordonGChang,ianbremmer,67,309,640,"Science--the January 24 article in the Lancet--and anecdotal evidence suggest the #coronavirus escaped from the #Wuhan lab. And if there is no ""hard evidence"" yet, it is only because #China has been suppressing research papers and barring foreign scientists from investigating. https://twitter.com/ianbremmer/status/1250818078792916994 …",,,#coronavirus #Wuhan #China,1251570539606552577,https://twitter.com/GordonGChang/status/1251570539606552577
2020-04-18 17:57:01,OttenbergEve,MoonofA,6,40,71,"Even if China underestimated fatalities, so what? China gave the US plenty of time to prepare. Trump failed to do so. End of story. https://twitter.com/MoonofA/status/1251567283367018497 …",,,,1251570444987228160,https://twitter.com/OttenbergEve/status/1251570444987228160
2020-04-18 17:56:57,AndertonMol,StarPlayrX,13,16,382,"China is lying. But here in the US we don't even have the capacity to know our true situation.",,,,1251570428197421062,https://twitter.com/AndertonMol/status/1251570428197421062
2020-04-18 17:56:13,charlie_adler,realDonaldTrump,5,23,69,"&Americans will be trying to figure out how to eat,pay bills &survive as you hold your daily propaganda rallies to feed your insatiable ego. You wasted precious time to protect your deal w China & have endangered the American people. #TrumpLiesAmericansDie #DerelictionOfDutyhttps://twitter.com/realDonaldTrump/status/1251552150024589312 …",,,#TrumpLiesAmericansDie #DerelictionOfDutyhttps,1251570244168019969,https://twitter.com/charlie_adler/status/1251570244168019969
2020-04-18 17:55:15,jmartNYT,,243,941,2674,"NEW: With Trump’s numbers dropping and vulnerable Republican senators badly outraised in Q1, the GOP is moving toward a Blame China strategy. The complication? Trump himself is torn on China w @maggieNYT >https://www.nytimes.com/2020/04/18/us/politics/trump-china-virus.html …",,@maggieNYT,,1251569999887695873,https://twitter.com/jmartNYT/status/1251569999887695873
2020-04-18 17:54:52,JoyaMia00,,20,217,179,"MSM idiots say Trump wasted 70 days not preparing for CV19 How the F’k did they come up with this? 1/14/20 WHO: No human to human transmission 2 wks later Trump bans China travel anyway 2/29/20 Fauci: Safe to go everywhere 2 wks later Trump bans Europe travel anyway WTF?? pic.twitter.com/1POSErZLsP",,,,1251569902609215489,https://twitter.com/JoyaMia00/status/1251569902609215489
2020-04-18 17:54:51,SenDanSullivan,,10,59,156,"The China Communist Party, however, doesn’t have a tradition of doing this, not just on public health, but on so many other issues. They are not transparent. Why is this? [4/5] #CCP #coronavirus",,,#CCP #coronavirus,1251569900398809090,https://twitter.com/SenDanSullivan/status/1251569900398809090
2020-04-18 17:54:35,MLInstitute,,5,51,75,"NEW: The Chinese government’s rule by fear endangers Chinese citizens—and the world. Watch MLI's latest video explaining the joint open letter signed by well over 100 China experts, academics, and politicians. @brianleecrowley #cdnpoli #COVID19 #cdnfphttps://www.youtube.com/watch?v=gLXZvMvhFkM …",,@brianleecrowley,#cdnpoli #COVID19 #cdnfphttps,1251569832912437250,https://twitter.com/MLInstitute/status/1251569832912437250
2020-04-18 17:53:26,SenDanSullivan,,6,99,196,"Without revealing sources or methods, I’ll say I agree with this @washingtonpost writer that all of us, but in particular our media, should be very skeptical of the data coming out of #China and remind readers of its questionable accuracy. [2/5] #CCPhttps://www.washingtonpost.com/opinions/2020/04/07/why-do-we-keep-treating-china-source-reliable-information/ …",,@washingtonpost,#China #CCPhttps,1251569542230401026,https://twitter.com/SenDanSullivan/status/1251569542230401026
2020-04-18 17:53:19,c_aashish,,51,400,1228,"Following Rahul ji's path, I also demand that China investment restrictions should be credited by Modiji to my tweet, which was 8 hours before his. pic.twitter.com/MDZgTMvjRq",,,,1251569512916250625,https://twitter.com/c_aashish/status/1251569512916250625
2020-04-18 17:52:48,BoSnerdley,,7,31,111,"Lawmakers introduce bill that would let Americans sue China over 'Wuhan Virus' https://nypost.com/2020/04/17/lawmakers-introduce-bill-allowing-americans-to-sue-china-over-coronavirus/?utm_source=twitter_sitebuttons&utm_medium=site%20buttons&utm_campaign=site%20buttons … via @nypost",,@nypost,,1251569381475303429,https://twitter.com/BoSnerdley/status/1251569381475303429
2020-04-18 17:51:23,yinwoman_,,8,75,91,"The Mask Wedgie by China pic.twitter.com/mOH0PZ4K3Q",,,,1251569025773039617,https://twitter.com/yinwoman_/status/1251569025773039617
