date,username,to,replies,retweets,favorites,text,geo,mentions,hashtags,id,permalink
2020-02-22 01:47:29,Caligirz4trump,,2,40,25,"Communist China is now w/holding basic needs (gas/electricity/food) from its citizens unless they agree 2 hourly temp monitoring! People dragged out of their homes by police & body bags full of the dead! Welcome 2 socialism #kag @BernieSandershttps://youtu.be/UfOLsDKchDU",,@BernieSandershttps,#kag,1231032732030889984,https://twitter.com/Caligirz4trump/status/1231032732030889984
2020-02-22 01:44:19,MrHammMath,,10,17,93,"Thread - things that have changed in China due to the Corona Virus. A lot of people have been asking about what it's like over here in Shanghai. Here's a list of the things I have noticed that have changed since the outbreak.",,,,1231031936291749888,https://twitter.com/MrHammMath/status/1231031936291749888
2020-02-22 01:43:56,michaelmina_lab,HarvardChanSPH,9,28,127,"It would be great if China would report all of the cases they have data on - even if not fitting the official case count definition. What would be equally/more as useful is if they’d report how many negative tests they are obtaining so we could have a rate to work with. https://twitter.com/HarvardChanSPH/status/1230827024001982465 …",,,,1231031839038607360,https://twitter.com/michaelmina_lab/status/1231031839038607360
2020-02-22 01:43:54,Aleah415147915,,1,75,57,"Take care ELF... And someone had mentioned, wear mask when you go to see members on musical, drama shooting, airport etc, or better avoid crowded places time being. ""South Korea becomes most infected country outside China for coronavirus as cases spike"" https://twitter.com/i/events/1230705711497134081 …",,,,1231031832239583232,https://twitter.com/Aleah415147915/status/1231031832239583232
2020-02-22 01:40:46,DrEricDing,megtirrell,9,37,110,"This is bad. We also need to start allow clinicians to request tests for their patients who have pneumonia and just returned from China (non-Hubei), but are currently denied. I know a MN pediatrician/family who has been clamoring to get pneumonia tested but to no avail.",,,,1231031043576287233,https://twitter.com/DrEricDing/status/1231031043576287233
2020-02-22 01:37:43,alfonslopeztena,,1,50,46,"Stay home, don't get sick, get back to work! — China faces a conundrum: bring people back to work, and risk a second spike in infections; or keep them at home, and watch businesses crash. https://www.latimes.com/world-nation/story/2020-02-21/china-coronavirus-china-factories-economy …",,,,1231030274139578368,https://twitter.com/alfonslopeztena/status/1231030274139578368
2020-02-22 01:37:15,BNODesk,,50,339,592,"Friday's coronavirus summary (00-00 GMT): -China: 397 new cases, 109 dead -South Korea: 96 cases, 1 dead -Italy: 16 cases, 1 dead -Japan: 14c -Iran: 13c, 2d -California: 2c -UAE: 2c -Taiwan: 2c -Australia: 2c (cruise) -Canada: 1c -Singapore: 1c -Lebanon: 1c -Israel: 1c (cruise)",,,,1231030155755376641,https://twitter.com/BNODesk/status/1231030155755376641
2020-02-22 01:36:55,syramadad,,6,31,66,"We need to broaden the clinical case definition for screening and testing of travelers outside of China. “The coronavirus is picking up steam outside China, narrowing chances of eliminating it” https://www.statnews.com/2020/02/21/coronavirus-picking-up-steam-outside-china/ …",,,,1231030071151951873,https://twitter.com/syramadad/status/1231030071151951873
2020-02-22 01:35:52,natoreyes,gmanews,5,125,274,"Allowing 100% foreign ownership in ""public services"" solidifies our status as a neo-colony. Oh how easy it will be for China or the US to install a puppet president in 2022 when they control everything including telecommunications and broadcasting. Automated polls pa more? https://twitter.com/gmanews/status/1230681043755245574 …",,,,1231029808802353152,https://twitter.com/natoreyes/status/1231029808802353152
2020-02-22 01:34:17,SalihHudayar,,16,58,105,"I just attended a “leftist event” on US- #China relations & they claim to be “against imperialism & pro #Muslim” yet they defended the #CCP’s colonization & #genocide of #Uyghur & other Turkic Muslims in #EastTurkistan as necessary to counter “US imperialism.” Complete hypocrisy!pic.twitter.com/2bll5EeURJ",,,#China #Muslim #CCP #genocide #Uyghur #EastTurkistan,1231029411920646144,https://twitter.com/SalihHudayar/status/1231029411920646144
2020-02-22 01:30:41,AbdulkarimYumen,,30,95,120,"Hundreds of Chinese blocked the bank's headquarters in order to get their money back. This is the first bank in #China that has problems caused by #coronavirus. The beginning of a financial disasterpic.twitter.com/s1FIFDqjfl",,,#China #coronavirus,1231028502452981761,https://twitter.com/AbdulkarimYumen/status/1231028502452981761
2020-02-22 01:30:34,Read_N_Learn,,1,17,38,"By pushing global investors to buy Chinese bonds, Mike Bloomberg may as well be Xi's personal banker. Considering the fact China is America's top geopolitical foe, this alone is disqualifying of him ever being President. He'll keep selling out Americans to make profits in China",,,,1231028476884418561,https://twitter.com/Read_N_Learn/status/1231028476884418561
2020-02-22 01:30:00,ChinaDaily,,10,15,96,"What's in there? Chinese people staying at home during the novel #coronavirus outbreak have come up with some neat tricks to take awesome #selfies by looking inside a washing machine, a potato chip bag or a fridge. #COVID19 #China pic.twitter.com/VDYuhrOT78",,,#coronavirus #selfies #COVID19 #China,1231028332117946368,https://twitter.com/ChinaDaily/status/1231028332117946368
2020-02-22 01:27:49,erleellis,,4,29,58,"Finally. China set to clamp down permanently on wildlife trade in wake of coronavirus #ConservationOptimism https://www.nature.com/articles/d41586-020-00499-2 …pic.twitter.com/CYJhagFI7i",,,#ConservationOptimism,1231027781737340928,https://twitter.com/erleellis/status/1231027781737340928
2020-02-22 01:27:23,Read_N_Learn,,4,29,51,"Who's side is Mike Bloomberg on? By putting Chinese bonds into his bond indices in 2019, $100 billion of inflows into China are expected. Xi can use this money to incarcerate Muslims, expand his military, and subsidize companies to steal American jobs. https://www.bloomberg.com/news/articles/2019-04-01/index-inclusion-seen-making-china-s-debt-market-no-2-globally …",,,,1231027672987377665,https://twitter.com/Read_N_Learn/status/1231027672987377665
2020-02-22 01:22:37,BadmintonTalk,,30,153,502,"BREAKING: China has confirmed their participation in March's European tournaments CBA: ""We would like to explain that members of the Chinese Badminton Team are healthy and that no one is infected or suspected of being infected."" https://bwfworldtour.bwfbadminton.com/news-single/2020/02/22/chinese-team-to-participate-in-european-events/ …",,,,1231026476327161857,https://twitter.com/BadmintonTalk/status/1231026476327161857
2020-02-22 01:20:38,BNODesk,,33,493,686,"Coronavirus update: - 77,812 cases worldwide - 10,846 being tested - 2,360 fatalities - 11,529 in serious/critical condition - 20,867 recovered - Most cases in China - Growing number in South Korea - 29 countries reporting cases",,,,1231025974118174720,https://twitter.com/BNODesk/status/1231025974118174720
2020-02-22 01:20:08,AFP,,4,54,60,"#BREAKING Drop in new China virus cases as toll reaches 2,345: govt, South Korea reports 142 more cases pic.twitter.com/7GdfZbad6A",,,#BREAKING,1231025850394349568,https://twitter.com/AFP/status/1231025850394349568
2020-02-22 01:16:05,marcorubio,,1190,3339,9691,"No reason to believe the #coronavirus is “contained” in #China. The numbers they are releasing are fake. Their primary goal isn’t addressing the virus,it’s their global image. We have no idea what the true numbers are but they are without a doubt higher than what they admit to.",,,#coronavirus #China,1231024830742507520,https://twitter.com/marcorubio/status/1231024830742507520
2020-02-22 01:15:47,DiMartinoBooth,,25,34,138,"(Bloomberg) --South Korea reported 142 more confirmed cases of coronavirus & death of second patient, as jump in number of infections outside China raises alarm among global health officials who say window of opportunity to prevent outbreak from turning into a pandemic closing.”",,,,1231024755286958080,https://twitter.com/DiMartinoBooth/status/1231024755286958080
2020-02-22 01:15:35,HelenBranswell,,0,13,24,"4. #COVID19: The explanation for the latest readjustment of China's numbers is found here. Thanks again, @ronankelly13. http://www.hubei.gov.cn/zhuanti/2020/gzxxgzbd/zxtb/202002/t20200221_2144623.shtml …",,@ronankelly13,#COVID19,1231024702661054464,https://twitter.com/HelenBranswell/status/1231024702661054464
2020-02-22 01:11:36,CP24,,18,11,56,"China reports major drop in new virus cases to 397 http://cp24.to/E0rr6SP pic.twitter.com/hxRVNTQcho",,,,1231023701266747392,https://twitter.com/CP24/status/1231023701266747392
2020-02-22 01:09:55,worldonalert,,7,40,113,"#BREAKING South Korea confirms 346 people in the country infected with coronavirus. Forget about China and their faked ""official"" numbers of cases. This virus is spreading incredible fast.",,,#BREAKING,1231023279672037376,https://twitter.com/worldonalert/status/1231023279672037376
2020-02-22 01:08:03,PDChina,,32,357,477,"#LATEST on #COVID19 outbreak in China, as of Feb 21: - 76,288 confirmed cases in Chinese mainland - 2,345 deaths - 20,659 discharged from hospital pic.twitter.com/MzqZgU6Rp9",,,#LATEST #COVID19,1231022809708560384,https://twitter.com/PDChina/status/1231022809708560384
2020-02-22 01:07:05,AmbLiuXiaoMing,,11,32,119,"Just received letter from Archibishop of Canterbury Justin Welby. He expresses sympathy and support for China, says the government and people of China have been much in his prayers and offers his ongoing support to China to fight #COVID19. Most appreciative of his kind gesture！pic.twitter.com/qwYwTSCTWl",,,#COVID19,1231022566199963650,https://twitter.com/AmbLiuXiaoMing/status/1231022566199963650
2020-02-22 01:05:30,XHNews,,3,28,38,"China confirms 397 new cases of novel coronavirus infection and 109 deaths on Friday http://xhne.ws/XrvnT pic.twitter.com/CmxJT9n3uQ",,,,1231022165794811904,https://twitter.com/XHNews/status/1231022165794811904
2020-02-22 01:03:52,lookner,,43,135,316,"Number of new virus cases in last half-day in South Korea: 142 Number of new virus cases in last full day in all of China outside Hubei province: 31",,,,1231021756254740480,https://twitter.com/lookner/status/1231021756254740480
2020-02-22 01:02:19,HongKongFP,,2,77,83,"Coronavirus: Uighur activist draws attention to Xinjiang plight amid China outbreak https://www.hongkongfp.com/2020/02/22/coronavirus-uighur-activist-draws-attention-xinjiang-plight-amid-china-outbreak … @JewherIlham #China #CoronavirusOutbreak #coronavirus #COVID19 #COVID #Xinjiang #Uighur",,@JewherIlham,#China #CoronavirusOutbreak #coronavirus #COVID19 #COVID #Xinjiang #Uighur,1231021365748215808,https://twitter.com/HongKongFP/status/1231021365748215808
2020-02-22 01:01:06,MailOnline,,6,58,42,"More than 100 wild animals drop dead near coronavirus epicentre in China after workers 'sprayed too much disinfectant' #CoronavirusOutbreakhttps://trib.al/wRjw0cn",,,#CoronavirusOutbreakhttps,1231021060356792320,https://twitter.com/MailOnline/status/1231021060356792320
2020-02-22 01:00:00,Reuters,,1,33,28,"No sub-Saharan African country has evacuated their citizens from China’s Hubei province at the center of the coronavirus outbreak and thousands stranded are running short of supplies and morale https://reut.rs/2T5p1eB via @josianekouagheu @ebiryabarema @laurenxanthonypic.twitter.com/MEVSAQnVQQ",,@josianekouagheu @ebiryabarema @laurenxanthonypic,,1231020783545139203,https://twitter.com/Reuters/status/1231020783545139203
2020-02-22 00:59:36,Trinhnomics,Trinhnomics,10,18,87,"Equities aren’t divorced from earnings after all. If China powers the world (its demand & manu) then by that logic it being partially shutdown by 1 month (Sunday is 23 Feb & Wuhan shutdown 23 Jan) is going to show up in balance sheets. What about March? April? 1/12 or 1/6 or 1/4? https://twitter.com/Trinhnomics/status/1230334910591692800 …",,,,1231020683053789184,https://twitter.com/Trinhnomics/status/1231020683053789184
2020-02-22 00:56:44,garyrextanner,,8,48,77,"Communists no longer rule Russia & communism is considered a failed political adventure by the Russian people. So Bernie Sanders couldn't move to Russia to experience it. Now he COULD move to China, or better yet...to North Korea! Venezuela?",,,,1231019960719167488,https://twitter.com/garyrextanner/status/1231019960719167488
2020-02-22 00:55:22,NatashaFatah,,26,96,135,"There is a 6th case of coronavirus confirmed in BC (the 9th in Canada) and health officials are surprised to learn that the woman had only visited Iran, not China #covid19 @MegsBatchelor reports https://www.cbc.ca/news/canada/british-columbia/coronavirus-bc-update-1.5470757 …pic.twitter.com/oM9cjqKVdd",,@MegsBatchelor,#covid19,1231019618048860160,https://twitter.com/NatashaFatah/status/1231019618048860160
2020-02-22 00:55:06,washingtonpost,,6,67,88,"China again changes coronavirus reporting criteria as Italy confirms first death from the virus https://wapo.st/3bZIoP9",,,,1231019549987831808,https://twitter.com/washingtonpost/status/1231019549987831808
2020-02-22 00:53:54,gerryshih,,15,77,96,"China’s massive effort to combat the coronavirus has resulted in hospitals turning away other patients in dire need of care across the country, a kind of triage on a national scale and a monumental logistical and ethical challenge. New story: https://www.washingtonpost.com/world/asia_pacific/in-chinas-war-on-coronavirus-hospitals-turn-away-other-patients--with-dire-results/2020/02/21/93e42c74-5307-11ea-80ce-37a8d4266c09_story.html?hpid=hp_hp-top-table-main_chinamedical-130p%3Ahomepage%2Fstory-ans&itid=hp_hp-top-table-main_chinamedical-130p%3Ahomepage%2Fstory-ans …",,,,1231019247280590848,https://twitter.com/gerryshih/status/1231019247280590848
2020-02-22 00:52:07,washingtonpost,,44,882,925,"Opinion: ""I was expelled from China for my reporting, too. It’s part of a larger strategy."" https://wapo.st/37PL7Y1",,,,1231018799278759936,https://twitter.com/washingtonpost/status/1231018799278759936
2020-02-22 00:51:33,HelenBranswell,,16,71,105,"1. #COVID19: China's Feb. 21 numbers are out. 397 new cases, 109 new deaths. The official totals are now 76,288 confirmed & 2345 deaths. There are also 5365 suspect cases, and I don't know if that means results pending, never tested but probably Covid-19 or a mix of the 2. pic.twitter.com/t4PQUvREZ7",,,#COVID19,1231018658052354048,https://twitter.com/HelenBranswell/status/1231018658052354048
2020-02-22 00:49:43,V2019N,,26,64,107,"#US Trump -concerned outbreak in US could hurt his reelection -unwilling to criticize China’s response to outbreak -worried drastic action could spook markets & hurt economy WH concerns: unable to quarantine large numbers of people in US in #pandemichttps://www.washingtonpost.com/politics/trump-was-not-told-coronavirus-infected-americans-would-be-flown-home-from-cruise-ship/2020/02/21/ae58b24c-54be-11ea-b119-4faabac6674f_story.html …",,,#US #pandemichttps,1231018195231756288,https://twitter.com/V2019N/status/1231018195231756288
2020-02-22 00:48:51,lookner,globaltimesnews,29,181,340,"The 30,000 hospital beds China is adding in Wuhan in the next four days is 75 times the total number of official new cases yesterday in all of China https://twitter.com/globaltimesnews/status/1230859730341507072 …",,,,1231017977178476546,https://twitter.com/lookner/status/1231017977178476546
2020-02-22 00:43:20,spectatorindex,,28,399,808,"BREAKING: Coronavirus deaths in China rise to 2,345",,,,1231016589404725248,https://twitter.com/spectatorindex/status/1231016589404725248
2020-02-22 00:39:16,lookner,,21,43,85,"China new cases update: we're back to the low numbers 314 new cases in Wuhan 52 new cases in all of Hubei outside Wuhan 31 new cases in all of China outside Hubei 109 new fatalities http://www.nhc.gov.cn/yjb/s7860/202002/543cc508978a48d2b9322bdc83daa6fd.shtml …",,,,1231015566527340545,https://twitter.com/lookner/status/1231015566527340545
2020-02-22 00:33:32,ChrisBHaynes,,252,996,7568,"Yahoo Sources: Free agent guard Lance Stephenson seeking return to NBA following season in China where he averaged 26.7 points, 7.4 rebounds and shot 52 percent from field. He’s willing to work out to prove his value.",,,,1231014122289942528,https://twitter.com/ChrisBHaynes/status/1231014122289942528
2020-02-22 00:31:50,davereaboi,RealSaavedra,3,15,55,"Yes—and for several reasons. Chiefly it’s because DC has been funded to the hilt with Russia hawks, while the same donors don’t want to jeopardize the money they’re making in China. https://twitter.com/RealSaavedra/status/1231013034216181761 …",,,,1231013695309930497,https://twitter.com/davereaboi/status/1231013695309930497
2020-02-22 00:29:13,RealSaavedra,davereaboi,34,221,713,"The most frustrating part about all the ""Russia"" stuff is that it completely overshadows the far greater threat to the U.S.: China",,,,1231013034216181761,https://twitter.com/RealSaavedra/status/1231013034216181761
2020-02-22 00:26:25,SqrunkTrep,Pomegrantetears,2,1,293,"I wonder if they kept the scene in china or other countries where anything LGBTQ related is seen as taboo or even illegal",,,,1231012333117419520,https://twitter.com/SqrunkTrep/status/1231012333117419520
2020-02-22 00:24:25,winningatmylife,Mike2020,10,38,150,"Shifting to Russia bc he's friends w the dictator in China eh? pic.twitter.com/OnkztSQANd",,,,1231011828924182528,https://twitter.com/winningatmylife/status/1231011828924182528
2020-02-22 00:23:00,Fxhedgers,,9,10,31,"[RTRS] 21 Feb - CHINA http://C.BANK VICE GOVERNOR SAYS CORONAVIRUS' IMPACT ON CHINA'S ECONOMY IS SHORT-TERM, LIMITED - STATE TV lol",,,,1231011469686263808,https://twitter.com/Fxhedgers/status/1231011469686263808
2020-02-22 00:22:45,vajrayudha11,TimesNow,2,13,60,"When they come to see a girl, even a girl of poor family deck herself her in jewelry and silk saree. Even if that’s the only silk saree that she has! Her mom borrows costly China set for tea from the neighbor. That’s smartness!. Such high virtuous stands aren’t for the poor! https://twitter.com/TimesNow/status/1230884864196395009 …",,,,1231011407698763777,https://twitter.com/vajrayudha11/status/1231011407698763777
2020-02-22 00:22:39,MackayIM,MackayIM,4,14,46,"At some point China has to get back to work and we have to return to trading with them. As does the US. This epidemic has highlighted (again) how dependent we are. Virus will continue on because it is so widspread and no1 has immunity AFAWK. Then it will be exported again. 2/2",,,,1231011382318919681,https://twitter.com/MackayIM/status/1231011382318919681
2020-02-22 00:20:54,MayFourth1919,,4,30,133,"I am going to write slowly about how peasants were treated during ROC era(which was right before CCP took over the power) in China.",,,,1231010940738588680,https://twitter.com/MayFourth1919/status/1231010940738588680
2020-02-22 00:20:48,TeddyVallee,,7,63,170,"China SMI. These guys designed the PMI before it was sold to Markit. They found that sales managers are higher up the chain than purchasing managers, so you get an even earlier read. pic.twitter.com/m8G147rjbK",,,,1231010916986126337,https://twitter.com/TeddyVallee/status/1231010916986126337
2020-02-22 00:20:04,FlagsMashupBot,,5,18,104,"Special edition Bolivia (1825-1826) + Reformed Government of the Republic of China = Reformed Government of the Republic of Bolivia: pic.twitter.com/DPRD1jqR7Z",,,,1231010731040149505,https://twitter.com/FlagsMashupBot/status/1231010731040149505
2020-02-22 00:19:51,nikki_miumiu,,4,59,52,"@appledaily_hk got a confidential document which written by Office of the #HongKong Chief Executive, revealed China control the masks supplies in the city, it also revealed #CarrieLam’s political wrestling with pro #CCP camp. Vid @appledaily_hk Close captioned by @RealHKNews https://twitter.com/RealHKNews/status/1230973555015344129 …pic.twitter.com/m5VFr5jGld",,@appledaily_hk @appledaily_hk @RealHKNews,#HongKong #CarrieLam #CCP,1231010678128820225,https://twitter.com/nikki_miumiu/status/1231010678128820225
2020-02-22 00:16:20,CatNamus,cjtruth,3,22,65,"Plot twist, can you imagine if the #Coronavirus was one of the black market sales that #Hillary sold on her unsecured server? Can you imagine if that’s 1 of the missing 33,000 emails? Selling lab made bioweapons to #China.... It’s in the realm of possibility in this insane https://twitter.com/cjtruth/status/1230982172816875520 …",,,#Coronavirus #Hillary #China,1231009792266788864,https://twitter.com/CatNamus/status/1231009792266788864
2020-02-22 00:16:07,bwfmedia,,2,56,198,"BREAKING: China #badminton team confirmed for upcoming HSBC BWF World Tour tournaments in Europe. Players are in United Kingdom training. MORE: https://bit.ly/38PM2Jk #WorldTour #Coronavirus #COVID19pic.twitter.com/J9NT6GBVVh",,,#badminton #WorldTour #Coronavirus #COVID19pic,1231009739460362241,https://twitter.com/bwfmedia/status/1231009739460362241
2020-02-22 00:10:38,spacetwinks,,8,95,393,"can't wait for the next turn of xenophobia and for america to return to blaming china for everything in our country they don't like. just a dial that switches from russia to arabic countries to china and back to russia again",,,,1231008359534546944,https://twitter.com/spacetwinks/status/1231008359534546944
2020-02-22 00:09:30,RainbowSquidInk,getFANDOM,10,18,124,"But in China? https://twitter.com/getFANDOM/status/1230905686004912129 …",,,,1231008075106131969,https://twitter.com/RainbowSquidInk/status/1231008075106131969
2020-02-22 00:09:08,MerlotN,,23,76,76,"The way that China stops and arrests a #coronavirus suspect on the road.pic.twitter.com/IlQUHkH1FQ",,,#coronavirus,1231007981631725568,https://twitter.com/MerlotN/status/1231007981631725568
2020-02-22 00:05:01,EpochTimesChina,,7,120,129,"A new study estimates that ⅔ of #Coronavirus cases exported from mainland #China remains undetected worldwide. This potentially leaves sources of human-to-human transmission around the world unchecked, the study concluded. https://www.theepochtimes.com/two-thirds-of-virus-carriers-from-china-were-not-detected-by-countries-new-study-estimates_3246396.html …",,,#Coronavirus #China,1231006944967745536,https://twitter.com/EpochTimesChina/status/1231006944967745536
2020-02-22 00:03:03,XHNews,,2,23,54,"Life of a Wudang Disciple: Wudang Mountain located in Shiyan city, C China's Hubei Province, attracts many foreign Kungfu students. But how have their lives changed since the novel #Coronavirus outbreak began? Let's find out...pic.twitter.com/hynRvxuIFF",,,#Coronavirus,1231006450828230656,https://twitter.com/XHNews/status/1231006450828230656
2020-02-22 00:02:34,XHNews,,6,65,145,"""I deeply appreciate the act of generosity of the Bill & Melinda Gates Foundation and your letter of solidarity to the Chinese people at such an important moment,"" Xi Jinping replies to Bill Gates, who has pledged support in China's #COVID19 fight http://xhne.ws/6cHff pic.twitter.com/9ViT01DSX0",,,#COVID19,1231006327406657538,https://twitter.com/XHNews/status/1231006327406657538
2020-02-22 00:00:34,AJEnglish,,1,36,56,"China coronavirus outbreak: All the latest updates https://www.aljazeera.com/news/2020/02/china-coronavirus-outbreak-latest-updates-200221211643953.html?taid=5e506f226831d00001c4cca5&utm_campaign=trueAnthem%3A+Trending+Content&utm_medium=trueAnthem&utm_source=twitter …",,,,1231005824769720320,https://twitter.com/AJEnglish/status/1231005824769720320
2020-02-22 00:00:00,ajplus,,8,98,79,"Over 70 coronavirus evacuees in Ukraine were greeted with burned tires and objects being thrown at the buses carrying them. They were headed to a two-week quarantine after arriving from China. pic.twitter.com/WHYc9YfWKB",,,,1231005683098607616,https://twitter.com/ajplus/status/1231005683098607616
2020-02-21 23:53:07,ImtiazMadmood,,23,55,244,"Pakistan's continued support for terrorism helps Pakistan army and BJP. It also helps China to keep them under it's thumb. Who are the loses? Pakistan's masses who keep becoming poorer every year to sustain it's expensive army in power.",,,,1231003949735534601,https://twitter.com/ImtiazMadmood/status/1231003949735534601
2020-02-21 23:51:02,TheEconomist,,3,20,33,"Even if the virus outbreak proves to be no more than a blip, the 2020s are unlikely to treat Apple well in China https://econ.st/2PbQkCV",,,,1231003424877142021,https://twitter.com/TheEconomist/status/1231003424877142021
2020-02-21 23:50:15,AkiPeritz,JasonSCampbell,186,215,747,"How does that work in China, ODNI Director? https://twitter.com/JasonSCampbell/status/1231002904703664129 …",,,,1231003228105515014,https://twitter.com/AkiPeritz/status/1231003228105515014
2020-02-21 23:46:59,LukeGromen,adamscrabble,5,18,39,"I'm still mad at Russia for getting China into the WTO, & for saying Iraq had WMD, & for keeping us in Afghanistan for all these years, & for repealing Glass Steagall, & for blowing the housing bubble, & for...",,,,1231002406307213312,https://twitter.com/LukeGromen/status/1231002406307213312
2020-02-21 23:45:11,RodneyClaeys,,6,18,22,"Of course Trump lied about his Agriculture trade deal with China U.S. Dept of Ag official said China may end up buying just $14B in farm products through September, so the total amount of sales for the year was to be short of the $40B Trump had promised https://www.washingtonpost.com/business/2020/02/21/all-caps-tweet-president-trump-vows-new-farm-bailouts-china-purchases-appear-weaker-than-promised/ …",,,,1231001953481654273,https://twitter.com/RodneyClaeys/status/1231001953481654273
