date,username,to,replies,retweets,favorites,text,geo,mentions,hashtags,id,permalink
2020-03-28 21:39:25,ArianeAndrew,,17,47,288,"Corona has my debut match postponed!This queen bad bitch was ready for her reutn against another baddie @thejamiesenegal! Next week April 4th, in honor of the match I will be doing a youtube video recapping my reactions of old matches & yes I will be in full gear! Girl Hello! pic.twitter.com/7rMmYiuhMM",,@thejamiesenegal,,1244016267331121152,https://twitter.com/ArianeAndrew/status/1244016267331121152
2020-03-28 21:39:22,iam7even5ive,,0,12,30,"We used to boil water on the stove to take baths I promise you if this corona shit get bad We gon survive idk bout u other niggas",,,,1244016254362554368,https://twitter.com/iam7even5ive/status/1244016254362554368
2020-03-28 21:39:19,LBF777,,1,15,34,"Because it’s all a fake show. 5G causes the flu like symptoms. The vaccine for the Corona Virus contains the #CoronaVirus.pic.twitter.com/YvWtVjf7yh",,,#CoronaVirus,1244016242635288576,https://twitter.com/LBF777/status/1244016242635288576
2020-03-28 21:39:03,Beinomugisha_Iv,,6,14,121,"Have been there sleeping and I started dreaming about the 7 new Corona cases, now the local man can't sleep in peace",,,,1244016174519779328,https://twitter.com/Beinomugisha_Iv/status/1244016174519779328
2020-03-28 21:36:22,SnarkySparkly,,6,19,60,"in the time of corona sometimes you just need to throw on your best diamonds, your favorite cologne, and some pajamas to go to the grocery store.",,,,1244015498695761920,https://twitter.com/SnarkySparkly/status/1244015498695761920
2020-03-28 21:35:41,Deleinko,,0,10,29,"In your name. Corona has a cure.",,,,1244015325940789248,https://twitter.com/Deleinko/status/1244015325940789248
2020-03-28 21:35:14,tbereketeab,,18,3,71,"Just saw contagion (2011) In the movie 1 Virus arises from a bat in china 2 Contagious by touch 3 Self isolation and washing hand is taken as protective measure 4 Exactly same symptoms with corona 5 The character leading the fight happens to be black I mean ... pic.twitter.com/XxFGjEHqJN",,,,1244015215353778177,https://twitter.com/tbereketeab/status/1244015215353778177
2020-03-28 21:34:34,elizascanllen,gagamonster96,2,150,588,"THIS IS FOR CORONA YOU BIG FAT WHITE NASTY SMELLING FAT BITCH WHY YOU RUINED GAGA’S POP ERA WITH YOUR TRIFFLIN DIRTY WHITE RACIST ASS YOU BIG FAT BITCH OOMPA LOOMPA BODY ASS BITCH https://twitter.com/gagamonster96/status/1244010131911835650 …",,,,1244015046423805956,https://twitter.com/elizascanllen/status/1244015046423805956
2020-03-28 21:34:27,Cloud1Bk,,9,42,74,"If scientist are serious about finding a cure for Corona virus they should be studying Keith Richards immune system. pic.twitter.com/Ie8JcCF1Lo",,,,1244015017537572865,https://twitter.com/Cloud1Bk/status/1244015017537572865
2020-03-28 21:33:36,ELEGBETE1,,14,17,44,"Truth is most of the equipment that we are buying for this Corona within such a short time, we already had this money since, why have we refused to dedicate consistent investment on our health care sector for our national good?",,,,1244014802265092097,https://twitter.com/ELEGBETE1/status/1244014802265092097
2020-03-28 21:33:24,aamirbh95005851,,0,11,25,"Take care and co-operate. Together we will defeat corona. @BBhuttoZardari @psfmansoor pic.twitter.com/ameYI7uIkypic.twitter.com/kaBbJwUWvF",,@BBhuttoZardari @psfmansoor,,1244014754655584257,https://twitter.com/aamirbh95005851/status/1244014754655584257
2020-03-28 21:33:03,AdamRamsay,,2,24,53,"Don’t let Boris Johnson blame you for his Corona failures! https://www.opendemocracy.net/en/opendemocracyuk/stop-blaming-ordinary-people-for-the-uks-pandemic-failures/ …",,,,1244014663316242433,https://twitter.com/AdamRamsay/status/1244014663316242433
2020-03-28 21:32:32,GovNiger,,13,47,89,"CORONA VIRUS: GOVERNOR SANI BELLO TESTS NEGATIVE...REMAINS IN SELF-ISOLATION TO STAY SAFE. Niger State Governor, Alhaji Abubakar Sani Bello has tested negative for the dreaded Corona Virus disease, otherwise known as #COVIDー19pic.twitter.com/QXUV8eKtPg",,,#COVIDー19pic,1244014534827872257,https://twitter.com/GovNiger/status/1244014534827872257
2020-03-28 21:32:30,BarstoolMiamiU,,2,84,931,"Imagine: it’s a Saturday in March 2019. You go to beat and buy pitchers with your friends. Then you walk down high street and get Charra for dinner. After some margs and a quesadilla you go home. You’re asleep by 8 PM. The only corona you know about is with a lime. Life is good.",,,,1244014526955245569,https://twitter.com/BarstoolMiamiU/status/1244014526955245569
2020-03-28 21:31:33,wdzfilm,,11,66,656,"caleb finn caught corona i fucking hate it here why couldnt it be someone problematic",,,,1244014289633116160,https://twitter.com/wdzfilm/status/1244014289633116160
2020-03-28 21:29:31,Cosmictruth369,risetoflyy,15,148,267,"People are posting videos all over YouTube of hospitals that are completely EMPTY. NO TESTING. Not one of them are overrun by ANYBODY except the ""CORONA GHOST"" that doesn't exist but is somehow still terrorizing the world",,,,1244013775193280513,https://twitter.com/Cosmictruth369/status/1244013775193280513
2020-03-28 21:29:00,Donalin199,,129,70,403,"XXXtentacion was my favorite rapper. When he passed away my friend laughed at his passing, today his mother died from the Corona Virus. God works in mysterious ways",,,,1244013647757705218,https://twitter.com/Donalin199/status/1244013647757705218
2020-03-28 21:28:24,Curryy__,,0,5,25,"God I promise after this corona passes I’ll never be ungrateful again , Amen.",,,,1244013493034070016,https://twitter.com/Curryy__/status/1244013493034070016
2020-03-28 21:27:31,fascinatorfun,MaryKelliPalka,6,13,22,"I think this is Florida again. Florida that has seen a marked uptick in the last week and has an an aging demographic. Is “Corona Brain” going to become a new insult? https://twitter.com/MaryKelliPalka/status/1244005908901920768 …",,,,1244013273923584001,https://twitter.com/fascinatorfun/status/1244013273923584001
2020-03-28 21:26:51,ucancallmekim,,2,11,64,"If one more person reveals another plan that Gaga had for us that isn’t gonna happen anymore bc of corona I’ll actually pass out and not wake up pic.twitter.com/xDxKIyKStH",,,,1244013103748198400,https://twitter.com/ucancallmekim/status/1244013103748198400
2020-03-28 21:26:06,SmajoBeso,TeamAlbanians,0,3,35,"Amazing gesture and solidarity from Albania. A developing country that might face a its own Corona crisis in the near future, sends more than 30 doctors to Italy. https://twitter.com/TeamAlbanians/status/1243941793227575297 …",,,,1244012916292100101,https://twitter.com/SmajoBeso/status/1244012916292100101
2020-03-28 21:25:31,WilliamdeVry1,rebeccastaab1,2,3,40,"Official photographer and official corona crusted mail opener. You're welcome. https://twitter.com/rebeccastaab1/status/1244010145010438144 …",,,,1244012770472812544,https://twitter.com/WilliamdeVry1/status/1244012770472812544
2020-03-28 21:25:19,rhea_98_,,10,2,204,"Biggest ‘mind blown’ (insert sound effect here) moment of the week is finding out @Chris_Stark has a child! Massive respect for keeping your private life as private as possible until now (dammit corona)",,@Chris_Stark,,1244012717901479937,https://twitter.com/rhea_98_/status/1244012717901479937
2020-03-28 21:24:22,MFaarees_,,25,34,186,"We've survived EBOLA We've survived Lassa fever We've survived HIV AIDS We've survived Malaria We'll survive this CORONA VIRUS Insha Allah.",,,,1244012479535099904,https://twitter.com/MFaarees_/status/1244012479535099904
2020-03-28 21:23:02,nausexusmxnster,,2,21,60,"Gaga was gonna perform at the iHeartRadio music awards, do a Coachella set, release an album and probably a music video in 2 weeks and now she can't. she said let's give the gays everything they want and corona said hi i'm FUMING pic.twitter.com/tR2AFQQCST",,,,1244012143957159936,https://twitter.com/nausexusmxnster/status/1244012143957159936
2020-03-28 21:22:50,Dadymakoda3,,1,6,32,"When a particular person contacted corona virus especially a politician some people Tend to forget he is a human like them ,keep party opposition aside and pray together pls.",,,,1244012094292480000,https://twitter.com/Dadymakoda3/status/1244012094292480000
2020-03-28 21:22:47,FAMEFAPPS,,0,5,22,"if corona wasn’t happening we’d be getting gaga award show performance tomorrow and coachella surprise performance in 2 weeks and probably so many other appearances... WHY WHY WHY pic.twitter.com/YTPHKHMcs9",,,,1244012083236257792,https://twitter.com/FAMEFAPPS/status/1244012083236257792
2020-03-28 21:22:26,tishatoomuch_,,1,100,85,"I’m so sick of this Corona shit",,,,1244011991355854849,https://twitter.com/tishatoomuch_/status/1244011991355854849
2020-03-28 21:22:15,DSC_UNN,,1,23,35,"Due to the limitations in place due to the Corona virus, DSC UNN is having its very first online interactive session on how to land remote jobs and the tools required for it. Tune in using the zoom app for mobile or desktop! http://bit.ly/dsc-unn-webinar-2020 … #SocialDistancing #StaySafepic.twitter.com/b844WqnLVD",,,#SocialDistancing #StaySafepic,1244011945428234242,https://twitter.com/DSC_UNN/status/1244011945428234242
2020-03-28 21:21:46,alluregaga,,8,36,282,"gaga had so much plan for chromatica era... surprise coachella set, iheard radio awards performance, apple performance and MORE... miss corona really ruined it pic.twitter.com/cKfKU1gumv",,,,1244011827572264967,https://twitter.com/alluregaga/status/1244011827572264967
2020-03-28 21:21:24,disosameer,,1,9,28,"This is the time we keep politics and personal interests aside and face our common enemy Corona. If we do not unite and protect ourselves then our ego and stupidity will perish us. My prayers are with all those affected, May Allah heal you all",,,,1244011733661990912,https://twitter.com/disosameer/status/1244011733661990912
2020-03-28 21:21:23,DonnyDiggins,,1,9,21,"This was sent to me by a friend earlier. This Iranian Revolutionary Guard Commander says: 'We are ready to help America in combatting corona. Americans are suffering because of the spread of corona among them. The infrastructure is powerless to help the American people.' pic.twitter.com/FazzX35Qwz",,,,1244011729769635841,https://twitter.com/DonnyDiggins/status/1244011729769635841
2020-03-28 21:20:48,Nupenchi_,,16,73,180,"Flash:Corona virus update. Gov @abusbello tests negative. Still to maintain self isolation.pic.twitter.com/GcDH0gQpcK",,@abusbello,,1244011584122429440,https://twitter.com/Nupenchi_/status/1244011584122429440
2020-03-28 21:20:37,MegaTJP,,7,12,116,"Whenever I used to talk about Animal Crossing, ppl used to have no clue what I was talking about..now everyone is comparing fruits. Starting to believe corona was just a master plan from Nintendo to get the entire planet to buy Animal Crossing on release day...genius plan.",,,,1244011535183183892,https://twitter.com/MegaTJP/status/1244011535183183892
2020-03-28 21:19:37,DoyinSoExtra,Vall_erie,3,9,11,"It looks like the corona virus we are all tryna beat https://twitter.com/Vall_erie/status/1243983605371744259 …",,,,1244011285253062656,https://twitter.com/DoyinSoExtra/status/1244011285253062656
2020-03-28 21:18:56,yashar,,13,8,203,"Corona, you sneaky motherfucker pic.twitter.com/txJBQXSV6j",,,,1244011111629737994,https://twitter.com/yashar/status/1244011111629737994
2020-03-28 21:18:04,GregoryRogers7,,1,14,27,"Trump is making a serious play with sending the Comfort to NY. Placing non Corona infected people in it to free up hospitals for virus infected. Cuomo will need to fill those empty rooms with the infected. He can’t. Once again, Trumps chess play is epic.",,,,1244010893974921216,https://twitter.com/GregoryRogers7/status/1244010893974921216
2020-03-28 21:17:57,Brixton1115,PrisonPlanet,8,13,131,"So since they will spy on ppl's phones for Corona virus, there should be absolutely no excuses for violent crime or terrorists being allowed to kill us in the future right?",,,,1244010866439307265,https://twitter.com/Brixton1115/status/1244010866439307265
2020-03-28 21:17:52,GagaMagazineUK,,3,6,44,"Corona fucked up chromatica. There was so many things planned. A secret Coachella set, a iHeartTadio performance, big collabs and ITS ALL BEEN RUINED.",,,,1244010843324456962,https://twitter.com/GagaMagazineUK/status/1244010843324456962
2020-03-28 21:17:32,Yakoob_jb,,1,8,18,"Since this corona virus entered Nigeria I have stopped seeing ‘I’m sick please pray for me’ on statuses",,,,1244010760541548546,https://twitter.com/Yakoob_jb/status/1244010760541548546
2020-03-28 21:17:31,katherineOma,,10,5,29,"FDA grants approval for a 15 minute Corona virus test. All well and good but how long before the people who do the testing get it? Is this just another way to slow the process down?",,,,1244010757273968641,https://twitter.com/katherineOma/status/1244010757273968641
2020-03-28 21:17:29,AmmadYousaf,,18,90,314,"Aga khan hosp stops all sort of corona tests, screening and admissions pic.twitter.com/ecG3uoVYZf",,,,1244010749636337664,https://twitter.com/AmmadYousaf/status/1244010749636337664
2020-03-28 21:16:13,JemeleWilliams,,6,9,19,"Trump just said ""ready reserves"" ""those are two big words"" and then repeated it ""ready reserves"". I Googled it and wow! One business came up, on CORONA Dr! The address on the window (64) is different than the address in the search. Post 64 ""Accelerated Counteractions"" pic.twitter.com/0qeql63U95",,,,1244010429258571777,https://twitter.com/JemeleWilliams/status/1244010429258571777
2020-03-28 21:15:54,PRlSMATlCPERRYS,,0,9,30,"the way we would’ve had the rain on me single announcement, a performance at iheartawards, and a Coachella performance all this and next month but a virus ruined it all WHEN I CATCH YOU MISS CORONA pic.twitter.com/JJeSBKF3d5",,,,1244010347457130496,https://twitter.com/PRlSMATlCPERRYS/status/1244010347457130496
2020-03-28 21:14:13,wheresmywigg,,1,4,29,"Corona charting when Chromatica era supposed to start, cancelling all of gagas surprise performances I HATCHU CORONA I HATCHU SO MUCH GIRL! pic.twitter.com/C3dnClqW3p",,,,1244009927594717184,https://twitter.com/wheresmywigg/status/1244009927594717184
2020-03-28 21:13:58,tauhenare,,18,2,43,"Can tell us where and how to bury our dead (non corona deaths) but can’t give us a test. #WHO says test test and retest. Germany testing 500,000 a week. Korea tested millions. We don’t even test all returning NZdrs.",,,#WHO,1244009862511472641,https://twitter.com/tauhenare/status/1244009862511472641
2020-03-28 21:13:13,BrittanyCurran,,27,28,326,"The new Corona Challenge is watching the Gal Gadot Imagine video all the way through.",,,,1244009674568904704,https://twitter.com/BrittanyCurran/status/1244009674568904704
2020-03-28 21:12:32,chiefpressngs,,3,14,19,"CORONA VIRUS: GOVERNOR SANI BELLO TESTS NEGATIVE **** REMAINS IN SELF-ISOLATION TO STAY SAFE. Niger State Governor, Alhaji Abubakar Sani Bello has tested negative for the dreaded Corona Virus disease, otherwise known as COVID-19. #StayAtHomeAndStaySafe #CoronaUpdate #CoronaLockpic.twitter.com/s1XPxhPS8P",,,#StayAtHomeAndStaySafe #CoronaUpdate #CoronaLockpic,1244009500455194624,https://twitter.com/chiefpressngs/status/1244009500455194624
2020-03-28 21:11:46,apriIies,,2,13,43,"corona virus saved cod",,,,1244009309505273859,https://twitter.com/apriIies/status/1244009309505273859
2020-03-28 21:11:44,Conservative_VW,,9,88,171,"Today’s Conundrum Why are some cities threatening jail if you leave your house ... .. and at the same time releasing prisoners from jail .. both due to Corona Virus",,,,1244009301204537346,https://twitter.com/Conservative_VW/status/1244009301204537346
2020-03-28 21:10:39,monjozx,,1,5,25,"My teachers husband tested positive for the corona virus and he’s on ventilator y’all pls pray",,,,1244009027606118400,https://twitter.com/monjozx/status/1244009027606118400
2020-03-28 21:10:05,LoveJaas,dearra,6,10,254,"nope corona took my job so i’m broke",,,,1244008886786539520,https://twitter.com/LoveJaas/status/1244008886786539520
2020-03-28 21:10:05,SpiritualJudas,,1,7,61,"I HATCHU CORONA pic.twitter.com/wqVQbbK6hr",,,,1244008886622978048,https://twitter.com/SpiritualJudas/status/1244008886622978048
2020-03-28 21:09:54,HumairIqbal1,,0,47,48,"Nation can defeat this menace with our resilience, courage & collective efforts in enforcing preventive measures; most important of which are maintaining personal hygiene & social distancing” writes the father of a recovered patient of corona virus to CM Sindh. @BBhuttoZardaripic.twitter.com/3GgP08Iw8l",,@BBhuttoZardaripic,,1244008840007385088,https://twitter.com/HumairIqbal1/status/1244008840007385088
2020-03-28 21:08:39,chrisreinacher,,5,11,122,"You guys have a secret bracket in your head of which of your friends will get corona first?",,,,1244008525560287237,https://twitter.com/chrisreinacher/status/1244008525560287237
2020-03-28 21:08:14,mrchromatica,Amen_ARTPOP,0,3,45,"I HATE YOU FAT CORONA I FUCKING HATE YOU GIRL https://twitter.com/Amen_ARTPOP/status/1244007233735753728 …",,,,1244008418496532480,https://twitter.com/mrchromatica/status/1244008418496532480
2020-03-28 21:08:08,lucasguttenberg,VMRConstancio,13,67,140,"Huge if true. Baltics joining the 9 would mean half of the original Hansa countries now in the Corona bond camp. and as well. Remaining holdouts are (predictably) . And . No idea why. https://twitter.com/VMRConstancio/status/1243989537157722113 …",,,,1244008396497526784,https://twitter.com/lucasguttenberg/status/1244008396497526784
2020-03-28 21:08:01,CobyMccool,,0,4,24,"Corona got every girl rocking crayon hair",,,,1244008365006651392,https://twitter.com/CobyMccool/status/1244008365006651392
2020-03-28 21:07:49,MuaazaC,,0,4,36,"Going on to house party and seeing your friends already in a room is the equivalent to (before corona) going on to Snapchat and seeing that your friends went out without you",,,,1244008313886564354,https://twitter.com/MuaazaC/status/1244008313886564354
2020-03-28 21:07:43,UndercoverNet,,1,20,19,"""Policing the Corona State"" is a joint collaboration between @Netpol and @UndercoverNet to chronicle the daily impact of policing and emergency powers during the current lockdown. Here's today's diary entry https://policing-the-corona-state.blog/2020/03/28/28-march-update/ … #PolicingTheCoronaStatepic.twitter.com/hB4DZcIzkg",,@Netpol @UndercoverNet,#PolicingTheCoronaStatepic,1244008289848963073,https://twitter.com/UndercoverNet/status/1244008289848963073
2020-03-28 21:07:26,H4nit_,qaayedd,3,7,20,"Niggas like this are the reasons why corona exists https://twitter.com/qaayedd/status/1243981561059573761 …",,,,1244008220487794689,https://twitter.com/H4nit_/status/1244008220487794689
2020-03-28 21:07:05,muky_zanna,,0,8,17,"For the umpteenth time, Corona Virus is not a death sentence but a disease like any other that can be overcome. Lets adhere to the protocols set by the @NCDCgov and remain steadfast in prayers. We will come out stronger in sha Allah.",,@NCDCgov,,1244008129962139650,https://twitter.com/muky_zanna/status/1244008129962139650
2020-03-28 21:06:43,sabirshahhoti84,,0,9,13,"SHOCKING Faisal Edhi says they received 6 to 7 dead bodies of #Corona suspects only in Punjab and due fear of spread of #coronavirus they are shutting down their centres in across the country.pic.twitter.com/gJ1aDIULso",,,#Corona #coronavirus,1244008036341071875,https://twitter.com/sabirshahhoti84/status/1244008036341071875
2020-03-28 21:06:32,SwiftHitter,,8,2,62,"Thats it for me at GP. Take it away corona",,,,1244007992082739201,https://twitter.com/SwiftHitter/status/1244007992082739201
2020-03-28 21:05:15,andi_tulip,,1,9,26,"Anytime time Corona is brought up in your awareness, practice Ho’oponopono “I am sorry, please forgive me, thank you, I love you” this will transmute the energy and literally heal these thought patterns and energies in our collective",,,,1244007667926007808,https://twitter.com/andi_tulip/status/1244007667926007808
2020-03-28 21:04:53,FaruqBashar,,1,5,37,"To be very honest im nt feeling like im in any sort of quarantine cas on a normal day I’m always indoors, d only time I go out is to get food which i still do now so.....even better cas all the roads ae free nd peaceful now I actually lik it like this but corona should go sha",,,,1244007577559666688,https://twitter.com/FaruqBashar/status/1244007577559666688
2020-03-28 21:04:42,NicoliniDavide,,1,7,42,"Next time you hear the trope ""Corona showed that we can move everything online"" tell them to check the evidence. A decade ago Hinds and Crompton made a strong case for the necessity to combine in person and virtual teamwork. https://pubsonline.informs.org/doi/abs/10.1287/orsc.2013.0869 …",,,,1244007528536604674,https://twitter.com/NicoliniDavide/status/1244007528536604674
2020-03-28 21:04:29,london_used,,5,6,70,"Dear Corona,this one you’ve gotten to el rufai,I take God name beg you,no carry yourself go Kano abeg.. just stop for this Abuja abeg.",,,,1244007477194166272,https://twitter.com/london_used/status/1244007477194166272
2020-03-28 21:04:08,InnrEngineering,,13,184,246,"From Self-Isolation to Self-exploration. We invite you to introduce a measure of calming reassurance into your lives by doing this simple guided meditation offered by Sadhguru. https://isha.us/dailypractice #coronavirus #StayHome #StayAtHome #beatthevirus #goinside #corona pic.twitter.com/v3qZikZ3Oo",,,#coronavirus #StayHome #StayAtHome #beatthevirus #goinside #corona,1244007389931675649,https://twitter.com/InnrEngineering/status/1244007389931675649
2020-03-28 21:03:47,TyHarris_52,,27,21,430,"Indiana not giving me a break .... no gym because corona so people say go outside. Except we are on thunderstorm watch when it’s 70 degrees outside then the next day it’s going to be 40 degrees with chance of snow and clear skies",,,,1244007300622422017,https://twitter.com/TyHarris_52/status/1244007300622422017
2020-03-28 21:03:33,raniaovo,,4,6,36,"coming back home because of this corona nonsense, has made me realise when i’m back at uni i’m not visiting for a while.",,,,1244007242749403137,https://twitter.com/raniaovo/status/1244007242749403137
2020-03-28 21:03:29,its_menieb,KSIOlajidebt,31,78,4852,"“Look at my wrist corona, my neck got Ebola”",,,,1244007225921847297,https://twitter.com/its_menieb/status/1244007225921847297
2020-03-28 21:03:11,Being_Humor,NorbertElekes,22,118,405,"WHO had no clue that Corona can spread from person to person either https://twitter.com/NorbertElekes/status/1243970600017760256 …",,,,1244007150848008193,https://twitter.com/Being_Humor/status/1244007150848008193
2020-03-28 21:02:58,botkandis,,12,13,105,"*Zuckerberg donates 25$million for Corona research* People on welfare : wow, only 25$mill.",,,,1244007094266859520,https://twitter.com/botkandis/status/1244007094266859520
2020-03-28 21:02:02,sabzsgizo,nypost,1,7,17,"They must focus on corona tbh https://twitter.com/nypost/status/1243617774922076167 …",,,,1244006859440304129,https://twitter.com/sabzsgizo/status/1244006859440304129
2020-03-28 21:01:55,alejidebt,KSIOlajidebt,6,2,810,"‘my wrist got corona, my neck got ebola’ it’s a rolex bar, kinda sick ngl",,,,1244006831707639809,https://twitter.com/alejidebt/status/1244006831707639809
2020-03-28 21:01:33,_Stages,,2,4,27,"Ah! I just open my TL and its full of Corona Virus Abeg is that the new iPhone model",,,,1244006737272864768,https://twitter.com/_Stages/status/1244006737272864768
2020-03-28 21:01:02,GageMcgill,,6,5,95,"HELLO TWITTER WORLD. THE CORONA VIRUS HAS NOT KILLED ME",,,,1244006609799524353,https://twitter.com/GageMcgill/status/1244006609799524353
2020-03-28 20:59:54,kaiisyourhomie,,20,20,589,"Circle, post status to “Caleb gave me the corona... pray for me #StayHealthy #GodsPlan” ... send",,,#StayHealthy #GodsPlan,1244006322854486030,https://twitter.com/kaiisyourhomie/status/1244006322854486030
2020-03-28 20:59:09,FavourphilicVic,,1,23,47,"Alpha pharmacy doing it the right way. They are out there working for you Please stay home for them. Muse: Pharm Stephen Oyeniran credit: unknown Location : Alpha Pharmacy Lagos #Pharmacist #Pharmacist_against_Corona #StayAtHomeAndStaySafe #HealthCareWorkerspic.twitter.com/TiaMPwkTmc",,,#Pharmacist #Pharmacist_against_Corona #StayAtHomeAndStaySafe #HealthCareWorkerspic,1244006134178078720,https://twitter.com/FavourphilicVic/status/1244006134178078720
2020-03-28 20:59:07,JadaBlackBeauty,,60,243,611,"Meanwhile in the City of New Orleans there’s a second line going on during the corona outbreak pic.twitter.com/IUePLCwPK0",,,,1244006125202214912,https://twitter.com/JadaBlackBeauty/status/1244006125202214912
2020-03-28 20:57:12,Maryerm_a_y,Asserdiq,21,31,211,"Corona virus will finish before Ramadan https://twitter.com/Asserdiq/status/1213177111466463236 …",,,,1244005644644073472,https://twitter.com/Maryerm_a_y/status/1244005644644073472
2020-03-28 20:57:08,ThePerilousGirl,,7,22,21,"Corona Virus Updates India : 1024 confirmed 915 active 85 recovered 24 death",,,,1244005624502984704,https://twitter.com/ThePerilousGirl/status/1244005624502984704
2020-03-28 20:56:11,India_Resists,,2,46,108,"Dear chomu middle class of India, No thali, ghanti, taali for the hapless workers struggling to save their lives from corona, hunger, poverty and police? Ab aao balcony pe..?",,,,1244005389173174274,https://twitter.com/India_Resists/status/1244005389173174274
2020-03-28 20:56:11,JoeInNoHo,toddstarnes,7,21,157,"One of the major symptoms of the Corona Virus is invisibility.",,,,1244005385335263234,https://twitter.com/JoeInNoHo/status/1244005385335263234
2020-03-28 20:56:05,Plinz,,13,127,786,"my daughter has drawn the corona walrus pic.twitter.com/N7cbZoFtgQ",,,,1244005361046016001,https://twitter.com/Plinz/status/1244005361046016001
