date,username,to,replies,retweets,favorites,text,geo,mentions,hashtags,id,permalink
2020-03-28 18:01:50,SeerviBharath,prithvicena21,3,10,64,"Current status in India: Total corona cases - 1022 Active cases - 913 Recovered - 85 Deaths - 24 https://twitter.com/prithvicena21/status/1243961095900901378 …",,,,1243961510998626304,https://twitter.com/SeerviBharath/status/1243961510998626304
2020-03-28 18:01:38,KKNTeachLearn,,94,196,1827,"The way your school leaders have dealt with corona virus and home working should have made you realise one of the following: You’re at the right school or You’re at the wrong school #lookforanewjob",,,#lookforanewjob,1243961458829950976,https://twitter.com/KKNTeachLearn/status/1243961458829950976
2020-03-28 18:01:30,sravindking,,10,126,345,"Arvind Spreading Corona Overall pic.twitter.com/267048hNtt",,,,1243961426491949056,https://twitter.com/sravindking/status/1243961426491949056
2020-03-28 18:01:22,kamaalrkhan,,35,44,544,"15000 people and 21 doctors died in Italy till now. Now you can imagine what’s going to happen in India within April month only. So just reach to ur family as soon as possible. #CoronavirusOutbreak #CoronaLockdown #Corona",,,#CoronavirusOutbreak #CoronaLockdown #Corona,1243961391997956098,https://twitter.com/kamaalrkhan/status/1243961391997956098
2020-03-28 18:01:10,iineeks,,2,78,118,"CAN THIS CORONA GO AWAY SO I CAN START FILLING OUT JOB APPLICATIONS?!??",,,,1243961341934817280,https://twitter.com/iineeks/status/1243961341934817280
2020-03-28 18:00:33,davelackie,,55,44,362,"Hi @NASheridan Here it is. My corona-cation cake-of-the-day. It's a flamingo chocolate cake with fudge icing, sprinkles and cocktail umbrellas. Yes, it looks like RuPaul baked this cake. haha!! pic.twitter.com/k1KcsglldF",,@NASheridan,,1243961189480235010,https://twitter.com/davelackie/status/1243961189480235010
2020-03-28 18:00:27,pauldashworth,,2,17,12,"TOUGH LESSON: 'If I get corona, I get corona'. The Americans who wish they'd taken #Covid19 seriously. But now the University of Tampa has confirmed that at least five of those students have tested positive. #coronavirushttps://uk.news.yahoo.com/corona-corona-americans-wish-theyd-084520474.html …",,,#Covid19 #coronavirushttps,1243961160820576259,https://twitter.com/pauldashworth/status/1243961160820576259
2020-03-28 18:00:14,RealDreylo,,24,70,526,"I pray this break Corona has given us will not affect or mental state when we resume work and school.",,,,1243961108605677568,https://twitter.com/RealDreylo/status/1243961108605677568
2020-03-28 17:59:20,CubanMofos,,14,5,32,"The US has more Corona Virus cases than Italy. And Italy has more deaths at 10,000 to the US at 1,700. That tells you everything about Italy's socialist free healthcare compared to the US. I guess with free health care its like the old saying. You get what you paid for with Italy",,,,1243960880271941632,https://twitter.com/CubanMofos/status/1243960880271941632
2020-03-28 17:58:27,TheCxdy,,74,37,669,"Yo someone should make a beat and call it “Quarantine” or like “Corona Virus”",,,,1243960657646456832,https://twitter.com/TheCxdy/status/1243960657646456832
2020-03-28 17:58:15,Aman9305Gupta,SaffronS0ul,25,69,819,"Akshay Kumar Donations Pulwama Martyrs - 5Cr Assam Floods - 2Cr Chennai Floods - 1Cr WCS - 50L CRPF Families - 1.08Cr HFT - 1.5Cr Corona Crisis - 25Cr Founder Of Bharat Ke Veer And Many More... The Man With Golden Heart @akshaykumar pic.twitter.com/zWCdDh3CHv",,@akshaykumar,,1243960610246676480,https://twitter.com/Aman9305Gupta/status/1243960610246676480
2020-03-28 17:58:04,ZaeemZia,,6,10,65,"Appearance on @PTVNewsOfficial current issues and strategy to fight Corona. A great team in Islamabad to work with especially @dcislamabad has been a great help for us to operate in #Islamabad. #COVIDPakistan #Islamabadpic.twitter.com/lJyglOw7yP",,@PTVNewsOfficial @dcislamabad,#Islamabad #COVIDPakistan #Islamabadpic,1243960563496960000,https://twitter.com/ZaeemZia/status/1243960563496960000
2020-03-28 17:57:43,HashemGhaili,,1,51,106,"Coronavirus: World’s fastest supercomputer identified 77 potential drugs to treat COVID-19 #science #technology #supercomputer #corona #coronavirus #coronaoutbreak #coronavirusupdate #covid19 #covid_19 pic.twitter.com/GW6eOQNtOe",,,#science #technology #supercomputer #corona #coronavirus #coronaoutbreak #coronavirusupdate #covid19 #covid_19,1243960474061934592,https://twitter.com/HashemGhaili/status/1243960474061934592
2020-03-28 17:57:10,Austen,,2,9,247,"“Mom we’re not going to go to the gym anymore are we?” “No, we’re not.” “Ahhhh I bet I know why. Coronavirus. Corona corona corona. It’s all about corona.” - four year old",,,,1243960337612689409,https://twitter.com/Austen/status/1243960337612689409
2020-03-28 17:57:02,RollsMuchegwa,,21,15,134,"Corona virus can stop reggae.",,,,1243960303634841600,https://twitter.com/RollsMuchegwa/status/1243960303634841600
2020-03-28 17:56:55,papaya_ex,,11,7,231,"Everyone thinks I have corona too who will test me bayi",,,,1243960273209307136,https://twitter.com/papaya_ex/status/1243960273209307136
2020-03-28 17:56:54,robertcobrien,,56,540,1923,"Honored to join ⁦ @realDonaldTrump⁩ and SECDEF to see USNS Comfort off to New York. Her sister ship USNS Mercy is in my home town of Los Angeles. 70,000 tons of hope in the fight against the Corona virus. #GONAVY ⁦ @SECNAV⁩ ⁦ @USNavy⁩ ⁦ @Scavino45⁩pic.twitter.com/svrF7i3bCx",,@realDonaldTrump @SECNAV @USNavy @Scavino45,#GONAVY,1243960269186924546,https://twitter.com/robertcobrien/status/1243960269186924546
2020-03-28 17:56:34,iBrideKaLouis,,3,12,38,"#UltimaLoveNG was a flop. They did nothing as couples, nothing to even determine the possibility of their relationships working outside, their therapy sessions where rubbish. Go on, blame Corona because he can't speak for himself. This show was a flop before the virus jumped up! pic.twitter.com/h6yp2qBb1C",,,#UltimaLoveNG,1243960183354687488,https://twitter.com/iBrideKaLouis/status/1243960183354687488
2020-03-28 17:55:54,imanitartt,,4,12,62,"thankful for everyone working extra hard during the corona pic.twitter.com/yCHQi5a5Rg",,,,1243960017377734656,https://twitter.com/imanitartt/status/1243960017377734656
2020-03-28 17:55:41,TroyAle52891286,,3,55,57,"A MUST SEE VIDEO about The Corona Virus!!! Did President Trump flip a Black Hat Plan into a White Hat plan. You decide. WATCH, comment, and spread far and wide Patriots!!! https://youtu.be/MgCJfzGa-4E",,,,1243959962025390080,https://twitter.com/TroyAle52891286/status/1243959962025390080
2020-03-28 17:55:14,UnofficBatushka,,1,15,60,"Not this time corona! pic.twitter.com/h998IqXCYi",,,,1243959847755776001,https://twitter.com/UnofficBatushka/status/1243959847755776001
2020-03-28 17:55:10,arifaajakia,,23,119,472,"The world is investing all money on health sector while my country, Pakistan, begging all over the world to help fight corona virus, but still millions & billions are spent on this impotent army, capable of doing nothing but killing innocent people. pic.twitter.com/deSLqJzad9",,,,1243959832203399170,https://twitter.com/arifaajakia/status/1243959832203399170
2020-03-28 17:54:49,ChinyereUgokwe,,4,21,72,"Please stay safe out there, please the Corona virus isn’t a joke—it’s REAL. People are dyingwe can all take preventive measures to decrease the mortality rate. Wash your hands—Maintain good social distancing, self Isolate and wear protective safe gloves and mask. Hand sanitize pic.twitter.com/hVPqlWtIfR",,,,1243959746476023808,https://twitter.com/ChinyereUgokwe/status/1243959746476023808
2020-03-28 17:54:46,amolnwagle,,22,131,301,"Chiplun, (Kokan)Art of Living volunteers provided entire week's ration for 50 families to Chiplun's municipal collection centre. These will be further distributed to daily wage workers and those in need of assistance during the Corona Pandemic. pic.twitter.com/T9h5Z4ImKa",,,,1243959734404706304,https://twitter.com/amolnwagle/status/1243959734404706304
2020-03-28 17:54:30,TTFCA,,23,120,577,"The TTFCA wants to extend its thoughts and prayers to all those whom Coach Orlando McDaniel touched, as an athlete, a coach and a friend. He succumbed to Corona virus this morning. RIP, Coach. pic.twitter.com/QTU0z9pHQ7",,,,1243959663328100354,https://twitter.com/TTFCA/status/1243959663328100354
2020-03-28 17:53:40,bbclysedoucet,,8,22,151,"Close-knit ⁦ @BBCNewshour⁩ teams keep us on air in a time of social distancing in #CoronaLockdown . Tonight it’s ⁦ @aliciatrujillo⁩ ⁦ @RozitaRiazati⁩ ⁦ @Al_Riddell⁩ ⁦ @_lauracain⁩ & Henry Tang . ⁦⁦ @bbcworldservice⁩ #corona pic.twitter.com/NDcKoNNU9N",,@BBCNewshour @aliciatrujillo @RozitaRiazati @Al_Riddell @_lauracain @bbcworldservice,#CoronaLockdown #corona,1243959456209211394,https://twitter.com/bbclysedoucet/status/1243959456209211394
2020-03-28 17:53:38,ManzoorZarqa,,7,7,222,"Mai corona se nahi, whatsapp forward's se zaroor marungi.",,,,1243959447707201537,https://twitter.com/ManzoorZarqa/status/1243959447707201537
2020-03-28 17:53:07,aju000,aju000,0,21,37,"Fazaluu Rahman offered his new house to be used as isolation centre for #Corona patients. Does anyone know what @ShefVaidya did, other than SHlTTlNG all over social media with her communal propagandas? #IndiaDeservesBetter #CoronaLockdownhttps://twitter.com/aju000/status/1243826389431635969 …",,@ShefVaidya,#Corona #IndiaDeservesBetter #CoronaLockdownhttps,1243959315343515649,https://twitter.com/aju000/status/1243959315343515649
2020-03-28 17:51:56,S21Nawab_,,0,37,19,"Marketing tips during the corona epidemic |Day4 in lockdown https://youtu.be/4yNsq6Gejg0 via @YouTube @ajaykudva @StaffoAceFerns Cc @e4mtweets @Social_Samosa @agency_reporter @afaqs @Cheil_Worldwide @theFORKMEDIA @weRinteractive @ETBrandEquity @DentsuAegisIN @PRFuzion @GrapesDigital",,@YouTube @ajaykudva @StaffoAceFerns @e4mtweets @Social_Samosa @agency_reporter @afaqs @Cheil_Worldwide @theFORKMEDIA @weRinteractive @ETBrandEquity @DentsuAegisIN @PRFuzion @GrapesDigital,,1243959019003244544,https://twitter.com/S21Nawab_/status/1243959019003244544
2020-03-28 17:51:20,DaviNaShae,,4,24,39,"y’all having kickbacks, game nights, backyard parties... a lil bit of everything and corona IS STILL... y’all not taking this shit serious! I’m scared",,,,1243958866792132610,https://twitter.com/DaviNaShae/status/1243958866792132610
2020-03-28 17:51:01,NarrativeWizard,,3,109,115,"Kejriwal, don't create panic Don't kill people Don't spread corona #ArrestKejriwal",,,#ArrestKejriwal,1243958788794617856,https://twitter.com/NarrativeWizard/status/1243958788794617856
2020-03-28 17:50:57,AbedLaanyy,,7,28,50,"Won't more people die from hunger in Ghana than from corona virus. This is real wickedness. When hand sanitizer sellers increased their prices,we all sparked against them. When the president announced 2 weeks partial lockdown in Accra and Takoradi, go to the various markets",,,,1243958771694686208,https://twitter.com/AbedLaanyy/status/1243958771694686208
2020-03-28 17:50:55,MaryHeglar,,2,7,111,"Watching America drop to its knees in the face of corona virus, I can’t help but hear echoes of how callously people here talked about Ebola circa 2014. It doesn’t bring me any joy, and it didn’t then either.",,,,1243958763352137729,https://twitter.com/MaryHeglar/status/1243958763352137729
2020-03-28 17:50:39,PeterSweden7,,52,161,302,"Sweden They have taken a drastically different approach to corona virus than other countries. They decided to keep everything open. Also, they aren't testing health care workers. How's that working out? - 3 447 infected. - 105 dead. - 3% death rate.",,,,1243958696297795585,https://twitter.com/PeterSweden7/status/1243958696297795585
2020-03-28 17:50:26,seyyedreza,,3,10,25,"Sharing poetry with friends under quarantine in Iran, an escape from the deluge of frightening news in a refuge of beauty. Poetry fills Tehran streets as Iranians adapt Nowruz rituals to Corona restrictions: https://ajammc.com/2020/03/24/poetry-tehran-nowruz-corona/ … Artist: Golrokh Nafisipic.twitter.com/UmW26HAwvN",,,,1243958641583063041,https://twitter.com/seyyedreza/status/1243958641583063041
2020-03-28 17:50:02,vic2pal,,7,59,61,"Big countries with huge healthcare systems are falling apart in front of #Covid_19 virus. How can Palestinians in Gaza confront the #Corona pandemic in the shades of the israeli occupation blockade?! #CoronaUpdatepic.twitter.com/evZQP8rwtj",,,#Covid_19 #Corona #CoronaUpdatepic,1243958540856897536,https://twitter.com/vic2pal/status/1243958540856897536
2020-03-28 17:49:52,abhinavsaha,,53,124,178,"Thousands of migrant workers throng Delhi's Anand Vihar Bus Station to go back home as country witness Curfew to contain Corona COVID 19 pandemic. @IndianExpress @ExpressImages #CoronaUpdate #CoronaLockdown #LockdownWithoutPlanpic.twitter.com/Q9rdOTMoAm",,@IndianExpress @ExpressImages,#CoronaUpdate #CoronaLockdown #LockdownWithoutPlanpic,1243958500729864192,https://twitter.com/abhinavsaha/status/1243958500729864192
2020-03-28 17:49:04,oohhhsayless,,1,6,55,"English: why don’t you do it Bengali: corona",,,,1243958298241568769,https://twitter.com/oohhhsayless/status/1243958298241568769
2020-03-28 17:49:03,iEmN3El,,2,27,39,"The best way to counter the fake forwards and fake news would be to circulate all the right positive news and videos in the whatsapp groups. Send 5 SRK related Corona Awareness videos to your family groups and the previous charity posts to your family groups! Spread them wide. pic.twitter.com/dScPOPNig2",,,,1243958294776930304,https://twitter.com/iEmN3El/status/1243958294776930304
2020-03-28 17:48:20,richiejerry,drekaaa_,1,6,235,"Y’all don’t have corona virus in ur area?",,,,1243958113084100610,https://twitter.com/richiejerry/status/1243958113084100610
2020-03-28 17:48:11,salice_roseee,,20,101,868,"My phone carrier is a bitchoops life happens but pay your bill bitch, fuck you &amp; corona pic.twitter.com/Z1hG7LL0Yf",,,,1243958077184864256,https://twitter.com/salice_roseee/status/1243958077184864256
2020-03-28 17:46:58,motaraaaa,,15,46,231,"Fr this Corona shit be getting serious and life is way too short so if we got beef or fell out. I just wanna say fuvk you from the bottom of my heart",,,,1243957769088249858,https://twitter.com/motaraaaa/status/1243957769088249858
2020-03-28 17:46:41,OTWtoWealth,,1,14,20,"I hope y’all getting autopsy reports from these “family members” “dieing” “from the corona”",,,,1243957696048611328,https://twitter.com/OTWtoWealth/status/1243957696048611328
2020-03-28 17:46:21,attorneybharti,AapActive123,5,73,133,". @msisodia very aptly n humanely made statement by Dy CM Sri Sisodia on the absolutely irresponsible allegations of BJP. This is not time to defeat each other but fight Corona Crisis together. When countries hv forgotten geographical boundaries,BJP hs ashamed India and humanity. https://twitter.com/AapActive123/status/1243954963086061568 …",,@msisodia,,1243957614695702528,https://twitter.com/attorneybharti/status/1243957614695702528
2020-03-28 17:46:14,Tamjidul69,SkySportsNews,0,24,22,"Let's beat Corona together https://twitter.com/SkySportsNews/status/1243948282314973184 …",,,,1243957585146871811,https://twitter.com/Tamjidul69/status/1243957585146871811
2020-03-28 17:45:50,AJA_Cortes,,2,16,118,"Relationships in the time of Corona: You realize that your friends are not people you' want influencing you You see who keeps a cool head, and who becomes anxiety ridden and panic stricken You realize you need a better social circle",,,,1243957484135436288,https://twitter.com/AJA_Cortes/status/1243957484135436288
2020-03-28 17:45:47,ClydeTheMack,,4,37,83,"I’m tired of this corona shit!!! I want some fuckin Jamba Juice",,,,1243957473272164361,https://twitter.com/ClydeTheMack/status/1243957473272164361
2020-03-28 17:45:31,Leydene_,stevedalepets,2,17,186,"He tested postive for Corona virus- the virus that has been around for years. Covid-19 is just a new strain of the Corona Virus and has thus far been proven NO ANIMAL can get it nor spread it. Don’t be the reason people start abandoning their animals.",,,,1243957406301896704,https://twitter.com/Leydene_/status/1243957406301896704
2020-03-28 17:44:37,AjitKDoval_FAN,,4,42,217,"It's been less than a week since @ChouhanShivraj ji took the charge as CM of MP and he is already on ground to fight Corona when most of the politicians are choosing to stay at home with fear of getting infected. MP is in safe hands again. #IndiaFightsCoronapic.twitter.com/vgHXo0azp4",,@ChouhanShivraj,#IndiaFightsCoronapic,1243957179092103169,https://twitter.com/AjitKDoval_FAN/status/1243957179092103169
2020-03-28 17:42:08,GuruDrona6,NarrativeWizard,0,33,26,"Kejriwal is double faced. One side he shows to be with people, on the other side he is trying to spread corona 19 #ArrestKejriwalhttps://twitter.com/NarrativeWizard/status/1243955788399271943 …",,,#ArrestKejriwalhttps,1243956551540305924,https://twitter.com/GuruDrona6/status/1243956551540305924
2020-03-28 17:42:04,Chghulamhusain,,9,52,118,"These dirty elements have spread a rumor that wife of a well-placed Army Person is suffering from corona which is a total lie. [15/15] #CoronaUpdate",,,#CoronaUpdate,1243956534788456449,https://twitter.com/Chghulamhusain/status/1243956534788456449
2020-03-28 17:41:57,Chghulamhusain,,2,64,151,"According to highly placed well informed military sources the Army Chief has ordered the army to carry out all necessary operations as per directions of the prime minister and federal govt. against corona virus. [2/15]",,,,1243956505080201217,https://twitter.com/Chghulamhusain/status/1243956505080201217
2020-03-28 17:41:39,AstonMerrygold,,6,21,141,"Corona ‘staying my ass indoors’ virus #stayhome https://www.instagram.com/p/B-STrZHA6rS/?igshid=10jqmgs5mxk0r …",,,#stayhome,1243956432241864705,https://twitter.com/AstonMerrygold/status/1243956432241864705
2020-03-28 17:41:26,duwapkaine,,4,120,530,"this corona shit got y’all showin y’all real personality’s lmao",,,,1243956378865152002,https://twitter.com/duwapkaine/status/1243956378865152002
2020-03-28 17:41:00,rameshlaus,,0,43,217,"From #Thala #Ajith’s #Valimai to #STR’s #Maanadu – When and Where Last Day before ‘ #Corona’ #ChiyaanVikram #Sivakarthikeyan #Dhanush #Karnan #Doctor #Simbu #Thala #Vikram Read the Slideshow :https://thandoratimes.com/slideshow-id-when-and-where-last-day-before-corona129.htm …",,,#Thala #Ajith #Valimai #STR #Maanadu #Corona #ChiyaanVikram #Sivakarthikeyan #Dhanush #Karnan #Doctor #Simbu #Thala #Vikram,1243956266042417152,https://twitter.com/rameshlaus/status/1243956266042417152
2020-03-28 17:40:53,sktripathi14,,0,38,42,"Urban naxals planning genocide through corona #ArrestKejriwal",,,#ArrestKejriwal,1243956239178088448,https://twitter.com/sktripathi14/status/1243956239178088448
2020-03-28 17:40:15,ABearComedian,,1,5,47,"Mom : I think your father is trying to get the corona virus, anyway I’ll call you later, bye. AND THEN HANGS UP. and how is your Saturday going?",,,,1243956080016855041,https://twitter.com/ABearComedian/status/1243956080016855041
2020-03-28 17:39:55,JohnJLennon1,,2,9,32,"21 prisoners, 10 convicted of murder, we're granted clemency in Cali. Apps were filed pre-corona, but #corona perhaps did nudge Gov Newsom to act. Let's nudge @NYGovCuomo to act on NY clemency apps. Full disclosure: I've never applied.",,@NYGovCuomo,#corona,1243955996923318272,https://twitter.com/JohnJLennon1/status/1243955996923318272
2020-03-28 17:39:55,Lanagirl321,cathyob1,8,9,99,"Just dealing w the procuring of food, then the sanitizing of the incoming food, then my hands and all surfaces and doorknobs. Next comes the laundry of all the towels I placed the food upon. Can I just walk into traffic and scream : Corona come get me already?",,,,1243955993924468736,https://twitter.com/Lanagirl321/status/1243955993924468736
2020-03-28 17:39:37,RitaStyles20,,9,22,288,"My boys and I are buying our second Uber car from our influencing saved money. I can’t wait to testify. Corona end soon",,,,1243955918896848898,https://twitter.com/RitaStyles20/status/1243955918896848898
2020-03-28 17:39:13,ShemWilfred,,9,34,64,"An extraordinary avalanche& extremely outstanding Miracles of JESUS has been demonstrated vividly to this generation. Courtesy of the MIGHTIEST PROPHETS DR DAVID OWUOR who prophesied about Corona Virus epidemic. They came with one message;REPENTANCE in CHRIST JESUS #TheSafeExitpic.twitter.com/8zcmhJAm9a",,,#TheSafeExitpic,1243955820792029184,https://twitter.com/ShemWilfred/status/1243955820792029184
2020-03-28 17:38:56,DrifterShoots,,1,5,46,"Saying Covid-19 instead of “Corona Virus” emulates the same feeling as using “furthermore” in an essay.",,,,1243955747995758595,https://twitter.com/DrifterShoots/status/1243955747995758595
2020-03-28 17:38:49,DaraGeez,,1,22,37,"This corona virus shit is serious man",,,,1243955717272489984,https://twitter.com/DaraGeez/status/1243955717272489984
2020-03-28 17:37:38,ThePlacardGuy,zoo_bear,1,20,137,"Goo bear, when will you fact check the claim that reading Azaan 5 times a day can cure Corona?",,,,1243955418885287936,https://twitter.com/ThePlacardGuy/status/1243955418885287936
2020-03-28 17:37:05,ml_kayla,,2,15,42,"Damn so apparently there’s a person who tested positive in Mercedes for corona",,,,1243955284076376064,https://twitter.com/ml_kayla/status/1243955284076376064
2020-03-28 17:36:34,NarrativeWizard,,5,135,132,"Kejriwal is double faced. One side he shows to be with people, on the other side he is trying to spread corona #ArrestKejriwal",,,#ArrestKejriwal,1243955150344994816,https://twitter.com/NarrativeWizard/status/1243955150344994816
2020-03-28 17:36:32,choga_don,zoo_bear,8,88,291,"Madarsa chaap @zoo_bear , Firstly, This video is of 25th March and not Today's. Secondly, TikTok is loaded with videos of 5 Times Namaz Curing Corona but you got only this video to post. Why no Fact-check of those videos? https://twitter.com/zoo_bear/status/1243934859426291713 …",,@zoo_bear,,1243955143306960903,https://twitter.com/choga_don/status/1243955143306960903
2020-03-28 17:36:02,anushaybkhan,,1,11,25,"In Pakistan: There are more than 70,000 people in and around my village effected by the Corona lockdown that were solely dependent on daily wages to survive, now they can’t afford their bread and butter. We are providing for as many as we can and are taking donations.",,,,1243955018295803904,https://twitter.com/anushaybkhan/status/1243955018295803904
2020-03-28 17:36:00,psfmansoor,,0,32,62,"Take care and co-operate. Together we will defeat corona. @BBhuttoZardaripic.twitter.com/4soQXXAQbH",,@BBhuttoZardaripic,,1243955010087653377,https://twitter.com/psfmansoor/status/1243955010087653377
2020-03-28 17:34:59,DaaruBaazMehta,,9,150,177,"SHARE MAX @msisodia EXPOSES the LIES of BJP and it's IT Cell During such times when the whole nation is fighting corona, BJP is indulging in such shameful propaganda driven politics!! #Kejriwalpic.twitter.com/bal6DepH5o",,@msisodia,#Kejriwalpic,1243954754713247744,https://twitter.com/DaaruBaazMehta/status/1243954754713247744
2020-03-28 17:34:56,RobertJohnDavi,,6,80,244,"The world is being devastated by a corona virus whose origins are not being made absolutely clear -what is ABSOLUTELY CLEAR IS FORMER CHINESE DEFENSE MINISTER GENERAL CHI HAOTIAN’S speech to tChinese communist party read the world MUST BAN P4 level Virology Labs they are deadly",,,,1243954742356672513,https://twitter.com/RobertJohnDavi/status/1243954742356672513
2020-03-28 17:34:28,Ridwanaass,,1,31,78,"yesterday I was watching a news segment on covid-19, this rickshaw driver in Bangladesh was saying “I used to make 20 or 100 taka a day and was able to feed my family. Now, my wife has been laid off from her job and I as well. We won’t die of corona but we will die of poverty”",,,,1243954621875453952,https://twitter.com/Ridwanaass/status/1243954621875453952
2020-03-28 17:34:11,Therealbigglo_,,0,96,95,"Im ready for this corona shit to be over I got shit to do.",,,,1243954551314620417,https://twitter.com/Therealbigglo_/status/1243954551314620417
2020-03-28 17:34:10,SeerviBharath,,13,65,428,"1000+ corona positive cases in India now! Yesterday 151 new cases Today 125+ new cases #StayHomeStaySafe",,,#StayHomeStaySafe,1243954548063887360,https://twitter.com/SeerviBharath/status/1243954548063887360
2020-03-28 17:33:35,given_ngomani,,20,79,229,"Your pastor is waiting for Corona to disappear so they continue healing sick people pic.twitter.com/TjmcKStykw",,,,1243954400084836352,https://twitter.com/given_ngomani/status/1243954400084836352
2020-03-28 17:33:07,lohewaliladki,,10,84,159,"China delivered Corona to world @ArvindKejriwal is delivering Corona to all India",,@ArvindKejriwal,,1243954283348819969,https://twitter.com/lohewaliladki/status/1243954283348819969
2020-03-28 17:33:06,TonyGranato,,9,77,660,"We appreciate what everyone is doing to fight and stop the spread of the corona virus. Stay safe out there. pic.twitter.com/uJcCmNpUkR",,,,1243954278236065793,https://twitter.com/TonyGranato/status/1243954278236065793
2020-03-28 17:32:41,dmkathiranand,,7,65,197,"On the advice of our Leader @mkstalin I have apportioned ₹100,00,000/- (One Crore) to the government hospitals inorder to purchase medical & sanitation supplies. This will strengthen us to fight the deadly Corona virus in my Vellore Parliamentary Constituency. @DMKITwingpic.twitter.com/Bp693HfQnI",,@mkstalin @DMKITwingpic,,1243954174078767104,https://twitter.com/dmkathiranand/status/1243954174078767104
