date,username,to,replies,retweets,favorites,text,geo,mentions,hashtags,id,permalink
2020-03-28 23:58:50,ambermayte,,0,11,50,"i WoUlD wAnT tO TaKe YoU oN a DaTe BuT wE cAn’T bC oF CoRoNa",,,,1244051350842900480,https://twitter.com/ambermayte/status/1244051350842900480
2020-03-28 23:58:26,Inevitable_ET,,22,165,274,"Miami nurse dead from corona http://miami.cbslocal.com/2020/03/28/coronavirus-claims-life-longtime-jackson-memorial-hospital-nurse-araceli-burundi-ilagan/ …",,,,1244051250699816961,https://twitter.com/Inevitable_ET/status/1244051250699816961
2020-03-28 23:57:59,TheCryptoDog,,24,31,257,"People are really washing their hands, going through bottles of hand sanitizer, and wearing masks, but reading corona news on this thing. pic.twitter.com/IG9g77BwT8",,,,1244051139223416832,https://twitter.com/TheCryptoDog/status/1244051139223416832
2020-03-28 23:57:52,madisonchaits,,8,18,144,"inspired by @QueenLesli... how a theatre family handles the corona quarantine pic.twitter.com/68416X3FCB",,@QueenLesli,,1244051109037182976,https://twitter.com/madisonchaits/status/1244051109037182976
2020-03-28 23:57:34,tailwithTHEtail,,4,9,137,"I did not beat cancer last year just to let miss Corona take me out in this one, I’ll be damned",,,,1244051034688888834,https://twitter.com/tailwithTHEtail/status/1244051034688888834
2020-03-28 23:57:14,brdavissr,,7,15,41,"How many Texas ladies know that governor Abbott has stopped all abortions in the state of Texas due to the Corona virus. He says planned parenthood is not essential services. An unwanted pregnancy awaits for no one. Plus, Abortions is not the only service they provide.1/2",,,,1244050949271965699,https://twitter.com/brdavissr/status/1244050949271965699
2020-03-28 23:56:25,wiIdflowermv,,3,20,74,"apparently a corona virus symptom is having no taste, thoughts go out to all the non 5sos stans at this time",,,,1244050744942231552,https://twitter.com/wiIdflowermv/status/1244050744942231552
2020-03-28 23:55:12,Reapered,,1,4,226,"Gg @EvilGeniuses Already miss playing on stage. hope this corona things getting better",,@EvilGeniuses,,1244050440079081472,https://twitter.com/Reapered/status/1244050440079081472
2020-03-28 23:54:44,ThatGuy_133,,0,14,14,"Beware,the new virus in town Easily beats corona hands down All stared from a giant clown Who said he didn’t want the crown He’s been nothing but letdown Done nothing but crackdown How dare you bring our country down? It’s now time for your meltdown #IslamicRepublicVirus",,,#IslamicRepublicVirus,1244050321049083909,https://twitter.com/ThatGuy_133/status/1244050321049083909
2020-03-28 23:54:42,Mostly_luca,,63,17,405,"Anyone bored asf at home due to Corona Season??",,,,1244050311804641280,https://twitter.com/Mostly_luca/status/1244050311804641280
2020-03-28 23:53:56,BermudezWrites,deelishusbarrie,8,18,259,"And the Corona Quarantine Trophy of the Week goes to .... https://twitter.com/deelishusbarrie/status/1244041587140763648 …",,,,1244050119269339137,https://twitter.com/BermudezWrites/status/1244050119269339137
2020-03-28 23:53:10,Hestia2007,,4,17,39,"Corona virus news March 28,2020 pic.twitter.com/u8uJkHm6zu",,,,1244049925740146689,https://twitter.com/Hestia2007/status/1244049925740146689
2020-03-28 23:53:03,PeterSweden7,,24,36,94,"Many have lost trust in mainstream media due to political bias in the past They've ignored the problems in Sweden Now that corona virus has come along, some don't believe the media when they warn of this pandemic BUT The media is right here. Corona virus is dangerous!",,,,1244049896191283209,https://twitter.com/PeterSweden7/status/1244049896191283209
2020-03-28 23:50:53,rafaelshimunov,,5,27,80,"You couldn’t make this stuff up. A former Cuomo staffer, accused of being funded by far right Modi nationalists, is likely exposed breaking Corona virus restrictions in Queens, home to worst cases in nation, to spread voter disinformation of @DeJesusSaves and maybe corona.",,@DeJesusSaves,,1244049352202616832,https://twitter.com/rafaelshimunov/status/1244049352202616832
2020-03-28 23:50:09,nerdsforyang,,11,31,96,"Next time someone says Corona is no worse than the flu, here's some math. 300M Americans If 20% get infected = 60M 1% mortality = 600K potential deaths CDC estimates 50K die from flu each year. So no, #CODVID19 is not just like the flu.",,,#CODVID19,1244049167384707079,https://twitter.com/nerdsforyang/status/1244049167384707079
2020-03-28 23:49:43,Isabella_Gomez,,88,197,4269,"Been talking to this boooooy everyday for a minute now, but honestly I can’t tell if we’re into each other, if we’re pen pals, or if we’re just bonding over corona trauma",,,,1244049058659840000,https://twitter.com/Isabella_Gomez/status/1244049058659840000
2020-03-28 23:49:37,tautiyauna,,0,7,16,"The sad thing is, some of y’all not about to start taking this corona pandemic serious until you lose somebody.",,,,1244049032550457346,https://twitter.com/tautiyauna/status/1244049032550457346
2020-03-28 23:48:04,actualfredsmith,,11,83,187,"The LNP is slowly adopting Labor policies used during the GFC to get us through the corona virus crisis. It's now obvious that Labor's economic credentials far exceed those of the LNP. I hope this finally puts to bed the myth that the LNP are better economic managers. #auspol",,,#auspol,1244048643004329985,https://twitter.com/actualfredsmith/status/1244048643004329985
2020-03-28 23:47:34,SAMOYEDCORE,,5,7,120,"we gotta put a stop to this corona’s virus",,,,1244048516994830336,https://twitter.com/SAMOYEDCORE/status/1244048516994830336
2020-03-28 23:47:11,BaldingsWorld,,19,10,85,"I told you people when this all started, we could have saved ourselves a lot of trouble in dealing with corona if we used the North Korean model of containment. Did you listen to me?",,,,1244048422979670018,https://twitter.com/BaldingsWorld/status/1244048422979670018
2020-03-28 23:59:45,Mmmmaaarriiiiii,,1,2,25,"Is it corona, allergies, or my anxiety?",,,,1244051583891054593,https://twitter.com/Mmmmaaarriiiiii/status/1244051583891054593
2020-03-28 23:58:55,ExpectVacancies,AltHistoryHub,1,4,106,"The great dying killed 99% of SPECIES on earth. So you sheep are taking this corona thing way to far.",,,,1244051373693394944,https://twitter.com/ExpectVacancies/status/1244051373693394944
2020-03-28 23:58:54,brice_mcbuckets,,0,2,22,"Corona virus is bad and all but I think if you’ve survived what mono has to offer you should be fine",,,,1244051368547098624,https://twitter.com/brice_mcbuckets/status/1244051368547098624
2020-03-28 23:58:40,devante_malone,talktometay,0,4,13,"Me: im sick of being quarantined in this damn house! I wanna go outside and do hoodrat things w/ my hoodrat friends! Corona: https://twitter.com/talktometay/status/1211492664228626432 …",,,,1244051311877898240,https://twitter.com/devante_malone/status/1244051311877898240
2020-03-28 23:57:55,sunlighttem,,0,1,29,"im used to quarantine i did it for 3 weeks last october except it wasn’t because of corona it was depression",,,,1244051121511038976,https://twitter.com/sunlighttem/status/1244051121511038976
2020-03-28 23:57:02,ernestadiq,,0,5,12,"BECAUSE CORONA So be careful to live your life wisely, not foolishly. Take advantage of every opportunity because these are evil times. (Ephesians 5:15,16)",,,,1244050898197909504,https://twitter.com/ernestadiq/status/1244050898197909504
2020-03-28 23:56:58,in_stax,,1,6,28,"More fashion designers from Iloilo City are creating face masks and overalls for our frontliners. We wanna fight corona in a fashion way. Thank you designers and donors. pic.twitter.com/AZUPPeaIEA",,,,1244050881626034181,https://twitter.com/in_stax/status/1244050881626034181
2020-03-28 23:55:49,TNTRMVINYL,,1,7,33,"apparently a corona virus symptom is having no taste, thoughts go out to all the non entertainment stans at this time",,,,1244050593284591616,https://twitter.com/TNTRMVINYL/status/1244050593284591616
2020-03-28 23:55:03,goose92_,,2,5,42,"Saw Pablo Sanchez trending on here and thought he had Corona. Stay safe king pic.twitter.com/35urJF8vOf",,,,1244050400413659143,https://twitter.com/goose92_/status/1244050400413659143
2020-03-28 23:52:04,MeganDoesNOLA,,4,3,16,"Saw someone call that damn second line today a “corona chorus line” and my God. pic.twitter.com/SvIOA0CuQh",,,,1244049647771017217,https://twitter.com/MeganDoesNOLA/status/1244049647771017217
2020-03-28 23:51:05,partyuntilfajr,Entrepreneur,2,2,27,"But you telling me they can’t cure corona virus https://twitter.com/Entrepreneur/status/610847280258777089 …",,,,1244049401888280584,https://twitter.com/partyuntilfajr/status/1244049401888280584
2020-03-28 23:50:33,BarberBroadway,,4,1,28,"I lost the last of my father’s surviving siblings today. Not because of corona virus....but because she was 96 YEARS OLD!!! Godspeed, Auntie.",,,,1244049267494400001,https://twitter.com/BarberBroadway/status/1244049267494400001
2020-03-28 23:50:17,Jayandreas__,,0,7,15,"Please corona, fuck off!",,,,1244049200595251201,https://twitter.com/Jayandreas__/status/1244049200595251201
2020-03-28 23:50:05,DrGuru23,SASBurnerAcct,4,1,171,"Like or get corona pic.twitter.com/tYkrJEqPiy",,,,1244049149923856385,https://twitter.com/DrGuru23/status/1244049149923856385
2020-03-28 23:49:28,Valnettles1,,1,17,16,"Somebody must know something about what happened to our Damien. God willing they will survive Corona virus so they can tell us what they know. #damiennettles #missing @DamienNettles @MisPersSupportpic.twitter.com/940vKBF5og",,@DamienNettles @MisPersSupportpic,#damiennettles #missing,1244048996840038401,https://twitter.com/Valnettles1/status/1244048996840038401
2020-03-28 23:48:46,lrosenba94,MajorSamO,0,9,14,"Tiny stairs! Corona Chic and Publicity face! That’s our Time Team! #Timeless #SaveTimeless",,,#Timeless #SaveTimeless,1244048818833891328,https://twitter.com/lrosenba94/status/1244048818833891328
2020-03-28 23:48:43,SiphoMalunga,,2,8,15,"3| Is both unconstitutional & violates the right to pvt property. It makes it illegal for pple who've stocked up their OWN food before the Corona virus.Totally unreasonable in a food insecure country. Opens the door for abuse by law enforcement to confiscate pple's food supplies.",,,,1244048807085715456,https://twitter.com/SiphoMalunga/status/1244048807085715456
2020-03-28 23:48:26,kafine,,3,3,28,"Corona-proof dining @Superdawg pic.twitter.com/1r1VTF2yfo",,@Superdawg,,1244048737460256769,https://twitter.com/kafine/status/1244048737460256769
2020-03-28 23:47:29,kiraniazeez,,0,4,16,"Y’all should go back again and watch the video of the army men. They are not practicing any distance from each other. They are not wearing gloves or face mask. They will be outside on Monday wearing none of this. Are they immune to the corona virus? What is really going on?",,,,1244048494601687040,https://twitter.com/kiraniazeez/status/1244048494601687040
2020-03-28 23:46:01,_sophiamoorex,,2,6,36,"you know what would SLAP when this whole corona thing is over? A LEMONADE MOUTH WORLD TOUR. make it happen bitches x",,,,1244048127511990272,https://twitter.com/_sophiamoorex/status/1244048127511990272
2020-03-28 23:45:42,mattprescott,,1,33,53,"It's hard to believe that we're attempting to fight the CORONA / COVID19 PANDEMIC without accurate, up-to-date + high resolution data on prevalence, transmission + infection. We've some of the best epidemic experts, clinicians + scientists in the world, but the worst politicians!",,,,1244048047434235910,https://twitter.com/mattprescott/status/1244048047434235910
2020-03-28 23:45:31,airnewsalerts,,1,11,70,"#Maharashtra: 26 Corona infected patients were discharged and sent home after their reports came negative. Another 28 new cases were recorded taking the total tally to 181. #IndiaFightsCorona #COVID2019India",,,#Maharashtra #IndiaFightsCorona #COVID2019India,1244048000088858624,https://twitter.com/airnewsalerts/status/1244048000088858624
2020-03-28 23:45:00,StevStiffler,,0,93,182,"THIS MAN IS A GENIUS he figured out the Corona virus problem pic.twitter.com/WNeTpMz1PM",,,,1244047870195531776,https://twitter.com/StevStiffler/status/1244047870195531776
2020-03-28 23:44:31,Turtlecat9,,53,21,212,"1/2 Very sad news. A rescue group that does free clinics picked up Corona for a check-up, neutering, and shots, etc. The woman that picked him up just called. Sadly, Corona had to be euthanized. He had the Feline Leukemia Virus. pic.twitter.com/RafI5l5Qfo",,,,1244047749907206144,https://twitter.com/Turtlecat9/status/1244047749907206144
2020-03-28 23:44:13,varvel,,3,15,31,"""Stayin' Inside"" - Corona Virus Bee Gees Parody https://youtu.be/nmUXntGlqFI via @YouTube",,@YouTube,,1244047675659616256,https://twitter.com/varvel/status/1244047675659616256
2020-03-28 23:43:25,Danny__walterr,,26,68,426,"Last month, Queen Elizabeth II ran from England to a Desert because of Corona Virus, Today, she’s tested Positive Modafuckin virus has been tracking her pic.twitter.com/vSh9NK3hS6",,,,1244047471430467590,https://twitter.com/Danny__walterr/status/1244047471430467590
2020-03-28 23:43:06,PeterSweden7,,27,18,105,"This corona virus quarantine has radically altered my diet. Except for some conserved ham, I've become more or less a vegetarian... Pasta. Beans. Pasta. Beans. Yum.",,,,1244047393131302916,https://twitter.com/PeterSweden7/status/1244047393131302916
2020-03-28 23:42:16,marxindo,,0,26,88,"before Corona=B.C.",,,,1244047184422567937,https://twitter.com/marxindo/status/1244047184422567937
2020-03-28 23:40:32,claudiajordan,,21,17,133,"It's impossible having a fact based conversation with some of these trump fans. They refuse to see any fault in their false god. It's sad. You can still be his fan boy & acknowledge he fumbled the ball on not taking this corona thing seriously until it was already claiming lives",,,,1244046748395454470,https://twitter.com/claudiajordan/status/1244046748395454470
2020-03-28 23:40:27,jmjohnstonwebs1,TheRickWilson,10,28,434,"Can golden showers spread corona flowers?",,,,1244046725091741696,https://twitter.com/jmjohnstonwebs1/status/1244046725091741696
2020-03-28 23:39:31,fluffyguy,07Kdoyle,9,26,557,"Please tell ur husband I said thank you for his service. I’m sorry the dates were moved but unfortunately the corona put everyone in entertainment on pause. I hope u guys can make it to a show one day https://twitter.com/07Kdoyle/status/1244030590011052032 …",,,,1244046492593033216,https://twitter.com/fluffyguy/status/1244046492593033216
2020-03-28 23:38:52,wrestlelamia,,6,14,88,"apparently a corona virus symptom is having no taste, thoughts go out to all TNA circa 2011 fans at this time",,,,1244046330030424070,https://twitter.com/wrestlelamia/status/1244046330030424070
2020-03-28 23:38:30,OhItsKell,,1,17,23,"Patron is the cure to corona virus",,,,1244046235423645696,https://twitter.com/OhItsKell/status/1244046235423645696
2020-03-28 23:38:06,Muhammad_M_Abba,,11,13,68,"The scary thing is not the cough and sneezing. The worrysome thing is the headache, wallahi as if as someone is pounding something inside my head. I pray may Almighty Allah protect you and your families from being infected with corona virus",,,,1244046133967683585,https://twitter.com/Muhammad_M_Abba/status/1244046133967683585
2020-03-28 23:37:23,theoztrucker,,24,11,144,"TV on. Background noise. I’m sick of it now. I reckon if I got a case of beer and took a swig every time someone said corona virus I’d be pissed in an hour!",,,,1244045954103119872,https://twitter.com/theoztrucker/status/1244045954103119872
2020-03-28 23:37:01,sockjig,forexposure_txt,7,19,98,"Adidas is worth billions, but doesn't want to pay their bills cause of Corona. This is the courage, persistence, and focus they were talking about. https://twitter.com/forexposure_txt/status/1244035567798501378 …",,,,1244045860821815296,https://twitter.com/sockjig/status/1244045860821815296
2020-03-28 23:36:37,AmaniBallour,,7,91,141,"Fear has a different flavor in opposition-held Syria #Covid_19 #Corona pic.twitter.com/igKQDsWtdD",,,#Covid_19 #Corona,1244045760079056896,https://twitter.com/AmaniBallour/status/1244045760079056896
2020-03-28 23:35:24,vishalmalavya,Swamy39,38,381,1043,"Gujarat is strongly stands with Country. While @ArvindKejriwal was busy to create panic Gujarat create largest Corona virus hospital in record times. #IndiaFightsCorona #Lockdown21https://indiandefencenews.info/gujarat-sets-up-2200-beds-coronavirus-hospital-in-just-6-days/ …",,@ArvindKejriwal,#IndiaFightsCorona #Lockdown21https,1244045456822288384,https://twitter.com/vishalmalavya/status/1244045456822288384
2020-03-28 23:35:13,dailyremarx,,3,11,48,"wish my lungs could tell me whether it’s corona breathing or corona-anxiety breathing",,,,1244045407820419074,https://twitter.com/dailyremarx/status/1244045407820419074
2020-03-28 23:32:36,DogmanOW,,17,12,295,"Bro why does corona have to be goin on while it's literally THE best wheather outside I've ever seen RN..",,,,1244044749255958528,https://twitter.com/DogmanOW/status/1244044749255958528
2020-03-28 23:32:20,tamar_whyte,BeresfordPeter,3,3,18,"I was thinking about this. 15y ago I regularly felt humiliated during A&E visits. I was usually on my own. This was without a national pandemic, risk of Corona & staff even more exhausted than usual. I remember one nurse who was kind & non-judgemental. Made all the difference https://twitter.com/BeresfordPeter/status/1244010864614748160 …",,,,1244044685611540482,https://twitter.com/tamar_whyte/status/1244044685611540482
2020-03-28 23:32:18,PeterSweden7,,68,24,148,"Over 30 000 have now died from Corona virus worldwide. Maybe if this had been taken seriously from the start, we could have avoided this.",,,,1244044676128215041,https://twitter.com/PeterSweden7/status/1244044676128215041
2020-03-28 23:32:07,rafaelshimunov,ZachReports,2,7,32,"Possibly a former Cuomo staffer has been knocking doors in Queens (home to one of the worst corona cases in the nation) to spread disinformation about another candidate. Allegation also includes that she takes donations from far right Hindu nationalists. Follow @aaronnarraphhttps://twitter.com/ZachReports/status/1244032722391220224 …",,@aaronnarraphhttps,,1244044627549790208,https://twitter.com/rafaelshimunov/status/1244044627549790208
2020-03-28 23:32:06,TxFireman325,toddstarnes,58,219,558,"They are preparing for war. Virus is a cover. NORAD and NORTHCOM now activated and personal are shut up inside with around the clock surveillance. Mercy and Comfort hospital ships NOT for the corona virus. Trump confirmed that today.",,,,1244044622990585857,https://twitter.com/TxFireman325/status/1244044622990585857
2020-03-28 23:31:30,_vhugala_,,199,431,1190,"I knew Zahara was the Queen that would save us from Corona. pic.twitter.com/kDCkkzmhJN",,,,1244044472549326848,https://twitter.com/_vhugala_/status/1244044472549326848
2020-03-28 23:30:16,Delavegalaw,DrSarahJWhite,5,19,152,"Avast ye hearties...the corona pirates. https://twitter.com/DrSarahJWhite/status/1243474758169063424 …",,,,1244044164175716352,https://twitter.com/Delavegalaw/status/1244044164175716352
2020-03-28 23:29:09,KIaud,GovMurphy,0,16,57,"I’d 100% watch a TV show like cops where governor Murphy goes around with police busting up corona parties https://twitter.com/GovMurphy/status/1243988789057466368 …",,,,1244043881659994115,https://twitter.com/KIaud/status/1244043881659994115
2020-03-28 23:28:41,Jorawer_22,,1,5,23,"Corona has depression in the air",,,,1244043766316568576,https://twitter.com/Jorawer_22/status/1244043766316568576
2020-03-28 23:28:23,Atlas8SP,EnesKanter,1,52,109,"This how you catch corona without leaving the house https://twitter.com/EnesKanter/status/1244033968095232000 …",,,,1244043690022141954,https://twitter.com/Atlas8SP/status/1244043690022141954
2020-03-28 23:27:45,_NickSytnik,,1,5,37,"If you really start an argument for calling it the Chinese virus or any such name instead of corona virus you're probaaaaaably just a little tad bit racist and don't want to admit it",,,,1244043532328996871,https://twitter.com/_NickSytnik/status/1244043532328996871
2020-03-28 23:26:58,Rosehill1999,,1,5,73,"Can we stop woth the online fear mongering. First it was my cousin’s friend from the pentagon now its i have corona [storytime] pic.twitter.com/zBv974bCCA",,,,1244043333627867136,https://twitter.com/Rosehill1999/status/1244043333627867136
2020-03-28 23:26:53,annascrpz,peepgawd1,1,4,126,"My mom works at the hospital too, she’s had cancer too, when patients with Corona virus started coming in, they decided to let her stay home for her safety (it took a week to get all the bureaucracy done but whatever), that’s the right thing to do!",,,,1244043312518049795,https://twitter.com/annascrpz/status/1244043312518049795
2020-03-28 23:26:20,Satiresocialist,,74,189,462,"Corona Virus, like any flu breakout will last for 2 to 4 months (starting from January) Manufactured hysteria will last for 12 to 18 months Oppressive societal control will last until it is no longer required and obedience is built in",,,,1244043173376245760,https://twitter.com/Satiresocialist/status/1244043173376245760
2020-03-28 23:25:46,Kingfreespeech,,4,66,99,"@NYGovCuomo Hey, shit head, explain to us all how the hell you & the democrats can blame Donald Trump for “not sending you Ventilators” for the Corona Virus crisis & then admit just hours ago that you have warehouses full of ventilators that you refuse to use? YOU ASSHOLE!",,@NYGovCuomo,,1244043033269678080,https://twitter.com/Kingfreespeech/status/1244043033269678080
2020-03-28 23:25:26,a_busy_woman,,7,123,691,"is there any pandemic discourse left? communism good, the real virus is capitalism, rent strikes require organization, sexting is a skill, indigenous/rural communities need greater attention, animal crossing is post-corona LARP, and incarcerated ppl should be let out immediately",,,,1244042948821557249,https://twitter.com/a_busy_woman/status/1244042948821557249
2020-03-28 23:23:45,DoxsieKatrina,AndrewYang,7,70,209,"You know what would have kept the 17 year old alive who died from corona? Medicare For All. Something you claimed to stand for, but never did. Also, you endorsed Biden. He's never going to pass a UBI OR Medicare For All. If we get UBI it cannot be your means tested version. https://twitter.com/AndrewYang/status/1243911521425600513 …",,,,1244042524576100352,https://twitter.com/DoxsieKatrina/status/1244042524576100352
2020-03-28 23:23:26,infantry1,IvankaTrump,3,30,186,"Ivanka Trump: True. Kindness goes a long way. Now, tell you husband to freeze/forgive rents of all the tenants of the buildings he owns. We are all in this corona mess, together. Also, get back to having all apartments be filed under the rent controlled laws... NO EVICTIONS!",,,,1244042444045463554,https://twitter.com/infantry1/status/1244042444045463554
2020-03-28 23:22:09,TheOliveKnife,,2,94,133,"The most awaited hazmat suit( according to @MamataOfficial govt) arrives at CORONA HUB R.I.P healthcare providers @MoHFW_INDIApic.twitter.com/Twn7otb8HZ",,@MamataOfficial @MoHFW_INDIApic,,1244042119091646466,https://twitter.com/TheOliveKnife/status/1244042119091646466
2020-03-28 23:22:07,adam_tooze,broderly,0,9,23,"This is a good overview by @spiegelonline team of the impasse in Europe over the step to corona bonds. https://twitter.com/broderly/status/1244006945708744704 …",,@spiegelonline,,1244042114322792450,https://twitter.com/adam_tooze/status/1244042114322792450
2020-03-28 23:21:56,mymia59,VanMeir3,10,5,108,"Had the flu 3x had pneumonia 3x (everytime). Treated with steroids all 3x. Not fun, but better in 5 days or less. Haven't heard one word about steroids with corona...why?",,,,1244042067845791744,https://twitter.com/mymia59/status/1244042067845791744
2020-03-28 23:21:20,ScottRogowsky,,6,8,116,"Rain rain go away, and take corona with you am I right ladies????",,,,1244041916234305539,https://twitter.com/ScottRogowsky/status/1244041916234305539
2020-03-28 23:21:06,Cassidyyblake,,0,6,30,"Me the second the corona virus is out of Buffalo pic.twitter.com/GMx9vByXgg",,,,1244041857958662145,https://twitter.com/Cassidyyblake/status/1244041857958662145
2020-03-28 23:17:33,Tolluuwalope,,2,2,17,"I picked up the hot sauce in our shopping cart today knowing no one really uses it in my family and asked my mom when she started liking hot sauce. Apparently one doctor somewhere said it might help against corona. WHATSAPP NEEDS TO GO I am TIRED",,,,1244040964110454785,https://twitter.com/Tolluuwalope/status/1244040964110454785
2020-03-28 23:17:27,racsterls,,0,4,21,"Watching Barry Gibb singing Staying Alive on #TwitchStreamAid is a real mood in the time of #Corona pic.twitter.com/uqH8Pj41sL",,,#TwitchStreamAid #Corona,1244040937157709824,https://twitter.com/racsterls/status/1244040937157709824
2020-03-28 23:17:05,PerucryptOM,,7,15,40,"No wonder India has less corona virus cases. They really enforcing the awareness . #BSV #BTC #BCH #XRP scary .pic.twitter.com/vvAZchUhCY",,,#BSV #BTC #BCH #XRP,1244040847571791872,https://twitter.com/PerucryptOM/status/1244040847571791872
2020-03-28 23:16:38,LiseKorson,JordanSchachtel,0,8,45,"B #corona episode Where U stand depends on where U sit makes for toxic brew To save their own asses, politicians must be seen to protect the public To make a profit, media sustains story through sensationalism To serve the public, health officials give advice based on worst",,,#corona,1244040733411225602,https://twitter.com/LiseKorson/status/1244040733411225602
2020-03-28 23:16:02,therealokine,,0,4,21,"Now that corona Virus has postponed your wedding date, how are you going to explain the Pregnancy? Or I should shut up?",,,,1244040581426434049,https://twitter.com/therealokine/status/1244040581426434049
