date,username,to,replies,retweets,favorites,text,geo,mentions,hashtags,id,permalink
2020-03-28 19:39:59,IFBBVicMartinez,,15,29,147,"I really don’t want to hear how the rich and famous people are going through it with corona and giving advice because they are not your everyday people. I want to hear the everyday person with no income, small apartments and barely any food for there families. That’s what’s real!",,,,1243986213008277504,https://twitter.com/IFBBVicMartinez/status/1243986213008277504
2020-03-28 19:39:32,PortalNicole,pussycatdolls,0,3,29,"the cure for corona is coming https://twitter.com/pussycatdolls/status/1243984677582655488 …",,,,1243986098168135682,https://twitter.com/PortalNicole/status/1243986098168135682
2020-03-28 19:39:28,annnieprice,,3,5,100,"when your flat mate has been sneaking out to see her friends and we had paramedics here that she’s most likely got corona along with the whole FUCKING FLAT!!!! STAY INDOORS AND STOP BEING SELFISH HORRIBLE CUNTS AND GOING OUT TO SEE YOUR FRIENDS IN THEIR HOUSES !!!!!",,,,1243986079721705474,https://twitter.com/annnieprice/status/1243986079721705474
2020-03-28 19:39:18,Schandillia,,1,64,122,"7/17 March 15: India pledges $10 million as corona aid to SAARC; nothing yet for its own self. http://www.themorning.lk/india-to-contribute-10-m-for-saarc-covid-19-emergency-fund/ …",,,,1243986039888154629,https://twitter.com/Schandillia/status/1243986039888154629
2020-03-28 19:37:21,NOTlinemary,,4,3,34,"don’t forget that your job doesn’t care about you like that. she would of die of corona and they would simply replace her and move on with their day ok? chuipsssss",,,,1243985548743753728,https://twitter.com/NOTlinemary/status/1243985548743753728
2020-03-28 19:37:07,dadykitto,Vall_erie,6,1,62,"Why is it looking like Corona virus",,,,1243985487603404802,https://twitter.com/dadykitto/status/1243985487603404802
2020-03-28 19:36:56,Remmzor_YBNL,,34,65,289,"I’m getting laid after this corona and Ramadan please . It’s enough I no celibate again , everything is turning me on this days. Vibration phone mi gan ji mi sile",,,,1243985444624379904,https://twitter.com/Remmzor_YBNL/status/1243985444624379904
2020-03-28 19:35:55,UdayMahurkar,,31,343,1419,"These are bad times for humanity. What Corona has done to big nations is fearsome. India too is worried. Our sages said Mahamritunjai Mantra to Lord Shiva has power to extricate us from such peril. Appeal to every one to hear/chant this mantra. Here it is http://youtu.be/pTYUBXJMQgY pic.twitter.com/pKBWoRJwJn",,,,1243985188113113098,https://twitter.com/UdayMahurkar/status/1243985188113113098
2020-03-28 19:34:58,futureusrefugee,,3,58,300,"I remember when libs used to defend Muslims they were like ""actually Muslims are the biggest victims of Islamic terrorism"" so I expected them to be like ""actually Chinese are the biggest victims of corona"" but instead they're just like ""China good. Fuck white people""",,,,1243984947414695939,https://twitter.com/futureusrefugee/status/1243984947414695939
2020-03-28 19:34:51,osmboyz,,3,2,20,"moms is corona free",,,,1243984918750867456,https://twitter.com/osmboyz/status/1243984918750867456
2020-03-28 19:34:40,gurdeepsappal,,7,29,106,"Feeling very depressed after witnessing mass exodus of poors’ #backmigration If only it were some elections and not corona threat, the famed ‘micro management skills’ & ‘booth level machinery’ would be at work. Why have such skills vanished now?",,,#backmigration,1243984873481621504,https://twitter.com/gurdeepsappal/status/1243984873481621504
2020-03-28 19:34:25,Famous_Anfield,,2,10,24,"Governor El-Rufa'i of Kaduna State, Nigeria tested positive for Corona Virus. Our thoughts and prayers are with him and his family. We hope he comes through this challenge and tough times in good health. May the Almighty heal all victims and protect the unharmed. #CoronaUpdate",,,#CoronaUpdate,1243984811670323200,https://twitter.com/Famous_Anfield/status/1243984811670323200
2020-03-28 19:33:16,LouisDunford,,8,22,92,"Corona Cover 5. #Flowers #Garagepic.twitter.com/nDRSvuGA1o",,,#Flowers #Garagepic,1243984520543703041,https://twitter.com/LouisDunford/status/1243984520543703041
2020-03-28 19:33:16,HAHayatu,MobilePunch,12,10,71,"They have found an alibi in corona https://twitter.com/MobilePunch/status/1243782370798395392 …",,,,1243984520161959940,https://twitter.com/HAHayatu/status/1243984520161959940
2020-03-28 19:32:39,smartmangonada,,3,68,227,"Y’all was so worried bout Mexicans taking your jobs, now look corona took yo job",,,,1243984366562402306,https://twitter.com/smartmangonada/status/1243984366562402306
2020-03-28 19:32:29,jayla_marieeee,,0,32,61,"CORONA NOT GONNA STOP SPREADING TILL A LOCKDOWN IS ACTUALLY ENFORCED. these ppl bullshitting",,,,1243984324455784448,https://twitter.com/jayla_marieeee/status/1243984324455784448
2020-03-28 19:32:27,alamin_ghost,,50,169,800,"Our working governor of kaduna state Nasiru el Rufaii has tested positive for corona virus oh ya Allah so far he has been a good governor to the common kaduna man,protect him and may he recover soon ameen",,,,1243984317124169728,https://twitter.com/alamin_ghost/status/1243984317124169728
2020-03-28 19:32:20,saritivik,,1,4,200,"Corona life Fanfinifinphone sex time",,,,1243984286006550529,https://twitter.com/saritivik/status/1243984286006550529
2020-03-28 19:32:19,_DatEgbaBoy,,6,12,24,"Na this corona period some people de cash out pass. God no go shame us o.",,,,1243984281715838976,https://twitter.com/_DatEgbaBoy/status/1243984281715838976
2020-03-28 19:31:37,mannequinpussy,,4,1,129,"dam when tours finally come back i'll probably have to get a bucket to spit into - can't be spitting all over stage in a post corona world",,,,1243984106528088065,https://twitter.com/mannequinpussy/status/1243984106528088065
2020-03-28 19:30:37,cyrilokolie,,4,17,106,"I swear the dude that comes up with the vaccine for corona will definitely win Nobel prize for medicine and peace sef Infact everything even literature World footballer of the year Golden boot Best actor Best hip hop album Miss universe Everything ......",,,,1243983852407869440,https://twitter.com/cyrilokolie/status/1243983852407869440
2020-03-28 19:30:28,HarlieSonnier,,2,11,90,"corona is giving me more quality time with the beach :)) pic.twitter.com/MP0AbTK7T2",,,,1243983816571551744,https://twitter.com/HarlieSonnier/status/1243983816571551744
2020-03-28 19:30:22,Ugaman01,,4,8,143,"Yo @YkeeBenda that Corona Virus Tune is a mad!!! Salute soldier!",,@YkeeBenda,,1243983792798384128,https://twitter.com/Ugaman01/status/1243983792798384128
2020-03-28 19:30:11,Shalumehta95,,0,80,83,"#ArrestKejriwal The satsangs of the true Satguru tell us that there is a God who eradicates even the worst of diseases, even if it is an epidemic like corona. pic.twitter.com/NMgQQdP5bO",,,#ArrestKejriwal,1243983744471465984,https://twitter.com/Shalumehta95/status/1243983744471465984
2020-03-28 19:30:06,nanditathhakur,KapilMishra_IND,20,141,234,"If corona spreads to villages Kejriwal should be arrested for genocide ... https://twitter.com/KapilMishra_IND/status/1243915240900669440 …",,,,1243983722401034240,https://twitter.com/nanditathhakur/status/1243983722401034240
2020-03-28 19:29:26,drop0ut__,,0,14,16,"Admist this corona lockdown doctors have announced a red alert for thalassemia patients in the country. Hospitals are out of blood as everyone is in their houses which is necessary but those lives are also as precious as someone battling with corona. Pls help as much as you can.",,,,1243983554368987136,https://twitter.com/drop0ut__/status/1243983554368987136
2020-03-28 19:29:09,ForePlayPod,,6,24,418,"A corona got its lime (via @Anthony_callin/IG) pic.twitter.com/HjCwfEBh9T",,@Anthony_callin,,1243983485175554049,https://twitter.com/ForePlayPod/status/1243983485175554049
2020-03-28 19:28:41,thatonequeen,,15,122,1402,"I just keep imagining the Corona virus on a cruise ship to Seattle singing ""How Far I'll Go"" from Moana.",,,,1243983369127501825,https://twitter.com/thatonequeen/status/1243983369127501825
2020-03-28 19:25:58,BILDERBERG_GP,warriorofrad,3,16,34,"Brexiteers...someone thinks I'm a 'Simpleton' for praising what our country is doing to help with this Corona virus. 'Apparently ' France has placed an order for 1billion. We are making our own...we can handle our need. You have to wonder why this person follows me. He hates us. https://twitter.com/warriorofrad/status/1243977508682371072 …",,,,1243982683904053248,https://twitter.com/BILDERBERG_GP/status/1243982683904053248
2020-03-28 19:24:47,MarietjeSchaake,RinkeNOS,105,893,810,"600.000 face masks revoked after being distributed to Dutch hospitals, they were ordered from China, but do not meet safety criteria, tests reveal (in Dutch) #Corona https://twitter.com/RinkeNOS/status/1243979735002218496 …",,,#Corona,1243982384921534466,https://twitter.com/MarietjeSchaake/status/1243982384921534466
2020-03-28 19:24:47,JuvenileCrime,,1,29,45,"NO -- Yet Another Article and 100's of Tweets ONLY taking about Low-Risk Youth Locked-Up should be Released to Reduce Corona Virus Infection. It's Unacceptable that BOTH Middle-Risk & High-Risk Youth Locked-Up have a Higher Risk to get the #CoronaVirus.https://chronicleofsocialchange.org/justice/juvenile-justice-2/juvenile-justice-systems-wrestle-with-how-to-shrink-the-number-of-youth-in-lock-up-as-pandemic-intensifies/41832 …",,,#CoronaVirus,1243982384569163776,https://twitter.com/JuvenileCrime/status/1243982384569163776
2020-03-28 19:24:38,GargaC,,28,38,136,"Delhi in the time of ""social distancing"". Why should we non-Hindi peoples suffer bcoz Hindi states are parasitic Somalias? Isnt @DelhiPolice under @AmitShah? Where's that anti-Bengali Dhokla now? Busy planning riots? Bengal must close Bihar+Jharkhand border for 6 months. #Corona pic.twitter.com/BiGVefvNg1",,@DelhiPolice @AmitShah,#Corona,1243982348204388357,https://twitter.com/GargaC/status/1243982348204388357
2020-03-28 19:24:19,Shiffa_ZY,DMiandad,10,5,72,"Have conducted several programmes - infact before this corona crisis have repeatedly done shows with Fawad Chaudhry, scientists like Dr. Atta ur Rehman, @yarjan_baloch and others... Programmes arent enough, policy making, planning & vision is needed 2 which we have lacked 4 yearshttps://twitter.com/DMiandad/status/1243848618215378944 …",,@yarjan_baloch,,1243982268315709442,https://twitter.com/Shiffa_ZY/status/1243982268315709442
2020-03-28 19:24:03,AyaIsleemEn,,30,214,1162,"Away from #Corona news a bit.. it’s green almond harvest season in #Gaza city, #Palestine pic.twitter.com/wTnY18zbFS",,,#Corona #Gaza #Palestine,1243982199474569217,https://twitter.com/AyaIsleemEn/status/1243982199474569217
2020-03-28 19:23:54,Spazzsodopee,,1,23,41,"Corona￼Virus Got mfs being horny, depressed,creative and true Alcoholics...im All 4",,,,1243982163382501377,https://twitter.com/Spazzsodopee/status/1243982163382501377
2020-03-28 19:23:30,Justinsjaded,,2,4,16,"I hope corona makes the head bangers and moshers at festivals go extinct",,,,1243982062631006210,https://twitter.com/Justinsjaded/status/1243982062631006210
2020-03-28 19:21:38,abdulqadeer03,,47,139,295,"HEC and government had no plan but they forced the universities to do this and students are facing problems in this regard so students want semester break and rejected online education. Spacialy Thank you @AdilabbasiAry for highlighting. #SaveStudentsFuture #Corona pic.twitter.com/7ipN41UL55",,@AdilabbasiAry,#SaveStudentsFuture #Corona,1243981595100483584,https://twitter.com/abdulqadeer03/status/1243981595100483584
2020-03-28 19:20:49,sukh_slatch,,34,15,83,"Mere ghr k near corona ka new case",,,,1243981387889328129,https://twitter.com/sukh_slatch/status/1243981387889328129
2020-03-28 19:20:43,theabdullah007,,9,38,117,"Our engineers are working 24/7 to help our doctors to fight CORONA virus. This is war, corona is our enemy, we are soldiers and our weapon is unity. Please stay at homes, let us fight this. #fightcorona #PakistanZindabad #RealHeroespic.twitter.com/2VJsHARHWd",,,#fightcorona #PakistanZindabad #RealHeroespic,1243981363545550848,https://twitter.com/theabdullah007/status/1243981363545550848
2020-03-28 19:20:33,Ian_Burnett_,,5,12,48,"The National newspaper asked the people of Scotland to protect them from the fallout of the Corona Virus. They're pushing digital subscriptions. There'll be many worthy causes in the coming weeks. Not sure the National will be a priority for the many or even the few.",,,,1243981320621043714,https://twitter.com/Ian_Burnett_/status/1243981320621043714
2020-03-28 19:20:10,xxAnae,,2,9,43,"Damn my cousin got the corona & they told her it’s airborne and more than 80% of Toledo gone get it, y’all can keep going outside but ME? I’m coo",,,,1243981225502466054,https://twitter.com/xxAnae/status/1243981225502466054
2020-03-28 19:19:34,DougStanhope,DSCDP,18,26,466,"You told me it was a ""corona-curing quarantine chair"" and charged me $4,500 you motherfucker! https://twitter.com/DSCDP/status/1243973783255474176 …",,,,1243981074302038021,https://twitter.com/DougStanhope/status/1243981074302038021
2020-03-28 19:19:09,MODIfiedkhan,,4,220,614,"New face of Corona #COVID19 #ArrestKejriwalpic.twitter.com/cqSvWaCqeY",,,#COVID19 #ArrestKejriwalpic,1243980966067990529,https://twitter.com/MODIfiedkhan/status/1243980966067990529
2020-03-28 19:19:03,RehamKhan1,qureshik74,51,18,52,"No leadership skills & certainly not the leader to deal with the corona crisis says @qureshik74https://twitter.com/qureshik74/status/1243910517879685121 …",,@qureshik74https,,1243980943414738944,https://twitter.com/RehamKhan1/status/1243980943414738944
2020-03-28 19:18:55,HistoryNed,,1,17,22,"Difficult to read about the hardships suffered by small businesses and entrepreneurs due to the corona pandemic. pic.twitter.com/zdfpH2YOZd",,,,1243980908304248832,https://twitter.com/HistoryNed/status/1243980908304248832
2020-03-28 19:18:35,ShabbirMir,,3,23,50,"Man in picture is Dr Hammad Zahir from Gilgit. He is at Wuhan province along with his spouse joining global efforts against Coronavirus. He arranged corona related equipment but finding it hard to send it to G-B. Wonder if government could find a way out to bring it from China. pic.twitter.com/FoWTqkCbJY",,,,1243980824476860417,https://twitter.com/ShabbirMir/status/1243980824476860417
2020-03-28 19:18:21,cameron_e_cook,NorthwesternGW,2,5,18,". @NorthwesternGW’s statement is the strongest & most wide-reaching i’ve read w/ respect to NU’s corona response. grad workers are really watching out for all of us. https://twitter.com/NorthwesternGW/status/1243976986722217985 …",,@NorthwesternGW,,1243980768487096322,https://twitter.com/cameron_e_cook/status/1243980768487096322
2020-03-28 19:18:20,mehran_narejo,,5,44,274,"Our Karachi post lockdown Air pollution has drastically decreased. Once we we done with corona menace we must come up with strong environmental policy. We must replace old vehicles & factory chimneys with new modern ones. To decrease carbon emissions. @BBhuttoZardari @BakhtawarBZpic.twitter.com/lyLQkhm3TB",,@BBhuttoZardari @BakhtawarBZpic,,1243980762812231680,https://twitter.com/mehran_narejo/status/1243980762812231680
2020-03-28 19:18:08,Arun2981,,10,182,405,"30th jan we had first CORONA case It’s 60th day now.... still we have reached to capacity of 2000 tests a day That’s total failure of Governance And to hide this failure, rest all trends are happening WE ARE NOT TESTING ENOUGH TO STOP THIS PANDEMIC",,,,1243980713109544962,https://twitter.com/Arun2981/status/1243980713109544962
2020-03-28 19:14:35,rocknrollgarag1,,0,5,20,"The Knack changes ‘My Sharona’ to “Bye, Corona” in released video - http://rockandrollgarage.com/the-knack-changes-my-sharona-to-bye-corona-in-released-video/ …",,,,1243979819211243520,https://twitter.com/rocknrollgarag1/status/1243979819211243520
2020-03-28 19:14:33,SabaHyder1,,15,25,190,"Corona Virus has slowly turned from Allah ka Azaab to yahoodi sazish to American agenda to chinese propaganda. Farigh awam apni conspiracy theories apne hadd tk rkhein.",,,,1243979812093530112,https://twitter.com/SabaHyder1/status/1243979812093530112
2020-03-28 19:14:18,TOKCityOfLights,,7,28,61,"Pakistan Corona Virus cases reach 1500 as Punjab emerges new epicentre. #CoronaUpdate #StayAtHomeAndStaySafepic.twitter.com/cMVR5uwyBV",,,#CoronaUpdate #StayAtHomeAndStaySafepic,1243979746758856704,https://twitter.com/TOKCityOfLights/status/1243979746758856704
2020-03-28 19:12:54,edrormba,,2,14,29,"#Italy in disbelief: Woman 102 infected with #Coronavirus and recovered. When Italica Grundona contracted Corona, no one expected her 20 days later to be released. Doctors try to understand how the elderly survived the virus: ""We call her the 'immortal'"" pic.twitter.com/QwfMqOUQXn",,,#Italy #Coronavirus,1243979393615134720,https://twitter.com/edrormba/status/1243979393615134720
2020-03-28 19:12:42,pGurus1,,3,25,36,"Some (the usual suspects?) in the MSM are back to doing what they do best - peddling lies about Corona virus @rvaidya2000 -https://www.pgurus.com/corona-crisis-prannoy-roys-ndtv-raghav-bahls-quint-website-and-anil-ambanis-ians-news-agency-caught-peddling-fake-news-creating-panic …",,@rvaidya2000,,1243979345879760896,https://twitter.com/pGurus1/status/1243979345879760896
2020-03-28 19:12:42,taylucifer666,,11,16,127,"TAYLOR WARNED US ABOUT THE CORONA VIRUS BACK IN 2017 WTFFF ?? pic.twitter.com/SlHE673ROH",,,,1243979343547826176,https://twitter.com/taylucifer666/status/1243979343547826176
2020-03-28 19:12:05,pengmanmodel,,6,16,86,"With this Coronavirus, when you open Instagram drip still full everywhere. Corona can’t stop the drip",,,,1243979191588130817,https://twitter.com/pengmanmodel/status/1243979191588130817
2020-03-28 19:11:53,DdaGOAT_19,,0,21,77,"Me seeing Dwayne Johnson trending thinking he has corona but it is just people talking about him for no reason pic.twitter.com/VfH6kD439V",,,,1243979138022678529,https://twitter.com/DdaGOAT_19/status/1243979138022678529
2020-03-28 19:11:31,MrY_Photography,,3,20,108,"Because of corona virus we all understood what it means to be in a cage. Please don’t keep birds in the cage. They are innocent, not guilty... (paintings by #JoannaMaitland)pic.twitter.com/nPDehmtRJC",,,#JoannaMaitland,1243979048642109441,https://twitter.com/MrY_Photography/status/1243979048642109441
2020-03-28 19:11:13,digitaldidan,,11,13,90,"I knew one Pastor had to make a clown out of themselves in this corona situation. Now look at Pastor Yiga SMH.",,,,1243978972154793986,https://twitter.com/digitaldidan/status/1243978972154793986
2020-03-28 19:10:55,pmcafrica,,41,147,334,"Flight attendant orders this passenger to leave the plane and sit on the engine because he has the Corona Virus. #PechéAfrica (Source: @TakaTina1 on Whatsapp) @pmcafrica @danielmarven #Day3 pic.twitter.com/iFWWXUdno4",,@TakaTina1 @pmcafrica @danielmarven,#PechéAfrica #Day3,1243978895608762369,https://twitter.com/pmcafrica/status/1243978895608762369
2020-03-28 19:10:28,antoowalker,,8,19,64,"If corona inna portmore enno. Di wulla we....",,,,1243978784598102018,https://twitter.com/antoowalker/status/1243978784598102018
2020-03-28 19:10:25,ShayanAhmed_,,2,16,59,"This Corona virus is making my life more difficult and boring than it already is. I am done.",,,,1243978770006061057,https://twitter.com/ShayanAhmed_/status/1243978770006061057
2020-03-28 19:10:23,SeriesTangled,,8,20,114,"Seriously if #Disney wasn't planning a #Tangled #Frozen #CrossOver why are the #Northuldra in #Frozen2 ""The people of the sun""? #QuarantineLife #Corona #StayAtHomepic.twitter.com/EI6FPxjApx",,,#Disney #Tangled #Frozen #CrossOver #Northuldra #Frozen2 #QuarantineLife #Corona #StayAtHomepic,1243978762103992320,https://twitter.com/SeriesTangled/status/1243978762103992320
2020-03-28 19:10:19,amhusreey,,10,29,114,"BREAKING NEWS : Burundi is the only african country without any case of corona virus. When the minister of health was asked about the secret behind the zero case of COVID-19. This is what he had to said ""it is very simple. We don't have the testing kits"" Copied",,,,1243978744894763008,https://twitter.com/amhusreey/status/1243978744894763008
2020-03-28 19:10:15,MsJazzybelle,,4,12,35,"Now if she decided to work that corona floor, got sick and died, guess what? That hospital is not covering her funeral costs or taking care of her children. Fck these jobs.",,,,1243978729841401858,https://twitter.com/MsJazzybelle/status/1243978729841401858
2020-03-28 19:08:50,ShahidaNoumani,,2,23,46,"SHAUOOR Welfare Foumdation ha s established Corona Fund. We are listing poor workers and people who are affected greatly by the lockdown. Do contribute. 4000 per package. We have to become nation in these difficult times. Whatsapp 03362331355 pic.twitter.com/74cZMF9U0L",,,,1243978372184670211,https://twitter.com/ShahidaNoumani/status/1243978372184670211
2020-03-28 19:08:30,philpotrm17,,1,11,79,"Words I could live without after 2020: •quarantine •covid-19 •social distancing •bored •corona virus •postponed •canceled",,,,1243978286906183680,https://twitter.com/philpotrm17/status/1243978286906183680
2020-03-28 19:06:47,Matthijs85,,3,14,26,"Because of Trump rather telling fairytales than actually taking action against the pandemic The US has become the new epicenter of the Corona Crisis with thousands of deads as a result and counting.. #TrumpLiedPeopleDied #TrumpPlaguepic.twitter.com/TqLmTv02xh",,,#TrumpLiedPeopleDied #TrumpPlaguepic,1243977856146976774,https://twitter.com/Matthijs85/status/1243977856146976774
2020-03-28 19:06:16,AriannaDantone,,3,7,223,"The only good thing that's come from corona is that I can get pitchers of margaritas delivered for $40 lol",,,,1243977726974922752,https://twitter.com/AriannaDantone/status/1243977726974922752
2020-03-28 19:05:52,maddy_b55,,16,42,157,"Corona is more important than the child you want to kill growing inside of you. Stop having unsafe sex and killing a human in result of your bad choices. personally i think abortion clinics should stay closed indefinitely. #ProLife #coronavirus",,,#ProLife #coronavirus,1243977627251212289,https://twitter.com/maddy_b55/status/1243977627251212289
2020-03-28 19:05:22,AtulPur31516195,,0,25,49,"#AkshayKumar takes big initiative, will give Rs 25 crores amid Corona crisis. #Coronavirus We love u @akshaykumar sirpic.twitter.com/3EeaYh5Zea",,@akshaykumar,#AkshayKumar #Coronavirus,1243977498418909185,https://twitter.com/AtulPur31516195/status/1243977498418909185
2020-03-28 19:05:17,Rev_says_desu,,19,32,424,"I'm pretty sure getting excited about more corona cases in the US because you can say ""haha Trump bad"" makes you a sociopath just saying...",,,,1243977477984321536,https://twitter.com/Rev_says_desu/status/1243977477984321536
2020-03-28 19:05:12,vlok_andre,,9,7,47,"My favorite game, Corona version pic.twitter.com/jF9V5NgFSs",,,,1243977457532841984,https://twitter.com/vlok_andre/status/1243977457532841984
2020-03-28 19:05:07,AuroraBlogspot,,20,238,366,"Because of the corona crisis, you can now explore the world’s largest collection of works by Vincent van Gogh at home. This collection can be seen on the website of the Van Gogh museum in Amsterdam. https://www.vangoghmuseum.nl/en/search/collection …pic.twitter.com/T3f8IheAlq",,,,1243977437106647041,https://twitter.com/AuroraBlogspot/status/1243977437106647041
2020-03-28 19:04:40,omar_kamal_s,,13,25,79,"We challenge corona pic.twitter.com/ByKITVAV0v",,,,1243977322975449088,https://twitter.com/omar_kamal_s/status/1243977322975449088
2020-03-28 19:04:24,MikkoTainio,FinnairCargo,1,8,62,"Corona or not, logistics don’t stop. Great effort with our customers and our internal team, a lot of optimizing needed to get this one done. More to come in the coming weeks while we already plan our way towards normal times. https://twitter.com/FinnairCargo/status/1243972991530209281 …",,,,1243977256273432578,https://twitter.com/MikkoTainio/status/1243977256273432578
2020-03-28 19:04:09,MissElks,,2,17,95,"Corona, sis, can u leave us alone pic.twitter.com/ItL5ldbL6M",,,,1243977193174306817,https://twitter.com/MissElks/status/1243977193174306817
2020-03-28 19:04:02,TunoiAustin,,2,11,48,"People that are owing people money should please take this Corona virus precautions more serious!! Use your masks and sanitizers or just stay at home! We don't want you to die with our money please",,,,1243977165491896320,https://twitter.com/TunoiAustin/status/1243977165491896320
2020-03-28 19:03:42,meettherichard,,2,11,50,"The world Isn’t coming to an end as y’all say. Corona or not. Asteroid or not. No man knoweth when the Son of Man shall come. He’ll appear like a thief in the night.",,,,1243977081345716224,https://twitter.com/meettherichard/status/1243977081345716224
2020-03-28 19:02:08,guptasoh,,6,93,113,"And Kejriwal ran Kapashera/Gurgaon-Anand Vihar/Ghaziabad buses, running entire breadth of Delhi in a lockdown. For what? To exactly expel lacs of families from Delhi coz they are non-voters. If Corona spreads now, who is responsible ?? #ArrestKejriwalpic.twitter.com/7Fo8k7qyn3",,,#ArrestKejriwalpic,1243976686380580871,https://twitter.com/guptasoh/status/1243976686380580871
2020-03-28 19:01:19,the_ironsheik,THETOMMYDREAMER,44,273,1975,"TOMMY BUBBA YOU KNOW EXACTLY WHAT YOU TALK ABOUT. YOU SAID IT PERFECT. I BREAK THE CORONA AND INTERNET BACK AT THE SAME TIME. https://twitter.com/THETOMMYDREAMER/status/1243972503044792320 …",,,,1243976481178619907,https://twitter.com/the_ironsheik/status/1243976481178619907
2020-03-28 19:01:16,nayeliahnayee,,0,37,96,"Dear Corona Virus, i want my life back.",,,,1243976468859744259,https://twitter.com/nayeliahnayee/status/1243976468859744259
