date,username,to,replies,retweets,favorites,text,geo,mentions,hashtags,id,permalink
2020-04-10 16:14:54,thefortunesoc,,0,17,17,"Call @NYGovCuomo & @GavinNewsom on behalf of thousands of incarcerated NYers and Californians who are vulnerable to #COVID19. Prisons and jails are no place to quarantine or protect people from this pandemic. #LetThemGo #ClemencyCoast2Coastpic.twitter.com/8HJGv15IJN",,@NYGovCuomo @GavinNewsom,#COVID19 #LetThemGo #ClemencyCoast2Coastpic,1248645643251388417,https://twitter.com/thefortunesoc/status/1248645643251388417
2020-04-10 16:11:56,jessemckinley,,9,28,110,"""We believe the projection would have hit our model,"" @NYGovCuomo says, without the measures the state took, including shutdowns.",,@NYGovCuomo,,1248644897546084352,https://twitter.com/jessemckinley/status/1248644897546084352
2020-04-10 16:11:31,RAPPcampaign,,0,44,71,"Our director, Jose Saldana, joining the movement to call on @NYGovCuomo & @GavinNewsom to grant #ClemencyCoast2Coast in the wake of #COVID19. Jose spent 38 years in prison, and from the moment he came home he has been advocating for those he left behind. Gov. Cuomo, #LetThemGo! pic.twitter.com/HJgp6ZTRVG",,@NYGovCuomo @GavinNewsom,#ClemencyCoast2Coast #COVID19 #LetThemGo,1248644789995790336,https://twitter.com/RAPPcampaign/status/1248644789995790336
2020-04-10 16:10:15,tiffany_caban,survivepunishNY,0,7,14,"Survivors of violence and allies are calling on @NYGovCuomo to use his clemency powers. Join the candle-lighting vigil & phone bank on Friday April 10th at 6pm —> http://bit.ly/FTA4PHCandleVigil …https://twitter.com/survivepunishNY/status/1248298638163324929 …",,@NYGovCuomo,,1248644470347874307,https://twitter.com/tiffany_caban/status/1248644470347874307
2020-04-10 16:10:04,ZackFinkNews,,4,9,25,". @jessemckinley asks @NYGovCuomo if his credibility has been harmed by projections of needed hospital beds in New York for #coronavirus crisis being so inflated. Cuomo says, “you hope for the best, and prepare for the worst. That is my job.” Cuomo says he relied on experts.",,@jessemckinley @NYGovCuomo,#coronavirus,1248644427352084481,https://twitter.com/ZackFinkNews/status/1248644427352084481
2020-04-10 16:09:24,MaggieWalkerDev,,0,10,20,"""So far @NYGovCuomo & @GavinNewsom have chosen only to release people convicted of non-violent, low-level offenses & others for parole violations. That's not enough! Everyone behind bars is vulnerable to #COVID19. #ClemencyCoast2Coast must include them all!pic.twitter.com/3YPkNK1SsX",,@NYGovCuomo @GavinNewsom,#COVID19 #ClemencyCoast2Coast,1248644260020314113,https://twitter.com/MaggieWalkerDev/status/1248644260020314113
2020-04-10 16:09:22,bern_hogan,,4,8,8,". @jessemckinley asks @NYGovCuomo if he fears losing credibility for relying on incorrect models projecting the scale of #coronavirus outbreak. He says no. He defends the federal government: ""Let's not get into the blame game."" ""These are all uncharted waters.""",,@jessemckinley @NYGovCuomo,#coronavirus,1248644248527933442,https://twitter.com/bern_hogan/status/1248644248527933442
2020-04-10 16:08:18,DeeTwoCents,,15,75,409,"How dare a reporter ask @NYGovCuomo about his credibility and no one ever ask that of the president who fucking lies for a living! Are you kidding me?! #WokeAF",,@NYGovCuomo,#WokeAF,1248643980679618561,https://twitter.com/DeeTwoCents/status/1248643980679618561
2020-04-10 16:07:41,antiviolence,,0,9,10,"As an org which serves LGBTQ survivors of IPV, we condemn rollbacks of bail laws by @NYGovCuomo @NYSenDems @NYSA_Majority, which will put thousands + in jail, including LGBTQ survivors like #LayleenPolanco, who died @Rikers nearly 1 yr agohttps://avp.org/avp-opposes-new-york-states-bail-rollbacks/ …",,@NYGovCuomo @NYSenDems @NYSA_Majority @Rikers,#LayleenPolanco,1248643825800790017,https://twitter.com/antiviolence/status/1248643825800790017
2020-04-10 16:05:14,mama_c2,NYGovCuomo,3,3,21,"Thank you for being the voice of reason and intelligence—which are both absent in the current White House.",,,,1248643207572983808,https://twitter.com/mama_c2/status/1248643207572983808
2020-04-10 16:04:25,bridget123goooo,,2,14,16,"@NYGovCuomo just asked, “How did we get here? Before we can go back to work, we need to find that out.” He wants to use the Defensive Act to ramp up testing, antibody testing. We’ll see what tRump says/does. #COVID19 #NYTough #wtpTEAMpic.twitter.com/Q1dGG2wNvH",,@NYGovCuomo,#COVID19 #NYTough #wtpTEAMpic,1248643005948538881,https://twitter.com/bridget123goooo/status/1248643005948538881
2020-04-10 16:04:18,N_y_d_d,NYGovCuomo,2,4,31,"I just hope this applies to EVERYONE you designated as an Essential worker. They’re all risking their lives every day to keep parts of our society and economy alive. Especially package delivery workers, grocery store workers, etc.",,,,1248642976311652352,https://twitter.com/N_y_d_d/status/1248642976311652352
2020-04-10 16:03:32,DYoffee,NYGovCuomo,37,14,234,"NY should not reopen until every New Yorker has been tested for the Coronavirus,otherwise we will be spinning our wheels for months after this !",,,,1248642783470145536,https://twitter.com/DYoffee/status/1248642783470145536
2020-04-10 16:03:28,txquila1,NYGovCuomo,1,3,13,"America listen to Cuomo not trump",,,,1248642766365736961,https://twitter.com/txquila1/status/1248642766365736961
2020-04-10 16:02:41,cnnbrk,,153,226,1015,"New York Gov. Cuomo says he's ""cautiously optimistic"" that the state's coronavirus infection rate is slowing, with 777 confirmed deaths Thursday, down from 799 the day before https://cnn.it/2wxWlE0 pic.twitter.com/L2x1mCg0KL",,,,1248642569027948550,https://twitter.com/cnnbrk/status/1248642569027948550
2020-04-10 16:02:39,SeeFisch,,3,2,36,"20-25 deaths a day at our place of #covid19 . three of my own dead in Zero sign of a national coordinated response. @NYGovCuomo Very grateful for the forceful and principled support of Andrew Cuomo. We are the epicenter of world pandemic.",,@NYGovCuomo,#covid19,1248642559427166210,https://twitter.com/SeeFisch/status/1248642559427166210
2020-04-10 16:01:25,CamRasNYC,,0,17,27,"I am joining the movement to call on @NYGovCuomo and @GavinNewsom to grant #ClemencyNow and other releases to elders and others vulnerable to #COVID19. This is a public health crisis and it is beyond time to #LetThemGo! #ClemencyCoast2Coastpic.twitter.com/84r7Egq0Lv",,@NYGovCuomo @GavinNewsom,#ClemencyNow #COVID19 #LetThemGo #ClemencyCoast2Coastpic,1248642250118246400,https://twitter.com/CamRasNYC/status/1248642250118246400
2020-04-10 15:59:57,NYGovCuomo,,1196,9619,49445,"Reopening NYS will be a gradual process and it all comes down to testing. We developed an antibody test but we need the Federal Government to help. They must use the Defense Production Act to rapidly scale up testing. If I could – I would.",,,,1248641879064936448,https://twitter.com/NYGovCuomo/status/1248641879064936448
2020-04-10 15:59:43,NewsRadio930,,9,7,25,"The 1918 flu epidemic lasted 10 months, and the second wave was worse than the first, says @NYGovCuomo. He wants the nation to be more prepared, study the waters and proceed with caution.",,@NYGovCuomo,,1248641821690998787,https://twitter.com/NewsRadio930/status/1248641821690998787
2020-04-10 15:58:50,lauferlaw,,36,171,1326,". @NYGovCuomo is awesome. Serious, candid, confident leadership.",,@NYGovCuomo,,1248641599409737730,https://twitter.com/lauferlaw/status/1248641599409737730
2020-04-10 15:57:54,jessemckinley,,2,12,24,". @NYGovCuomo talking about 1918 flu epidemic and its three peaks. He's warning against complacency and a second wave.",,@NYGovCuomo,,1248641364176392192,https://twitter.com/jessemckinley/status/1248641364176392192
2020-04-10 15:57:37,alexkellyhansen,,0,20,23,"TAKE ACTION: I am calling on @NYGovCuomo and @GavinNewsom to grant #ClemencyNow to elders and others vulnerable to #COVID19. We will not stop demanding #ClemencyCoast2Coast until our loved ones are home and safe. #LetThemGo @RAPPcampaign @CURBprisons @c_c_w_p @paroleprepnypic.twitter.com/SuJrzBk8ib",,@NYGovCuomo @GavinNewsom @RAPPcampaign @CURBprisons @c_c_w_p @paroleprepnypic,#ClemencyNow #COVID19 #ClemencyCoast2Coast #LetThemGo,1248641291493224450,https://twitter.com/alexkellyhansen/status/1248641291493224450
2020-04-10 15:57:12,JelonekMarv,NYGovCuomo,1,5,41,"Gov Cuomo, Believe it or not. You sir are doing a fantastic job. Just think. How much better YOU would be doing if the federal government had their act together!!! God bless you and your family. I live in Illinois. Thank you and God bless your work!",,,,1248641186446925825,https://twitter.com/JelonekMarv/status/1248641186446925825
2020-04-10 15:57:04,CURBprisons,NYGovCuomo,0,11,16,"We’re all waiting for you to be a hero @NYGovCuomo and provide assistance by granting clemencies to people locked up in your prisons who are most vulnerable to #COVID19 #ClemencyNow #LetThemGo #ClemencyCoast2Coasthttps://twitter.com/NYGovCuomo/status/1248640191423746048 …",,@NYGovCuomo,#COVID19 #ClemencyNow #LetThemGo #ClemencyCoast2Coasthttps,1248641155069145088,https://twitter.com/CURBprisons/status/1248641155069145088
2020-04-10 15:56:09,montaga,,296,2169,4884,"This goes out to all you DirtyLibs & Rino’s that are globalist . @govmurphy . @nygovcuomo You won’t be in Power Long! pic.twitter.com/X7E0axAXK5",,@govmurphy @nygovcuomo,,1248640925510684672,https://twitter.com/montaga/status/1248640925510684672
2020-04-10 15:55:42,montyl713,Yamiche,1,5,23,"“If I had a Defense Protection Act in New York I would use it.” - Governor Cuomo, speaking about testing. Shade!",,,,1248640811262193667,https://twitter.com/montyl713/status/1248640811262193667
2020-04-10 15:54:48,NBCLatino,,2,41,49,"NEW: Hit the hardest by coronavirus deaths, Latinos in New York City now mourn together By @Nicolemarie_A with @NYPDShea @NYPD72Pct @NYGovCuomo @HavidanUAlbany @PS9BklynPTO @ualbany @NYCMayor @TWULocal100 +more.https://www.nbcnews.com/news/latino/hit-hardest-coronavirus-deaths-ny-latinos-now-mourn-together-n1180836 …",,@Nicolemarie_A @NYPDShea @NYPD72Pct @NYGovCuomo @HavidanUAlbany @PS9BklynPTO @ualbany @NYCMayor @TWULocal100,,1248640583381508096,https://twitter.com/NBCLatino/status/1248640583381508096
2020-04-10 15:54:17,JumaaneWilliams,ZackFinkNews,12,69,228,"This is the BS that causes harm. We know what happened. We have a Mayor who moved 2 slowly if at all We have @NYGovCuomo who asked for & received unprecedented powers & also refused bold action except 4 cutting medicaid There's a price for #COVID19 inaction, it's now unfoldinghttps://twitter.com/ZackFinkNews/status/1248587083607879680 …",,@NYGovCuomo,#COVID19,1248640454498885632,https://twitter.com/JumaaneWilliams/status/1248640454498885632
2020-04-10 15:54:15,DCJohnNorton,Yamiche,0,9,53,"This is obvious and for Trump to not understand it shows how incompetent he is.",,,,1248640444575211520,https://twitter.com/DCJohnNorton/status/1248640444575211520
2020-04-10 15:53:30,mbendernyc,,0,29,19,"Cuomo says prior to reopening businesses in NY state, NY needs the federal govt to assist with production of COVID tests at scale. Private companies alone not enough. @NYGovCuomo: “If I had a Defense Production Act [at the state level], I would use it. #PressConference #COVID19",,@NYGovCuomo,#PressConference #COVID19,1248640258801049600,https://twitter.com/mbendernyc/status/1248640258801049600
2020-04-10 15:53:14,NYGovCuomo,,231,1573,10091,"Saying thanks is nice. Providing assistance is better. I’m working with NY's Congressional delegation to create a ""COVID-19 Heroes Compensation Fund"" to support frontline workers and their families. Just as Congress did after 9/11, we need to support our heroes once again.",,,,1248640191423746048,https://twitter.com/NYGovCuomo/status/1248640191423746048
2020-04-10 15:52:42,Yamiche,,208,1794,6698,"A day after Pres Trump said national testing system is not needed to re-open, @NYGovCuomo says testing will be ""key"" to that. He says: ""It's going to be reliant on testing, testing of antibodies, testing for diagnostic results. Testing on a scale that we have not done before.""",,@NYGovCuomo,,1248640055230500871,https://twitter.com/Yamiche/status/1248640055230500871
2020-04-10 15:51:00,patkiernan,,2,2,25,"At daily briefing @NYGovCuomo focuses on testing as the “key to reopening” the economy. Calls on federal government to use Defense Production Act to mass produce testing equipment and reagents. pic.twitter.com/tGGtoNMoUV",,@NYGovCuomo,,1248639626300084226,https://twitter.com/patkiernan/status/1248639626300084226
2020-04-10 15:50:07,andrewsiff4NY,,3,11,16,". @NYGovCuomo — State lab can do 300 antibody tests per day. In two weeks they’ll be up to 2,000 per day. But he admits it’s “a drop in the bucket” and not nearly enough. #coronavirus #nbc4nypic.twitter.com/XTmg2eQcJj",,@NYGovCuomo,#coronavirus #nbc4nypic,1248639406216491008,https://twitter.com/andrewsiff4NY/status/1248639406216491008
2020-04-10 15:50:03,PeggyMaysonet,,14,4,96,"Me watching Gov Coco giving a news brief. @NYGovCuomo pic.twitter.com/wyxncSdxsI",,@NYGovCuomo,,1248639389753839616,https://twitter.com/PeggyMaysonet/status/1248639389753839616
2020-04-10 15:49:35,thetinyraccoon,,1,22,17,"Since the outbreak of #COVID19, @GavinNewsom has granted only 21 clemencies and @NYGovCuomo has granted ZERO. 21 combined clemencies for two states with 166K people in prison isn’t enough. We need bold, sweeping action NOW to prevent more COVID-19 deaths. #ClemencyCoast2Coastpic.twitter.com/TsDl8jxNTS",,@GavinNewsom @NYGovCuomo,#COVID19 #ClemencyCoast2Coastpic,1248639273034711042,https://twitter.com/thetinyraccoon/status/1248639273034711042
2020-04-10 15:49:23,bern_hogan,,4,38,90,"NEW: NYS Department of Health is ramping up antibody tests. -300 tests a day capacity right now -1000 tests by next Friday -2000 tests the following week “Thats great that sounds like a lot but that’s a drop in the bucket,"" @NYGovCuomo says.",,@NYGovCuomo,,1248639222426279936,https://twitter.com/bern_hogan/status/1248639222426279936
2020-04-10 15:48:20,cspan,,5,19,22,". @NYGovCuomo Coronavirus News Briefing - LIVE online here: https://cs.pn/2RvHuBk pic.twitter.com/II5ovDP0cU",,@NYGovCuomo,,1248638957728026627,https://twitter.com/cspan/status/1248638957728026627
2020-04-10 15:47:51,SteveFromPhilly,AngelaBelcamino,4,15,516,"A real NYer too.",,,,1248638836286132224,https://twitter.com/SteveFromPhilly/status/1248638836286132224
2020-04-10 15:47:09,Nvr4Get91101,,5,12,49,"Almost 3000 people were murdered by being choked to death, burned to death or crushed to death for all the world to see, all within a few hours, in one day. Please stop belittling and comparing 9/11 to anything @NYGovCuomo. K. Thx.",,@NYGovCuomo,,1248638657839411200,https://twitter.com/Nvr4Get91101/status/1248638657839411200
2020-04-10 15:47:06,AngelaBelcamino,realDonaldTrump,160,189,3288,"Shhh... a real leader @NYGovCuomo is talking.",,@NYGovCuomo,,1248638645814341633,https://twitter.com/AngelaBelcamino/status/1248638645814341633
2020-04-10 15:46:14,NYGovCuomo,,215,1807,9227,"No one should go hungry because of this pandemic. NYS will provide $200 million in emergency food assistance to more than 700K low-income households enrolled in SNAP. Food is a very real issue for many families.",,,,1248638429467992067,https://twitter.com/NYGovCuomo/status/1248638429467992067
2020-04-10 15:46:04,ShellenbergerMD,,3,33,82,"The effort to close Indian Point nuclear plant is, literally, corrupt It included bribery by a natural gas company of top aides to @NYGovCuomo pic.twitter.com/kMulKqFIBm",,@NYGovCuomo,,1248638385557655552,https://twitter.com/ShellenbergerMD/status/1248638385557655552
2020-04-10 15:45:26,jessemckinley,,0,10,30,"NEW: @NYGovCuomo calling for ""heroes compensation fund"" for #COVID19 front line workers.",,@NYGovCuomo,#COVID19,1248638227579310083,https://twitter.com/jessemckinley/status/1248638227579310083
2020-04-10 15:44:36,hwinkler4real,,12,18,244,"@NYGovCuomo THANK YOU for your calm , humanity and leadership",,@NYGovCuomo,,1248638018417639426,https://twitter.com/hwinkler4real/status/1248638018417639426
2020-04-10 15:44:05,ShellenbergerMD,,7,46,93,"Indian Point is 23% of New York’s emissions-free electricity @NYGovCuomo is shutting it down because “environmentalists” including @AOC @NRDC @SierraClub @EnvDefenseFund want him to They promote renewables to greenwash their pro-pollution agendapic.twitter.com/s0byTgtkiX",,@NYGovCuomo @AOC @NRDC @SierraClub @EnvDefenseFund,,1248637888037707776,https://twitter.com/ShellenbergerMD/status/1248637888037707776
2020-04-10 15:43:47,NYGovCuomo,,347,2013,13745,"We continue to endure great pain as we lost 777 New Yorkers yesterday. We feel this loss deeply as a state, community and New York family. It is a terrible, heartbreaking loss.",,,,1248637810212515841,https://twitter.com/NYGovCuomo/status/1248637810212515841
2020-04-10 15:42:12,Tom_Winter,,130,605,2018,"NEW: 777 more people have been reported dead as a result of COVID-19 pandemic in New York State, Gov. Andrew Cuomo says. The state’s death total is now 7,844. He says there’s been a dramatic decline in hospitalization growth rates. There were 17 FEWER people in ICUs yesterday",,,,1248637413997469697,https://twitter.com/Tom_Winter/status/1248637413997469697
2020-04-10 15:41:51,gabegutierrez,,9,28,208,". @NYGovCuomo says actual curve is ""much"" lower than projected He cites policies put in place, and compliance from public",,@NYGovCuomo,,1248637324256260102,https://twitter.com/gabegutierrez/status/1248637324256260102
2020-04-10 15:41:45,jessemckinley,,7,17,32,"NEW: ""The actual curve is much much lower than any of them projected,"" @NYGovCuomo. Actual hospitalizations stand 18,569; some projections had up to 136,000 beds needed.",,@NYGovCuomo,,1248637301711933443,https://twitter.com/jessemckinley/status/1248637301711933443
2020-04-10 15:41:16,WRALLena,,11,117,496,"NEW: @NYGovCuomo announces ICU admissions are in the *negative* today for the first time. Three day average of total hospitalizations is also down; same with intubations. However, 777 people have died since yesterday. Total deaths: 7,844. Very sad. #coronavirus #wralpic.twitter.com/XhVSGsemvX",,@NYGovCuomo,#coronavirus #wralpic,1248637178168606722,https://twitter.com/WRALLena/status/1248637178168606722
2020-04-10 15:40:28,fwaction,,1,18,26,"New York state has been hit hard by the COVID-19 pandemic, so why hasn't @NYGovCuomo stopped water shutoffs? Everyone needs access to water to wash their hands and stop the spread of the virus. pic.twitter.com/h2uZ2JZydc",,@NYGovCuomo,,1248636976669982723,https://twitter.com/fwaction/status/1248636976669982723
2020-04-10 15:40:17,AngelGotti5,,171,571,1017,"Excuse me, @NYGovCuomo my Daughter’s friend’s Grandma died yesterday NOT from Coronavirus but she is listed as dying from CoronavirusWhat’s that about???",,@NYGovCuomo,,1248636929979138054,https://twitter.com/AngelGotti5/status/1248636929979138054
2020-04-10 15:38:50,NYGovCuomo,,210,1291,9568,"We are cautiously optimistic that we are slowing the spread. The change in daily ICU admissions was a negative number for the first time (-17). That means there were fewer people in ICU units statewide yesterday than there were on the previous day.",,,,1248636566014234627,https://twitter.com/NYGovCuomo/status/1248636566014234627
2020-04-10 15:38:03,TweetBenMax,,2,17,50,"Wow - big: @NYGovCuomo announces first day of net drop in ICU admissions since the coronavirus crisis became acute.",,@NYGovCuomo,,1248636368168849409,https://twitter.com/TweetBenMax/status/1248636368168849409
2020-04-10 15:38:02,LouiseMensch,NYGovCuomo,22,73,325,"BREAKING: @NYGovCuomo says ICU admissions in New York are “a negative number for the first time”. Meaning instead of the rate of increase slowing, Coronavirus admissions are actually dropping. https://twitter.com/NYGovCuomo/status/1248635467769118721 …",,@NYGovCuomo,,1248636364427591682,https://twitter.com/LouiseMensch/status/1248636364427591682
2020-04-10 15:37:11,gabegutierrez,,7,26,115,"Wow. ICU admissions today in NY is a negative number for the first time, says @NYGovCuomo",,@NYGovCuomo,,1248636149029101568,https://twitter.com/gabegutierrez/status/1248636149029101568
2020-04-10 15:36:45,dsaronowitz,NYGovCuomo,3,13,52,"Thank you @NYGovCuomo for being the leader NY needs in the absence of a functional @realDonaldTrump",,@NYGovCuomo @realDonaldTrump,,1248636039700283395,https://twitter.com/dsaronowitz/status/1248636039700283395
2020-04-10 15:35:00,meltanissa,,1,23,22,"TAKE ACTION: I am calling on @NYGovCuomo and @GavinNewsom to grant #ClemencyNow to elders and others vulnerable to #COVID19. We will not stop demanding #ClemencyCoast2Coast until our loved ones are home and safe. #LetThemGo @RAPPcampaign @CURBprisons @c_c_w_p @paroleprepnypic.twitter.com/iATMlG7Vbk",,@NYGovCuomo @GavinNewsom @RAPPcampaign @CURBprisons @c_c_w_p @paroleprepnypic,#ClemencyNow #COVID19 #ClemencyCoast2Coast #LetThemGo,1248635600128708608,https://twitter.com/meltanissa/status/1248635600128708608
2020-04-10 15:34:53,snidelines,,0,12,11,"@NYGovCuomo ONCE MORE WITH FEELING! You can prevent the deaths of thousands in prison. We demand: you release incarcerated people vulnerable to COVID-19 NOW. #NoMoreDeaths and #ClemencyNow #ClemencyCoast2Coastpic.twitter.com/VJ5cQBG659",,@NYGovCuomo,#NoMoreDeaths #ClemencyNow #ClemencyCoast2Coastpic,1248635570873647104,https://twitter.com/snidelines/status/1248635570873647104
2020-04-10 15:34:28,NYGovCuomo,,203,536,1712,"Holding a briefing with updates on #Coronavirus. WATCH LIVE:https://www.pscp.tv/w/cV84BDIyNjcxMDN8MU95SkFZZFFwT05KYr5O8b2PC2JfwldZ1MSyd0oZfday-xA3KYHIeRJORTHS …",,,#Coronavirus,1248635467769118721,https://twitter.com/NYGovCuomo/status/1248635467769118721
2020-04-10 15:33:24,laurawhitehorn,,6,54,82,"Way past time 4 @NYGovCuomo 2 release incarcerated elders & others vulnerable to coronavirus. What kind of person refuses to pick up a pen to save lives?? #ClemencyNow #ClemencyCoast2Coast Base release decisions on public health, not criminal Injustice. @RAPPcampaign @CURBprisonspic.twitter.com/13nyqYcyl8",,@NYGovCuomo @RAPPcampaign @CURBprisonspic,#ClemencyNow #ClemencyCoast2Coast,1248635200545918977,https://twitter.com/laurawhitehorn/status/1248635200545918977
2020-04-10 15:33:09,MSNBC,,136,340,1153,"NY Gov. Cuomo says President Trump should use the Defense Production Act to streamline coronavirus testing. ""Leaving it to the states is a slower, less uniform, less affective process."" https://on.msnbc.com/3b03iwC",,,,1248635135953719298,https://twitter.com/MSNBC/status/1248635135953719298
2020-04-10 15:32:14,StJamesMaxwell,LouiseMensch,2,2,34,"Not only that, Cuomo was the first major endorsement Biden received! This is crap",,,,1248634906562920453,https://twitter.com/StJamesMaxwell/status/1248634906562920453
2020-04-10 15:30:21,lenaweinstein,,0,8,7,"Outside of clemencies @NYGovCuomo & @GavinNewsom have used their power to only release people convicted of “non-violent”, low-level offenses and others for parole violations. These releases are good but not enough. #ClemencyCoast2Coast must include everyone vulnerable to #COVID19pic.twitter.com/l3c9wPa2PH",,@NYGovCuomo @GavinNewsom,#ClemencyCoast2Coast #COVID19pic,1248634432149487633,https://twitter.com/lenaweinstein/status/1248634432149487633
2020-04-10 15:30:00,RAPPcampaign,,0,10,14,"Since the outbreak of #COVID19, @NYGovCuomo still has granted ZERO clemencies. With over 43,000 people incarcerated in New York State prisons, we need bold, sweeping action NOW to prevent more COVID-19 deaths. #ClemencyCoast2Coast #GovernorAndrewCuomopic.twitter.com/HXQ22ZirEv",,@NYGovCuomo,#COVID19 #ClemencyCoast2Coast #GovernorAndrewCuomopic,1248634341837557760,https://twitter.com/RAPPcampaign/status/1248634341837557760
2020-04-10 15:28:27,co_rapunzel4,,2,13,45,"I’m starting to appreciate things much more, like a hot shower, a steaming cup of coffee, a late night chat with my teen, and @NYGovCuomo. But, I sure wish we had a President to lead us through this pandemic, like @BarackObama or @HillaryClinton. #TrumpIsALoser #TrumpVirus",,@NYGovCuomo @BarackObama @HillaryClinton,#TrumpIsALoser #TrumpVirus,1248633954795749376,https://twitter.com/co_rapunzel4/status/1248633954795749376
2020-04-10 15:27:04,RAPPcampaign,,0,15,15,". @NYGovCuomo is set to deliver his #Coronavirus news briefing at 11:30AM. Here are the updates: NY's prison system has more COVID19 cases than any other state prison system in the entire country. Yet @NYGovCuomo has granted ZERO clemencies. We hope Capitol press will ask him why. pic.twitter.com/fHVZDoV68Y",,@NYGovCuomo @NYGovCuomo,#Coronavirus,1248633603665387527,https://twitter.com/RAPPcampaign/status/1248633603665387527
2020-04-10 15:26:00,LouiseMensch,ChrisDJackson,10,27,280,"@NYGovCuomo endorsed @JoeBiden and spoke warmly of him in pressers. I won’t give this oxygen",,@NYGovCuomo @JoeBiden,,1248633334470672385,https://twitter.com/LouiseMensch/status/1248633334470672385
2020-04-10 15:25:41,ImLookgBackAtU,,2,9,14,"So, what is the deal with HART ISLAND in NYC? Supposedly 25 bodies are buried there any given week but now it's almost daily. I want to hear @NYGovCuomo talk about this in his one of his lengthy updates! #MassgraveNYChttps://bit.ly/2y1jtuW",,@NYGovCuomo,#MassgraveNYChttps,1248633257480065024,https://twitter.com/ImLookgBackAtU/status/1248633257480065024
2020-04-10 15:23:16,AlexAtFWW,,0,9,10,"Would be great if someone asked @NYGovCuomo why he won't stop water shutoffs in the midst of the pandemic. Pretty hard to wash your hands without running water. @jessemckinley @m_jfrench @ZachReportspic.twitter.com/CwSLNdwe8J",,@NYGovCuomo @jessemckinley @m_jfrench @ZachReportspic,,1248632647364026368,https://twitter.com/AlexAtFWW/status/1248632647364026368
