date,username,to,replies,retweets,favorites,text,geo,mentions,hashtags,id,permalink
2020-04-10 22:47:40,blackboikei,,1,12,47,"lit a candle today in support of @freethemall2020 and in honor of people killed by @NYGovCuomo and @NYCMayor by incarceration. will you join us? #FreeThemAll4PublicHealth #freesurviorspic.twitter.com/WHKNgHGwd7",,@freethemall2020 @NYGovCuomo @NYCMayor,#FreeThemAll4PublicHealth #freesurviorspic,1248744487049887758,https://twitter.com/blackboikei/status/1248744487049887758
2020-04-10 22:44:06,ImaniBrown20,,0,5,21,"Improvising a candle in support of #FreeThemAll4PublicHealth. It is completely within @NYGovCuomo and @NYCMayor’s power to free people from prisons and jails in the midst of this outbreak. Will you light a candle with me?pic.twitter.com/GorqaXoPHr",,@NYGovCuomo @NYCMayor,#FreeThemAll4PublicHealth,1248743587011072000,https://twitter.com/ImaniBrown20/status/1248743587011072000
2020-04-10 22:41:27,colinasher,,0,9,45,"My partner and I lit a candle in solidarity with those who are trapped behind bars during this public health crisis. Please join us, and so many others, in demanding @NYGovCuomo #FreeThemAll4PublicHealth NOW. #FreeThemAllpic.twitter.com/xHsDtdtmq2",,@NYGovCuomo,#FreeThemAll4PublicHealth #FreeThemAllpic,1248742920393576448,https://twitter.com/colinasher/status/1248742920393576448
2020-04-10 22:38:29,calexity,,0,4,20,"Lighting a candle to call on @NYGovCuomo and @GavinNewsom to free those who are incarcerated for their health and ours #FreeThemAll4PublicHealth #ClemencyCoast2Coastpic.twitter.com/FIagevpQy1",,@NYGovCuomo @GavinNewsom,#FreeThemAll4PublicHealth #ClemencyCoast2Coastpic,1248742174985867265,https://twitter.com/calexity/status/1248742174985867265
2020-04-10 22:36:31,JoshRPetersen,,0,15,30,"TAKE ACTION: I’m calling on @NYGovCuomo and @GavinNewsom to grant #ClemencyNow and #ClemencyCoast2Coast to release elders and vulnerable from prison. Failure to do so fails to protect human rights to life and health. @RAPPcampaign #LetThemGopic.twitter.com/uDa9JOWQPG",,@NYGovCuomo @GavinNewsom @RAPPcampaign,#ClemencyNow #ClemencyCoast2Coast #LetThemGopic,1248741679378640900,https://twitter.com/JoshRPetersen/status/1248741679378640900
2020-04-10 22:31:51,aj_joven,,2,18,57,"I lit a candle in solidarity of all those incarcerated and hoping that @NYGovCuomo and the gov in my states - @GavinNewsom - choose to #FreeThemAll4PublicHealth.pic.twitter.com/NK2jI57vBk",,@NYGovCuomo @GavinNewsom,#FreeThemAll4PublicHealth,1248740503140487168,https://twitter.com/aj_joven/status/1248740503140487168
2020-04-10 22:27:11,SultanReina,,0,12,36,"It’s well past time for @NYGovCuomo and @NYCMayor to empty the prisons and jails. Even my cats know people don’t belong in cages. #FreeThemAll4PublicHealthpic.twitter.com/dE6BDPJtwQ",,@NYGovCuomo @NYCMayor,#FreeThemAll4PublicHealthpic,1248739331902181377,https://twitter.com/SultanReina/status/1248739331902181377
2020-04-10 22:23:55,RAPPcampaign,,0,13,20,"TAKE ACTION: I am joining the movement to call on @NYGovCuomo and @GavinNewsom to grant #ClemencyNow and other releases to elders and others vulnerable to #COVID19. This is a public health crisis and it is beyond time to #LetThemGo! #ClemencyCoast2Coastpic.twitter.com/u1MxD9mVBA",,@NYGovCuomo @GavinNewsom,#ClemencyNow #COVID19 #LetThemGo #ClemencyCoast2Coastpic,1248738507423703040,https://twitter.com/RAPPcampaign/status/1248738507423703040
2020-04-10 22:22:51,Ali_Najmi,SarahGoat,5,14,50,"Respectfully, @NYGovCuomo should reconsider the need for any online application. @BOENYC should mail ALL voters an absentee ballot. In the context of a pandemic where everyone has a legitimate reason to vote by absentee, the online application is an unneccessary barrier to votinghttps://twitter.com/SarahGoat/status/1248650673597579268 …",,@NYGovCuomo @BOENYC,,1248738239059496960,https://twitter.com/Ali_Najmi/status/1248738239059496960
2020-04-10 22:22:33,RoxyZech,,1,56,225,"Survivors of violence and allies are calling on @NYGovCuomo to use his clemency powers and #FreeThemAll4PublicHealth. I lit a candle today to stand with this demand. It’s time to release every single person from NYC jails. #PrisonsAreThePandemicpic.twitter.com/39Fl1qrbnP",,@NYGovCuomo,#FreeThemAll4PublicHealth #PrisonsAreThePandemicpic,1248738164778377216,https://twitter.com/RoxyZech/status/1248738164778377216
2020-04-10 22:18:01,cmariavincenty,,5,67,225,"There is no way to socially distance on Rikers. @NYGovCuomo has the power to #FreeThemAll4PublicHealth 91,000 people are behind bars in NY...tonight we light a candle for them all.pic.twitter.com/IGmcVdu58V",,@NYGovCuomo,#FreeThemAll4PublicHealth,1248737024162631680,https://twitter.com/cmariavincenty/status/1248737024162631680
2020-04-10 22:17:49,tinysleuth,,0,23,67,"I’m lighting a candle tonight, sending love to @FreeThemAll2020 @survivepunishNY and those inside jails and prisons. People are scared and under active threat of death. @NYGovCuomo act now & save lives. Prisons don’t keep us safe. #FreeThemAll4PublicHealthpic.twitter.com/cRnvnXXTy6",,@FreeThemAll2020 @survivepunishNY @NYGovCuomo,#FreeThemAll4PublicHealthpic,1248736975089213440,https://twitter.com/tinysleuth/status/1248736975089213440
2020-04-10 22:17:26,melhuman,,7,47,394,"I am lighting a candle for the 91,000 incarcerated people in New York and calling on @NYGovCuomo and @NYCMayor to #FreeThemAll4PublicHealthpic.twitter.com/aDE2V2Px99",,@NYGovCuomo @NYCMayor,#FreeThemAll4PublicHealthpic,1248736877395554305,https://twitter.com/melhuman/status/1248736877395554305
2020-04-10 22:11:32,NML_dc,,0,15,32,"Incarcerated people are at extreme risk of contracting #COVID19. There is no justification for not releasing people. #FreeThemAll4PublicHealth @NYGovCuomo @GovLarryHoganpic.twitter.com/lbXcdnqLVk",,@NYGovCuomo @GovLarryHoganpic,#COVID19 #FreeThemAll4PublicHealth,1248735392985223168,https://twitter.com/NML_dc/status/1248735392985223168
2020-04-10 22:11:22,jaydotkaydot,,1,15,48,"I am lighting this candle in solidarity with all people being held behind bars tonight. @NYGovCuomo @NYCMayor @BrooklynDA I call on you to #FreeThemAll4PublicHealthpic.twitter.com/munXg1Cumv",,@NYGovCuomo @NYCMayor @BrooklynDA,#FreeThemAll4PublicHealthpic,1248735351348367367,https://twitter.com/jaydotkaydot/status/1248735351348367367
2020-04-10 22:08:19,Gozalomadrid,,1,12,39,"We lit this candle in New Orleans to demand that @NYGovCuomo as well as @LouisianaGo use their clemency powers and #FreeThemAll4PublicHealth #ClemencyNow #FreeThemAllpic.twitter.com/319BeTmkX5",,@NYGovCuomo @LouisianaGo,#FreeThemAll4PublicHealth #ClemencyNow #FreeThemAllpic,1248734580825260039,https://twitter.com/Gozalomadrid/status/1248734580825260039
2020-04-10 22:07:50,JossTGreene,,0,20,67,"Today I'm lighting a candle to honor my loved one who is incarcerated in NY state prison. @NYGovCuomo, I call on you to use your clemency powers and #FreeThemAll4PublicHealth. This is a humanitarian crisis-- don't leave our loved ones behind.pic.twitter.com/DvRB4DCGdR",,@NYGovCuomo,#FreeThemAll4PublicHealth,1248734460696240128,https://twitter.com/JossTGreene/status/1248734460696240128
2020-04-10 22:03:57,furuya_liz,,1,15,25,"Calling on @NYGovCuomo to let them go!!! #ClemencyCoast2Coastpic.twitter.com/LrVa5TkDzm",,@NYGovCuomo,#ClemencyCoast2Coastpic,1248733484463595527,https://twitter.com/furuya_liz/status/1248733484463595527
2020-04-10 21:56:55,thoughtlessbeast,,0,20,106,"survivors of domestic violence and allies are urging @NYGovCuomo to use his clemency powers to #FreeThemAll4PublicHealth --pls join me in lighting a candle to support this demand! http://bit.ly/FTA4PHCandles pic.twitter.com/5jnq8klcA2",,@NYGovCuomo,#FreeThemAll4PublicHealth,1248731715377541121,https://twitter.com/thoughtlessbeast/status/1248731715377541121
2020-04-10 21:55:11,vickygener85,linda_wed1,1,21,47,"You are 100% correct I love @NYGovCuomo cuz he’s been a light in all the darkness we are enduring but @JoeBiden is our guy! Cuomo will have his chance when he’s ready!!! pic.twitter.com/5AHLlj3abj",,@NYGovCuomo @JoeBiden,,1248731277647364098,https://twitter.com/vickygener85/status/1248731277647364098
2020-04-10 21:52:43,iamlisako,,1,36,104,"91,000 people are incarcerated in NY jails, prisons, & immigration detention during this pandemic. Lighting candles in solidarity as we call on @NYGovCuomo @NYCMayor @BrooklynDA to act now, save lives & #FreeThemAllForPublicHealth. #ClemencyCoast2Coast #prisonsarethepandemicpic.twitter.com/tkXOgnHVwi",,@NYGovCuomo @NYCMayor @BrooklynDA,#FreeThemAllForPublicHealth #ClemencyCoast2Coast #prisonsarethepandemicpic,1248730658509332487,https://twitter.com/iamlisako/status/1248730658509332487
2020-04-10 21:52:14,calexity,,0,29,47,". @prisonculture is calling for folks to post photos of themselves online holding candles to raise awareness for a mass release of those incarcerated in NY in the interest of public health. Post a photo between 6-7pm ET and tag @NYGovCuomo #FreeThemAll4PublicHealth",,@prisonculture @NYGovCuomo,#FreeThemAll4PublicHealth,1248730533443465216,https://twitter.com/calexity/status/1248730533443465216
2020-04-10 21:48:14,wordsmovethings,,0,13,51,"Today I lit this candle to remember the 90,000 people incarcerated in New York. It's time for @NYGovCuomo to use his clemency powers and #FreeThemAll4PublicHealth. #ClemencyNow #FreeThemAllpic.twitter.com/2rDLWxEWnj",,@NYGovCuomo,#FreeThemAll4PublicHealth #ClemencyNow #FreeThemAllpic,1248729527527841797,https://twitter.com/wordsmovethings/status/1248729527527841797
2020-04-10 21:42:06,lulunavratil,,0,9,18,"Please join me and @survivepunishNY in asking @NYGovCuomo and @NYCMayor to immediately #FreeThemAll4PublicHealth Prisons do not keep us safe. #prisonsarethepandemicpic.twitter.com/6tusaZb29b",,@survivepunishNY @NYGovCuomo @NYCMayor,#FreeThemAll4PublicHealth #prisonsarethepandemicpic,1248727985445842945,https://twitter.com/lulunavratil/status/1248727985445842945
2020-04-10 21:39:53,RHAVote,,1,16,52,"We lit a candle in honor of all those who are being held in prisons, jails, and detention centers right now. Please join me and @FreeThemAll2020 and @survivepunishNY in asking @NYGovCuomo and @NYCMayor to immediately #FreeThemAll4PublicHealth Prisons do not keep us safe.pic.twitter.com/uBO54DS0Aj",,@FreeThemAll2020 @survivepunishNY @NYGovCuomo @NYCMayor,#FreeThemAll4PublicHealth,1248727424965246980,https://twitter.com/RHAVote/status/1248727424965246980
2020-04-10 21:39:19,james_feldman,,0,5,29,"Tonight I'm lighting a candle for all those in our prisons and jails whose lives are needlessly at risk. @NYGovCuomo @NYCMayor #FreeThemAll4PublicHealthpic.twitter.com/hq0zVMrmGm",,@NYGovCuomo @NYCMayor,#FreeThemAll4PublicHealthpic,1248727286238633985,https://twitter.com/james_feldman/status/1248727286238633985
2020-04-10 21:38:44,TheEugeniaKim,,0,21,52,"Lit this candle while I think about Jen and D and 90,000+ others across NY state who are fighting for their freedom and survival. @NYGovCuomo and @NYCMayor refuse to do anything when it is obvious we must #FreeThemAll #FreeThemAll4PublicHealth @survivepunishNY @FreeThemAll2020pic.twitter.com/Xn0G3tfIis",,@NYGovCuomo @NYCMayor @survivepunishNY @FreeThemAll2020pic,#FreeThemAll #FreeThemAll4PublicHealth,1248727137089175552,https://twitter.com/TheEugeniaKim/status/1248727137089175552
2020-04-10 21:38:35,votejgr,,0,22,57,"I am joining @RAPPcampaign and others in the movement to call on @NYGovCuomo and @GavinNewsom to grant #ClemencyNow to elders and other folks vulnerable to #COVID19. This is a public health crisis and it is beyond time to #LetThemGo! #ClemencyCoast2Coastpic.twitter.com/zjs8FWhcFg",,@RAPPcampaign @NYGovCuomo @GavinNewsom,#ClemencyNow #COVID19 #LetThemGo #ClemencyCoast2Coastpic,1248727099801776137,https://twitter.com/votejgr/status/1248727099801776137
2020-04-10 21:36:22,TrumpWarRoom,,62,330,841,"According to Gov. Andrew Cuomo, New York is getting the ventilators and PPE it needs to combat the coronavirus! “We have a stockpile where we are now relatively comfortable…we do have a supply that’s coming in.” pic.twitter.com/ZNqLGsN09g",,,,1248726543964258307,https://twitter.com/TrumpWarRoom/status/1248726543964258307
2020-04-10 21:34:22,LoanRager,,2,26,133,"I lit a candle today in support of the release of prisoners who ARE HUMAN BEINGS and deserve to be treated as such. Follow through with your promises for once please. @NYGovCuomo. The world is watching you. #FreeThemAll #FreeThemAll4PublicHealthpic.twitter.com/BuDDLyfuQm",,@NYGovCuomo,#FreeThemAll #FreeThemAll4PublicHealthpic,1248726040681340931,https://twitter.com/LoanRager/status/1248726040681340931
2020-04-10 21:33:28,teragr_am,,0,15,51,"I lit a candle in support of those incarcerated. Prisons are a hazard to public health. Please @NYGovCuomo @NYCMayor , grant clemency to all those behind bars, all whom are now facing a death sentence from COVID-19! #FreeThemAll4PublicHealthpic.twitter.com/AAIk2iZCO8",,@NYGovCuomo @NYCMayor,#FreeThemAll4PublicHealthpic,1248725810212753408,https://twitter.com/teragr_am/status/1248725810212753408
2020-04-10 21:31:23,sabur_anisah,,1,18,36,"#STOPTHESPREAD @NYGovCuomo & @GavinNewsom Grant Emergency #ClemencyCoast2Coastpic.twitter.com/N6gpbHFpUd",,@NYGovCuomo @GavinNewsom,#STOPTHESPREAD #ClemencyCoast2Coastpic,1248725287560503297,https://twitter.com/sabur_anisah/status/1248725287560503297
2020-04-10 21:28:14,chick_in_kiev,,0,17,55,"#freethemnow @NYGovCuomo and @BilldeBlasio. People are being condemned to death pretrial, for parole violations. Riker's is a death trap. You are murderers. #FreeThemAll4PublicHealth",,@NYGovCuomo @BilldeBlasio,#freethemnow #FreeThemAll4PublicHealth,1248724495495544832,https://twitter.com/chick_in_kiev/status/1248724495495544832
2020-04-10 21:23:01,MJC6853,montaga,0,23,59,"Love this man!! 100% right! @NYGovCuomo @BilldeBlasio if you two clowns actually did your job you wouldn’t need to ask for help. Now you just look dumb and unprepared for something you knew about for at least a month. #DoNothingDemocrats #dumblasiohttps://twitter.com/montaga/status/1248640925510684672 …",,@NYGovCuomo @BilldeBlasio,#DoNothingDemocrats #dumblasiohttps,1248723183798292482,https://twitter.com/MJC6853/status/1248723183798292482
2020-04-10 21:22:48,CriticalRace,CriticalRace,1,15,23,"Lit this candle in solidarity with all 90,000 people in NY’s prisons and jails seeking freedom and in fear of this #COVID19 crisis. @NYGovCuomo and @NYCMayor must immediately #FreeThemAllForPublicHealth. #prisonsarethepandemic #ClemencyCoast2Coast https://freethemall4publichealth.org/ pic.twitter.com/dw44PWiHen",,@NYGovCuomo @NYCMayor,#COVID19 #FreeThemAllForPublicHealth #prisonsarethepandemic #ClemencyCoast2Coast,1248723126449553408,https://twitter.com/CriticalRace/status/1248723126449553408
2020-04-10 21:18:29,TONYCnimm,,1,13,30,"I'm joining @FreeThemAll2020 @survivepunishNY this evening to light a candle and tell @NYGovCuomo to #FreeThemAll4PublicHealth These prisons do not keep us safe.pic.twitter.com/uDs619zWhx",,@FreeThemAll2020 @survivepunishNY @NYGovCuomo,#FreeThemAll4PublicHealth,1248722041672433664,https://twitter.com/TONYCnimm/status/1248722041672433664
2020-04-10 21:12:34,hopecaneel,,4,110,604,"I lit this candle to honor everyone being held in NY prisons, jails, and detention centers right now. Nobody is safe until everyone is safe. @NYCMayor , @NYGovCuomo , and @BrooklynDA I'm asking you to #FreeThemAll4PublicHealthpic.twitter.com/pCXA6FlABB",,@NYCMayor @NYGovCuomo @BrooklynDA,#FreeThemAll4PublicHealthpic,1248720553265057795,https://twitter.com/hopecaneel/status/1248720553265057795
2020-04-10 21:05:31,davidgeorge265,,8,162,413,"Here is the full list of names @NYGovCuomo has granted #Clemency to since the outbreak of COVID-19:",,@NYGovCuomo,#Clemency,1248718780458557449,https://twitter.com/davidgeorge265/status/1248718780458557449
2020-04-10 20:58:20,geopol24,pamnsc,2,5,33,"I've seen better photo shopping on Obama's birth certificate..",,,,1248716969249030144,https://twitter.com/geopol24/status/1248716969249030144
2020-04-10 20:57:39,lettersfromvani,,0,22,49,"in solidarity with incarcerated people around the world, in hope and struggle for an abolitionist future, a world without cages and without punishment. lighting a candle in Brooklyn NY and adding my voice to say #FreeThemAll4PublicHealth @NYGovCuomo @NYCMayorpic.twitter.com/fif7KT77Hr",,@NYGovCuomo @NYCMayorpic,#FreeThemAll4PublicHealth,1248716798977064961,https://twitter.com/lettersfromvani/status/1248716798977064961
2020-04-10 20:55:18,mariaskennedy,,0,10,35,"There are over 90,000 people incarcerated in NY jails. Survivors of violence and allies are calling on @NYGovCuomo to use his clemency powers and #FreeThemAll4PublicHealth. I lit a candle today to stand with this demand. #PrisonsAreThePandemicpic.twitter.com/5m43pTQHiH",,@NYGovCuomo,#FreeThemAll4PublicHealth #PrisonsAreThePandemicpic,1248716206732804096,https://twitter.com/mariaskennedy/status/1248716206732804096
2020-04-10 20:50:56,MattersTyme,DearAuntCrabby,3,5,32,"@NYGovCuomo has been amazing! He knew from the get go he couldn’t criticize the PO**S, otherwise he’d be denied federal help (how fcked up is that) Trust me you, when we are in a “safe/safer” zone @NYGovCuomo is going to RIP apart @realDonaldTrump and I can’t personally wait!",,@NYGovCuomo @NYGovCuomo @realDonaldTrump,,1248715109561597953,https://twitter.com/MattersTyme/status/1248715109561597953
2020-04-10 20:45:00,RAPPcampaign,,0,18,41,"TAKE ACTION: I am joining the movement to call on @NYGovCuomo and @GavinNewsom to grant #ClemencyNow and other releases to elders and others vulnerable to #COVID19. This is a public health crisis and it is beyond time to #LetThemGo! #ClemencyCoast2Coastpic.twitter.com/7TqjZPBspZ",,@NYGovCuomo @GavinNewsom,#ClemencyNow #COVID19 #LetThemGo #ClemencyCoast2Coastpic,1248713614162153472,https://twitter.com/RAPPcampaign/status/1248713614162153472
2020-04-10 20:39:44,davesund,jessespector,1,3,22,"He's already waived the requirement for the primary.https://twitter.com/NYGovCuomo/status/1247929924498923524?s=20 …",,,,1248712287755657216,https://twitter.com/davesund/status/1248712287755657216
2020-04-10 20:38:13,carenculture,,1,4,16,"I’m joining my community in lighting a candle for the 91,000 people incarcerated in NY jails during this deadly pandemic. I ask you to light a candle with us and demand electeds #FreeThemAll @ManhattanDA @NYGovCuomo @NYCMayor @NYCMayor @BrooklynDA @MelindaKatz pic.twitter.com/rU26vnpq1u",,@ManhattanDA @NYGovCuomo @NYCMayor @NYCMayor @BrooklynDA @MelindaKatz,#FreeThemAll,1248711908989063169,https://twitter.com/carenculture/status/1248711908989063169
2020-04-10 20:37:56,cailintaters,,0,8,21,"I lit a candle in support of @FreeThemAll2020, in solidarity w/all incarcerated ppl, who now face the deadly risk of COVID19 in addition to the inherent violence of incarceration. @NYGovCuomo @QueensDAKatz @BrooklynDA @NYCMayor I am calling on you to #FreeThemAll4PublicHealthpic.twitter.com/K2N44WnZLX",,@FreeThemAll2020 @NYGovCuomo @QueensDAKatz @BrooklynDA @NYCMayor,#FreeThemAll4PublicHealthpic,1248711837236985859,https://twitter.com/cailintaters/status/1248711837236985859
2020-04-10 20:36:33,jessespector,,24,36,151,"you stink @NYGovCuomo pic.twitter.com/PkrPW89yRt",,@NYGovCuomo,,1248711490758197248,https://twitter.com/jessespector/status/1248711490758197248
2020-04-10 20:33:01,DearAuntCrabby,,562,1800,11707,"Is it just me, or are others more comforted by adopted POTUS and National Dad, Mayor Andrew Cuomo than by the national idiot @RealDonaldTrump?",,@RealDonaldTrump,,1248710601024700419,https://twitter.com/DearAuntCrabby/status/1248710601024700419
2020-04-10 20:31:34,yolandajoey,,1,9,12,"@GavinNewsom @NYGovCuomo @CAgovernor @RAPPcampaign @ccwp @CURBprisons #ClemencyCoast2Coast #ClemencyNow #COVIDー19 time to quarantine at home. Please save them from DEATH CAMPSpic.twitter.com/b7hkQoTnkG",,@GavinNewsom @NYGovCuomo @CAgovernor @RAPPcampaign @ccwp @CURBprisons,#ClemencyCoast2Coast #ClemencyNow #COVIDー19,1248710236652703744,https://twitter.com/yolandajoey/status/1248710236652703744
2020-04-10 20:30:08,sarbetter,,2,38,44,". @NyRegents Chancellor Rosa and @NYSEDNews interim Commissioner Tahoe tell @CapitalTonight that they have asked @NYGovCuomo for an executive order waiving APPR, Annual Professional Performance Reviews for principals and teachers.",,@NyRegents @NYSEDNews @CapitalTonight @NYGovCuomo,,1248709874353082370,https://twitter.com/sarbetter/status/1248709874353082370
2020-04-10 20:26:28,JoshSilber,NYGovCuomo,10,47,175,"#Cuomo is handling all of this with such grace. A stark contrast to #potus ... Unfortunate that #Trump is so mentally ill & uneducated that he's incapable of being a leader like @NYGovCuomo. Trump could be the hero here but his big dumb mouth gets in the way. #antibiotics #SMHhttps://twitter.com/NYGovCuomo/status/1248688307510431747 …",,@NYGovCuomo,#Cuomo #potus #Trump #antibiotics #SMHhttps,1248708952612798464,https://twitter.com/JoshSilber/status/1248708952612798464
2020-04-10 20:25:00,drchethansathya,,8,16,109,"And at hospital, people are coming together in incredible ways. A nurse I had never met before spent 20 minutes yesterday after work going to get me a hand knitted bag for my N95 mask. This was time away from her own family. Incredible @NYGovCuomo @BilldeBlasio @AOC 3/3",,@NYGovCuomo @BilldeBlasio @AOC,,1248708582054547458,https://twitter.com/drchethansathya/status/1248708582054547458
2020-04-10 20:24:51,pamnsc,HowleyReporter,1,26,62,"First @CBSThisMorning putting a photo of an Italian hospital with @NYGovCuomo now @CNN photoshopping a hurricane picture for San Francisco.. And people wonder why we trust very few in the media in this country... Wonder no more",,@CBSThisMorning @NYGovCuomo @CNN,,1248708542971994112,https://twitter.com/pamnsc/status/1248708542971994112
2020-04-10 20:24:36,larkomura,,0,16,32,"Today we light candles for the over 90K people currently caged in NY jails, while Covid-19 moves through prisons and detention centers like wildfire. @ManhattanDA @NYGovCuomo @BilldeBlasio @NYCMayor @BrooklynDA @MelindaKatz #FreeThemAll4PublicHealthpic.twitter.com/XTLGB9M88L",,@ManhattanDA @NYGovCuomo @BilldeBlasio @NYCMayor @BrooklynDA @MelindaKatz,#FreeThemAll4PublicHealthpic,1248708479306563584,https://twitter.com/larkomura/status/1248708479306563584
2020-04-10 20:15:42,RayahJaymes,,1,16,19,"Since the outbreak of #COVID19, @GavinNewsom has granted only 21 clemencies and @NYGovCuomo has granted ZERO. 21 combined clemencies for two states with 166K people in prison isn’t enough. We need bold, sweeping action NOW to prevent more COVID-19 deaths. #ClemencyCoast2Coastpic.twitter.com/KPtN1rYOqM",,@GavinNewsom @NYGovCuomo,#COVID19 #ClemencyCoast2Coastpic,1248706240995160064,https://twitter.com/RayahJaymes/status/1248706240995160064
2020-04-10 20:15:02,Fly_Sistah,maddow,1,5,8,"Are they testing to determine if these were covid 19 related deaths? @NYGovCuomo @NYCMayorhttps://twitter.com/maddow/status/1248680304073748480 …",,@NYGovCuomo @NYCMayorhttps,,1248706072350789634,https://twitter.com/Fly_Sistah/status/1248706072350789634
2020-04-10 20:13:49,Lynda63986855,Ley_Mouse,6,12,10,"Now Hollywood is Supporting China & WHO Every time I wonder if Hollywood can be any more Bat Shit Crazy and Against America & Americans They step it up a notch https://www.who.int/news-room/detail/06-04-2020-who-and-global-citizen-announce-one-world-together-at-home-global-special-to-support-healthcare-workers-in-the-fight-against-the-covid-19-pandemic …",,,,1248705766409687041,https://twitter.com/Lynda63986855/status/1248705766409687041
2020-04-10 20:09:16,Christo29932651,,2,6,5,"GOVERNOR Cuomo caused the unemployment crisis in NY STATE ! THAN THE DEPARTMENT OF LABOR , could not handle the volume ! Where is the criticism of his MALFEASANCE ! @Aug_1405 @NYGovCuomo @OANN @NYSLabor @realDonaldTrump @GOPChairwoman @NY1 @News12BX @News12WC @ABC7NYpic.twitter.com/7R1TC17g2M",,@Aug_1405 @NYGovCuomo @OANN @NYSLabor @realDonaldTrump @GOPChairwoman @NY1 @News12BX @News12WC @ABC7NYpic,,1248704621910073347,https://twitter.com/Christo29932651/status/1248704621910073347
2020-04-10 20:08:07,laurawhitehorn,,4,25,31,"A message for @GavinNewsom & @NYGovCuomo from @Snidelines: #LetThemGo #ClemencyCoast2Coast You must grant #ClemencyNow before COVID-19 sickens & kills hundreds of Black & Latinx people in CA & NY prisons. #FreeEmAll4PublicHeathpic.twitter.com/bPF9DB7kGH",,@GavinNewsom @NYGovCuomo @Snidelines,#LetThemGo #ClemencyCoast2Coast #ClemencyNow #FreeEmAll4PublicHeathpic,1248704331924279298,https://twitter.com/laurawhitehorn/status/1248704331924279298
2020-04-10 20:00:41,n_th_n_,,1,27,53,"People inside & comrades are demanding @NYGovCuomo #FreeThemAll4PublicHealth (You too, @NYCMayor) Will you join me in supporting @FreeThemAll2020? While people die, DA Katz is asking courts for more time to investigate conditions in Rikers. It's (past) time for executive action.pic.twitter.com/hmZOihjj0a",,@NYGovCuomo @NYCMayor @FreeThemAll2020,#FreeThemAll4PublicHealth,1248702462590177280,https://twitter.com/n_th_n_/status/1248702462590177280
2020-04-10 20:00:20,MomsRising,,1,9,8,"Outside of clemencies @NYGovCuomo & @GavinNewsom have used their power to only release people convicted of non-violent, low-level offenses & others for parole violations. These releases are good but not enough. #ClemencyCoast2Coast must include everyone vulnerable to #COVID19.pic.twitter.com/rtxErEC1Jy",,@NYGovCuomo @GavinNewsom,#ClemencyCoast2Coast #COVID19,1248702374581018625,https://twitter.com/MomsRising/status/1248702374581018625
