date,username,to,replies,retweets,favorites,text,geo,mentions,hashtags,id,permalink
2020-04-11 15:49:28,KellyO,,10,27,67,"New York has lost 8,627 citizens with deaths Friday reaching 783 according to @NYGovCuomo",,@NYGovCuomo,,1249001629870960643,https://twitter.com/KellyO/status/1249001629870960643
2020-04-11 15:49:24,jessemckinley,,0,7,11,"""There is no economic answer that does not attend to public health,"" @NYGovCuomo",,@NYGovCuomo,,1249001613165027330,https://twitter.com/jessemckinley/status/1249001613165027330
2020-04-11 15:49:23,KlasfeldReports,,27,155,675,"Cuomo scoffs at the notion that the United States can open its economy without the engine of the New York economy. ""You're kidding yourself,"" the governor says.",,,,1249001609583091715,https://twitter.com/KlasfeldReports/status/1249001609583091715
2020-04-11 15:49:14,Scampi13,theirfanator,4,6,27,"Both Governor Cuomo and Hogan have been in contact with @SpeakerPelosi, look for her to get as much funding as possible, with the republicans actively working against her.",,@SpeakerPelosi,,1249001569867255808,https://twitter.com/Scampi13/status/1249001569867255808
2020-04-11 15:49:01,tomwatson,,30,383,1827,"""You think you're going to open up the economy without the engine of the New York metropolitan area? You're kidding yourself."" Exactly right from @NYGovCuomo.",,@NYGovCuomo,,1249001518361083905,https://twitter.com/tomwatson/status/1249001518361083905
2020-04-11 15:48:37,CathyJoeGPT,LSD122070,2,8,20,"For the welfare of the citizens of NY I completely understand why --pic.twitter.com/xTdsfcvGKN",,,,1249001415621697543,https://twitter.com/CathyJoeGPT/status/1249001415621697543
2020-04-11 15:47:26,NY1,,2,6,22,". @NYGovCuomo spending a lot of time today on uncertainty of modeling. “It's too soon for Monday quarterbacking because the game isn’t even over yet.""",,@NYGovCuomo,,1249001116618166273,https://twitter.com/NY1/status/1249001116618166273
2020-04-11 15:45:57,LSD122070,,31,4,36,"Is it me or is @NYGovCuomo doing some brown nosing to Drumpf?",,@NYGovCuomo,,1249000746403708928,https://twitter.com/LSD122070/status/1249000746403708928
2020-04-11 15:43:29,campbellclaret,NYGovCuomo,47,85,333,"Watching this with @patel4witham on in the background. @NYGovCuomo actually reveals what is happening and answers questions. https://twitter.com/NYGovCuomo/status/1248999217055404032 …",,@patel4witham @NYGovCuomo,,1249000124803670016,https://twitter.com/campbellclaret/status/1249000124803670016
2020-04-11 15:42:18,HenryRosoff,,1,16,9,"New York curve continuing to flatten, in fact intubations in negative territory... BUT live lost “stabilizing at a horrific rate” at around 800 per day, @NYGovCuomo said. Adding: “We must stay the course” knowing there’s temptation to discuss re-opening society. pic.twitter.com/lFXd8Qx9Zk",,@NYGovCuomo,,1248999825959419906,https://twitter.com/HenryRosoff/status/1248999825959419906
2020-04-11 15:40:56,KellyO,,10,33,110,"""There's no doubt I have worked hand in glove with the president here..."" @NYGovCuomo ""He has really responded to New York's needs..."" Cuomo says keep politics out of decision to reopen.",,@NYGovCuomo,,1248999481825255427,https://twitter.com/KellyO/status/1248999481825255427
2020-04-11 15:38:00,jfberke,,80,334,1098,"Cuomo: 783 deaths in the last 24 hours from COVID-19, up from 777 yesterday. Death toll is 8,627. The death toll is ""stabilizing at a horrific rate.""",,,,1248998745628434432,https://twitter.com/jfberke/status/1248998745628434432
2020-04-11 15:35:38,cspan,,13,17,32,". @NYGovCuomo Coronavirus News Conference - LIVE on C-SPAN https://www.c-span.org/video/?471151-1/york-governor-cuomo-holds-coronavirus-briefing&live …pic.twitter.com/ovoQxFEtc5",,@NYGovCuomo,,1248998148791558145,https://twitter.com/cspan/status/1248998148791558145
2020-04-11 15:34:37,cmkinmia,,5,16,33,"I think it’s time we all join together and stop watching The Trump Show every night. It’s a reelection infomercial filled with lies and dangerous instructions. We need to do it en masse. Watch @NYGovCuomo instead. If you agree, please get this hashtag trending. #ShutHimOff",,@NYGovCuomo,#ShutHimOff,1248997891466825728,https://twitter.com/cmkinmia/status/1248997891466825728
2020-04-11 15:34:14,NikolovScience,itsrichardp,6,6,15,"How? This is the relationship when one excludes NYC and Newark NJ from the graph.pic.twitter.com/3R0mmLqrc8",,,,1248997795761016834,https://twitter.com/NikolovScience/status/1248997795761016834
2020-04-11 15:33:06,RosanneR429,funder,1,21,80,"I’m a press conference will happen. @NYGovCuomo is having one so jealous Trump will too!! pic.twitter.com/60RgGPOQwO",,@NYGovCuomo,,1248997511290851329,https://twitter.com/RosanneR429/status/1248997511290851329
2020-04-11 15:32:59,News12,,5,11,26,"WATCH LIVE: @NYGovCuomo is giving an update on the #coronavirus outbreak in New York.http://www.news12.com/story/41996925/gov-cuomo-holds-briefing-with-latest-on-covid19-pandemic-in-ny-live-video …",,@NYGovCuomo,#coronavirus,1248997479749746689,https://twitter.com/News12/status/1248997479749746689
2020-04-11 15:32:46,NewEconomyNYC,,1,6,5,"More than 3,000 New Yorkers have signed this petition calling on @NYGovCuomo to halt debt collection in NY. ADD YOUR NAME https://actionnetwork.org/petitions/haltdebtcollectionny?source=new-econ-social …",,@NYGovCuomo,,1248997425207029765,https://twitter.com/NewEconomyNYC/status/1248997425207029765
2020-04-11 15:28:10,BowmanNancy,NYGovCuomo,0,5,8,"Churches open Sunday in NY? Choir went ahead with rehearsal 3/10. Stood 6' apart & didn't do usual hugs or handshakes but SANG. Singing puts droplets in air that hang around for hours. 45 of 60 singers got #COV19. 2 died. What do they do in church? Sing.https://fxn.ws/39W78W8",,,#COV19,1248996270158512128,https://twitter.com/BowmanNancy/status/1248996270158512128
2020-04-11 15:27:49,theirfanator,Scampi13,6,3,20,"I don't believe that either party has considered this level of direct aid to states.",,,,1248996181054763008,https://twitter.com/theirfanator/status/1248996181054763008
2020-04-11 15:19:39,jessemckinley,,1,3,6,". @NYGovCuomo briefing at 11:30; watch here: https://www.governor.ny.gov/",,@NYGovCuomo,,1248994124059021312,https://twitter.com/jessemckinley/status/1248994124059021312
2020-04-11 15:18:10,Hirdman,,24,266,611,"Dr. Oz, whose study on Hydroxychloroquine (HCQ) was shut down by Gov. Cuomo before it got started, still wants his use his cred as a doctor to endorse HCQ. Note that India, as a nation, accepts its efficacy. I sped it up to fit the 2 minute limit. pic.twitter.com/xNZGqhTTPw",,,,1248993751441129472,https://twitter.com/Hirdman/status/1248993751441129472
2020-04-11 15:06:08,RAPPcampaign,NYGovCuomo,1,27,32,". @NYGovCuomo’s #Coronavirus news briefing will take place at 11:30AM. Our question: Why hasn’t Cuomo granted any clemencies since the COVID-19 outbreak? Governors in CA, KY, OK & IL have granted clemencies since the outbreak. NY is the COVID-19 capitol & Cuomo has granted zero. https://twitter.com/NYGovCuomo/status/1248982423787970562 …",,@NYGovCuomo,#Coronavirus,1248990724286226433,https://twitter.com/RAPPcampaign/status/1248990724286226433
2020-04-11 15:05:34,mikecalma,tribelaw,0,3,8,"This is Trump and his ""Article 2 allows me to do anything I want"" theory. Trump believing he is King of America. The dude can issue all the reopen the economy orders he wants but I am listening to @NYGovCuomo, my governor who issued the original order.",,@NYGovCuomo,,1248990581243723782,https://twitter.com/mikecalma/status/1248990581243723782
2020-04-11 15:03:00,HealthNYGov,,0,5,5,"The celebrations can wait. Stay apart now, so we can all be together later. #NewYorkTough #IStayHomeFor @NYGovCuomo pic.twitter.com/NDONS9QuBi",,@NYGovCuomo,#NewYorkTough #IStayHomeFor,1248989935325102086,https://twitter.com/HealthNYGov/status/1248989935325102086
2020-04-11 14:58:47,ScottHech,nypost,27,211,642,"Andrew Cuomo is letting thousands of people get infected and die in NY jails and prisons despite his power to help. https://twitter.com/nypost/status/1248552597256093696 …",,,,1248988876582117377,https://twitter.com/ScottHech/status/1248988876582117377
2020-04-11 14:58:21,PBurtonCMB,FelixFelix7070,4,3,7,"And @NewYorkStateAG will be waiting for Rapist-in-Chief come January 2021!",,@NewYorkStateAG,,1248988765571301376,https://twitter.com/PBurtonCMB/status/1248988765571301376
2020-04-11 14:55:46,MelissaJPeltier,NoahShachtman,9,63,170,"Trump’s passively murdering NYers. Thank God for @NYGovCuomo https://twitter.com/NoahShachtman/status/1248756837270409217 …",,@NYGovCuomo,,1248988114145742849,https://twitter.com/MelissaJPeltier/status/1248988114145742849
2020-04-11 14:52:29,zachdcarter,,100,446,2806,"It's not just 2020 stuff. Democrats are really into Cuomo right now even though any cursory examination of what he did to prepare for and combat the pandemic shows that he got a lot of people killed. Meanwhile Inslee is doing a great job and nobody seems to notice or care.",,,,1248987291403661312,https://twitter.com/zachdcarter/status/1248987291403661312
2020-04-11 14:47:09,medit8now,NYGovCuomo,1,3,20,"Good. The voice of sanity @NYGovCuomo",,@NYGovCuomo,,1248985947066241032,https://twitter.com/medit8now/status/1248985947066241032
2020-04-11 14:45:37,PepperOceanna,,17,224,322,"Urgent! New Yorkers, Cuomo may take Bernie off the Ballot on new Mail-in ballots but Keep Biden on the ballot. It is critical that if Bernie is NOT on the Ballot that YOU Write him in. He can still gather delegates & We Need Bernie to Win NY. #KeepBernieOnTheBallotNY Pass it on.pic.twitter.com/2BzfjJ81Cq",,,#KeepBernieOnTheBallotNY,1248985563191029760,https://twitter.com/PepperOceanna/status/1248985563191029760
2020-04-11 14:45:17,jor689,RustTemecca,1,1,11,"cuomo should've shut down NYC from the rest of the state. he allowed all the NYC folk to spread the virus to neighboring states and counties.",,,,1248985479220998146,https://twitter.com/jor689/status/1248985479220998146
2020-04-11 14:45:10,JoyceMVance,Deadly4human,0,1,19,"Same here. I live in MI. I get wayyyy more info from his briefings than the daily trump rallies. Thanks @NYGovCuomo",,@NYGovCuomo,,1248985446740344835,https://twitter.com/JoyceMVance/status/1248985446740344835
2020-04-11 14:13:48,reallyhadenough,reubing,1,5,8,"@NYCMayor @NYGovCuomo ...mind taking a minute to address this in between your fear mongering? .. https://twitter.com/reubing/status/1248974479700754432 …",,@NYCMayor @NYGovCuomo,,1248977554238844933,https://twitter.com/reallyhadenough/status/1248977554238844933
2020-04-11 14:11:01,EcoWatch,,2,7,7,"#NewYork now leads the world in #CoronaVirus cases. ""9/11 was supposed to be the darkest day in New York for a generation ... we lose so many more New Yorkers to this silent killer."" @NYGovCuomo #staysafe #stayhome #stayhealthy #Covid19 #pandemichttp://www.ecowatch.com/new-york-state-coronavirus-cases …",,@NYGovCuomo,#NewYork #CoronaVirus #staysafe #stayhome #stayhealthy #Covid19 #pandemichttp,1248976853416718338,https://twitter.com/EcoWatch/status/1248976853416718338
2020-04-11 14:07:04,pwoodreporter,,2,18,36,"On behalf of the nation’s governors, @GovLarryHogan and @NYGovCuomo are asking Congress for $500B in aid to help close massive expected budget gaps. https://www.baltimoresun.com/coronavirus/bs-md-hogan-congress-request-20200411-mkap5vycrndjhocbajo5i3cqg4-story.html …",,@GovLarryHogan @NYGovCuomo,,1248975858683043840,https://twitter.com/pwoodreporter/status/1248975858683043840
2020-04-11 13:58:19,RossBarkan,,22,88,463,"Why hasn't Bill de Blasio aggressively fought for rents to be frozen for the duration of the coronavirus crisis and built public pressure on Andrew Cuomo to act? Is he a bad politician or too deferential to the real estate lobby? You decide.",,,,1248973656329461760,https://twitter.com/RossBarkan/status/1248973656329461760
2020-04-11 13:56:59,RebelWheelsNYC,,1,7,12,"To all the people, the #Cuomosexuals and Team #CuomoForPresident etc... @NYGovCuomo recently cut $400 million in hospital funding cuts, including a $138 million cut to the #NewYorkCity public hospital system, currently battling on the #frontlines against #COVIDー19 (1)",,@NYGovCuomo,#Cuomosexuals #CuomoForPresident #NewYorkCity #frontlines #COVIDー19,1248973322861326336,https://twitter.com/RebelWheelsNYC/status/1248973322861326336
2020-04-11 13:55:53,VOCALNewYork,RAPPcampaign,0,12,15,"DOCCS continued secrecy around #COVID19 in NYS prisons will be deadly. New data they have released raise more questions & concerns than answers. @NYGovCuomo must take immediate action. #ClemencyNowhttps://twitter.com/RAPPcampaign/status/1248966962434187267 …",,@NYGovCuomo,#COVID19 #ClemencyNowhttps,1248973046976843776,https://twitter.com/VOCALNewYork/status/1248973046976843776
2020-04-11 13:52:52,JohnRLottJr,,36,432,1164,"March 2, the day after the first New Yorker tested positive for COVID-19. ""Out of an abundance of caution we will be contacting the people who were on the flight with her from Iran to New York,"" Cuomo vowed. However: ""No one ever did that work,"" NYT found. https://reason.com/2020/04/09/3-ways-new-york-botched-the-coronavirus-response-in-march/ …",,,,1248972287543476224,https://twitter.com/JohnRLottJr/status/1248972287543476224
2020-04-11 13:46:25,billritter7,,31,16,264,"my first trip outside my home since 12:30 am March 25 ... but this wasn't just a glorious Saturday morning spring walk through @CentralParkNYC . I had a reason. You can hear it on Up Close Sunday morning at 11am @ABC7NY (will slide show If @NYGovCuomo has briefing ) pic.twitter.com/Vy9quGmncE",,@CentralParkNYC @ABC7NY @NYGovCuomo,,1248970665128071169,https://twitter.com/billritter7/status/1248970665128071169
2020-04-11 13:37:48,DeJesusSaves,,1,1,10,"Every time @NYGovCuomo says “The virus has been ahead of us” he admits he’s been reactive & not proactive in realizing the measures needed to save more lives. I have coronavirus. My manager. My mom. NY has more cases than whole nations & cops still out here body slamming ppl.",,@NYGovCuomo,,1248968492730245120,https://twitter.com/DeJesusSaves/status/1248968492730245120
2020-04-11 13:28:56,NukeDaDiva,,0,5,16,"Angela Rye summed this up perfectly. The relation between the @NYGovCuomo @mta and its workforce.pic.twitter.com/k2lj6TNRcK",,@NYGovCuomo @mta,,1248966264019705861,https://twitter.com/NukeDaDiva/status/1248966264019705861
2020-04-11 13:28:42,BojakForNY,,2,4,17,"I continue to hear from tenants every day, and the number one question I am asked: what will happen to me when the eviction moratorium is lifted? Will I lose my home? They deserve an answer, @NYGovCuomo. It’s time to put #HomesAndPeopleFirst.",,@NYGovCuomo,#HomesAndPeopleFirst,1248966204867346433,https://twitter.com/BojakForNY/status/1248966204867346433
2020-04-11 13:27:33,revjmcguire,,0,6,15,"I have been supportive of @NYGovCuomo's efforts to #StopTheSpread, but he has crossed a line with the guidance release pertaining to Executive Order 202.10, particularly as it pertains to worship. https://esd.ny.gov/guidance-executive-order-2026 …",,@NYGovCuomo,#StopTheSpread,1248965916341293059,https://twitter.com/revjmcguire/status/1248965916341293059
2020-04-11 13:27:08,merylnyc,bradlander,1,8,46,"Please push the @NYGovCuomo to liberate the human beings in immigrant detention & unaccompanied minors in ORR funded facilities — @ICEgov #ConcentrationCamps History will not view us kindly for sitting still while thousands die. #FreeThemAll",,@NYGovCuomo @ICEgov,#ConcentrationCamps #FreeThemAll,1248965811898920960,https://twitter.com/merylnyc/status/1248965811898920960
2020-04-11 13:25:35,NatlGovsAssoc,,34,65,114,". @GovLarryHogan and @NYGovCuomo: ""In the absence of unrestricted fiscal support of at least $500 billion from the federal government, states will have to confront the prospect of significant reductions to critically important services …"" #COVID19https://www.nga.org/news/press-releases/national-governors-association-outlines-need-for-additional-and-immediate-fiscal-assistance-to-states/ …",,@GovLarryHogan @NYGovCuomo,#COVID19https,1248965421828657152,https://twitter.com/NatlGovsAssoc/status/1248965421828657152
2020-04-11 13:24:13,Ladyblue11Carol,GovLarryHogan,11,73,338,"Keep it up, Governors. Someone needs to be leaders and in charge. Lord knows the Presidential administration (I can’t call them leaders) left the building. The USA salutes our Governors’ leadership. Puppet @VP just stands there nodding his head. @SpeakerPelosi need this bill",,@VP @SpeakerPelosi,,1248965076570292227,https://twitter.com/Ladyblue11Carol/status/1248965076570292227
2020-04-11 13:20:58,laurawhitehorn,,0,7,6,"People around the country told @NYGovCuomo & @GavinNewsom to grant #ClemencyNow #ClemencyCoast2Coast 2 elders & others in prison vulnerable to COVID-19 illness. #LetThemGo NOW https://www.dailydot.com/irl/prisoner-release-coronavirus/ … @RAPPcampaign @CURBprisons @c_c_w_p @paroleprepny @VOCALNewYork @WESPAC_NY",,@NYGovCuomo @GavinNewsom @RAPPcampaign @CURBprisons @c_c_w_p @paroleprepny @VOCALNewYork @WESPAC_NY,#ClemencyNow #ClemencyCoast2Coast #LetThemGo,1248964259607769088,https://twitter.com/laurawhitehorn/status/1248964259607769088
2020-04-11 13:18:28,Scampi13,GovLarryHogan,33,81,331,"I love ya, Larry, but please direct this to the republicans. @SpeakerPelosi and @SenSchumer are doing their best to get you the help you need, it's @GOPLeader @senatemajldr and @realDonaldTrump that are not helping the states. Be honest, expose it.",,@SpeakerPelosi @SenSchumer @GOPLeader @senatemajldr @realDonaldTrump,,1248963629619261441,https://twitter.com/Scampi13/status/1248963629619261441
2020-04-11 13:16:03,riccimike,,29,149,265,"STATEMENT from @GovLarryHogan & @NYGovCuomo: ""Congress must appropriate an additional $500 billion specifically for all states and territories to meet the states’ budgetary shortfalls that have resulted from this unprecedented public health crisis."" pic.twitter.com/gMTJJMjmAe",,@GovLarryHogan @NYGovCuomo,,1248963023164899328,https://twitter.com/riccimike/status/1248963023164899328
2020-04-11 13:12:10,TomPreciousALB,,8,8,6,"Unemployment benefit delays by Cuomo labor agency blasted by lawmakers, jobless. @NYGovCuomo turns to Google, other private companies for help. https://buffalonews.com/2020/04/11/unemployment-benefit-delays-raises-ire-of-jobless-state-lawmakers/ …",,@NYGovCuomo,,1248962045116112896,https://twitter.com/TomPreciousALB/status/1248962045116112896
2020-04-11 13:05:38,GSI_NewJersey,,2,7,12,"ICYMI: Recognizing the fiscal emergency created by COVID-19, @NYGovCuomo has deferred salary increases for state employees. NJ needs @GovMurphy & all levels of gov't from county, municipal & school districts to follow suit & include a new hire freeze.https://m.timesunion.com/news/article/New-York-unions-lash-out-at-Cuomo-for-deferring-15189254.php …",,@NYGovCuomo @GovMurphy,,1248960400999227392,https://twitter.com/GSI_NewJersey/status/1248960400999227392
2020-04-11 13:02:59,jtd_gameon12,,24,282,244,"Good Morning America!!! The DNC knows they have a problem with Joe Biden, and his often times lack of memory. So they’re positioning NY Gov. Andrew Cuomo as a back up. But Red, White & Blue voting Americans have a keen memory, to know these words will live in infamy. pic.twitter.com/oDSvDRDQzv",,,,1248959731537977344,https://twitter.com/jtd_gameon12/status/1248959731537977344
2020-04-11 12:58:51,ScottHech,shanakn,2,95,318,"In NY, people right now are being sent to jail & prison for things like missing curfew, failing to check in with a parole officer, & forgetting to update an address. Always cruel. Always wasteful. Always irrational. Especially so right now. This is 100% on @NYGovCuomo. https://twitter.com/shanakn/status/1248763787940974592 …",,@NYGovCuomo,,1248958694294945794,https://twitter.com/ScottHech/status/1248958694294945794
2020-04-11 12:53:41,decolonize_this,,2,32,51,"MANY, many more are dying in NY State and City than the authorities and @NYGovCuomo are letting know. People are dying at home, on the streets, at hospitals before being tested. They are not part of the official count. They need to be counted. NOT RIGHT #COVIDー19 #coronavirus",,@NYGovCuomo,#COVIDー19 #coronavirus,1248957392626294789,https://twitter.com/decolonize_this/status/1248957392626294789
2020-04-11 12:52:38,mgrant76308,,78,172,208,"Gov. Andrew Cuomo on Wednesday announced that New York state had set a new single-day record of 779 coronavirus-related deaths on Tuesday. Since they're counting everything as Kung Flu, this is skewed! https://www.breitbart.com/politics/2020/04/08/gov-cuomo-orders-flags-half-mast-new-york-coronavirus-deaths-set-another-record/?utm_source=facebook&utm_medium=social …",,,,1248957128011911169,https://twitter.com/mgrant76308/status/1248957128011911169
2020-04-11 12:46:46,AndrewSErickson,,0,3,4,"“ #NewYork state has about 170,000 confirmed #coronavirus cases, a number that only counts infected people who have been tested. @NYGovCuomo said testing would have to be ramped up dramatically to put New York back in business.” https://www.fox5ny.com/news/reopening-new-york-will-require-massive-testing …",,@NYGovCuomo,#NewYork #coronavirus,1248955652250177536,https://twitter.com/AndrewSErickson/status/1248955652250177536
2020-04-11 12:46:03,CallingBSonU,,35,134,280,"It's laughable that Dems consider Andrew Cuomo presidential material. They need to pull their heads out of their asses. He has failed to lead, and 8000 dead New Yorkers back that up. The only thing he's qualified to do is replace the Grim Reaper if he ever decides to retire.",,,,1248955470884339714,https://twitter.com/CallingBSonU/status/1248955470884339714
2020-04-11 12:41:02,rjnln02,dyro874,0,3,4,"The Fed needs to force Cuomo / NYS to take the signs down, and everyone in Cuomo's administration must take a pay cut to reimburse NYS taxpayers for the cost of the signs.",,,,1248954206825971713,https://twitter.com/rjnln02/status/1248954206825971713
2020-04-11 12:38:57,brettsinger,,0,1,7,"Between Dr. Fauci and Governor Cuomo, Italians haven't been this popular since The Sopranos was on the air. @NYGovCuomo @FauciFan #cuomo #Fauci #CuomoForPresident #brettsinger #brettsingercomedian #brettsjokes #Sopranos @HBO @TheSopranosClub",,@NYGovCuomo @FauciFan @HBO @TheSopranosClub,#cuomo #Fauci #CuomoForPresident #brettsinger #brettsingercomedian #brettsjokes #Sopranos,1248953685935370243,https://twitter.com/brettsinger/status/1248953685935370243
2020-04-11 12:28:02,MSNBC,,88,241,869,"NY Gov. Cuomo: ""I don't think we ever get back to normal. This is one of the new normals ... it's going to depend on what we do. That's why this is such an important period for government."" https://on.msnbc.com/3b1IOTX",,,,1248950935855996932,https://twitter.com/MSNBC/status/1248950935855996932
2020-04-11 12:10:09,steveinjax1,,0,8,19,"Anyone want to make a wager? I bet @NYGovCuomo uses Covid-19 as the reason New York defaults on MSA bonds. I would also bet Cuomo asks the Feds or Big T to kick in $$$to avoid telling citizens how he mismanaged the MSA payouts. Any takers? Erin @NYSMom4Kiddos ?",,@NYGovCuomo @NYSMom4Kiddos,,1248946435728474112,https://twitter.com/steveinjax1/status/1248946435728474112
2020-04-11 12:08:55,phillygodfather,phil15xfit,6,1,11,"I'm not mad at @NYGovCuomo the man because politics aren't easy, but as a Governer his decision to keep the subway open failed the people of New York and was CATASTROPHIC. I'm not here to bash him, he's got enough on his plate and will have to look in the mirror, rest of his life https://twitter.com/phil15xfit/status/1248945259071131649 …",,@NYGovCuomo,,1248946128374153216,https://twitter.com/phillygodfather/status/1248946128374153216
2020-04-11 12:08:03,MightyQuinnUSA,TB_Times,1,3,12,"I wish we had a real leader instead of @GovRonDeSantis who is merely a @realDonaldTrump sycophant. Give us @NYGovCuomo, @GavinNewsom, @GovAndyBeshear, or @GovWhitmer! #coronavirus #COVID__19pic.twitter.com/NzQ8UFU9Ie",,@GovRonDeSantis @realDonaldTrump @NYGovCuomo @GavinNewsom @GovAndyBeshear @GovWhitmer,#coronavirus #COVID__19pic,1248945908626137089,https://twitter.com/MightyQuinnUSA/status/1248945908626137089
2020-04-11 12:05:21,RossBarkan,,95,612,3385,"Imagine wildly praising Andrew Cuomo's response to COVID-19 at a time when the State of New York has more confirmed cases than other country in the WORLD.",,,,1248945230872817665,https://twitter.com/RossBarkan/status/1248945230872817665
2020-04-11 12:04:57,TheBern420,NYGovCuomo,0,0,34,"Ah yes the genocidal maniac Churchill",,,,1248945128456282113,https://twitter.com/TheBern420/status/1248945128456282113
2020-04-11 11:56:42,conferplastics,,1,4,12,"Here's a special message for @NYGovCuomo: Please allow pool service companies to open up swimming pools https://www.wkbw.com/news/local-news/pool-openings-are-not-essential-in-new-york-state-heres-why-thats-a-health-issue?fbclid=IwAR2kkFewImACOPk-kHtbbbU2nwD85egex-3vWRgz3KNgjif-o9PV9xUJ-uw …pic.twitter.com/xGBArVMS5T",,@NYGovCuomo,,1248943051311132672,https://twitter.com/conferplastics/status/1248943051311132672
2020-04-11 11:54:41,glennEmartin,,2,3,11,"Leave it up to @jdavidgoodman to give us a dose of reality, so that we don’t get too caught up in lionizing America’s Crisis Daddy @NYGovCuomo and romanticizing Uncle Lurch @NYCMayor: How Delays & Unheeded Warnings Hindered NY’s Virus Fighthttps://nyti.ms/2Xk7ByE",,@jdavidgoodman @NYGovCuomo @NYCMayor,,1248942543489859585,https://twitter.com/glennEmartin/status/1248942543489859585
2020-04-11 11:53:34,phillygodfather,,3,3,18,"He will have to look in the mirror everyday knowing he kept the Subway open @NYGovCuomo made the biggest mistake of his life.",,@NYGovCuomo,,1248942262559662080,https://twitter.com/phillygodfather/status/1248942262559662080
